date,userid,tweet,lang
2022-03-20 15:00:24+00:00,691c94c4c3c5f3ff03e44fae95b470f2,Legislation that would help individuals that have suffered an adverse reaction to COVID-19 vaccines is getting the support of Senator Cindy Hyde-Smith.https://t.co/rQYIvYlshA,en
2022-03-20 15:00:22+00:00,e42244c2a8406dc5cd0e8d1e6ccfe52836d376b178bdacd2cbde247fd168fb5f,S. Korea to offer COVID-19 vaccines to children aged 5-11 | Article – NEWPAPER24 https://t.co/ex0AItgeAj,en
2022-03-20 15:00:21+00:00,c31de384ca9f2142364d6723a49261ea7c6e617b54ee977bd1312d2fed07ace8,S. Korea to offer COVID-19 vaccines to children aged 5-11 | Article – NEWPAPER24 https://t.co/yAkJQYx2TP,en
2022-03-20 15:00:20+00:00,2a5bb1ce13817ada35a87f6ab086910e,"""At first I was very hesitant and scared""Sunshine Miles explains why she changed her mind. Considering getting the COVID-19 vaccine? #GetTheFacts like Sunshine did so you can make an informed decision. Watch her video below or by visiting: https://t.co/TeYieeKZQ6 https://t.co/sPJNgiZV4u",en
2022-03-20 15:00:15+00:00,5b121598cc411889daeabe705aa75339f4daa29cb5db5e0878ee23e2044d41d4,#COVID-19 #coronavirus #vaccine durability picture gets clearer ... | #J&amp;J | #Moderna | #Pfizer | #Immunization | #vaccination | #SARSCoV2 | #COVID19 | By @dgvarins via @NBCNews https://t.co/LMUUy1nNM8,en
2022-03-20 15:00:05+00:00,7ba5284d1392e1993435c42acf7229a3,New COVID-19 vaccine registered in Russia https://t.co/ixkuAoTnB7 #Health https://t.co/eQQT8822Zi #news 833,en
2022-03-20 15:00:02+00:00,ed2f0762c1f046f7cb71e53e24c6fa50,"Covid-19 booster vaccine jabs for millions of people in England will begin to be offered this week, the NHS has announced.https://t.co/ksqZ7KlUIR",en
2022-03-20 15:00:01+00:00,803f90b3ab8fddd85ba0fb3fa9e5daa9,There’s a vaccine clinic open daily in #Coquitlam at the COVID-19 Testing Clinic-Tri-Cities. Head to 2796 Aberdeen Ave for all ages (5-11 and 12+). @FinDonnellyFor info on @Fraserhealth clinics and how to book for ages 5-11 and 12+ visit: https://t.co/uaq4XsuetO,en
2022-03-20 15:00:00+00:00,f4a448ce7286d9ea378d05bde5dc357f2ab186f94bb6826e35d7823c74afcba6,There’s still time to get your second COVID-19 vaccine dose &amp; receive $100. Complete your vaccine series by March 31 at select sites https://t.co/YWYLRQVJgG https://t.co/uCfd3iGqWU,en
2022-03-20 14:59:34+00:00,0cac71fbe55a5561dc8f633020b21281,"Medicago's homegrown, plant-based COVID-19 vaccine approved by Health Canada | CBC News https://t.co/yoy0CPIvEw",en
2022-03-20 14:57:00+00:00,6854b3b0abfc6b512f8a2ca65536b0a419fabdf7cb2f5042a48b6c1e2cf2a424,@3DprintStuffs @Vinny49347272 @ZoeLightly @JesseKellyDC There are many causes for myocarditis-Covid-19-Bacteria -gastroenterologist infections-rubella-fungi-parasites-etc and the recovery rate is exceptionally good so it’s not strictly the vaccines-,en
2022-03-20 14:52:28+00:00,a81c405a0a97c0a435a93917f9156310,"Marcos should have paid Philippine Government on day 1 of COVID-19 so we would have saved 30,000 LIVES!! Filipinos died because we couldn't buy vaccines and equipment!! #PasigIsPink #PasigLaban @ABSCBNNews @DOHgovph",en
2022-03-20 14:51:51+00:00,a81c405a0a97c0a435a93917f9156310,"@RockyMa46760498 Marcos should have paid Philippine Government on day 1 of COVID-19 so we would have saved 30,000 LIVES!! Filipinos died because we couldn't buy vaccines and equipment!! #PasigIsPink #PasigLabanParaSaTRoPa #PasigLaban",en
2022-03-20 14:50:33+00:00,6b729f33f44b7cccaae6dd046e9e2f34,"If you took a vaccination selfie, took a photo with your sticker, band-aid, vaccine card, etc, send it to us to be included on the 2021 Town Report cover collage as we mark this turning point in the COVID-19 pandemic.Send photos to publicinfo@concordma.gov for inclusion https://t.co/tZPVxAWIgj",en
2022-03-20 14:50:21+00:00,1a414a8bd2417eb5d09500095f98c9d85faa40f0391fc1b8fcc8da0e9d814164,"Nurse in Germany gave 8,600 saline shots instead of COVID vaccinehttps://t.co/G6szVa3d5cWalgreens store mistakenly injects saline instead of COVID-19 vaccinehttps://t.co/UslcBStQMv[Forward from Cosmic Light Force] https://t.co/qEVPx9Wxt0",en
2022-03-20 14:48:57+00:00,39921ab739e4049887feb6919f2c20d1e6b0eb671a85e365ebe70fbd075f78ff,@realspidey1 @ScienceWDrDoug Replying to @realspidey1  Dr Doug Corrigan is informing us with the truth. Those that are not accepting need to do their own research and discover who is profiting. And yes the virus does exist but you need to take super precaution just like most of us not taken Covid-19 vaccine.,en
2022-03-20 14:48:12+00:00,b4520cbd6bcdfddeeeed87b8d14d48ee,"Pfizer is using a RegEx to find covid? What could go wrong? 😀 CNN: A 4th dose of Covid-19 vaccine will be needed, Pfizer's CEO says, but the company is working on a shot to handle all variants.https://t.co/C5jHdRCaNu",en
2022-03-20 14:45:23+00:00,be1fb6ca2753fabe40f37a963ecb3fc7764aded04cc4a0d102431ffe9b6ebe1b,“ Our study is the first in vitro study on the effect of COVID-19 mRNA vaccine BNT162b2 on human liver cell line. We present evidence on fast entry of BNT162b2 into the cells and subsequent intracellular reverse transcription of BNT162b2 mRNA into DNA.”https://t.co/d8ZzgJBJbc,en
2022-03-20 14:43:25+00:00,87914637a9ed2ed0dc9deaf2f6fc799a,@sxsw @wearebcl @amywebb @TheSharkDaymond 2) @pfizer  ’s Moonshot: The story of the race for the COVID-19 vaccine (Pfizer CEO @AlbertBourla ) “Billions of people &amp; businesses were putting their hopes on it. I knew it wasn’t possible but it had to be possible”,en
2022-03-20 14:42:45+00:00,10f7d23ece7e1e3889f93cdbb49e6753,#ICYMI: Vaccinated travellers won't need COVID-19 test to enter Canada as of April 1 https://t.co/CUFU8LDtxs — via @financialpost#vaccine #COVID19 #travel #Canada,en
2022-03-20 14:42:45+00:00,7171cd7868bc134927abfa70ca293c1a,#ICYMI: Vaccinated travellers won't need COVID-19 test to enter Canada as of April 1 https://t.co/Ymsey2a199 — via @financialpost#vaccine #COVID19 #travel #Canada,en
2022-03-20 14:42:00+00:00,1486587ddcdc971e364e4709e992bc447fff34f08a6c48e10bb9aa97dd0bed27,"@afringecanadian @HarvesterEAS @JamesKi38096383 @idiolekt @MsBlaireWhite @JoeySarson Yet it didn't happen with the covid-19 vaccines, so it is rather irrelevant.",en
2022-03-20 14:39:56+00:00,2f66efad9b0070aac29c7ee06f9c22feaf0af65efacf98f4235fb5b96c2528cb,What Mothers Should Know About COVID and COVID-19 Vaccine for Children https://t.co/RBFBIal0Ms,en
2022-03-20 14:39:11+00:00,b6af330b68a149519f804b4e92ac2c10,@JohnTory @MayoClinic @richardursomd This narrative of  Covid-19 vaccines needs to be dropped.Everybody knows that they are HARMFUL and DEADLY.Yesterday the Federal🇨🇦 gov set up a 75 million dollar injury compensation program. That is another proof that not all will survive or come out healthy with these vaccines,en
2022-03-20 14:39:08+00:00,6563d8761c94906a5e7885703bfa4cd9,@un__anchored @JDCocchiarella The vaccines were never meant to prevent you from getting COVID-19.  They are meant to prevent hospitalization and/or death,en
2022-03-20 14:38:48+00:00,c5a1d9741040150f57d33b7ef95ea93f,"So scary, I’m saying it for two years now, all those demonstrations anti covid-19 and anti vaccines, all organised by Nazis, the 6th of January and now this senseless war.Be aware people.",en
2022-03-20 14:38:09+00:00,5be7f67a0a44e639b25ccdbef6635b7f,"If you needed more proof that vaccines work, Switzerland is reporting COVID-19 deaths by vaccination/booster status. https://t.co/wlzSsRla8i",en
2022-03-20 14:37:22+00:00,0b5585424214c97aecf2032e14c4a1dd,#ICYMI: Vaccinated travellers won't need COVID-19 test to enter Canada as of April 1 https://t.co/KVDkB3zoty — via @financialpost#vaccine #COVID19 #travel #Canada,en
2022-03-20 14:36:20+00:00,2336a3551c6d08936e15830634a21f5557914b804d1a0a8cd528e6db790a7f4e,"nucleus that houses our DNA.Yet a Swedish study—conducted outside a living organism, or in vitro—has shown that the Pfizer COVID-19 vaccine can enter human liver cells and convert the mRNA to spike DNA within six hours. In addition, these spike DNA were found in the nucleus.",en
2022-03-20 14:36:20+00:00,2336a3551c6d08936e15830634a21f5557914b804d1a0a8cd528e6db790a7f4e,"The pandemic has given the pharmaceutical industry innovation opportunities that may have not been possible before, Oelrich said.A pioneer of the mRNA vaccine technology, Dr. Robert Malone, who calls the COVID-19 vaccine a genetic vaccine was de-platformed from all major",en
2022-03-20 14:34:48+00:00,997f2f69b6eed116b1ce283aea81bea7,FDA to Consult Advisory Panel About Additional COVID-19 Vaccine Boosters https://t.co/5FrlLfZ7Fn,en
2022-03-20 14:34:35+00:00,a573d02b449c96d9d0bff868cac8a0df,Fourth doses of #Covid_19 vaccine available to local immunocompromised residents 👉 https://t.co/kMm4A7F2kt https://t.co/K0BNccEmDi,en
2022-03-20 14:34:00+00:00,f7236da37e391fd00312464f667f347b,#ICYMI: Vaccinated travellers won't need COVID-19 test to enter Canada as of April 1 https://t.co/eAzBTQRqJN — via @financialpost#vaccine #COVID19 #travel #Canada,en
2022-03-20 14:32:00+00:00,d2196281db681bfe54fe151154755fe731522f07df34c0d1d707fcd4e0e5187a,"Vaccines only prevent most people from dying of Covid-19, and they do not prevent all deaths complicated by Covid-19.",en
2022-03-20 14:30:40+00:00,9db54e22b1379abe5551a925cda27955,#ICYMI: Vaccinated travellers won't need COVID-19 test to enter Canada as of April 1 https://t.co/hps4uBR25Z — via @financialpost#vaccine #COVID19 #travel #Canada,en
2022-03-20 14:30:39+00:00,912afd312811116836f145038a231103,#ICYMI: Vaccinated travellers won't need COVID-19 test to enter Canada as of April 1 https://t.co/3SFyONQfIc — via @financialpost#vaccine #COVID19 #travel #Canada,en
2022-03-20 14:30:31+00:00,ad47ae0ba7c5825b0986d8333ddd8fca,Louisville health department leader who oversaw COVID-19 vaccine distribution has died https://t.co/TWLXWDuz0R via @Yahoo,en
2022-03-20 14:30:04+00:00,7ba5284d1392e1993435c42acf7229a3,New COVID-19 vaccine registered in Russia https://t.co/ixkuAoTnB7 #Health https://t.co/eQQT8822Zi #news 884,en
2022-03-20 14:27:35+00:00,18237c51b3e9f60a0bcd6429d3ec77a7e690d641e8fd5a31d0e1dc3d59bc278f,"@TyotoRiffle @Knight67Templar @Ms_Be_Free_83 The government's line about""covid-19"" calling it with every other brainwashed human being""a PANdemic' when it is not one, jabbing the endless lines of people coming in for their possibly eventually genocidal"" vaccines"" when most know darn well that they are not""vaccines"" and not",en
2022-03-20 14:27:16+00:00,a0a03151cadcc3e07a2f4a958832a0f10d38230d2267eab691eb4a2b606beb83,United States Army Kicks Outs First COVID-19 Vaccine Refusers https://t.co/ppyPskAdvW,en
2022-03-20 14:26:40+00:00,cee095e3d221a33682bf62a76dfa665dfc263b530f3bb46c34fb01a0d913f37e,One word: DISCRIMINATION‼️‼️‼️ it is well known that #vaccine does NOT prevent #Covid_19 infection -here data from Denmark 🇩🇰 showing infection rates among boosted 💉 NOT lower (if anything higher) than those with 2 or no vax #COVID19 #Booster #Canada https://t.co/xUUrLdZ3LW,en
2022-03-20 14:26:37+00:00,3258f24236c52a55d9f78cfa8a1e6341,"In response to reporting unusual adverse reactions to the #COVID-19 vaccine, enjoy reading a case about a young male who developed acute myocarditis post-covid-19 vaccine. Luckily, he quickly recovered with no long-term sequelae! https://t.co/NgLdCsKxIohttps://t.co/8M95RtFUcm",en
2022-03-20 14:24:01+00:00,ffedcffd7d250d5e8d2ab2351569613e,A Perspective in @NatureMedicine argues that the epidemiological and social crises brought about by COVID-19 have magnified widely held social anxieties and trust issues that have exacerbated skepticism toward vaccines. https://t.co/9x8a7prj0F https://t.co/fZhbaLaPrW,en
2022-03-20 14:23:43+00:00,3655097d6081e5ccc7b65cb698b9492417845062627f592920e9a8c1fb591954,"introducing a social credit application that combines universal basic income (UBI), a digital identity and a passport for the COVID-19 vaccine, all within their Diia app for Ukraine.https://t.co/vcmN95Lmj6",en
2022-03-20 14:22:45+00:00,b9d38511a0f7618b0c371cf84bd8e8f516e25e4f09fa8d460afbbf545fcf313f,Get your Vaccine and maybe we won't get hit hard .Sadly this has been turned into a Political Shit show so expect another hard wave of COVID-19 .https://t.co/3KCVNbpeyU,en
2022-03-20 14:20:11+00:00,d86bcc49bc8bf85120e70ef40c2d4814,@scobie @Spotify Rachel Maddow spread proven misinformation about COVID 19 and vaccine efficacy. Why do you have such a double standard here?,en
2022-03-20 14:19:17+00:00,1ec7385b736155233f60e41a506f3921fea17c5f2663bf580f635c658daf4771,"@BooRaisedRight @DanFlet18217428 @mnresist @JFVandermeij lol 'experimental'. Yeah, only a couple of decades of proven testing on mRNA coronavirus vaccines for SARS, and almost 2 years now on these specific ones for SARS-2 aka COVID-19. I like how people still say experimental after all the testing is over and FDA FULLY approved several",en
2022-03-20 14:18:56+00:00,5213d9c9b284947238260ebbe5727fc2,Breast-feedingIt is unknown whether COVID-19 mRNA Vaccine BNT162b2 is excreted in human milk. A risk to the newborns/infants cannot be excluded.FertilityIt is unknown whether COVID-19 mRNA Vaccine BNT162b2 has an impact on fertility.,en
2022-03-20 14:18:55+00:00,5213d9c9b284947238260ebbe5727fc2,"Fertility It is unknown if COVID-19 mRNA Vaccine BNT162b2 has an impact on fertility.For women of childbearing age, pregnancy should be excluded before vaccination. Plus,women of childbearing age should be advised to avoid pregnancy for at least 2 months after their second dose.",en
2022-03-20 14:18:54+00:00,5213d9c9b284947238260ebbe5727fc2,COVID-19 mRNA Vaccine BNT162b2 is not recommended during pregnancy.,en
2022-03-20 14:18:47+00:00,56513a4907497294448d1141b6dc8b91,Unintended Consequences of mRNA Vaccines Against COVID-19 https://t.co/5nBBsqVvyK via @epochtimes,en
2022-03-20 14:18:04+00:00,45cb240f74e57f69bd279ff0d44aa28f,"India's apex body on immunisation NTAGI has recommended administering the second dose of COVID-19 vaccine Covishield between eight and 16 weeks after the first dose, official sources said on Sunday.https://t.co/t6NYvkibbt",en
2022-03-20 14:17:18+00:00,7f962f396742ecbde6055e13d8a7780a,WHO pauses approval of Quebec's Medicago COVID-19 vaccine due to tobacco industry ties https://t.co/Wo2iWD1Yeo The vaccine is first Cdn made shot and also the first jab to be entirely plant-based. Health Canada authorized its use on Feb. 24 in people aged 18 to 64.*why &gt; 64yr.,en
2022-03-20 14:15:55+00:00,7ba7c40be729f614602983ab2699d5a6,Spring Covid-19 booster vaccine jabs will be offered to millions in England this week.https://t.co/4jIuZA2SAk,en
2022-03-20 14:15:00+00:00,3136ce686704a9ca2965382f53c7d077,Did you know that even if your child had COVID-19 and recovered they should still get vaccinated? It is possible for kids who have already had COVID-19 to become infected with the virus again. Talk to your pediatrician about the COVID-19 vaccine: https://t.co/W9q4E8zRhB https://t.co/OtHwySaB87,en
2022-03-20 14:14:08+00:00,93a339983ba5325d2b98d3e2c9170ebf416160b90b8d13b94fc7810b3174e5cc,@RedCandleBad @JustAMazen @EricG1247 The COVID-19 vaccines are not experimental.,en
2022-03-20 14:13:57+00:00,f4a52bd33f0306101acbbbe4c07b9253,"People who received 2 or 3 doses of an mRNA #COVID19 vaccine had a 90% reduced risk for ventilator treatment or death from COVID-19. During the Omicron surge, those who received a booster dose had a 94% reduced risk of the two severe outcomes.https://t.co/Ew449xVzNn",en
2022-03-20 14:13:51+00:00,cee095e3d221a33682bf62a76dfa665dfc263b530f3bb46c34fb01a0d913f37e,Danish data show that #vaccine does NOT prevent #Covid_19 infection‼️‼️ infection rates among boosted 💉 NOT lower (if anything higher) than those with 2 or no vax #COVID19 #Booster https://t.co/5i6QSCrsEu,en
2022-03-20 14:13:48+00:00,f308225d05199250361eee4b0294c3cd770dcfc807c3dfa878ad99f1544ed7a1,@remus_67 @erinotoole In April/May 2020... there were NO viable Covid-19 vaccines... The feds were exploring all their options... Read...https://t.co/IFHB7M83Rn https://t.co/ChI086iD1Q,en
2022-03-20 14:13:40+00:00,8eaf2ba42997b4f2b7dd1cf2e3dc838c,"@KamVTV Refugees from Ukraine are comming to Poland since 25 days. No masks, vaccines, social distancing.And guess what?No news waves of #Covid_19Isn't that intetesting?",en
2022-03-20 14:13:06+00:00,0bad96073bb10da313579ead036001a80990da73f0f4f27cef428fb56a569144,"They continue to insist in the “extreme rare” 🤬 UK: COVID-19 Vaccine Caused Woman's Death, Coroner Rules https://t.co/9Yo4NBR1pb",en
2022-03-20 14:12:49+00:00,e7f7a64761dbb1f4470999653432ae52ca3956902d62bf7b27ac59ab4ed9ed04,https://t.co/Ra6Ts4jnAD Navy boots first sailors from service for refusing COVID-19 vaccine https://t.co/ka4ErbpbAd,en
2022-03-20 14:11:43+00:00,8b8e469e3235f3ece74f985812147d23,So they hate everyone because the so called Covid-19’s jabs are not technically a vaccine there go nobody is technically vaccinated when you can still get or transmit. A not hiring sign would suffice since nobody is vaccinated. Just stating the facts! ⬇️100% discriminatory ⬇️,en
2022-03-20 14:11:07+00:00,908167b36407ee7dc6461e10e15e4637821f283cde8c34b915c488a851f264f6,"During a recent interview with @aawsat_eng, Professor Sir Mene Pangalos, EVP &amp; President Biopharmaceuticals R&amp;D, shared how @AstraZeneca has supplied over 2.7 billion doses of our COVID-19 vaccine globally. https://t.co/GnrJNQNZsm",en
2022-03-20 14:10:52+00:00,6b9c6bbf2840b2c085d9db9d666a0e787744b8bb58f31ccbfdef7b7b457b9070,Former Werder Bremen boss Markus Anfang apologies for FORGING a Covid-19 vaccination card and says he failed to act 'as a role model'... but the banned German coach reveals he is still 'afraid' of the vaccine https://t.co/YMZwgQcvYE https://t.co/ZQcVW4uciz,en
2022-03-20 14:10:16+00:00,4fbe83f3d0895ac0b1886f48b3786a7c,"Informant: #Whitmer kidnap suspect wanted to blow up COVID-19 vaccine plants, kill doctors https://t.co/SRfnDo5sIC via ⁦@freep⁩ #Michigan #BrandonCaserta was irate abt Mandates/masks/Vaccines. ⁦⁩@MIGOP⁩ @GOP respect men like this. #WhitmerKidnapping",en
2022-03-20 14:10:11+00:00,0e5aaccd0367bc54109b480951394d77c860d037b6d4d5d6353695e610c27ea3,"@rob_connections @nathaliejacoby1 Fact check:COVID-19 vaccine protects both the person vaccinated and those around them""This is false information,"" Akiko Iwasaki, a professor of immunobiology and molecular, cellular and developmental biology at Yale University, said in an email.",en
2022-03-20 14:10:11+00:00,ff589330189d3e6f6032ff52561c8db4,"@Noideatoosmall @tedcruz I’m unvaccinated and don’t wear a mask and I’ve never had COVID-19.My body, my life, my choice.Only a dictator would force mandates of a free society.Never had a cold.Never had the flu vaccine.Never had the flu.I’m in my mid 60’s.",en
2022-03-20 14:09:25+00:00,a0a58910ff1320342057e034db7eecdf,COVID-19 vaccine dose sparing: strategies to improve vaccine equity and pandemic preparedness - The Lancet Global Health https://t.co/Xx0LJcZVjE,en
2022-03-20 14:09:13+00:00,cb96c801241bdeb1fa63420c1967fbe2,People are seeing a more relaxed state with the spread of the vaccine and wonderfully now doubt that Covid-19 existed. 🤔,en
2022-03-20 14:09:09+00:00,74059afd3e7036785e05368201ee2d346060cfc2e3f5abe257642ca5e44c6342,FDA to Consult Advisory Panel About Additional COVID-19 Vaccine Boosters  👀 https://t.co/Oleiykkwq8,en
2022-03-20 14:05:16+00:00,1150f049f4c3c42870bb02b492672273c860d037b6d4d5d6353695e610c27ea3,"If you want a COVID-19 vaccine or need a ride to a local clinic--AAYHF, Capitol Metro &amp; CTAHI has you covered! https://t.co/p442sKhrJM",en
2022-03-20 14:03:36+00:00,59b83be875fe92db5c2777473963b6e0,Fourth vaccine offers little protection against COVID-19  https://t.co/XVGYWPeijI,en
2022-03-20 14:03:30+00:00,229b57e59844bc57d577d71ed03dd5c3,"DMRegister: Opinion: Hysteria about COVID-19 vaccines and rules aimed at protecting lives didn't stay contained to COVID vaccines, writes the Register's editorial board. https://t.co/C4rePQqyeE",en
2022-03-20 14:03:03+00:00,bb89af8ec77049c0c4e11829b5cf205e,Still have questions about the COVID-19 Vaccine? Antioch Baptist Church is hosting a Town Hall on March 22 at 6:30 pm! @BHCHD Dr. Nafissa Cisse Egbuonye &amp; Dr. Robert Nichols from Greenwood Pharmacy will be on hand to answer your questions. #TakeTheShotBHC https://t.co/KVncnB81QV,en
2022-03-20 14:03:00+00:00,e833bd0d85035ad0001bf3e455eccac9,"Despite the fact that children under the age of 5 are not eligible for the vaccine, the number of COVID-19 cases has dropped to the lowest level in over two years. So, if the vaccine is approved for that age group, will they need it?https://t.co/VH3F6DDXyV",en
2022-03-20 14:02:44+00:00,3bfb7e6308963fdf1f7bbd7307e21f8d11b5758fb0253f3ec5d6f727f3ebbec2,@darstin1957 @SenRonJohnson Plenty of conspiracy theorists in the US too.masks don’t stop the spread of the COVID-19: many studies prove masks reduce spreadvaccines don’t work: that’s just stupid,en
2022-03-20 14:01:41+00:00,a0a58910ff1320342057e034db7eecdf,Evaluating COVID-19 vaccines in the real world - The Lancet https://t.co/TycIGp3fSq,en
2022-03-20 14:00:49+00:00,47234d85aeef5843a64ba0c344afdbc99aba482d39f0c07da1d753218a30c24d,"Are you unsure of whether you are eligible for the #COVID-19 #booster #vaccines? We recommend that you find out more here: https://t.co/4tlZsfThjwLet us fight this pandemic together. If you need any further support, email: help@cahn.org.uk https://t.co/y45c6weuDY",en
2022-03-20 14:00:48+00:00,69f94405e466280d35944b11b2629696f963cd995f82474e37fd53b0377f1243,"Maanvii Arya, aged 16, talks about her experience of side effects after getting the COVID-19 vaccine. You can find your nearest walk-in vaccination centre here: https://t.co/z0CPTLK51Bhttps://t.co/qrOqBO7vZI",en
2022-03-20 14:00:48+00:00,4f8f547a1cb6bdc6ecff495beb40613f,The COVID-19 vaccine is safe for children aged 5 to 11. Health Canada determined that the COVID-19 vaccine is safe and effective at providing a strong immune response against COVID-19 in children and youth. Learn more at https://t.co/QxTRjj3efn https://t.co/7Xjj6X0IY7,en
2022-03-20 14:00:34+00:00,dcad70e7b0f371d8e174d5a519555455,"An opponent of COVID-19 vaccine and mask mandates gestures to a counter-protester wearing a cow suit during a rally in downtown Vancouver, Canada. Photo by @Jen_Gauthier https://t.co/sOSIq0H10i",en
2022-03-20 14:00:14+00:00,b866c3e0686f75f90ffc72ea9519ad99,Vaccines offer the best protection against COVID-19. Book your jab or find a local drop-in clinic online now: https://t.co/9t64T4n8Pt 💉 https://t.co/HHXYZtODeC,en
2022-03-20 14:00:05+00:00,7ba5284d1392e1993435c42acf7229a3,New COVID-19 vaccine registered in Russia https://t.co/ixkuAoTnB7 #Health https://t.co/eQQT8822Zi #news 182,en
2022-03-20 14:00:02+00:00,90b52e029334e08aea3543d1948f7246,Looking for weekend COVID-19 vaccine walk-in clinics? Visit 👉 https://t.co/2NPWzAZT1e to find a clinic near you. https://t.co/FruFZ5fgfr,en
2022-03-20 14:00:00+00:00,9ad8ca5dbbb944db4e156190373f2e41651d5744beb0834c7b55c917cc35e1d8,Dr. Mark Hobart - Australian Health Authorities on Notice - Withdraw COVID-19 Vaccines Immediately https://t.co/7xKkN3h2wZ,en
2022-03-20 13:58:18+00:00,77b4656a56310e6fc701c675d5e0e951,The Texas Rangers’ warrants detail communications between Hidalgo employees and Harris County vendor in controversial COVID-19 vaccine contract | https://t.co/yTqJHEAZoT  @houstonchron https://t.co/2WQnPVKNab,en
2022-03-20 13:57:27+00:00,e93c91d930cf3fb962c37aaf583e1112c59111713d1d3bcd20a13dd134527bd9,U.S Edges Towards Covid-19 Vaccines Approval For Children https://t.co/u2hbJcZlvq,en
2022-03-20 13:56:56+00:00,452c8105487506cb15961f7fc57cc440,@chipfranklin Yes. I wouldn’t need one if more people got the initial dose of the vaccine. The anti-vaxxers prolonged COVID-19.,en
2022-03-20 13:56:50+00:00,4bf439230413def211df24c210ecb19fe7bf50937d93249225a8c38b81205223,"TWiV 877 🩺 In COVID-19 clinical update #106, Daniel Griffin covers failure of ivermectin to improve hospitalization, increased hospitalization of children w/ Omicron, effectiveness of Pfizer mRNA vaccine in children &amp; more. 📺 https://t.co/UM3p4VpBAj https://t.co/cZdeLGl1QC",en
2022-03-20 13:55:49+00:00,0848e4096ae12583453956f03f5c70f8b53ec6c2fc374751419229ecee9c423b,"@William88500864 @DrJamesOlsson You should request same proof for ""vaccines provent Covid-19""",en
2022-03-20 13:55:22+00:00,c6db20e5e6502460803530416b143ca6,Do you have an interest in how the #Infodemic has played a role in COVID-19 and vaccines?Join the #UCTvaccinechat on Monday the 21st at 19:30 SAST to share your views. All @UCT_news and #GrooteSchuurHospital students and staff welcome! https://t.co/c3qVW5HCYr,en
2022-03-20 13:53:57+00:00,a19bd8c6c9e78cb94e60049847e99f86,"UK: COVID-19 vaccine caused woman's death, coroner rules - Business Insider https://t.co/A6VZUrtwSf",en
2022-03-20 13:53:47+00:00,b18a76816bba788202cea92a06265955,“Receiving 2 or 3 doses of an mRNA COVID-19 vaccine was associated with a 90% reduction in risk for COVID-19–associated IMV or death. Protection of 3 mRNA vaccine doses during the period of Omicron predominance was 94%.”-@CDCMMWR https://t.co/jQJhGrW8Fm,en
2022-03-20 13:52:53+00:00,5473d4b07c2fdc714adb02a527e276d7f6bdd3bba9746466c30f31257ce2a1af,"Pharma billionaire's son buys $33M mansion in exclusive Sydney suburb after pocketing $10.7BILLION on the back of the Covid-19 vaccine rollout. Florian Struengmann, 35, has snapped up the $33million five-bedroom mansion in Mosman, smashing the area's previous property records.",en
2022-03-20 13:51:32+00:00,d92d62e4a268c6726301f8fa1d1f6f3e,New2Trip: Comparing clinical efficacy of COVID-19 vaccines: systematic review &amp; network meta-analysis https://t.co/BeqDtOL6UC,en
