date,userid,tweet,lang
2022-04-14 13:36:58+00:00,4484394159,Valneva Covid-19 vaccine approved by MHRAThe Medicines and Healthcare products Regulatory Agency has given regulatory approval to the Covid-19 vaccine developed by Valneva.https://t.co/zxmmvakdRS,en
2022-04-14 13:36:07+00:00,412973080,@Taric25 @Hax4days1 @xXSonofApolloxX I don't think you understand how vaccines (and the COVID-19 vaccine) work,en
2022-04-14 13:35:00+00:00,7383122,"Fighting the Pandemic Through 🎵: In Rajasthan, these revered Manganiyar folk artists are communicating through song about the safety and efficacy — and availability — of COVID-19 vaccines.https://t.co/o4JvU3akj8",en
2022-04-14 13:34:35+00:00,50335591,"Ugo Humbert Says Poor Form Could Be Due To COVID-19 Vaccine, Claims Others Have Experienced Similar https://t.co/KmvO81bn2B https://t.co/p4MUWi99uL",en
2022-04-14 13:34:28+00:00,1250156125053423619,"Covid-19 Live Updates: China, Omicron and Vaccine News - The New York Times https://t.co/zLkHyQUzBC",en
2022-04-14 13:34:28+00:00,1309199463190274049,"Trudeau/Champagne invested $173m in Medicago, knowing WHO wouldn’t approve, because QUE based, can’t even send to developing countries. Completely irresponsible!!! Big Tobacco' COVID-19 vaccine: what were the Liberals thinking? - Financial Post https://t.co/xElrkIosCz",en
2022-04-14 13:34:26+00:00,18956303,"With a new COVID-19 variant spreading, there is no better time than now to protect our community. Get ahead of COVID-19 by staying up to date on vaccinations with a booster. Find a vaccine location near you:  https://t.co/3qsfVMNpdq #BoostedIsBetter @DrMotew https://t.co/viGMQQyXka",en
2022-04-14 13:34:09+00:00,2269237262,We are sharing our data so you can make an informed decision about the COVID-19 vaccine. A COVID-19 data dashboard is available seven days a week at https://t.co/QSHP3sZtPW. https://t.co/Eashl8QRlR,en
2022-04-14 13:34:03+00:00,538456752,Parents: Side effects after your child gets a #COVID19 vaccine are normal &amp; may last a few days. Get your kids ages 5+ years vaccinated to give them the best protection against COVID-19. Learn more: https://t.co/qhIQTjcb89,en
2022-04-14 13:33:59+00:00,1283085436215349248,@MzwaneleManyi Who care about covid-19 right now except Ramaphosa and his vaccine mafias.,en
2022-04-14 13:33:00+00:00,25735151,BOOSTERS FOR KIDS: Pfizer says that a third shot of the children's dose of their COVID-19 vaccine raised Omicron-fighting antibodies by 36 times in kids 5 through 11 years of age. https://t.co/LRndCSjuuJ,en
2022-04-14 13:32:47+00:00,73340105,"This week’s Coronavirus Snapshot has been published.The Snapshot shows:➡️6.4% of the regional population are estimated to have COVID-19, based on modelling by Public Health. ➡️616 people received a vaccine dose in the last 7 days.Find out more at https://t.co/1OusgiS5CY https://t.co/hTEklVPtmt",en
2022-04-14 13:32:05+00:00,2870783409,"CDC recommends a #COVID19 vaccine booster shot to continue to provide maximum protection against COVID-19 and its variants. To stay up to date, get a #booster shot when due. For more information about boosters, visit ➡️ https://t.co/xwf4gizWu3 https://t.co/bDoQ9g7n3V",en
2022-04-14 13:31:52+00:00,30460070,"The New York Times: Covid-19 Live Updates: China, Omicron and Vaccine News.https://t.co/EHIM6hXjbavia @GoogleNews",en
2022-04-14 13:31:05+00:00,2256940704,Paying the vaccine-hesitant to get their COVID-19 shots could boost vaccine rates https://t.co/lB1VGmjjVF,en
2022-04-14 13:30:28+00:00,6433472,Health Canada says almost 1.5 million doses of COVID-19 vaccines held in a national inventory have expired since January. https://t.co/EKgaxp7uLx,en
2022-04-14 13:30:15+00:00,1920454891,"A 4th dose of the COVID-19 vaccine is now available to: • adults aged 60+ • Indigenous adults and their household members aged 18+ For the best protection, book your 4th dose 5 months after your booster. https://t.co/7QTfqzwbP5 https://t.co/Ns52gssg5Z",en
2022-04-14 13:30:14+00:00,236770150,UK's Medicines and Healthcare products Regulatory Agency approved Valneva COVID-19 vaccine https://t.co/0HIB4T8rfd #Health https://t.co/eQQT88jDQQ #news 405,en
2022-04-14 13:30:12+00:00,20596957,RT @BrookingsInst: Public funding still has a major role to play in COVID-19 vaccines and therapeutics. New research from the USC-Brookings Schaeffer Initiative for Health Policy outlines 4 important lessons for policymakers. https://t.co/H961IWttvM,en
2022-04-14 13:30:05+00:00,125416629,"We now provide the fourth dose of COVID-19 vaccine to eligible Veterans, their spouses and dependents. Please see our Facebook post for full details: https://t.co/zlusdSGS3g https://t.co/coZU01tdRX",en
2022-04-14 13:30:02+00:00,7744592,"A booster dose of the Pfizer-BioNTech COVID-19 vaccine raised antibody levels in children ages 5 to 11, the company said Thursday. https://t.co/Nv6otq9XJi",en
2022-04-14 13:30:00+00:00,126296958,"We’ve published weekly local COVID-19 figures on our website, which show:➡️6.4% of the regional population are estimated to have COVID-19, based on modelling by Public Health. ➡️616 people received a vaccine dose in the last 7 days.Find out more at https://t.co/WQN1QHQ4IE https://t.co/h8unUKPO1y",en
2022-04-14 13:29:59+00:00,205392468,"Pfizer and BioNTech plan to ask the FDA to clear a third dose of their COVID-19 vaccine for children as young as 5 after trial results show a ""robust response"" of antibodies in this age group. https://t.co/mIhkfPSDXs",en
2022-04-14 13:29:43+00:00,14352556,"COVID-19 vaccines will not be required for students to attend K-12 schools in Washington this fall, the state Board of Health decided in a unanimous vote Wednesday afternoon. https://t.co/uzHP1qwz4T",en
2022-04-14 13:29:42+00:00,296694466,"1. Britain has become the first country to approve Valneva's Covid-19 vaccine, which is reportedly easier to store. The shot is stored at a temperature of between two and eight degrees Celsius, which is similar to that of a domestic refrigerator. https://t.co/Liaz7mKR9r",en
2022-04-14 13:28:56+00:00,242351863,"April 14- Britain's medicines regulator said on Thursday it had approved the use of Moderna Inc's COVID-19 vaccine in children between six and 11 years, as the country bolsters itself for fighting coronavirus infections.https://t.co/q45GZyjg52#Moderna",en
2022-04-14 13:28:10+00:00,1208608058974318592,"Health Canada says almost 1.5 million doses of COVID-19 vaccines held in a national inventory have expired since January.April 14, 2022 at 04:57AM | By: Mia Rabson https://t.co/vX9P7Yf8eLWinnipeg Landscaping | KS Landwork Winnipeg Trusted",en
2022-04-14 13:28:07+00:00,2846112885,"""The Biden administration announced Wednesday it is extending the public health emergency for the COVID-19 pandemic for another 90 days, Reuters reports.The extension means people can continue to receive free tests, vaccines and treatments for COVID-19.https://t.co/Dx0FhlV9QO",en
2022-04-14 13:28:01+00:00,304952647,@Scott46198555 @sajidjavid @Scott46198555 We can accept donations from those who have and have not had a Covid-19 vaccine. You can read more on this at https://t.co/UaTrICQO5HThanks - Patrick,en
2022-04-14 13:27:53+00:00,1369717735899471873,$INO Vaccine technologies used to develop COVID-19 vaccines   https://t.co/S6MALeGkK8,en
2022-04-14 13:27:49+00:00,2811559122,"A third shot of the children's dose of Pfizer/BioNTech's COVID-19 vaccine raised Omicron-fighting antibodies by 36 times in kids five through 11 years of age, the companies said in a news release. https://t.co/4Mte9Uk53k",en
2022-04-14 13:27:18+00:00,830687924509249537,The ruling of taking the injection of covid-19 vaccine on the daytime of Ramadhan is permissible and does not invalidate fasting because the injection does not go through an open cavity.,en
2022-04-14 13:27:00+00:00,35239459,Looking for a COVID-19 vaccine or booster today in the Pawtucket area? There is a clinic for everyone age 5 or older at the Boys and Girls Club (1 Moller Place) from 4-6 p.m. Make an appointment at https://t.co/BDqUWfTSC5. https://t.co/Z9HIuVhKeS,en
2022-04-14 13:26:27+00:00,1207679668008214530,"""430. Will a Covid-19 Vaccine Change the Future of Medical Research?"" by Freakonomics Radio https://t.co/dupvvZsEhf #economics #podcastSee more posts at https://t.co/lo9TyPYSl4",en
2022-04-14 13:26:24+00:00,2598000222,UK approves Valneva’s COVID-19 vaccine https://t.co/1LtFApuz86,en
2022-04-14 13:26:05+00:00,830687924509249537,Question #2 What is the ruling of taking covid-19 vaccine during Ramadhan?,en
2022-04-14 13:25:48+00:00,56488059,@BioNTech_Group @FDA Emergency uses of the vaccine have not been approved or licensed by US FDA but have been authorized to prevent COVID-19 in ages 5+. See Fact Sheets: https://t.co/zCHIrvunEm,en
2022-04-14 13:23:48+00:00,28160998,Pfizer and BioNTech said their Covid-19 vaccine was effective as a booster against the Omicron variant in children ages 5 to 11 https://t.co/d352UE4QOp,en
2022-04-14 13:22:27+00:00,27212395,"Shanghai’s symptomatic Covid-19 cases soar to 2,573 as Xi doubles down https://t.co/vZzzH05qdK? Xi talks about ""science"" in a nation that cannot make vaccines....  via @scmpnews",en
2022-04-14 13:22:16+00:00,312412918,"Pfizer and BioNTech said Thursday that a third dose of their COVID-19 vaccine in children 5 to 11 produced a “high” immune response, and that they will apply for authorization for a booster dose in the age group soon.   https://t.co/1yZj80xjJI",en
2022-04-14 13:22:04+00:00,1224287909672562689,UK approves Valneva’s COVID-19 vaccine https://t.co/xbiwDkGiNW,en
2022-04-14 13:21:07+00:00,1121184084,Albumedix and Valneva Expand Collaboration to Include Newly Approved Inactivated COVID-19 Vaccine - https://t.co/r5juVvhQI3,en
2022-04-14 13:20:46+00:00,1232677953617776646,"The Valneva vaccine VLA2001 has been approved for use against COVID-19 in the UK 💜We would like to give huge thanks to all our incredible staff and volunteers who have been involved in this trial. Without you, research would not be possible.Read more:https://t.co/5MbkmoZfGX https://t.co/IZQDetOPYb",en
2022-04-14 13:20:08+00:00,1180165058338447363,"Live Covid-19 updates: China, Omicron and vaccine news https://t.co/Ix1fhCAHSd",en
2022-04-14 13:16:54+00:00,1331246050129154052,The #COVID19Vaccine can help keep students and schools healthy. A recent study by @ABCCollab found that vaccines are 88% effective at preventing COVID-19 infection in schools. Get #vaccinated for maximum protection against the virus! https://t.co/XN0h9dkwTz https://t.co/MuJpan9wLK,en
2022-04-14 13:16:33+00:00,266347276,"Pfizer hired 600 employees in the months after its COVID-19 vaccine was authorized in the United States due to the “large increase” of reports of side effects linked to the vaccine, according to a document prepared by the company.",en
2022-04-14 13:15:00+00:00,157997359,Covid-19 vaccine being produced in Scotland has been approved. https://t.co/3IMQNT0Fh2,en
2022-04-14 13:14:16+00:00,25636170,@BalurCDN @BYoung362 @PeterHRatcliffe I get that but not every country requires all vaccines including Covid 19 vaccine. The fact of the matter is people who didn’t get the shot can’t even step foot on a plan or train that includes within our own country. I seriously can’t wrap my head around it all.,en
2022-04-14 13:13:46+00:00,17159134,Pfizer announced Thursday that a third shot of its COVID-19 vaccine raised omicron-fighting antibody by 36 times in children ages 5 to 11.https://t.co/kELOPsh2xe,en
2022-04-14 13:12:33+00:00,16640775,Moderna recalled one lot of its COVID-19 vaccine in Europe after a “foreign body” was found in one vial. Doses in the U.S. have not been impacted.https://t.co/Pora6MkDZW,en
2022-04-14 13:12:16+00:00,50279781,"Spikevax was already approved in Britain for those over 12 years, and the extension to include younger children comes hours after the regulator approved French firm Valneva's easy-to-store COVID-19 vaccine for adults up to 50 years of age.https://t.co/gGck2VgRLP",en
2022-04-14 13:12:12+00:00,636342679,"Leading the NewsU.S. renews COVID-19 public health emergency for three more monthsReuters (4/13) “The United States renewed the COVID-19 public health emergency, allowing millions of Americans to keep getting free tests, vaccines and treatments for at least three more months.”",en
2022-04-14 13:11:21+00:00,892125759963312128,"""It is for the Joint Committee on Vaccination and Immunisation (JCVI) to advise in due course on whether 6 to 11s should be offered vaccination with the COVID-19 vaccine made by Moderna as part of the deployment programme.""Source: https://t.co/xbTUyQqIaK",en
2022-04-14 13:11:03+00:00,3193130087,@PeterHotez At least one person has told he was COVID-19 vaccine-hesitant because his primary care physician was COVID-19 vaccine-hesitant and he trusted his primary care physician more than anyone else on medical issues.,en
2022-04-14 13:10:36+00:00,1153086551729065984,"Whenever Twitter directly blocks tweets that show proof of this ""covid-19 vaccine"" harming people, the corporation is responsible for anyone who is either maimed or killed (by the fake vaccine), due to the afflicted not seeing helpful tweets that otherwise would've been shared.",en
2022-04-14 13:10:31+00:00,7940822,Washington Board of Health decided unanimously not make the COVID-19 vaccine a requirement for kids to attend school in the fall. https://t.co/GCUTMUHEo1 #4NewsNow,en
2022-04-14 13:10:24+00:00,994242738676789249,Albumedix and Valneva Expand Collaboration to Include Newly Approved Inactivated COVID-19 Vaccine  https://t.co/hK1Wq9YU91 https://t.co/5jC0R2widq,en
2022-04-14 13:10:08+00:00,88324218,But not our servicemen.Would-Be Immigrants Can Get Waivers for COVID-19 Vaccine Requirement: Lawyer https://t.co/O3lrdHCQ68 via @epochtimes,en
2022-04-14 13:10:01+00:00,151106990,Public funding still has a major role to play in COVID-19 vaccines and therapeutics. New research from the USC-Brookings Schaeffer Initiative for Health Policy outlines 4 important lessons for policymakers. https://t.co/GSvmepUVYj,en
2022-04-14 13:09:01+00:00,3373177095,What makes vaccine inequality even more stark is the fact that the technology at the heart of the COVID-19 vaccine was developed with a combination of private and public money. https://t.co/gClwIuzMan,en
2022-04-14 13:07:37+00:00,1410033740248666121,"@ShhhhDontTalk @Alisonnj @nurdtwitt @Reuters That was the ruling “The Food and Drug Administration won't have 75 years to release thousands of pages of documents it relied on to license its COVID-19 vaccine. Instead, the federal agency will have just over eight months to do so, per a federal judge's ruling.”",en
2022-04-14 13:07:33+00:00,461853598,Britain's medicines regulator said on Thursday it had approved the use of Moderna Inc's COVID-19 vaccine in children between the ages of six and 11 years. | via @Reuters https://t.co/peiar9WMum,en
2022-04-14 13:05:10+00:00,606623619,Children in Bassetlaw aged 5 to 11 are now eligible for the Covid-9 vaccine. The vaccine will reduce the risk of your child falling seriously ill with Covid-19. To book online go to https://t.co/o91scpsTEK https://t.co/NG3RnV1Ezm,en
2022-04-14 13:05:02+00:00,2775202518,"New from @IDEpiPhD et al: Factors Associated With Willingness to Receive a #COVID-19 #Vaccine Among 23,819 Adults Aged 50 Years or Older.  https://t.co/rGCDJKeKha",en
2022-04-14 13:05:01+00:00,2313994032,"As the world seeks normalcy in the COVID-19 pandemic's third year, leaders and experts urge vaccination and vigilance amid vaccine opposition, economic hardship, and inequalities in getting vaccines to people globally.https://t.co/5jnByCitEo",en
2022-04-14 13:04:21+00:00,856421901727617024,COVID-19 vaccines in national stockpile starting to expire as uptake slows https://t.co/dLxFhEp1Dk,en
2022-04-14 13:04:11+00:00,994242738676789249,Albumedix and Valneva Expand Collaboration to Include Newly Approved Inactivated COVID-19 Vaccine https://t.co/hK1Wq9YU91,en
2022-04-14 13:04:09+00:00,132399982,"@canadavsengland @nazcamonkey @LynnMcCabe13 @redsnoopy69 1/2“The investigators analyzed the antibody-induced immune response up to 1 year in 130 COVID-19 recovered, unvaccinated individuals versus up to 8 months among 402 others matched by age and BMI and w/out previous infection who received two doses of the Pfizer vaccine.”",en
2022-04-14 13:03:42+00:00,384023597,"Need a copy of your COVID-19 vaccination record? MA residents can use My Vax Records to get a digital vaccine card to show they’ve been vaccinated against COVID-19, if they choose. More at https://t.co/W1LE9rnhlq #Covid19MA https://t.co/W4P21zVF4s",en
2022-04-14 13:02:35+00:00,1332686182845657088,COVID-19 vaccines in national stockpile starting to expire as uptake slows https://t.co/iOdSGLiA7j,en
2022-04-14 13:02:27+00:00,23189415,"Aspire Pharmacy, High Street, Sidcup is offering children aged 5 to 11 can appointments to get their Pfizer COVID-19 vaccine today.2pm to 4pm, Friday 15 April Walk in’s are available. https://t.co/NSND9aLGCF",en
2022-04-14 13:01:51+00:00,160763593,"The pictured van is run by Worcester Health &amp; Human Services' Equity Vaccination Mobile Clinic, which seeks to increase accessibility to the COVID-19 vaccine. If you attend the upcoming two dates, and receive your 1st or 2nd shot, you will receive a $25 gift card for groceries! https://t.co/ZRROxeVnMg",en
2022-04-14 13:01:37+00:00,1035192921723613184,"CANVax in Brief 📕| How Government Policies and Political Ideologies Impact Vaccine Acceptance: COVID-19 and Beyond | Noni MacDonald, Eve Dube, Janice Graham | https://t.co/y9hQ6HDCGJ#CANVaxRes https://t.co/h7Pddp2d2C",en
2022-04-14 13:01:36+00:00,271408313,Individuals who are at higher risk of serious illness and hospitalization from COVID-19 should consider an additional dose of the vaccine. Protect yourself and book your booster vaccine at https://t.co/hc76rJREKi https://t.co/AJFUCJWsxy,en
2022-04-14 13:01:22+00:00,1364045200310423554,Valneva Receives Conditional Marketing Authorization from UK MHRA for its Inactivated COVID-19 Vaccine https://t.co/8lAmG2rl6l,en
2022-04-14 13:01:21+00:00,823824278156115968,We have extended the deadline for our COVID-19 Booster &amp; flu vaccines survey.We want to hear your views on the vaccines and experiences if you had them. Your responses will help the local NHS with future planning: https://t.co/9ADtJPyBWn https://t.co/le4OERtK9j,en
2022-04-14 13:01:08+00:00,73238422,"Vaccines and other treatments mean we can now transition to managing COVID-19 like other respiratory illnesses, with updated guidance. Comment on this thread if you have any questions and one of our Community Health Workers will reach out to you! #COVIDisparities #Brooklyn",en
2022-04-14 13:01:07+00:00,556207855,"Do COVID-19 vaccines affect menstrual cycles?Many women reported a delay in their menstrual cycles following vaccinations. A new study saw delays in women's cycles by up to 2 days.⚕️ Providers, have any of your patients experienced similar symptoms? https://t.co/Iozs8tf2YJ",en
2022-04-14 13:00:48+00:00,25562183,Britain's medicines regulator said on Thursday it had approved the use of Moderna Inc's COVID-19 vaccine in children between the ages of six and 11 years. https://t.co/1n8kW1nqm2,en
2022-04-14 13:00:42+00:00,1240282099363590144,The creators of four Cuban vaccines against COVID-19 were awarded the “Medal for Inventors” by the U.N.’s World Intellectual Property Organization. The island boasts one of the top ten vaccination rates in the world. Cuban vaccines have been exported to five countries. https://t.co/4rLHta37eR,en
2022-04-14 13:00:30+00:00,1267531476448366593,COVID-19 vaccine protects sufferers of inflammatory Bowel diseaseRead more about this here: https://t.co/aSiOxlbPwcSubscribe for free to ResearchNews Newsletter: https://t.co/SKqXzy40b2 https://t.co/qr7puaoTx0,en
2022-04-14 13:00:27+00:00,63268295,"Free COVID-19 vaccine opportunity available for individuals 5 years of age &amp; older. Boosters are available.Thursday, April 143-7 p.m.St. Elmo Elementary School600 W. St. Elmo Rd. Vaccine available: Pfizer, Modernahttps://t.co/QS2sOPIhGzStElmoMustangs",en
2022-04-14 13:00:24+00:00,1455505486523125763,Parents...schedule a vaccine today and keep your family safe from the COVID-19 variants! Visit the VBDPH website to see local vaccine clinic information: https://t.co/sa25SZTjld https://t.co/6nriYWBrjZ,en
2022-04-14 13:00:15+00:00,2993727444,"2022-04-14 COVID-19 vaccines in national stockpile starting to expire as uptake slows | CBC NewsMore than 80 per cent of Canadians are considered fully vaccinated, while 57 per cent of adults and 15 per cent of teenagers have received a third dose.https://t.co/VLXmQ28woc",en
2022-04-14 13:00:13+00:00,236770150,UK's Medicines and Healthcare products Regulatory Agency approved Valneva COVID-19 vaccine https://t.co/0HIB4Tq2DN #Health https://t.co/eQQT8822Zi #news 210,en
2022-04-14 13:00:06+00:00,6892002,"No, the Moderna COVID-19 vaccine wasn’t recalled in the US https://t.co/Qc2shZksSc",en
2022-04-14 13:00:05+00:00,3318510966,COVID-19 vaccines in national stockpile starting to expire as uptake slows https://t.co/1wo62P89rx,en
2022-04-14 13:00:02+00:00,776597804391264256,Covid-19 Vaccine Boosters: What Does the Future Look Like? https://t.co/1Nwp3aHF8D@ETFMG #vaccine #vaccinebooster #covidvaccine #vaccinenews,en
2022-04-14 13:00:01+00:00,1339765547907465216,"Jabs for kids? Taiwan is working to secure COVID-19 vaccines for children as young as five. John Van Trieste asks Dr. Shih Shin-Ru, Director of Chang Gung University’s Research Center for Emerging Viral Infections, how safe these jabs are for children. https://t.co/FpOlvD11ek",en
2022-04-14 13:00:00+00:00,804892070,"Children aged 5 to 11 are eligible for the COVID-19 vaccine. Across Hull and East Riding we have dedicated clinics available. No appointment necessary, you can simply walk in. Visit Vaccinate Hull and East Riding for more information https://t.co/nY8EPTq2XA https://t.co/70qpgQypQF",en
2022-04-14 12:59:41+00:00,4423439899,"The first Youth COVID-19 Vaccine Days is today! Together with the YMCA of Greater Londonderry we will have two dates available for children and teens ages 5-17 to get their first and second doses. Registration is on-site, along with resources and giveaways. #NHhealthy #InNHforNH https://t.co/51XIa8jXRp",en
2022-04-14 12:57:54+00:00,19013879,Pfizer CEO: Covid-19 vaccines for new variants possible before year ends https://t.co/NTuBcvvdXw https://t.co/SrdWkddWDf,en
2022-04-14 12:57:39+00:00,1134049078424162304,Valneva Shares Jump As Its COVID-19 Vaccine Receives Conditional Approved In UK $VALN https://t.co/ZpJxWTin7u,en
2022-04-14 12:57:21+00:00,263719312,COVID-19 vaccines and testing are the best way to keep our communities protected and healthy. For updated #Covid_19 guidelines check out @NYCHealthSystem's resource hub.,en
2022-04-14 12:55:18+00:00,241876167,Let's get something straight.Is there Covid-19 - YES.Is there a Vaccine - NO.,en
2022-04-14 12:55:08+00:00,204560863,Have questions about the Supreme Court's recent upholding of the Centers for Medicare and Medicaid COVID-19 #vaccine mandate for workers in #healthcare organizations? We explain the ruling here: https://t.co/oyTegokvx0 https://t.co/cs2HngrNxD,en
2022-04-14 12:55:00+00:00,16456004,NEW BOOSTERS? The youngest kids eligible for a COVID-19 vaccine may need another shot soon. https://t.co/5g6Ga3qOoO,en
2022-04-14 12:54:52+00:00,798805325298049025,"@POTUS Injecting vaccine to COVID-19, cause alot of people died! Both in America and China, other countries and places are the same situation.it cause a lot of side effect, that is bad efdect!",en
2022-04-14 12:54:41+00:00,19658826,Today’s covid-19 news: · UK first in Europe to approve Valneva vaccine · US renews covid-19 public health emergency status· People at higher risk of heart disease are up to six times more likely to die from covid-19 https://t.co/kOLzb6YSIk,en
2022-04-14 12:54:23+00:00,887352779139944448,Albumedix Ltd.:Albumedix and Valneva Expand Collaboration to Include Newly Approved Inactivated COVID-19 Vaccine https://t.co/0mrbsoVnM5,en
2022-04-14 12:54:02+00:00,1085280073119354880,New COVID-19 &amp; Pregnancy Poster from the New York State Department of Health (NYSDOH). Share this poster to address common questions mothers and birthing people may have about the safety of the COVID-19 vaccine while pregnant!  https://t.co/QnA2rms9Sw https://t.co/RoUH2QZ3Gk,en
2022-04-14 12:53:47+00:00,798805325298049025,"@POTUS I feel we don't need to develop vaccine to COVID-19! We can solve COVID-19 problem too! For example, North Korea! There are only four countries in the world that have no COVID-19 cases!",en
2022-04-14 12:53:36+00:00,47512768,Pfizer and BioNTech Announce Data Demonstrating High Immune Response Following a Booster Dose of their COVID-19 Vaccine in Children 5 Through 11 Years of Age https://t.co/GswDtk4lTp $PFE $BNTX,en
2022-04-14 12:53:33+00:00,26350330,Refusal to receive COVID-19 vaccine remains hot button issue for Chicago Police and the City https://t.co/CA3bYwWvyk #Chicagonews #Breakingnews #news,en
2022-04-14 12:53:13+00:00,1328777031299960833,$VALN - Valneva Shares Jump As Its COVID-19 Vaccine Receives Conditional Approved In UK,en
2022-04-14 12:53:00+00:00,842579741697703936,$VALN - Valneva Shares Jump As Its COVID-19 Vaccine Receives Conditional Approved In UK,en
2022-04-14 12:52:17+00:00,72928001,$VALN: Valneva SE receives conditional marketing authorization from UK MHRA for its inactivated COVID-19 vaccine https://t.co/4QwHn9w0F7,en
2022-04-14 12:51:34+00:00,1446551130679480331,Moderna reveals source of COVID-19 vaccine contamination as Japan finds yet another suspect vial | Fierce Pharma (2021 article) Search Stew Webb for the inside story with photo and video proof  https://t.co/70vcviP6Q0,en
