date,userid,tweet,lang
2022-11-10 09:00:03+00:00,44e004a539d95633a0bbe341d33f79ac,"COVID-19 and flu spread more quickly in winter and can cause serious illness.If you're over 50, you're eligible for a free flu and COVID-19 booster vaccine.Find out more: https://t.co/oCVWEmlCIP https://t.co/Zy3Hxc2PdW",en
2022-11-10 08:59:15+00:00,96f06ef4d0d5b2acd67392ee506194e499f643619929e2bb088c6d27871e0a8c,@jeremycorbyn leading cause of death in the UK is now the Covid-19 vaccine 👀👀👀😡,en
2022-11-10 08:57:05+00:00,9bb9be431752f0a121a35f6a36ed43f58fa40d52ad35ae7251c0c53944910dd0,"Today is #WorldImmunizationDay to celebrate and spread awareness about the benefits of getting vaccinated. @CDCTanzania in collaboration with the GOT &amp; partners accelerated COVID-19 vaccination coverage to 70%. COVID-19 vaccines are available, safe &amp; are effective. https://t.co/iCuWYyHhvf",en
2022-11-10 08:52:56+00:00,af260d9362fd0157fe411d8de755e9a47ba3241557cf24fd6834ffa8fe9cad5f,"#MedSafetyWeek doest not working !My report it's full dust in some office desks probably, no help from NHS, @YCCScotland collecting information with no offering help either, where is the point to report that you are sick from the Covid-19 Vaccine with no help #vaccineinjuries",en
2022-11-10 08:52:02+00:00,dbdc32482bd3511933ac20db2e8b8082d0f98443f7390cd68cc6c1b0c75e7bc6,@vivekagnihotri @AAArtsOfficial @AbhishekOfficl @kaalisudheers 3. COVID-19 injections were not vaccines as we have come to know for decades. “Vaccine’s” definition was changed to pass selectively toxic injections in the name of “Vaccines”.,en
2022-11-10 08:51:55+00:00,c86c6d301eb8bc09efb5e56a9930dcfa4a10f634cb188351c6e5a7c048a8f49f,"2019 Novel Coronavirus (COVID-19) - Vaccines | Monterey County, CA https://t.co/Yal0HqV8sC Emerging Conversations Program: Respiratory syncytial virus (RSV) - Webinar. Date: 11/15/2022 6:00 PM - 7:00 PM 11/15/2022 6:00 PM 11/15/2022 7:00 ...",en
2022-11-10 08:51:51+00:00,a3ccf1d2d740ee6f4c249f0f1424850936d376b178bdacd2cbde247fd168fb5f,Frequently asked questions on #Covid 19 #vaccineshttps://t.co/0vo4S5dII9 Kenya to spend $37 million on sending forces to Congo,en
2022-11-10 08:51:51+00:00,386bdb499ffb8efe600f5685d13b0456,Studios Backing Away From Blanket COVID-19 Vaccine Mandates - Hollywood Reporter https://t.co/J1U6ciyBs8,en
2022-11-10 08:51:50+00:00,a3ccf1d2d740ee6f4c249f0f1424850936d376b178bdacd2cbde247fd168fb5f,Frequently asked questions on #Covid 19 #vaccineshttps://t.co/0vo4S5dII9 German business leaders warn against pulling out of China,en
2022-11-10 08:51:50+00:00,a3ccf1d2d740ee6f4c249f0f1424850936d376b178bdacd2cbde247fd168fb5f,"Frequently asked questions on #Covid 19 #vaccineshttps://t.co/0vo4S5uLK9 Ethiopia peace talks extended as disarmament, aid discussed",en
2022-11-10 08:46:49+00:00,75ce5a374e82e80a1a1f3daf844ee6bf,Pre-pandemic conspiratorial mindset predicted hesitance to accept COVID-19 vaccine https://t.co/VlTzZWWViD https://t.co/NHdC7amiE7,en
2022-11-10 08:46:36+00:00,834db0efaa6fd2b4560d1f2429320936,"I’m happy to share that I’ve obtained a new certification: Comprehensive training for promotion of vaccine demand to maintain and restore routine immunization and promote covid-19 vaccination by leveraging social data, behavioral insights, infodemic manag…https://t.co/kkLBSmILMF",en
2022-11-10 08:43:26+00:00,ca32a9c4f23ee94140c466fdc0cf22923774c17003aead22e80a9d0df7332c2e,"@mattletiss7 @davidkurten Great Matt, shared. From a recent parliamentary debate about the safety of the Covid-19 vaccines . . .https://t.co/6o9ih5jXTQ",en
2022-11-10 08:42:45+00:00,ca32a9c4f23ee94140c466fdc0cf22923774c17003aead22e80a9d0df7332c2e,@MaajidNawaz From a recent parliamentary debate about the safety of the Covid-19 vaccines . . .,en
2022-11-10 08:42:37+00:00,45ae3da38ae7133c6a517fce55d16399,"""Second Pfizer/BioNTech bivalent COVID-19 booster vaccine approved by UK medicines regulator""https://t.co/Krs1JXukAE""targets both the Original strain of SARS-CoV-2 and the Omicron BA.4 and BA.5 sub-variants.""@sailorrooscout",en
2022-11-10 08:42:13+00:00,a483ff9b7bd384516a61d078df4254951ab55ac47ab669572bdbb041d9045860,My experience with receiving the COVID-19 vaccine was phenomenal... I urge you to get your dose of the covid to protect yourself and your family☺️,en
2022-11-10 08:41:32+00:00,3f9f247251c74335801ea9923a001b2438fc9a662d8ec8ba354ec5e16890649e,"@VCALST @GunterDeRyck @alaingrootaers Wel, we bewijzen dat een anekdote maar een anekdote is. --&gt; ""The risk of myocarditis in unvaccinated individuals after a COVID-19 infection was at 11x higher than in individuals who developed myocarditis after receiving a COVID-19 vaccine, ... https://t.co/FjfWBkOk3H",en
2022-11-10 08:41:10+00:00,997a2e2568f378b65f99c288c34e4510,"Getting your flu and Covid-19 vaccines are two of the most important things you can do to keep yourself and others around you safe this winter. Find out more, including how to book your vaccinations, at https://t.co/YOrxApwSQN.#Bristol #NorthSomerset #SouthGlos https://t.co/Us9f1AXvEu",en
2022-11-10 08:40:32+00:00,c48abd82c60b594f75562ed14bf447eb4d9991957655dac241f70aabccfc3d0a,"@JazzyLakudura @OnthatileSeiti4 @BLOSE_ZN @destinyzee The same why I don't understand why it's easy to take a smallpox vaccine that  cases the illness below, but not the covid 19 one, that cause the same kind of illnesses. https://t.co/R2KPgZX8jc",en
2022-11-10 08:40:32+00:00,63df80ad38305f5b8f7a459488e25719,"Staff vaccinations today at the Berridge Room, find us in The Courtyard at Sandwell Hospital. We have COVID-19 and Flu Vaccines and are open from 8.30am till 4pm. @SWBHnhs @swbohw https://t.co/S9mlZAsV9p",en
2022-11-10 08:39:00+00:00,ebe2938ceaf23062db5f20a45b6c84e2840575f21bd583899dd1be3620a865f4,Journalists from various media houses committed to increase their efforts in educating the people of #Cameroon to support the country to achieve high acceptancy and uptake of the COVID-19 vaccine💉. #EndCovid22 https://t.co/r8BI8Box2D,en
2022-11-10 08:38:37+00:00,4d3c338bae88302acc0f3e56126f1c33ff92c98d7b0fa2c1e6d3d090314b65f2,"@devisridhar Prof. Devi Sridhar (Health Advisor to Scottish govt), claimed in Aug21 that Pfizer &amp; Moderna COVID-19 #vaccine stops 90% Transmission! When confronted by citizen, she says, she gets her salary from #wellcometrust whose founder is pharma magnet Henry Wellcome 1/2 https://t.co/uxJRjlCpEn",en
2022-11-10 08:37:41+00:00,86fdd2d793421ac1012b2e4bba576026,Novavax’s Covid-19 vaccine approved in Britain for use as booster – Veloxnews https://t.co/BZtKUjyHnd,en
2022-11-10 08:34:38+00:00,fd1befa962567b97e52c31289b7e499751a69a641a28f7ecfae3e771173414c3,"Although manufacturing capacity worldwide has increased, it remains highly concentrated. Ten manufacturers alone provide 70% of vaccine doses (excluding COVID-19). Several of the top 20 most widely used vaccines (such as PCV, HPV, measles and rubella containing vaccines) #WHO",en
2022-11-10 08:32:07+00:00,0bf538816264293dab9b93381e60ac60dadec572bd582a07d671e7b0b8e84270,🌏 Global COVID-19 vaccine rollout🟩🟩🟩🟩🟩🟩🟩🟩🟩🟩⬜⬜⬜⬜⬜ 68.21% (estimate)Vaccine doses deployed: 12.9BThe rollout seems to be slowing down#COVID19 #EpiTwitter #Vaccination #PublicHealth https://t.co/7hnIcIDCxS,en
2022-11-10 08:31:20+00:00,d3087ff11350649d3c684c86f20b140d,"Hey doctors, can a person have their blood titered to see if they have antibodies for COVID-19? I'm debating on whether to get the 5th vaccine, it will be 6 months since I got the 4th one. Any info would be appreciated.",en
2022-11-10 08:31:05+00:00,fd1befa962567b97e52c31289b7e499751a69a641a28f7ecfae3e771173414c3,"Approximately 16 billion vaccine doses, worth US$ 141 billion, were supplied in 2021, almost three times the 2019 market volume (5.8 billion) and nearly three-and-a-half times the 2019 market value (US$ 38 billion). The increase was primarily driven by #COVID-19 vaccines",en
2022-11-10 08:30:50+00:00,64c2e835f89105045dd393e37b935718839306c5fac4b469d83fd237427fbc61,A tribute to our scientists who developed the vaccine for CoViD 19. who on that time #TheVaccineWar https://t.co/wlim8oZ1Vi,en
2022-11-10 08:30:00+00:00,df9e8e69f85184fafc05fec4c4aafab2,"Our vaccine bus is in Kilburn today offering COVID-19 boosters, 11am-4pm📍Lauriston Lodge, corner of Maygrove and Barlow Roads, NW6 2BH Then visiting:🚌Clyde Court, Purchese St, NW1 1HL - Friday 11 November 🚌29-39 Brunswick Sq, WC1N 1AX - 17 to 19 November https://t.co/jYSuqbD3eq",en
2022-11-10 08:28:15+00:00,45427ca056aa1f6ffdddc29751e79dd63774c17003aead22e80a9d0df7332c2e,Covid-19 vaccine injury is REAL! Thousands of victims across the UK are suffering because of their “safe and effective” jabs.Enough is enough! We need a compensation model that genuinely supports victims of Covid-19 vaccine injury! SIGN OUR PETITION!https://t.co/2swgKWY13s,en
2022-11-10 08:26:44+00:00,72ad78f6055bdde466c8547541fbadfe651d5744beb0834c7b55c917cc35e1d8,Mainstream Media Warns of ‘Tripledemic’ This Winter—— What’s Really Behind the Hype? #Influenza #RSV #COVID-19 # (CDC) #vaccines #internationalnews #hotnews https://t.co/qKwEyUdfXu,en
2022-11-10 08:26:34+00:00,68d4351a4bc6e6860edf68a6f9fdec35,"This investigation reveals so many worrying things about the long debate into intellectual property (IP) rights at the WTO around COVID-19 vaccines, which eventually resulted in a disappointing ""narrow and temporary exception to an export restriction, not a waiver""Highlights 🧵",en
2022-11-10 08:25:18+00:00,302ac50740283095cf2cc22eaed6a5b7,Who killed the vaccine waiver that would give poorer countries greater access to Covid-19 products?Our latest @TBIJ investigation w/@politico is worth your time.B/ @SamuelHorti @ashleighfurlong &amp; @SarahAnneAarup ⌨️ https://t.co/0BB8N2R8d3,en
2022-11-10 08:24:10+00:00,0f56a11a80c8b9b09b1bdae0e805c3a5,"As COVID-19 cases increase in the past few weeks, the Health Ministry has recorded that 48 percent of the deaths from Oct. 4 to Nov. 8 are people who have received no vaccine. #jakpost https://t.co/vL0CvC7yKZ",en
2022-11-10 08:20:12+00:00,0beb854d1d2a182a21a773f85e163ee2,Researchers compare the risk of myocarditis between Pfizer and Moderna COVID-19 vaccines https://t.co/3oH4wiFwXz,en
2022-11-10 08:20:11+00:00,7a3cdd6ccd7361fb91e7bd0614db95b38cbd134e73fc2dd981790d02a64756b2,Ohio Lawmaker Proposes Bill Prohibiting COVID-19 Vaccination Discrimination in Schools.https://t.co/yt7qQu3p6X #ohio #news #schools #vaccine #discrimination #bill,en
2022-11-10 08:18:46+00:00,066f2308a69b5228f2b2ae52d0b4abe7,"British Medical Journal's editor Dr. Peter Doshi raises alarming questions About COVID-19 Vaccine Safety Concerns; BY ARJUN WALIA NOVEMBER 2, 2022 https://t.co/LshFNkfYI8",en
2022-11-10 08:18:29+00:00,09551575459586d6a959f8a872a719f17be945a28ed35bea71ecdf51242b554f,@Frank_2567 This is so devastating. Bless her heart is she speaks up. May her voice be heard. I pray that it would move people to walk away from this dangerous covid-19 inoculation. I also pray that it makes people more skeptical of other vaccines. Too many hidden side effects.,en
2022-11-10 08:18:13+00:00,5dad48f349e4dadbc216ea7ea5d56529,"@NomfundoMotha2 @OnthatileSeiti4 @BLOSE_ZN @destinyzee Sisi weh. Have them immunized doesn't mean they won't die from it. Some vaccines eat you up slowly, some are immediate. Covid 19 vaccines are much faster, for reasons known by pharmaceuticals.many kids are disabled because of the immunization, something that's not talked about",en
2022-11-10 08:11:14+00:00,c12cba531eebc1a2601e5cfa1eaf9be9,"New COVID-19 Variants May Evade Vaccine Protection: latest variants—BQ.1, BQ.1.1, XBB, and XBB.1, which were all derived from Omicron—are evading both vaccine-derived and infection-derived immunity. https://t.co/g6DfafYaLA",en
2022-11-10 08:10:40+00:00,8376b9a52aa967f3e2abfeac33df8f96,Novavax’s Covid-19 vaccine approved in Britain for use as booster https://t.co/a9S9xxWi1F  #Nigeria #NigeriaNews https://t.co/Jfwe4X3Wq5,en
2022-11-10 08:08:56+00:00,18bc6f17d6c829c010447401d7773ad0d66be0a09cf846f2bb864b5b9502862b,FAQS Covid-19 vaccinevia NaMo App,en
2022-11-10 08:07:58+00:00,f9cee7a3d3376f07e9c07346ce937ad9418730e4496d801a0719a789095114ad,Study reveals vaccine confidence declined considerably during COVID-19 pandemic - Medical Update Online #MedPub #MedTwitter #MedEd #MedNewshttps://t.co/RrxdZ0ZqRm,en
2022-11-10 08:06:06+00:00,c48abd82c60b594f75562ed14bf447eb4d9991957655dac241f70aabccfc3d0a,@OnthatileSeiti4 @JazzyLakudura @BLOSE_ZN @destinyzee First of all you need to have an honest conversation about what vaccines are to people who believe that 5G causes covid 19 and that America is out to get you paranoia. And that bill gates is a devil sent to kill Africans. It's very difficult with this kind of citizens,en
2022-11-10 08:04:44+00:00,26ceea538b73aea48adf20bf24090874ee294151a436de3b7a8901f191f4184b,Novavax’s Covid-19 vaccine approved in Britain for use as booster - https://t.co/PsmdZkgOvv https://t.co/kEzwHXV4P5,en
2022-11-10 08:04:27+00:00,18bc6f17d6c829c010447401d7773ad0d66be0a09cf846f2bb864b5b9502862b,#Will help intensify fight': WHO welcomes India's Covid-19 vaccine approvalvia NaMo App,en
2022-11-10 08:03:49+00:00,b708a7970aaa980cbd7881f3b1507448abbda9948c98c1504dba5fc4f623b6fd,"National Debt And Gasoline Prices In The Four States In Which We Have Chef-Authors, Illegal Aliens-Invaders-and-‘Refugees’ News, Foreign News-Overseas News I, COVID-19 Lockdowns-Restrictions-and-Authoritarianism News, Vaccine Manufacturers’ Stock Prices (Follow the Money) News,…",en
2022-11-10 08:03:36+00:00,3f251f9bcfc5e62d973c696971c4adb2,"(Washington Examiner):In the end, outrage over masks, vaccines, and lockdowns didn't matter : Many Republicans claimed it was tyranny what Democrats did during the height of the COVID-19 pandemic. Closing businesses, forcing .. https://t.co/fmN11E1SiN",en
2022-11-10 08:03:34+00:00,ad2de7e087a7f051d768ff721c79f0d5770dcfc807c3dfa878ad99f1544ed7a1,"National Debt And Gasoline Prices In The Four States In Which We Have Chef-Authors, Illegal Aliens-Invaders-and-‘Refugees’ News, Foreign News-Overseas News I, COVID-19 Lockdowns-Restrictions-and-Authoritarianism News, Vaccine Manufacturers’ Stock Prices (Follow the Money) News,…",en
2022-11-10 08:03:05+00:00,192089a5bbda1229c3bacae3f064d9a2,Protection provided by COVID-19 vaccines decreases over time and flu viruses can change every year. Vaccines are the best protection we have against these viruses that can cause serious illness. Find out if you’re eligible at https://t.co/eqv0NoFw2T and book now. https://t.co/Pm9v3UMEsd,en
2022-11-10 08:03:04+00:00,ee146b7aff55a028b7aa2c782a3349e5,Protection provided by COVID-19 vaccines decreases over time and flu viruses can change every year. Vaccines are the best protection we have against these viruses that can cause serious illness. Find out if you’re eligible at https://t.co/mB1fgMXiwQ and book now. https://t.co/KrjsaQhJtF,en
2022-11-10 08:03:02+00:00,28f673c105fbff7dc52913b11588059a908fb83e78de91bbd8c2aa62c835eadf,"National Debt And Gasoline Prices In The Four States In Which We Have Chef-Authors, Illegal Aliens-Invaders-and-‘Refugees’ News, Foreign News-Overseas News I, COVID-19 Lockdowns-Restrictions-and-Authoritarianism News, Vaccine Manufacturers’ Stock Prices (Follow the Money) News,…",en
2022-11-10 08:01:24+00:00,c48c01f36a72d5253d531a14bf9067cc277f581c54df9aae6435db282b72ef2f,"Covid-19 = NothingCovid-19 = FakemRNA vaccine = ArmsMedia = Brainwashing deviceTwitter = Diversion/feint deviceHowever,There is a slightly tips in Twitter.However,There is a truth of truth only in soul.Good luckElon",en
2022-11-10 08:01:08+00:00,c48c01f36a72d5253d531a14bf9067cc277f581c54df9aae6435db282b72ef2f,"@elonmusk Covid-19 = NothingCovid-19 = FakemRNA vaccine = ArmsMedia = Brainwashing deviceTwitter = Diversion/feint deviceHowever,There is a slightly tips in Twitter.However,There is a truth of truth only in soul.Good luckElon",en
2022-11-10 08:00:34+00:00,5b121598cc411889daeabe705aa75339f4daa29cb5db5e0878ee23e2044d41d4,#Pfizer #BioNTech's #COVID-19 #coronavirus #booster targeting #omicron BA.4/5 approved in the United Kingdom ... | #SARSCoV2 | #vaccine | #COVID19 | #medicine | #pandemic | #ImmuneSystem | Via @Reuters https://t.co/LnIQ3mZRTS,en
2022-11-10 07:58:50+00:00,9c1e6520cdf74ced58338a30899bd052c4f8e91cca374f93eb5640cf75835ae8,"Since COVID-19 I have never taken a test, never locked down, not taken any vaccine! I do not know of any person close to or in my circle who died in the alleged pandemic.I know 3 people who have unexpectedly died within the last 3 months, also 2 mates both had stomach cancer..",en
2022-11-10 07:58:13+00:00,d102cedfa15ebb99bfdab3e8dd7a98339e674eea07990bb610036e9095788c88,@balkraix Another poorly designed study Participants with a singleton pregnancy who had received at least 1 dose of an mRNA Covid-19 vaccine EITHER BEFORE CONCEPTION  or before 20 weeks of gestation and who did NOT have a pregnancy loss &lt; 6 wks of gestation were included..,en
2022-11-10 07:57:54+00:00,18bc6f17d6c829c010447401d7773ad0d66be0a09cf846f2bb864b5b9502862b,#DCGI approves restricted emergency use of COVID-19 Vaccine. Here's everything you need to know! #IndiaFightsCoronavia NaMo App,en
2022-11-10 07:57:19+00:00,b352f321dbf78de1799972e3944578f6,CanSino debuts inhalable Covid-19 vaccine #FMTNews https://t.co/Mmv39lBW7u,en
2022-11-10 07:50:47+00:00,18bc6f17d6c829c010447401d7773ad0d66be0a09cf846f2bb864b5b9502862b,WHO welcomes Indians Covid-19 vaccine approvalvia NaMo App,en
2022-11-10 07:46:27+00:00,b056d3e3bb8a4bd7f87ad5ffa452e943,Vaccines still vital as COVID-19 changes – Abdool Karim https://t.co/q3JyqY6uH8 via @MedicalBriefZA @JVLazarus @CAPRISAOfficial,en
2022-11-10 07:46:11+00:00,c48abd82c60b594f75562ed14bf447eb4d9991957655dac241f70aabccfc3d0a,"@BLOSE_ZN @OnthatileSeiti4 @destinyzee I know my wording is trash. What logical thing will you say to. Someone who takes a flu vaccine, but doubts a covid 19 vaccine?",en
2022-11-10 07:44:01+00:00,499dbf299f206ffada9603fe998e53e8,"The Latest COVID-19 Variants Can Evade Vaccine Protection, According to New Data https://t.co/S6z47up78W via @YahooNews",en
2022-11-10 07:41:24+00:00,77bd0b2ecceb0d7075d6bef093b3f903,"@flossthewriter1 @jamie_hauxwell @barrybargwan @MRobertsQLD Incorrect. It’s purpose is to “prevent covid 19”. That’s what it’s authorized for. When they discovered it didn’t do that, they pivoted the narrative and changed the definition of vaccine. You were deceived. https://t.co/pAbUNXb36V",en
2022-11-10 07:39:24+00:00,c48abd82c60b594f75562ed14bf447eb4d9991957655dac241f70aabccfc3d0a,"@OnthatileSeiti4 @BLOSE_ZN @destinyzee Vaccines don't stop transmission. Transmission happens regardless you are vaxxed or not. Sometimes by touching someone you transmit covid to that person. Being vaccinated does not mean, you touching covid 19 wont infect others",en
2022-11-10 07:38:46+00:00,03eedc7abb5ba9e8c868559690f5f003,"A Pastor that took the Covid 19 vaccine, encouraged his congregation to do same, and likes and endorses Ramaphosa, is not a man of God, and when the mark of the beast is made law, she/he will be first in line to take the mark! Impostors!! Mathew 7: 15 - 29",en
2022-11-10 07:34:30+00:00,ca32a9c4f23ee94140c466fdc0cf22923774c17003aead22e80a9d0df7332c2e,@DrHoenderkamp From a recent parliamentary debate about the safety of the Covid-19 vaccines . . .,en
2022-11-10 07:33:51+00:00,edb7600a87f432e64bfdeb54328e1e550d38230d2267eab691eb4a2b606beb83,The importance of #immunisation was proved recently by the vaccines against #Covid19Vaccines work as a remarkable defence system that protects us from the risk of various diseases. At @tcifindia we appeals to all eligible benificery to complete your COVID-19 vaccination today. https://t.co/ZrUAF5FFRu,en
2022-11-10 07:30:43+00:00,dbafde204b1f7c97956f9a3d73e93fb97be945a28ed35bea71ecdf51242b554f,Novavax Nuvaxovid™ COVID-19 Vaccine▼ Authorized in the United Kingdom for Use as a Booster in Adultshttps://t.co/4VZnI9EPIG,en
2022-11-10 07:25:37+00:00,1eb725ad43f09950c49faaadb676b89a15b4ab0a24a81dca04a9eee0b632f47e,Looking forward to today's  @mbrrace conference where my work on the COVID-19 vaccine during pregnancy will be showcased in a poster presentation. Get in touch to connect or discuss my poster.@NHS_HealthEdEng  @OHID#mbrrace #midwives#PopulationHealthFellow#HealthInequalities,en
2022-11-10 07:24:08+00:00,0d83fc71e738aa7f8f779505ead42566b27768391d0feb2b6255c3ff94c6ce42,"I tust the VIRUS, but I don't trust the men behind the Vaccines of COVID-19 🙏 https://t.co/z9sY8up85C",en
2022-11-10 07:22:37+00:00,aefdf09e8800343e57a8462b5663adc9,"Fact Check: COVID-19 Vaccines Reduce, Not Increase, Risk of Stillbirth https://t.co/3yastdyI5S",en
2022-11-10 07:17:25+00:00,0bf538816264293dab9b93381e60ac60dadec572bd582a07d671e7b0b8e84270,🌍 Global COVID-19 vaccine rollout🟩🟩🟩🟩🟩🟩🟩🟩🟩🟩⬜⬜⬜⬜⬜ 68.21% (estimate)Vaccine doses deployed: 12.9BThe rollout seems to be slowing down#COVID19 #EpiTwitter #Vaccination #PublicHealth https://t.co/LzpSaLj0b4,en
2022-11-10 07:15:56+00:00,489e61dc7a96d2552e2927c636c0ec07609c20435c297bb703bbdebcc8d2fd7c,Unreported Truths About Covid-19 and Lockdowns: Part 4: Vaccines KCLVR9Shttps://t.co/CdufG506sH,en
2022-11-10 07:10:04+00:00,44c09702977d63e660829f0c1a27f2fbe459b88093fc0a5ce6d6af9f9c4c002f,@NewEnglandSMB @DrJamesOlsson Then why 2021/22 has more all-cause excess mortality than 2020 when nobody was vaccinated?Keep in mind that you cannot die from Covid-19 when you’re already dead from vaccine.,en
2022-11-10 07:05:26+00:00,28c0ab9683bd8ec57bf8dab940311dd379ea6213d3066c465c1c6b56c644f894,"@PMNdiaye The million lives lost globally, the global economic hit, Million girls were violated , learning was affected , Million Jobs were lost and etc , for strong recovery people admitted the covid -19 vaccine  now appealing to investors to increasing technical support and funding  ?",en
2022-11-10 07:00:09+00:00,75bcb41584cfbb68ad6dbe8d415416edf169fb69d93450fcb4611c52cde00b12,Mainstream Media Warns of ‘Tripledemic’ This Winter—— What’s Really Behind the Hype? #Influenza #RSV #COVID-19 # (CDC) #vaccines #internationalnews #hotnews https://t.co/EZ1mv4kWVn,en
2022-11-10 06:54:48+00:00,5fb6fb95c9d3dddec0489feab95c21dd,Deaths caused by Covid-19 globally have decreased by almost 90% compared with February.#theSun #theSundaily #covid19 #health #vaccine #WHO https://t.co/LVSm53ogCa,en
2022-11-10 06:54:25+00:00,ca32a9c4f23ee94140c466fdc0cf22923774c17003aead22e80a9d0df7332c2e,@DrAseemMalhotra From a recent parliamentary debate about the safety of the Covid-19 vaccines . . .,en
2022-11-10 06:53:00+00:00,4654d78a8fd5e93e4966f5094f919ff8,Cuba’s COVID-19 vaccine success could serve as global model: report | News | Harvard T.H. Chan School of Public Health https://t.co/bxkTE6nVTl,en
2022-11-10 06:52:36+00:00,00336da6ea0fd072c7a462c3127849b7ee294151a436de3b7a8901f191f4184b,Health Workers Took 1.4 Million Doses of COVID-19 Vaccine: NPHCDA  https://t.co/QuNvPXbsWK,en
2022-11-10 06:51:45+00:00,66cb25415da43c3e79fa59d3323bf1f91157706687bcec5cbe9c779485d4ec66,"The Kashmir Files Director Vivek Ranjan Agnihotri Announced His Next ‘The Vaccine War’, A Film Over COVID-19 Pandemic, Detail Inside !#TheKashmirFiles #TheVaccineWar #VivekAgnihotri @vivekagnihotri https://t.co/rHc96x7VcE https://t.co/hi2vE21CP3",en
2022-11-10 06:51:38+00:00,6033cacf62b03088626b006e400a2153,"The Kashmir Files Director Vivek Ranjan Agnihotri Announced His Next ‘The Vaccine War’, A Film Over COVID-19 Pandemic, Detail Inside !#TheKashmirFiles #TheVaccineWar #VivekAgnihotri @vivekagnihotri https://t.co/Oejz0inxJs https://t.co/ZKtK0nnxKX",en
2022-11-10 06:48:45+00:00,c827e8bd35830305479f769f4d69fe71,"@Flak70058159 @Justjudy29 @DrJamesOlsson “AKI could occur after the COVID-19 vaccines, predominantly in elderly patients. However, the causality needs further identification.” - your own articleYoure a genius",en
2022-11-10 06:47:24+00:00,4895f75a3a207c1bace723f0dad14c7b8675e634b941a14d348b415201478c63,"‘We must genuinely help those who attributed adverse reactions from their Covid-19 vaccines.The Gov must adopt a new compensation model that overhauls the VDPA 1979, and assesses harm - case by case.Sign and share!’ @MaxSH2022 #MedSafetyWeek #ReportSideEffects",en
2022-11-10 06:47:12+00:00,99dd49c3621a9ca03c4b01d0da89cabb,"I just want you all to know, that right now, in many African countries you cannot get hold of ANY COVID-19 vaccines.Not boosters. FIRST doses. Tell me, would you turn up to get a vaccine when you might queue for nothing? Would you walk there? Would you do it repeatedly?",en
2022-11-10 06:45:08+00:00,54749d6ae6c138014fee8ca300652a22,"@erineattitude @Mermaid10851064 @PatriciaHeaton Do you think I should be forced along with my children to get the covid 19 vaccine?  Because in my blue state that's what is going to happen, I have a religious exception for both my work and children...they tired to remove that option when we had a purple legs.",en
2022-11-10 06:44:14+00:00,0eabf0ef134fd040ae4e3ecba4f904c3c55220b3e29a701ba3f2d3aaddccf3c8,"COVID-19 Vaccines Reduce, Not Increase, Risk of Stillbirth – https://t.co/Yt0EFN7J5u https://t.co/65xMleEFgE",en
2022-11-10 06:38:14+00:00,f0d4a6412f6b41f98a7bb851c5c9d45c40c68a166134116d964e60bce4ff10d1,"Hi there ❤️❤️The very first time I got my Covid-19 vaccine dose, the injected area was  swollen and the swelling lasted for a day or two. I enquired from a healthcare worker, if that was normal and she indicated that it was. 1/2 https://t.co/brrxtJg4Pj",en
2022-11-10 06:35:04+00:00,e2aa04a2defe02d8eb08352120fb348df1a9b4b1a59ad13433a274aef31d4df0,A tribute to our scientists who developed the vaccine for CoViD 19 👏👏👏!#TheVaccineWar https://t.co/khRJIed0SI,en
