date,userid,tweet,lang
2022-02-21 17:36:54+00:00,1392027840493748224,"Covid-19 News Story that Has Me Concerned about More than the Virus | by Justiss Goode | Jun, 2021 | Medium - via @pensignal  Read this story https://t.co/rWkzl2z27Q about how one #teenager struggled to go against his parents wishes about getting the #covid #vaccine this year.",en
2022-02-21 17:36:14+00:00,2811559122,"The national government will shift its focus to house-to-house and mobile COVID-19 vaccination, along with administering booster shots, vaccine czar Carlito Galvez, Jr. said on Monday. https://t.co/HV1VBdtuy8",en
2022-02-21 17:36:08+00:00,4256039579,Ottawa 🇨🇦 CanadaNationwide people’s #FreedomConvot2022 protests against Covid-19 💉vaccine mandatesPrime Minister Trudeau is correct.A vote of no confidence that will force another election is now needed👇,en
2022-02-21 17:35:57+00:00,54723619,"New @CDCgov studies show efficacy and safety of COVID-19 vaccines Pfizer and Moderna.https://t.co/U0no4AC7Om | https://t.co/8xiMEoaCFC . If you are not fully vaccinated and boosted, visit https://t.co/my96xHRaxP to find a vaccine site near you. https://t.co/NUSiQe9IzZ",en
2022-02-21 17:33:56+00:00,1419026497801801734,"Official data published by the UK Health Security Agency (UKHSA) is beginning to look terrible for those who have succumbed to three doses of the CoVID-19 ""vaccine"".1/2Source : https://t.co/19rES6gYeC https://t.co/Co4rveQ1BN",en
2022-02-21 17:32:14+00:00,612594310,Covid-19 Vaccine Clinics 2/7 &amp; 2/28: Link to register: https://t.co/CpO2e97Jq2 https://t.co/WDhJURnPYI,en
2022-02-21 17:32:03+00:00,18956073,"Billionaire Bill Gates said the omicron variant moved faster than COVID-19 vaccines, creating a high level of natural immunity. https://t.co/YxqJx4WF94",en
2022-02-21 17:32:00+00:00,2598357146,WATCH: @ItsMadeToSave Senior Advisor Dr. Alice Chen answers your COVID-19 vaccine and FDA approval questions.   https://t.co/B2drRWDlX6,en
2022-02-21 17:31:50+00:00,222576260,"Covid-19 vaccines have been highly effective and very safe, but for a small minority the side effects have been serious, leaving governments grappling with how to handle hundreds of injury claims https://t.co/m4vqAHZJZN via @WSJ",en
2022-02-21 17:31:27+00:00,1449574120799277058,"COVID-19 vaccines and treatment ： We must have raw data, nowhttps://t.co/DvRIAnwzjA",en
2022-02-21 17:31:20+00:00,1475009335055077378,"The mRNA vaccines are wonderful, but the companies that own them have a good chance of really messing up the global response to COVID-19. Everyone should have access to them. If you have a moment, check out this petition from Doctors Without Borders. https://t.co/Oli4rShz3n",en
2022-02-21 17:31:00+00:00,562827192,An additional booster dose will be offered to all adults over-75 and the most vulnerable over-12s in the UK this spring.The UK's vaccines advisers said an extra dose would help top up their protection against severe Covid-19.https://t.co/jOrmOAwkDy,en
2022-02-21 17:30:37+00:00,3167112683,Fourth COVID-19 Vaccine To Be Rolled Out For Millions Of People In A Few Weeks https://t.co/TMtEzfWqrL,en
2022-02-21 17:30:34+00:00,1085642997050552321,"Yesterday was a beautiful morning to be outside serving the community for our RAO Love event. With the help of several local organizations, we offered food, coffee, medicinal items, COVID-19 vaccines and boosters, and more to 75 of our transient neighbors in the area. https://t.co/z2iZo67frx",en
2022-02-21 17:30:28+00:00,1481297249024069632,Check out this cool article regarding the COVID-19 vaccine responses across various causes of immunodeficiency! #pitt_id22,en
2022-02-21 17:30:10+00:00,159126496,"Celebrating #BlackHistoryMonth today and EVERY day 🖤 ✊🏽 Today, WNSB highlights Dr. Kizzmekia Corbett, one of the lead scientists in charge of developing the #Moderna vaccine for COVID-19! #weareblackhistory #blackwomeninmedicine #hot91 #thesoulofva https://t.co/GgN6WpSDiy",en
2022-02-21 17:30:10+00:00,1058519731148333056,"@calebsaysthings Why are you afraid of a cold? As Bill Gates and Vladimir Putin has said, omicron is a live vaccine for covid-19 including the dreaded Delta variant. Stop listening to the US medical establishment and start thinking for yourself.",en
2022-02-21 17:30:05+00:00,1465196934,"The COVID-19 Vaccine does NOT cause fertility problems.Myth: COVID-19 vaccines will affect my fertility.Fact: Currently no evidence shows that any vaccines, including COVID-19 vaccines, cause fertility problems (problems trying to get pregnant) in women or men. https://t.co/z0WcWhrjuo",en
2022-02-21 17:30:05+00:00,115435421,A Senate committee dramatically scales back the House’s vaccine mandate bill. The Indiana Department of Health releases new school COVID-19 guidance. And COVID-19 data continues to improve. https://t.co/VmVmXth2E7 via @laurenechapman_,en
2022-02-21 17:30:03+00:00,17387359,"MPS and @MKEhealth COVID-19 vaccine clinic TODAY, February 21, 2022:1 - 4 pm - Clarke Street School, 2816 W. Clarke St., Milwaukee, WI 53210No appointments are needed. https://t.co/t0UwR3ldWw",en
2022-02-21 17:29:26+00:00,1238692051551760384,"Assuming each an everyone Nigerian whose take Covid-19 vaccine full dose , would have 100,000          Would you take ? Me : Tintini .🤪🤪",en
2022-02-21 17:29:17+00:00,623298279,"Half of #HongKong restaurants still unprepared for Covid-19 vaccine pass scheme, worry about being penalised, industry leaders sayhttps://t.co/ay985NRqKG https://t.co/jyeGY5zvv7",en
2022-02-21 17:29:05+00:00,178518155,A Covid-19 vaccine was discovered within one year. What is now taking Mai Mala Buni almost two years to plan an ordinary party convention? When has organizing a convention now turn to rocket science?,en
2022-02-21 17:28:04+00:00,1547446278,"COVID-19 vaccines and treatment ： We must have raw data, nowhttps://t.co/Y8HskVLGxy",en
2022-02-21 17:26:02+00:00,85458041,COVID-19 hospitalizations at Asante have increased slightly since yesterday. Please continue to take precautions to slow the spread. Vaccines help prevent hospitalizations and deaths.Get vaccinated: https://t.co/ciqASA65hsGet tested: https://t.co/SiluILLaxT#healthcare https://t.co/5TBcSc2Mm9,en
2022-02-21 17:25:37+00:00,145659842,"Covid-19 vaccines have been highly effective and very safe, but for a small minority the side effects have been serious, leaving governments grappling with how to handle hundreds of injury claims via ⁦@jennystrasburg⁩  https://t.co/HTfYQnc8jX",en
2022-02-21 17:25:02+00:00,1239408727431643137,"The Pfizer BioNTech COVID-19 vaccine is fully FDA-approved for everyone 16 years and older, while the Moderna COVID-19 vaccine is fully FDA-approved for everyone 18 years and older.Visit the link below to find a FREE vaccine clinic near you.https://t.co/18DBbgTnKl https://t.co/gJfrbuSDF9",en
2022-02-21 17:24:18+00:00,21186044,"Manchester🔊If you haven't had your COVID-19 vaccines already, it is not too late.Stay protected by visiting one of our walk-in centres, or by booking an appointment online at https://t.co/OHISkEc9Qf ◀ https://t.co/QVCgYBjTY6",en
2022-02-21 17:24:10+00:00,897918778012454912,Cumulative COVID-19 vaccine does administered in India cross 175.78 crore https://t.co/ObbGA6mFVi,en
2022-02-21 17:23:57+00:00,1489310625696305156,Ensuring equitable access to #Covid_19  vaccines a pressing task for #G20   https://t.co/Tqi1qjArWQ,en
2022-02-21 17:23:05+00:00,562737335,"Not long now until our online Q&amp;A for parents and carers of 12-15-year-olds.Do you have a question about the COVID-19 vaccine you want to ask to our panel of health professionals before consenting to your child having the vaccine? If so, join us at 6pm 👉https://t.co/G3HrHl1rhM https://t.co/KAWnTHNg8l",en
2022-02-21 17:22:49+00:00,350317017,The protesters wanted an end to cross-border COVID-19 vaccine mandates for #TruckDrivers(LIES: &gt; ) but the blockade turned into a demonstration against Trudeau &amp; Liberal government https://t.co/YTPYqlZPBv,en
2022-02-21 17:22:42+00:00,2681209558,"Had the vaccine twice, had the booster back in December, caught covid over an week ago and I’m getting treatments for my lungs (found tiny blood clots) and that is thanks to covid-19…but naaah “iS jUsT a fLu”",en
2022-02-21 17:22:38+00:00,1402931368938684419,Psst... The Covid-19 Vaccines cause AIDS... Pass it on... https://t.co/QfIrzYWb7Y,en
2022-02-21 17:21:44+00:00,895693223368081408,@zanfr @Gab_H_R @Loor_____ That is why omicron is a vaccine but Covid-19 is not?? They are one and the same so talk you theory elsewhere,en
2022-02-21 17:21:13+00:00,850527333165420546,"Getting the COVID-19 vaccine?This is what you need to know before, during and after.  https://t.co/FcrAu4gdfw",en
2022-02-21 17:21:00+00:00,803962240999243776,Effectiveness of Maternal Vaccination with mRNA COVID-19 Vaccine During Pregnancy Against COVID-19 https://t.co/xDIIbTtKQH via @CDCgov,en
2022-02-21 17:19:48+00:00,722873435894906880,"As of Monday, Feb. 21, 2022, Med Center Health has 29 COVID-19 hospitalizations. 52% of these are unvaccinated. If you are able, please go and get vaccinated or get your booster. Walk-ins welcome at the Med Center Health COVID-19 Vaccine from 12-5pm. ▶️ https://t.co/taG5NUNvU0 https://t.co/BBIu4zGE5D",en
2022-02-21 17:19:15+00:00,1220898395608342529,@NBCNews @NBCNewsTHINK I don't see how Covid-19 will effect anything. The crying adults who are acting like children over mask wearing won't no mask mandates and no Covid-19 Vaccine mandate's. The US is bending to the will of these spoiled adult children giving them a national no mask Mandate not good.,en
2022-02-21 17:18:49+00:00,1174335540130279425,"The emergency use authorisation to #COVID19 #vaccine #Corbevax for the 12-18 age group will further strengthen India's fight against Covid-19, Union Health Minister #MansukhMandaviya said on Monday.#Corbevaxvaccine https://t.co/qI89TbfeCE",en
2022-02-21 17:18:22+00:00,1179521676,A strategic partnership will enable South African Aspen to increase production capacity to meet the rising demands for COVID-19 vaccines in Africa. Co-financed by funds from the develoPPP program of the German Government.https://t.co/pWcqtI0XBl,en
2022-02-21 17:16:28+00:00,976948534053343233,"In an embrace of the pseudoscientific theory of “herd immunity,” billionaire Bill Gates, told the world’s preeminent military affairs conference that mass infection with the Omicron variant was a “type of vaccine” against COVID-19.https://t.co/Pf1Bd4hKgP",en
2022-02-21 17:16:17+00:00,31325104,"COVID-19 vaccines during pregnancy can protect babies after they're born and lead to fewer hospitalized infants, a recent U.S. government study suggests https://t.co/IPeAGb0Wnc",en
2022-02-21 17:15:50+00:00,1461752897947852801,"Biological E Limited's Corbevax vaccine, India's first indigenously developed Receptor Binding Domain (RBD) Protein sub-unit vaccine against #COVID-19, has received emergency use authorisation (EUA) from India's drug regulator for the 12 to 18-year age group: Biological E Limited",en
2022-02-21 17:15:48+00:00,156598109,"@romeojudy11 @heheboi69420190 @sailorrooscout What do you mean ""such little testing and data?""Every pharmaceutical company threw billions of dollars into COVID vaccine research for a whole year. mRNA vaccine tech was in dev for 10 years prior. Dozens of COVID-19 vaccine candidates were eliminated because of inefficacy",en
2022-02-21 17:15:14+00:00,236770150,Italy recommends fourth COVID-19 vaccine dose for immunocompromised https://t.co/5Jy2WAdW6S #Health https://t.co/eQQT8822Zi #news 365,en
2022-02-21 17:15:11+00:00,1421101459870044161,🇳🇿 New Zealand’s praised zero covid approach is faltering in the face of variants. And its shift to endemic acceptance and vaccine strategy ignores the risk to its indigenous population.How New Zealand’s covid-19 strategy failed Māori people  https://t.co/IXTzTfymZy,en
2022-02-21 17:15:02+00:00,1334918783316713477,"Free Covid-19 Testing, Vaccine &amp; Booster Clinic! No appointment necessary! #covid19 #testing #booster #vaccination #vaccinationclinic #westvirginia https://t.co/BspA5PABwi",en
2022-02-21 17:14:06+00:00,17545687,UNC Mobile Health is offering COVID-19 vaccines and Flu shots in your neighborhood! Appointments are recommended but not required. @CityofDurhamNC @RaleighGov #Raleigh #Durham #UNCMobileHealthGet the latest UNC Mobile Health info &amp; register:https://t.co/qnzYzMKqHd https://t.co/tyyXEqQxcm,en
2022-02-21 17:14:03+00:00,135522601,"Covid-19 in Africa: 'The doses are here, but vaccine hesitancy remains high' https://t.co/XI2ZfxzWEM https://t.co/X5G5P1Ahr4",en
2022-02-21 17:13:43+00:00,180577571,FDA Delays Review of COVID-19 Vaccine for Children Under 5 Years Old https://t.co/aC8Nhl3bDM,en
2022-02-21 17:13:34+00:00,1487074054473408513,@Govhopeuzodinma @MBuhari @OfficialAPCNg @oshiomoleadams @vokaldigital @ImoGovernor @realRochas @ibekweofficial Sir please why some health center in owerri collecting money before giving out the covid 19 vaccines,en
2022-02-21 17:12:17+00:00,289118612,DON’T PITY THE FOOLAnti-vaccine Christian broadcaster Marcus Lamb dies at age 64 after contracting Covid-19. https://t.co/7Ur0zsZ1NZ 01,en
2022-02-21 17:11:45+00:00,398011083,"@MissusZumwalt @60Minutes We still have people that believe the earth is flat, the moon landings were faked, and the covid 19 vaccines have microchips in them from Bill Gates.There are people that will believe literally anything.",en
2022-02-21 17:10:04+00:00,10032502,"We are under 100 for the first time since August! Here is an overview of our hospitalized COVID-19 patients as of Feb-22. For the safety of yourself and others, get your vaccine and booster: https://t.co/h6Ta1w4nwC https://t.co/1py34XI8Ak",en
2022-02-21 17:10:00+00:00,19347202,"Vaccination against SARS-CoV-2 appears to protect people with IBD from the more serious consequences of breakthrough COVID-19 infections, but results fluctuate based on which vaccine was received. https://t.co/I9QkbUNkkA",en
2022-02-21 17:09:18+00:00,2204994903,@barbara_kuks @PieterBz WH0 official website for side effects of all waxes is vigiaccess dot org. One has to type in exactly this: covid-19 vaccine to see side effects. “Death” is  classified under “general disorders”. I mean what the heck? Heavy censorship &amp; MSM doesn’t tell anyone about it. Shameful.,en
2022-02-21 17:09:12+00:00,1384174991533436929,@lhhgfr Yay that’s nice! My day was quiet good. Today I got the third dose of the Covid-19 vaccine :) I’m about to sleep now,en
2022-02-21 17:08:47+00:00,1483562284697882628,"@CBCNews Yet our premier doug ford and many scientists say ""whether 1 dose or 10 doses"" the vaccine does not stop the spread of covid-19 or catching it. FACT! the vaccine is also in clinical trials untill 2023. So stop trying to use us as test subjects. Use rats or monkeys",en
2022-02-21 17:08:18+00:00,1192486093666635779,The Uncertainty of Black Pregnant Women and COVID-19 Vaccines https://t.co/e9oEsPIFzF via @medcarebloggers,en
2022-02-21 17:07:31+00:00,442087763,"The US military has approved religious exemptions to its Covid-19 vaccine mandate for 15 service members out of approximately 16,000 requests, according to the latest data from the services. https://t.co/v7V8n1ZJPZ",en
2022-02-21 17:07:00+00:00,1228901384566652928,No data supports this. This death vaxx business continues on ... no investigation...no reporting on side effects and deaths....doctors and nurses that speak out are silenced...Evil agenda.FDA is considering FOURTH dose of COVID-19 vaccine..... https://t.co/ExZ6h1jNzm,en
2022-02-21 17:06:56+00:00,823933695212056576,Read more research about COVID-19 vaccines in pregnancy in our latest Bulletin 44 for #Covid19 vaccination programme. Read it: https://t.co/o1OZPQrI5B #ForUsAll https://t.co/7cefkYcX8X,en
2022-02-21 17:06:37+00:00,224261953,A personal view: I’ve read the full ‘Living with Covid’ 19 document. It is of no help to me whatsoever as a disabled person. It basically says get a vaccine and an antiviral and get on with it. Where is the wider support needed to address the additional inequalities?,en
2022-02-21 17:05:56+00:00,2865144777,"New, not yet peer-reviewed research has found that a subvariant of Omicron, called BA.2 or “stealth Omicron,” doesn’t just spread faster; it may also be more dangerous and able to bypass currently available COVID-19 vaccines.",en
2022-02-21 17:04:20+00:00,1484420527825768451,New Delhi: The Drugs Controller General of India (DCGI) on Monday granted emergency use approval to Biological E's Covid-19 vaccine 'Corbevax' for inoculating adolescents aged 12-18 years.https://t.co/PBKrIipFDR,en
2022-02-21 17:04:13+00:00,2926418704,"COVID-19 Update: Novavax EUA Expected, Toddler Vaccine Delay  | BioSpace https://t.co/7AMaZTaCf8 #jobs",en
2022-02-21 17:03:43+00:00,83815756,The Welsh Government have confirmed that a fourth dose of the COVID 19 vaccine will be offered in the spring to• Adults 75+• Residents in a care home for older adults• People 12+ who are immunosuppressedIt comes after the JCVI's latest review of the vaccination programme https://t.co/mUMSi02RqR,en
2022-02-21 17:03:29+00:00,249567266,The Welsh Government have confirmed that a fourth dose of the COVID 19 vaccine will be offered in the spring to• Adults 75+• Residents in a care home for older adults• People 12+ who are immunosuppressedIt comes after the JCVI's latest review of the vaccination programme https://t.co/nKyebGl8qy,en
2022-02-21 17:03:29+00:00,898536559057793024,@AnthonyeAnt @dat_hammer @NathDolan A study2 of covid-19 transmission within English households using data gathered in 2021 found even a single dose of a covid-19 vaccine reduced the likelihood of household transmission by 40-50%. supported by a study of household transmission among Scottish healthcare workers,en
2022-02-21 17:03:06+00:00,2774403890,"We’re is offering free vaccination clinics each week on Wednesdays from 1-3 p.m. and on Thursdays from 9-11 a.m. You can receive a booster or an initial dose of COVID-19 vaccine, call 319-273-2100 to schedule an appointment. ☎️",en
2022-02-21 17:02:59+00:00,1280670913848057856,"The U.S. leads the world in COVID-19 deaths by a wide margin. We are also the most tested and most vaccinated. Huh? China has 1.4 billion people, has not given out any MNRA vaccines, and hardly has any COVID deaths by comparison. We are committing mass suicide.",en
2022-02-21 17:02:55+00:00,2840267787,JCVI advises a spring COVID-19 vaccine dose for the most vulnerable - https://t.co/5wsWyn33f5 https://t.co/aDLkJw3qSB,en
2022-02-21 17:02:44+00:00,1487074054473408513,Sir pleas why is some health centre in IMO state collecting money before give citizens the covid 19 vaccines,en
2022-02-21 17:02:22+00:00,326932611,An additional booster dose will be offered to all adults over-75 and the most vulnerable over-12s in the UK this spring. The UK's vaccines advisers said an extra dose would help top up their protection against severe Covid-19.https://t.co/wCKoWqhe44,en
2022-02-21 17:02:14+00:00,192389493,"While the UK moves to ""living with"" COVID-19, this pandemic is far from over, most especially in low income countries where only 1 in 8 people have received their first vaccine - @BBCPanorama tells the story this evening:",en
2022-02-21 17:02:13+00:00,21838529,via ⁦@nytimes⁩ Some really welcome news on the Covid 19 vaccine front.  https://t.co/PN1i5iGOkD,en
2022-02-21 17:02:00+00:00,153075877,"Your VA care team can respond to your COVID-19 vaccine questions • If I have an underlying condition, should I get it?• What if I am pregnant or breastfeeding?• What if I’ve had allergic reactions to other meds?Find out more: https://t.co/eIvER7RDT2 https://t.co/zx0VNd5CkO",en
2022-02-21 17:01:50+00:00,1451916853,"The COVID-19 vaccine is the best way to protect yourself, friends and family from the virus. https://t.co/39YHHgrnUG",en
2022-02-21 17:01:41+00:00,140077855,"Got questions about the COVID-19 vaccine &amp; fertility? On Tuesday 22nd Feb at 4-5pm, we’re hosting an information &amp; Q&amp;A session to discuss reproductive health &amp; the vaccine. You can register ahead 👉 https://t.co/aSTvpOoajg or join us on this link 👉 https://t.co/g3bvjn83aD https://t.co/aJSzpCgEbt",en
2022-02-21 17:01:41+00:00,125595021,"Got questions about the COVID-19 vaccine &amp; fertility? On Tuesday 22nd Feb at 4-5pm, we’re hosting an information &amp; Q&amp;A session to discuss reproductive health &amp; the vaccine. You can register ahead 👉 https://t.co/5U9ZrpGQ9P or join us on this link 👉 https://t.co/HFhsvzvniD https://t.co/rywDp82Bs3",en
2022-02-21 17:01:41+00:00,123574840,"Got questions about the COVID-19 vaccine &amp; fertility? On Tuesday 22nd Feb at 4-5pm, we’re hosting an information &amp; Q&amp;A session to discuss reproductive health &amp; the vaccine. You can register ahead 👉 https://t.co/cgdyfTspo8 or join us on this link 👉 https://t.co/CzERtjluJY https://t.co/uE2xR8FU86",en
2022-02-21 17:01:41+00:00,562087684,"Got questions about the COVID-19 vaccine &amp; fertility? On Tuesday 22nd Feb at 4-5pm, we’re hosting an information &amp; Q&amp;A session to discuss reproductive health &amp; the vaccine. You can register ahead 👉 https://t.co/QWICV2UwbD or join us on this link 👉 https://t.co/tUbitfUIXe https://t.co/44uuK57XU6",en
2022-02-21 17:01:00+00:00,1178733287990267904,"Looking to test your knowledge on the COVID-19 vaccines? The 'Students Igniting Vaccine Confidence Program in Windsor Essex' has created a fun quiz for you to do just that: https://t.co/J5TZItOP5R. For more COVID-19 information, visit our resource hub: https://t.co/LqM5CLfovp https://t.co/cqRxdJA9tX",en
2022-02-21 17:01:00+00:00,702855675,Some people report getting bills for COVID-19 vaccines and home test kits https://t.co/jIebEmHeRp,en
2022-02-21 17:00:42+00:00,2471005879,"We understand that there can be some confusion surrounding the COVID-19 vaccine, so we want to address some of the frequently asked questions we receive in the office. 💉For more information about the COVID-19 vaccine, visit the link below. ⬇️https://t.co/g6lsKnCOwh https://t.co/gAey03D6aR",en
2022-02-21 17:00:40+00:00,428887166,The COVID-19 vaccines offer the best protection for pregnant women and their babies. You can get the vaccine at any point during your pregnancy. https://t.co/OmCR9HmuqB,en
2022-02-21 17:00:38+00:00,3037075484,"Join the Family Health Centers, Inc. this Saturday, February 26, 2022 from 9am-1:00pm for our Covid-19 Vaccine Event. 3310 Magnolia St. #CancelCovid https://t.co/o5r24RQkQ0",en
2022-02-21 17:00:36+00:00,2890689197,#Watch SNOMED Webinar -   Supporting COVID-19 vaccine certificate initiatives: SNOMED International involvement in global efforts.Click here: https://t.co/hQ62ANX99P#eHealth4all @SnomedCT @IrelandSnomed @jcwemyss @Mark_Bagnell @loretto_grogan https://t.co/BM7HgEPyDs,en
2022-02-21 17:00:33+00:00,3099154459,EXPLAINED: When and how will Italy offer a fourth Covid-19 vaccine dose? https://t.co/EhvyBi2dVl https://t.co/WZ96wWEVrO,en
2022-02-21 17:00:31+00:00,204748499,"🆕💥Systematic Review&amp; Meta-AnalysisThe risk of immediate allergic reactions,severe immediate reactions or anaphylaxis associated w a second dose of an mRNA COVID-19 vaccine was low among those experienced an immediate allergic reaction to their 1st dosehttps://t.co/lAuDSp7HLc",en
2022-02-21 17:00:18+00:00,562152771,"Got questions about the COVID-19 vaccine &amp; fertility? On Tuesday 22nd Feb at 4-5pm, we’re hosting an information &amp; Q&amp;A session to discuss reproductive health &amp; the vaccine. You can register ahead 👉 https://t.co/O3g2vlPXrl or join us on this link 👉 https://t.co/DmF5vk7K8G https://t.co/UtFNAoZuIl",en
2022-02-21 17:00:18+00:00,52351492,"Got questions about the COVID-19 vaccine &amp; fertility? On Tuesday 22nd Feb at 4-5pm, we’re hosting an information &amp; Q&amp;A session to discuss reproductive health &amp; the vaccine. You can register ahead 👉 https://t.co/6skVqm0rv6 or join us on this link 👉 https://t.co/4HtdiVHZH9 https://t.co/OkY5zlJDce",en
2022-02-21 17:00:18+00:00,562067020,"Got questions about the COVID-19 vaccine &amp; fertility? On Tuesday 22nd Feb at 4-5pm, we’re hosting an information &amp; Q&amp;A session to discuss reproductive health &amp; the vaccine. You can register ahead 👉 https://t.co/gax8o9fxD6 or join us on this link 👉 https://t.co/ElOSLnDmv2 https://t.co/WxK87diFrH",en
2022-02-21 17:00:08+00:00,934923079041605633,Bone repair from Covid-19 vaccine technology #theScienceHour https://t.co/NmjZThZLmb via @PodcastAddict,en
2022-02-21 17:00:05+00:00,407087874,"Do you have questions about the COVID-19 vaccines? Check out The Conversation #BetweenUsAboutUs with Doctors, nurses and community health workers who have answers! https://t.co/OeCSKVLw5B#FVvaccineoutreach https://t.co/KoVoXQAywK",en
2022-02-21 17:00:04+00:00,2363670784,Autopsy Histopathologic Cardiac Findings in Two Adolescents Following the Second COVID-19 Vaccine Dose https://t.co/aNDUaUR5m5,en
2022-02-21 17:00:02+00:00,245777874,Covid-19 booster vaccines have been approved for children aged between 12 and 15.https://t.co/jkkuRBL6v3,en
2022-02-21 17:00:02+00:00,17213774,.@LANationalGuard will be on campus weekdays from 10 a.m. to 3 p.m for COVID-19 testing and vaccines in Shaver Gymnasuim. This clinic is free and open to the public.,en
2022-02-21 17:00:02+00:00,1422779090898145287,Do I still need the vaccine if I already had COVID-19 before? https://t.co/TASpvys2Rp,en
2022-02-21 16:59:43+00:00,4423439899,Get your COVID-19 vaccine or booster dose at one of the State's walk-in mobile clinic locations! Booster doses for 12-15 now available. Visit https://t.co/jOWX96V8hK for the most updated map. Go to https://t.co/U3p6uW8ryD for other vaccine locations in the state. #vaccinateNH https://t.co/IYLQxqThY3,en
