date,userid,tweet,lang
2022-07-24 18:48:56+00:00,1411090147072937985,"VAERS data released Friday by the Centers for Disease Control and Prevention show 1,350,950 reports of adverse events from all age groups following COVID-19 vaccines, including 29,635 deaths and 246,676 serious injuries between Dec. 14, 2020, and July 15, 2022.MSM   Not a word.",en
2022-07-24 18:47:42+00:00,718389989,"Washington, DC Child COVID-19 Vaccine Mandate Illegal: Legal Expert https://t.co/gqLC0hgCRR",en
2022-07-24 18:47:36+00:00,2775725501,Adverse effects of COVID-19 vaccines and measures to prevent them - PubMed https://t.co/VetRCLH3E2,en
2022-07-24 18:47:22+00:00,242618658,Trump beat #Covid_19 before there was a vaccine. Biden is popping in his pants with it after he got 4 doses of Trump's vaccines.,en
2022-07-24 18:46:12+00:00,1214209408751685632,"@gavi @ConversationUK Gavi, the Profit Alliance Why has the so called safe &amp; effective COVID-19 (toxic injections) vaccines resulted in serious injury &amp; death?",en
2022-07-24 18:45:59+00:00,1428445406241951755,"@AndrewR70528002 @notAllenFunt @v4victoriously @BushyTail215 @POTUS No, it’s accurately stating the FDA-provided information. You’re just not understanding. The Pfizer covid vaccine has 2 names: 1) “COMIRNATY” which is both licensed and EUA-authorized depending on series, and 2) “Pfizer-BioNTech Covid-19 Vaccine” which is only EUA-authorized",en
2022-07-24 18:45:54+00:00,1323154146892001280,COVID-19: Over 194 crore 17 lakh vaccine Dozes provided to States/UTs so far 👇https://t.co/UusMheKri7,en
2022-07-24 18:44:42+00:00,500334056,"Continued; if you want to take the vaccine for the Covid-19 viruses also, and lets go Brandon🙂😆😂🤣👏🏻👌🏻👌🏻👊🏻👊🏻👍🏻👍🏻🦅🇺🇸💯, and I support the people’s convoy, and those truckers in Canada who are or were protesting the vaccine mandate, and; continued.",en
2022-07-24 18:43:28+00:00,785527176,@FreemanGoodnigh You mean to tell me that you think you have pure white man blood because you haven’t had the Covid 19 vaccine 😂😂😂😂😂😂😂😂😂😂😂😂😂 or are you trying to avoid you are a nazi?,en
2022-07-24 18:42:32+00:00,637302720,"Birx now Says COVID-19 Vaccines Were Never ‘Going to Protect Against Infection’; this malfeasant said prior to get you to take the vaccine ""This is one of the most highly-effective vaccines we have"".. https://t.co/sb0gAJlGif",en
2022-07-24 18:42:23+00:00,1299486303319457792,"The former POTUS would've had done better. I'm not a fan, but he was VERY, VERY successful at getting out the COVID-19 vaccine. Time to get the Operation Warp Speed crew back together. Two children diagnosed with monkeypox in US, officials say https://t.co/v4dFpzBqjg via @nypost",en
2022-07-24 18:37:52+00:00,50707051,Distorting truth—Birx Says COVID-19 Vaccines Were Never ‘Going to Protect Against Infection’https://t.co/IGwtGwLge2,en
2022-07-24 18:37:39+00:00,545632388,"#DeborahBirx was the White House Coronavirus Response Coordinator. To hear her say that they knew the COVID-19 vaccines were not going to protect against infection, and that they overplayed, it is wild to me.",en
2022-07-24 18:37:30+00:00,1297606518133727235,"Birx Admits She Knew COVID-19 Vaccines Were Never ""Going To Protect Against Infection""Biden 1 yr ago: ""you're NOT going to get COVID if you have these vaccines... If you’re vaccinated, you’re NOT going to be hospitalized... you’re NOT going to die""https://t.co/SQj5KcLkgY",en
2022-07-24 18:36:32+00:00,2485567418,"Birx Admits She Knew COVID-19 Vaccines Were Never ""Going To Protect Against Infection"" | ZeroHedge #Despicable #Lies #Traitors #NoConfidence #NoTrust #NoDecency #NoShame #Vaccines  https://t.co/VSH5ZdVsSo",en
2022-07-24 18:35:17+00:00,945354510,"Birx wie Fauci wie Drosten oder Lauterbach Birx Admits She Knew COVID-19 Vaccines Were Never ""Going To Protect Against Infection"" | ZeroHedge https://t.co/v46veca4Mj",en
2022-07-24 18:34:47+00:00,1519727197665185793,Dr. Birx ADMITS She &amp;apos;Knew&amp;apos; COVID-19 Vaccines &amp;apos;Were Not Going to Protect Against Infection&amp;apos; https://t.co/n2LFM3LGXp,en
2022-07-24 18:34:33+00:00,41828534,"China says Xi Jinping and other leaders have been given domestic Covid-19 vaccines, amid public concern over safety https://t.co/me4ju9QLiM",en
2022-07-24 18:34:33+00:00,1508285741440323584,"China says Xi Jinping and other leaders have been given domestic Covid-19 vaccines, amid public concern over safety: Chinese President Xi Jinping and other leaders in the country have been given domestic Covid-19… https://t.co/C1LOGN1cJr yeager #world #michaelangelo #tristan",en
2022-07-24 18:34:20+00:00,1526485509555601420,"@I_Like_Lifting @DrJamesOlsson This is according to your CDC:You must be fully vaccinated with the primary series of an accepted COVID-19 vaccine to travel to the United States by plane if you are not a U.S. citizen, U.S. national, lawful permanent resident.FACT: VACCINES SAVE LIVES. PERIOD.",en
2022-07-24 18:32:47+00:00,1303790925945229316,China says Xi Jinping and other leaders have been given domestic Covid-19 vaccines https://t.co/aPworJ4ToS,en
2022-07-24 18:32:38+00:00,3286213656,"COVID-19 AMA: CDC approves Novavax vaccine, which uses traditional technology. – UCI News https://t.co/cVgscyzBe8",en
2022-07-24 18:32:05+00:00,2485432718,"For those MLB players who rejected the COVID-19 vaccine due to health concerns, personal choice, religious grounds, etc., they need to be respected, not chastised. There is news daily on the increased risks of the vaccine, especially if one wants to start a family, etc.",en
2022-07-24 18:31:34+00:00,29341680,"@mgubrud @FSchnerbert @SKMorefield Per CDC, “94% effective against symptomatic Covid - 19. Bar set by CDC and Pfizer/Moderna. Embellishment or knowing misrepresentation. Prior to Covid, all efforts to produce commercially viable vaccine against coronaviruses failed because the limited protection waned too quickly. https://t.co/8f32O9Kwid",en
2022-07-24 18:28:02+00:00,47441125,"Despite revealed lies, the vaxx until you die game plan never changes.  Maybe not about health??? Birx Admits She Knew COVID-19 Vaccines Were Never ""Going To Protect Against Infection"" | ZeroHedge https://t.co/VjKNfx0UPi",en
2022-07-24 18:26:49+00:00,744920580420362241,"@RonFilipkowski While your resignation letter reeks of self-righteousness condemning the DeSantis Covid-19 policies, it lacks science.  I suggest you catch up on the facts as presented by world renowned leading experts on Covid-19 and the MRNA vaccines:  Dr Peter McCullough and Dr Robert Malone",en
2022-07-24 18:26:06+00:00,523746170,Accountability? Yeah right.#Covid_19  #vaccine #vaccineinjuries @realDrBirx https://t.co/H5TSRVAjOc,en
2022-07-24 18:25:59+00:00,1520533885955756038,COVID-19 VAX used to reduce the risk of getting COVID-19 does not treat COVID-19. *********There is no FDA-approved vaccine to prevent COVID-19. ********** The FDA has authorized the emergency use of this vaccine during the COVID-19 pandemic.https://t.co/QaujsxNzCY,en
2022-07-24 18:24:00+00:00,108689047,"Many children in Gr 7-12 haven't received their vaccines for Meningococcal Disease, Hepatitis B, and/or HPV due to the ongoing COVID-19 pandemic. @TheWECHU is holding catch-up clinics throughout our area. Meningococcal vax is required to attend school. Book an appointment soon! https://t.co/HZLwGkwqRb",en
2022-07-24 18:23:46+00:00,1169813564695162880,"@MikeDro_ Yo the bot who posted 18,000 tweets in 1 year, can you tell me the survival rate of Covid-19 and tell me if its rushed vaccine stops transmission?",en
2022-07-24 18:22:35+00:00,123199183,Unvaccinated people are around 10 times more likely to get seriously ill with COVID-19 than people who have been vaccinated. Get all vaccine doses recommended to you as soon as you can. Your health is precious.#covidbooster #covid19vacccine💉 #covid19prevention https://t.co/PGsP1AWlQE,en
2022-07-24 18:22:13+00:00,185335312,"@christinemtoye Hello Christine, and thank you very much for your continued support. Donors who receive the COVID-19 vaccine do not require a wait or deferral period. We look forward to seeing you Thursday. Together, we are Canada's Lifeline! ^MM",en
2022-07-24 18:22:05+00:00,1395857490911404032,Unvaccinated people are around 10 times more likely to get seriously ill with COVID-19 than people who have been vaccinated. Get all vaccine doses recommended to you as soon as you can. Your health is precious.#covidbooster #covid19vacccine💉 #covid19prevention https://t.co/XJyv16d0rF,en
2022-07-24 18:21:36+00:00,419111219,A new study sheds light on the most effective COVID-19 vaccines during pregnancy and the ideal timing for vaccinationshttps://t.co/u858MvhVRA https://t.co/YBj7StMoyI,en
2022-07-24 18:21:30+00:00,1434866380873023488,@nexus1111 @LouiseCulmer1 @JohnShakallis @johnandpol We have world class vaccines and treatments for covid-19 right??? So why do we still have to be scared? Unless your anti vaxxer who doesn’t believe the vaccine works?,en
2022-07-24 18:20:40+00:00,1728918818,"China says Xi Jinping and other leaders have been given domestic Covid-19 vaccines, amid public concern over safety https://t.co/iVkxMqudE3 https://t.co/wzQDxOfyPi",en
2022-07-24 18:20:40+00:00,231924026,"https://t.co/OSFAUzKsW2 Prior #Covid_19 infection clearly increases risk of #vaccines SAEs. As natural immunity trumps vaccine immunity, mass vaccination increases risk of harm in low risk groups. This is unjustifiable and murder for profit.",en
2022-07-24 18:19:10+00:00,2230383211,"@LGBFJB19 “You must be fully vaccinated with the primary series of an accepted COVID-19 vaccine to travel to the United States by plane if you are a non-U.S. citizen, non-U.S. immigrant.” https://t.co/IdRGBSdPwl",en
2022-07-24 18:18:55+00:00,50707051,US Army Has Approved Only 20 Permanent Religious COVID-19 Vaccine Exemptionshttps://t.co/AAX7ZwZXm6,en
2022-07-24 18:16:16+00:00,1450347992775467011,@CarymaRules What if these people are actually mentally ill as a result of infection with Covid-19? What if that vaccine they protested against could have actually prevented this?,en
2022-07-24 18:15:00+00:00,1428445406241951755,@AndrewR70528002 @notAllenFunt @v4victoriously @BushyTail215 @POTUS Where in the EUA issuance do they say the EUA for “Pfizer-BioNTech Covid-19 Vaccine” stops at age 16?,en
2022-07-24 18:13:54+00:00,21929652,"@DavidFoyCalgary @RobertFife Conservative reaction to left wing authoritarian""Results show that LWA predicts higher vaccine acceptance and support for COVID-19 vaccine mandates and the punishment of unvaccinated individuals, whereas libertarianism and RWA show negative relationships""https://t.co/yN347gMH06 https://t.co/yd5qgXkVTG",en
2022-07-24 18:11:55+00:00,1260148815161688067,Novavax: Everything You Should Know About the Newest COVID-19 Vaccine https://t.co/RH41MyO38E,en
2022-07-24 18:11:40+00:00,107547335,Novavax: Everything You Should Know About the Newest COVID-19 Vaccine     - CNET https://t.co/FMgnzP3QAq,en
2022-07-24 18:11:38+00:00,800829309539799041,Government causing more #Addiction from their brainwashing. 👍#Vaccines making compliant 🐒🐒🐒. #MonkeyPox &gt; #Covid_19 🤡🌎🌍,en
2022-07-24 18:11:09+00:00,52245541,Novavax: Everything You Should Know About the Newest COVID-19 Vaccine https://t.co/tnAL0lOxbN,en
2022-07-24 18:10:01+00:00,1129992914,****Alert*****If you got your covid 19 vaccine after july 2021 contact me directly. You could be eligible to be paid! There is NOT unlimited funds so do not wait too long https://t.co/8m3f21hpdJ,en
2022-07-24 18:09:12+00:00,1544749530364710915,As I tweeted to @MonicaLewinsky Trump-DARPA-Pfizer COVID-19 vaccine meant a money grab.,en
2022-07-24 18:07:17+00:00,1544749530364710915,@MonicaLewinsky Trump-DARPA-Pfizer means COVID-19 vaccine money grab.,en
2022-07-24 18:06:49+00:00,3294121171,"@astroterf “I knew these vaccines were not going to protect against infection. And I think we overplayed the vaccines."" ” Birx, the White House COVID-19 response coordinatorhttps://t.co/hcjP30BeYD",en
2022-07-24 18:06:21+00:00,15674417,"@4mcadam The COVID-19 vaccines work VERY WELL in preparing the immune system to fight the virus. Those w severe infections after vaccination had multiple comorbidities---age, obesity, diabetes. So vaccination remains essential Make sense? https://t.co/k7wSfVjzgP",en
2022-07-24 18:04:26+00:00,3294121171,"@Truth_DangerD “I knew these vaccines were not going to protect against infection. And I think we overplayed the vaccines. ” Birx, the White House COVID-19 response coordinatorhttps://t.co/hcjP30BeYD",en
2022-07-24 18:03:16+00:00,369379594,NEW: Children eligible to receive the COVID-19 vaccine and reduced O-Train service: Five stories to watch in Ottawa this week  #ottnews https://t.co/FoROChOTfC,en
2022-07-24 18:03:13+00:00,21212604,NEW: Children eligible to receive the COVID-19 vaccine and reduced O-Train service: Five stories to watch in Ottawa this week  #ottnews https://t.co/UsIrUPH0X1,en
2022-07-24 18:02:59+00:00,213838211,"We could do more at moderate cost to lower the chance of infection. But, the vaccine makers have hugh profits, eh. Just saying. #Covid_19",en
2022-07-24 18:01:27+00:00,3301919605,"Children ages 6 months and up are now eligible to receive COVID-19 vaccines. Do your part to keep yourself, your families and our community healthy! Sign up today at: https://t.co/sYGGjpGkEl https://t.co/lq1ipl2KVo",en
2022-07-24 18:01:20+00:00,1920454891,"COVID-19 vaccine clinics and appointments are continuously being added across our region – right into the fall months!  Book your shots, including both your 1st and 2nd boosters as soon as you are eligible. https://t.co/X07dsA9S7Z https://t.co/lLAFiQnpUS",en
2022-07-24 18:01:19+00:00,814954441971482624,"Got questions about the COVID-19 vaccines and your child? Earlier this week, we teamed up with @nycHealthy and @NYCHealthSystem for this town hall on vaccines for kids.ICYMI - check out the recording here: https://t.co/3n1dPSjynz(all info is accurate as of 7/19/22)",en
2022-07-24 18:01:05+00:00,270482245,"Everyone 12+ should get a COVID-19 booster (regardless of how many previous doses). Boosters should be 6 months apart, or after COVID vaccine, or 3 months after having COVID. Boosters can be 3 months apart if required - for reasons such as travel, etc. https://t.co/0jqQH6eobg https://t.co/aPSidyKlNS",en
2022-07-24 18:00:38+00:00,750607340,Don't forget to listen to this week's 200th episode of The Sport Psych Show with Trevor Whyte @trevorwhyte7. Trevor is a Respiratory Therapist who lead a team administering COVID-19 vaccines during the pandemic.Listen here https://t.co/kPJoPTgqf5 https://t.co/r9EwsY6qYe,en
2022-07-24 17:59:31+00:00,38535418,"In case you missed it! The CDC recently announced that everyone 6 months and older is now eligible for a COVID-19 vaccine. Additionally, COVID-19 booster shots are encouraged for everyone ages 5 years and older. Learn more at: https://t.co/jpUe9on0dE. https://t.co/c6LuSsi6jp",en
2022-07-24 17:58:42+00:00,2611274225,Covid-19 vaccines are quite simply shit. Maskers are spoiling the rest of their lives.Made to be scared to comply.Fact check that.,en
2022-07-24 17:58:36+00:00,2352383732,Positive for Covid-19. No obvious symptoms or positive test until at least 3 days after exposure; stay safe out there!Maggie &amp; Evie are negative. Fever &amp; congestion are no joke; the headaches are debilitating. Vaccine gave me a test battle: hoping I’m back to normal soon!,en
2022-07-24 17:57:35+00:00,1356688414452699136,@EricTopol The Public Health authorities seem to be frozen stuck on one idea: mRNA vaccines &amp; acceptance of COVID-19 infections. I'm sure there are people that want to jump into action but those with power seem to be focused on shuffling paper only.,en
2022-07-24 17:57:05+00:00,13364222,"https://t.co/EAwdQgStNfAccording to European Med Agency, “frequent booster shots could adversely affect the immune response”Adverse effects of COVID-19 vaccines and measures to prevent them “immune function among vaccinated individuals 8mo. after ... two doses of COVID vaccine",en
2022-07-24 17:57:01+00:00,1520764519294849026,US Army Has Approved Only 20 Permanent Religious COVID-19 Vaccine Exemptions https://t.co/ZWtVdQItgc,en
2022-07-24 17:56:29+00:00,1279228962,Worried About Potential Covid-19 Vaccine Side Effects or Whether You Should Get Vaccinated at All? | Nature's Real Health https://t.co/rRqQ8YpZvz,en
2022-07-24 17:53:04+00:00,1461711209636540426,"@MclernonDylan @mikerobertrose @RachelNotley Except vaccines don’t prevent infection and therefore MIS-C…« Fifteen of the 21 were diagnosed as having COVID-19 despite vaccination, while 6 developed MIS-C for unknown reasons. »https://t.co/ifAU6wqBeg",en
2022-07-24 17:51:47+00:00,485132479,"https://t.co/gnn2GioJOZSorry if ppl are pissed  gotta call a spade a spade. ""The study showed that immune function among vaccinated individuals 8 months after the administration of two doses of COVID-19 vaccine was lower than that among the unvaccinated individuals."" @MdBreathe",en
2022-07-24 17:51:36+00:00,3191830017,Birx Says COVID-19 Vaccines Were Never ‘Going to Protect Against Infection’ https://t.co/6m66ajIJAD,en
2022-07-24 17:50:10+00:00,30862829,A new study sheds light on the most effective COVID-19 vaccines during pregnancy and the ideal timing for vaccinations https://t.co/i4oH9uF0sX,en
2022-07-24 17:49:36+00:00,719362796,United States Department of Health and Human Services: Petition to add all COVID-19 vaccines to the Vaccine Injury Compensation Program (VICP) - Sign the Petition! https://t.co/MovbiacgFf via @Change,en
2022-07-24 17:48:17+00:00,1435810249404043267,"‘She should have remorse, though. After all, what Birx is admitting to is knowing that vaccine mandates were pointless. How many thousands of people lost their jobs and livelihoods based on a known-false idea that the COVID-19 vaccines stopped the spread of the coronavirus?’",en
2022-07-24 17:48:15+00:00,113192040,"@peter_cappel @dgoold Eduardo Rodriguez and Alphonso Davies have entered the chat(In case that means nothing to you - both missed significant time due to myocarditis FROM COVID-19 infection, not the vaccine.)",en
2022-07-24 17:47:51+00:00,3294121171,"“I knew these vaccines were not going to protect against infection. And I think we overplayed the vaccines."" ” Birx, the White House COVID-19 response coordinatorhttps://t.co/hcjP30BeYD",en
2022-07-24 17:47:16+00:00,1496948176682729475,"China says Xi Jinping and other leaders have been given domestic Covid-19 vaccines, amid public concern over safety | CNN https://t.co/ycN7fIf2AH",en
2022-07-24 17:44:37+00:00,1422023460084084737,China says Xi Jinping and other leaders have received domestic Covid-19 vaccines amid public concerns about safety https://t.co/ExEVxxkWD1,en
2022-07-24 17:42:55+00:00,1104430556660535296,Biden &amp; many others are testing poitive for Covid 19 despite being Vaccinated. Are variants weaker now or are vaccines working to lessen illness ? https://t.co/QX5HLMg9Lv via @LinkedIn,en
2022-07-24 17:42:45+00:00,962688480731193345,🇨🇦 Canadian TikToker “Died Suddenly” One Month After Receiving Her Covid-19 Vaccine 💉 https://t.co/0RHEmM62MG,en
2022-07-24 17:42:29+00:00,1482246518447165441,China says Xi Jinping and other leaders have been given domestic Covid-19 vaccines https://t.co/zQPRvGGK1Y,en
2022-07-24 17:41:55+00:00,48677431,New post: Birx Admits She Knew COVID-19 Vaccines Were Never “Going To Protect Against Infection” https://t.co/w8jAasCJI2,en
2022-07-24 17:41:51+00:00,1089662640849182721,@SolHorizons @aultimatevoice @InsideLineBK @cwolfman13 @CryptoDefiGuys @nytimes It has been proven that the vaccine has longer lasting immunity than non vaccinated individuals getting Covid-19. https://t.co/7KrGU6pIhP,en
2022-07-24 17:41:25+00:00,962688480731193345,Gareth Eve’s Wife ‘Lisa’ Died From The Covid-19 Vaccine 💉 https://t.co/8hAbnGPSTL,en
2022-07-24 17:39:11+00:00,2168678580,"Upcoming Covid-19 Vaccine clinic in Central Etobicoke! Saturday, July 30th from 9:00-3:00 PM. No appt needed! 399 The East Mall. V. @ The East Mall https://t.co/w4IN2DuV5d",en
2022-07-24 17:38:14+00:00,1214209408751685632,@WHO World Criminal Organization Why has the so called safe &amp; effective COVID-19 (toxic injections) vaccines resulted in serious injury &amp; death?,en
2022-07-24 17:36:55+00:00,23504157,"@Walter_Sobchak0 @comeroundfullO @missmiranda @gayla_s For me, it’s just part of this anti-vax culture that is fueling everything. Even with COVID-19 vaccines not preventing transmission, I think the same people that won’t get that shot potentially won’t get others like polio, measles, etc. which will cause others to get sick &amp; die.",en
2022-07-24 17:35:05+00:00,709947536,"Biden's COVID-19 symptoms have 'diminished considerably,' his doctor says-- News, Social Impact | The Perfect Enemy: https://t.co/XzLk7ltBfG.#Coronavirus #Vaccines https://t.co/ti4mOh9zzE",en
2022-07-24 17:35:03+00:00,37716311,"Biden's COVID-19 symptoms have 'diminished considerably,' his doctor says-- News, Social Impact | The Perfect Enemy: https://t.co/qSxJyerwch.#Coronavirus #Vaccines https://t.co/mNL6juGuaF",en
2022-07-24 17:35:01+00:00,396602871,@SaskHealth why isn't there any covid-19 vaccine clinics in Moose Jaw?,en
2022-07-24 17:34:16+00:00,1518920556032237568,"Please, for the love of health, stop this COVID-19 vaccine madness.  Why are we still pushing this for children and low-risk adults including active military?  This does not equate to well-established childhood vaccinations. My informed opinion… https://t.co/MtiYVTpG7K",en
2022-07-24 17:34:01+00:00,3505883832,Great news! The COVID-19 vaccine is now available for children aged 6mo to 5 years. Learn why you should get your children #vaccinated in our latest blog: https://t.co/Uuz5LkAd6O https://t.co/Yt0ZPs0jYc,en
2022-07-24 17:34:01+00:00,81932411,Great news! The COVID-19 vaccine is now available for children aged 6mo to 5 years. Learn why you should get your children #vaccinated in our latest blog: https://t.co/5qRiVtudJd https://t.co/wteTOV5bxd,en
2022-07-24 17:34:01+00:00,4860991905,Great news! The COVID-19 vaccine is now available for children aged 6mo to 5 years. Learn why you should get your children #vaccinated in our latest blog: https://t.co/QFQPUtV0q8 https://t.co/CpAv1osg8a,en
2022-07-24 17:34:01+00:00,21314501,Great news! The COVID-19 vaccine is now available for children aged 6mo to 5 years. Learn why you should get your children #vaccinated in our latest blog: https://t.co/QClATEG51q https://t.co/4j3Hy2q8Fw,en
2022-07-24 17:32:37+00:00,1162893684767019008,NBA champ Andrew Wiggins still regrets getting COVID-19 vaccine https://t.co/IQVqTOwQbF Business signs made for Orange County https://t.co/vcnCC9cAVQ,en
2022-07-24 17:30:13+00:00,395312602,Vaccination remains our best protection against serious COVID-19 illness. Drop-in clinics in Ayrshire are now open to anyone due a dose of vaccine from age 5 upwards. Read more here: https://t.co/lG7HHpzasg,en
2022-07-24 17:27:45+00:00,1406967325455052807,China says Xi Jinping and other leaders have been given domestic Covid-19 vaccines https://t.co/ThQqcoIvBe,en
2022-07-24 17:26:01+00:00,804532034806882304,#BreakingNews Mira Bhayandar: MBMC booster drive hits hurdle due to COVID-19 vaccine shortage - https://t.co/xYNc7PqEqv https://t.co/E1YMwriT3C,en
2022-07-24 17:25:50+00:00,1493372923201081352,"@Truthseeker2710 @CastorT26371809 @MattMelv @WChrisNunn @nancyvictoria The FDA says it's a vaccine.""The vaccine has been known as the Pfizer-BioNTech COVID-19 Vaccine, and the approved vaccine is marketed as Comirnaty, for the prevention of COVID-19 in individuals 12 years of age and older.""https://t.co/ikhLdBWeVV",en
2022-07-24 17:24:51+00:00,1032707112445476867,"@covid_parent The science is never settled, except for these Covid-19 vaccines.",en
2022-07-24 17:24:22+00:00,1034238168294457344,@Jimmymcbucketss There is no evidence that Covid-19 vaccines affect fertility.,en
2022-07-24 17:23:40+00:00,1020043318380593152,Vaccine modifiable risk factor CVA/Millness likely mild and risk of CVA/MI also markedly reduced. I @cupallcare @cuonline Acute Myocardial Infarction and Ischemic Stroke After COVID-19 by Vaccination Status https://t.co/o5YC0GldQd via @JAMA_current part of @JAMANetwork,en
2022-07-24 17:23:08+00:00,2199494760,New2Trip: Safety &amp; Adverse Events Related to COVID-19 mRNA Vaccines; Systematic Review https://t.co/9XhjQ6tBfK,en
2022-07-24 17:22:32+00:00,1550338005524779008,@CyrilRamaphosa Stop promoting Covid-19 vaccine #ANCKZNconference 😭🚫,en
2022-07-24 17:22:19+00:00,1544516169159397377,"@JimmyJo42042395 @Nyxus_11 furries helped come up with the covid-19 vaccine, and if it weren't for furries idk if we would even be able to use the internet, what have all you anti-furs done besides complain about how you hate furries so much, how you want to burn or shoot them, and how their so cringe?",en
2022-07-24 17:22:13+00:00,3003935714,Do COVID-19 vaccines prevent death in children? - #VejonHealth https://t.co/i3zmURpHe5,en
2022-07-24 17:21:28+00:00,23504157,"@Walter_Sobchak0 @missmiranda @comeroundfullO @gayla_s People don’t want to listen to science. They just want to listen to nonsense from mom blogs that they linked to off of Facebook. From the start, the COVID-19 vaccines were said to make symptoms less severe. And they have. Nothing else was promised about them. 🤷🏻‍♂️",en
2022-07-24 17:20:17+00:00,1549019825317593088,China says Xi Jinping and other leaders received domestic Covid-19 vaccines amid public safety concerns https://t.co/sHdvxcrb97,en
2022-07-24 17:20:08+00:00,1539247799652556803,@IngrahamAngle The president of the USA should make the people of America pay for the Covid-19 virus vaccine,en
