date,userid,tweet,lang
2022-05-06 23:56:50+00:00,1391255995356119042,@alexforest01 We suffered during the COVID-19 lockdowns+now they’re abandoning the mandatory surveillance Vaccine Passport...revealing the entire fiasco was an exercise in control+a barbaric abuse of power. Andrews+Morrison sacked+shot us driving Aussies to commit suicide,en
2022-05-06 23:56:05+00:00,17429521,"As of Friday, DeKalb County is considered at “medium” risk for community transmission of COVID-19, and as a result indoor mask use and updated vaccines or boosters are recommended, according to the state health department. https://t.co/shgdJQuShU",en
2022-05-06 23:54:15+00:00,1265382860132884480,FDA Restricts J&amp;J’s COVID-19 Vaccine Over Risk of Blood Clots - https://t.co/RaA6r5WuK1By Jack PhillipsTh... https://t.co/akKkQcMv8x,en
2022-05-06 23:54:13+00:00,16644176,"Teen vaccine boost makes up for lost time. Health authorities are turning their attention to broader vaccination targets after the lifting of COVID-19 https://t.co/OBdPsDQsE5 NSW, pharmacies will join a r...Latest #news from MWM newsfeed #auspol https://t.co/5N5c9Ny8HG",en
2022-05-06 23:54:00+00:00,4520319979,OSHA says employers are largely keeping up with COVID-19 precautions in the workplace since SCOTUS blocked the vaccine rule earlier this year via @ReutersLegal https://t.co/i6QXB5EOty #osha #government #legislatives2022 #covid19 #policy #vaccine,en
2022-05-06 23:53:56+00:00,16644176,"Teen vaccine boost makes up for lost time. Health authorities are turning their attention to broader vaccination targets after the lifting of COVID-19 https://t.co/OBdPsDQsE5 NSW, pharmacies will join a r...Latest #news from MWM newsfeed #auspol https://t.co/7U8i0YarPj",en
2022-05-06 23:53:26+00:00,1329839675301908482,"""The White House is preparing for as many as 100 million Americans to get infected with COVID-19 during a wave this fall and winter if Congress does not provide new funding for vaccines and tests, a senior administration official said Friday, warning new money is needed""",en
2022-05-06 23:52:57+00:00,1427453613979312131,"@BessTSD @Frankly2BFrank @NoJabsEver https://t.co/tvTZo9pKVC many creditentialed scientists have noticed the similarities between covid 19, the vaccine &amp; something called HIV..a retrovirus. A retrovirus has the ability to convert RNA into DNA. Wrap the spike protein in a lipid particle &amp; it can invade a healthy cell",en
2022-05-06 23:52:23+00:00,1202799944798625793,"Sorry, this is newsworthy.  If the Pfizer vaccine was approved for use following trials, and 1,223 people our of 40,086 died, or 2.9% of the participants, why was this vaccine approved for emergent use?  The morbidity rate from the vaccine exceeds the morbidity rate from Covid 19",en
2022-05-06 23:50:55+00:00,493266859,"@michaelpardon3 @sixers2022LG @LemurCat40 @filmmaker3207 @CRS_0N3 @JackieMoonPies You do know this isn’t the first corona virus, right? They’ve known about them for years. But the variation discovered in 2019 (hence the Covid 19) was a deadlier variant. But the groundwork for a vaccine was laid long before you cared.",en
2022-05-06 23:49:53+00:00,54444254,Judge rejects B.C. government’s bid to drop case against COVID-19 vaccine orders - https://t.co/OqWL2KIIX8 - #yaletown #gastown #discovervancouver #burnaby #coquitlam #northvancouver #newwestminster #newwest #westvancouver #langley #richmond #diamondtest -,en
2022-05-06 23:49:52+00:00,779825839798099968,Judge rejects B.C. government’s bid to drop case against COVID-19 vaccine orders https://t.co/ygoK7aAmlK https://t.co/1yfpkopuZi,en
2022-05-06 23:49:48+00:00,779825839798099968,Canada won’t limit J&amp;J COVID-19 vaccine access due to rare blood clots: Tam https://t.co/qNjkieGUQB https://t.co/6Lvml8dg7C,en
2022-05-06 23:49:43+00:00,1272434570,"@MarkReady13 @OmicronData @hutcho66 @BallouxFrancois ""The overall incidence of myopericarditis from 22 studies (405 272 721 vaccine doses) was 33·3 cases (95% CI 15·3–72·6) per million vaccine doses, and did not differ significantly between people who received COVID-19 vaccines""https://t.co/sdzMOtFhLQ",en
2022-05-06 23:49:32+00:00,779825839798099968,J&amp;J’s COVID-19 vaccine restricted by FDA due to rare but serious blood clot risk https://t.co/s5oneDsnn0 https://t.co/DNUdqfxUrw,en
2022-05-06 23:49:24+00:00,1421177994488418306,BREAKING: FDA limits use of Janssen COVID-19 vaccine  https://t.co/OYvcCDXu9M via @MailOnline,en
2022-05-06 23:49:22+00:00,1548578978,More than 64% of the adverse side effects of Covid-19 vaccines are because of the ‘nocebo effect’https://t.co/fp2Dfg8MyY,en
2022-05-06 23:46:08+00:00,37955059,FDA restricts Johnson &amp; Johnson COVID-19 vaccine due to blood clot riskhttps://t.co/9gw5D4Qf3t,en
2022-05-06 23:46:05+00:00,1463924794060152843,FDA puts strict limits on Johnson &amp; Johnson Covid-19 vaccine | CNN https://t.co/QLsdakG9Wz,en
2022-05-06 23:43:14+00:00,1347157496960491521,"FDA restricts J&amp;J’s COVID-19 vaccine due to blood clot risk, Health News, ET HealthWorld https://t.co/FBhO02b9W2",en
2022-05-06 23:43:02+00:00,727592059385827330,"#Canada #Vancouver #Canadians Through deaths #lockdownextensions, raised #suicides, #domesticviolence, #sexualabuse,  unemployment etc. #Covid_19 has caused havoc. #Hunger &amp; #riots R awaited. No drug no #vaccine STOP IT. Take advice https://t.co/9LRAScysZL https://t.co/zGvoMGHNX9",en
2022-05-06 23:42:00+00:00,1487530494254272518,The newly released Pfizer documents do not show that their COVID-19 vaccine is unsafe https://t.co/7vAnRzx90w,en
2022-05-06 23:41:03+00:00,386320140,"@MTCRYPTOCLUB @Don94612248 @RSiverene @tedcruz What shot is that? (Obviously not the COVID-19 vaccines, which were subject to extensive testing.)In addition to which, I'm sure you're aware that abortions aren't contagious.",en
2022-05-06 23:38:13+00:00,1366035494073679873,"So pfizer fought to have the data on their dangerous, harmful Covid-19 vaccine hidden for 75 years.They needn't have bothered. The data has been released and......crickets.",en
2022-05-06 23:36:13+00:00,29908613,Dont believe a word you say. Fact Check-No link between hepatitis cases in children and COVID-19 vaccines  https://t.co/3u8W9rzyN6,en
2022-05-06 23:36:07+00:00,1465165498287628293,"Pfizer vaccine has a 12% accuracy against covid-19, Johnson &amp; johnson vaccine is causing blood clots in people.",en
2022-05-06 23:35:42+00:00,6610672,Denmark to destroy 1.1 million excess COVID-19 vaccines | Coronavirus pandemic News | Al Jazeera https://t.co/eQlb7OTzKB,en
2022-05-06 23:35:35+00:00,1237533914341601280,"@NellyTells Here in South Australia, the Health Dept is still advising 'Pregnant people can safely receive an mRNA COVID-19 vaccine, such as Pfizer or Moderna, at any stage of pregnancy.' I wrote to the Minister 2 days ago with a link to the Pfizer docs - as expected, no response, no change.",en
2022-05-06 23:35:01+00:00,1419867080812232705,"Walgreens COVID-19 Vaccine Appointments Near You/Walgreens検索・予約（English） website was updated, visit the page! https://t.co/TqHHgBXRsK",en
2022-05-06 23:34:53+00:00,1482057052021219332,FDA restricts J&amp;J’s COVID-19 vaccine due to blood clot riskhttps://t.co/yHuzJFfAHL,en
2022-05-06 23:34:05+00:00,797595901392891904,https://t.co/nnsl2Ti458 The North Denver News is edited &amp; published by Guerin Green. powered by Novel Cogniton. Newest Stories. FDA Restricts J&amp;J's COVID-19 Vaccine Over ...,en
2022-05-06 23:34:04+00:00,28123142,Neither AIDS nor HIV can be spread through the COVID-19 vaccine. https://t.co/QRVOPg95l2,en
2022-05-06 23:30:46+00:00,379297386,"https://t.co/Pcp4wCflpT On Thursday, the FDA announced that it will restrict the use of the J&amp;J COVID-19 vaccine to adults who cannot receive mRNA vaccines, citing the risk of potentially “life-threatening” side effects. J&amp;J is NOT mRNA based vaccine, but still as bad!",en
2022-05-06 23:30:29+00:00,850714859113074689,"Stupid reason to get kicked out. You get many vaccines in the military especially if you deploy. Not sure what was in any of them or how well they worked. what's 1 more Army officer convicted in first Covid-19 court-martial, but judge doesn't punish him https://t.co/KUOj9DylSs",en
2022-05-06 23:30:00+00:00,19777359,"Sonya Harris is the Senior Advisor of the COVID-19 Vaccine Taskforce @CAPublicHealth. While the pandemic exposed many of the inequalities in our communities, we appreciate Sonya’s work to meet all our communities where they are at in our fight against the pandemic.✊ https://t.co/aA4uZQ6wIr",en
2022-05-06 23:29:15+00:00,19797326,Staying up to date on your vaccines is the best way to protect yourself from COVID-19. Talk to your health care provider or call 907-646-3322 for help reviewing your options.​ Find more information about booster shots at https://t.co/yYSFxRUxCO. https://t.co/lJtGKTsdrF,en
2022-05-06 23:29:14+00:00,19797326,"If you're eligible for a 2nd COVID-19 vaccine booster, you might consider getting it if you're more likely to get very sick from COVID-19​, or if you're more likely to be exposed to COVID-19 through your job, where you live, or other factors.",en
2022-05-06 23:28:38+00:00,1477247441736908800,FDA restricts Johnson &amp; Johnson COVID-19 vaccine due to blood clot risk https://t.co/tIohlQrAMh,en
2022-05-06 23:28:27+00:00,1491841545670213632,"FDA put strict limits on the use of Johnson &amp; Johnson’s COVID-19 vaccine, citing the risk of a blood clotting condition, but experts say that Pfizer and Moderna pose similar riskshttps://t.co/Jiu9Ec2NBe",en
2022-05-06 23:28:03+00:00,1462117768229048323,White House documents detail a looming squeeze on #Covid-19 boosters - #WhiteHouse could run out of #COVID19 #vaccines if it moves forward with plans to encourage all adults to get a 2nd Covid-19 vaccine #booster dose by roughly Sept. 1. https://t.co/GVehg2i0e0,en
2022-05-06 23:27:49+00:00,28341112,FDA restricts Johnson &amp; Johnson COVID-19 vaccine due to blood clot risk - CBS News https://t.co/9R1y0wsJNQ,en
2022-05-06 23:27:35+00:00,487118986,"Colombia will begin application of a second COVID-19 booster dose, or a fourth vaccine dose, for people over 50 years old to help maintain immunity levels https://t.co/TddIhU27Cb https://t.co/cF8NlKsKW0",en
2022-05-06 23:27:31+00:00,21907610,"Covid isn’t over—and unless we provide access to vaccines to everyone worldwide, the pandemic will continue to disrupt and threaten our lives. That’s why I’m attending @End_Covid_Now’s People’s COVID-19 Summit May 9-12. Join me: https://t.co/IRYyl0J4tO",en
2022-05-06 23:27:24+00:00,1491841545670213632,"A total of 1,255,355 reports of adverse events following COVID-19 vaccines were submitted between Dec. 14, 2020, and April 29, 2022, to the Vaccine Adverse Event Reporting System (VAERS)https://t.co/fvrvuqjhgL",en
2022-05-06 23:27:23+00:00,1860839948,How effective are vaccines? “Vaccinated teachers working outside the home were less likely to report COVID-19–related outcomes than unvaccinated teachers working exclusively from home.”,en
2022-05-06 23:26:33+00:00,3306186389,Have heard zero stats on the latest #covid-19 wave.Are these re-infections or new? Herd immunity not working? Are the vaccines wearing off or no longer effective against latest variant?,en
2022-05-06 23:26:13+00:00,2511385572,"If your employer still mandated Covid 19 vaccines, would you file for exemptions or blow the whole thing up because these exemptions have never been offered in good faith? @lee613200 @happytotalk09 @Atoosa1981 @boyfromdixie",en
2022-05-06 23:25:56+00:00,1400997101706883079,Our nurses went from HEROES to ZEROES very quickly when they declined the Covid-19 vaccine.All nurses who were fired over the vaccine mandate should be reinstated with backpay!#NationalNursesDay,en
2022-05-06 23:25:43+00:00,881946720703193088,Data continue to show that #COVID19 vaccines are safe &amp; effective. Get vaccinated against COVID-19 as soon as you can. Get a booster shot when eligible. Find your vaccine: https://t.co/NnTCesm9qc #SleeveUp Link to all our members for more COVID-19 info: https://t.co/XHSMUHpvdN https://t.co/ZJ6r4nnaBn,en
2022-05-06 23:25:14+00:00,1509717811609931779,Glad I didn't get suckered into taking those untested vaccines. Biden told the FDA to pass them. They did the very next day. I hope the best for everyonUpdate on Blood Clotting Risk From the Johnson &amp; Johnson/Janssen COVID-19 Vaccine https://t.co/slK14Vhvu4,en
2022-05-06 23:23:51+00:00,1376799665669165059,Harmful effects of COVID-19 vaccines are best explained by micro blood clots Report https://t.co/mcMi7Hq10C,en
2022-05-06 23:23:50+00:00,865242169,Harmful effects of COVID-19 vaccines are best explained by micro blood clots Report https://t.co/1MtHt82JG8,en
2022-05-06 23:23:43+00:00,18956073,"The FDA narrowed its use authorization for Johnson &amp; Johnson’s single-dose COVID-19 vaccine due to risks of severe blood clotting, a move that comes months after an initial warning from health officials. https://t.co/TwA8RXaggv",en
2022-05-06 23:22:31+00:00,1431655264378306561,FDA puts strict limits on Johnson &amp; Johnson Covid-19 vaccinehttps://t.co/8BTuNzFwCk,en
2022-05-06 23:22:23+00:00,2952942945,FDA puts strict limits on Johnson &amp; Johnson Covid-19 vaccinehttps://t.co/LdYl5HfpoJ,en
2022-05-06 23:20:00+00:00,39453212,Unvaccinated Omicron patients at risk from variants; Different vaccines protect well against severe COVID-19https://t.co/iGmeihxa3Z,en
2022-05-06 23:16:34+00:00,1147089496875393026,Judge rejects B.C. government's bid to drop case against COVID-19 vaccine orders - Global News https://t.co/RqSkAWc2kE,en
2022-05-06 23:16:17+00:00,32886188,"""Sen. Ron Johnson says it 'may be true' that COVID-19 vaccines cause AIDS""https://t.co/9LCEYfOnSB https://t.co/aM5SeJtKJD",en
2022-05-06 23:16:02+00:00,1503028249139593222,FDA Limits J&amp;J's COVID-19 Vaccine Over Blood Clot Risk https://t.co/ieaAyzJkXI,en
2022-05-06 23:14:49+00:00,1002361483169226752,Are you interested?Read More on https://t.co/t1nQmZpBoNLink to read a full article: https://t.co/lUmzupKkv1#trialsitenews #trialsite #transparent #courage #journalism #scientificjournalism #covid_19 #vaccine#public #free https://t.co/YNvHesIzGb,en
2022-05-06 23:14:21+00:00,1276984461406531585,FDA puts strict limits on Johnson &amp; Johnson Covid-19 vaccine - CNN https://t.co/utxHwWv2e5,en
2022-05-06 23:14:19+00:00,1002361483169226752,Are you interested?Read More on https://t.co/t1nQmZpBoNLink to read a full article: https://t.co/iFXzdOkim7#trialsitenews #trialsite #transparent #courage #journalism #scientificjournalism #covid_19 #vaccine#public #free #brain #longcovid https://t.co/b5wdRJJoO6,en
2022-05-06 23:14:17+00:00,1372955250437545987,"@petulantskeptic @zeynep Agreed (I wrote the article). My point was simply that we aren’t talking about “prescribing” when it comes to recommending and administering covid-19 vaccines. But 100% yes, the constraint on physician ability to recommend/administer vaccines off-label is without justification.",en
2022-05-06 23:13:57+00:00,1872630422,We’ve been closely monitoring the Janssen COVID-19 Vaccine and occurrence of TTS following its administration and have used updated information from our safety surveillance systems to revise the EUA. https://t.co/EujdpOgqJv,en
2022-05-06 23:13:50+00:00,1002361483169226752,Are you interested?Read More on https://t.co/t1nQmZpBoNLink to read a full article: https://t.co/WNh0MGMDmR#trialsitenews #trialsite #transparent #courage #journalism #scientificjournalism #covid_19 #vaccine#public #free #ethics #france #treatment https://t.co/x0MngNstfu,en
2022-05-06 23:12:37+00:00,375141331,CIMB | Free Full-Text | Intracellular Reverse Transcription of Pfizer BioNTech COVID-19 mRNA Vaccine BNT162b2 In Vitro in Human Liver Cell Line | HTMLhttps://t.co/I5RtMxLbvY,en
2022-05-06 23:11:58+00:00,1511886555643789315,Buy Covid-19 Vaccine Cert without getting the jab https://t.co/Vc5ktJaaM8 via @footeo_officiel,en
2022-05-06 23:11:25+00:00,3240588843,Affinivax to Highlight Preclinical Data from COVID-19 MAPS™ Vaccine Development Program at IMMUNOLOGY2022™ https://t.co/rzrAvKOH2E #preIPO #biotech #pharmaceuticals https://t.co/33ft1xA3au,en
2022-05-06 23:07:32+00:00,63177215,Should Quebecers get a fourth dose of COVID-19 vaccine? https://t.co/cCU5YlqJEv,en
2022-05-06 23:05:45+00:00,821763432391344128,Updates on #COVID19 #treatments and #vaccines COVID-19 tracker: Researchers want to test Pfizer's Paxlovid in long COVID https://t.co/tKDWwIb55f,en
2022-05-06 23:04:49+00:00,1424983554992214017,CDC Report Admits 74 Million Americans Have Refused the COVID-19 Vaccine🇺🇸Join Us👉 @SGTnewsNetwork https://t.co/IOe4xO9KPh https://t.co/hEnw2sXFwP,en
2022-05-06 23:01:13+00:00,193461610,I voted for COVID-19 Pop-up Vaccine Centre - Camphill School Aberdeen in the Scottish Charity Awards https://t.co/1HhI4FB9m6 #ScotCharityAwards via @camphillschool,en
2022-05-06 23:01:04+00:00,1490057525001170948,FDA restricts J&amp;J’s COVID-19 vaccine due to blood clot risk https://t.co/lnmxKNEgeB,en
2022-05-06 23:00:13+00:00,40778270,- 62.7% of people have had three doses of a COVID-19 vaccine*- 83.1% of people aged 12-15 have had one dose of a COVID-19 vaccine- 79.5% of people aged 12-15 have had two doses of a COVID-19 vaccine- 50% of people aged 5-11 have had one dose of a COVID-19 vaccine,en
2022-05-06 23:00:13+00:00,40778270,COVID-19 update – Saturday 7 May 2022In the 24-hour reporting period to 4pm yesterday:- 96.2% of people aged 16+ have had one dose of a COVID-19 vaccine- 94.8% of people aged 16+ have had two doses of a COVID-19 vaccine https://t.co/mWbndxEkcy,en
2022-05-06 23:00:06+00:00,1466651412981374978,"1/ Plant-based recombinant COVID-19 vaccine found to be effective. Researchers found vaccine efficacy was 78.8 and 74.0 per cent against moderate-to-severe disease and among those who were seronegative at the start, respectively https://t.co/V2RMsLZmCz",en
2022-05-06 23:00:02+00:00,1485868040642256898,Get Your COVID-19 &amp; Flu Vaccine Today. https://t.co/JC85xcabXK https://t.co/oihneoZEh3,en
2022-05-06 23:00:01+00:00,826662087195701248,"Where we are with covid-19, it’s not over, and new more transmissible variants continue to emerge. We need better vaccines and treatment, as well as clean air standards and masks.",en
2022-05-06 23:00:00+00:00,3460109487,"Cases of a syndrome with rare and life-threatening blood clots in combination with low levels of blood platelets warrant limiting the authorized use of J&amp;J’s Covid-19 vaccine, the FDA said Thursday.https://t.co/epdkQVkqAh",en
2022-05-06 22:59:16+00:00,971662920877711363,Judge rejects B.C. government’s bid to drop case against COVID-19 vaccine orders | https://t.co/s0N0i8F4xv https://t.co/hNI418iF0T,en
2022-05-06 22:58:34+00:00,948696827645366273,.Céline Dion (Official HD Video) disposable PATCH vaccine COVID-19 or flu assembly with 200 to 4000 microprojectionspatent: WO2021216925A1 Abc:Fox:Oan:Cnn:Cbs:Nbc:Bbc:Msnbc:Whtm:Cnbc:Tx:Can:Ca:Pbs:Wtnh:Ctv:Bce:Tvo:Chek:Bnn:Gma3:Aus https://t.co/sh9m6zcowo via @YouTube,en
2022-05-06 22:57:57+00:00,1450179814233681923,"@AllonsEnfants99 @DefenceU If #Putin was #communist the #СССР,the #УССР would exist till now and the #communist #Yugoslavia would exist now.There are not #communists in #Hungary?You accuse #Putin and not #Orban.Orban bought #vaccines for #Covid_19 from #Russia.https://t.co/na4krt9CzS",en
2022-05-06 22:57:23+00:00,412039958,"@barbie1952 None of the COVID-19 vaccines anywhere are successful. Look at the current situation in China and VAERS-type reports all over the world (even taking into account massive ongoing deletions and numbers-fudging). The vaccines may be ""successful"" for another purpose...",en
2022-05-06 22:56:46+00:00,49404200,"Eric Topol, MD, Discusses the Latest COVID-19 Vaccine Booster Data https://t.co/0bdmVKJSy4",en
2022-05-06 22:55:50+00:00,42340653,FDA Restricts J&amp;J’s COVID-19 Vaccine Over Risk of Blood Clots https://t.co/K3Wd07LsWu,en
2022-05-06 22:53:48+00:00,1082585659,“Mucosal COVID-19 Vaccine Protects Against Disease and Transmission in Hamsters | Technology Networks“ https://t.co/BoaS9l5GG8,en
2022-05-06 22:52:42+00:00,753137912,"@jsm2334 @Jikkyleaks @as1001 Its absolutely insane to me that anybody with an IQ over 100 can actually sit there with a straight face and say that in the real world vaccines for COVID-19 have had anything even remotely more than 10-20% reduction in cases, when in reality they INCREASED cases",en
2022-05-06 22:49:45+00:00,2418055116,FDA restricts J&amp;J’s COVID-19 vaccine due to blood clot risk https://t.co/2CNjIuyrJ6,en
2022-05-06 22:49:16+00:00,1248375099285049347,"""Autoimmune hepatitis after COVID-19 vaccine - More than a coincidence."" (Oct 26 - 2021)https://t.co/jo58IJltkY ""Autoimmune Hepatitis - Like Syndrome Following COVID-19 Vaccination: A Systematic Review of the Literature"" (Apr 29 - 2021)https://t.co/Mkld4f8jSL",en
2022-05-06 22:47:59+00:00,2861185455,"#GetVaccinated this weekend! Sites will be open in the @theserhajm.Head to your nearest location to receive your 1st, 2nd or booster dose of a COVID-19 vaccine.Listed here are the sites for Sunday, May 08.#VaccinateJa@christufton @julietcuthbert https://t.co/Nm3JwLBc3T",en
2022-05-06 22:47:46+00:00,312412918,The White House is preparing for as many as 100 million Americans to get infected with COVID-19 during a wave this fall and winter if Congress does not provide new funding for vaccines and testsH/t ⁦@justthefacts85⁩  https://t.co/0KgiSkkBU5,en
2022-05-06 22:46:36+00:00,1293897372225998849,"Did you miss our latest community conversation on COVID-19 treatments?  Watch it at the link below to learn about treatments, updates on vaccines, and the test-to-treat locators. #CERCL #CCDPH #CovidVaccine #CovidTreatment #COVID19 #provisotownshiphttps://t.co/lxYdVBzKqO",en
2022-05-06 22:46:04+00:00,2861185455,"#GetVaccinated this weekend! Sites will be open in the @theserhajm.Head to your nearest location to receive your 1st, 2nd or booster dose of a COVID-19 vaccine.Listed here are the sites for Saturday, May 07.#VaccinateJa@christufton @julietcuthbert https://t.co/VsvRoPqOl5",en
2022-05-06 22:45:11+00:00,1251981278,"As of 4pm today, Cambridge is reporting:203 newly reported COVID-19 cases.0 newly reported COVID-19 deaths.117.7 cases per 100,000 residents, 7-day moving average.93% of residents with at least one vaccine dose and 77% fully vaccinated.More at https://t.co/YgmNLKcIMc #CambMA https://t.co/XnJGOYhTvt",en
2022-05-06 22:45:07+00:00,1303928309005209601,TGA weekly report of Adverse Events to covid-19 vaccines in Australia (summary) - up to 1st May 2022 https://t.co/Q4fNx7veGq,en
2022-05-06 22:45:00+00:00,252114970,COVID-19 vaccines are widely available for New Jersey residents ages 5 &amp; up. All vaccines currently available are proven to be safe and effective. Talk to your pediatrician and find an appointment near you: https://t.co/W9q4E8ifT1 #COVID19 https://t.co/sVGF5kOK1K,en
2022-05-06 22:44:48+00:00,1965939079,Researchers confirm evidence of viral shedding from covid-19 vaccines – Dr. Eddy Bettermann MD https://t.co/KNa0dyBP7c,en
2022-05-06 22:43:58+00:00,840647696562155520,So you're saying the #Vaccine is so good that your 3 dose vaccinated co-workers have had #Covid_19 2x?,en
2022-05-06 22:42:46+00:00,380706185,Surprise surprise…“hepatotoxicity with vaccines. We present a case of liver injury after administration of the vaccine against the COVID-19 infection”https://t.co/VP4R73TJzF https://t.co/IkAjZlCYOI,en
2022-05-06 22:42:26+00:00,288584040,"Fewer than 1 in 5 US parents say they'll get Covid-19 vaccines for kids under 5 as soon as they can, survey findshttps://t.co/jeV48LpsnO",en
2022-05-06 22:42:11+00:00,288584040,FDA puts strict limits on Johnson &amp; Johnson Covid-19 vaccinehttps://t.co/qQpnJ5Qr6i,en
2022-05-06 22:41:17+00:00,978265628426432512,4-16-21 - Dr. Oz assured his followers that symptoms after getting the COVID-19 vaccine are normal. https://t.co/TFAv8VlLIP,en
2022-05-06 22:40:53+00:00,40296265,FDA: Restrictions to Johnson &amp; Johnson Covid-19 vaccine because of rare blood clot risk  https://t.co/nMKFmUreSE,en
2022-05-06 22:40:49+00:00,791752212267532288,"No, the COVID-19 vaccine does not cause AIDS https://t.co/nB5CJyLZrP",en
2022-05-06 22:40:46+00:00,714513438836441089,"No, the COVID-19 vaccine does not cause AIDS https://t.co/ewGD2ycjlm",en
2022-05-06 22:39:33+00:00,2707130960,U.S. regulators on Thursday strictly limited who can receive Johnson &amp; Johnson's COVID-19 vaccine due to the ongoing risk of rare but serious blood clots.Keep reading: https://t.co/8icLunQqGH,en
2022-05-06 22:39:06+00:00,1425147277631393794,"@audraf637 #Misleading #claims suggesting that more than 1,200 died after suffering adverse reactions to the #Pfizer #COVID-19 vaccine have once again been spread on social media.https://t.co/rqfKA8LxF8",en
2022-05-06 22:38:12+00:00,978265628426432512,3-24-21- Dr. Oz again promoted the COVID-19 vaccine on TikTok telling his followers that those who get vaccinated are “doing a service to yourself and your community.” https://t.co/76ODVJ84H4,en
2022-05-06 22:37:38+00:00,49121846,FDA puts strict limits on Johnson &amp; Johnson Covid-19 vaccinehttps://t.co/v3JllPAP5x,en
2022-05-06 22:36:51+00:00,433484277,@hyxx_or @KenMuno @S12_Schokt @lePlaymobil28 @ThierryRibier @amelie_for_you @JnovVjno @Locuste_ @Pyostacine Cureus | Acute Pancreatitis: A Possible Side Effect of COVID-19 Vaccinehttps://t.co/cTNmp5cX3y,en
2022-05-06 22:35:32+00:00,1348748816791580673,I spoke today to a woman who had lost her husband due to the Covid-19 vaccine.  Now this too:https://t.co/OhrhF6bl0j,en
