date,userid,tweet,lang
2022-06-29 15:19:58+00:00,3281761939,"Fabens ISD will be hosting an immunization clinic at Fabens High School on Tuesday July 19th from 2 - 4 p.m. It will include childhood immunizations, meningitis and COVID-19 vaccines. Don't wait to get your child vaccinated. #SmallTownTough https://t.co/4V0BnF4Cc1",en
2022-06-29 15:19:10+00:00,1504254117702602753,Which COVID-19 Vaccine Should Your Kid Under 5 Get? https://t.co/ZU00aAlTvu,en
2022-06-29 15:18:20+00:00,97498423,I just took action to keep pediatric COVID-19 vaccines optional for children in Massachusetts. Join me in signing TODAY!,en
2022-06-29 15:16:03+00:00,23711785,Baker-Polito administration awards additional $7 million for COVID-19 vaccine equity efforts; funding supports ongoing efforts to increase awareness and access to vaccines in communities hardest hit by the pandemic: https://t.co/QLjpwGvqu7 #Covid19MA https://t.co/oguzWB7535,en
2022-06-29 15:15:00+00:00,1490461389386887171,Why are doctors concerned about the relationship between #PFAS poisoning and #COVID-19? The CDC found “evidence from human and animal studies that PFAS exposure may reduce antibody responses to vaccines.” Learn more: https://t.co/8775SEu2uc #HunterShkolnik https://t.co/VREylwBvU7,en
2022-06-29 15:14:53+00:00,1373015974920736770,@sunshine_toes @Jaxie_B8 @BigRor7 @TakethatCt @Monstercoyliar @Harley_Dogg @crabb_vicki @provaxtexan @LiamKav @AndrewLazarus4 @doritmi @dave_odo @CoralBlob @David71799014 @FrankDElia7 @JohnRLottJr @CallMeEOnly @Kingey16 @lazlowoodbine42 @thewelldressed1 @Mchael21592783M @ILUVTRUTH2 @_mamadeb @GazJayM @quigley_jesse @volpiranyas @Suesue2point0 @Mike4truths @mcfunny @ZaynJaffer @ProVaxProHealth @SkepticalMutant @FlamingArse @Megalodon_16 @clownworld_bobo @JakeEschen @Kathmarval @chris_kelly1991 @vault_code @WendyOrent @CharlieGordon20 @AutisticShill @LazarusLong13 @SProteen @BurgerLab12 @FredFunkFumb @JimSatone @AnzacMegan @slemar_ Tweeting misleading and false information about vaccines and Covid-19:Source &gt; https://t.co/E8B674obT4 https://t.co/tT4yZNcoZF,en
2022-06-29 15:14:14+00:00,1349795689463771137,Fatal cerebral haemorrhage after COVID-19 vaccineFemale Healthcare worker in her 30's- ChAdOx1nCov-19 Oxford-Astrazeneca https://t.co/3eqaLGjfkM,en
2022-06-29 15:13:37+00:00,2491664966,"@TheBeaverton And read this: Which freedoms are they demanding?The protestors are armed with misinformation About COVID-19 vaccines, pandemic conspiracy theories, and a deep conviction that the federal government has trampled fundamental individual liberties  https://t.co/XhTwa9sZCA",en
2022-06-29 15:12:00+00:00,59545968,Getting your COVID vaccine provides the best outcomes for all involved-including your baby!. Find a vaccination location near you at https://t.co/PlCxA7uRvG. Visit https://t.co/K49NIeaj2v for more info about COVID-19 vaccines + pregnancy. #OneVaxTwoLives https://t.co/IBiVLpJgXx,en
2022-06-29 15:12:00+00:00,47357672,More than a year and a half since the first COVID-19 vaccines were rolled out -- at a record pace and with the promise of ending the worst public health crisis in a century -- several U.S. counties still have incredibly low rates of vaccination. https://t.co/pNiILxekkR,en
2022-06-29 15:11:20+00:00,1349795689463771137,mRNA COVID-19 Vaccine–Related Anaphylactoid Reaction and Coronary Thrombosis38 year old male- Pfizer BNT162B2/TOZINAMERAN https://t.co/A3NWZJtkT1,en
2022-06-29 15:11:00+00:00,28927026,📍Beloved “Sesame Street” character Elmo has received his first shot of a COVID-19 vaccine. https://t.co/SFatQV9pxu,en
2022-06-29 15:10:29+00:00,1481564568845438976,FDA advisers vote in favor of authorizing Covid-19 vaccines for children as young as 6 months https://t.co/LvkI7etC13,en
2022-06-29 15:10:20+00:00,1529393408267104256,The Novavax vaccine may offer an option for the thousands of service members who have refused other COVID-19 vaccines for religious reasons. Read more about the new COVID-19 vaccine:New COVID-19 vaccine may be option for troops with religious concernsThe COVID-19 vaccine f... https://t.co/SxDCeEsKB5,en
2022-06-29 15:09:50+00:00,1493187605823127556,Which COVID-19 vaccine type and timing are best during pregnancy? Study examines maternal immune responses and antibody transfer from mother to fetus for different vaccines across pregnancy trimesters — ScienceDaily https://t.co/BKVKE3n4UH,en
2022-06-29 15:09:47+00:00,3126818525,"Just a reminder, the @vopnews is hosting weekly vax clinics at the Cheney Mansion, 220 N. Euclid Ave. in Oak Park. The clinics will now be offering COVID-19 vaccines for individuals 6 months and older. More information on the village's website https://t.co/j3ssLRNk1C.",en
2022-06-29 15:09:43+00:00,15647482,South Korea approves first homemade COVID-19 vaccine https://t.co/D2y0NRK3L3,en
2022-06-29 15:07:46+00:00,962607038294515712,"What efforts has China made to develop a COVID-19 vaccine?Did you know that five COVID-19 vaccines are available and all of them are free in China？Five technology routes and five vaccines entered phase III clinical trials, with 18 companies accelerating production preparation. https://t.co/EDn21CyWQ3",en
2022-06-29 15:07:29+00:00,1243141735737249794,"#FDA &amp; #CDC are so #corrupt - they only approve patented == profitable COVID-19 treatments and #vaccines, which are less safe &amp; effective® than other better researched treatments. https://t.co/2ED9OeotVQ, https://t.co/Qe35BSROGH, https://t.co/3CXfFg2lxe &amp; https://t.co/aKRSlIQ4iR. https://t.co/sjXkqMteL8",en
2022-06-29 15:07:02+00:00,360220091,FDA panel urges revamped Covid boosters; White House to widen access to monkeypox vaccine FDA panel urges revamped Covid-19 boosters - https://t.co/wJtTJC50Cw,en
2022-06-29 15:06:34+00:00,15724264,Pfizer and BioNTech share positive results for Omicron-adapted COVID-19 vaccine https://t.co/2yCawPsz4C https://t.co/0eMDFU485O,en
2022-06-29 15:05:02+00:00,43317911,"BioNTech and Pfizer, who collaborated on the Covid-19 vaccines, said they would start testing next-generation shots that protect against a wide variety of coronaviruses #Covid19 #coronavirus https://t.co/pZNQa2fVHQ",en
2022-06-29 15:05:00+00:00,151513624,Did you know? Children aged 12-15 can now receive the COVID-19 vaccine🙌💉For more information visit: https://t.co/wWdkBllmzz https://t.co/Ez3Ws7oTIT,en
2022-06-29 15:04:44+00:00,777551368953458688,"TRUST THESE CRIMINALS? EU chief can't find texts with Pfizer chief on COVID-19 vaccine deal., https://t.co/5ZepB5BsLg",en
2022-06-29 15:04:43+00:00,2520259915,HDT Bio’s COVID-19 Vaccine Wins Regulatory Approval in India https://t.co/JSI7D8IJ4W,en
2022-06-29 15:04:35+00:00,384376782,Visit our team at @HealthDouglasCo on Friday to get your under 5 kiddos vaccinated 💉! #Elmogetsvaccinated #VaccinesWork #COVID19Sesame Street: Elmo Gets the COVID-19 Vaccine  | PSA https://t.co/iXx9ajq6pP via @YouTube @elmo @BigBird @PBSKIDS,en
2022-06-29 15:04:30+00:00,2925683967,USAID Rolls Out U.S. Government-Facilitated Pediatric COVID-19 Vaccines Worldwide | Press Release | U.S. Agency for International Development https://t.co/dcwuhCqFim,en
2022-06-29 15:02:28+00:00,923530365221900288,Which COVID-19 vaccine type and timing are best during pregnancy? - https://t.co/o2NYllWwm2,en
2022-06-29 15:02:24+00:00,24912695,"COVID-19 Vaccinations and BoostersWED., THUR., and FRI., noon – 4:30 p.m.CCHHS 2625 N King St,VaccinesKids Moderna: 6 months - 5 yrsKids Pfizer: 6 months+Moderna and J &amp; J Boosters 18+. Pfizer booster 5+.Appt: https://t.co/GbxJSLSHBi  Spanish: https://t.co/bX0Q64Xktk https://t.co/Qh071u0s26",en
2022-06-29 15:02:07+00:00,87413491,"The failure of the UK and other G7 nations to share COVID-19 vaccine doses and stop hoarding them is shocking. The doses that were promised - but not delivered - could have saved 600,000 lives. https://t.co/RxNgjzdaDo",en
2022-06-29 15:02:05+00:00,1239315181882224640,https://t.co/k5GfHGnEUk:  A Study to Evaluate the Safety and Immunogenicity of the mRNA-1273.214 COVID-19 Vaccine in Healthy Children Between 6 Months to Less Than 6 Years of Age: Condition:   SARS-CoV-2Intervention:  … https://t.co/JCiPTvkPss #covid19 #SARSCOV2 #coronavirus,en
2022-06-29 15:02:03+00:00,1271092173904150529,Which COVID-19 vaccine type and timing are best during pregnancy? https://t.co/MqtcdW3FQ0,en
2022-06-29 15:02:03+00:00,278583474,The FDA EUA of the Moderna COVID-19 and Pfizer-BioNTech COVID-19 vaccines for the prevention of COVID-19 to include use in children down to 6 months of age.https://t.co/aajz8b2SYg,en
2022-06-29 15:01:33+00:00,137775956,COVID-19 testing and vaccine update from the Duval County Department of Health:,en
2022-06-29 15:01:26+00:00,117793973,"COVID-19 vaccinations for children six months and older are available at COVID Centers in all eight wards.Continue to check DC Health's social media platforms for updates on under 5 vaccine availability at the COVID Centers. For more info, visit https://t.co/NZYnUIQLLz https://t.co/BHQ01UDJBK",en
2022-06-29 15:01:01+00:00,17343896,Make your plan to get everyone in your family (6 months+) up to date on COVID-19 vaccines at one of our family clinics as early as this weekend! It’s available to EVERYONE AT NO COST. Register to confirm your spot: https://t.co/s9YhLcJFAA https://t.co/XzEZ630TVz,en
2022-06-29 15:00:49+00:00,2433566743,Be a Covid-19 Vax Champ! Check out these resources and more at our Vaccine Confidence resource library. Visit https://t.co/NjQoVqbwBQ for more. https://t.co/qt9qpwOEbQ,en
2022-06-29 15:00:48+00:00,3299957854,"On June 28, a panel of experts convened by the U.S. Food and Drug Administration (FDA) voted 19 to 2 to change the vaccines that have been used since December 2020 to protect against COVID-19.https://t.co/e6cR56jRXO",en
2022-06-29 15:00:26+00:00,743361210,Misinformation is prevalent about COVID-19 vaccines. Trust your healthcare provider and talk to them about the science behind the vaccines. #ThisIsOurShot #VaccinesSaveLives #COVIDAwareness https://t.co/xCuqOp4asc,en
2022-06-29 15:00:25+00:00,879010003,AJOG Special Report:  One Vax Two Lives: A Social Media Campaign and Research Program to Address COVID-19 Vaccine Hesitancy in Pregnancy https://t.co/dBTLUO3hx9 @acog @MySMFM https://t.co/O57bjnIr82,en
2022-06-29 15:00:20+00:00,36807767,COVID-19 vaccines are now available for kids 6 months+ and can help keep the whole family safer from serious illness &amp; hospitalization.Give yourself peace of mind &amp; help loved ones #GetVaccinated. Visit https://t.co/xethWby0Xe or call 833-422-4255 to find a vaccine near you. https://t.co/FEMGxN22ri,en
2022-06-29 15:00:17+00:00,236770150,South Korea approves use of first homegrown COVID-19 vaccine https://t.co/kEczU37r0A #Health https://t.co/eQQT8822Zi #news 838,en
2022-06-29 15:00:15+00:00,882328032,"USA TODAY - See how many COVID-19 vaccines your state received, and how many people have been given one so far.https://t.co/RyCiCTTANP https://t.co/Wef2222sCh",en
2022-06-29 15:00:07+00:00,1281853279203241986,"@lszumigala149 @WendellHusebo @POTUS The FDA is still saying vaccines prevent COVID-19, which is false.  https://t.co/BIhAePWogO",en
2022-06-29 15:00:02+00:00,15741370,ELMO GETS THE SHOT: A public service announcement from Sesame Street dove into the question of whether it’s safe for kids to get a COVID-19 vaccine. READ MORE: https://t.co/ryPiuVvJbf,en
2022-06-29 15:00:00+00:00,1277922630,"GHC-SCW is now scheduling COVID-19 Moderna vaccines for members 6 months to 4 years old. Appointments must be made via the phone.  To make an appointment please call 608-662-4914! For the latest information on COVID-19 vaccines, please visit https://t.co/dyHaUtJv3I https://t.co/YiI3RnsscM",en
2022-06-29 14:57:37+00:00,1678161991,INFOGRAPHICS ON COVID-19 FAKE VACCINE#PNPKakampiMo#WeServeAndProtect#TeamPNP https://t.co/7XNp1txy4p,en
2022-06-29 14:57:01+00:00,144531738,@SilverdadAR @DashneyShannon @EcoFashionByBG @LouWall48323834 @abolishwokeness So your proof that vaccines are a joke is to show hospitalization data during a time when over 80% of all Canadians are vaccinated? You do realize that as vaccination rates go up the number of vaccinated Canadians hospitalized with COVID-19 does as well,en
2022-06-29 14:56:21+00:00,37716311,"Covid-19 Cases and #Vaccines: Latest Updates-- News, Social Impact | The Perfect Enemy: https://t.co/crBH2cu24O.#Coronavirus #MentalHealth https://t.co/yqMhl54Nx0",en
2022-06-29 14:56:02+00:00,20052710,Children under five years old are now eligible for a COVID-19 vaccine. A pediatric infectious disease specialist joined @WLRNSundial to discuss what parents and caregivers should know about the vaccines for kids and how to talk to children about it. https://t.co/n70TCOnS4Y https://t.co/OIMDltSzPX,en
2022-06-29 14:55:36+00:00,46780565,COVID-19 VACCINES FOR KEIKI AGES 3+ ARE NOW AVAILABLE at KTA Puainako Pharmacy! Schedule an appointment to get your keiki vaccinated:https://t.co/yVH6gzg1Z1 https://t.co/0DUc9VXMIe,en
2022-06-29 14:55:27+00:00,40737415,"Elmo gets his COVID-19 vaccine shot: 'A little pinch, but that was OK' https://t.co/9Y5IoEYeBf",en
2022-06-29 14:55:14+00:00,783214744463257600,▪ S. KOREA'S 1ST COVID-19 VACCINES. Korea's first domestic COVID-19 vaccine approved by Ministry of Food and Drug Safety#COVID19 #SouthKorea #vaccineArirang News ▶ https://t.co/mVDEocMIwsNews Center ▶ https://t.co/mZQ2egcir7 https://t.co/xj4PacHPdK,en
2022-06-29 14:55:06+00:00,405664289,"@CTVNews @fleurbleueinf You mean vaccine, after COVID-19 vaccine…",en
2022-06-29 14:55:02+00:00,167150943,"IN OTHER NEWS — Many people find themselves unsure whether to wait on new, updated formulations of the COVID-19 vaccines or to mix and match combinations of the original vaccine strains. https://t.co/t9ZHC1PKnq",en
2022-06-29 14:54:20+00:00,2939509486,"The Healthcare Sector Research and Development Intervention (Grant) Scheme was equally introduced to trigger research into the development of the Nigerian drugs and vaccines for the control, prevention and treatment of COVID-19 and other infectious diseases.#CBNInterventons https://t.co/EBECowdKbS",en
2022-06-29 14:54:04+00:00,2885929432,✓ South Korea Approves First Domestically Developed COVID-19 Vaccine #BreakingNews #time #RT ►►► https://t.co/G0pO3Y5j1W https://t.co/kXFSjANgKP,en
2022-06-29 14:53:59+00:00,1406611710,Thanks to ⁦@CharityNebbe⁩ and ⁦@IowaPublicRadio⁩ for inviting me to discuss the #COVID -19 vaccine for young children! #vaccinessavelives #thisisourshot Kids under 5 are now eligible to receive the COVID-19 vaccine | Iowa Public Radio https://t.co/Nq1ei8e3ix,en
2022-06-29 14:53:53+00:00,28821048,"@peeweeherman @ScienceChannel @discoveryplus During the COVID-19 pandemic, when the Pfizer and Moderna vaccines were being readied for distribution, which require strong refrigeration for storage, Chapman's volunteered the use of their industrial freezers for the Grey Bruce Health Unit for the vials.",en
2022-06-29 14:53:51+00:00,19543597,COVID-19 update for June 29: Facility able to manufacture millions of vaccines opens in Saskatoon | The U.S. FDA will decide whether to redesign vaccines this fall to fight Omicron https://t.co/VvYIHWDyvo,en
2022-06-29 14:53:32+00:00,282749294,"Looking forward to the conversation today!  ""Building Confidence in COVID-19 Vaccines For Younger Children &amp; Infants"" https://t.co/dsdMFsOWzn @Eventbrite",en
2022-06-29 14:52:53+00:00,4803494767,@gazowensdc2 Also look at the people bitching about losing a court case. Same people wants to take guns from other people. Same people forcing the Covid-19 vaccine on other people or threaten to fire them from their jobs. Maybe everyone just needs to mind their own business.,en
2022-06-29 14:52:02+00:00,179622536,IHCP to cover COVID-19 vaccine counseling as part of EPSDT benefit https://t.co/h3VWWB7gCo,en
2022-06-29 14:51:19+00:00,387416764,Checking onto this... Press Release: Independent Pharmacovigilance Report Confirms Evidence for Recall of Covid-19 Vaccines https://t.co/kMDOMlajvI via @WCH_Org,en
2022-06-29 14:51:10+00:00,1782513678,"The African Health Budget will convey a regional webinar on Thursday 30th June, 2022 on Understanding COVID 19 vaccines procurement and delivery mechanisms for Africa with CSOs and advocate.@AHBNetwork https://t.co/e9UadIIimq",en
2022-06-29 14:50:29+00:00,1580712540,"The same people who are mad at seeing Elmo get a Covid-19 vaccine shot are the ones not even a week ago screaming ""PRO-LIFE"" and celebrating the SCOTUS decision. So much for ""pro-life"", eh?",en
2022-06-29 14:50:00+00:00,136662972,"When Covid 19 vaccines appeared I was in Kenya. As instructed, I got the 1st vaccine available to me: Sputnik V. @TheLancet endorsed it. But it appears Russia fabricated the results, lying to millions of people who thought they were protected, but weren’t. https://t.co/4ZD1S5tT72 https://t.co/5DQEvO3eFN",en
2022-06-29 14:49:43+00:00,1537826190010077186,The COVID-19 vaccine is SAFE. Ithelps protect you from getting severely sick with COVID-19 virus.Vaccines help to keep families and communities safe.Protect yourself and others by getting vaccinated.Go get Vaccinated! https://t.co/TBVuLUofMw,en
2022-06-29 14:49:35+00:00,312037870,"Feeling inspired after reading @NewsweekEspanol’s latest article featuring @Pfizer’s Global President of Vaccines Nanette Cocero, PhD. Learn more about her background &amp; thoughts on how the COVID-19 pandemic has changed healthcare. #PFEColleague https://t.co/8t6HxMEHN8",en
2022-06-29 14:49:26+00:00,1249816994423152642,"@stringerbell99 @bunchanumbas @strcz @ohheyjenna @AOC No vaccine in history has had 100% efficacy. COVID-19 vaccines do, however, have very high efficacies when used &amp; boosted as prescribed. Every medicine out there is like that: must be used correctly. Medical research confirms lower transmission among well-vaccinated populations.",en
2022-06-29 14:49:09+00:00,944157923395166209,"Chamber of Deputies: MPs pass new Covid-19 law, expert opinion on vaccine mandate to be available by next week https://t.co/K0tUjyMDx8 https://t.co/orQAQggXG1",en
2022-06-29 14:48:31+00:00,71894191,29. June 2022. Norwegian Public Health is recommending and offering new booster dose for ppl&gt; 75. Increased deaths 2022 in these agegroups discussed: not one word about covid-19 Vaccine as possible etiology. One more shot! https://t.co/uLkfqiNfGO,en
2022-06-29 14:48:12+00:00,1409475221137014789,@kuabi_les @seanjward Dr Ryan Cole Idaho Doctor Makes Baseless Claims About Safety of COVID-19 Vaccines https://t.co/eZuq8odcHD,en
2022-06-29 14:46:42+00:00,1409475221137014789,"@kuabi_les @seanjward Robert Wallace Malone is an American physician and biochemist. His early work focused on mRNA technology, pharmaceuticals, and drug repurposing research. During the COVID-19 pandemic, Malone has promoted misinformation about the safety and efficacy of COVID-19 vaccines",en
2022-06-29 14:45:22+00:00,1481996169349840896,"Elmo is now vaccinated against COVID-19 (Entertainment Weekly, Variety, https://t.co/pgE8Hi78WU, ...)#SesameStreet #COVID19vaccine #Vaccines https://t.co/Px1N1Gh5av",en
2022-06-29 14:44:59+00:00,2835059080,"@Mikeggibbs ""I am in the hospital with heart complications from the Covid-19 vaccinesI want to inform as many people as I can About the risks of taking the vaccine that I wish someone would have told me"" https://t.co/Ceb06WkyWM",en
2022-06-29 14:44:46+00:00,528935588,"@JShijiu + it's the vaxxed who are getting repeat respiratory illnesses.""The study showed that immune function among vaccinated individuals 8 months after the administration of two doses of COVID-19 vaccine was lower than that among the unvaccinated individuals.""https://t.co/gPn1fqNuZP",en
2022-06-29 14:42:59+00:00,1409475221137014789,"@kuabi_les @seanjward Peter Andrew McCullough is an American cardiologist. He was vice chief of internal medicine at Baylor University Medical Center and a professor at Texas A&amp;M University. During the COVID-19 pandemic, McCullough has promoted misinformation about COVID-19, the COVID-19 vaccine",en
2022-06-29 14:42:47+00:00,489894993,Sen. Ted Cruz is in a fight with Elmo about COVID-19 vaccineshttps://t.co/5Vy1jhk2j3,en
2022-06-29 14:42:30+00:00,177321281,"""The pandemic is still raging. We need to take heed.""On June 17, the FDA authorized the emergency use of Moderna and Pfizer COVID-19 vaccines for children six months through 5 years of age. Here's what to know: https://t.co/EMB8BbCnjZ",en
2022-06-29 14:42:22+00:00,50626909,Sen. Ted Cruz is in a fight with Elmo about COVID-19 vaccines https://t.co/E7HmasxYyT #FoxNews,en
2022-06-29 14:42:00+00:00,34927577,"At least 14,000 National Guard soldiers are under the risk of being discharged after refusing to get the COVID-19 vaccine. https://t.co/qpqQGdrKay",en
2022-06-29 14:41:33+00:00,1239315181882224640,PubMed:  Safety and Adverse Events Related to COVID-19 mRNA Vaccines; a Systematic Review: CONCLUSION: Vaccines play a crucial role in controlling the COVID-19 pandemic and decreasing mortalities and the results of the… https://t.co/BPS7GAYhEf #covid19 #SARSCOV2 #coronavirus,en
2022-06-29 14:41:28+00:00,4803494767,@gazowensdc2 @RealPaigeWWE I can understand it in situations like rape or if there is a medical risk to the mother. But there has to be limitations. Also look at who is pushing my body my choice. It’s the same people who was pushing the Covid-19 vaccine on everyone or else lose their jobs.,en
2022-06-29 14:40:50+00:00,44362949,"Elmo gets covid-19 shot in CDC’s vaccine push for kids, prompting Ted Cruz criticism https://t.co/ktQVL3PQhc",en
2022-06-29 14:40:27+00:00,2473782116,"After DCGI approves Covovax vaccine for restricted emergency use in children aged 7 to 11 years, Serum Institute seeks its inclusion in national COVID-19 vaccination programme https://t.co/Xkhfl2LZxm",en
2022-06-29 14:40:03+00:00,20437286,Questions about #COVID19 vaccine guidance for kids 6 months and older? @CDCgov has answers to some common questions parents &amp; caregivers may have about #COVID-19 vaccination: https://t.co/OSDcLVqNsc #WednesdayWisdom https://t.co/gnkzUkjs2g,en
2022-06-29 14:40:01+00:00,1033651843,Coming off methotrexate doubles antibody levels after covid-19 vaccine https://t.co/9znnns0E25,en
2022-06-29 14:37:36+00:00,1473851349452599306,"Indias first mRNA Covid vaccine will be priced competitively, says company . According to manufacturer Gennova Biopharmaceuticals on Wednesday, Gemcovac-19, India's first mRNA Covid-19 vaccine, will be priced comparably with its...",en
2022-06-29 14:37:16+00:00,722567626409537537,"Looking for the COVID-19 vaccine in North Middlesex? The @MLHealthUnit mobile clinic team will be at the Parkhill Branch (229 B Parkhill Main St) today, Wednesday, June 29th, from 3:30 pm to 7:00 pm. No appointment is needed! https://t.co/oqknMER12V",en
2022-06-29 14:36:49+00:00,1531967058547822594,Which COVID-19 vaccine type and timing are best during pregnancy?#sciencehttps://t.co/WKTBmMLf8b,en
2022-06-29 14:36:45+00:00,1301258131780128771,Intracranial hemorrhage in a patient with COVID-19 vaccine-induced immune thrombotic thrombocytopenia and cerebral venous thrombosis:https://t.co/08rS6uZBez,en
2022-06-29 14:35:40+00:00,1453409215272431616,Good News! Now we have available Moderna COVID-19 vaccine for children’s 6 months – 5 years old. Just come in with your child to 828 E 149th Street or 3200 Grand Concourse.Get Vaccinated Today!#Essen #EssenHealthCare #HealthCare #Vaccine #Covid19 #ModernaVaccine #UrgentCare https://t.co/sLGb5w7Vzo,en
2022-06-29 14:35:33+00:00,1337754019163496450,Covid-19 Cases and Vaccines: Latest Updates - The New York Times: Covid-19 Cases and Vaccines: Latest Updates  The New York TimesView Full Coverage on Google News https://t.co/dASpgbXsuE,en
2022-06-29 14:35:32+00:00,1363525131616870400,COVID-19 vaccine for children under 5 being offered this summer at Blue Door clinics on South Side - Chicago Sun-Times https://t.co/Cp4kDNujZ8,en
2022-06-29 14:35:29+00:00,1104080147496480768,We glad to be part of the Ministry of Health Massive Advocacy Campaign on COVID 19 Vaccine Acceptance and Uptake in Mbale City and District.@MNYPA1 @OpenSocietyEA @AruweU @cehurduganda @SonaKimb @SiphoUganda @ankoleroyalty @TracyKirabo4 @FatiaKiyange https://t.co/ufofIH0oqu,en
2022-06-29 14:35:08+00:00,1476993928997998592,PNBN News: FDA's VRBPAC votes in favor of adapting the Covid-19 vaccine to the latest Omicron variant: The FDA’s Vaccine and Related Biological Products Advisory Committee on Tuesday gave the thumbs up ... #biotech #news https://t.co/N3M1Pi6eMY,en
2022-06-29 14:35:03+00:00,20683724,"As Novavax clears a key step toward FDA authorization, @uncglobalhealth researchers hope for a COVID-19 vaccine that can address vaccine inequity and demand. @UNC_SOM's Dr. Cindy Gay discusses the vaccine's advantages in design, delivery and storage #UNC https://t.co/dMmc3de2ly https://t.co/NHPdDyjyPZ",en
2022-06-29 14:34:33+00:00,497831813,"Only 2,826 of the over 14,000 17-18 year-olds in #Buckinghamshire have had three doses of Covid-19 vaccine as recommended by the NHS. Nearly a quarter of this age group remain unvaccinated. More at link: https://t.co/1XAFRNhfCD",en
2022-06-29 14:33:29+00:00,1354855405613150210,"@CKellyUAP Part 7. https://t.co/zvVkPINziQ Informed Consent. Fundamental Principle of Medical Law. Check box, I confirm. Type COVID 19 Vaccine. This means these were the potential side effects actually reported...... https://t.co/LIgUoV1lhu",en
2022-06-29 14:33:12+00:00,27943005,"Because the ghoulish governor and his demon sperm surgeon general don't believe in vaccines for your kids, the feds will work to supply Florida doctors with COVID-19 vaccines for infants, toddlers #DeathSantis @RemoveRon https://t.co/LabrKssx6b",en
