date,userid,tweet,lang
2022-01-09 07:32:50+00:00,408c41d3f4e4cead91892f935367c6bc,It is easy for older people to get their COVID-19 booster vaccine dose: call PHCC today on 4027 7077 to book an appointment at a health center; call the Urgent Elderly Care Unit in Rumailah Hospital on 33253128 or 55193240 https://t.co/AZUvJC9v3W,en
2022-01-09 07:32:48+00:00,0bec629300de0093b47b280b122062cf,@RiseofBurnol Are kids under the age of 10 less susceptible to COVID-19? If no then why no vaccine for them?,en
2022-01-09 07:32:26+00:00,02215036667037ca8fde60a557bd657ade73ef3bddfa536e5002d6c185e4d25b,Why your teen is more likely to get Covid-19 from the virus than the vaccine https://t.co/lLFcEpnT71,en
2022-01-09 07:32:09+00:00,8ed6d8cadfa541709877fcef6ccc6532,"@MCsquar98081045 @bonomi_a COVID-19 is a SCAM!!!No one should take these jabs! They are not a vaccine, but a poison, AKA spike protein!!! If you want myocarditis, reproductive loss, brain bleed, etc., take the jab!This virus has not been isolated! The vaccine is likely the virus!https://t.co/vtPR2HLJwN",en
2022-01-09 07:30:20+00:00,c6a1cac262007663dc5d2ccc5659c7ad,It is easy for older people to get their COVID-19 booster vaccine dose: call PHCC today on 4027 7077 to book an appointment at a health center; call the Urgent Elderly Care Unit in Rumailah Hospital on 33253128 or 55193240 https://t.co/V9uF9IrSsU,en
2022-01-09 07:30:06+00:00,00305656139690be71320b141c472cd7,It is easy for older people to get their COVID-19 booster vaccine dose: call PHCC today on 4027 7077 to book an appointment at a health center; call the Urgent Elderly Care Unit in Rumailah Hospital on 33253128 or 55193240 between 7am and 3pm from Sunday to Thursday; https://t.co/RdZdWKYmm2,en
2022-01-09 07:30:02+00:00,06473cd02757b6e48e8946d819a4e489,Tennis world number one on Sunday began his fourth day in immigration detention as Australian authorities finalised a legal defence for their decision to cancel his visa over his COVID-19 vaccine exemption. https://t.co/bRg2t55sH7,en
2022-01-09 07:29:38+00:00,cb08d1ec3527a9ca0ad8f749aabadb6d,"Hospitalizations skyrocket in kids with COVID-19 under 5, too young for COVID vaccines - https://t.co/w3g1AkfXrI https://t.co/HzK2D1c709",en
2022-01-09 07:28:26+00:00,f4dcac92d4ed442f21a7450c792627ee1079f2ab57ea2e697453499d8610a00b,大筋合意Army begins discharge of troops rejecting COVID-19 vaccine https://t.co/AaU5eeLDpk,en
2022-01-09 07:27:45+00:00,73e447958c6883266c6d2b7c867cc335cdcd26da41a22b290f0610cbdd70e4cc,Why your teen is more likely to get Covid-19 from the virus than the vaccine https://t.co/uH8JNsautr,en
2022-01-09 07:27:28+00:00,26ec5693d85f621820eab4ec9af7d185,"@IAmSimonDell @OMGTheMess ""16.4 per cent of Victorians aged 18 and over have had three doses of a Covid-19 vaccine""2 may be keeping them out of hospital, but not from catching or spreading Omicron. https://t.co/OJW5XO6gQt",en
2022-01-09 07:27:00+00:00,fcf447baac74637707253e08fbfea960,Distinguishing features of current COVID-19 vaccines: knowns and unknowns of antigen presentation and modes of action | npj Vaccines https://t.co/jHgFs1IF70,en
2022-01-09 07:26:07+00:00,bd365b92c3a954eda94621f0d9bb9a10,"@sheik_render @carlawalworth @cooltxchick I agree with you.  The only way some of these people could have caught Covid-19 is if it was airborne. And if that’s the case, we don’t just need a vaccine, we actually need a cure.  How close are we to that?",en
2022-01-09 07:24:30+00:00,bd48d3956b82d179833604cc7488d866,"French lawmaker Jose Evrard, whose vaccine-skeptic far-right party had opposed government measures to control the spread of COVID-19, has died after contracting the coronavirus.#COVID19 | #coronavirus https://t.co/W0eGZyEKz9",en
2022-01-09 07:24:26+00:00,9f849fd497fa124888757e9d1ff7a091,COVID-19 vaccine is effective in inflammatory bowel disease patients a... https://t.co/9Y7atvFSPh,en
2022-01-09 07:24:13+00:00,a971b7bce350b8cef87f94e35f8c89bc076e040e4ce57a570e2be3731734101e,Its legit minors have the authority over there parents if they seem fit.COVID-19 vaccines: understanding the mature minor and managing consent issues with young people - North Western Melbourne Primary Health Network https://t.co/9GIoK7QyY9,en
2022-01-09 07:23:34+00:00,39a198c7b85c4d68ea4c860d1724c06bd68d5e874817934c994f8b1ec0827828,"Got My 1st Dose Of COVID-19 Vaccine, “COVISHIELD”.🥰✌👉 Now It’s Your Turn.🙏🙏#COVID19 #COVID19Vaccine #vaccinated https://t.co/iI7yiKXoOX",en
2022-01-09 07:22:48+00:00,4aef1e550e8fdf45b2b4941b835cfc3c59089353dc5259318694bdc3f025c91f,"""The Washington State Legislature is slated to vote on a measure that will authorize the involuntary detainment of residents as young as 5 years old in “Covid-19 concentration camps, for failing to comply with the state’s experimental vaccine mandate.""https://t.co/m4xQVsqpys",en
2022-01-09 07:22:35+00:00,a6a15b9d1729aaf3137d3c14fac0130d,"Anti covid-19 vaccine rallies started in many European countries like 🇫🇷,Italy,Austria and Germany.recently in #France more than100,000 protesters across the country gathered and march against #covid-19  vaccine restrictions .mostly protesters are unmasked.",en
2022-01-09 07:22:13+00:00,a8c83235fbfe2183a01174ee208411a6,"""COVID-19 vaccines are effective at preventing serious illness and death, experts say"" Let's see the proof. Oh we are going to, because the data Pfizer tried to get locked away for 75 years is now going to be released because ICAN won in court. Their house of cards is collapsing.",en
2022-01-09 07:20:35+00:00,44effb14c04aabe134e9ebd1a80133d1a0a0b150e777820bcd7eb42602619ba9,"How difficult it is for the richest sportsman in a country to get a fake covid positive result ?          ⁦@DjokerNole⁩ is a liar . Period.Djokovic was granted vaccine exemption after testing positive for Covid-19 in December, court documents show. https://t.co/CfVGTZdW1y",en
2022-01-09 07:20:19+00:00,df762b1f458ed9a9280151082753f93e,@Skyizblue2 @JonathanSarfat1 @HwsEleutheroi Did you notice how these affects were confirmed? Through 4 scientific study. Now apply that method to the covid 19 vaccines.,en
2022-01-09 07:19:49+00:00,d3870b04ecd2652a30451425712abfc0,"@ricksinghk @Dom_Perrottet Surely you’re not serious. What do you think ‘herd immunity’ actually is? ‘As long as COVID-19 is able to mutate, lasting immunity is likely off the table Dr. Gregory Poland, head of the Mayo Clinic's Vaccine Research Group, said on Tuesday.’",en
2022-01-09 07:18:55+00:00,3f7512e339075fedb1104b538324269d,"सबका साथ, सबका प्रयास !!Over 2 crore teenagers in the age group of 15-18 years have received their first dose of Covid-19 vaccine in less than a week of the inoculation drive being launched for children. @narendramodi @mansukhmandviyahttps://t.co/lbWo6qV0m8via NaMo App https://t.co/tUodmJ2NT8",en
2022-01-09 07:18:07+00:00,a29192817188c08d8adcea5b8e0a6fd1,The vaccine effectiveness data might indicate that Omicron does not significantly increase risk of severe disease or death in vaccinated populations. But billions of people around the world are not vaccinated. Just 7% of Africans have received two jabs with the covid-19 vaccines.,en
2022-01-09 07:16:17+00:00,7a7794b4b062e315c8dc212ee69cd172,"There is a reason why PEI has the lowest COVID case count and no deaths. As of Jan. 5, 95.6% of eligible Island residents aged 12 years and older have received at least one dose of COVID-19 vaccine &amp; 92.3%  are fully vaccinated with two doses. https://t.co/CV08uJIOPM",en
2022-01-09 07:15:58+00:00,c121fe555d7008359e10b5a442f772b5,COVID-19 Vaccine Ingredients https://t.co/UEFbfY61aW,en
2022-01-09 07:15:50+00:00,9224158bee4faea090db2e53692679b111f84b1b15e75011c5a2e090e7491561,Concerns over whether COVID-19 vaccines have an effect on menstrual cycles https://t.co/OqPoM1CVb9 via @YouTube,en
2022-01-09 07:15:07+00:00,9429201198458b8c829e47151279f75d,Moderna donates 2.7 million vaccine doses to Mexico as COVID-19 cases surge https://t.co/eQw8igeQBf #SmartNews,en
2022-01-09 07:14:57+00:00,c2ae6ce413a13a25313db70ecba21dad,"JUST IN: 2,703,870 doses of the Pfizer COVID-19 vaccine arrived in the country on Sunday. These were donated by the United States via COVAX.Follow our live blog for more COVID-19 updates: https://t.co/SmAwtBWlCi https://t.co/mLwU33Q3hB",en
2022-01-09 07:13:37+00:00,a6238c3850e64cf7f1eb0cc92f6e1a1b9096a03e82b127d8cf035674046442f2,"Additional 2,703,870 doses of Pfizer COVID-19 vaccine arrive in the country through the COVAX facility.📸: PTV/screenshot https://t.co/aZ6Tlqighs",en
2022-01-09 07:12:39+00:00,11e24bb2bc1dda0681c3b184b68f967bab61a5e3bb8cc49da818402c25365d37,"No safety concerns were identified in a study of more than 35,000 pregnant people who received an mRNA COVID-19 vaccine within 30 days of conception. Pregnant people can get vaccinated against COVID-19 at any time during pregnancy or while breastfeeding.https://t.co/udwKOaxyrd",en
2022-01-09 07:11:53+00:00,fb0ab0e54cd23ee14df0917a925f78cf16e0879a47e53d7ec76bd285931febf0,@sophielouisecc Wikipedia: “ Michael Yeadon is a British anti-vaccine activist and retired pharmacologist *who attracted media attention for making false or unfounded claims about the COVID-19 pandemic and the safety of COVID-19 vaccines*.”,en
2022-01-09 07:11:14+00:00,3d12b3e1f621e9a3d5e121fd29f39376f0226e9ca871386b5984996815a7e36f,"#VaccinatieSchade Neurological complications, such as autoimmune encephalitis, demyelination diseases, Guillain‐Barré syndrome (GBS), seizures, and acute encephalopathy, have been reported in patients who received the COVID-19 vaccine.https://t.co/D00gOviKHe",en
2022-01-09 07:10:35+00:00,aa431719847a442983d302faeab04f94,Hong Kong rail operator MTR Corp issues Covid-19 vaccine mandate to its employees https://t.co/fgaoFkBgzv,en
2022-01-09 07:09:57+00:00,09a5985738a8e1979512c3b31ab8c1317be7f01b5560c63dd059c154fa18a03a,"Within the next 6 to eight months, the world will know what Pfizer COVID 19 vaccine really is and those that have not taken the vaccine will be relieved and justified. Research yourself through non traditional sources and use real peer reviewed data to find the true science.",en
2022-01-09 07:08:09+00:00,436e55d200be0c2857ab06ef8f9e6836,"The feature to book online slots for a ""precautionary dose"" of COVID-19 vaccine, through the government's CoWIN platform, was enabled on January 8. #boosterdose #CORONAVIRUS #COVID19 #COVID19Vaccine #COWIN #PrecautionaryDose #Vaccinationhttps://t.co/vTZZJlAjm2",en
2022-01-09 07:07:22+00:00,0102399ed67ea8762594638ffeb6c655,People flocked to Bangkok’s vaccination hub at Bang Sue Grand Station on Sunday as Thailand’s fifth wave of Covid-19 continued to spread.#bangkok #vaccine #thailand #ThailandNews #TheNationThailandRead more: https://t.co/XcXpG8PV4O https://t.co/WNyLie8M7d,en
2022-01-09 07:06:03+00:00,a138207f8fcc0c1ac2836a62f59c841b,"@vkoganpolisci Pfizer has been accused of “bullying” Latin American governments in COVID-19 vaccine negotiations and has asked some countries to put up sovereign assets, such as embassy buildings and military bases.https://t.co/h1gU74iuc9",en
2022-01-09 07:05:36+00:00,80b06da9b601e483e1bfc9964b6b0955,@Africanadian “If you do not have your medical contraindication recorded in the AIR you will need to show airline staff a medical certificate. This must state you are unable to be vaccinated with a COVID-19 vaccine due to a medical condition.”,en
2022-01-09 07:05:32+00:00,2e53c0316ed448135cf5c2156f52c131,"@curiosa_monika @Justplainbob1 @disclosetv Wow, you clearly don’t understand what vaccines do with our body? they prepare you and give you a taste of the infection. I mean, I didn’t check my antibodies before and after but that’s the idea behind that. So, yes… getting Covid-19 while being vaxxed is totally normal.",en
2022-01-09 07:05:08+00:00,ca6269278929f92e5d0a92d7323911e4,'No COVID-19 Exception to the First Amendment': Judge Sides with Navy SEALs Challenging Vaccine Mandate | CBN News https://t.co/UZpjTceRnq # via @CBNNews,en
2022-01-09 07:05:02+00:00,b147e34ce3a0aba6a20314e18061b27d3099a90c524cb53d4c5ac27ba441ef62,'No COVID-19 Exception to the First Amendment': Judge Sides with Navy SEALs Challenging Vaccine Mandate | CBN News https://t.co/MnzaWzWuMi # via @CBNNews,en
2022-01-09 07:04:45+00:00,12beded35ab9ca9c4ddb60a705cb312fadcf551ed4a23e6b4b05131732b3e1ba,Pfizer vaccine protects children against rare COVID-19 complication: CDC https://t.co/JpOWWyVY3Z,en
2022-01-09 07:04:31+00:00,6cd37301893463a72e16a5509123e6377cf4230413eb3bd02b61c276ca215f6e,"@isaacscaroline @dlgiv_ @AndrewBellBNN @seungminkim @nicnguyen @WSJ Hi Caroline, I understand your hopes. The reality is contagious COVID-19 will be around for a long time if community spread isn’t minimized. If a new strain is able to completely evade current vaccines, we may need a restart w/a new vaccine formula (in  development stages now).",en
2022-01-09 07:04:26+00:00,4a24cd3e869401b92aac224b76a5914b,"Covid-19: In Sweden, a vaccine passport on a microchip implant • FRANCE ... https://t.co/eyJcsXX7B5 via @YouTube",en
2022-01-09 07:03:36+00:00,f7b48fba7a11afe21ed9c5f125f176d6,"@JerasIkehorn Less efficacy of vaccine means more shots into the arm, 1,2,3,4,5,6… and the vaccine makers are thankful to Covid-19, Delta, omicron. What’s next ?",en
2022-01-09 07:03:32+00:00,b70ea888c6b29614debcfd1965f315d951857d32d7f3bbba40f1a5df0540a36a,"@Public_Citizen Our town's @Walmart shut down this morning for 2 days because their entire staff have COVID-19, and they have to disinfect the entire store. And the Republicans are seriously asking #SCOTUS to BAN vaccine mandates? WHILE PEOPLE ARE SICK AND DYING?AND the lawyers had COVID-19!",en
2022-01-09 07:01:42+00:00,0e76b31deca059cf95118cec8ea7c64c8bb3c04a2f53bed232c3ed3b22f9ad9a,"From tomorrow, children aged 5 to 11 are eligible for COVID-19 vaccinations SyringeVaccines are safe, effective and our best protection against COVID-19.",en
2022-01-09 07:00:46+00:00,15ed9b0c8284ab144b3273bd9786266a5759a6a76bdc1c7cc913bf32dd20f005,"@PriyamvadaGopal I’m aware this is a theory, but also plausible: the vaccine is a new product that needs an update with every variant, and we are all marketing it. So it would be within the reach of pharmaceuticals to not want to eradicate Covid-19, but to allow it to mutate.",en
2022-01-09 07:00:44+00:00,e775d172900c700c9da8d5a7ed8a41f894038daac28575f77e0cee2c81baa7e2,The UK Health Security Agency recommended against giving a fourth COVID-19 vaccine dose to the most vulnerable https://t.co/pvGe39M38T,en
2022-01-09 06:58:36+00:00,bdabe6f7e166abee3049458b16f67446,COVID-19 vaccines are our best hope of ending this pandemic - and rebuilding a better world #ForEveryChild. Get vaccinated and continue to:Wear your 😷 Wash your 👐 with 🧼 and 🚰Maintain social distance 👫#StaySafe #MaskUp https://t.co/3umbmPfuXm,en
2022-01-09 06:58:19+00:00,751498726111360a8873bf52b92e29b9,"79,000  Australians Filing Compensation Claims for COVID-19 Vaccine Injuries https://t.co/yOXvGzh3Cl",en
2022-01-09 06:57:34+00:00,219c71ea7d1bde228586a61456a35ad2abbda9948c98c1504dba5fc4f623b6fd,People in Beirut Rallying Against Mandatory COVID VaccinationA woman flashes a victory sign as she receives the Pfizer-BioNTech COVID-19 vaccine during a nationwide vaccination... https://t.co/RfJSk60jV9 https://t.co/nJEcOJ2SJe,en
2022-01-09 06:57:24+00:00,aaa911c7dce02616f2825b82836d9a6aa41d79bc3be910435c6bb93e982447d1,"This guy really needs help.  I feel sorry for him actually.  He is obviously missing love in his life.  This is what he is calling all of you peaceful &amp; loving Canadians that came together in Montreal on Jan. 8, marching against Curdew and COVID-19 Vaccine Passports. https://t.co/GjwaQ8SLtE",en
2022-01-09 06:57:24+00:00,6cc59114d61d318f6cf7b447bb2aed2743cd84abc163006e3c14089141ac81d5,"@finbarvano @KatiePavlich Here, we are talking about Covid-19 'vaccines', NOT about all vaccines...",en
2022-01-09 06:55:39+00:00,2fe59c445a2c4644c06866f25d81080c6240a234c6021d99038ad175d2bf9b02,@sagezza2 @helenzille Over a Thousand Scientific Study’s To Prove That The Covid 19 Vaccines Are Dangerous https://t.co/AnRAUEWDx5,en
2022-01-09 06:55:25+00:00,c999f03407575402f1fdf5949968bcdc,Novak Djokovic's COVID-19 vaccine status controversy timeline https://t.co/4vMqweP0hL,en
2022-01-09 06:55:06+00:00,563f7908dedb1c304dde77c308d7c934,"""At BioNTech, we are now going beyond covid-19 and investing in mrna-vaccine programmes to deal with diseases such as malaria, tuberculosis and hiv, which are still responsible for many deaths in lower-income countries.""https://t.co/ATQbezJH0U",en
2022-01-09 06:54:13+00:00,cfd4adc51fba9b0e46c21d7ec226f40a,Supreme Court Hears Oral Argument on OSHA’s COVID-19 Vaccination and Testing Emergency Temporary Standard and CMS Vaccine Rule https://t.co/ElQNS2cDyH,en
2022-01-09 06:50:51+00:00,3bcf5622a17b612b235d3d6f1510502f,"Okay, I think it’s time I used this platform for an entirely different purpose. While news of @DjokerNole is to hit the media circus tomorrow, questions around Covid-19, Australia, relevant visas, vaccines have a thought for those of us on temporary visas. (1/10)",en
2022-01-09 06:50:48+00:00,da7bb57ab5e617b32db26089bb6bd7b6044d6ec8bb739c82ac6a73673fdf3223,More than 155.95 Crore COVID-19 vaccine doses provided to States-UTs https://t.co/1JYZy87Pkx via @India News Diary https://t.co/rms6GaHfLE,en
2022-01-09 06:50:47+00:00,848cabce2d9e44ebd392a8c0b45e4b17,Proposed national COVID-19 Vaccine mandate: How #will it affect New Mexicans - Jan 9 @ 1:48 AM ET [video onsite] https://t.co/uz8eorDCz0,en
2022-01-09 06:50:42+00:00,735384cee69dd8f96b92bd8214401e3a,"Effective January 10, everyone seeking services at court halls will need to present a mandatory Covid-19 vaccine certificate and a negative test for Covid. The move is in line with adherence to the national preventive protocols against Covid-19. https://t.co/gvy2Bxb7js",en
2022-01-09 06:50:05+00:00,d7e6ebdc7b07538a2a2efd60e3e9dfe7,People recently infected with COVID-19 may be curious when it's safe and effective for them to get a vaccine or possibly a booster dose. Here are public health officials' responses to common questions.  https://t.co/dxcmmmIl5R,en
2022-01-09 06:50:00+00:00,d993f9631dc744ec984de56d0b366b09,"Bihar man, who allegedly received 11 doses of COVID-19 vaccine, booked; investigation underway#Vaccination #Bihar https://t.co/PTHOf5Rui7",en
2022-01-09 06:48:25+00:00,0234713b3ac2c3f4ab1b304e14a3452f19fabdf7cb2f5042a48b6c1e2cf2a424,"@ActivistsVoice @ccc74905bff84db @Cougarguy2 @Abn_RN Health Resources Services Administration announc[ed]that the HRSA COVID-19 Claims Reimbursement to HC Providers and Facilities for Testing, Treatment and Vaccine Admin…has paid over 5 million claims to health care providers for…COVID-19 vaccines to uninsured individuals.”",en
2022-01-09 06:47:56+00:00,4a32f12ff7904808b0abf523334b34c55de47a1dec411e0e1a42ac8fc753ae9b,"@ProphetKin @ssactrub Dude,you do realize that coronavirus is an entire group of virus and not just referring specifically to COVID-19 right? If you ACTUALLY read it and understand what it means then you would have realized that this vaccine is for regular coronavirus",en
2022-01-09 06:47:15+00:00,0443c6470fb5306b665389a8465bc74b,Djokovic readies Covid-19 vaccine exemption case for Australia visa showdown https://t.co/lyoe8BoMg5,en
2022-01-09 06:46:41+00:00,8fb1d404986e4f2b428cea617fcef203,09.01.22 | Update on COVID-19 Vaccine Availability in States and UTs - https://t.co/Ah6q4CjUeO https://t.co/eI38nVrDhs,en
2022-01-09 06:46:11+00:00,c8da958465383049d89e7a39e1c1010d,"UUP president on COVID-19 vaccine mandate, staffing at SUNY https://t.co/J9AAyDFh42",en
2022-01-09 06:46:08+00:00,e084fb5c35ae0b49e5b6011c3b429ecb,Pfizer/BioNTech vaccine protects children against rare COVID-19 complication - CDChttps://t.co/w1Gu4gQEpB,en
2022-01-09 06:45:30+00:00,6fcc82201f56cb1ac8d1b216b90b77ab17da2a1eb7ca8b4211f5ccd39de08726,"A year ago, everybody was ready for a booming economic recovery in 2021, all made possible by Covid-19 vaccines. Some were even saying the end of the pandemic was in sight.Then the Delta and Omicron variants arrived. Read the full articlehttps://t.co/xD4N30QP1f https://t.co/htFApQKtN3",en
2022-01-09 06:45:27+00:00,d93df1e4b5d3ae3dd6d2330b71ab888f,"After FDA says it can release COVID-19 vaccine data by 2097, federal judge orders all info to be shared this year https://t.co/Wk0ZCbnEsH",en
2022-01-09 06:44:28+00:00,79d6de842bbabaff27e20eb4c7e4d39d2f646e95eb058e470b09da86cd51fa32,@Monica2_Can Nobel Prize winner French Virologist Prof. Luc Montagnier claims that the COVID-19 vaccines itself are creating variants. He said that epidemiologists know but are “silent” about the “Antibody-Dependent Enhancement” (ADE) which makes you immunocompromised.,en
2022-01-09 06:41:21+00:00,95e3ac7192fb473a1d4ffafcad8a3d99,Moderna donates 2.7 million vaccine doses to Mexico as COVID-19 cases surge #SmartNews  https://t.co/6Xrc3UKVae,en
2022-01-09 06:41:11+00:00,19f6f32d271f081110b1a4557bfaed897961af9c94b05b1bbf1858256f1dbb58,"@samanthamaiden If Novak's lawyers' argument re what a contraindication is accepted, then will this open the flood gates? Everyone who has had covid-19 in last 6 mths might be exempt from vaccines.",en
2022-01-09 06:41:08+00:00,de3cbc21dd3b2dd1cd1661c38174e8cd062704baeb7c0930f51d776c0347c33c,HUGE PROTEST PLANNED AT PFIZER'S HEADQUARTERS IN NEW YORK AGAINST MANDATORY COVID-19 VACCINES https://t.co/DBuUkNKNWf #LBRY via @OdyseeTeam #VaccineDeaths #CoronaPositive #COVID19 #lockdownuk,en
2022-01-09 06:40:10+00:00,6a96c6ef43d0aa88ff933e96770c7025,"My name is Remruati Chawngthu , I'm 17yrs. I recently took my first dose of Covid 19 vaccine. I am very thankful to the Government for giving free vaccine for our protection. I request all our age group to take vaccine for our safety.#SabkoVaccineMuftVaccine      #vaccine4youth https://t.co/w9kAYI9oog",en
2022-01-09 06:40:04+00:00,4c29d1b4d7c4aa9261f28ba9ee718af9f1801e9c70d0db1f66665cab4a217d64,Moderna donated 2.7 million COVID-19 vaccine doses to Mexico as cases surge in the country. ... Pentagon flub delays Hawaii redistricting.https://t.co/0cpDsaKlPQ,en
2022-01-09 06:38:36+00:00,ff3fe2af128943a0a8a9fdaf3c6b4b8d,@RogerSeheult You're YouTube videos that fail to mention M-RNA vaccines and boosters as the BEST DEFENSE AGAINST COVID-19 amounts to disinformation. You are probably the reason my RN sister failed to get vaccinated and subsequently got the disease. You're a fraud.,en
2022-01-09 06:38:27+00:00,4c29d1b4d7c4aa9261f28ba9ee718af9f1801e9c70d0db1f66665cab4a217d64,"Belen Galvez, 15, gets her booster shot at the Berkshire Vaccine Collaborative's second COVID-19 pop-up vaccine clinic this winter at Berkshire ...https://t.co/MIUN5xkrH0",en
2022-01-09 06:38:23+00:00,4c29d1b4d7c4aa9261f28ba9ee718af9f1801e9c70d0db1f66665cab4a217d64,Long lines at Austin ISD COVID-19 vaccine clinic. Students and Austin ISD community members waited in long lines Saturday morning to get a shot or ...https://t.co/E9Q7jeOaCK,en
2022-01-09 06:38:10+00:00,4c29d1b4d7c4aa9261f28ba9ee718af9f1801e9c70d0db1f66665cab4a217d64,The Ontario government has made slots available at 10 additional COVID-19 vaccine clinics specifically for education and child-care workers in the ...https://t.co/yWlxd531s6,en
2022-01-09 06:37:56+00:00,d2bae8b17446c179d45a5735906378b6,"From tomorrow, children aged 5 to 11 are eligible for COVID-19 vaccinations 💉Vaccines are safe, effective and our best protection against COVID-19. Book your child in ↙️ https://t.co/CI33Hki0Nl",en
2022-01-09 06:37:07+00:00,be8bf0ee29ec3b901ca21190e1cb39d1,"Masks for toddlers ? 🤦🏻‍♂️🤦🏽‍♂️🤦🏻🤦🏿, only an uneducated idiot would set vaccine/mask mandates for children developing &amp; building up their immune system. It's a Fact, biden is Unfit For office.COVID-19 vaccine mandate blocked for Head Start Program https://t.co/NqWj7xRPgo #FoxNews",en
2022-01-09 06:36:38+00:00,2887af415854bc79d0450c76f0028a07c964f39abcb25518fdd9c16e8b23e1c6,Registration for precautionary dose of COVID-19 vaccine begins on CoWIN portal on Saturday https://t.co/pVeDvvm843,en
2022-01-09 06:35:33+00:00,ea68c1e8233b7f3b3355c9ddafa5da50,"German Health Minister Karl Lauterbach warned that it was ""naive to believe that Omicron is the end of the pandemic"" as he defended the introduction of a general vaccine mandate in the fight against Covid-19 and announced a reform of the country's… https://t.co/nrOSS08LWe",en
2022-01-09 06:35:19+00:00,516ad5e86a0d2058dcd8cbacd1ba9a1a,SL completes Covid-19 vaccine requirement! https://t.co/1pgeeLJolE,en
2022-01-09 06:35:18+00:00,5af7600e134f7b64d40b75df7f3dc7de,Novak Djokovic’s Vaccine Exemption Granted After He Tested Positive for COVID-19 in December . Court documents show that Novak Djokovic was granted vaccine exemption to play in the Australian Open after he tested positive for COVID-19 in... https://t.co/HpOTwtcYBb,en
2022-01-09 06:34:24+00:00,eb1937f668f45b536bb960d43442343213381fd652e747dfd96ba8a9fa243a0b,Federal judge refuses to block Rhode Island COVID-19 vaccine mandate for health care staff https://t.co/jDiVYY3fIK,en
2022-01-09 06:34:14+00:00,05f9e8cc907a2b6ae161f75c895f7e7a,"Among all the districts in Maharashtra, Pune has managed to vaccinate the highest number of adolescents so far, covering more than 1.48 lakh (24%) of its 15-18 years’ population with the first dose of Covid-19 vaccine. #Pune #Vaccination #Covid_19 https://t.co/rPtMJo5bMB",en
2022-01-09 06:33:46+00:00,378d53d5faa5302e35000b353c6fbf03,"#AlJazeera #Germany #France - Anti-vaccine protesters rally in France, Germany, Austria, ItalyMore than 100,000 people marched across France against government’s plans to introduce a COVID-19 vaccine pass.https://t.co/sUo7JpQJQU",en
