date,userid,tweet,lang
2022-05-23 23:59:18+00:00,1958224596,"Since most older people probably have significant immunity, including me, and since we do have vaccines, I don't expect this to be like COVID-19.But something is new about these outbreaks.  I'm hoping it's just limited clusters.  But hope is not a strategy.",en
2022-05-23 23:59:09+00:00,260215996,Looking to get your COVID vaccine or booster? There's a pop-up clinic near you. Visit http:///coronavirus/resources/covid-19-vaccine/community-clinics/upcoming-covid-19-vaccine-community-clinics?sf255989035=1 to find out where. https://t.co/xMPS4elky7,en
2022-05-23 23:59:03+00:00,1199834053,"@HollowsChris @1NewsNZ Apparently the Govt does understand ""Fact Check-COVID-19 public health measures do not violate Nuremberg code, COVID-19 vaccines are not experimental | Reuters"" https://t.co/pIQLQS06XV",en
2022-05-23 23:56:10+00:00,1359295016112422912,"Congratulations to Pfizer, winner of Gartner's 2022 Supply Chain Award for Customer or Patient Innovation. Learn more about our mRNA COVID-19 vaccine &amp; how we’re getting doses into patients’ arms #Pfizerproud #PFEColleague https://t.co/lGJAqAqhk3",en
2022-05-23 23:55:18+00:00,1404291198,@aspieactually @euro_trashed It’s not a big deal to wear a mask when grocery shopping.And more than 30% of people eligible for a third COVID-19 vaccine haven’t had it yet.We all need to work together to slow down transmission.,en
2022-05-23 23:54:37+00:00,886395614556246016,"If you allow your Children to get this,your the problem. They never(needed)it before but keep doing with they tell you. 🐑 If Pfizer's data pans out, when will little kids get the COVID-19 vaccine??https://t.co/yHSKasEK9F",en
2022-05-23 23:54:34+00:00,2156011614,CNN just ran a piece explaining that “scientists are urgently trying to solve” the question of whether the endless waves of Covid we now have “may be a result of the mRNA technology used to build some Covid-19 vaccines.”https://t.co/eeqx4hTokq,en
2022-05-23 23:53:23+00:00,28381177,CNN just ran a piece explaining that “scientists are urgently trying to solve” the question of whether the endless waves of Covid we now have “may be a result of the mRNA technology used to build some Covid-19 vaccines. https://t.co/kIM6BynGGI,en
2022-05-23 23:53:15+00:00,886395614556246016,"If you allow your Children to get this,your the problem. They never(needed)it before but keep doing with they tell you. 🐑 If Pfizer's data pans out, when will little kids get the COVID-19 vaccine??https://t.co/yHSKasEck7",en
2022-05-23 23:51:48+00:00,1348460167642238977,Arizona governor OK’s ban on school COVID-19 vaccines.https://t.co/Jv2zkeJp9e,en
2022-05-23 23:51:08+00:00,371504522,"I'm listening to The Sharyl Attkisson Podcast | 96. Vaccine Mandates, Passports and Choice in the Era of Covid-19 on Podbean, check it out! https://t.co/vKxBDf3UEA",en
2022-05-23 23:51:05+00:00,18527874,'Please get the vaccine': Macon woman who lost daughter to COVID-19 urges people to get booster https://t.co/54gHH5i7dA,en
2022-05-23 23:50:22+00:00,1176874982816833538,Hey – I’ve just signed this to tell the UK government to stop blocking access to Covid-19 vaccines for the global south. Will you add your name too? https://t.co/7OihmJtSzy,en
2022-05-23 23:49:57+00:00,500334056,"Continued; through bing, or you can look for it through Duckduckgo search engines, to everyone out there stays healthy and safe and stay sane too and it’s up to you if you want take the vaccine for the Covid-19 viruses also, and lets go Brandon; continued.",en
2022-05-23 23:49:48+00:00,536057528,LOL...COVID 19 VACCINE IS THE CAUSE!!! DONT ACT LIKE U DONT KNOW!!  ITS BEEN PROVEN &amp; UK MAN CASES DIAGNOESD COVID EXPERIMENTL KILLER VAX SHAME USADoctors baffled by severe hepatitis in kids as CDC confirms 180 cases https://t.co/SLk39N3Lwv,en
2022-05-23 23:47:06+00:00,264352849,Will You Need an Annual COVID-19 Vaccine? Here’s What Experts Predict https://t.co/BTWvwp3yvg via @SELFmagazine,en
2022-05-23 23:46:29+00:00,22597864,"@J_TheCynic @07HDSB ""A study of 11 million people found no increased risk of death among COVID-19 vaccine recipients""https://t.co/BmSqVSDv1Z",en
2022-05-23 23:45:45+00:00,15828025,"Three doses of Pfizer’s COVID-19 vaccine offer strong protection for children younger than 5, the company said Monday, another step toward shots for the littlest kids possibly beginning in early summer. https://t.co/i6aRwUtHT3",en
2022-05-23 23:45:02+00:00,26903206,Pfizer: 3-dose COVID-19 vaccine 80% effective in children under 5; FDA updates review schedule: https://t.co/FZGRS0VcMA https://t.co/I22hEHzjXS,en
2022-05-23 23:45:00+00:00,58479641,A few steps remain before COVID-19 vaccines become available for kids under the age of 5 available.  https://t.co/7hQ26vfTow,en
2022-05-23 23:44:21+00:00,451391625,"First Covid -19 vaccine was first administered on Dec 14. Thirty -six days later , One million . The US population is 331 million .",en
2022-05-23 23:43:51+00:00,1096933400668078081,@goldenrose_79 @lapublichealth You do know that vaccines are not meant to stop covid-19 never meant to help keep you out of the hospital which they are doing so vaccines are working they are doing their job no vaccine is meant to stop you from getting an illness,en
2022-05-23 23:43:44+00:00,1519989438323085312,"@karen6566a @MrDruCartier @davidkurten There are no fetal cells or chimpanzee kidney DNA in the vaccine. Just mRNA + buffers/stabilisers.If you've had Covid-19 then you've already had the spike protein mRNA in you. Around 2.5 trillion of them at peak infection, circulating through your entire body.",en
2022-05-23 23:40:54+00:00,128393462,"@mpc_xetts @Chewie65354432 @Sue31379894 @MamaTigress22 @9898guitar @GerardDelaney39 @ShelleyWilson30 @corruptbritain @scottschell7 @bulkbiker @CutmansCurse @NotRight510710 @PeterMurrayChem @GoodElija @liamalone69 @Nic21121970 @jacktrafalgar1 @dead_star_33 @jillkeene20 @ClaireH37444648 @USATODAY @US_FDA @CDCgov “Correlation and Causation” is the buzz word and cop out that you people use. Resource:https://t.co/ZZPaGS7ro2Go to that link. Scroll to bottom, check the box. Then:Type in “COVID-19 vaccine”Click on “adverse drug reactions”To get more detail, click on each reaction. https://t.co/eV2YqI26mK",en
2022-05-23 23:40:14+00:00,25562002,"U.S. FDA sets June meeting dates for Moderna, Pfizer small children COVID-19 vaccines https://t.co/rgcJsZz9wJ https://t.co/MvqijfBFp5",en
2022-05-23 23:40:00+00:00,15741370,"WHAT'S NEXT? Parents hoping to get their youngest children vaccinated against COVID-19 got some encouraging news Monday.Pfizer said three small doses of its vaccine offers strong protection to youngsters under 5, according to preliminary data.https://t.co/6nM78LNixB",en
2022-05-23 23:39:24+00:00,22597864,"@J_TheCynic @07HDSB It's a little hard to read but this appears to be counting hospitalizations for COVID-19... obviously it's going to go down once the vaccine takes effect.Even if I believe your conspiracy theory, you'd have to also believe that these people are going to die in the first 14 days.",en
2022-05-23 23:39:03+00:00,1103784300648914944,REPORT: Pfizer-BioNTech release COVID-19 vaccine data on effectiveness in children under 5 https://t.co/0rY5RJAVsL via @realdennislynch,en
2022-05-23 23:38:14+00:00,405866662,@rav222 @Clippersfann203 @SenJeffMerkley Please refer to the pfizer latest drop on data when it comes to the covid-19 vaccine. Upon release the  protection rate was only at 5% and they knew about it. Direct information from the developer and manufacturer by the way.,en
2022-05-23 23:37:21+00:00,1103784300648914944,REPORT: Pfizer-BioNTech release COVID-19 vaccine data on effectiveness in children under 5 https://t.co/0rY5RJAVsL via @realdennislynch,en
2022-05-23 23:36:17+00:00,1524831615364517899,"Three Doses of Pfizer’s Covid-19 Vaccine 80% Effective in Young Children, Company Says https://t.co/1rMV32aNmL",en
2022-05-23 23:34:04+00:00,1237861039829422083,Pfizer COVID-19 vaccine: when could little kids get the vaccine? https://t.co/y28FFrfWiA,en
2022-05-23 23:33:50+00:00,1419867080812232705,"Walgreens COVID-19 Vaccine Appointments Near You/Walgreens検索・予約（English） website was updated, visit the page! https://t.co/TqHHgBXRsK",en
2022-05-23 23:33:24+00:00,72786857,Covid-19: Updated Vaccine Pass available from today as old ones expire https://t.co/QImYMa4J01,en
2022-05-23 23:32:15+00:00,42589739,"Australia joins global mRNA push on vax | ""I would love to see a hepatitis C vaccine in humans within five years. And I think COVID-19 has shown us that it is possible to do that,"" @hdrummer1 tells @NC_Robinson  https://t.co/k7TEfnzdnW",en
2022-05-23 23:30:12+00:00,27583598,Pfizer says three small doses of its COVID-19 vaccine protect kids under 5 and that it plans to give the data to U.S. regulators later this week. https://t.co/Kk3bhxQc4p,en
2022-05-23 23:27:35+00:00,3091853545,"Pfizer-BioNTech COVID-19 Vaccine Demonstrates Strong Immune Response, High Efficacy and Favorable Safety in Children 6 Months to Under 5 Years of Age Following Third Dose https://t.co/2pR6A0x6DlPor ✒️ @BusinessWire",en
2022-05-23 23:26:03+00:00,1263882379757867009,Video: Boston doctor's key takeaways from Pfizer announcement on young kids' COVID-19 vaccine - WCVB Boston https://t.co/DpEWJB08W6,en
2022-05-23 23:26:03+00:00,318509758,Idaho vaccine data on our COVID-19 dashboard are not currently updated. Changes were made to Idaho’s Immunization Reminder Information System by the vendor over the weekend. Staff are making sure new processes work before we publish the data. We apologize for the inconvenience.,en
2022-05-23 23:25:32+00:00,424531030,FDA Will Assess Data On T-Cell Levels Produced By COVID-19 Vaccines https://t.co/60sQj08dLM,en
2022-05-23 23:25:17+00:00,2373130591,"@Jac67Roq @TmthyPatrick @pnjaban Never said it did .but the fact of the matter is the vaccine was created 8 years before Covid-19. They had it ready to be tested. So your insisting that its experimental is false, by all standards.",en
2022-05-23 23:25:14+00:00,137503927,"COVID-19 Vaccination for children aged 5 -11 years old starts Wed 25 May 2022 May 23, 2022:  The Ministry of Health (MoH) advises the public that the distribution of paediatric Pfizer COVID-19 vaccines to children aged 5 yes old to 11 years old will start on Wed 25th May, 2022. https://t.co/vHobdW1RhI",en
2022-05-23 23:25:09+00:00,1697751708,Coronavirus (COVID-19) Update: FDA Announces Tentative Advisory Committee Meeting Schedule Regarding COVID- 19 Vaccines6 months up vaccines come closer. https://t.co/ZDb8TgXxjT,en
2022-05-23 23:21:16+00:00,384438102,"In long-awaited data, Pfizer said its three-dose vaccine was 80% effective against symptomatic omicron COVID-19 infection among children 6 months to under 5 years old.@ALokPatelMD joins @LinseyDavis to discuss. https://t.co/w4H8Uxw42R https://t.co/WpfIRiP6gg",en
2022-05-23 23:20:53+00:00,2811559122,"Three child-size doses of the Pfizer/BioNTech COVID-19 vaccine appeared to be safe and showed a strong immune response in children ages 6 months to 5 years, the companies say. https://t.co/pVmNTwJ5Hs",en
2022-05-23 23:20:36+00:00,934499986552840193,"Air Force Academy grads may have to repay up to $200,000 in tuition after refusing Covid-19 vaccinehttps://t.co/AU30FdZkBC",en
2022-05-23 23:20:05+00:00,1435977855935172616,Pfizer-BioNTech announced its 3-dose vaccine for youngsters is about 80% effective against COVID-19 https://t.co/S2v8iH1dzW,en
2022-05-23 23:20:02+00:00,1203756106494857216,@jess_gallegos Getting a booster helps: • babies and kids under 5 who are still not able to get the Covid-19 vaccine• Cancer patients and others who are immune compromised• People who haven't gotten their booster yet,en
2022-05-23 23:19:08+00:00,1171120627253731329,BCHIP promotes COVID-19 vaccines and a smokefree pride day in NEW HOPE last week! https://t.co/wDwtqdNLQw,en
2022-05-23 23:18:09+00:00,2915115012,Covid-19: Updated Vaccine Pass available from today as old ones expire https://t.co/EVmSEoXl2V,en
2022-05-23 23:17:28+00:00,836358064693473280,Pilot Bob Snow Says the COVID-19 Vaccine Led to His Cardiac Arrest Minutes After Landing https://t.co/eT2IEZDjSS,en
2022-05-23 23:16:11+00:00,836358064693473280,Pilot Bob Snow Says the COVID-19 Vaccine Led to His Cardiac Arrest Minutes After Landing https://t.co/eT2IEZlJ1k,en
2022-05-23 23:15:46+00:00,1080972087047512064,“The key findings of our study of CVT cases from 130 countries are that the potential safety signal for the development of CVT was noted in mRNA-based COVID-19 vaccines as well as the ChAdOx1 nCoV-19 vaccine compared with the entire dataset.”https://t.co/S1QlsrXK5J,en
2022-05-23 23:15:13+00:00,1481564568845438976,What’s next for COVID-19 vaccines for youngest US children https://t.co/08foXK9Jil,en
2022-05-23 23:14:02+00:00,1241111930531532800,"On Tuesday, COVID-19 vaccines will be available in Eureka at Public Health Main as well as at Willow Creek Public Health. Vaccines remain readily available and, as always, Humboldt County’s vaccination and testing services are available free of charge. #HumCoCOVID https://t.co/x8dqWQyWnM",en
2022-05-23 23:13:09+00:00,151256278,Pfizer has asked a U.S. court to throw out a lawsuit from a whistleblower who revealed problems at sites that tested Pfizer’s COVID-19 vaccine. https://t.co/MKWOPCluk3,en
2022-05-23 23:13:00+00:00,1457407226411290627,Health Officials Set Plans To Rollout New COVID-19 Vaccine For Upcoming Fall And Winter Season https://t.co/ajncIrLlHE,en
2022-05-23 23:09:30+00:00,1483008916711743491,Health Officials Set Plans To Rollout New COVID-19 Vaccine For Upcoming Fall And Winter Season | https://t.co/lGxebbLHR3 | #NEWS #celebrity #insayt https://t.co/OI0vKafEtV,en
2022-05-23 23:08:27+00:00,732629411665719296,COVID-19 Vaccine Can Elicit a Distinct T Cell-Dominant Immune-Mediated Hepatitis https://t.co/HaTOU2Xqu8 via @bendedreality #COVID19 #COVID #vaccine #Hepatitis #tcell,en
2022-05-23 23:08:16+00:00,827771134233939968,Alex Jones’ Unfounded Claims That Monkeypox Outbreak Due To Covid-19 Vaccines - Forbes https://t.co/IBeVFt7yzx via @GoogleNews https://t.co/i4rvJrk9pq,en
2022-05-23 23:07:37+00:00,938533034659168256,"📬 I delivered “Access to Covid-19 Vaccine for Toddlers Needed Urgently” from Heather, a constituent in Rice, Minn., to @RepTomEmmer, @amyklobuchar and @SenTinaSmith #MN06 #MNpolitics📝 Write your own: https://t.co/z5540KFSKD https://t.co/xNc1HVTT6M",en
2022-05-23 23:07:04+00:00,40695119,"News Wrap: Pfizer says its COVID-19 vaccine offers strong protection to children under 5: In our news wrap Monday, Pfizer says three small doses of its COVID-19 vaccine offers strong protection to children under 5, the U.S. surgeon general warned of… https://t.co/Iks4qL0rYa https://t.co/fSNou3rQaK",en
2022-05-23 23:05:34+00:00,18269496,"Three Air Force Academy cadets who refused COVID-19 vaccine won't be commissioned, will receive bachelor's degrees instead, may need to repay gov't for education https://t.co/VJwmepCSDG",en
2022-05-23 23:05:31+00:00,40778270,- 63.3% of people have had three doses of a COVID-19 vaccine*- 83% of people aged 12-15 have had one dose of a COVID-19 vaccine- 79.3% of people aged 12-15 have had two doses of a COVID-19 vaccine- 50% of people aged 5-11 have had one dose of a COVID-19 vaccine,en
2022-05-23 23:05:30+00:00,40778270,COVID-19 update – Tuesday 24 May 2022 In the 24-hour reporting period to 4pm yesterday: - 96.4% of people aged 16+ have had one dose of a COVID-19 vaccine- 94.9% of people aged 16+ have had two doses of a COVID-19 vaccine https://t.co/kuOqlcrGVD,en
2022-05-23 23:03:59+00:00,1649005357,Studies link AstraZeneca and all three COVID-19 vaccines authorized in the U.S. to blood-clotting disorders. #TheDefenderhttps://t.co/Uj0mkYkXsq,en
2022-05-23 23:01:47+00:00,1475118661887266821,"Air Force Cadets To Receive Degree, No Commission Over COVID-19 Vaccine Refusal https://t.co/6A200Bxxzh",en
2022-05-23 23:00:48+00:00,4673120582,Third Dose of Pfizer COVID-19 Vaccine Proves to be Effective in Children Ages 6 Months to 5 Years Old https://t.co/7KLw6AdVgf,en
2022-05-23 23:00:08+00:00,23335901,What’s next for COVID-19 vaccines for youngest US children https://t.co/9WS6zoGBkQ,en
2022-05-23 23:00:02+00:00,62905430,White House COVID-19 response coordinator Ashish Jha says FDA is likely to decide soon on whether children under age 5 years should receive a COVID-19 vaccine dose.https://t.co/WpBTfoAy3G,en
2022-05-23 22:59:30+00:00,232898264,"Last Friday, Ducey signed legislation that will prevent state health officials from EVER adding a COVID-19 vaccine to the list of required school inoculations and bar face mask mandates in ANY buildings operated by state or local governments. https://t.co/DewACj9CV1",en
2022-05-23 22:59:11+00:00,1248509877921726464,"#onlinebusiness #digitalmarketing #makemoneyfast Health Officials Set Plans To Rollout New COVID-19 Vaccine For Upcoming Fall And Winter Season https://t.co/Jyrb4HIt0Y In an effort to get a jump on a potential spike of COVID-19 this fall and winter, h… https://t.co/Ot9n7jbnel",en
2022-05-23 22:58:31+00:00,971058885472804864,Health Officials Set Plans To Rollout New COVID-19 Vaccine For Upcoming Fall And Winter Season https://t.co/6s5Gi8i3Vi,en
2022-05-23 22:57:26+00:00,6577642,Pfizer reported that a third COVID-19 vaccine dose in children under the age of 5 produced a “strong” immune response.  https://t.co/FqSOEj34k6,en
2022-05-23 22:56:27+00:00,135864208,"Three Doses of Pfizer's Covid-19 Vaccine 80% Effective in Young Children, Company Says https://t.co/QIRis87cSA",en
2022-05-23 22:55:13+00:00,331244103,Here is the latest coronavirus in Colorado update for May 23. 📊COVID-19 data dashboard: https://t.co/LRM3AmL3XB➡️COVID-19 vaccine dashboard: https://t.co/V5pozaM8Wg#Covid19Colorado https://t.co/70o5q8AyLY,en
2022-05-23 22:54:27+00:00,2535654342,COVID-19 vaccine effectiveness in patients with cancer: remaining vulnerabilities and uncertainties https://t.co/cdeJtkJmmj @NicoleKuderer @senpattykuderer @double_whammied @OncoAlert @fredhutch @UWDeptMedicine @UWCancerVaccine @PergamIC @IDSA,en
2022-05-23 22:51:56+00:00,1519384587067027456,@johnsob20 @KATUNews Covid-19 vaccines do not prevent you from catching or spreading covid-19.,en
2022-05-23 22:50:55+00:00,821592481,#childsafety | California coronavirus updates: Pfizer hopes to get young children’s COVID-19 vaccine approved soon https://t.co/y4JBWqyHRY,en
2022-05-23 22:50:19+00:00,258102038,"This is what passes for public health advice from a public health board in Idaho's largest county. If you read the article, you see that Labrador and Cole, the anti-vaxxer, are also pushing to remove recommendations about the COVID-19 vaccines from the website.",en
2022-05-23 22:50:10+00:00,1727359892,"@tonyj_x @PeterHotez COVID-19 is definitely more lethal than flu, and death isn’t the only thing that’s worse. Both vaccines lower transmission, which helps the community.I vaccinate my kids against flu every year. They and millions of other kids who do the same are completely fine.",en
2022-05-23 22:50:06+00:00,126900006,The State Department of Health today announced its recommendation that children ages 5 to 11 should receive a COVID-19 vaccine booster five months after completing their initial two-dose Pfizer-BioNTech vaccine series. https://t.co/DVKGxwhlxH,en
2022-05-23 22:50:06+00:00,1354677973929046016,Have the leader lost their collective minds???Air Force Cadets Who Refused Vaccine Will Not be Commissioned Three cadets at the Air Force Academy who refused the Covid-19 vaccine will not be commissioned as officers upon graduating.https://t.co/ehSQCYK3q1 via @getongab,en
2022-05-23 22:50:05+00:00,14662354,"Pfizer: Children under 5 show strong immune response in three-shot, COVID-19 vaccine regimenhttps://t.co/4ZstCgFm0W https://t.co/pdX47kX8gv",en
2022-05-23 22:48:42+00:00,850727236281958401,Alex Jones promotes false conspiracy that monkeypox outbreak is due to Covid-19 vaccines Does he ever shut up!  https://t.co/hsA7eD9oGm,en
2022-05-23 22:47:00+00:00,621060143,#Pfizer and #BioNTech Granted U.S. Emergency Use Authorization for #Booster Dose of Their COVID-19 Vaccine in Children 5 Through 11 Years of Age #Covid19 - https://t.co/ZszIN2JfWL,en
2022-05-23 22:45:59+00:00,1522303426566176768,"@HealeyRhett @CentralLogic Not a lie, but purposeful information. Rogan literally told young people not to get the vaccine because he said, and I quote, ""I don't think it's true there's an increased risk of myocarditis from people catching Covid-19 that are young, versus the risk from the vaccine.""",en
2022-05-23 22:45:55+00:00,25357817,"The Ministry of Health (MoH) advises the public that the distribution of paediatric Pfizer COVID-19 vaccines to children aged 5 years old to 11 years old will commence on Wednesday 25th May, 2022. The vaccine will be available to all children within the 5 -11 years age group. https://t.co/3Wd11v7QR0",en
2022-05-23 22:45:35+00:00,1528792652598038528,"Decisions have consquences.  It's not about getting vaccinated or not, it's about being able to follow lawful orders.  And yes, it's a lawful order.Air Force Academy grads may have to repay $200,000 tuition after refusing Covid-19 vaccine https://t.co/pI3shyx2kV",en
2022-05-23 22:45:22+00:00,621060143,"#Pfizer-#BioNTech COVID-19 Vaccine Demonstrates Strong Immune Response, High Efficacy and Favorable Safety in Children 6 Months to Under 5 Years of Age Following Third Dose #CovidBooster #Covid19 - https://t.co/jgzCAtH126",en
2022-05-23 22:45:11+00:00,1251981278,"As of 4pm today, Cambridge is reporting:169 newly reported COVID-19 cases.0 newly reported COVID-19 deaths.80.7 cases per 100,000 residents, 7-day moving average.93% of residents with at least one vaccine dose and 77% fully vaccinated.More at https://t.co/YgmNLKcIMc #CambMA https://t.co/HU6YOc3En8",en
2022-05-23 22:45:05+00:00,25562183,"The Serum Institute of India (SII), the world's biggest vaccine maker, is considering setting up its first manufacturing plant in Africa as it looks to expand globally after its success in selling COVID-19 shots, its CEO told Reuters on Monday. https://t.co/5CyK0Dh4Zn",en
2022-05-23 22:45:02+00:00,1261305227220836352,Pfizer says children under 5 can get 3 low-dose versions of its COVID-19 vaccine https://t.co/AWZ64pKYyN,en
2022-05-23 22:44:45+00:00,23906611,"From Wednesday, children age 5 to 11 can begin receiving the paediatric Pfizer COVID-19 vaccine in Trinidad and Tobago https://t.co/kPygq6P35j",en
2022-05-23 22:44:42+00:00,1435263981409669125,Health Officials Set Plans To Rollout New COVID-19 Vaccine For Upcoming Fall And Winter Season https://t.co/bh713FRPSb,en
2022-05-23 22:44:26+00:00,761960459704606720,"Completely healthy 36-year-old mother, who died less than two weeks after receiving her first Covid-19 vaccine dose, has died due to inflammation most probably caused by the vaccine, the autopsy showshttps://t.co/L9ztvLPpZQ",en
2022-05-23 22:44:16+00:00,1197358428789850119,"Pfizer Moves to Dismiss Lawsuit From COVID-19 Vaccine Trial, Citing ‘Prototype’ Agreement",en
2022-05-23 22:43:58+00:00,1498923969763807232,(Pfizer Says COVID-19 Vaccine Response Robust in Young Children) has been published on The Globe - https://t.co/pnqtshZnLl,en
2022-05-23 22:42:30+00:00,1497048616640425985,Frontline Doctors: Experimental vaccines are ‘not safer' than COVID-19 - LifeSite https://t.co/IYwmHvLVmw,en
2022-05-23 22:42:29+00:00,1488471799188766722,5-23-20 TLAV Vaccine Operation Warp Speed Trump Slaoui Fauci Moderna Gates Connections Covid-19 Lockdowns https://t.co/ugOBB79Jyb #Odysee via @OdyseeTeam,en
2022-05-23 22:40:20+00:00,2311116235,"Three-dose Covid-19 vaccine produces strong immune response in young children, Pfizer and BioNTech say https://t.co/ISddWVUljO",en
2022-05-23 22:40:10+00:00,1270305070509371392,"""COVID-19 vaccines not only are ineffective in preventing cases and transmission, they rapidly lose protection against severe illness or death while posing risks.""We have better things to do than warning you about the #ClotShot day after day, #sheeple.https://t.co/VL5SSJXdI0",en
2022-05-23 22:39:33+00:00,1478333335948591105,Health Officials Set Plans To Rollout New COVID-19 Vaccine For Upcoming Fall And Winter Season https://t.co/ip5HaU1XTB,en
2022-05-23 22:39:18+00:00,3411957832,"THESE ARE COVID-19 VACCINES REACTION"" NOT MONKEYPOX https://t.co/lSD9GEtYr5 via @BitChute",en
2022-05-23 22:38:50+00:00,1508448925212188674,@NBCNews Monkey box aka Shingles is one of the adverse reactions to the covid 19 vaccine.,en
2022-05-23 22:37:48+00:00,2962805042,"Following Covid -19 and vaccinations. They? Wanted to vaccinate us all, including babies. Now the vaccine is pretty much useless all of a sudden there is no more baby formula? So, Momma's! Make your vegan baby food to keep your baby safe. Do not trust the new shipments! Later!",en
2022-05-23 22:35:59+00:00,1958659440,@Jutsch80 @realtim07519182 @kwnet_at @florianklenk Increased emergency cardiovascular events among under-40 population in Israel during vaccine rollout and third COVID-19 wavehttps://t.co/1euL2sJAYo,en
2022-05-23 22:35:34+00:00,362492835,Some folks haven’t even taken their Covid-19 vaccine (s) 😟🫣,en
2022-05-23 22:35:10+00:00,1101916240447188993,Immunity to #COVID-19 can be infection-induced or vaccination-induced. Cirrhosis associated w/ vaccine hypo responsiveness but also immune dysfunction. How does infection-induced immunity compare with vaccine-induced in #cirrhosis?Our abstract at #DDW2022 @ 4:30 pm #livertwitter https://t.co/Foakb2fdL1,en
2022-05-23 22:35:09+00:00,939418772,@DavidTYork COVID-19 vaccines. [this BS is actually circulating on SM],en
