date,userid,tweet,lang
2022-08-28 14:42:06+00:00,bd064f27d72a485b79b84fcbaf398d9f,Moderna sues Pfizer for patent infringement of COVID-19 vaccines - JURIST https://t.co/rvxYRZ9tRS,en
2022-08-28 14:40:47+00:00,94f344bf5643eb6e74e946a187ad3e19,"The British Government Has Begun Paying $140,000 for COVID-19 Vaccine Damage Victims https://t.co/NjbZy6BU7Z via @pamelageller",en
2022-08-28 14:40:01+00:00,d5fc3a5012f5a19df42150d9aa5b3300f1801e9c70d0db1f66665cab4a217d64,"The exceptionally rapid progress in COVID-19 vaccine development reflects years of researching and developing new vaccine platforms, most notably mRNA.Here's how the world moved so quickly in 2020 in response to the escalating crisis 🔽 https://t.co/VHpJSdeVEq",en
2022-08-28 14:39:50+00:00,4b1c33ee493280db0c6247ba7ad15ca3,🔊 @AndrejPlenkovic @MichealMartinTD @Xavier_Bettel @sanchezcastejon @jacindaardern Thanks for supporting #VaccineEquity through COVID-19. Will you join #GlobalCitizenFestival and pledge funds to the @WHO mRNA Tech Hub to empower developing regions to produce their own vaccines?,en
2022-08-28 14:34:57+00:00,452ea66bf8f4c6ad065405e8e7c5191f2f646e95eb058e470b09da86cd51fa32,"ABC Members Exempt from Federal COVID-19 Vaccine Mandate, 11th Circuit Rules https://t.co/daiBQvofHh #business",en
2022-08-28 14:34:50+00:00,fcd332b39f0ced043583949776c743935faa40f0391fc1b8fcc8da0e9d814164,Moderna Sues Pfizer Over Patents Behind COVID-19 Vaccine https://t.co/gLIAn4wqJC,en
2022-08-28 14:33:27+00:00,e0020801dad6550d87fd9d7409621363,"BCG vaccine provides protection from TB to young children, not  adolescents or adults: Lancet @LancetGH #TheLancetGlobalHealth #tuberculosis #TB #BCGvaccine #children #publichealth #vaccination #COVID-19 #TBdisease https://t.co/P1OpGseZyz",en
2022-08-28 14:33:00+00:00,d9401a041a1ac4b88c6d1d301e13b0efef66cd6bace5def972bf35bb8e325225,"The compensation programme will offer eligible individuals a fast, fair, robust and transparent process to receive compensation for rare but serious adverse events associated with COVID-19 vaccines https://t.co/UecmlHSvge",en
2022-08-28 14:31:45+00:00,5b99ab5950c40a789f7664a7098c8e51,Celebrated 200 crore COVID-19 Vaccine doses with Traditional Rangoli alongwith Medical Faternity. https://t.co/Bum2Fu8JUj,en
2022-08-28 14:31:09+00:00,135463d8b759ac8ed7cbb75a45a033bdc2bb5270d2212839bfbc50b04f5489b9,Somalia receives 1.6 million J&amp;J COVID-19 vaccine doses from Sweden and the Czech Republic – Somalia &amp; More Latest News Here https://t.co/gMMO4qZBz0,en
2022-08-28 14:30:25+00:00,fff5b44c29fba04c66cb4bc30bc5d50b,It's back to school time! Here are some essentials:✅ Book Bag✅ School Supplies✅ Covid VaccineGet ready for school with COVID-19 vaccines. Learn about how the vaccine works &amp; how safe it is for children from the pediatricians at the @AmerAcadPeds:https://t.co/TCUKj4nTHE,en
2022-08-28 14:30:00+00:00,c20128b5f0af5d4d9ba2dca265b869b6,"COVID-19 vaccines available in Stewiacke, Elmsdale next weekhttps://t.co/6MmVnooXHe",en
2022-08-28 14:30:00+00:00,5024dd9b8f0c90f90dc0261ad28ec382,"COVID-19 vaccines available in Stewiacke, Elmsdale next weekhttps://t.co/fIzttfnmcs",en
2022-08-28 14:29:02+00:00,f0447916813e2534e556195fe0d92317,"“Just a few days ago, the Biden administration indicated that the first updated COVID-19 vaccines would be available shortly after Labor Day to Americans 12 and older who have already had their primary series.” https://t.co/FqQv27w1Tr",en
2022-08-28 14:26:18+00:00,f4413624277ad04c8c4506610ac29e434c51b15f6955825ad4ee94e7dd5cd7cb,🔊 @AndrejPlenkovic @MichealMartinTD @Xavier_Bettel @sanchezcastejon @jacindaardern Thanks for supporting #VaccineEquity through COVID-19. Will you join #GlobalCitizenFestival and pledge funds to the @WHO mRNA Tech Hub to empower developing regions to produce their own vaccines?,en
2022-08-28 14:25:16+00:00,b314bd8a848ec5a59b3cc84f4ab36e9ce7f21fd95e14ce910057474476c3fa58,Mike Tyson 'beaten into submission' before getting COVID-19 vaccine https://t.co/gsjVnjp8y4,en
2022-08-28 14:25:01+00:00,015209ced54a30e2fcb12d97d541ceb2,The McKinsey COVID-19 Immunity Index shows fluctuations in degrees of protection over time. Higher scores mean that more people have immunity and that the community has greater protection against symptomatic disease. https://t.co/I5PLna2q6t#covid19immunity #covid19 #vaccines https://t.co/A3ObecqJC8,en
2022-08-28 14:24:31+00:00,72ebbd3b05d9f388646ea9f33c707eb8,@EpochTimes @JudicialWatch Same with Pfizer...Covid-19: Researcher blows the whistle on data integrity issues in Pfizer’s vaccine trialhttps://t.co/Ao0KcSpZ4Rhttps://t.co/H3MMrjZEoP,en
2022-08-28 14:24:05+00:00,f77e8a0bc5de56b8408d5e53f53d7be8,COVID-19 vaccines produced in Nigeria will meet international standards — NAFDAC https://t.co/H0p5dAikp2 https://t.co/ieOpfNAJyg,en
2022-08-28 14:23:29+00:00,e6a7281247a01776549df5d3c57659c5,Nigeria: Covid-19 Vaccines Produced in Nigeria Will Meet International Standards – NAFDAC https://t.co/UszTmQupRp,en
2022-08-28 14:23:20+00:00,7d0dc1b308dbf66b9e782bd8508193807635cf3bd1ef76e624f735752c7332a0,"@jakeshieldsajj Well, we KNOW, for sure, that this spike in deaths has absolutely nothing whatsoever to do with the Covid-19 Vaccines. Nothing at all. Not even one vax-related death. Zero. Zilch. Nada. Our chemical wizards and the politicians they own would NEVER lie to any of us!",en
2022-08-28 14:23:10+00:00,2a3e06e70e580052a0ddb22cdee93bc00de7c3003c81a9646f13be5396412fab,"As young people, we need to take a stand against the virus and get the COVID-19 Vaccine as well as the booster.The #COVID-19 vaccine is safe and it is important you @amaampofoa #getthejab @_GHSofficial @fhi360 @USAID @upsaccra @UnivofGh @AcCE_SRC @GIMPA_Greenhill @Breakthrough_AR https://t.co/vtzTHro6CY",en
2022-08-28 14:22:46+00:00,82c58876e00d0d8e6ef70420479eeab8b27768391d0feb2b6255c3ff94c6ce42,Yet notable civil rights organizations are silent as 40% of the District of Columbia’s black students who are 12 or older are barred from returning to school in person due to the city’s COVID-19 vaccine mandate.,en
2022-08-28 14:21:38+00:00,66461b94957160159354ae2928b814ab,"Time is running out for some 1,300 city Department of Education employees on unpaid leave for a year since the city’s COVID-19 vaccine mandate https://t.co/SQ7wijiTRc",en
2022-08-28 14:20:57+00:00,a3ea99d75a0c42a366d5a1decb7d6706410e577447ec350790eae9001265aadf,COVID-19: NAFDAC boss confirms Nigeria’s vaccines meet global standard https://t.co/LKfoMauhb3,en
2022-08-28 14:20:13+00:00,7ac812f1b8c01b5e9c77fd72e598f2c0ef66cd6bace5def972bf35bb8e325225,"@Cryptoknightenj @Salmander0 @adamKDean @IOHK_Charles So Pfizer announced the Covid-19 vaccineHaving also created Viagra, we can fully rely on a company that was able to raise the dead, to cure the living.",en
2022-08-28 14:20:11+00:00,8d92d937659d6bc89ef4acde62d274ca,A Sociological Look at COVID-19 Vaccine Hesitancy and RefusalMy research is available on @ResearchGate: https://t.co/xcLnLlsF8L,en
2022-08-28 14:17:40+00:00,262e46fdcf75c5c2efcf706f5850d1f47961af9c94b05b1bbf1858256f1dbb58,"@thebkstylez @robreiner ATTENTION DEMOCRATS: FIRST IT WAS COVID-19, THEN BLM, THEN DEFUND POLICE, THEN LGBTQ+, THEN JANUARY 6, THEN VACCINES, THEN MASKS, THEN MANDATES, THEN GUN BAN, THEN UKRAINE, THEN ABORTION, BUT IT HAS ALWAYS BEEN DANALD TRUMP! YOU’RE BEING PLAYED AND CONTROLLED! DONT BE A PUPPET! https://t.co/Ej5kmBBhiB",en
2022-08-28 14:17:20+00:00,562bc0999fb93340d667a311c95e6fac,@cnuijts @PrinceKrekel @WijfieM 'You must be fully vaccinated with the primary series of an accepted COVID-19 vaccine to travel to the United States by plane.' https://t.co/jrnQsFkTf2,en
2022-08-28 14:16:52+00:00,6dd606eaa886b3f607fbdd0d10bea54d,The FDA is expected to authorize modified versions of Covid-19 vaccines. The U.S. wants to roll them out before it’s too cold—but that’s before data comes in from human trials https://t.co/54d1xTylst via @WSJ,en
2022-08-28 14:16:30+00:00,18acacfb7b47aedc9af705d284bbb192,Novavax COVID-19 vaccine granted UK approval for 12- to 17-year-olds by MHRA https://t.co/8tZaz4BKE4,en
2022-08-28 14:16:14+00:00,7e42b5124039b0530541af627821ab8f28f2fa8e1ee3c2a628a9623bdb55581d,"@princess_bug6 @Lukewearechange Which one? If the goal was to encourage vaccination, why wasn't a single whole virus, inactivated COVID-19 vaccine given EUA approval? Almost 3 years in, and a vaccine technology over 100 yrs old is still in trials; when mRNA went full-boar in 8 months.",en
2022-08-28 14:15:02+00:00,f3ebd6b736ea7f897232b3ca1b02123f,🚨 COVID-19 VACCINE CLINICS: Aug 30  – Sept 4 🚨💉PFIZER and MODERNA 💉Ages 5+ are welcome (unless otherwise specified)💉3rd doses available for 12+💉4th doses available for those eligible 💉Walk-in only (unless otherwise specified) Come get vaxxed! https://t.co/kFq7jgRFHx https://t.co/xSEmdZc2xv,en
2022-08-28 14:15:02+00:00,6b5cea9e74eee8f68efd66033a715b42,Covid-19 vaccines saved an estimated 20m lives during their first year https://t.co/RkpRhV8KkL,en
2022-08-28 14:13:00+00:00,03c5f8d241ef7a1bef267c57d807a72a5759a6a76bdc1c7cc913bf32dd20f005,"COVID-19 vaccine boosters adjusted for the latest Omicron subvariants are likely to receive U.S. authorizations this week before their human testing is complete, according to regulatory submissions filed by vaccine makers, Pfizer (NYSE:PFE)/BioNTech (BNTX) and Moderna (MRNA).",en
2022-08-28 14:11:49+00:00,8ee3ab7091e44d8ecb1b5c6ac18f91c3,TUCKER CARLSON: Democrats are trying to shift blame about the COVID-19 vaccine to Trump https://t.co/R3pxxvQ4Tv #FoxNews,en
2022-08-28 14:10:36+00:00,0fa513d6c9f2c29751f7745365775ea4,My New video is releasing on my Youtube Channel Create Success Date: 28/08/2022 Time 8Pm TodayCovid-19 Vaccine really Work Our Immunity | Covid-19 Vaccine V/S Immunity Powerhttps://t.co/Das3kPpeUl,en
2022-08-28 14:10:01+00:00,e04f9559e2afd87130dbecade765564a,"With the COVID-19 vaccines now available for younger kids, there is a need to help cope w/ needle fears. One great way is to educate/discuss why we need vaccines &amp; what to expect. I read this beautiful book with my 4 y/o and she loved it, saying she was now ready for her vaccine! https://t.co/HEd5HC67ig",en
2022-08-28 14:09:26+00:00,6ae87e06935180289527d83e1276ee75fbfd54ec7516a52f5bedf757978fbed0,"Moderna suing Pfizer, BioNTech for patent infringement in development of COVID-19 vaccine | CBC News https://t.co/9B3gPITWhO",en
2022-08-28 14:08:59+00:00,baa1a39c603aa027f65d1bb88755524e,"SOMALIA RECEIVES 1,645,600 doses of the Johnson and Johnson (J&amp;J) COVID-19 vaccines from Sweden and the Czech Republic. So far, around 2.3 million people have been fully vaccinated against COVID-19 and over 1.9 million people partially vaccinated. https://t.co/9ry4yLaJow",en
2022-08-28 14:07:33+00:00,e9e69bb1910beb85f4fd63c213dd89c97961af9c94b05b1bbf1858256f1dbb58,#JusticeForAnkitaCovid-19 virus has a vaccine.But Islamic virus has carriers(muslims) not vaccine.So eliminate carriers to cure muhammadian virus..!!,en
2022-08-28 14:07:11+00:00,50e9ca5f2370c9e2181a50f68bebf2dc,Covid-19 Vaccines Produced in Nigeria Will Meet International Standards - NAFDAC @vanguardngrnews: https://t.co/p5H3JeeKNk #Nigeria #Coronavirus #Covid19 https://t.co/7H5Zv9W8vd,en
2022-08-28 14:05:00+00:00,152e9fb4170f81866fb8cda8526acee3,"Students are required to get the usual vaccines, but CMS does not include a COVID-19 or Monkeypox vaccine requirement. https://t.co/OlncgvMG9J",en
2022-08-28 14:04:44+00:00,faa76baea2211ab357b7c494ba0daf0d8f392400d539037d450d623a668b4f39,The Damage Is Undeniable The Only New Thing That Happened in 2021 Is the COVID-19 Vaccine https://t.co/IYFdHDq9mb,en
2022-08-28 14:04:24+00:00,0ecb8a21383b15d170a124002f59a543,"@adarpoonawalla @MoHFW_INDIA Sir, Took all kind of Covid-19 vaccines but still wearing Mask, I'm very upset.",en
2022-08-28 14:02:05+00:00,dfa5bf73aedd61e70479cad1b3093847820a80599938968d2e0e1771a32abb25,Glad to share our recent paper assessing the association between COVID-19 vaccines and uveitis. The review outlines the plausible pathophysiology and its management. Thank you @Jawad_Ahmed13 for all the support!@SummaiyyaWaseem@TahaGulshaikhhttps://t.co/vMW8Xcejj2#MedTwitter,en
2022-08-28 14:01:54+00:00,6cb323d4b950f230466fbeecb5c41eff,"🏫 School is easier when you have your friends with you. Keep everyone safe this school year and make sure you have all your vaccinations, including the COVID-19 vaccine. #Back2School #GetVaccinated https://t.co/yJlIog91jh https://t.co/gSLmiHgqMa",en
2022-08-28 14:01:47+00:00,c673c1a65476268965c5395bb3a5c835,FUN FACT: A recent study estimated that Covid-19 vaccines saved nearly 20 million lives in their first year of use.This was a monumental achievement by everyone.THANK YOU!https://t.co/wpznPNEgIv,en
2022-08-28 14:01:21+00:00,4a21071348f3e6da55fdc664b34fba22,Inside The Moderna Vs. Pfizer Lawsuit That Could Upend The COVID-19 Vaccinehttps://t.co/6NhH3zbfEn,en
2022-08-28 14:00:00+00:00,bc0cb97c23bd26f54591bed1922fb424,"COVID-19 continues to be a threat to the Army's readiness. Soldiers, make sure you meet the requirements of the DoD vaccine mandate by immunizing with one of the vaccine options mentioned in the story below.#VictoryStartsHere #PeopleFirst @PaulFunk2 https://t.co/KTYGxJzgGl",en
2022-08-28 13:57:47+00:00,1b46e72bdaef3df5e94927aeeb454d3b15fdb9fc85fcf1ddf5c44fba8762699a,"Covid-19 News Story that Has Me Concerned about More than the Virus | by Justiss Goode | Jun, 2021 | Medium - via @pensignal  Read this story https://t.co/QqveWQd8PZ about how one #teenager struggled to go against his parents wishes about getting the #covid #vaccine this year.",en
2022-08-28 13:57:01+00:00,96b850b55c99f09c6b5515da039bec9eadcf551ed4a23e6b4b05131732b3e1ba,@Thirdtimeluck15 Covid -19 vaccine adverse reaction.,en
2022-08-28 13:55:52+00:00,93a0f34dcd0140e501b81aa8c5b76a19c5b1f8449c7dc51cb6d46912a8a5c008,"@AwakenedSwede @Rosse1111 @A_sick_world ""Michael Yeadon is a British anti-vaccine activist and retired pharmacologist who attracted media attention for making false or unfounded claims about the COVID-19 pandemic and the safety of COVID-19 vaccines""",en
2022-08-28 13:55:27+00:00,f48ddfa332c2a707435de79b67849123,@kacrn91 FDA-approved SPIKEVAX and the EUA-authorized Moderna COVID‑19 Vaccine have the same formulation and can be used interchangeably without presenting any safety or effectiveness concerns.https://t.co/8MBJ5eleZ6,en
2022-08-28 13:55:27+00:00,6a509beed887d752002f297635b41a839aba482d39f0c07da1d753218a30c24d,Operation Nasal Vaccine—Lightning speed to counter COVID-19 | Science Immunology https://t.co/Nj3myq4P7H,en
2022-08-28 13:55:05+00:00,704ae699490678370b7e30ad7d3af1a5,"The British Government Has Begun Paying $140,000 for COVID-19 Vaccine Damage Victims https://t.co/gQwA8ETtFv via @pamelageller",en
2022-08-28 13:54:41+00:00,f0d7db3ac98e1848bef8c06fb32a314f6f9adb7e2f20c44c9a9f890951e3fc3d,"@BenSkyWatcher1 @thetamoonshots @DrJamesOlsson Check it out.  Go to VigiAccess and click the box on the bottom, then  search for covid-19 vaccine, all, and you will see 5 million reports of adverse events.  And statistically these systems are 1-10% underreported.",en
2022-08-28 13:52:19+00:00,66c7f4c2a910b1c942f0e512271c9305,"@HEhastheanswer @robbystarbuck Fact Check-No evidence COVID-19 vaccines have caused increase in cancers, contrary to claims made on social media  https://t.co/l0dMPzQsf2",en
2022-08-28 13:51:31+00:00,6a370cff106dfeca1a8b445a188b668f28fc0e92190b87c0dc2468d0c64ea5a6,🔊 @AndrejPlenkovic @MichealMartinTD @Xavier_Bettel @sanchezcastejon @jacindaardern Thanks for supporting #VaccineEquity through COVID-19. Will you join #GlobalCitizenFestival and pledge funds to the @WHO mRNA Tech Hub to empower developing regions to produce their own vaccines?,en
2022-08-28 13:49:54+00:00,1d04e9dea8d9b9796024bf119347321f1c66c04618671a7616b55e84f16ef963,Moderna sues Pfizer over COVID-19 vaccine patents : Shots https://t.co/xairAJuCQP,en
2022-08-28 13:49:43+00:00,4eba266ade749c5897da80772dbfbaaf,"The British Government Has Begun Paying $140,000 for COVID-19 Vaccine Damage Victims https://t.co/XJHO1owhQG via @pamelageller",en
2022-08-28 13:47:14+00:00,2570a0b4daffd79f3c5da91ca1446327,"""Effective tools for prevention and control of COVID-19 (vaccines, prevention measures) are available; if utilized, the road back to normality is achievable even without achieving classical herd immunity."" Notice that vaccines alone are not enough: also need prevention measures.",en
2022-08-28 13:46:29+00:00,ccff4873884eba7eab9f1e3d44c50715c2bb5270d2212839bfbc50b04f5489b9,"@BrautigamRoland @ADnl @RTL4 @DeTelegraaf_MUN @mkeulemans @MarionKoopmans What is BNT162b2 and what is it used for?BNT162b2 is a vaccine indicated for active immunisation to prevent COVID-19 caused by the SARS-CoV-2 virus, in individuals 12 years of age and older. Prevent? Ahahhahaha",en
2022-08-28 13:45:33+00:00,711a8a848fc68b55fd26614dfe76dcc6,"COVID-19 vaccination is available for children 6 months of age and up! #Vaccination is strongly recommended for protection, including for those who have had #COVID19 disease.Visit https://t.co/H7XaJ7oWQ6 or call the WV COVID-19 Vaccine Info Line: 1-833-734-0965. https://t.co/UR93kFLbId",en
2022-08-28 13:45:12+00:00,c0ce505119f48ec70b17b19d90249e37d3ae4f154a3d4182019b72e1ec047bf7,"@charleyb2355 @No1NicLochlainn @guest_7th @adamajacoby @DrEliDavid @dynamat ""...Such examples of outcome reporting bias mislead and distort the public’s interpretation of COVID-19 mRNA vaccine efficacy and violate the ethical and legal obligations of informed consent.""",en
2022-08-28 13:45:09+00:00,483778c6c7fc7a09e9241a019152c6d3,"Now do you understand why Pfizer wanted no liability from their vaccines? The British Government Has Begun Paying $140,000 for COVID-19 Vaccine Damage Victims. https://t.co/kE9VSrOtGR",en
2022-08-28 13:42:37+00:00,a313df440cea12fcc5efa1021d2faa4a43e62c7dcc04846aaa07447d40767fa8,🔊 @AndrejPlenkovic @MichealMartinTD @Xavier_Bettel @sanchezcastejon @jacindaardern Thanks for supporting #VaccineEquity through COVID-19. Will you join #GlobalCitizenFestival and pledge funds to the @WHO mRNA Tech Hub to empower developing regions to produce their own vaccines?,en
2022-08-28 13:42:04+00:00,3c295484f7109b4e5c5038c37529d98e,NAFDAC vows to certify local COVID-19 vaccines to international standards https://t.co/Fw6wlRvGub,en
2022-08-28 13:40:44+00:00,6ca29b4fa52b3e7362d158e9de9997aad23d5bebe4ed1b2faf07bf51376be2ef,NAFDAC vows to certify local COVID-19 vaccines to international standards https://t.co/CN2F6VCXgs,en
2022-08-28 13:40:38+00:00,4b2bd2ea52306056f6e9469ebe07ab3c,#Moderna files patent infringement lawsuits against Pfizer and BioNTech over mRNA Covid-19 vaccines - CNN https://t.co/C0zFqOnlDL,en
2022-08-28 13:40:00+00:00,9b32372e1027f4be1fd32c1e40067f85,"The Central Epidemic Command Center (CECC) said on Sunday that 8,687 children between the ages of 6 months and 4 years old received a first dose of the Pfizer-BNT COVID-19 vaccine on Saturday. https://t.co/hiZCRTWy4z",en
2022-08-28 13:37:57+00:00,6f1a77b42d244a279da8c4dba62a60a3,Why doesn’t @KathyHochul stand up for these rights! #StoptheShots @NYCMayor you are committing #CrimesAgainstHumanity #Covid_19 #vaccines cause #VaccineSideEffects #vaccineinjuries #VaccineDeaths https://t.co/8zFsEXgMzl,en
2022-08-28 13:36:55+00:00,bcbd98857dccaf3e3048a8bfbc2be324,"Oh ...The British Government Has Begun Paying $140,000 for COVID-19 Vaccine Damage Victims. https://t.co/7q4TnVV2gu",en
2022-08-28 13:36:31+00:00,c0539bd044e89653a0a2b0a3949db0ac903388681b2b43b235969cc012a44557,"@Bel_B30 I'm surprised they're allowing comments for now.Remember those YouTube banners, ""Get the 'facts' about the COVID 19 'vaccine'""?Then those videos turned off comments cos they were getting absolutely mullered.",en
2022-08-28 13:35:31+00:00,9934e9798a0c57871575a4fd0687c8fb82f9660b63fdd777625ef092eb876ab8,COVID-19 vaccines produced in Nigeria will meet international standards  NAFDAC https://t.co/8a26mseWnk,en
2022-08-28 13:33:17+00:00,d1c2a309f77294d6587000f5f4771d43c860d037b6d4d5d6353695e610c27ea3,"This is important. A study of prisoners during the Omicron wave found that among individuals with COVID-19, those who received at least one vaccine shot were 24% less likely to infect close contacts (i.e., cellmates) compared with unvaccinated prisoners. https://t.co/peac1ENcxD",en
2022-08-28 13:32:05+00:00,54c7d54d7f71fd81a92f0d3c2b4f75da7cf4230413eb3bd02b61c276ca215f6e,@10DowningStreet is paying out for COVID-19 vaccine injuries. https://t.co/T41A1cZGq4,en
2022-08-28 13:30:31+00:00,abdbaaf232c5763b318609dd6b0c87d1,“Pfizer and BioNTech Advance COVID-19 Vaccine Strategy With Study Start of Next-Generation Vaccine Candidate Based on Enhanced “Spike Protein” Design”https://t.co/5bocjC8bNM https://t.co/ZKFTOM0BrZ,en
2022-08-28 13:30:00+00:00,ad4b799debcba733c133a33d5cbce8f3,"Before term starts, make sure you're up to date with your MMR, HPV, MenACWY and COVID-19 vaccines.If you've missed one or more of these vaccines visithttps://t.co/nAN0JZxv6q to find out where you can access these in your area.#Vaccines4Students #NotTooLateToVaccinate https://t.co/pxs7YnRCuQ",en
2022-08-28 13:29:53+00:00,2d3c13c1db46e0ca80c7c88d141af1e4c5b1f8449c7dc51cb6d46912a8a5c008,COVID-19 vaccines produced in Nigeria will meet international standards – NAFDAC https://t.co/gEwjowrEDC,en
2022-08-28 13:27:45+00:00,6a9c3a839228e63e2891a17226019ae7574fd5620b498524d1d7a0cb963556d9,"“The couple, now partners in #science, business, and life, had never owned a TV and stayed off social media, relying instead on select online publications they considered worthy of their attention.”—The vaccine, inside the race to conquer the COVID-19 pandemic, Joe Miller https://t.co/6Cd6pE0fli",en
2022-08-28 13:26:45+00:00,9461a3ec5537612a23834a7b202c8009,"@SynicalClinical @JASB1001 @waynerohde @KVandetti And time has already told. I have not lost a single vaccinated patient to Covid-19. ( BTW my partner is the full time intensive care specialist at our hospital, he worked nearly 24 hrs/day prior to the vaccine, watching many die).",en
2022-08-28 13:24:26+00:00,ee7a0da33ba3e825593570f308c41f2acb8cfa55c0ef24869677a7b5d213677f,"""430. Will a Covid-19 Vaccine Change the Future of Medical Research?"" by Freakonomics Radio https://t.co/dupvvZb3pH #economics #podcastSee more posts at https://t.co/lo9TyPHhtw",en
2022-08-28 13:23:09+00:00,6a0d5ccf1a8f8c19b982b3bbc178771794038daac28575f77e0cee2c81baa7e2,"@BioVisionary @BeckyWi70473387 @rhonda_harbison @laurenboebert Go to the VAERS data, Israeli &amp; European research &amp; countless Doctors including at John Hopkins are coming forward now to reveal how the Covid-19 vaccines were anything, but safe &amp; effective. My healthy neighbor got the jab &amp; was dead two days later. World class athletes died too",en
2022-08-28 13:20:14+00:00,5ecad3fa17499cf10f16440764536485,They've got the COVID-19 vaccine.,en
2022-08-28 13:15:49+00:00,77359c5ed97b19fc8c9c9b38dd8a3d24de73ef3bddfa536e5002d6c185e4d25b,"@freedomlover717 @tingxiao7 @PeterSweden7 The only study that ""proves"" vaccines cause autism is undeniably fake. Autism startsbin the womb. You can't get autism. The worst a vaccine can do to you is an allergic reaction (or numerous side effects if we are talking about the covid 19 vaccine because it was rushed)",en
2022-08-28 13:14:28+00:00,3c2dc0a19b9f24680db8820f18be27e5,COVID-19 vaccines tweaked to better match today’s omicron threat are expected to roll out in a few weeks. How much will they help? https://t.co/TBWaoQKOxd#covid #Omicron #CovidBooster #Healthcare #health #Vaccine #SundayMorning #SundayThoughts https://t.co/HL1d5saPGo,en
2022-08-28 13:13:05+00:00,a1ddc7cddf63a17caf7feb2de8d4e0312a8fd57e979a12401ccbd6a9401da8a2,@tulipxwy Covid-19 vaccine to senior citizens and children ages 5-10,en
2022-08-28 13:11:32+00:00,a8f94ef7ea82da891b2655272e041c246d4d5b14be9a1917202a8cbbd2b20a8f,In the middle of a global health crisis we must prioritize public health over the profits of Big Pharma. Tell @JustinTrudeau and @mary_ng to support waiving COVID-19 vaccine patents: https://t.co/sapJ1d4OR2 #cdnpoli,en
2022-08-28 13:11:30+00:00,78e00c440ebd243de5158810bbfaaddab6f79280101362d8109c6079e1cfd156,U.S. donating COVID-19 vaccines to Mexico as domestic demand drops  https://t.co/m1ZnEUahlz,en
2022-08-28 13:10:59+00:00,5fcee1d8f240d3af3f4f83ea9c406e8d,@tr6_guy @cafreeland Canada ordered more than 400 million COVID-19 vaccine shots. Pop 38 million. That's 10 shots per person. That's why he's pissed at the people who chose not to get vaccinated.,en
2022-08-28 13:10:40+00:00,7f729c075946445b4eb743b58d8e7c46cdfd804906ebfafb77307f82fb6ed7e8,COVID-19: NAFDAC boss confirms Nigeria’s vaccines meet global standard https://t.co/Tgj9niMz7Q,en
2022-08-28 13:08:50+00:00,02c845a3fd61d43fb8ff982c58937758,Moderna sues Pfizer over COVID-19 vaccine patents : Shots - Health News : NPR https://t.co/IjMWughXZq,en
2022-08-28 13:08:39+00:00,9bcfa82a2205ac80009ea323b0400523390fd13c6f338f1c585be94c031bde75,"@matthewjay0 @huronatwestern @WesternU I had Vaccines Mar 31, June 4, Booster Dec 6 2021. Feb 13 2022 I tested Pos for Covid 19. This is over time to move on.",en
2022-08-28 13:07:22+00:00,cf030d960bb31a320087cdf48f1b07d2f6bdd3bba9746466c30f31257ce2a1af,"""David was always pro-vaccination but so much about the Covid-19 vaccines raised alarm bells for him. He was coerced into taking the jab under immense pressure, until his own rigorous research led him to conclude unequivocally that something was very, very wrong""",en
2022-08-28 13:06:07+00:00,6cab9ef5ce417c2f8586c851e067279e,COVID-19: NAFDAC boss confirms Nigeria’s vaccines meet global standard https://t.co/NERWDHR6XH,en
