date,userid,tweet,lang
2022-11-10 18:52:02+00:00,51884df1066dd405021879e14bd66ecf,"There is a BIG problem with authorities language,that reinforce the idea that COVID-19 vaccines stop you getting COVID-19. They don’t. Current vaccines reduce symptoms of the early infection,in most,which is good but still leaves you open to organ damage &amp; long covid. Wear an N95",en
2022-11-10 18:51:32+00:00,cf939f8df76e0f53242f0f5e415e95eb,Senior Editor At British Medical Journal Speaks Out About COVID-19 Vaccine Safety Concerns https://t.co/z7leytd1gT,en
2022-11-10 18:51:11+00:00,ece28135c0949b6880da8994c8a5d9a1,"Individuals submitting Form I-693, Report of Medical Examination and Vaccination Record, on or after October 1, 2021, must provide proof of vaccination against COVID-19. Learn more in our latest Vaccine Advisory:https://t.co/lI1BjuiNgU",en
2022-11-10 18:50:59+00:00,a2300509be980fb0e5c0865953d56f3e66f4d07eb42c00a2fa0f30ada02c72aa,@mkwlbert2552 @samanthamarika1 😂😂… and the fact that the so called ‘Vaccine’ (gene therapy) does not stop you from getting Covid-19 or spreading covid-19? Pfizer admitted that zero tests were done on transmission. So how did this help ANY vaccinated person at work?,en
2022-11-10 18:50:58+00:00,0a2a611cdf1802fcb32b1ffef940fcc8fa91d6487ea94af5173c44944a3f9ec5,"@FHeijblom @harryhol Campbell zegt over aspiratie hetzelfde als deze studie""in vivo evidence that inadvertent intravenous injection of COVID-19 mRNA vaccines may induce myopericarditis. Brief withdrawal of syringe plunger to exclude blood aspiration may be one possible way to reduce such risk.",en
2022-11-10 18:50:07+00:00,25ecb593f6c2b84dae10e41d84378a11,BEEP! BEEP! The #GOVAXX bus will stop by Fleming's Peterborough and Lindsay campuses on November 21 and 29 from 11 a.m. to 5 p.m. to administer Covid-19 vaccines. Learn more about the clinic and how you can book your appointment: https://t.co/CNQJTor5kg https://t.co/HjKxUOLjhd,en
2022-11-10 18:47:59+00:00,4508026892d6f4e3855c95dd530483cfd66b609fd8016c399ea2d8e8bcdece5e,"@GaryF56698701 @spirok123 @TorontoStar Quote by CDC: ""A review of available clinical information, including death certificates, autopsy, and medical records, has not established a causal link to COVID-19 vaccines.""Linked article has sources at the bottom. https://t.co/2Ly6T0tHld",en
2022-11-10 18:47:49+00:00,ca32a9c4f23ee94140c466fdc0cf22923774c17003aead22e80a9d0df7332c2e,@ToniaBuxton From the recent parliamentary debate about the safety of the Covid-19 vaccines . . .,en
2022-11-10 18:46:07+00:00,f5147d8bd0d733e867d021a3d2bf2298ed32550d39fb225fd7de388e5348d635,"""Near real-time surveillance of safety outcomes in US COVID-19 vaccine recipients aged 12 to 64 years""(that's bad news)Myocarditis/pericarditis met the statistical threshold for a signal following BNT162b2 in two of three databases (RRs: 1.83–2.47).https://t.co/Yu5hbCYpcT",en
2022-11-10 18:45:06+00:00,2b185f09723de9cf1cd1cae8f950f414,"AstraZeneca is no longer pursuing U.S. approval of its COVID-19 vaccine, Chief Executive Pascal Soriot said in a media call on Thursday. https://t.co/azEycAHrjw",en
2022-11-10 18:45:03+00:00,e96f521559428760a74204b1e46f26a1,"Wondering how vaccines work? On #WorldImmunizationDay, learn how #vaccines protect us from serious, preventable diseases like #measles, #polio, and #whoopingcough and teach our bodies to fight off #flu and #COVID-19. https://t.co/6rF72VODvl https://t.co/TZ3JHatW5F",en
2022-11-10 18:41:25+00:00,1ba10cfc49ea7161bd1faa893790897859932c712eb60e369e0cf16d0305a942,"New York: Pregnant women, who received one of the mRNA Covid-19 vaccines, had 10-fold higher antibody concentrations than those who were naturally infected with Covid virus, ... #Tech #WorldNews ℹ️  Read more at https://t.co/RZQYs9hZmt https://t.co/DaPBQ1g9vq",en
2022-11-10 18:40:14+00:00,0d7b36785b60a019b2f26e64a1b106c8,"Those who need a vaccinator of a certain sex, or a private space to be vaccinated, can request this at the vaccination clinic. For more information about the flu and COVID-19 vaccines this winter, visit https://t.co/TuR09w4h36 https://t.co/z1xIuyFUoW",en
2022-11-10 18:37:17+00:00,cdefb6e07fc3dd536e99a41c6ea2658dcdcd26da41a22b290f0610cbdd70e4cc,“A Pfizer media representative in an email said that the company’s vaccine has “a favorable safety profile and high level of protection against severe COVID-19..” “Favorable” compared to being struck by a bus- https://t.co/d2BVXNox9n,en
2022-11-10 18:37:01+00:00,ff0ba26175715b1abfd6eae363bf3e76,"Cuba’s ability to develop homegrown COVID-19 vaccines and immunize most of its citizens should serve as a model for developing countries around the world dealing with public health emergencies, according to a new report. https://t.co/XnGdT3mBjQ",en
2022-11-10 18:36:13+00:00,ca32a9c4f23ee94140c466fdc0cf22923774c17003aead22e80a9d0df7332c2e,@beverleyturner @DrAseemMalhotra @Johnincarlisle @CampbellMurdoch @MarkSharman Dr. John Campbell here too . . .From the recent parliamentary debate about the safety of the Covid-19 vaccines . . .https://t.co/6o9ih5jXTQ,en
2022-11-10 18:32:51+00:00,03a9171b791adc8867858ceaeeb78e51,New COVID-19 Variants May Evade Vaccine Protection https://t.co/A2Fd7AaLhu,en
2022-11-10 18:32:30+00:00,2fca822f685f2b1145c050f7888faefd8958dc3bed97d39429dad1efec3b9102,@GovMurphy Every HUMAN deserves to feel save from the MANDATES &amp; COVID-19 VACCINE you have pushed. #Murphymustgo #CrimesAgainsHumanity #CrimesAgainstChildren #CrimesAgainstSociety,en
2022-11-10 18:31:46+00:00,bc7f25f737d7ad07590f1085a008d44d,"@BlackCreekCHC  and @TOPublicHealth are hosting more Flu and COVID-19 vaccine clinics in our community at York University, Yorkgate Mall, and San Romanoway. Walk-ins are welcome, and no OHIP is required. https://t.co/gvW8lu7S9M",en
2022-11-10 18:30:52+00:00,0a2a611cdf1802fcb32b1ffef940fcc8fa91d6487ea94af5173c44944a3f9ec5,"@FHeijblom @harryhol ""This study provided in vivo evidence that inadvertent intravenous injection of COVID-19 mRNA vaccines may induce myopericarditis. Brief withdrawal of syringe plunger to exclude blood aspiration may be one possible way to reduce such risk.""",en
2022-11-10 18:30:06+00:00,e03ccc4366a2fcb0ca0c182c8e847d83ea94c81ad1485943315f263ff52c3152,"#COVID19 #COVID #Covid_19 #CovidIsNotOver [fear mongering, supra Stockholm syndrome types addicted to fear] #COVIDVACCINE #COVIDisAirborne #VaccineSideEffects [it is *NOT* a ""#vaccine"" #vaccineSideEffect #VaccineDeath #VaccineInjured #VaccinesSaveLives #injections #lies #truth",en
2022-11-10 18:29:59+00:00,6615600eedc8593dfb6fe73993378781,"@ChompskyHonk69 @JeaninePlieth @durham79 @GovWhitmer Funny how you talk about choice, when the same woman  that you voted for agreed on making COVID-19 vaccine mandatory. And people who refused lost their jobs.. but it's ok keep killing the unborn.. 🤦‍♂️ it's our rights.",en
2022-11-10 18:29:57+00:00,e483e4ed480422a9d34dc579cd411ee5bc4b62c4e39ebeefd4a6c14fc8a4dfed,"@Tamzilla_52 Also, Trump won’t bow to the establishment? Bullshit. He did with the Covid-19 pandemic with the lockdowns and the vaccines.",en
2022-11-10 18:29:00+00:00,69f3512640188320c9b065641f70df19,🩺 New from the American Journal of Nursing 🩺Low COVID-19 Vaccine Uptake in Young Childrenhttps://t.co/aF5COprK9h #UTHSC #NursingResearch #NursingStudent,en
2022-11-10 18:28:56+00:00,539b4e0198419560ed05c0e343afab18,BREAKING: COVID-19 vaccine mandate goes to SCOTUSADF to U.S. Supreme Court: Protect NYC workers (cont) https://t.co/FGTD0np8CF,en
2022-11-10 18:28:35+00:00,7889bb66da2c957c4797bbec488ff9b5,"assistant professor of mass communication at the School of Communication and Journalism, $100,000 grant from Pfizer .. COVID-19 vaccine hesitancy.. getting more people to go get the jab, especially parents of their young children.  https://t.co/aLPEqbaqNE",en
2022-11-10 18:28:09+00:00,16a46eb73b27c2222c7c559959a39897,Los Angeles Imposes COVID-19 Passport on Children Aged 12+ #children #covid #mandate #vaccine https://t.co/MAULHAayui,en
2022-11-10 18:27:17+00:00,c7cb90cb7d1e395ae580d2aa4306e6df,Next week Nova Scotia Health’s COVID-19 vaccine outreach clinics will be offering drop-in vaccines in all zones to help support vaccine accessibility.Learn more: https://t.co/m8t25PcnKn https://t.co/Oj9JcnXyeD,en
2022-11-10 18:27:05+00:00,7223472334df3a57fd81ccb4ac25842d,"AstraZeneca is no longer pursuing U.S. approval of its COVID-19 vaccine, Chief Executive Pascal Soriot said in a media call on Thursday.",en
2022-11-10 18:26:50+00:00,eca6201f8de930057245f4a3425868da,"@kootenayGreg Rate of COVID-19-related hospitalizations higher among unvaccinated individuals compared to those who completed their primary vaccine series. Similar trends were observed for COVID-19 related deaths, with higher rates of deaths among unvaccinated https://t.co/qTAOBSCPNd",en
2022-11-10 18:26:00+00:00,4db2be75512ce508ed2d0bb23b51b35c,"Pfizer is planning to mark up the covid-19 vaccine 10,000% in 2023 making it around $130. It cost $1.18 per dose to produce. If you still think this entire thing isn’t 100% about making them money then ur a moron.",en
2022-11-10 18:24:48+00:00,ca32a9c4f23ee94140c466fdc0cf22923774c17003aead22e80a9d0df7332c2e,@LozzaFox From the recent parliamentary debate about the safety of the Covid-19 vaccines . . .,en
2022-11-10 18:23:26+00:00,ca32a9c4f23ee94140c466fdc0cf22923774c17003aead22e80a9d0df7332c2e,From the recent parliamentary debate about the safety of the Covid-19 vaccines . . .https://t.co/6o9ih5jXTQ,en
2022-11-10 18:21:18+00:00,81285273ff4e22508d8459bea54d387d,"@UniteSharon In light of the failed and questionable safety profiles of the Covid-19 vaccines, you should be investigating those companies that are still imposing vaccine mandates on the UK offshore workforce. #nojabnojob",en
2022-11-10 18:21:03+00:00,4fb446684ab9b2e78eae52fcb2dc4581ba67f59927ce36aec354742d5cc1bf2e,Over 12.7 billion doses of Covid-19 vaccines have been distributed since the start of the pandemic. Explore how we reached this milestone on this World Immunization Day and World Science Day for Peace and Development: https://t.co/7JeDto3MHp #ScienceEd #STEMEducation #sschat,en
2022-11-10 18:18:38+00:00,b141bc18cc69eba2a77c3be101df85ae40c4c2b695144af394971d2e61654951,"A doctor “told me if I did not take the COVID-19 vaccine, I would not get the transplant, and if I did not get the transplant, I would die,” Lewis said in July. (Canada)https://t.co/ADlesfiFfm",en
2022-11-10 18:18:06+00:00,0de97248343026b0f6ef08949eca79f8868ecfc50631b4c6d07c40b6a1acd69a,"Tune in as California Surgeon General Dr. Diana Ramos joins Dr. Aliza Pressman from Raising Good Humans podcast to discuss COVID-19 vaccines, updated boosters for 5+ and getting vaccinated during pregnancy. Listen to the episode: https://t.co/WcmJjgc4jl #GetVaccinated https://t.co/Pypdxu2qjK",en
2022-11-10 18:16:33+00:00,009046b082dca35c9713948fb4d25fc2,Josh Sigurdson: COVID-19 vaccines causing cancer rates to skyrocket – https://t.co/LfooqSq0wh https://t.co/Gxmwp5qHGA,en
2022-11-10 18:16:32+00:00,8c6e3b2ae45db4f673b25892c7fdb596,"Get your omicron vaccine in time for the highest level of protection by Thanksgiving. Getting all recommended doses of the #COVID-19 vaccine is the best way to protect yourself, your loved ones, and the community from COVID-19. https://t.co/bzfFfk2w7Z https://t.co/wJVaZrG1gJ",en
2022-11-10 18:15:20+00:00,f55483501981adf2bb95b27646ae733c,"Bivalent COVID-19 booster outperforms original vaccine, Pfizer says https://t.co/dYfISSl7sw",en
2022-11-10 18:15:09+00:00,11ad339bd46f9ab8e8130f39daa9910e,"Pediatric health providers are improving COVID-19 vaccine rates! Providers told @PRCUMassChan about training needs for giving recommendations, addressing misinformation, developing messages, and integrating vaccine delivery. @umassmemorial @UMassChan https://t.co/NZqciNxI9X",en
2022-11-10 18:14:55+00:00,1f7f3608639cac1084060dcde273727e,#1 Many aspects of Covid-19 and subsequent vaccine development r unprecedented for a vaccine deployed for use in the general population.1.First 2 use PEG(polyethylene glycol) in an injection2.First coronavirus vaccine ever attempted in humans https://t.co/d8h45MTk0z,en
2022-11-10 18:13:02+00:00,29050ab1e2f85e1ba95d763a0144188a,"Interim Recommendations from the Advisory Committee on Immunization Practices for the Use of Bivalent Booster Doses of COVID-19 Vaccines — United States, October 2022 https://t.co/AjrXHaRNOw",en
2022-11-10 18:12:41+00:00,af76db074099e7f2030f9fb591eab762,"I have taken all the vaccines that are tried and tested, but took the COVID 19 vaccine because I wanted to go to Italy. I had a heart attack and have now had a triple by pass operation. Coincidence? Don't know.",en
2022-11-10 18:12:35+00:00,f8b7d184bc5aa15dda85e58f04112416f9ab2f457d4a6d8e17d3baa7c8d9869e,"@YouTube youtube banned me for sharing Scientific and Medical facts about the efficacy of the Vaccine in early weeks of Covid-19...and now people like you are asking for ""Vaccine Amnesty"". Hope you all get the same treatment as the last bunch to hide behind; ""I was just doing my job.""",en
2022-11-10 18:12:20+00:00,e13ad8f6ff98a108cd3d55d93996003181a554a8dc688b60ca24a17e5f8d6d6e,GSK - VACCINE APPROVED BY EUROPEAN COMMISSION AS A BOOSTER FOR PREVENTION OF COVID-19 IN ADULTS 18 YEARS OF AGE AND OLDER,en
2022-11-10 18:12:19+00:00,f6774e3cf02f4b9185695d6873d445b09aba482d39f0c07da1d753218a30c24d,GSK - VACCINE APPROVED BY EUROPEAN COMMISSION AS A BOOSTER FOR PREVENTION OF COVID-19 IN ADULTS 18 YEARS OF AGE AND OLDER,en
2022-11-10 18:12:14+00:00,7ae695f2e60b0ded335f7206c40cec5c,GSK - VACCINE APPROVED BY EUROPEAN COMMISSION AS A BOOSTER FOR PREVENTION OF COVID-19 IN ADULTS 18 YEARS OF AGE AND OLDER,en
2022-11-10 18:12:07+00:00,256c5cff2ec36082b77c5807c52a0462,Justice Sonia Sotomayor on Thursday rejected a request that the Supreme Court block New York City's public sector Covid-19 vaccine requirement as it applies to employees with who have religious objections to the vaccine. https://t.co/5DLZiqurVD,en
2022-11-10 18:11:42+00:00,60f70e4e1a5cdacf9cb8d3157ae3f0324e8a152cd89caaf56525214471e368a1,Multiple major Hollywood studios are dropping their COVID-19 vaccine mandates as concern over the coronavirus recedes nationwide. https://t.co/ETOKPo3YwX,en
2022-11-10 18:11:42+00:00,4c92c09c9b06bc1f8c79269ab167f66953d5496383456b562feaef683720535e,Multiple major Hollywood studios are dropping their COVID-19 vaccine mandates as concern over the coronavirus recedes nationwide. https://t.co/PfgYAraDxW,en
2022-11-10 18:11:28+00:00,e13ad8f6ff98a108cd3d55d93996003181a554a8dc688b60ca24a17e5f8d6d6e,GSK - SANOFI-GSK COVID BOOSTER VACCINE APPROVED BY EUGSK - SANOFI AND GSK'S NEXT-GENERATION COVID-19 BOOSTER VACCINE VIDPREVTYN BETA APPROVED BY EUROPEAN COMMISSION,en
2022-11-10 18:11:27+00:00,f6774e3cf02f4b9185695d6873d445b09aba482d39f0c07da1d753218a30c24d,GSK - SANOFI-GSK COVID BOOSTER VACCINE APPROVED BY EUGSK - SANOFI AND GSK'S NEXT-GENERATION COVID-19 BOOSTER VACCINE VIDPREVTYN BETA APPROVED BY EUROPEAN COMMISSION,en
2022-11-10 18:11:22+00:00,7ae695f2e60b0ded335f7206c40cec5c,GSK - SANOFI-GSK COVID BOOSTER VACCINE APPROVED BY EUGSK - SANOFI AND GSK'S NEXT-GENERATION COVID-19 BOOSTER VACCINE VIDPREVTYN BETA APPROVED BY EUROPEAN COMMISSION,en
2022-11-10 18:11:21+00:00,1eb867d931716c6a48b38931373d06ba8274dc5d4b8bfc3ceb4d8bc231e5dc3b,"@theJagmeetSingh JagMeet Singh: During my time in Berlin, I visited the Wannsee Conference Memorial — where the murderous and genocidal plans of the Nazis were formed. Me: Great so now will you support Canadian Nuremberg Trials for those who mandated  Covid-19 mRNA vaccines ?",en
2022-11-10 18:11:10+00:00,5147f8142c6f4d048d784e97d1001a84,@Ahsley36893154 @CptCarm @TheVotersSay @CaulfieldTim @AHS_media @jonathanstea @ShelleyZieroth @SammyG_MD @DocMCohen @RSCTheAcademies @MoriartyLab The effect in the “long term” of receiving Covid vaccines is a significantly reduced chance of serious Covid-19 outcomes and a moderately reduced chance of other outcomes including infection and transmission. Unsure what exactly you’re still confused about…,en
2022-11-10 18:10:50+00:00,b2c62db6b304a3f629ee058bc7348df6,"It’s important for people who are trying to get pregnant, are pregnant or breastfeeding, or who might become pregnant in the future to stay up to date on COVID-19 vaccines to help protect themselves and infants against #COVID19. More: https://t.co/TWPok4EdM3",en
2022-11-10 18:09:59+00:00,983e089fe784396acac668275462cd6f,Kari Lake - Kari Lake says falsely that COVID-19 vaccines are ineffective and dangerous for children https://t.co/WUP8exCoHs #SmartNews,en
2022-11-10 18:09:43+00:00,db8fd19654d4290b10b16a9c36f722a2682bf6e4fe240b184985fe61e5bc0e74,Long-Term Organ Damage after COVID-19 Vaccines Emerging in Medical Literature https://t.co/MePuYNuzht,en
2022-11-10 18:09:15+00:00,590d36d38e1fa8c88815540f02d25d77,@DarkCowboyGod @stevew63 @IrishMossMan1 @trainwithtish COVID-19 *Vaccine* caused heart issues: 27.49% in young males (percentages continue to go up with the number of vaccinations received)COVID-19 *Infection* caused heart issues: 3.26%Link to 23 million person study:https://t.co/rGUultboeN,en
2022-11-10 18:08:36+00:00,88f78e9ea87422dc552ba114311b66baee294151a436de3b7a8901f191f4184b,"The peer-reviewed publications of COVID-19 “vaccine” adverse events in just 18 months far exceeds those published from ALL OTHER inoculations, ALL OVER the world in ALL OF THE PAST CENTURY",en
2022-11-10 18:08:29+00:00,4b01ff79206fd926ab50468421b89e32,"My advice is to get the @novavax covid-19 vaccine which is far safer, more effective, and more persistent than the mRNA variety.",en
2022-11-10 18:08:01+00:00,666981982d488eb6865ef1d644c940df,"U.S. Supreme Court Justice Sonia Sotomayor on Thursday rejected a bid to prevent New York City from enforcing its COVID-19 vaccine mandate for municipal workers against a group teachers, firefighters and others who challenged the policy. https://t.co/6WVa1uSJiK",en
2022-11-10 18:07:48+00:00,14c740a2c06c56dc07015798bf0c6a4b,@CBCNews @GlobalBC Foot draaaaaggging: FDA urged to publish follow-up studies on covid-19 vaccine safety signals https://t.co/qz3zyJSAvv,en
2022-11-10 18:07:25+00:00,884d6f2f9506cdf08f28f5e650509a0c,"""New COVID-19 Variants May Evade Vaccine Protection | Time"" https://t.co/Yu2oXa2Xny@StPaulsLondon @Nrw_Cathedral @durhamcathedral @TheEconomist @El_Universal_Mx @Telegraph @GolfDigest @HuffPost @nypost @Jerusalem_Post @DeutscheWelle @DeutscheBank @GMA @pfizer @NETAPORTER @Disney",en
2022-11-10 18:06:33+00:00,80a31c42a1a72d9e53295424c4c320a7,"Galveston County's COVID-19 Community Level is LOW.  •Stay up to date on COVID-19 vaccines. •Get tested if you have symptoms. •If you are at a high risk for severe illness, talk to you doctor about whether you need to wear a mask and take other precautions.",en
2022-11-10 18:05:14+00:00,61a622cea827477fae715e6997bfca7b,Multiple major Hollywood studios are dropping their COVID-19 vaccine mandates as concern over the coronavirus recedes nationwide. https://t.co/HXzeAPrbSH,en
2022-11-10 18:05:01+00:00,92b254a308be8f568846c36a17c231b3,"Getting the #COVID19 vaccine helps protect your kids from serious illness. The @CDCgov recommends COVID-19 vaccines for kids 6 mos &amp; up, and boosters for everyone 5 yrs &amp; up, if eligible. Call your health care provider or visit https://t.co/YtMOStygVy to schedule an appointment. https://t.co/Ru5Xi9LD4I",en
2022-11-10 18:04:54+00:00,5040fc5c16f853565eaa724b5d261cf8,"""New COVID-19 Variants May Evade Vaccine Protection | Time"" https://t.co/DVnNBIcZjY@unicomplutense @ScholasticTeach @BloomsburyBooks @BloomsburyPub @simonschuster @McGrawHillK12 @MHEducation @britishlibrary @LibraryJournal @nypl @NATO @EU_Commission @AutismTips @CNBC  @FoxNews",en
2022-11-10 18:02:13+00:00,0588e8c3334f8c4cffe821d795b5c9be,"""New COVID-19 Variants May Evade Vaccine Protection | Time"" https://t.co/cpz19Qrxfy @UNPeacekeeping @UNPeacebuilding @washingtonpost @chicagotribune @LMU_Muenchen @risj_oxford @StanfordMed @HarvardHealth @HarvardChanSPH @harvardmed @YaleClimateComm @latimes @nytimes @NBCNews @RFI",en
2022-11-10 18:01:50+00:00,17801ff34263e7bf6e75cad996c9f3eb,"New Drive-Up COVID-19 Vaccine &amp; Testing HoursStarting November 7, the COVID-19 Vaccine and Testing hours will be open Monday through Friday from 8:00 AM to 11:30 AM and 12:30 PM to 4:00 PM. The Vaccine and Testing Clinic will be closed from 11:30 AM to 12:30 PM for lunch. https://t.co/za1s0pMPCC",en
2022-11-10 18:01:38+00:00,c31812d1d57093b4a227a2b68ad06e43,"BREAKING: #BNNUS Reports.  U.S. Supreme Court Justice Sonia Sotomayor on Thursday rejected a bid to prevent New York City from enforcing its COVID-19 vaccine mandate for municipal workers against a group of teachers, firefighters, and others who challenged the policy. https://t.co/DcLAGqMk8c",en
2022-11-10 18:01:24+00:00,9e14570aeec2dd94208e52467759100b,Let’s Get Boosted!COVID-19 Boosters are available on select days at each location. Contact your provider or clinic nurse for access to the COVID-19 Booster vaccine. Every Dose Matters#COVID19Booster #Atlanta #HIV #Atlanta #PIHC https://t.co/Er9T2dHQS8,en
2022-11-10 18:00:25+00:00,74a0d2a0059a038e154d73b10167b846,"Last month the Office of Community Partnerships &amp; Strategic Communication, Asian Resources Inc., UC Davis Center for Reducing Health Disparities &amp; Hefty Gyros hosted a Covid-19 vaccine clinic @ Marymead apts where COVID-19 vaccines, testing kits, $10 gift cards &amp; food were given. https://t.co/WA0dwUioKz",en
2022-11-10 18:00:11+00:00,1b09aadb242330554306b69292dcb4dd,"Covid and flu are about. The autumn Covid-19 booster and annual flu vaccine are your best protection.Keep yourself and your loved ones safe, and don't let being poorly ruin your plans.Find out if you're eligible and book yours today.https://t.co/D4QxFGo9RT https://t.co/PteIVmMgEX",en
2022-11-10 17:59:44+00:00,a6d9502c2ebdd170b4583da621d2159e1957c75a95883adae2513e423ba75d6d,"Justice Sotomayor Rejects Emergency Application of NYC Firefighters, Cops, and Teachers Raising Religious Objections to COVID-19 Vaccine Mandatehttps://t.co/hqhC7B9erJ",en
2022-11-10 17:56:56+00:00,09551575459586d6a959f8a872a719f17be945a28ed35bea71ecdf51242b554f,"https://t.co/ezyJy1auTW What are Bill Gates intentions? Listen to him directly! His goal is to reduce the population through vaccines, new Healthcare, &amp; reproductive Healthcare. Heavily financed in the covid-19 inoculation! Question how do you do that?",en
2022-11-10 17:56:31+00:00,f8d0a25191ebd536efd8d61fc2a2e5961c8d97ec243ae4fd5238a52dd4e8b78d,@AmitAryaMD When eight out of 10 people don't support Mask mandate the other two out of 10 can wear their masks all they want. Hey you said the covid-19 vaccine stops the transmission of covid in its tracks?,en
2022-11-10 17:53:06+00:00,d170d8010df4ff1d98b565d54e4abf208a7ff8c5377b83551ca99dbea2c6eae1,".@Pfizer believes mRNA technology used to create COVID-19 vaccines could be the key to better protection against other viruses including the flu.Phase 3 of a mRNA flu vaccine study is underway at sites across the country, including locally at Senders Pediatrics.@SpectrumNews1OH https://t.co/b2SXDcJXnb",en
2022-11-10 17:52:58+00:00,e5cd50fd84dc82ccec1dacf6d4ae35ab,Covid-19 vaccine during pregnancy in Australia https://t.co/5vLzgPr9gO #covid19vaccineduringpregnancyinaustralia,en
2022-11-10 17:52:43+00:00,9a5c4cc12a142a994dfcbbc52ce3bb1f13381fd652e747dfd96ba8a9fa243a0b,“An Israeli study has concluded that the short-lived immunity and rapid waning of the Pfizer BioNTech COVID-19 vaccine necessitates the reevaluation of future COVID-19 vaccination campaigns.”- For a simplified recap of these published  findings read here https://t.co/ijxO4aGbnq,en
2022-11-10 17:52:15+00:00,b69a3ae97b05e8586e84903d632f6a30,@tommyjoad1 @Co63535127Jerry @TestInProducshn @LoveseeSteve @DrJamesOlsson which was then analyzed using the Cov19VaxKB vaccine safety statistical analysis tool to identify statistically significant adverse events for the three currently FDA-authorized or approved COVID-19 vaccines. They found 96 statistically significant events from 2019-2021.,en
2022-11-10 17:51:44+00:00,c53faa54e6e09e392a19c95e142d589616e25e4f09fa8d460afbbf545fcf313f,"@american_kitty @PrisonPlanet 1. The government incentivized a vaccine to the Covid-19 pandemic, so you calling it “certain drugs” is horribly misleading 2. There is little to no risk in big Pharma at all with there always being an inelastic demand for medicine.",en
2022-11-10 17:47:58+00:00,b60d97de1de1151da6cb67168a735fc6,"Justice Sotomayor Rejects Emergency Application of NYC Firefighters, Cops, and Teachers Raising Religious Objections to COVID-19 Vaccine Mandate https://t.co/v9yJPH7IP4 #SmartNews",en
2022-11-10 17:46:02+00:00,d0d8b747cc2bbfc5900cf0034cf7cbf5,"Arlington County will close its public vaccine clinic along with most of its COVID-19 testing blocks before the end of the year, stating that ""Demand has significantly decreased at the county’s clinic."" https://t.co/A6mjaMUnKi https://t.co/gKWLQUg8n5",en
2022-11-10 17:45:43+00:00,1568461733cf59391d954fb74fad084e,Fact Check: No evidence that DJ Mighty Mouse's death was linked to the COVID-19 vaccine https://t.co/qCqUjs89Pn   More propaganda spread on line.,en
2022-11-10 17:45:41+00:00,fa69babcdd6be4a24d201aacaeb8b7e8adcf551ed4a23e6b4b05131732b3e1ba,AstraZeneca Drops Plan to Sell Covid-19 Vaccine in U.S. https://t.co/XMpHjGndpw,en
2022-11-10 17:45:11+00:00,6b0ab14f8d32f4c9ec1c1f6e0579d8cd9d88f393a4b92c54796ffd2d39921abd,"City Exhausts 1st Doses of COVID-19 Vaccine, Shutting Down Dodger Stadium &amp; Other Sites - Los Feliz Ledger https://t.co/m6O8UT11ni https://t.co/R3qLaqsxcW",en
