date,userid,tweet,lang
2022-08-26 14:33:48+00:00,776590937455681537,@MayorBowser Stop pushing the stupid COVID-19 agenda. Here in Texas we opened back up with kids returning to school in August 2020. You have no right to force vaccines and mask mandates on people and especially children. STOP LYING!!,en
2022-08-26 14:33:47+00:00,1056965024990801927,🔊 @AndrejPlenkovic @MichealMartinTD @Xavier_Bettel @sanchezcastejon @jacindaardern Thanks for supporting #VaccineEquity through COVID-19. Will you join #GlobalCitizenFestival and pledge funds to the @WHO mRNA Tech Hub to empower developing regions to produce their own vaccines?,en
2022-08-26 14:33:39+00:00,38167858,"ALERT CENTER: Moderna sues Pfizer and BioNTech over COVID-19 vaccine, accuses companies of copying its technology. https://t.co/4Z8MA2cJ65",en
2022-08-26 14:33:02+00:00,1308040622922706944,"@rappin_ronnie2 @TheDarkStormyK1 @WSMV They also are still alive to tell the tale bc they are vaccinated. Vaccines not a cure. COVID-19 vaccines can offer added protection to people who had COVID-19, including protection against being hospitalized from a new infection, especially as variants continue to emerge.",en
2022-08-26 14:32:36+00:00,1460667363658018820,"@peoplercrazy_ @EthicalSkeptic ""By contrast, the incidence of COVID-19-associated cardiac injury or myocarditis is much higher, estimated to be 100 times higher than mRNA COVID-19-related myocarditis [24,25]. Moreover, mRNA vaccine-related myocarditis is characterized by overall mild presentation and ...""",en
2022-08-26 14:32:34+00:00,2376010970,Ever wonder how mRNA vaccines (such as the Pfizer and Moderna vaccines for COVID-19) work? Check out this helpful graphic from @nycHealthy.,en
2022-08-26 14:32:15+00:00,18917882,"ALERT CENTER: Moderna sues Pfizer and BioNTech over COVID-19 vaccine, accuses companies of copying its technology.https://t.co/G4F4A01h0A",en
2022-08-26 14:31:34+00:00,85920748,Moderna plans to sue Pfizer for patent infringement over COVID-19 vaccine technology https://t.co/pMkWqFalpN #10news #news #wtsp https://t.co/P7A7UZdBf2,en
2022-08-26 14:31:13+00:00,8862532,"COVID-19 vaccine maker Moderna is suing Pfizer and the German drugmaker BioNTech, accusing its main competitors of copying Moderna's technology in order to make their own vaccine. https://t.co/kxN3gOaxEM",en
2022-08-26 14:31:12+00:00,37663094,"COVID-19 vaccine maker Moderna is suing Pfizer and the German drugmaker BioNTech, accusing its main competitors of copying Moderna's technology in order to make their own vaccine. https://t.co/yEbm8o6l2N",en
2022-08-26 14:31:12+00:00,4716692414,@CriticalThin1 and imagine all the people who don't know to file a claim to the CICP!  You have to file within a year of injury/death I think.  but all the different type of claims for covid-19 vaccine injury is ALARMING...,en
2022-08-26 14:30:43+00:00,1220148870509989889,All about the 💰 “Moderna sues Pfizer and BioNTech over COVID-19 vaccine Moderna said in a statement that Pfizer and BioNTech infringed on patents filed between 2010 and 2016 that covered its mRNA technology”https://t.co/zbdGWkM4Rg,en
2022-08-26 14:30:33+00:00,1303544430,Getting a COVID-19 booster vaccine in August allows enough time before the next seasonal dose in autumn to protect you over winter.Book your jab at https://t.co/FmrLvjSEeP or call 119. https://t.co/z3vKGl71AE,en
2022-08-26 14:30:29+00:00,1594788486,"@AdamKinzinger Congressman, this vaccine dies not keep an individual from Covid-19. To mandate any vaccine that has not been tested for side effects is just using the military for experimentation and that is not what our military stands for!!",en
2022-08-26 14:30:29+00:00,12993222,#NEW: Moderna is suing Pfizer and the German drugmaker BioNTech -- accusing its main competitors of copying the technology for their COVID-19 vaccine. https://t.co/fJbUrfl2q9,en
2022-08-26 14:30:25+00:00,761756733731516417,"Moderna sues Pfizer and BioNTech, alleging they copied its COVID-19 vaccine technology https://t.co/eHHVBhXjLy",en
2022-08-26 14:30:24+00:00,25560065,"Inovio has agreed to pay $44 million to settle a shareholder class action lawsuit, which alleged the Plymouth Meeting biotech company made ""false and misleading"" statements about the development of a Covid-19 vaccine in public disclosures.  https://t.co/0Y8uleW8UT",en
2022-08-26 14:30:19+00:00,132897310,Moderna alleges that Pfizer and BioNTech used its patented mRNA vaccine technologies in the Comirnaty® COVID-19 vaccine without its permission.#Biopharma#EPRTalksFind out more: https://t.co/hvxntMyfnH https://t.co/CqepR3KA55,en
2022-08-26 14:30:17+00:00,4898091,"Moderna has said it will sue Pfizer and BioNTech for copying the ‘groundbreaking technology’ behind its Covid-19 vaccine, setting up a legal clash between the pharmaceutical rivals behind some of the best-selling jabs used to combat the pandemic https://t.co/fFOeSQvZCa",en
2022-08-26 14:30:10+00:00,6433472,"Moderna is suing Pfizer and its German partner BioNTech for patent infringement in the development of its COVID-19 vaccine, alleging they copied technology that Moderna had developed years before the pandemic. https://t.co/rM5TvuNNKD",en
2022-08-26 14:30:08+00:00,16424606,"COVID-19 vaccine maker Moderna is suing Pfizer and the German drugmaker BioNTech, accusing its main competitors of copying Moderna’s technology in order to make their own vaccine. https://t.co/a69tsDXJRX",en
2022-08-26 14:30:06+00:00,3231756711,"@ClaytonMorris How much has been spent of ""ineffective"" Covid-19 vaccines? Just provide ballpark, please.",en
2022-08-26 14:30:04+00:00,8854622,"COVID-19 vaccine maker Moderna is suing its main competitors Pfizer and the German drugmaker BioNTech, accusing the rivals of copying Moderna’s technology in order to make their own vaccine. https://t.co/Y7CX5Sy463",en
2022-08-26 14:30:01+00:00,1192791243396440067,In the news today: PfizerAmerican multinational pharmaceutical and biotechnology corporationModerna sues Pfizer and BioNTech for using mRNA technology in their COVID-19 vaccineModerna suing Pfizer over Covid vaccine technology #Pfizer,en
2022-08-26 14:29:54+00:00,2908723580,TUCKER CARLSON: Democrats are trying to shift blame about the COVID-19 vaccine to Trump https://t.co/WmibYbXz5Q #FoxNews,en
2022-08-26 14:29:35+00:00,3881875397,@DrNeilStone For Novak the vaccine represents a far greater risk then COVID-19. He made the right decision.,en
2022-08-26 14:29:27+00:00,2351420289,"PFIZER SAYS ""SURPRISED"" BY MODERNA LITIGATION GIVEN PFIZER/BIONTECH COVID-19 VACCINE WAS BASED ON BIONTECH’S PROPRIETARY MRNA TECHNOLOGY",en
2022-08-26 14:29:16+00:00,1102617507205210112,Moderna files patent infringement lawsuits against Pfizer and BioNTech over mRNA Covid-19 vaccineshttps://t.co/dLJpfb8bu2,en
2022-08-26 14:29:14+00:00,700792673687343105,"NEW: Moderna is suing Pfizer for patent infringement over their competing COVID-19 vaccines. https://t.co/0ZveF7AWxfI haven't seen Pfizer's new statement from any other outlets, so here it is: https://t.co/HuyI348KwS",en
2022-08-26 14:29:08+00:00,1302684144082747393,"Moderna is suing Pfizer and its German partner BioNTech for patent infringement in the development of the first COVID-19 vaccine approved in the United States, alleging they copied technology that Moderna developed years before the pandemic.  https://t.co/pAOwOBse2y",en
2022-08-26 14:28:59+00:00,1557302979706904577,Australia Twitter: Whole towns are refusing Covid-19 vaccines in Mexico https://t.co/d68R7HCY8y,en
2022-08-26 14:28:25+00:00,17465654,"Now it gets interesting. $MRNA own #MRNA or some part of it? #Moderna sues #Pfizer, BioNTech for #Covid -19 vaccine patent infringement https://t.co/dV7TrsuoPL",en
2022-08-26 14:28:23+00:00,1468104850823073802,🔊 @AndrejPlenkovic @MichealMartinTD @Xavier_Bettel @sanchezcastejon @jacindaardern Thanks for supporting #VaccineEquity through COVID-19. Will you join #GlobalCitizenFestival and pledge funds to the @WHO mRNA Tech Hub to empower developing regions to produce their own vaccines?,en
2022-08-26 14:28:13+00:00,3041394260,"KOB4: Moderna is suing Pfizer and the German drugmaker BioNTech, accusing its main competitors of copying Moderna’s technology in order to make their own COVID-19 vaccine. https://t.co/DQ37nwnLLO",en
2022-08-26 14:28:10+00:00,1421451864999092230,"Breaking: 'Moderna sues Pfizer over patents behind Covid-19 vaccine', https://t.co/XXJVGJaPOR",en
2022-08-26 14:27:22+00:00,38120332,Moderna sues Pfizer over patents behind COVID-19 vaccine | AP News https://t.co/8Bcz7Xcvmr,en
2022-08-26 14:27:10+00:00,1157748605526204416,Moderna sues Pfizer over patents behind COVID-19 vaccine https://t.co/5SUe2ICK4h,en
2022-08-26 14:26:33+00:00,119973528,Moderna plans to sue Pfizer for patent infringement over COVID-19 vaccine technology - https://t.co/BFg97vF1Kv https://t.co/Vf6zQgHiRm,en
2022-08-26 14:26:32+00:00,2955141350,Moderna Sues Pfizer Over Patents Behind COVID-19 Vaccine https://t.co/oGyigXnPtG,en
2022-08-26 14:26:26+00:00,45634832,"COVID-19 vaccine maker Moderna is suing Pfizer and the German drugmaker BioNTech, accusing its main competitors of copying Moderna’s technology in order to make their own vaccine.https://t.co/mOnes6rKb8",en
2022-08-26 14:26:10+00:00,7309052,"COVID-19 vaccine maker Moderna is suing Pfizer and the German drugmaker BioNTech, accusing its main competitors of copying Moderna’s technology in order to make their own vaccine. https://t.co/JVltlmccSy",en
2022-08-26 14:25:57+00:00,1259692098,@ssquirrel91 @OccupyDemocrats And also for their role in the Covid-19 Pandemic disinformation and misinformation campaign of promoting the movement of being against mask and vaccine mandates. They are evil and sick.,en
2022-08-26 14:25:23+00:00,455395758,"@K_fth1992 @students4agency @WesternU @huronatwestern @KingsAtWestern Nah those issues are caused by covid-19, not vaccines.",en
2022-08-26 14:25:03+00:00,1553855305108398084,@backtolife_2023 2010-2016 you say 🤔…….“Moderna believes that Pfizer and BioNTech's COVID-19 vaccine Comirnaty infringes patents Moderna filed between 2010 and 2016 covering Moderna's foundational mRNA technology.”,en
2022-08-26 14:25:02+00:00,1550395834520326146,"Jabbed Man in Italy Tests Positive for COVID-19, Monkeypox and HIV – At Same Time #COVID19 #vaccinehttps://t.co/8egMaMDl2U",en
2022-08-26 14:24:59+00:00,15755669,"Moderna announced Friday that it is suing Pfizer and its German partner BioNTech, alleging the two companies copied Moderna's technology in its development of their COVID-19 vaccine Comirnaty. https://t.co/8nwY4RX7CD",en
2022-08-26 14:24:44+00:00,449027230,"$PFE $BNTX responds:""Pfizer/BioNTech has not yet fully reviewed the complaint but we are surprised by the litigation given the Pfizer/BioNTech COVID-19 Vaccine was based on BioNTech’s proprietary mRNA technology and developed by both BioNTech and Pfizer...",en
2022-08-26 14:24:42+00:00,1326550378188398598,French Population Study Reinforces Cardiovascular Risk Associated with mRNA COVID-19 Vaccines - YouTubehttps://t.co/5oUVEK3acP,en
2022-08-26 14:24:30+00:00,1294344468875935746,"Money matters. “Moderna sues Pfizer and BioNTech, alleging infringement of MRNA patents.Moderna says rivals copied its methods for encoding genetic material and used the same chemical modification in their Covid-19 vaccine.” https://t.co/DVbaOCj564",en
2022-08-26 14:24:17+00:00,1005106335891931137,Did a Conservative leadership hopeful compare COVID-19 vaccines to Nazi atrocities? Leslyn Lewis rejects ‘cowardly’ accusation | The Star https://t.co/e7BuE5Rdkj,en
2022-08-26 14:24:15+00:00,84141253,"COVID-19 vaccine maker Moderna is suing Pfizer and the German drugmaker BioNTech, accusing its main competitors of copying Moderna’s technology in order to make their own vaccine. https://t.co/bgSnKytA0e",en
2022-08-26 14:23:54+00:00,253306038,"“Moderna, which accepted $2.5 billion in taxpayer money to develop its Covid-19 vaccine, had said in 2020 that it would not enforce its Covid-related patents while the pandemic continues.”https://t.co/Yx2FjyoUjl",en
2022-08-26 14:23:49+00:00,1113942176331968513,VIVIDESIGN Group -  Moderna Sues Pfizer And BioNTech Over Covid-19 Vaccine https://t.co/SXDs2o4D1U  - Call 270-723-3650 https://t.co/sPZ0CsJbN8,en
2022-08-26 14:23:37+00:00,1596829382,"Moderna sues Pfizer, BioNTech for patent infringement with COVID-19 vaccine https://t.co/M69aWUQb3c https://t.co/mNehGGCK3c",en
2022-08-26 14:23:35+00:00,1596829382,"Moderna sues Pfizer, BioNTech for patent infringement with COVID-19 vaccine https://t.co/acRI38yCrY https://t.co/BxibImNUI9",en
2022-08-26 14:23:08+00:00,1074588680,COVID-19 vaccine patent legal wars are in full-swing...Moderna is suing Pfizer over its coronavirus vaccineOn 2 grounds:1) modification of mRNA to improve half-life in body to enable more robust immune response2) use of full spike protein sequence https://t.co/aFy7cHUe3J,en
2022-08-26 14:23:02+00:00,1379635526647435264,Tucker Carlson: Democrats alerted us the COVID-19 vaccine wasn't properly tested @MayorBowser is preventing children from learning if they don’t get the Covid vax which we know was not properly tested and is harmful to kids. https://t.co/qQ4AQDeHWt,en
2022-08-26 14:22:40+00:00,18856867,"PFIZER SAYS ""SURPRISED"" BY MODERNA LITIGATION GIVEN PFIZER/BIONTECH COVID-19 VACCINE WAS BASED ON BIONTECH’S PROPRIETARY MRNA TECHNOLOGY",en
2022-08-26 14:22:34+00:00,125632328,Moderna Sues Pfizer Over Patents Behind COVID-19 Vaccinehttps://t.co/oC8M1qAyK7,en
2022-08-26 14:22:31+00:00,1562487370145878016,🔬 | 📌 | #Moderna said it is suing #Pfizer and its German partner #BioNTech for patent infringement in the development of the first #Covid-19 vaccine. https://t.co/zaHqV8S31b,en
2022-08-26 14:22:23+00:00,713523037560111105,Moderna sues Pfizer over patents behind COVID-19 vaccine https://t.co/YvQyMn3sQ2,en
2022-08-26 14:22:12+00:00,1423543075583012867,"partner BioNTech for patent infringement in the development of the first Covid-19 vaccine.The US drug company is alleging that mRNA technology it developed before the pandemic was copied.The lawsuit,which is seeking unspecified financial damages was filed in the US and Germany",en
2022-08-26 14:22:10+00:00,1476167478355111938,"COVID-19 Vaccines and Informed Consent, by @RWMaloneMD https://t.co/kz8U3ChLJl",en
2022-08-26 14:22:03+00:00,1489351076960735232,Novavax's COVID-19 Vaccine Granted Expanded Conditional Authorization In U.K. For Adolescents https://t.co/AQ1eEkGGg3 #news #stocks #stockmarketnews,en
2022-08-26 14:21:21+00:00,963495628545327104,$PFE NEW ARTICLE : Should Pfizer Investors Worry About Falling COVID-19 Vaccine Demand? https://t.co/8qdeaRL0lS Get all the latest $PFE related news here : https://t.co/LE4NwSNio1 https://t.co/TqK7sxyLPF,en
2022-08-26 14:21:20+00:00,3295423333,"PFIZER SAYS ""SURPRISED"" BY MODERNA LITIGATION GIVEN PFIZER/BIONTECH COVID-19 VACCINE WAS BASED ON BIONTECH’S PROPRIETARY MRNA TECHNOLOGY",en
2022-08-26 14:21:04+00:00,1539287560966402048,"@GovRonDuhSantis @tedcruz Again, UNLIKE MMR or Polio vaccines, the Covid-19 vaccines confer neither immunity nor prevent transmission. They simply reduce risk of severe disease, which is minimal in schoolchildren, anyway.",en
2022-08-26 14:20:39+00:00,14662354,"A D.C. judge ruled Thursday that a COVID-19 vaccine mandate imposed by Mayor Muriel Bowser is unlawful, siding with a police union that challenged the rules as unfair and damaging to recruitment. https://t.co/dSzmHyJ2nD",en
2022-08-26 14:20:34+00:00,23175245,Why did Gates/Fauci have a COVID-19 vaccine ready to go before there was a COVID-19 pandemic? Why are the patents to both virus and “vaccine” filed in the City of London patent office?,en
2022-08-26 14:20:32+00:00,1360825520657731587,"PFIZER ON MODERNA LAWSUIT SAYS PFIZER/BIONTECH HAS NOT YET FULLY REVIEWED THE COMPLAINTPFIZER SAYS ""SURPRISED"" BY MODERNA LITIGATION GIVEN PFIZER/BIONTECH COVID-19 VACCINE WAS BASED ON BIONTECH’S PROPRIETARY MRNA TECHNOLOGY$PFE $MRNA $BNTX",en
2022-08-26 14:20:16+00:00,259832379,Moderna sues Pfizer over patents behind COVID-19 vaccine https://t.co/gaX7DpJ54V,en
2022-08-26 14:20:14+00:00,12848262,"Moderna said it’s suing Pfizer and BioNTech SE, claiming the technology in the partners’ COVID-19 shot infringes on its patents, a move that sets the stage for a massive legal clash between the three vaccine titans. https://t.co/XMca6bya3j",en
2022-08-26 14:20:05+00:00,119973528,"BRIEF-Moderna Suing Pfizer, Biontech For Patent Infringement In Development Of Covid-19 Vaccine - Devdiscourse https://t.co/swChx49IH3",en
2022-08-26 14:20:04+00:00,55060090,Moderna Sues Pfizer Over Patents Behind COVID-19 Vaccine https://t.co/EyzbjHeura,en
2022-08-26 14:20:03+00:00,25354366,Moderna sues Pfizer over patents behind covid-19 vaccine https://t.co/aP4lY6Pla3,en
2022-08-26 14:20:01+00:00,1459227002481877004,Novavax COVID-19 vaccine granted UK approval for 12- to 17-year-olds by MHRA https://t.co/uuFFXyXDdF,en
2022-08-26 14:20:00+00:00,15308015,"Moderna is suing fellow vaccine-makers Pfizer and BioNtech over claims that their COVID-19 vaccine infringes on patents Moderna filed before the pandemic, the company said in a statement.  https://t.co/RGRG6ULOTV",en
2022-08-26 14:19:29+00:00,1539287560966402048,"@GovRonDuhSantis @tedcruz I don't believe Ted is referring to MMR vaccines. There are cardiac risks to young men with Covid-19 vaccines, and minimal benefits. This 60 year old with diabetes and hypertension got his Covid-19 shots. My son got Covid itself with no problems, at 17.",en
2022-08-26 14:19:22+00:00,149111272,Vaccine negative effectiveness  - COVID-19 vaccines update 56 https://t.co/wgIqNTPX8i via @YouTube,en
2022-08-26 14:19:03+00:00,15917758,Moderna plans to sue Pfizer for patent infringement over COVID-19 vaccine technology https://t.co/qo3lblhiUn,en
2022-08-26 14:18:47+00:00,3152644679,Moderna sues Pfizer over patents behind COVID-19 vaccine https://t.co/nesz2yLSxl,en
2022-08-26 14:18:36+00:00,185115193,Moderna sues Pfizer over patents behind Covid-19 vaccine https://t.co/2TM85RfqNb,en
2022-08-26 14:18:11+00:00,2212206491,Covid-19 Vaccine Effectiveness against the Omicron (B.1.1.529) Variant | NEJM⁦@gillesDM92⁩  https://t.co/zQ24P8HJe7,en
2022-08-26 14:17:59+00:00,2971811463,"Moderna Sues Pfizer and BioNTech Over Covid Vaccine https://t.co/qXLT72t4Bz Moderna, which accepted $2.5 billion in taxpayer money to develop its Covid-19 vaccine, had said in 2020 that it would not enforce its Covid-related patents while the pandemic continues. What do we get ?",en
2022-08-26 14:17:52+00:00,1046783815937662976,"Moderna is suing Pfizer and BioNTech, accusing the companies of infringing on Moderna’s patents when they partnered to develop their own COVID-19 vaccine. https://t.co/dQ8G60jE4k",en
2022-08-26 14:17:44+00:00,722345392759644160,Moderna sues Pfizer and BioNTech for using mRNA technology in their COVID-19 vaccine. Moderna claims Pfizer-BioNTech's COVID vaccine infringes on patents it filed between 2010 and 2016 covering its mRNA technology. #moderna #pfizer https://t.co/Ge6McOAM5q,en
2022-08-26 14:17:36+00:00,19028281,Moderna Sues Pfizer and BioNTech Over MRNA Patents: Moderna said its rivals copied its methods for encoding genetic material and used the same chemical modification in their Covid-19 vaccine. https://t.co/S5E6WTa074 ^WSJ #Business #Finance #CFO https://t.co/Yv4BAdHLto,en
2022-08-26 14:17:31+00:00,1346065989784330240,Pfizer and its German partner BioNTech are being sued by Moderna for allegedly infringing on Moderna’s patent while working on the first COVID-19 vaccine to be approved for use in the United States. #Pfizer #BioNTech #Moderna #COVID19 #vaccine #US https://t.co/c1kKF6YVru https://t.co/urycBQfRmj,en
2022-08-26 14:17:30+00:00,1184378293958729728,Disrupted immunization campaigns due to COVID-19 have led to increasing transmission of measles and vaccine-derived polio. #WHO #หลานรัฐมนตรีมมอมยาข่มขืน #يوم_الجمعه #CBCHS #ChampionsLeague,en
2022-08-26 14:16:35+00:00,4340349613,"Moderna said Friday it is suing rival vaccine makers Pfizer and BioNTech, alleging the partners infringed on its patents in developing their Covid-19 shot administered to hundreds of millions around the world.https://t.co/D57tLdp8QL#BilyonaryoHealth",en
2022-08-26 14:16:02+00:00,15312292,"Moderna said Friday it is suing Pfizer and its German partner BioNTech, alleging patent infringement over the COVID-19 vaccine.  https://t.co/nISm9g3KKI",en
2022-08-26 14:15:12+00:00,1489747303078445066,"Moderna is suing Pfizer and its German partner BioNTech for patent infringement in the development of the first COVID-19 vaccine approved in the United States, alleging they copied technology that Moderna developed years before the pandemic.  https://t.co/aivNsfTeNP",en
2022-08-26 14:15:11+00:00,1365984327339814913,"Moderna is suing Pfizer and its German partner BioNTech for patent infringement in the development of the first COVID-19 vaccine approved in the United States, alleging they copied technology that Moderna developed years before the pandemic.  https://t.co/ASdZhtrNpL",en
2022-08-26 14:15:11+00:00,451751944,"Moderna is suing Pfizer and its German partner BioNTech for patent infringement in the development of the first COVID-19 vaccine approved in the United States, alleging they copied technology that Moderna developed years before the pandemic.  https://t.co/EL12EGLXSJ",en
2022-08-26 14:15:10+00:00,1302684144082747393,"Moderna is suing Pfizer and its German partner BioNTech for patent infringement in the development of the first COVID-19 vaccine approved in the United States, alleging they copied technology that Moderna developed years before the pandemic.  https://t.co/pAOwOBJh4y",en
2022-08-26 14:15:10+00:00,16743886,"Moderna is suing fellow vaccine-makers Pfizer and BioNtech over claims that their COVID-19 vaccine infringes on patents Moderna filed before the pandemic, the company said in a statement.  https://t.co/SJwoQWqies",en
2022-08-26 14:15:04+00:00,18655359,Moderna plans to sue Pfizer for patent infringement over COVID-19 vaccine technology https://t.co/aa8gbj4ivS,en
2022-08-26 14:15:03+00:00,91334232,"Covid-19 vaccine maker Moderna is suing Pfizer and the German drugmaker BioNTech, accusing its main competitors of copying Moderna’s technology in order to make their own vaccine  https://t.co/oDdS1oNiYV",en
2022-08-26 14:15:00+00:00,303862998,"Moderna said Friday it is suing Pfizer/BioNTech for patent infringement in the development of the first COVID-19 vaccine approved in the United States, alleging they copied technology that Moderna developed years before the pandemic. https://t.co/bOF79nk2cS",en
2022-08-26 14:14:56+00:00,487630770,"AFP: #Moderna said Friday it is suing rival #vaccine makers #Pfizer and #BioNTech, alleging the partners infringed on its #patents in developing their #Covid_19  shot administered to hundreds of millions around the world. https://t.co/i83QY9Fqza",en
2022-08-26 14:14:48+00:00,1539287560966402048,"@GovRonDuhSantis @tedcruz The vaccines for Covid-19, which is what Ted is referring to, neither prevent transmission of disease nor prevent the acquiring of Covid-19.They prevent severe illness from developing in adults, which is a microscopic risk in children and adolescents.",en
2022-08-26 14:14:48+00:00,4716692414,"@code_monkey76 @TimRunsHisMouth including compensation claims filed to the CICP program for COVID DEATHS FROM VENTILATORS, see the bottom of the list, SHOCKING!!!  and Covid-19 vaccine deaths, injuries like heart problems, blindness, paralysis, from the covid19 vaccine!!",en
2022-08-26 14:14:19+00:00,1523873067390619648,Moderna sues Pfizer and BioNTech for the COVID-19 vaccine https://t.co/AmznmP5KmO,en
2022-08-26 14:14:17+00:00,1954460286,Stay up to date with your COVID-19 vaccines for the best protection heading into autumn. COVID-19 vaccination appointments are available in Belleville for ages 6 months and over. Book now: https://t.co/6gtxXX4dT4 #makeHPEstrong https://t.co/6xighLeOPe,en
2022-08-26 14:14:11+00:00,1225163710794272768,ForksTalk Newswatch: Moderna Suing Pfizer For COVID-19 Vaccine Patent Infringement: by Trevor Schakohl at CDN -      Moderna is filing patent infringement lawsuits against Pfizer and BioNTech in U.S. district court and German regional court Friday in… https://t.co/lUfaumD3O2 https://t.co/5z3Shl4m7z,en
2022-08-26 14:13:40+00:00,25390486,"RT @NACCHOalerts: We may be tired of #COVID-19, but the virus is not tired of us! Vaccine-preventable diseases remain a threat to our health, so be sure to encourage your community members to stay up to date on recommended vaccines! #ivax2protect #NIAM #… https://t.co/ew5gZ1ieAz",en
2022-08-26 14:13:27+00:00,38903873,Risk of Myocarditis After Sequential Doses of COVID-19 Vaccine and SARS-CoV-2 Infection by Age and Sex https://t.co/GuyMebsVeH #nessunacorrelazione,en
2022-08-26 14:13:27+00:00,4716692414,"@code_monkey76 @TimRunsHisMouth yep check this out.  Scroll down to the ""COVID19 Countermeasure claims filed as of Aug 1, 2022""9,153 countermeasure claims, 6,088 injuries/deaths from Covid-19 vaccines ad 3,065 injuries/deaths from other Covid-19 countermeasuresso many causes!!https://t.co/LbUuIr57mT https://t.co/yunHIfK1Y7",en
2022-08-26 14:13:13+00:00,20298671,Moderna is suing Pfizer and its German partner BioNTech for alleged patent infringement in the development of the first COVID-19 vaccine approved in the US. https://t.co/p2R32yADMB,en
2022-08-26 14:13:09+00:00,6817432,"Moderna said Friday it is suing Pfizer and its German partner BioNTech, alleging patent infringement over the COVID-19 vaccine.  https://t.co/CLq4H9CXcM",en
2022-08-26 14:13:02+00:00,2411278777,Moderna plans to sue Pfizer for patent infringement over COVID-19 vaccine technology https://t.co/Jty0xvOCrM,en
