date,userid,tweet,lang
2022-12-30 14:17:31+00:00,1559227334502166528,It's past time for this draconian practice to be halted.Pentagon Pauses All Actions Related to COVID-19 Vaccine Mandate After Biden Signs Bill https://t.co/OX8d9HbwZA,en
2022-12-30 14:16:43+00:00,424291167,"To me, the reason of low severity of Omicron BA.5  is because its spread in a background of very high population immunity (vaccination &amp; previous infections) &amp; better clinical knowledge of how to manage COVID-19 disease. China has good vaccine coverage &amp; knowledge on management.",en
2022-12-30 14:16:41+00:00,424291167,"China decided to stop its Zero-COVID intervention. The intervention worked well in the past two years and allowed time for the world and China to develop vaccines, diagnostics and therapeutics. Now, there is fear that the COVID-19 tsunami in China will detail the global efforts.",en
2022-12-30 14:16:22+00:00,1527761741215670272,"Although even need for polio vaccine rollout was questionable as population was already nearing herd immunity, the points still apply. Polio was serious for children. Why give risky Covid 19 jab to healthy, no risk children.",en
2022-12-30 14:16:12+00:00,203226736,(UPDATED) Exclusive Summary: Covid-19 Vaccine Concerns https://t.co/8ixEiRYGNw,en
2022-12-30 14:15:53+00:00,1465875630,"12/ In summary, the 1954 polio vaccine trial for an order of magnitude more lethal, and crippling childhood disease than covid-19, assessed ~650-fold the number of children evaluated in Pfizer’s covid-19 vaccine trial.",en
2022-12-30 14:15:13+00:00,247351807,"Off this week? Catch up on infectious diseases #ContinuingEducation with #NFID webinars covering topics such as #flu #vaccination, #HepatitisB prevention, travel #vaccines, #COVID-19, #mpox, and more. Learn more and register: https://t.co/nBoc6eZ4UD https://t.co/TXNjDdPNTM",en
2022-12-30 14:15:10+00:00,34050524,"Each day in America, there are about 2,500 excess deaths and 5,000 excess disability victims due to covid-19 vaccines. Are you among the ranks?https://t.co/JUiL9upFBl",en
2022-12-30 14:14:19+00:00,2227871363,"Read ""Study: Original COVID-19 vaccines haven't protected nursing homes in over a year - Washington Times' on SmartNews:  no kidding 😡 https://t.co/LgsDj6C1W0",en
2022-12-30 14:14:03+00:00,1465875630,"11/ Additionally, “No cases of COVID-19 were observed in either the vaccine group or the placebo group in participants with evidence of prior SARS-CoV-2 infection.” https://t.co/RyFLoS6N11",en
2022-12-30 14:13:18+00:00,1465875630,"10/ Covid-19 vaccination did reduce mildly symptomatic, covid-19 sniffles syndrome by “90.7%,” based on “3 cases in the BNT162b2 group and 16 cases in the placebo group (noting the 2:1 randomization of vaccine: placebo)” https://t.co/RyFLoS6N11",en
2022-12-30 14:13:03+00:00,1519353873609207810,A third dose of Pfizer and Moderna vaccines actually worsen immune against COVID-19. Study finds antibodies worse after mRNA boosters.https://t.co/pNfrETyZku,en
2022-12-30 14:11:54+00:00,1465875630,"9/ The Pfizer covid-19 vaccine randomized, placebo-controlled trial in 5 to 11 year-olds recorded zero cases of severe covid-19, despite recruiting ~20% with comorbidities. https://t.co/RyFLoS6N11",en
2022-12-30 14:09:48+00:00,30129303,"On ""why excess mortality is related to COVID boosters, why the association of Covid vaccines with mortality strengthens as time goes on instead of declining, and why boosted people take the longest to clear Covid-19.""https://t.co/Q4t3FdSigF",en
2022-12-30 14:09:08+00:00,1465875630,"7/ Pfizer’s Covid-19 mRNA vaccine randomized, controlled trial in 5 to 11 year-olds enrolled ~2300. https://t.co/RyFLoS6N11",en
2022-12-30 14:04:50+00:00,2243513534,U.S. sends COVID-19 vaccines worldwide [rolling updates] https://t.co/Q7ZUNExqf3 via @ShareAmerica,en
2022-12-30 14:04:20+00:00,77887226,"Project Covid-19 is one of the worst criminal acts in the history of mankind. The virus, the vaccine, the lockdowns have been agents of death deployed by a cabal of evil people influenced by the dark side",en
2022-12-30 14:03:18+00:00,2590913185,"@theacountantcpa @SeizureSalad314 And, yet, didn't think much about MERS because they didn't develop a vaccine for it? SARS is one reason why the Covid-19 vax was able to be prepared so quickly. 18 years of research between the 2 vaccines.",en
2022-12-30 14:03:15+00:00,830151760333381633,"Read ""'Waste of taxpayer money': Experts 'baffled' by DeSantis' COVID-19 vaccine investigation' on SmartNews: https://t.co/AIDGdP3hiA",en
2022-12-30 14:02:32+00:00,947698674603298817,"Great development! The GAVI vaccine alliance's board has approved up to $150 million to help 92 low- and middle-income countries prepare for the delivery of future COVID-19 vaccines, including technical assistance and cold chain equipmen! via :  https://t.co/rld8HWVCmS https://t.co/QJMTLNw3nh",en
2022-12-30 14:01:59+00:00,1536984703236034560,Do you have questions about the flu and Covid-19 booster vaccine? Our vaccine FAQ’s provide answers to commonly asked questions around both vaccines.Visit our website to find answers and more information around the questions you may have: https://t.co/NMR6uwcnWB https://t.co/ta9GiVtlpV,en
2022-12-30 14:01:22+00:00,936302210559938560,on #rooseveltisland Roosevelt Islander Online: NYC Mobil Vaccine Clinic Van Offering Free Pfizer Covid 19 https://t.co/oy3wzqNSr2,en
2022-12-30 14:01:07+00:00,1382786405366136836,"Vaccine Clinic in @TownCollingwood! As many respiratory viruses are back, staying up to date with your COVID-19 vaccinations is recommended. Learn more: @SMDhealthunit https://t.co/dL2CuzdNSg https://t.co/8Jq1ItNlSV",en
2022-12-30 14:00:54+00:00,139790901,Study: Original COVID-19 vaccines haven’t protected nursing homes in over a year - https://t.co/AZXpxgd7Fi - @washtimes,en
2022-12-30 14:00:51+00:00,90705306,"The COVID-19 vaccine clinic calendar has been updated for the first week of January. Walk-ins will be accepted.  Clinics: 1PM - 4PM on Jan 3 (All age groups)9AM - 4PM on Jan 4 &amp; 5 (All age groups)For more details, visit:https://t.co/d6uSer5Tfh https://t.co/y8kZzujXXC",en
2022-12-30 14:00:32+00:00,935942321756966912,"A new peer-reviewed study is raising concerns that a third dose of Pfizer and Moderna vaccines may actually worsen immune response against COVID-19, creating waves in both mainstream and heterodox COVID circles.Read more ➡https://t.co/dudWcTYEN1",en
2022-12-30 14:00:31+00:00,863527548,"During the pandemic, Twitter censored Dr. Martin Kulldorff. They said he shared “false information regarding the efficacy of the COVID-19 vaccines, which goes against CDC guidelines”.  Did Twitter have even 1 employee qualified to make that determination?https://t.co/JsQvUAH2VA",en
2022-12-30 14:00:30+00:00,908206706290601985,"Learning About Updated COVID Vaccine BoostersThe virus that causes COVID-19 is generally known to evolve. As such, it's vital to obtain a bivalent COVID-19 vaccination booster dose. Read more:https://t.co/mPWxAViZhz#HomeHealthCare #VaccineBoosters #PhoenixAZ",en
2022-12-30 13:59:36+00:00,1448221137335377921,"@RandPaul ""Risk of COVID-19 increased with time since the most recent prior COVID-19 episode and with the number of vaccine doses previously received."" It's also worth noting that the point of the article is to push the new bivalent vaccines, which they estimate at 30% efficacy.",en
2022-12-30 13:59:19+00:00,1381274649460412416,"There is a steep rise in cases of COVID-19, influenza &amp; other respiratory illness, placing our health services under significant pressure. Getting your flu and booster vaccine when it is due will help protect yourself, your patients, colleagues &amp; community.",en
2022-12-30 13:58:12+00:00,927118659260223489,"I do NOT know ONE SINGLE PERSON who has NOT gotten infected with Covid 19 AFTER receiving the ""vaccine"".  I am NOT vaccinated with Covid shots and I am STILL Covid free to this very day.  I consider myself lucky, so far... https://t.co/py8jGefSmx",en
2022-12-30 13:58:04+00:00,2281228142,COVID-19 Vaccines and Fever: Scientists Have Discovered a New Potential Link https://t.co/OlWtlmux9q #Health #COVID19 #Vaccination #Vaccine,en
2022-12-30 13:57:56+00:00,1519132370460364800,Researchers Prove Link Between Deaths and COVID-19 Vaccines https://t.co/QniVkbaHVg via @epochtimes #mRNA #GeneTherapy #VaccineDeaths,en
2022-12-30 13:57:12+00:00,367050948,"@first_merch @thisgreatisland @ClairElle__4 Not fair; In just one go, you concluded the conversation and deprived a soul - seemingly more anti-India than anti-vaccine - of it's happy moments... 😀#Covid_19 #CovidVaccines #vaccines #vaccine #CovidIsNotOver #covishield #smalldickenergy #",en
2022-12-30 13:56:53+00:00,1476324189657305089,Curing the pandemic of misinformation on COVID-19 mRNA vaccines through real evidence-based medicine - Part 1 | Malhotra | Journal of Insulin Resistance https://t.co/W1cG6Lcgsv,en
2022-12-30 13:56:41+00:00,1577764040662781979,⚠️Natural immunity vs. vaccine-induced immunity to COVID-19 To better explain what mRNA shots do to your immune systemhttps://t.co/1lLjVCVISx https://t.co/HBv3OO8D6A,en
2022-12-30 13:55:29+00:00,1447632313312030722,@Fletcho89 @Sonwabo_Cele @NomvulaWemvula Well I know people who have spoken against the vaccines and have given unmolested data about covid 19 and were killed for that,en
2022-12-30 13:55:25+00:00,1578360801148416000,@P_McCulloughMD NEW WARNING 🚨🚨🚨“Non-sexually acquired genital ulceration… can potentially occur after vaccination.”➡️Australian drug regulator- the Therapeutic Goods  Administration Safety  Report  ➡️ Covid 19 vaccine safety report➡️December 2022https://t.co/H8WlheygYc https://t.co/zRRaLTKEXj,en
2022-12-30 13:54:47+00:00,885788162,"@RandPaul So this is what the study actually said Conclusions The bivalent COVID-19 vaccine given to working-aged adults afforded modest protection overall against COVID-19, while the virus strains dominant in the community were those represented in the vaccine.",en
2022-12-30 13:53:58+00:00,1528774469963194376,Effectiveness of the Coronavirus Disease 2019 (COVID-19) Bivalent Vaccine https://t.co/xVUM8fRyro,en
2022-12-30 13:53:10+00:00,270492072,"Novavax starts mid-stage trial for COVID-19, flu vaccine combo https://t.co/drKYIoSBPu via SeekingAlpha #news #SeekingAlpha",en
2022-12-30 13:52:44+00:00,14874174,"@jamijturner @MarkMcC87580046 @DavidCWillisUSA @FatEmperor ""Make Covid-19 vaccine a global common good"" - I watched a video recently of a doctor in Uganda saying ""We don't need Covid vax as it's not a problem here. But we do need mosquito nets, malaria drugs and clean water. Like we always have. But you keep sending us useless vax""",en
2022-12-30 13:52:21+00:00,1498923969763807232,(Novavax Broadcasts Initiation of Section 2 Trial for COVID-19-Influenza Mixture and Stand-Alone Influenza Vaccine Candidates) has been published on The Globe - https://t.co/DkVCGIgOwQ,en
2022-12-30 13:51:48+00:00,923214244451151876,Bill Gates and the World Economic Forum were planning for a coronavirus pandemic plus the implementation of digital vaccine IDs BEFORE the Covid-19 outbreak started in China.Just a reminder,en
2022-12-30 13:51:28+00:00,1311421252133847041,Frequently asked questions on #Covid 19 #vaccineshttps://t.co/h6DDFIygn6 Beijing gives Hong Kong leader more power in security cases,en
2022-12-30 13:51:28+00:00,1311421252133847041,Frequently asked questions on #Covid 19 #vaccineshttps://t.co/h6DDFIygn6 South Korea's unannounced rocket launch causes UFO scare,en
2022-12-30 13:51:27+00:00,1311421252133847041,Frequently asked questions on #Covid 19 #vaccineshttps://t.co/h6DDFIygn6 Iranian man's death in France shakes distressed diaspora,en
2022-12-30 13:50:53+00:00,1549498746748014592,Effectiveness of the Coronavirus Disease 2019 (COVID-19) Bivalent Vaccine | medRxiv https://t.co/0BapHQtDOd,en
2022-12-30 13:49:24+00:00,40933920,#AndinaEnglish Peru: Over 86.61 million COVID-19 vaccine doses applied https://t.co/KRX8PoBNzI https://t.co/FiT69kMGhf,en
2022-12-30 13:46:37+00:00,407278889,"BREAKING: Drs Stricker and McCullough--labelled COVID-19 vaccines Pregnancy Category X in 2021 (do NOT use in pregnancy).  Now Thorp et al, compared to FluVax, COVID-19 vaccines found up to 1000-fold worse for multiple maternal-fetal outcomes. ...",en
2022-12-30 13:45:53+00:00,1597635242176962560,People who have received two doses of the COVID-19 vaccine have an 885% higher chance of dying than of those who are unvaccinated!https://t.co/B1WQpZ8quJ#diedsuddenly #suddenlydied #vaccine Follow me: @IToldYaSo123 https://t.co/hvGurF80rz,en
2022-12-30 13:45:38+00:00,1593209338809679879,"Effectiveness of the Coronavirus Disease 2019 (COVID-19) Bivalent Vaccine.-“The higher the number of vaccines previously received, the higher the risk of contracting COVID-19.”····🤔https://t.co/TexBPVeokB",en
2022-12-30 13:45:22+00:00,124958427,COVID-19 Vaccines: The Impact on Pregnancy Outcomes and Menstrual Functionhttps://t.co/SMWneaO2eAConclusions Pregnancy complications &amp; menstrual abnormalities are significantly more frequent following COVID-19 vaccinations than Influenza vaccinations. A worldwide moratorium ..,en
2022-12-30 13:45:12+00:00,1338639524868489217,"The short version of that conversation is that each day in America, there are about 2,500 excess deaths and 5,000 excess disability victims due to covid-19 vaccines. This means, on average, about 7,500 Americans are removed from the potential labor pool each day.",en
2022-12-30 13:44:26+00:00,948442499797934081,"“Booster mandates in young adults are expected to cause a net harm: per COVID-19 hospitalisation prevented, we anticipate at least 18.5 serious adverse events from mRNA vaccines, including 1.5–4.6 booster-associated myopericarditis cases in males...”",en
2022-12-30 13:44:17+00:00,1453327596985491457,"@AGHuff @ZombyWoof2022 International Journal of Vaccine Theory, Practice, and Research. What is in the so-called COVID-19 “Vaccines”? Part 1: Evidence of a Global Crime Against Humanity. Enjoy. And do not say, later, that you did not know. Open Season on Vaccinalist Predators!https://t.co/X6ynLGugij",en
2022-12-30 13:43:11+00:00,934077170338746368,"Getting your flu and Covid-19 vaccines are two of the most important things you can do to keep yourself and others around you safe this winter. Find out more, including how to book your vaccinations, at https://t.co/cBJGoYpphK.#Bristol #NorthSomerset #SouthGlos https://t.co/5l0DnO1iI3",en
2022-12-30 13:43:03+00:00,1336448695802470406,"Dr. Emanuel responded saying COVID-19 vaccines don't prevent transmission of the virus . they prevent serious illness, hospitalization,death. young people  are at lower risk . My daughter had side effects from the vaccine would of been better off fighting the virus on her own!",en
2022-12-30 13:42:13+00:00,1375787463965294592,@obriedave1 Again he would never knowingly push a vaccine that was not safe. And the one he was referring to when he recovered from COVID-19 himself was the same treatment that desantis was trying to make available in Florida.,en
2022-12-30 13:41:59+00:00,1104797212528267265,"@SkyNews I don't understand the 'fully vaccinated' element of the policy.Vaccinated people can still catch Covid-19 and pass it on to others while infectious. The vaccine only helps us combat Covid, doesn't stop us catching it.",en
2022-12-30 13:40:24+00:00,1293366978493722625,“Pregnancy complications &amp; menstrual abnormalities are significantly more frequent following COVID-19 vaccinations than Influenza vaccinations. A worldwide moratorium on use of COVID-19 vaccines in pregnancy is advised until randomized prospective trials document safety…”,en
2022-12-30 13:39:37+00:00,2913798339,NEW: Novavax announced the initiation of our Phase 2 dose-confirming trial in Australia for our COVID-19-Influenza Combination (CIC) vaccine candidate. The trial will evaluate the safety and effectiveness of the #CICVaccine in adults aged 50-80. Learn more:https://t.co/MvX9u6gSPI https://t.co/RtUEdd2SGs,en
2022-12-30 13:38:53+00:00,1483833061636718597,"@healthbyjames @LuLFo9 Anti-covid-19 vaxxers are giving, through scientists and doctors, a voice to why the covid vaccines should be pulled off the market.",en
2022-12-30 13:38:47+00:00,1544924753563381761,"Novavax To Initiate COVID-19 Phase 2 Influenza Combination, Stand Along Vaccine Trialshttps://t.co/fWHA4x24qe",en
2022-12-30 13:38:46+00:00,1561288285460123648,"Novavax To Initiate COVID-19 Phase 2 Influenza Combination, Stand Along Vaccine Trialshttps://t.co/bM1MQqWUn1",en
2022-12-30 13:38:13+00:00,129056223,Those with chronic comorbidities couldn't have survived without vaccines simply because their immunity is compromised and COVID-19 being what it is would've certainly proven fatal for them.One should never keep an all or nothing approach.Your arguments are seriously flawed.👎,en
2022-12-30 13:38:03+00:00,22798758,"TODAY 12/30 on THE MIKE GALLAGHER SHOW, 9-11aET: Issues covered include: Biden signs $1.7T spending bill after it’s flown 1,500 miles to St. Croix; DOD formally rescinds COVID-19 vaccine mandate for military. Much more! Listen online at https://t.co/VeGjDlsBNZ. https://t.co/GXEuG6JxcM",en
2022-12-30 13:37:21+00:00,1401070716,"Happening Now: what the media is hiding from American people about the COVID-19 vaccine. Please be aware and protect your kids,because COVID-19 vaccines producer have full immunity from killing your love ones or kids. https://t.co/XuQMcPxC3e",en
2022-12-30 13:36:40+00:00,1489351076960735232,"Novavax To Initiate COVID-19 Phase 2 Influenza Combination, Stand Along Vaccine Trials https://t.co/p4PE4UGAbD #news #stocks #stockmarketnews",en
2022-12-30 13:36:30+00:00,1532531230322806785,"@catturd2 There has NEVER been ANYTHING classified by the @FDA as a ""Vaccine"" for Covid-19. Let that sink in.",en
2022-12-30 13:36:24+00:00,38284810,"@jordanbpeterson public health benefit. Serious COVID-19 vaccine-associated harms are not adequately compensated for by current US vaccine injury systems. As such, these severe infringements of individual liberty and human rights are ethically unjustifiable",en
2022-12-30 13:36:11+00:00,1587130403290480641,@redwoodser One more thing before I go. Here is VAERS data on covid 19 vaccines. 😺https://t.co/5ohPS8cdpQ,en
2022-12-30 13:36:08+00:00,38284810,@jordanbpeterson Our est shows that university COVID-19 vaccine mandates are likely to cause net expected harms to young healthy adults—for each hospitalisation averted we estimate approximately 18.5 SAEs and 1430–4626 disruptions of daily activities that is not outweighed by a proportionate 1-2,en
2022-12-30 13:35:30+00:00,69298376,"If you are aged 18 to 49,  you can now get your second COVID-19 vaccine booster dose. If you’ve had COVID-19 recently, wait 6 months before booking your appointment. For more information, visit: https://t.co/C40fLxb1zH#COVIDVaccine https://t.co/8cZtz7O3Dz",en
2022-12-30 13:35:16+00:00,1588609928154972167,"Department of Defense formally rescinds COVID-19 vaccine mandate for militaryThe Air Force's mandate, in particular, was on pause amid a legal challenge from service members who claim they were wrongfully denied religious exemptions.#dt47https://t.co/k1pHXmuxOd",en
2022-12-30 13:33:40+00:00,15659178,"""SUMMARY: Among 51011 working-aged Cleveland Clinic employees, the bivalent COVID-19 vaccine booster was 30% effective in preventing infection, during the time when the virus strains dominant in the community were represented in the vaccine."" https://t.co/qZbqAEWeaY",en
2022-12-30 13:32:28+00:00,15659178,"""Risk of COVID-19 increased with time since the most recent prior COVID-19 episode and WITH THE NUMBER OF VACCINE DOSES PREVIOUSLY RECEIVED.""https://t.co/qZbqAEWeaY",en
2022-12-30 13:31:16+00:00,190337035,"Vaccine-boosted convalescent plasma therapy for patients with immunosuppression and COVID-19[Dec 13, 2022] @JuanGRipoll1 et al. @jwsenefeld @BloodAdvances https://t.co/pgDHkkSR5p #COVID19CP #COVID19 #COVID19nCancer #leusm #lymsm #mmsm",en
2022-12-30 13:30:51+00:00,1534822168089051136,UK pharmacies UK administered over 2 million flu vaccines in the 2021/2022 season and they will likely do more this year as we are faced with both the flu and Covid-19. Click the link to book your flu shot at Chippenham Pharmacy https://t.co/93hHT8U93s  #fluvaccine #flushot https://t.co/leyoHSWCjf,en
2022-12-30 13:30:32+00:00,100201255,Best event of the year 2022!Covid-19 spared many nations.India emerged as Leader in the production of Vaccines.G-20 Leadership Role for India#Welcome2023,en
2022-12-30 13:29:32+00:00,1314541592653561859,RFK Jr says Dr. Fauci will profit from COVID-19 vaccine https://t.co/DEK9VOJS6o,en
2022-12-30 13:28:57+00:00,1205044900951027714,"Report on COVID-19 vaccine for animals, measures to reduce the snakebite-related deaths and angry farmers destroying their vineyards were among the ten most read stories on @GaonConnection this year. Wondering what's more on the list? Read on.https://t.co/vFGfqDV7Rs",en
2022-12-30 13:27:07+00:00,489894993,Department of Defense formally rescinds COVID-19 vaccine mandate for military | Just The News https://t.co/RLYaTzUABH,en
2022-12-30 13:26:20+00:00,19741325,Overigens is vaccineren daartegen ook effectief (29% minder #LongCovid):The effectiveness of coronavirus disease 2019 (COVID-19) vaccine in the prevention of post–COVID-19 conditions: A systematic literature review and meta-analysis https://t.co/5FPA75dzkO,en
2022-12-30 13:25:39+00:00,9355842,SciTechDaily: COVID-19 Vaccines and Fever: Scientists Have Discovered a New Potential Link https://t.co/hE1fpSpHsz,en
2022-12-30 13:25:38+00:00,2761481534,“The file contains one data row for each distinct report associated with a suspected/interacting COVID-19 vaccine in an accepted adverse event case created between 10 January 2022 and 8 November 2022 where the outcome of the adverse event was reported as fatal.“ via @Jikkyleaks https://t.co/4RqdCtYg0e,en
2022-12-30 13:25:05+00:00,1460599124722659332,COVID-19 Vaccines and Fever: Scientists Have Discovered a New Potential Linkhttps://t.co/BTyFvcvIa1,en
2022-12-30 13:24:32+00:00,31372539,"Novavax starts mid-stage trial for COVID-19, flu vaccine combo https://t.co/e9sXzpAA8L",en
2022-12-30 13:24:13+00:00,1602006893685243905,"@ZombyWoof2022 @PierreKory @PeterHotez is corrupt, on the take, and promotes COVID-19 vaccines which injure many people.The Under Reporting Factor has been estimated to be 41 by Steve Kirsch, and the CDC has refused to provide a URF.#ivermectin works for COVID-19.https://t.co/iSmJRlzFbo https://t.co/D0knYa8dBE",en
2022-12-30 13:23:18+00:00,1519289960750329857,"@ProudElephantUS When no opposing opinions to a new treatment (the COVID-19 ""shot"" not vaccine) in the medical community are allowed and are indeed silenced (including those offering possibly effective treatments), common sense requires distrust of the product.",en
2022-12-30 13:21:29+00:00,1562815285257977859,COVID origins 'may have been tied' to China's bioweapons program: GOP report. Did Dr. Fauci launder money thru EcoHealth to pay for GAIN OF FUNCTION COVID-19 at WUHAN BIOWEAPONS LAB for BIG PHARMA VACCINES?? https://t.co/DgGjgiaOoQ #FoxNews,en
2022-12-30 13:20:40+00:00,1594844003610099713,"Dr. Peter McCullough has claimed that mRNA, which is present in COVID-19 vaccines, can be transmitted through close contact such as kissing, sexual activity, and breast milk.https://t.co/mhaYUFej0g",en
2022-12-30 13:20:01+00:00,1249996933080461312,All adults can now get their second COVID-19 booster vaccine. You can get yours in Cavan at the below times:@HSELive @theanglocelt @cavancoco @NewsonNS https://t.co/n3GUGW4aSz,en
2022-12-30 13:18:26+00:00,1575378615956639744,TrustHealthInf: Frequently asked questions on #Covid 19 #vaccineshttps://t.co/XOWRtGlaGj Greece: Remote town officials fired over Turkey group claim,en
2022-12-30 13:17:57+00:00,912916099683045376,"Dr Zaliha: Covid-19 vaccine walk-ins for elderly, high-risk groups from Jan 9 https://t.co/gpVzyVkidi",en
2022-12-30 13:16:45+00:00,2361912385,"@PierreKory @LordLindley Of course the EU officials complicate in the Covid 19 vaccine scam will try to prevent the truth coming out and will protect Bigpharma who paid them to keep quiet. This is replicated in other countries all over the world like Canada, NZ, Australia and the UK.",en
2022-12-30 13:14:47+00:00,1207679668008214530,"""430. Will a Covid-19 Vaccine Change the Future of Medical Research?"" by Freakonomics Radio https://t.co/dupvvZbBff #economics #podcastSee more posts at https://t.co/lo9TyPHPj4",en
2022-12-30 13:14:11+00:00,1493993097016975361,I have a disclosure to make I am sick as hell right now.  I didn't take a COVID-19 vaccine or flu shot and if I had it would have been so much worse! The good think is I already had COVID and you can't get it twice.,en
2022-12-30 13:09:11+00:00,1516030462954725380,Novavax launches Phase 2 trial for COVID-flu combination vaccine candidate$NVAX#Covid-19#Ainvest #Ainvest_Wire #trading #trade #tradeideas View more: https://t.co/lTXh1dzMi0 https://t.co/stwa5ysqWv,en
2022-12-30 13:09:04+00:00,1587390996668502019,🌍〛Fitness | Health | Sports 〉Top 10 COVID-19 Vaccine Candidates that You Should Knowhttps://t.co/4oSBa2hbFu https://t.co/0MpoFwjuHV,en
2022-12-30 13:08:40+00:00,1134049078424162304,Novavax Announces Initiation of Phase 2 Trial for COVID-19-Influenza Combination and Stand-Alone Influenza Vaccine Candidates $NVAX https://t.co/RPPnB1rtov,en
2022-12-30 13:08:37+00:00,399537893,@jimbolint @thecomeback @awfulannouncing Ok I’ll bite. (I love this part). Let’s discuss your knowledge of masks.  Show me studies where masks were proven to cut down on the spread of Covid-19. I’ll take any study that isn’t funded by pharma. After that we will move to the vaccine 🤣🤣🤣,en
