date,userid,tweet,lang
2022-10-29 08:39:01+00:00,d482983a371d880b2f0a0e0fa3cb67ea82f9660b63fdd777625ef092eb876ab8,Vaccines are the best protection we have against viruses like flu and COVID-19 that can cause serious illness. Find out if you’re eligible at https://t.co/vVlZUbbaQs… and book now. https://t.co/u5EVJYpQLe,en
2022-10-29 08:34:34+00:00,f6a093a66d2314a1320c8cd9a56007b38cbd134e73fc2dd981790d02a64756b2,"@CDN_Nick @MsDemeanor6 @Cyclowarrior @kerry98198 @AMFC1662 @Truth1027029097 @CorkySwift2 @cobysmom02 @grenier8_ruth @cartercode7 @pleasantville73 @GeoffreyWeiss @Tony42600263 @sattfly Funny how all the vaccines of yore that we all got did put a magic shield around us. Never acquired, or transmitted any of those diseases.COVID-19 vaccine doesn't do that. So they changed the definition of a vaccine.",en
2022-10-29 08:30:46+00:00,d6dfd5b2aae6d7ba2dcb474e31c081eb73bb1397ead7004ba8bfaffeeb24bcb3,Pandemic origin and response Lancet commission - COVID-19 vaccines updat... https://t.co/Ua6zcJyYYw via @YouTube,en
2022-10-29 08:30:41+00:00,70dcc072479f5a190ececd4e35436390ea6afc6692dba1e30116726ed32b4278,"@brillcubes @cooj2_0 @CristianTerhes Ah, a troll or bot account. Akin to a turd floating in a toilet pan.Tell me....'troll' is 51 people dead in England as a result of the covid 19 'vaccine' still deemed 'safe'?Bye bye. Enabler of evil xx",en
2022-10-29 08:30:16+00:00,1b999c72794d9d9536f1038bea0d1965,Getting the flu and COVID-19 vaccines helps to protect you and the person you care for and reduces your risk of becoming ill so that you can continue providing support. Don’t let your protection fade. Book an appointment at https://t.co/nInzlmEW7y https://t.co/F8eA5qvSJ0,en
2022-10-29 08:29:00+00:00,69103e2d7c89555e18fa13e43476e6a1,Manchester - Don’t let these two get in your way💉💪 We can all keep Manchester moving this winter with a free Covid-19 autumn booster and annual flu vaccine. Find out if you're eligible and book yours today. 👇 https://t.co/jbI4Xti83k https://t.co/eKQlQF07L6,en
2022-10-29 08:27:09+00:00,553e01dd75d518e586684c42dc13fc4897ac97db34f81002395d6bb4801e0ceb,Spike Protein in COVID-19 Vaccines Triggering Cancers and Clots: Pathologist Dr. Ryan Colehttps://t.co/Gm10amSw3W,en
2022-10-29 08:25:13+00:00,e72b15d4f71adf6488eb1cf517abb958,"@stevenrsurrey @cmishmom https://t.co/fjxiLQdHkZYou aren’t wrong. Vaccines emulate that which they vaccinate against, and COVID-19 causes cardiomyopathy and myocarditis. The evidence pointing to a lab leak is disquieting because the heart damage may be the result of a design spec.",en
2022-10-29 08:23:01+00:00,5898e50e2517d302436b849476af441d20d188cf0fc8aee9ea5fbd916abfa9ba,"@KathyHochul Wake up people,her plans to Fix/Save NY is off the table. It came straight out of her mouth. Even worse she plans of mandating the COVID-19 vaccine for our kids https://t.co/8DnVT4Z3Vm",en
2022-10-29 08:20:50+00:00,009046b082dca35c9713948fb4d25fc2,Panel of experts: More and more young people are dying because of COVID-19 vaccines – https://t.co/LfooqSq0wh https://t.co/IYJrq2xMU8,en
2022-10-29 08:19:47+00:00,8285a7b850bf531d435a8966243228eb,@KamVTV What rubbish... unless you are vaccinated by a Pfizer Covid-19 vaccine.,en
2022-10-29 08:18:55+00:00,0c709a9cd2b641e1bb12af6bc084ae759026c3d2d73e7cca99b009e9e8e5029f,"Pelosi attack susp. David DePape„ his personal blog, posts include such topics as “Manipulation of History” “Holohoax” “It’s OK to be white“,mentioned 4chan, videos of conspiracies COVID-19 vaccines+the war in Ukraine being a ploy for Jewish to buy land😳 https://t.co/rEkwUDbYnu",en
2022-10-29 08:18:47+00:00,f57accef5b8532840235cb0b995a0d480e20ff1af458b4b7e3a895da04ff7262,"TrustHealthInf: Frequently asked questions on #Covid 19 #vaccineshttps://t.co/GQiPcDa66T 17 Australian women, children return from Syrian camp",en
2022-10-29 08:18:47+00:00,f57accef5b8532840235cb0b995a0d480e20ff1af458b4b7e3a895da04ff7262,TrustHealthInf: Frequently asked questions on #Covid 19 #vaccineshttps://t.co/GQiPcDa66T Witnesses allege Eritrean abuses during Ethiopia peace talks,en
2022-10-29 08:18:01+00:00,23291bf6ad8446e86845e97949ec6e4f,"Another new report supports claim that COVID-19 likely came from Wuhan lab-- News, Social Impact | The Perfect Enemy: https://t.co/V08V6pCYoT.#Coronavirus #Coverage #Vaccines https://t.co/xtrnzL6x1D",en
2022-10-29 08:17:58+00:00,0cdbbee8883d1d70dbce50335852e5ad,"Another new report supports claim that COVID-19 likely came from Wuhan lab-- News, Social Impact | The Perfect Enemy: https://t.co/ud86yWqvCe.#Coronavirus #Coverage #Vaccines https://t.co/SoOefsd0mm",en
2022-10-29 08:15:18+00:00,790bc0ad045129c8927622834fad1df0d81e9b791b159e8c3c49665e073c209e,"The covid-19 vaccine is neither safe nor effective. It has been killing thousands, perhaps even millions, and so has the booster, for those who were fortunate enough to survive the initial shot(s). The vaccine has also crippled and severely injured many people.",en
2022-10-29 08:15:00+00:00,0413026f68bf047c6cfbc66b7a0eba7e,⚠️💉The European Medicines Agency Pharmacovigilance Risk Assessment Committee has recommended listing 'heavy menstrual bleeding' as a side effect of the BioNTech (Pfizer/Comirnaty) and Spikevax (Moderna) COVID-19 vaccines. https://t.co/9WGwISp3GN https://t.co/xC31ruOeTb,en
2022-10-29 08:13:00+00:00,fa604bb48e6f585f9bf3b54d3d4eaccb,"Excellent advice by Dr Monique Ryan 📌Please Get Boosted 💉VIC CHO: ""In the past three months, there have been 1,100 COVID-19 related deaths in Victoria. Of those deaths, 49% had NOT received their third COVID-19 vaccine dose""29/10/22https://t.co/3pLrXPgn05",en
2022-10-29 08:12:00+00:00,e95e3ea9a37efae40e506713ccd9028b,"New evidence has emerged that the mRNA COVID-19 vaccines are routinely injuring the heart of all vaccine recipients, raising further questions about their safety and their role in the recent elevated levels of heart-related deaths.https://t.co/hi0yzSIQUq",en
2022-10-29 08:09:58+00:00,b61c211846342b1480926f82a7baa852,"@Atotii_ @iyanzoo @Kamaug @ntvkenya They’ll build a vaccine hub(m-RNA types). Apart from covid-19 vaccines, Moderna has many other vaccine candidates. For the biotechs, It will be great to have m-RNA vaccine technology in Kenya.",en
2022-10-29 08:09:33+00:00,23729ad6178a97d5946359d344e1c666ac79ae11044c3635d5cf5c5b223c4b8a,"@CaulfieldTim Did they censor the lies about covid-19 beinf anything but a an artificial virus, the creation of which was funded by Fauci? Did they counter the spread of the idea that vaccines are low risk in cardiovascular complications or low sperm count? That they don't stop the spread?",en
2022-10-29 08:05:05+00:00,00547bac9d9aeaf9e27a4aad4985716abcbd7e127e19920ecf3e4b5c53912f4e,Getting your flu and COVID vaccines are two of the most important things you can do to keep yourself and others around you safe this winter. Book an appointment by visiting https://t.co/725Si3Cgs5 for your Flu vaccination &amp; https://t.co/WCImHGtY7p for your Covid-19 vaccination https://t.co/BkKN5xgoeb,en
2022-10-29 08:01:26+00:00,0c20398c6731f5d68e3330157468c62715b4ab0a24a81dca04a9eee0b632f47e,"COVID-19 and flu spread more easily in winter and can both cause serious illness. So, if you’re eligible, make sure you have your free flu vaccine and the COVID-19 booster this winter #GetBoosted https://t.co/rnILNUeSGs",en
2022-10-29 08:01:03+00:00,3c78cf2ab8a1bcadf340681a904d1538,💉The Covid-19 vaccine walk-in clinic in Loughborough Market place is open again today.🕙Open from 10am-5pm.This clinic is for boosters only. You must be aged 50+ or 12+ if eligible. https://t.co/jJHx7KECVm,en
2022-10-29 08:00:59+00:00,d821bd66acbe229bd5c35c5125288e6a40c4c2b695144af394971d2e61654951,"If you’re 50 years or over, have certain health conditions or are pregnant, you should have the flu vaccine and COVID-19 booster. Many children are also eligible for a free flu nasal spray vaccine. #GetBoostedFind out how to book at https://t.co/9Derb0A4uf https://t.co/1Dkva9vf1w",en
2022-10-29 08:00:45+00:00,913987ab1ef2c2701ffc3e7f6b8169afb8d21c90a316b29ae741237b75b0b840,"If you're pregnant, flu and COVID-19 can cause serious harm to you and your baby 🤰Make sure you get your free flu vaccine and COVID-19 booster.Find out how to book: https://t.co/aRv8vEA1hs https://t.co/6rCTP4EvY7",en
2022-10-29 08:00:17+00:00,25bcac1d9b62c824fb51db1339d66b2fd06ce007721bd9806b5e464e17dc4b9c,"COVID-19 and flu spread more quickly in winter and can cause serious illness. If you’re 50 years or over, you are eligible for a free flu vaccine and a COVID-19 booster. #GetBoostedFind out how to book at 👉 https://t.co/RAzx6jsLqv https://t.co/3E0XI584jD",en
2022-10-29 08:00:10+00:00,40d73577e551ab7acfb38bddf0976edcd4a4949e9f71b76a3d55839d8fcd4065,Seven million of Pfizer COVID-19 vaccines to expire within two days!https://t.co/CXdnVDDYil,en
2022-10-29 08:00:02+00:00,a923d24009cd172613547e168e1ede01,COVID-19 and flu spread more quickly in winter and can cause serious illness. If you’re over 50 you're eligible for a free flu and COVID-19 booster vaccine this winter. Book now ➡️ https://t.co/xeaSOGHaDj https://t.co/3uuUZMN5Wy,en
2022-10-29 08:00:01+00:00,efd6a7eb315298e8cd518d74bdeaa866,"If you're pregnant, flu and COVID-19 can cause serious harm to you and your baby 🤰Make sure you get your free flu vaccine and COVID-19 booster.Find out how to book: https://t.co/1sGavQx3RL https://t.co/vH5ml3Fym7",en
2022-10-29 07:57:20+00:00,9093242653667fecfaeb5de94150df86,Engaging women at Ngozi Mine informal settlement where the COVID-19 vaccine was shunned due to fears of its alleged impact on women's sexual reproductive health. Little information reached the settlement on COVID-19 treatment #ZwakalaMama #WomensHealth #Womensvoices @UN_Women https://t.co/8w4uAZuLkS,en
2022-10-29 07:53:01+00:00,0d9b956e05bffa681cac25c8c4267c2c,Boost your immunity this winter with the COVID-19 booster and flu vaccines. Find out if you are eligible at https://t.co/Ln56i8FeKc and book now. 💉 https://t.co/rNIzoCWNi5,en
2022-10-29 07:52:38+00:00,94457c3e3b42a3989aedc0ef5ac4eee5,Thousands still cocooning from Covid-19 without access to potentially protective drug  https://t.co/370wBPnv2VThis is a poorly disguised advertisement for Astrazeneca’s Evusheld using vulnerable but vocal middle class people.What happened to the vaccines?,en
2022-10-29 07:51:32+00:00,a3ccf1d2d740ee6f4c249f0f1424850936d376b178bdacd2cbde247fd168fb5f,"Frequently asked questions on #Covid 19 #vaccineshttps://t.co/MVijeonyZU 17 Australian women, children return from Syrian camp",en
2022-10-29 07:51:32+00:00,a3ccf1d2d740ee6f4c249f0f1424850936d376b178bdacd2cbde247fd168fb5f,Frequently asked questions on #Covid 19 #vaccineshttps://t.co/MVijeonyZU Witnesses allege Eritrean abuses during Ethiopia peace talks,en
2022-10-29 07:49:00+00:00,0d53ead8cedfac1deda9ea8eddff2b4d,The flu and COVID-19 vaccines are the best way to protect you and your baby against these dangerous viruses.Book your appointments now with your GP surgery or pharmacist or ask your maternity services. https://t.co/eDhIbs8QKA,en
2022-10-29 07:46:47+00:00,4605a5fa6e64041a009c29a7a97f92b70a1e444dc0419bc8ea58135f112bd565,"COVID-19 booster vaccine, Get your booster dose | How to Protect Yourself &amp; Others from Covid-19 safety measures and precautions and ways to prevent after and before covid-19https://t.co/vfRCZx3NHL#chestworkout #gym #gymmotivation #workout #abs #chest #exercise #bodybuilding",en
2022-10-29 07:45:11+00:00,62489f45753f1522d4c0bfef010db6bb,"@DrKimSchrier how about the current crop of covid-19 vaccines? Care to comment how they were first ""95% staying at injection site"" which turned out to be 54% according to pfizer, 95% preventing infection and spread, and so on? Nevertheless - get vaccinated or lose your career.?",en
2022-10-29 07:44:08+00:00,fb00a69ae5e03b550b1cdcd6d9a10bba79ea6213d3066c465c1c6b56c644f894,Why did Elon musk worry about the population going extinct. Because the Covid 19 vaccine killing millions,en
2022-10-29 07:44:00+00:00,80765ac7a7102114964c6db51007ed6ffea17c5f2663bf580f635c658daf4771,@M_T_Franz Das steht auch drin: „There is no evidence to suggest the menstrual disorders experienced by some people have any impact on reproduction and fertility. Available data provides reassurance about the use of mRNA COVID-19 vaccines before and during pregnancy. …🤮🤮🤮,en
2022-10-29 07:39:09+00:00,cb0b1f9e2e58169a77e7e95220cee9a6ca3956902d62bf7b27ac59ab4ed9ed04,"@Wags261 @ProgressiveInDC @MuellerSheWrote “Topics include Holocaust denialism, false claims that Covid-19 vaccines are lethal, venerating alt-right figure Jordan Peterson, and his support for Donald Trump to run in 2024 with Tulsi Gabbard as his running mate.”https://t.co/gxN8DIdngQ",en
2022-10-29 07:35:24+00:00,9aeebcf9e5519c78209063c9803ac3846315af655a3798edd9e5bd9b253d0b10,$DYAI has just been granted go-ahead for Phase I trials for a low-cost alternative to other COVID vaccinesThis could be a big disruptor to the COVID-19 vaccination market if it goes the distanceOne to watchMore info here 👇 https://t.co/B1iI6pjPLV,en
2022-10-29 07:33:27+00:00,95ed6bc096c54a177ba6ce073e201c65,Spike Protein in COVID-19 Vaccines Triggering Cancers and Clots: Pathologist Dr. Ryan Cole https://t.co/YkngucmJDk via @epochtimes,en
2022-10-29 07:30:52+00:00,d1b30a34958534ea6523e5c1d0453e80,It’s all about Schizer Liezer!! Covid-19: Researcher blows the whistle on data integrity issues in Pfizer’s vaccine trial | The BMJ https://t.co/Pxd9sdI7XK,en
2022-10-29 07:27:43+00:00,6b5bf96116e98e8bd61848330a063ec631ca2f45dfa7850c1f31ce0a3ebd7a0e,@zirkkeli1 So I guess over 3 years of data from this trial which uses the exact same amount of Matrix-M (adjuvant) that is in Novavax Covid-19 vaccine doesn’t matter? Not one adverse safety signal. https://t.co/h2WtvbFbaZ https://t.co/sxHFMNIQKw,en
2022-10-29 07:25:35+00:00,6fac630347fc16b783b89ba4f4b7dc7a8ea1710378c76cb62da8566507aae966,@DavidMc13940270 @UKHSA COVID-19 vaccination is the safest and most effective way for women to protect themselves and their pregnancies against severe COVID-19 disease. The JCVI has advised that women who are pregnant are considered to be in a clinical risk group within the COVID-19 vaccine programme. https://t.co/QlFg9oL8Nf,en
2022-10-29 07:24:56+00:00,7725a836a9d1889bd9963fb2bdff2176,Toronto Zoo’s Red Panda Cub Dies After Receiving Covid-19 Vaccine? Speculation on Social Media After Death of 3-Month-Old Dash https://t.co/0GtTgwJnXB,en
2022-10-29 07:24:55+00:00,f0561f676892ee6be5945f412a456c4716e25e4f09fa8d460afbbf545fcf313f,Toronto Zoo’s Red Panda Cub Dies After Receiving Covid-19 Vaccine? Speculation on Social Media After Death of 3-Month-Old Dash https://t.co/XEUap87fPT,en
2022-10-29 07:24:25+00:00,77c92b8b75bd3615d683930c66672b40,@samanthamarika1 Scary that we survived all of that bullying!!! I stood my ground when my husband was made to bc of his job  &amp; the majority of my siblings don’t talk to me bc I didn’t fall for the bullshit Covid-19 vaccine. Thank goodness #ElonMusk gave us hope back that we can honest convos 🙏🏻,en
2022-10-29 07:23:00+00:00,b4262abc716ab35758003aaaef9ce0fe,Manchester - Don’t let these two get in your way💉💪 We can all keep Manchester moving this winter with a free Covid-19 autumn booster and annual flu vaccine. Find out if you're eligible and book yours today. 👇 https://t.co/4Ztq0caDaU https://t.co/8RjuJLEXsP,en
2022-10-29 07:22:45+00:00,15069651c284278216c5babea10980cecee4ea7571378a940e002dce2e82bbf9,"2 months after COVID-19 vaccines were rolled out to the public, a statistically significant safety signal for myocarditis in males ages 8 to 21 appeared in the CDC’s - officials waited another 3 months before alerting the public, according to a new study.  https://t.co/AzTBmTlsQk",en
2022-10-29 07:22:26+00:00,2cab8fd09558d8abae0db9e4320282c166f4d07eb42c00a2fa0f30ada02c72aa,Aus 🇦🇺 Boom 💣 Ex AFL Player and Former 9 News Sport Presenter Warren Tredrea is seeking 5.77 Mill in damages and lost earnings over his termination for refusing the Covid 19 Vaccine....💣🔥👊 https://t.co/tR5BsI70PG,en
2022-10-29 07:20:40+00:00,d3e92b6943cd9027419facbb9e744791418730e4496d801a0719a789095114ad,VACCINATED people are dying of COVID-19 in huge numbers as of now &amp; the ANTI-CONSPIRACY THEORISTS &amp; FOLLOWERS OF SCIENCE are wearing brave faces. Better to die of anything else than to be murdered by an EXPERIMENTAL VACCINE.,en
2022-10-29 07:18:15+00:00,0eabf0ef134fd040ae4e3ecba4f904c3c55220b3e29a701ba3f2d3aaddccf3c8,Posts Distort Misleading Analysis of COVID-19 Vaccine Safety Data – https://t.co/Yt0EFNpku4 https://t.co/dywdBxl2kU,en
2022-10-29 07:17:30+00:00,0bf538816264293dab9b93381e60ac60dadec572bd582a07d671e7b0b8e84270,🌎 Global COVID-19 vaccine rollout🟩🟩🟩🟩🟩🟩🟩🟩🟩🟩⬜⬜⬜⬜⬜ 67.93% (estimate)Vaccine doses deployed: 12.9BThe rollout seems to be slowing down#COVID19 #EpiTwitter #Vaccination #PublicHealth https://t.co/t3iS5AIG6D,en
2022-10-29 07:15:09+00:00,9d7b2aece0957430bc9de22d270f55f3,Eligible adults aged ≥18 years should receive an updated bivalent COVID-19 mRNA vaccine to maximize protection against BA.4/BA.5 lineagesand to prevent COVID-19–associated hospitalization.https://t.co/BXzDBDVI9l,en
2022-10-29 07:14:39+00:00,2dcacddb68fc597fe727faf89d987fea5135c7784d89dc84a9d84551f61190fb,"@Permamama @CristianTerhes https://t.co/JHfTTEYN63 and ""covid-19 vaccine""",en
2022-10-29 07:13:57+00:00,8c74daa3c9524ea52dc310469f1ee432,Jonathan Weissman on COVID-19 Vaccines: What You Should Have Been Told https://t.co/xOGyeHGv33 via @YouTube,en
2022-10-29 07:13:54+00:00,96a6b020c94d5be98fd3c9ad0cf1c16b,Petition: Remove indemnity from the manufacturers of covid-19 vaccines https://t.co/XKDgLgOr31,en
2022-10-29 07:12:23+00:00,8c74daa3c9524ea52dc310469f1ee432,Jonathan Weissman on COVID-19 Vaccines: What You Should Have Been Told https://t.co/xOGyeHolOV via @YouTube,en
2022-10-29 07:11:56+00:00,6d19c7feb53dec8d3eafe07c3b22c87aefba49bbaa167c403b729780bb04eb05,@charlesadler 🤣🤣you have had one to many covid 19 vaccines. the spike protein must have penetrated the old brain cells. you say silly things.,en
2022-10-29 07:11:00+00:00,5d20713d491cc12f0b070ec3af108c3e8b29de593104fd92559fbde33165e94f,"@treehuggersunny @FakieNosegrob00 @samanthamarika1 The CDC recently admitted that the vaccine was NOT tested for efficacy against COVID-19, but I guess you’re a supporter of “the speed of science”. I guess being aware of that makes me someone that didn’t pass high school biology.",en
2022-10-29 07:07:42+00:00,57ec211299aedaace2a36f1212e4445b3f3fc08e7fb6487c2e59c2f36f6fef87,"@POTUS You created jack💩Manufacturing Lost 1.33 Million Jobs because of COVID-19 and your restrictions on forced vaccines and mandates , the so called pandemic is over so people can now get on with business with less government harrassment.",en
2022-10-29 07:03:06+00:00,aac1d883914680178fd437a093d5d0b77be945a28ed35bea71ecdf51242b554f,"Illinois COVID 19 coronavirus update: IL reports 3,449 new cases, 9 new deaths; Health officials encourage booster vaccines https://t.co/5S4olZlKp6",en
2022-10-29 07:02:59+00:00,7f66be671511047b30e318eaccdad017,@ruthbenghiat “…DePape posted links on his Facebook page to multiple videos produced by My Pillow CEO Mike Lindell falsely alleging that the 2020 election was stolen. Other posts included transphobic images &amp; linked to websites claiming Covid-19 vaccines were deadly.”https://t.co/HpbOEqPMEI,en
2022-10-29 07:02:40+00:00,05aae9f8c7e3ee2d7a7e91f834388dc3,"What may be the epidemiological implications of the global distribution of vaccines being proportional to need, rather than to wealth?In context of COVID-19, a @WarwickSBIDER study uses an age-structured model for 152 countries to consider different vaccine sharing policies.👇",en
2022-10-29 07:00:17+00:00,3bac71a949f5cf5c9380fb97386fbf49,Some health conditions put you at increased risk this winter and you’ll need the flu and COVID-19 vaccines. Find out if you are eligible at https://t.co/6x3qbk6ERm and book now. https://t.co/fsHkmZnjXu,en
2022-10-29 07:00:04+00:00,fbad13c2377c8237008c251edfeabe05,"Do you support vaccine requirements? A majority of Americans support COVID-19 vaccination requirements from employers, schools, businesses and federal, local and state governments for employees, residents or patrons. https://t.co/EluWMIPnaW https://t.co/tqpUkG5njJ",en
2022-10-29 06:57:29+00:00,f049ff2a2e3eab02adc83da2826de38498337e3dc34525c5d51d1023ec262913,@ElijahSchaffer It's not about thinking or believing. It's a well-documented fact that many people have died from the Covid-19 vaccines.,en
2022-10-29 06:56:04+00:00,9b20a3018af1fff98505f99fcf6f71734c1fd080ace9e71bd6a044d921c3ddfa,COVID-19 vaccine injury support group faces online censorship – [your]NEWS https://t.co/2MfhmoTgIe,en
2022-10-29 06:54:58+00:00,f2189605851c63564a8cfda6f3ecb37440c4c2b695144af394971d2e61654951,@VerifyThis The phoney Covid 19 pandemic is over according to Biden. The untested and ineffective vaccines are not necessary.,en
2022-10-29 06:54:57+00:00,e5db6672992e9a12a8531f41240808dc,"India’s Cumulative COVID-19 Vaccination Coverage exceeds 219.62 Cr Over 4.12 Cr 1st dose vaccines administered for age group 12-14 yearsIndia's active caseload currently stands at 18,802Recovery rate currently stands at 98.77%Details: https://t.co/HLTUwdhy50",en
2022-10-29 06:53:21+00:00,17e81667808a7403fd34245c1682f698db50cd64fb406eb84a00ef6d35d0c583,"‘Danger Signal’: Leaked Hospital Email Reports Increase in Stillbirths, COVID-19 Vaccine Suspected https://t.co/qkEjJOswNw via @TnkConservative",en
2022-10-29 06:53:18+00:00,0dce82e962894a94c5413544aa564906,Booster vaccinations in the elderly lead to impaired neutralization of SARS-CoV-2 and atypical B cells#COVID19#vaccine#CovidVaccine#SafeAndEffective#Covid_19 https://t.co/JDWicY6WIC,en
2022-10-29 06:53:06+00:00,714f8881b9e8f415cbb20964790081731c00d9eb303b43dbad00a52060ebaff8,New #vaccine approach can help jumpstart immune response to #COVID-19https://t.co/Gg8mwtyv2u,en
2022-10-29 06:52:27+00:00,8ca270d0ddc2b6e954574801a3ec7d21162fa1635c968d50f007da77ee5eed3d,@PowerUSAID U might not get it but this shows hiw racist u are. There have been millions people waiting for the vaccines all over the world during COVID-19 and miraculously are available fir Nazis Ukraine? Pathetic,en
2022-10-29 06:50:54+00:00,d9b0758484417684cc267cc5e2d33e0638fc9a662d8ec8ba354ec5e16890649e,Here's to all y'all that resisted the greatest genocidal psyop in history.Don't take that deadly fucking vaccine. The COVID-19 vaccine is lethal and will probably kill you. Sooner or later.Free speech is great. 😎,en
2022-10-29 06:50:41+00:00,36899637893aa22c7d1d6ef8018ad2d88f392400d539037d450d623a668b4f39,"@testsubjecttt @Astronomical18_ you should get one. vaccine immunity wanes over time. this is the same reason you get a flu vaccine each year, for example. COVID-19 vaccines are still free in some places but they will not be for long. Get one for free while you can",en
2022-10-29 06:48:21+00:00,751866691c5acd3575b92ace55443fd0,"@TomiLahren Didn't you have the vaccine in order to continue to work at Fox?“All workers in NYC who perform in-person work at an office location, including Fox employees, must show proof of receiving at least one dose of a COVID-19 vaccine.” 12/21— Fox News memo",en
2022-10-29 06:47:56+00:00,aa94c9ba8540483d2f2c1ed31b035a91,This is exactly what I am experiencing after taking the vaccine. Definitely won't be taking booster shot.COVID-19 can interfere with your period in many ways. Here's how. https://t.co/rrctqVJaX5 via @NatGeoMag,en
2022-10-29 06:47:41+00:00,4399fd73a7b6e5c3723432477fec1891,Understanding COVID-19 Vaccine Acceptability Among People Experiencing Homelessness - JPHMP Direct https://t.co/QrAtKoryNz,en
2022-10-29 06:44:53+00:00,9b20a3018af1fff98505f99fcf6f71734c1fd080ace9e71bd6a044d921c3ddfa,(UPDATED) The hidden Covid-19 vaccine-injured | Sharyl Attkisson https://t.co/6NZFmpEDSM,en
2022-10-29 06:44:28+00:00,57f06039e36ce2c004c88cc2656b77954486eae99ee249ab587270a413fabbdd,"@AbigailJordynnn If nothing happened to you, then that means that you probably got saline solutions disguised as covid-19 vaccines. Only the saline solutions are ""safe and effective"".",en
2022-10-29 06:42:53+00:00,78d9d3d1ef028768610aeb34a8af899d,"@WDervaish To be fully vaccinated, your vaccine certificate must contain a QR code (QR code not required if you hold a COVID-19 vaccination record card issued in the USA), and you must have received two doses of the same vaccine, or one dose of Janssen. *Kacy",en
2022-10-29 06:42:19+00:00,9b20a3018af1fff98505f99fcf6f71734c1fd080ace9e71bd6a044d921c3ddfa,Acute kidney injury after COVID-19 vaccines: a real-world study - PubMed https://t.co/bPYh4bqlzw,en
2022-10-29 06:39:19+00:00,51caae53ba552c4e3609bb249cfb702828fc0e92190b87c0dc2468d0c64ea5a6,Toronto Zoo’s Red Panda Cub Dies After Receiving Covid-19 Vaccine? Speculation on Social Media After Death of 3-Month-Old Dash https://t.co/SILVEKxp1c,en
2022-10-29 06:36:17+00:00,cb0b1f9e2e58169a77e7e95220cee9a6ca3956902d62bf7b27ac59ab4ed9ed04,"@Rebel_Mike @DanRather Trumper. “Topics include Holocaust denialism, false claims that Covid-19 vaccines are lethal, venerating alt-right figure Jordan Peterson, and his support for Donald Trump to run in 2024 with Tulsi Gabbard as his running mate.”https://t.co/gxN8DIcPri",en
2022-10-29 06:35:00+00:00,ffcf007320416b6e3312f653b0974cf6fea17c5f2663bf580f635c658daf4771,"COVID-19 Update:🔹 219.62 add a cr Total Vaccine doses (95.02 cr Second Dose and 22.07 cr Precaution Dose) have been administered so far under Nationwide Vaccination Drive🔹 1,72,838 doses administered in last 24 hours🔹 India's Active caseload currently stands at 18,802 https://t.co/t5QNUDku6o",en
