date,userid,tweet,lang
2022-12-30 18:43:49+00:00,310478772,"@HLFrisbie @WHO As of 8 April 2022, WHO has evaluated that the following vaccines against COVID-19 have met the necessary criteria for safety and efficacy:  https://t.co/mOg7WoEeva",en
2022-12-30 18:43:18+00:00,1031112480280522752,"@AAPSonline @angelanashtn @P_McCulloughMD ""..all COVID-19 vaccine AE far exceed the safety signal on all recognized thresholds...Pregnancy complications and menstrual abnormalities are significantly more frequent following COVID-19 vaccinations than Influenza vaccinations..""https://t.co/JCtxCK39mC https://t.co/8ez6NDmaRX",en
2022-12-30 18:42:28+00:00,77802089,@DoxMeIfYouCan @eastcountyDave3 @DrAndrewJackson “Spikevax has the same formulation as the EUA Moderna COVID-19 Vaccine” https://t.co/BtIOutJwL8,en
2022-12-30 18:41:22+00:00,37716311,4 CT Counties at High Levels Amid ‘Long-Anticipated Winter COVID-19 Surge' - NBC Connecticut-- News | The Perfect Enemy: https://t.co/HOyyPElQoL.#PublicHealth #Vaccines https://t.co/HehcYLNTYM,en
2022-12-30 18:41:05+00:00,709947536,4 CT Counties at High Levels Amid ‘Long-Anticipated Winter COVID-19 Surge' - NBC Connecticut-- News | The Perfect Enemy: https://t.co/R75B5WQIOl.#PublicHealth #Vaccines https://t.co/DmFioZG5Yt,en
2022-12-30 18:40:56+00:00,2867793173,"I had relectantly gotten the J&amp;J vaccine originally and later (earlier this year) got COVID and took Paxlovid, which I hated. Feeling crummy today and tested positive for COVID-19 on a rapid test. Recommendations for supplements or things I may already have at home?",en
2022-12-30 18:40:41+00:00,1354179574758825984,"Updated data: In November, adults w/ the updated bivalent vaccine had much lower COVID-19 hospitalization rates, compared to the unvaccinated and the vaccinated who did not get the updated bivalentStay well in the new year, get the updated vaccinehttps://t.co/D0M8E97uIn https://t.co/YHOrVbUySp",en
2022-12-30 18:37:32+00:00,73904441,Stay Up to Date with COVID-19 Vaccines Including Boosters | CDC https://t.co/O4nuZH5M92,en
2022-12-30 18:36:20+00:00,1248441635186315265,"Another doctor warns people about the ""Covid-19 vaccine"" - videohttps://t.co/7S6irwqKRg",en
2022-12-30 18:35:53+00:00,553627910,@RafstuffBert @DineshDSouza Nonsense - lots of research shows that COVID-19 is much more likely (8-10 times) to blood clots in the brain than vaccines. Some research studies linked form here: https://t.co/QtW4R8fa37,en
2022-12-30 18:32:43+00:00,42769016,A worldwide moratorium on the use of COVID-19 vaccines in pregnancy is advised until randomized prospective trials document safety in pregnancy and long-term follow-up in offspring.,en
2022-12-30 18:31:25+00:00,1302677570547318785,@TiceRichard Are you on the right bus 🤔Lockdowns and vaccines made the UK the leaders in combating COVID-19,en
2022-12-30 18:31:14+00:00,1606678343436406789,"Invited but…absent…included Dr. Anthony Fauci, Dr. Rochelle Walensky, Dr. Peter Marks, Dr. Ashish Jha, Dr. Robert Califf, and…other government…health officials…[they] refused calls to attend…and interact with their peers…refused to face COVID-19 vaccine-injured patients…”",en
2022-12-30 18:30:30+00:00,43902999,The British Heart Foundation has hit back at claims by a Bridgen that it covered up data on the harm caused by Covid-19 vaccineshttps://t.co/NiXfH3t09c,en
2022-12-30 18:30:00+00:00,472122299,"The government can still continue the rollout of vaccines if President Ferdinand ""Bongbong"" Marcos Jr. decides against the extension of the state of calamity due to COVID-19, but it cannot purchase additional doses, the Department of Health said Friday. https://t.co/M0cCiZ6w1R",en
2022-12-30 18:30:00+00:00,29199444,"Protect yourself from COVID-19 and the flu ahead of #NYE2023! Come by BCYF Menino Community Center tonight for free COVID-19 vaccine or booster, flu vaccine, and rapid testing kit! @BCYFcenters @LCGBoston https://t.co/MOAVRLN8nc",en
2022-12-30 18:29:09+00:00,1359363872558227459,"@_shloka From Walgreens site: “It remains critically important to get vaccinated or boosted against COVID-19, and is safe and convenient to get a COVID-19 vaccine or booster at one of Walgreens nearly 9,000 locations.”https://t.co/hUqoXAJYJL",en
2022-12-30 18:29:01+00:00,1096883838641496065,@samkelemaseko @Eskom_SA Covid 19 vaccine underway second term,en
2022-12-30 18:28:56+00:00,1963205773,"Medical research is an important part of @aboutKP integrated care and innovation. The Shi family, Kaiser Permanente members who participated in national trials of COVID-19 vaccines for children and adults, will join our @RoseParade float on Monday morning. #KPResearch @KPSCALnews",en
2022-12-30 18:28:12+00:00,1583448430483050496,@masslivenews Pretty silent on the economic development people without a covid-19 vaccine could bring to our state if you'd stop banning them from working for our state.,en
2022-12-30 18:25:03+00:00,50681065,Experts Puzzled By Why Haiti Has One of the Lowest COVID-19 Death Rates In the World Despite Administering Zero Vaccine Doses: 'We Don't Know' https://t.co/Xhwm7LbROz,en
2022-12-30 18:24:39+00:00,1577684377534074880,Senate passes bill that rescinds COVID-19 vaccine mandate for the military https://t.co/sbH3FAeSvB,en
2022-12-30 18:22:59+00:00,1583448430483050496,"@NateMen_deezy @MassGovernor Except this covid-19 vaccine does not stop the spread of covid-19. You can still get covid-19 and spread it despite being vaccinated against covid. Our case/death numbers are extremely similar to Tennessee's, one of the least vaccinated states with a similar population",en
2022-12-30 18:22:54+00:00,1506401373293891593,"BREAKING ON UNIVERSITY MANDATES “Booster mandates in young adults are expected to cause a net harm: per COVID-19 hospitalisation prevented, we anticipate at least 18.5 serious adverse events from mRNA vaccine” -according to a peer reviewed published paper https://t.co/zYJhMAGfRI",en
2022-12-30 18:22:03+00:00,1595434574112518146,"US Senate Panel on COVID-19 Vaccines: What They Are, How They Work, and Possible Causes of Injuries - America Out Loud https://t.co/q4R9psn88K",en
2022-12-30 18:22:03+00:00,26016477,Public Health Mid-West urge all adults to get the latest booster vaccine amid surge in Covid-19 https://t.co/shALy4WVqh,en
2022-12-30 18:22:03+00:00,25531742,Public Health Mid-West urge all adults to get the latest booster vaccine amid surge in Covid-19 https://t.co/hTisBxKLgR,en
2022-12-30 18:21:30+00:00,147049707,COVID-19 Vaccines: The Impact on Pregnancy Outcomes &amp; Menstrual FunctionPregnancy complications &amp; menstrual abnormalities are significantly more frequent following C19 vax than flu vax. A worldwide moratorium on the use of C18 vax in pregnancy is advised https://t.co/zm32qq5Pa7,en
2022-12-30 18:21:17+00:00,1595434574112518146,COVID-19 Vaccines: The Impact on Pregnancy Outcomes and Menstrual Function[v2] | Preprints https://t.co/a4qIHKyfIL,en
2022-12-30 18:21:06+00:00,1002890502130282496,"@morganstephensa Smart guy @RepThomasMassie advocates for catching Covid-19 because it gives you ""immunity"" so that you would not need vaccines",en
2022-12-30 18:20:34+00:00,1437812724008984583,Public Health Mid-West urge all adults to get the latest booster vaccine amid surge in Covid-19 https://t.co/IOK99qxCTa,en
2022-12-30 18:19:42+00:00,437545780,"Saturday's event at the Lentz Public Health Center will be the final event for the MPHD Strike Team.Starting Tuesday, COVID-19 vaccines and boosters will be available by appointment in our clinics instead of at community sites. At-home tests can be picked up at our clinics. https://t.co/VR8mVkPWJp",en
2022-12-30 18:19:01+00:00,1347405487,Ready to get your COVID-19 booster shot? Or get the #flooster AKA your COVID booster and flu shot together! Protect yourself and your loved ones by getting vaxxed for free! Learn more and find a vaccine near you at https://t.co/7Vzfo3c3KC #GetVaxxed #GetBoosted https://t.co/12phemBmqj,en
2022-12-30 18:18:37+00:00,1522638563019472898,COVID-19 was made in the lab in China. It killed my dad and millions of others and these jabs are not vaccines.,en
2022-12-30 18:18:13+00:00,1348562760561516545,"Inquest finds man, 96, died after allergic reaction to Covid-19 vaccine. Peter Jackson died after collapsing in the car park after receiving his Injection of filth. https://t.co/tGIbZwteq8",en
2022-12-30 18:17:02+00:00,314621392,Herpes vaccine tests underway by company that made COVID-19 vaccines. So if this follows the Covid plan we shall see more Herpes related outbreaks. https://t.co/nhvUQIOxNq,en
2022-12-30 18:16:04+00:00,1601999378495029248,Top Japanese Physician-Scientist Gives Dire Warning About COVID-19 mRNA Vaccines: ‘Scientifically Misconceived’ https://t.co/l0X0DrHW6S,en
2022-12-30 18:15:47+00:00,253049000,@zoeharcombe A very useful video on that topic:Dr. Victoria Male explains what antibody dependent enhancement (ADE) is and how the coronavirus vaccine clinical trials were designed to monitor for it. ADE:What Is It? Does it Occur With COVID 19 Vaccines?https://t.co/vv2UuWWhHj,en
2022-12-30 18:15:08+00:00,15794057,Gaithersburg’s Novavax is drawing the curtain on 2022 by advancing its combination vaccine for Covid-19 and the seasonal flu.  https://t.co/LclNXoXQJg,en
2022-12-30 18:13:09+00:00,873989847907614720,COVID-19 Vaccines: The Impact on Pregnancy Outcomes and Menstrual Function[v2] | Preprints https://t.co/zHMou6A56k,en
2022-12-30 18:13:06+00:00,1038599418797219840,New article out with @CaulfieldTim examining newspaper coverage of COVID-19 vaccine requirement for organ transplant. We found false balance may contribute to misperceptions about a consensus medical viewpoint &amp; create controversy where none exists. https://t.co/kiuvaxQNSe https://t.co/FfEEdjXaZU,en
2022-12-30 18:12:41+00:00,328470960,New Study Found A 9-Times Increased Rate Of Myocarditis In Males After mRNA Booster | 3 Or More COVID-19 Vaccine Doses Associated With A 6-Fold Increased Risk Of Infection Said Cleveland Clinic 👀https://t.co/1ZRxutPCF7,en
2022-12-30 18:12:22+00:00,1344755461455810564,New study shows the more Vaccine doses one has received the more likely they are to contract Covid-19.Link: https://t.co/ci1L1UYQVz https://t.co/EZw7Z7SvT6,en
2022-12-30 18:11:35+00:00,525908056,@SenBillCassidy Interesting how you selectively honor George Washington. Surely a doctor such as yourself would know how Washington instituted a smallpox vaccine mandate (https://t.co/Q6qQe7TjoD). Which makes it ironic you opposed a military COVID-19 vaccine mandate.,en
2022-12-30 18:09:18+00:00,1492623295828660227,« Probable causal association between Australia’s new regime of high all-cause mortality and its COVID-19 vaccine rollout. »(20 December 2022)https://t.co/lP53h4o7XP https://t.co/uSn2rdJjWs,en
2022-12-30 18:09:00+00:00,1487539778975420418,"variants - or possibly any other virus. So let's watch the ""real"" pandemic begin now! In its Week 42 ""COVID-19 Vaccine Surveillance Report"", the UK Department of Health admits on page 23 that ""N antibody levels appear to be lower in people who become infected after two",en
2022-12-30 18:08:07+00:00,117793973,"It takes 2! Get your COVID-19 + flu vaccines to keep you and your family safe from severe illness. To find a vaccine site, visit https://t.co/Ko2X2WIQ8L. https://t.co/zjlwJt7jzM",en
2022-12-30 18:07:17+00:00,1273874011261468673,"👀 Excerpt:“Slowly, the public is being made aware that Covid 19 was a bioweapon, and the same people who made it, covered up the origin, covered up viable treatments, and pushed vaccines that didn’t work, which they profited off of, all in an effort to retain and gain power”",en
2022-12-30 18:06:26+00:00,984517807076446208,"In responding to the COVID-19 pandemic, the United States:   ✅ Provided nearly $20 billion for the global response ✅ Distributed 671 million doses of safe, effective vaccines✅ Supported over 115 countries",en
2022-12-30 18:05:32+00:00,1594890849787281408,U.S. sends COVID-19 vaccines worldwide [rolling updates] https://t.co/c9iVuXdDd5 via @ShareAmerica,en
2022-12-30 18:05:03+00:00,97447407,"New Study Found A 9-Times Increased Rate Of Myocarditis In Males After mRNA Booster | 3 Or More COVID-19 Vaccine Doses Associated With A 6-Fold Increased Risk Of Infection Said Cleveland Clinic | ETC, by @healthbyjames https://t.co/ohzIpob76l",en
2022-12-30 18:03:47+00:00,1520753991331819520,TRUTH BE TOLD. AVOID COVID 19 VACCINES!,en
2022-12-30 18:03:46+00:00,1332460279326679041,@Agent131711 @TimTruth123 A customer told me she has POTS and her doctor told her it was from the covid-19 vaccine. She has to wear a heart monitoring device on her wrist for the rest of her life.,en
2022-12-30 18:03:07+00:00,1568595224238112770,@bjay1121 @WalshFreedom I didn’t hear him claim whether the vaccine or COVID killed the athletes but the story from Media https://t.co/BcliPN92Ou said: “NBA icon John Stockton baselessly claimed that “thousands” of professional athletes may have died after they received the Covid-19 vaccine shot.”,en
2022-12-30 18:02:52+00:00,1568595224238112770,@bjay1121 @WalshFreedom I didn’t hear him claim whether the vaccine or COVID killed the athletes but the story from https://t.co/Uq1peXAk3X said: “NBA icon John Stockton baselessly claimed that “thousands” of professional athletes may have died after they received the Covid-19 vaccine shot.”,en
2022-12-30 18:02:05+00:00,146569971,"If you have a weakened immune system, you are at increased risk of severe illness and death from #COVID19. You have the best protection when you stay up to date with your COVID-19 vaccines. Learn more:  https://t.co/aWbIzh1oor https://t.co/TRiTi3GGaK",en
2022-12-30 18:02:00+00:00,9636672,"@RandPaul You really should read the whole thing, Rand, it makes you look stupid when you don’t. “Conclusions The bivalent… (vax) given to working-aged adults afforded modest protection…against COVID-19, while the virus strains dominant in the community were those…in the vaccine.”",en
2022-12-30 18:01:54+00:00,1413996216866820103,"Please end all Covid 19 vaccine mandates, which are harming students, especially the socioeconomically disadvantaged, communities and public health at large. 4/4",en
2022-12-30 18:01:21+00:00,207536512,The COVID-19 vaccination rollout commenced in some of the high-risk regions of Niger.  @UNICEF is supporting traditional and community leaders to drive the campaign against vaccine hesitancy in the country to increase the uptake of COVID-19 vaccines. https://t.co/xJitrwaUIg,en
2022-12-30 18:01:02+00:00,1559163527952203777,$NVAX → 📰 Press ReleaseNovavax Announces Initiation of Phase 2 Trial for COVID-19-Influenza Combination and Stand-Alone Influenza Vaccine CandidatesGet more stock alerts ↓https://t.co/1G5pL9O1Ki,en
2022-12-30 18:00:15+00:00,268393114,"The last day to visit a #TravisCounty COVID-19 vaccine clinic is TOMORROW (12/31)!💉 Go here for locations, hours, and vaccine availability: https://t.co/FkSXffpzGW💉 After Saturday, find COVID-19 vaccines near you here: https://t.co/pxc5DL5avP or https://t.co/NcYHVDrFPk https://t.co/BWyFBHoMvb",en
2022-12-30 18:00:08+00:00,390277164,"The mRNA used in the Pfizer and Moderna COVID-19 vaccines is broken down within a few hours to a few days after vaccination, and discarded from the body. https://t.co/0l1ic4G5mO",en
2022-12-30 18:00:06+00:00,199252851,"Florida Gov. Ron DeSantis requested a grand jury look into “crimes and wrongdoing” related to the COVID-19 vaccines, as his hired experts repeatedly suggested the shots were too risky. However, his reasons are flawed. #COVID19 https://t.co/UBxLwvyXRw",en
2022-12-30 18:00:02+00:00,3161549442,Drop by our immunization clinic to get the COVID-19 Bivalent booster vaccine.Vaccines are available Monday-Friday at our immunization clinic. Walk-ins welcome. https://t.co/v1PvQs8xbd,en
2022-12-30 18:00:02+00:00,140530918,"⚠There are a number of respiratory illnesses circulating our communities. ⚠👉Visit https://t.co/KkgD4UatCx for more information on Flu, COVID-19 and RSV.Find a flu vaccine near you!  https://t.co/Emo1wjsQxm https://t.co/3FWgMCabRo",en
2022-12-30 17:59:16+00:00,1490766333046259715,Seeking Health &amp; Truth: Two Years of U.S. COVID-19 Vaccines Have Prevented Millions of Hospitalizations and Deaths https://t.co/ZhWCPdsKVf,en
2022-12-30 17:59:07+00:00,1491443674927886336,This is idiotic @PierrePoilievre @CPC_HQ. COVID-19 vaccination doesn't stop infection or transmission. Risk of serious vaccine side effects is higher than risk of hospitalisation from COVID-19 for most.Abstinence is 100% effective. Stop flights from China.@MaximeBernier,en
2022-12-30 17:58:48+00:00,1593633629837484033,"Well, actually they should be in a waybecause they more gene therapy/vaccine jabs you getthe more times you are likely to GET covid 19and the weaker your immune system is to fight it...",en
2022-12-30 17:58:32+00:00,3161549442,"Galveston County's COVID-19 Community Level is LOW.  •Stay up to date on COVID-19 vaccines. •Get tested if you have symptoms. •If you are at a high risk for severe illness, talk to you doctor about whether you need to wear a mask and take other precautions.",en
2022-12-30 17:56:53+00:00,1588234573099552768,"@RTLnieuws https://t.co/nsw0GpL2vd"" The Florida Supreme Court signed off Thursday on Gov. Ron DeSantis’ request to impanel a grand jury to investigate COVID-19 vaccine manufacturers for potential wrongdoing.""",en
2022-12-30 17:56:11+00:00,1374632998293929984,Top Japanese Physician-Scientist Gives Dire Warning About COVID-19 mRNA Vaccines: ‘Scientifically Misconceived’ https://t.co/4jTJuX4GIy,en
2022-12-30 17:55:15+00:00,24955217,@elonmusk Have you revised CDC and WHO's data on COVID-19 and vaccines?Im curious as to what do you think about the science behind it.Lemme guess you haven't.There's no such thing as Truth. Scientific method is the closest we have to be there.,en
2022-12-30 17:55:14+00:00,184516497,"With the recent increase in flu, RSV, and COVID-19 cases, here are some tips to stay healthy: •Consider wearing a well-fitting mask.•Stay home when you are sick.•Stay up to date on flu and COVID-19 vaccines.•Wash your hands with soap and warm water. https://t.co/HQz6yxm5iF",en
2022-12-30 17:54:38+00:00,1036790300310691840,@SeizureSalad314 Questions ;1. Did this covid/ vaccine debacle happen because Fauci Saw the episode?2. If that episode was never written and aired would the COVID-19/ vaccine debacle still have happened? 🤔,en
2022-12-30 17:53:20+00:00,3231590395,Covid-19 vaccine during pregnancy in Singapore https://t.co/CQYYoYXlRZ #covid19vaccineduringpregnancyinsingapore,en
2022-12-30 17:53:01+00:00,898764909630115840,North Korean vaccine needles for COVID-19,en
2022-12-30 17:52:32+00:00,418149466,"@Erik44187887 @WotsOnInfo @macleod_kendra @jdkstrick @DrAseemMalhotra Independent peer-reviewed re-evaluation of the actual trial data:“Pfizer and Moderna mRNA COVID-19 vaccines were associated with an excess risk of serious adverse events of special interest of 10.1 and 15.1 per 10,000 vaccinated over placebo baselines”https://t.co/gXTsSlvTFM",en
2022-12-30 17:52:31+00:00,738054095907360768,"Nico Martinez must be a Pfizer bot. the bot writes ""outlandish claims,Stockton's words are falling on deaf ears.  With the COVID-19 pandemic in the past now, fans just don't have time to listen to fake news and facts about the vaccine""Bill Gate owns MSNhttps://t.co/PqQjnGKERD",en
2022-12-30 17:52:03+00:00,1332347277441175554,@AneurinBevanUHB It appears others around the world are publicly acknowledging COVID-19 vaccine injuries are real and must be dealt with.  When will UK medical authorities do the same and admit what is obvious?https://t.co/MBh7Adx5a6,en
2022-12-30 17:50:42+00:00,1556349765541036033,"Russian Covid 19 ( not MNRA ) vaccine used in 70 countries, including China. Not approved by WHO or used in the West, not making people drop like flies.",en
2022-12-30 17:49:45+00:00,27313635,@DeeJaY_DarE Many of the people who oppose the mRNA vaccines for Covid-19 are Republicans.DeSantis has taken a much more skeptical view of the vaccines. This may give him some political advantages over Trump. Even Biden might campaign against Trump's vaccine rollout.,en
2022-12-30 17:49:17+00:00,1586396414338371584,@BlueSlots This was two years after the fake Covid 19 mRNA So-called vaccines were patented. Think about that.,en
2022-12-30 17:48:08+00:00,98875350,"""The risk of COVID-19 also varied by the number of COVID-19 vaccine doses previously received. The higher the number of vaccines previously received, the higher the risk of contracting COVID-19""https://t.co/dZi03QdhJR",en
2022-12-30 17:46:37+00:00,914622937,"@ABridgen Covid-19 is the disease SARS Covi-2 is the virus. The former is a bioweapon &amp; the vaccine is a delivery system of that bioweapon. Any distinction therefore is false.By the way, SARS Covi-2 comprises of 4 viruses not one.",en
2022-12-30 17:45:32+00:00,37716311,Behind the mask: COVID-19 leaves lasting impact on health-care workers - Lebanon Reporter-- News | The Perfect Enemy: https://t.co/79hqw2s4L7.#Employment #MentalHealth #Vaccines https://t.co/JEGa6O1lGA,en
2022-12-30 17:45:19+00:00,1556349765541036033,Sputnik V labelled ‘most efficient COVID-19 vaccine’ as China manufacturing deal announced https://t.co/A7aqRCiS6W,en
2022-12-30 17:45:08+00:00,709947536,Behind the mask: COVID-19 leaves lasting impact on health-care workers - Lebanon Reporter-- News | The Perfect Enemy: https://t.co/yWleDo6MIC.#Employment #MentalHealth #Vaccines https://t.co/WWtKnnXnZ3,en
2022-12-30 17:43:42+00:00,373746744,"The cruelty of just letting Covid-19 run rampant in a population of 1.4bn that had access only to mediocre vaccines if any is just unfathomable. If a government is that callous towards its own people, why would you trust it with anything else?",en
2022-12-30 17:43:23+00:00,1494658607346036743,"@debwired @Chillieman1 @cents5818 @POTUS There were many people that still got Covid-19 even after taking all 3 booster shots, so tell us, if someone that takes a vaccine it must makes you feel all warm and fuzzy inside. Plus there was no guarantee that the vaccine was going to work.",en
2022-12-30 17:41:01+00:00,1599629529122840577,@PeterHotez @Plasticdoe @WHO More numbers from our trusted friends at the WHO… the list of side-effects is massive. https://t.co/XpLAyQh0FY Search for ‘covid-19 vaccine’ https://t.co/4BDBm4nzAr,en
2022-12-30 17:40:33+00:00,66715765,".@PhilanderSmith and the @ADHPIO are partnering to provide free Covid-19 vaccines, booster shots and the flu vaccine. https://t.co/4j69rAS64X",en
2022-12-30 17:40:31+00:00,1028621202389180417,"@AllBiteNoBark88 My 82 year old mum's first vaccination was for Covid 19. She has never had a day sick in her life. We called her 'AnnDroid"" when I lived at home. Both mum &amp; dad stopped at 2 mRNA vaccines but not told me reason. I guess no one likes to hear 'i told you so'",en
2022-12-30 17:40:05+00:00,238784389,Wow! This is proof positive that the vaccine doesn't work against COVID-19 any longer! SO STOP GIVING IT!Pfizer and Moderna better get this clarified': Study finds worse antibodies after mRNA boosters | Just The News https://t.co/Cp03hEMvdM,en
2022-12-30 17:36:12+00:00,98651557,Valneva Reports Further Heterologous Booster Data for its Inactivated COVID-19 Vaccinehttps://t.co/fFGSZnfRtV https://t.co/T8rJybZ0ag,en
2022-12-30 17:35:33+00:00,808855336815919104,Will we see Poilievre’s Conservatives call for vaccine mandates and border restrictions for COVID-19 in 2023? I sure hope not.,en
2022-12-30 17:35:25+00:00,1117802764086779904,Valneva $VLA $VALN Reports Further Heterologous Booster Data for its inactivated COVID-19 vaccine https://t.co/mZ2Nrl4Lw4,en
2022-12-30 17:35:09+00:00,3318510966,Valneva Reports Further Heterologous Booster Data for its inactivated COVID-19 vaccine https://t.co/xSAGq7lyIM,en
2022-12-30 17:35:05+00:00,963495628545327104,$DVAX $VALN NEW ARTICLE : Valneva Reports Further Heterologous Booster Data for its inactivated COVID-19 vaccine https://t.co/zxTal4ZfRO Get all the latest $DVAX related news here : https://t.co/RqPKzE5n93 https://t.co/WspToMxx95,en
2022-12-30 17:35:04+00:00,407464670,• COVID-19 vaccines aren't gene therapy.• The EU isn't imposing a “personal carbon credit” system.• Hooters isn't shutting down.Here are the facts on false claims spreading on social media this week. https://t.co/kurkwrhZNR,en
2022-12-30 17:33:29+00:00,3140868280,"•Find COVID-19 Vaccines: https://t.co/F8F4Pv3Bcf•How, Where and When to Get Updated COVID Boosters: https://t.co/2D6wbGMDjr•What You Need To Know About Fall Booster Shots: https://t.co/DfVg5DgOXC•COVID-19’s Bivalent Boosters: 10 Questions, Answered: https://t.co/mjSG1DC2Si",en
2022-12-30 17:33:26+00:00,3140868280,A Bivalent Omicron-Containing Booster Vaccine Against COVID-19. Peer Reviewed. •https://t.co/tDcvjz79JU,en
2022-12-30 17:32:50+00:00,1346555108192972800,"@nathaliejacoby1 Yes, vaccines, including COVID-19, are safe",en
2022-12-30 17:32:44+00:00,896351423457185792,"https://t.co/0NC5kdAg0F =2day , My💎Mom's Heart ( Organ ) Specialistasked IF My💎Mom went for her &lt; Covid~19Vaccine  |  2nd_Booster 💉 Injection &gt; . ~ shesaid for My💎Mom's Case , &lt; Prevention 💛🙏💜is  ** Definitely_Better **  than Cure &gt;  ! https://t.co/6EQcnTdw5W",en
2022-12-30 17:32:09+00:00,1514599068667981827,"I had a Ischemic Stroke two months after my second Covid-19 vaccine, who else had a stroke?",en
2022-12-30 17:32:07+00:00,1069693680066420736,"$DVAX [15s. delayed]: Issued Press Release on December 30, 12:30:00: Valneva Reports Further Heterologous Booster Data for its inactivated COVID-19 vaccine https://t.co/DNdhSov4Kn",en
