date,userid,tweet,lang
2022-12-31 17:40:44+00:00,1593633629837484033,It is OBVIOUS the mrna Covid 19 gene therapy/vaccines are causing FAR MORE HARMthan other vaccines which were pulled off marketFor causing far less harmSuppressing facts even on behalf of the govtMAKES YOU COMPLICIT in these harms@YouTube @Google  https://t.co/Z2pKJSz15W,en
2022-12-31 17:40:26+00:00,17240190,"#mRNA gave us a breakthrough vaccine with which to fight Covid-19, but it has even greater potential to democratize access to innovative medicines.via @WIRED https://t.co/Cr2MXbBXmu",en
2022-12-31 17:39:41+00:00,1593633629837484033,It is OBVIOUS the mrna Covid 19 gene therapy/vaccines are causing FAR MORE HARMthan other vaccines which were pulled off marketFor causing far less harmYou are PAID FOR BY BIG PHARMANot reporting facts/promoting Lies make you complicit@MSNBC  https://t.co/Z2pKJSz15W,en
2022-12-31 17:38:58+00:00,1586723746487967747,"@genuke1 Jan 14, 2021 — Pope Francis and Pope Emeritus Benedict XVI receive their first doses of the Covid-19 vaccine in the Vatican.",en
2022-12-31 17:38:49+00:00,1593633629837484033,It is OBVIOUS the mrna Covid 19 gene therapy/vaccines are causing FAR MORE HARMthan other vaccines which were pulled off marketFor causing far less harmYou are PAID FOR BY BIG PHARMANot reporting facts/promoting Lies make you complicit@CNN @ABC  https://t.co/Z2pKJSz15W,en
2022-12-31 17:36:59+00:00,1550684882623414273,"Dr. Peter Hotez - You blocking a Covid-19 vaccine injured survivor after a simple invitation to a public conversation tells us all we need to know about how you would handle patients, public health &amp; safety, and those hurting.How long can you pretend they don't exist?",en
2022-12-31 17:36:40+00:00,1586723746487967747,"@SaraGerre Jan 14, 2021 — Pope Francis and Pope Emeritus Benedict XVI receive their first doses of the Covid-19 vaccine in the Vatican.",en
2022-12-31 17:36:29+00:00,39356894,"@RandPaul @missmew17171838 Yep, ""Risk of COVID-19 increased with time since the most recent prior COVID-19 episode and with the number of vaccine doses previously received.""",en
2022-12-31 17:35:40+00:00,759594998929043457,I hope 2023 brings1. The release of January 6 prisoners 2. The impeachment of Biden &amp; Harris3. A criminal trial for Fauci4. Federal mandate for COVID-19 vaccine is not followed by employers5. Food &amp; gas prices are lower like the Trump era6. NWO demons  get their karma https://t.co/dOIeBXd7GJ,en
2022-12-31 17:35:14+00:00,966404621299265536,"Dr. Kerryn Phelps, who said she and her wife suffered “devastating” COVID-19 vaccine injuries, slammed regulators for “censoring” public discussion and called for more research into vaccine adverse reactions. https://t.co/gtSrvewxT8",en
2022-12-31 17:34:56+00:00,1553096811589541889,"250 million COVID-19 cases in China three years later? Wait, so lockdowns &amp; masks don't actually help? Color me shocked. Next they'll be telling us the vaccines weren't safe and effective after all!https://t.co/c9mETmWxyA",en
2022-12-31 17:33:13+00:00,1520011189736124416,"The Democratic Party is now using ""science"" as a weapon to control the public (witness Covid 19 vaccine Hysteria, Climate Change Hysteria, etc.).",en
2022-12-31 17:33:03+00:00,817478777299050496,"@jenniferzeng97 It is censored because everyone says that it is the food of the people from far below. The powerful feed on the best. This is what happens in Mexico with AMLO's communism, there are no medicines or vaccines for covid 19.",en
2022-12-31 17:33:02+00:00,2302563486,"@CascadiaEric @jimmy_dore You are in a cult and this comment reinforces that. You don’t need a study to say “this experimental vaccine shouldn’t be forced on people, due to possible LONG TERM side effects” tell me, what study have the “scientists” done to tell us the long term effects? Covid-19. It’s 2022",en
2022-12-31 17:32:51+00:00,18629078,"@sue_beachcover @Fox_Claire I don’t know if you’ve noticed, but 99.9999 percent of medics think that the infinitesimally small risk of vaccine injury are outweighed by the considerable advantages of the Covid-19 vaccination.",en
2022-12-31 17:32:18+00:00,953694256002027520,"Covid-19 Vaccine Pharmacovigilance Reporthttps://t.co/bUNZbsc88TMore Than 1,000 Peer Reviewed Articles On COVID Vaccine Injurieshttps://t.co/BhqYbyEMqqCOVID-19 Vaccination Stories, Side Effects &amp; Healinghttps://t.co/bfJwe9rIn3",en
2022-12-31 17:31:35+00:00,626391901,New law ends COVID-19 vaccine mandate for US troops | AP News https://t.co/HYU19cQK9L via @rcooley123,en
2022-12-31 17:30:11+00:00,14777730,"One Public Health Lesson From 2022 Worth Remembering: “For us, by us” public health responses quashed mpox, improved Covid-19 vaccine equity, &amp; more (V) https://t.co/HgAxPwxZXm",en
2022-12-31 17:28:51+00:00,1593633629837484033,Time to push back and demand they are pulled from the marketIt is VERY clear that the harm is greater than the benefit for the Covid 19 gene therapy vaccineOther vaccines have been pulled for far less damageDemand the vaccine is pulledor intentional harm is made clear.,en
2022-12-31 17:27:09+00:00,1061521201737023489,"@malissa_bearden @ProudElephantUS And, you're a nurse? So, you're cool with all thr pills and IV drugs administered every day in a hospital, but the Covid-19 vaccine is killing people  ... uh, huh.",en
2022-12-31 17:27:01+00:00,1593289460636155904,"@J03YKHAY02 @zoeharcombe These pics = are from Health Canada and PHAC site... Their, = Govt. of Canada, Stats. on Adverse Events / Effects = caused by the Covid-19 ""Vaccines &amp; Boosters""... Oh, but wait, = the ""Government"" was keeping Canadians up-to-date/ informed, = on the ""Safety""... THEY ""ALL"" KNEW!! https://t.co/tKqSt0Bu01",en
2022-12-31 17:26:17+00:00,1654778071,""" The risk of #COVID-19 also varied by the number of COVID-19 vaccine doses previously received. The higher the number of vaccines previously received, the higher the risk of contracting COVID-19""  https://t.co/dIRiiMvQTi",en
2022-12-31 17:26:08+00:00,1598842830218317826,"@BustersMom7 @SusanBerube8 @laralogan The Covid-19 “vaccine” is not by definition one… such polio, mumps, measles, rubella, etc.Just as the flu “vaccine” is not one either.  Covid-19 is a “weaponized” variant of the common cold virus known as Corona Virus.   The “cure” has proven to be worse so far than the virus.",en
2022-12-31 17:23:55+00:00,1453415887604756492,"@muskQu0tes @elonmusk Axiomatic? Yes, with same elements of life, one can build a pub, school or church. Covid 19. People needs vaccines, foods, peace, security, space, clean air…etc. Problem would be to organise for actions not just for 1 Bn (1900): 100 needs, but for 10 bns(2050): 1000 needs. How?",en
2022-12-31 17:22:26+00:00,1589325455856848896,"@adriandix @VCHhealthcare @mableelmore @GeorgeChowBC Stop trying to send people to slaughter, creep. True science is proving that the COVID-19 vaccine is causing a plethora of health issues that lead to death.",en
2022-12-31 17:21:45+00:00,1596177426878431233,Biden let in 5 million plus illegal immigrants with no COVID-19 vaccines and in many cases..no vaccines for MMR. Tuberculosis. Polio..TDAP.ect. but mandated all Americans for COVID-19 vaccine to keep their jobs/businesses now we have a measles outbreak,en
2022-12-31 17:18:20+00:00,766426284700364800,"@RC123TC Aaron Russo final interview with Alex Jones where he speaks of how the Rockefeller’s want everyone chipped! https://t.co/MKdCyvkKkT Rockefeller Foundation funding Covid 19 testing, tracing and “vaccines!” https://t.co/G6bqJxvR23",en
2022-12-31 17:18:20+00:00,954034659746304000,"@IraIrleague @kacdnp91 2/ ""More than 1.3 million individuals who received a dose of the mRNA COVID-19 vaccine were identified, with a mean age of 55.1 years. More than half (57%) were women; 14% were Black, 65% were White, 11% were Hispanic or Latino, and 6% were Asian. The investigators calculated...",en
2022-12-31 17:17:41+00:00,425060684,Oh. Serious adverse events at rate of 1:800. Must be one of worst vaccines in history.Its why the won't  release the data. Serious adverse events of special interest following mRNA COVID-19 vaccination in randomized trials in adults https://t.co/JiVRb7CMG2,en
2022-12-31 17:17:35+00:00,262983790,"@MKingdefren @NotOfThisGalaxy @ksorbs This is the first line of the report ... ""Little is known about COVID-19 vaccine effectiveness (VE) during the Omicron variant BA.2/BA.2.12.2–predominant period or VE of a fourth COVID-19 vaccine dose in persons aged ≥50 years.""",en
2022-12-31 17:16:53+00:00,1593633629837484033,It is obvious that the mrna Covid 19gene therapy/vaccines are causing FAR MORE HARMthan other vaccines which were pulled off marketFor causing far less harmSO EITHER YOU STOP THEMOR YOU SIGNAL YOU INTEND TO HARM THE PUBLIC@SpeakerPelosi @GOPLeader https://t.co/Z2pKJSz15W,en
2022-12-31 17:16:27+00:00,1082964799510720513,"@JjinUk64 @Bellepuza @AllisonPearson More embarrassing is not reading the link you post to support your argument. Direct quote:""These findings support continued use of recommended mRNA COVID-19 vaccines among all eligible persons aged ≥5 years.""Please stop embarrassing yourself. 🤣🤣🤣",en
2022-12-31 17:16:00+00:00,118717877,"I've been reading Tweets from the COVID-19 unvaccinated against the COVID-19 vaccinated.The animosity was caused by politics. There should never be a mandate to take an unproven injection, whether or not it is a vaccine.The mandate caused unnecessary hatred between good folk.",en
2022-12-31 17:15:33+00:00,131706937,@sosotakei @ped_allergy COVID-19 vaccines: studies for approvalhttps://t.co/fmV6KtoXEP,en
2022-12-31 17:15:33+00:00,239950631,"Parliamentarians in Australia &amp; UK, eminent British cardiologist Dr Aseem Malhotra and now respected Dr John Campbell calling for halt to mass Covid-19 “vaccine” rollout until independent studies on risk-benefit analysis is done for peer review. Why the silence @PierrePoilievre ?",en
2022-12-31 17:15:00+00:00,14286806,"In a remote area of #Cameroon, @IMC_Worldwide is helping provide health &amp; nutrition services.Their recently donated solar refrigerator will be used to store COVID-19 vaccines &amp; cold packs.https://t.co/rwFQc2nDYV",en
2022-12-31 17:13:39+00:00,1229455229374156801,"@Middleofitall2 @Dawn0fTyme @AnnieRo39645825 @wintermom6723 @ProudElephantUS These findings corroborate a causative role of the gene-based COVID-19 vaccines, and this diagnostic approach is relevant to potentially vaccine-induced damage to other organs as well.”",en
2022-12-31 17:11:21+00:00,888095198642876425,"@CDCDirector Nonsense, the director of the CDC says If you get the vaccine you're immune and can't transmit COVID-19, do keep up with the science",en
2022-12-31 17:11:06+00:00,34052834,Check out this week's COVID vaccination progress!Start your New Year safe and protected against COVID-19 by getting vaccinated/boosted! Find out where you can get a vaccine/booster: https://t.co/HME8bP1YAZ https://t.co/7ofX1Np7JS,en
2022-12-31 17:11:05+00:00,935892215406227456,"“Experimental mRNA COVID-19 vaccines are not safe, they do not stop transmission, disease or death; long-term side effects are not known. This single stranded RNA virus is always going to evolve faster than we can inject new variations of this jab into peoples’ arms.“ Dr. Malone",en
2022-12-31 17:10:23+00:00,1519336116427452422,"@FLVoiceNews As per the CDC ""VAERS received 18,007 preliminary reports of death from Covid 19 Vaccine"" so far, more each day...Big Phamra pays for Floridas Voice is that correct? https://t.co/5ypLhvGmBK",en
2022-12-31 17:09:37+00:00,38234122,Batch release assessment of COVID-19 vaccines https://t.co/Y8ZfeCQgc5,en
2022-12-31 17:08:05+00:00,1585906919994429441,"Raj et al.: ""COVID-19 Vaccine-Associated Subclinical Axillary Lymphadenopathy on Screening Mammogram""; Vaccine Induced Axillary (swollen lymph nodes) Lymphadenopathy in women taking mRNA COVID jab https://t.co/wefUEPEYlj",en
2022-12-31 17:07:37+00:00,1258674936341827586,"1.All our lives, we fought successfully against dictatorship, extremism, terrorism, COVID-19 without vaccines and oxygen, the high cost of life, the shortage of basic products///",en
2022-12-31 17:06:38+00:00,1468649663339368448,"As more people become aware of the massive number of adverse reactions that come from the Covid-19 “vaccines,” the powers-that-be tend to claim they are just now coming around to the conclusions that many of us have known for two years.",en
2022-12-31 17:06:20+00:00,1060573081935249409,Can a third dose of #Pfizer and Moderna #vaccines actually worsen immune response against COVID-19? A peer-reviewed study published in Science Immunology last week is causing concern.https://t.co/P4t92P8ZWN,en
2022-12-31 17:06:11+00:00,111442299,"Everyone talking about how vaccines cause blood clots (maybe they do) should also know that Covid-19 causes blood clots. It seems that this is never mentioned. A lot of the people who die of Covid die of blood clots, I think. Getting the vaccine might prevent that.",en
2022-12-31 17:05:57+00:00,1058507864698843136,"Having been a participant in the Pfizer COVID-19 vaccine initial trials, this news is disappointing.Variants are inevitable but this news sux! 😖",en
2022-12-31 17:05:11+00:00,92366218,"Find your vaccination records online: COVID, flu shots, and more - See https://t.co/gOiiiOW8dx for more info #vaccine #vaccinationrecords #flushot #immunization #covid #covid19 #covid-19 #windows #mac #macintosh #iphone #ipad #android #computer #laptop #desktop #technology",en
2022-12-31 17:03:23+00:00,2371071333,@RishiSunak My hope for 2023 is you look properly at all the families affected by the Covid 19 vaccines. The Vaccine Damage Payment Scheme is not fit for purpose! @RishiSunak @SteveBarclay @BBCNews @BBCFergusWalsh @samueljlovett @VIBUK1 https://t.co/MSkqrIZS2r,en
2022-12-31 17:01:51+00:00,26548941,"Start off the new year with the best protection against Covid-19 &amp; get your booster.  The Covid vaccine wears off over time so if you’re eligible for a booster, top up your protection by getting vaxxed now. Find out more at: https://t.co/VH6e95h6pR #GetVaxxedStayOnTrack https://t.co/ILrlqSc9MG",en
2022-12-31 17:01:50+00:00,140077855,The effects of flu and Covid-19 can be more serious if you have a health condition like heart disease or diabetes.The free flu vaccine and Covid-19 booster can boost your immunity this winter.Find out more 👉 https://t.co/tQyvi3mnWw https://t.co/D37QIbevx4,en
2022-12-31 17:01:50+00:00,123574840,The effects of flu and Covid-19 can be more serious if you have a health condition like heart disease or diabetes.The free flu vaccine and Covid-19 booster can boost your immunity this winter.Find out more 👉 https://t.co/3s0uWpnxL6 https://t.co/xthO3PNSF1,en
2022-12-31 17:01:50+00:00,125595021,The effects of flu and Covid-19 can be more serious if you have a health condition like heart disease or diabetes.The free flu vaccine and Covid-19 booster can boost your immunity this winter.Find out more 👉 https://t.co/dWpv7phl5C https://t.co/eKzeN8EKNa,en
2022-12-31 17:01:50+00:00,562087684,The effects of flu and Covid-19 can be more serious if you have a health condition like heart disease or diabetes.The free flu vaccine and Covid-19 booster can boost your immunity this winter.Find out more 👉 https://t.co/0diHpa3ypU https://t.co/QEk0pZiOZV,en
2022-12-31 17:01:48+00:00,318065652,"COVID-19 VACCINES: The vaccines are one of our most powerful tools against COVID-19. Getting vaccinated is safe, free, and saves lives. Let’s get vaccinated and boosted together! Visit PHS Vaccination Clinics for your COVID-19 vaccines and boosters. https://t.co/LHrrscPK6s",en
2022-12-31 17:01:38+00:00,1447411372933931008,"So, Poilievre is open to the idea of COVID-19 vaccine mandates, after tabling legislation only months ago to ban vaccine mandates. And, given China don't do mRNA, he would be mandating a Chinese vaccine to travel into Canada. What the fuck is wrong with Pierre?",en
2022-12-31 17:00:42+00:00,52351492,The effects of flu and Covid-19 can be more serious if you have a health condition like heart disease or diabetes.The free flu vaccine and Covid-19 booster can boost your immunity this winter.Find out more 👉 https://t.co/GMaKa7lPrb https://t.co/yfcSBAgn6s,en
2022-12-31 17:00:41+00:00,562152771,The effects of flu and Covid-19 can be more serious if you have a health condition like heart disease or diabetes.The free flu vaccine and Covid-19 booster can boost your immunity this winter.Find out more 👉 https://t.co/TZOsTKCzLS https://t.co/gjcapSubbX,en
2022-12-31 17:00:41+00:00,562067020,The effects of flu and Covid-19 can be more serious if you have a health condition like heart disease or diabetes.The free flu vaccine and Covid-19 booster can boost your immunity this winter.Find out more 👉 https://t.co/rfVt5HuL6v https://t.co/LyUojoaHzQ,en
2022-12-31 17:00:26+00:00,1316150226445623302,"@robataki @jacdoolittle @REAL_GBW @mxvet89 @nytimes Wake up clown!Donald Trump, Melania got COVID-19 vaccine in secret before leaving officehttps://t.co/OBXZd0zO0Mhttps://t.co/3wEZGoQMFi",en
2022-12-31 16:57:10+00:00,131706937,@sosotakei @ped_allergy Safety of COVID-19 Vaccineshttps://t.co/U7uCvOfaEe,en
2022-12-31 16:56:25+00:00,923117164181176320,"@KimBate46378806 @BookerSparticus @KimM31856358 Nearly 5,500,000,000 individuals in the world has taken a dose of COVID-19 vaccines…In the U.S., alone, as of today, nine (9 👈🏽) deaths has occurred confirmed to be directly related to J&amp;J viral vector vaccine… ZERO (0 👈🏽) confirmed deaths remotely related to mRNA vaccine.",en
2022-12-31 16:55:03+00:00,131706937,@sosotakei @ped_allergy Safety and Efficacy of the BNT162b2 mRNA Covid-19 Vaccinehttps://t.co/Iir1MvRQpU,en
2022-12-31 16:53:33+00:00,131706937,@sosotakei @ped_allergy Statement for healthcare professionals: How COVID-19 vaccines are regulated for safety and effectivenesshttps://t.co/jwxunEmncY,en
2022-12-31 16:51:02+00:00,1542511474320343046,"@MP38041398 @adfurrer79 Unless the Bhakti and Burkhardt just proved that Tyler Sanders died from the COVID-19 vaccine, you just struck out again, by sharing an IRRELEVANT post because you are STILL unable to prove anything wrong in my article. https://t.co/ISsMBsOq3R",en
2022-12-31 16:50:38+00:00,923117164181176320,"@KimBate46378806 @BookerSparticus @KimM31856358 It’s like the fringe doctors out there who scour around for a handful of a tiny sub-fraction of people who have ‘genuinely experienced’ an occurrence of adverse drug reaction to COVID-19 vaccines, and exploiting their misfortunes — going on as if those people are in a majority. https://t.co/KCsfvQyOHp",en
2022-12-31 16:47:49+00:00,1419141124451561474,"@Isucceed @CDCDirector A hypnotist should just get vaccinated. #hypnotist #vaccines #Covid #CovidIsntOver #Covid_19. While you are at it, get them #fluvaccine too. I can’t have my kids &amp; my Elderly &amp; cancer patients and immunosuppressed catch #flu #covid from yo Sorry A$$ @Marcinmusz1",en
2022-12-31 16:47:21+00:00,1443993685209673729,"Just 5.5% of Americans aged 18 to 24 have received the bivalent COVID-19 booster, according to data from the CDC, while 66% of the same age group received the initial COVID-19 vaccinehttps://t.co/NepFOcxk9T",en
2022-12-31 16:47:03+00:00,1078709956290011137,@10News How many boosters of the deadly COVID 19 vaccine did she get?,en
2022-12-31 16:46:20+00:00,1568593929536249856,@jonathanstea I love how the pro-vaxxers are losing the COVID-19 debate so they're overreaching to all vaccines. Most of us don't have opinions on all vaccines but we were right about the COVID-19 vaccines.,en
2022-12-31 16:45:58+00:00,1261446439,"Cleveland Clinic study...""Given the risk for COVID-19 increases with the number of vaccine doses previously received, the whole premise of the current COVID-19 vaccination scheme must be reconsidered.""Mhttps://t.co/GzDJ7DbGWh",en
2022-12-31 16:44:21+00:00,1537537270487687177,"@sov_scot @Michell87463246 @JiminyJelikers_ My point is that covid the virus alone has a very high survival rate. That is fact. The Covid-19 vaccines have many side effects, I follow numerous C-19 vaccine injured on Twitter. Their jobs made them do this, just to let them go since they can’t perform their jobs anymore.",en
2022-12-31 16:44:20+00:00,1506748670447951881,"@koko38416488 @Kanthan2030 Wowy this vaccine is different“mRNA vaccines were associated with strong protection against hospital admissions with covid-19 due to the alpha, delta, and omicron variants. Vaccination reduced risk of covid-19 progressing to critical illness or death.”https://t.co/PRUxOnnyR6",en
2022-12-31 16:44:11+00:00,1487831400753635331,@dasfactjack @kazadorI @BigDaddyJinx @GenericJes @DrAseemMalhotra @DineshDSouza @Silje_Schevig Our study is the first in vitro study on the effect of COVID-19 mRNA vaccine BNT162b2 on human liver cell line. We present evidence on fast entry of BNT162b2 into the cells and subsequent intracellular reverse transcription of BNT162b2 mRNA into DNA.https://t.co/qzkPQMdYjm,en
2022-12-31 16:42:16+00:00,1459168367185702913,"@redheadlass1402 @DrAseemMalhotra And that's why you should pay attention to the possibility's,, it's factual that these possibilities are happening to the vaccinated especially among young men,, also more people have died from COVID-19 after vaccination than those who never got the vaccine,,",en
2022-12-31 16:41:55+00:00,1214173214382817283,Top Japanese Physician-Scientist Gives Dire Warning About COVID-19 mRNA Vaccines: ‘Scientifically Misconceived’ https://t.co/2HKzdgABaO,en
2022-12-31 16:37:56+00:00,1537533012,@CDCDirector So you FINALLY admit that the vaccines DO NOT PREVENT INFECTION. NOW FOR THE IDIOTS IN THE BACK AT THE @HealthNYGov @NYCHealthCommr READ HER LIPS: “WE CANNOT STOP THE SPREAD OF COVID 19.” Stop peddling ineffective boosters to enrich yourselves &amp; the pharma cabal.,en
2022-12-31 16:37:30+00:00,196233238,"""mRNA gave us a breakthrough vaccine with which to fight Covid-19, but it has even greater potential to democratize access to innovative medicines."" via @WiredUK https://t.co/1O2Ge1ydXD https://t.co/C1UhGHL7qg",en
2022-12-31 16:36:58+00:00,1700233818,"@DrAseemMalhotra ""More serious or long-lasting side effects to COVID-19 vaccines are extremely rare. ... Vaccines are continually monitored to detect and respond to rare adverse events."" https://t.co/X5yhyfU1Ht",en
2022-12-31 16:36:57+00:00,1595362799290662912,"@trimjim2007 @ztkelly @DrAseemMalhotra Even the CDC have acknowledged the link between the EUA products and cardiac damage, they now have a 'myocarditis and perdicarditis considerations' tab added under their vaccines/Covid-19 pages, *and* they published a summary paper on it.But this lady knows better I suppose.",en
2022-12-31 16:36:01+00:00,1405914053294407687,"https://t.co/RbkBeNLzIC""6 Congressionally-authorized statutory frameworks that authorized a coordinated US Government attack on the American people, using noncompliant biological material (bioagents) distributed across state borders labelled as Covid-19 vaccines.""",en
2022-12-31 16:35:44+00:00,36638077,"When the public loses confidence in public health, this is what happensYears of lies by public health “experts” over Covid-19 is causing hesitancy in childhood vaccinesThese outbreaks were unthinkable a decade ago...and measles actually kills childrenhttps://t.co/lrirQeBqHl",en
2022-12-31 16:35:04+00:00,1483759964585967620,"“The purchase of 4.5 billion doses of the covid-19 vaccine for 450 million EU citizens 🇪🇺 is the biggest CORRUPTION SCANDAL in human history.”10 doses per person. Whatever about the financial aspect, this was before  variants were even a thing. How did she know?",en
2022-12-31 16:34:55+00:00,1031564851821404160,"@CMO_England How do you sleep at night? Your covid-19 pandemic measures &amp; insanely misplaced (profit-driven) support of Covid vaccines killed people in their thousands. Lockdowns killed people &amp; stripped others of dignity &amp; livelihoods. You should be behind bars, &amp; one day you will be.",en
2022-12-31 16:33:47+00:00,1537537270487687177,"@sov_scot @Michell87463246 @JiminyJelikers_ Then you don’t live in WA State, NY, CA, or OR. Consider yourself lucky because millions of people in many states were coerced into taking the Covid-19 vaccine or they were fired.",en
2022-12-31 16:33:34+00:00,2826106440,Pfizer’s COVID-19 Vaccine Linked to Blood Clotting: FDA ⁦@RonDeSantisFL⁩ You don’t need your own study. https://t.co/bIdHS17yWE,en
2022-12-31 16:32:48+00:00,1245769441914294278,..2/2...be more vulnerable to afford treatment of the vaccines after effects so they can make more money out of them with supplements under NHI.As we speak DOH has EMERGENTLY Formalized permanent positions of the current Covid-19 Medical Staff knowingly of their evil plan.,en
2022-12-31 16:32:47+00:00,1253031362577100805,When I volunteered with Sean Penn’s company (Core) and deliver COVID-19 testing and vaccines to Los Angeles. #Core #Covid #billygriffin https://t.co/jzBKZ5OCqv,en
2022-12-31 16:32:13+00:00,1608075997655760896,"Getting a COVID-19 vaccine is a safer, more reliable way to build protection than getting sick with COVID-19.#health #covid_19 #covid #vaccination https://t.co/fYaOaLNjPc",en
2022-12-31 16:31:40+00:00,1523811229575393280,"1.7 Million Americans Disabled After COVID-19 Jab Rollout, Says Edward Dowd https://t.co/ybUITvm4aF #coverup #covid #Vaccine",en
2022-12-31 16:31:16+00:00,953395932929908737,"With a lot of preclinical testing, from 2013 on humans, the founding of 2 companies (Moderna, BioNtech) and a lot of investment, the final product of 2 mRNA vaccines against COVID-19 is now in use; with great promise for the future. A virus-free vaccine that works like a virus.",en
