date,userid,tweet,lang
2022-05-06 17:39:44+00:00,16812696,"Today is #NursesDay (the first day of #NursesWeek). Shout out to our nursing staff! Between staffing our COVID-19 vaccine clinics, working in our COVID-19 call center, or working in our Disease Prevention Clinic, they're helping our community stay safe and healthy! https://t.co/62sluH3T2Z",en
2022-05-06 17:39:39+00:00,40061315,"New data shows COVID-19 hospitalizations and deaths are on track to rise for the first time in months, and the FDA is encouraging Americans to get either the Moderna or Pfizer vaccines over the Johnson &amp; Johnson shot. https://t.co/LlulfOiUf8",en
2022-05-06 17:38:22+00:00,209906181,"@leftychris3 @LogicalKnot @FraiseAdam Since Phase4 is commonly referred to as 'the post-marketing phase', and the second sentence of the FDA News Release includes the phrase:""The vaccine has been known as the Pfizer-BioNTech COVID-19 Vaccine, and will now be marketed as Comirnaty...""",en
2022-05-06 17:37:59+00:00,280526716,"@jonfitztv @still138bu @MermanKris You should read it. And this one too. Search, ""Journal of Hepatology published a letter titled, “The mRNA COVID-19 vaccine – A rare trigger of autoimmune hepatitis?”""",en
2022-05-06 17:37:34+00:00,1422668272885977088,COVID-19 News: FDA Restricts Use Of Johnson &amp; Johnson Vaccine To Adults Over Blood-clot Concerns https://t.co/lE7RNmMpwD,en
2022-05-06 17:37:27+00:00,3594901,"@mp3michael not since this? ""January 24, 2022 — Pfizer Inc. and BioNTech SE today announced the publication of new results from two laboratory studies demonstrating that three doses of the Pfizer-BioNTech COVID-19 Vaccine (BNT162b2) elicited antibodies that neutralize the Omicron variant.""",en
2022-05-06 17:37:01+00:00,1207757490764599296,The #FDA has decided to limit the use of the #COVID19Vaccine to individuals at least 18 years old who cannot receive other authorized or approved COVID-19 vaccines. COVID-19 vaccine.”MORE HERE: https://t.co/3J9Vct5FSy#Thrombosis #ThrombocytopeniaSyndrom,en
2022-05-06 17:36:26+00:00,2468505655,"43,898 Dead 4,190,493 Injured Following COVID-19 Vaccines in European Database of Adverse Reactions https://t.co/HG89jh2J3d",en
2022-05-06 17:36:21+00:00,1488270640926937104,"Let me tell you what happened to my students: one young man at this 38 caught Covid twice and his family , wife, twin daughters and his parents all caught Covid-19. All adults got fully vaccine. Another student suffering with a bad cold while her man was Covid, all got 2 shots.",en
2022-05-06 17:36:15+00:00,62525794,@eliehonig These people commenting don't seem to understand mutations. The vaccines were designed for the original Covid-19  and the Delta Variant. They only had about 60% effectiveness with Omicron and the Omicron Variant. That leaves 40% that's  open season. Glad you are better.,en
2022-05-06 17:36:10+00:00,1066482170481598464,FDA Limits J&amp;J's COVID-19 Vaccine Over Blood Clot RiskAfter 'taking another look at the data...' Durden,en
2022-05-06 17:36:06+00:00,1167849256344010754,"NBA’s Kyrie Irving refers himself as a ‘martyr’ discussing COVID-19 vaccine holdout, Stephen A. Smith retorts - ScoonTv https://t.co/dxqkAOhIBv",en
2022-05-06 17:36:02+00:00,415773218,"Hey #Durham, keep taking steps to protect yourself and your family.#COVID19 is still in our community.Get your COVID-19 vaccine when eligible, including 5-11 vaccine for kids. 💉 📅 Check out our calendar for locations, dates &amp; times of clinics: https://t.co/ZRqbU7HTIb https://t.co/mT8ErS3dKb",en
2022-05-06 17:35:59+00:00,2201979738,"A little while back we wrote this review in @OFIDJournal about COVID-19 vaccines and SARS-CoV-2 transmission - our main message is that we need more research funding to study this topic, especially in the US. https://t.co/EvZl4nbWZF",en
2022-05-06 17:35:58+00:00,1386524676021637121,Sen. Ron Johnson (R-WI) told an anti-vaccine activist in an interview that it “may be true” that the COVID-19 vaccines are giving people AIDShttps://t.co/CVIvaoLkY6,en
2022-05-06 17:35:45+00:00,1506009012,"With global acceptance of the COVID-19 vaccine COMIRNATY®, which uses our lipid nanoparticle delivery system, we are turning our attention to developing therapeutics to address other diseases such as cancer, malaria and HIV/AIDS. https://t.co/8XOYiwsNww #acuitastherapeutics",en
2022-05-06 17:34:48+00:00,1420718664538464259,Do people forget son easy. Covid 19 has the same genetics as hiv  by 2025 most vaccinated will be dead yes bill gates was a part of this population control.they knew what they were doing that's why laws were passed to no accountability with vaccines,en
2022-05-06 17:34:38+00:00,11650762,.@DeptofDefense continues to discharge U.S. military personnel as a result of their COVID-19 vaccine status. These brave men and women are potentially being stripped of various benefits that have been promised. It is unacceptable.https://t.co/pPTKsArCku,en
2022-05-06 17:34:37+00:00,1893014606,NH Covid-19 vaccine sites for Children! https://t.co/U9LKnm6L7N,en
2022-05-06 17:34:12+00:00,729974047941885952,FDA limits use of Johnson &amp; Johnson COVID-19 vaccine https://t.co/kU3Tw8Dfxs https://t.co/rEOicKKTbF,en
2022-05-06 17:33:56+00:00,3897863434,A reduction of around 50% in antibody response when receiving a vaccination after a few days of poor sleep – which has implications for annual flu vaccines and COVID-19.,en
2022-05-06 17:33:54+00:00,1239976081630904320,"On May 5, 2022, the U.S. Food and Drug Administration (FDA) said it was limiting the use of Johnson &amp; Johnson’s Covid-19 vaccine for adults due to the risk of a rare blood clotting syndrome.Are you sure you still want that booster shot?",en
2022-05-06 17:32:49+00:00,1242082182748872705,FDA restricts use of Johnson &amp; Johnson COVID-19 vaccineMore medical news at https://t.co/pvWdUgzL00#Epidemiology #MedTwitter #MedEd #MedNewshttps://t.co/tnQaRVbke6,en
2022-05-06 17:32:17+00:00,1369140194482458625,Florida bars shut down as new COVID-19 cases explode vaccine company stocks.  https://t.co/UOgGjXJG01 via @YouTube #USA,en
2022-05-06 17:32:00+00:00,35764366,"You can get your COVID-19 vaccines at any stage of your pregnancy.So, if you haven’t already, the right time is now.Find out more at: https://t.co/3ooyKtX9cs #KeepEnfieldSafe https://t.co/rdcNZFvreN",en
2022-05-06 17:31:04+00:00,1749902564,FDA Limits Use of J&amp;J's COVID-19 Vaccine Due to Blood Clot Risk | https://t.co/komshRAtcR https://t.co/GcIZ48rjM9 via @Newsmax,en
2022-05-06 17:30:56+00:00,2271981373,Families File Amended Federal Suit Claiming Schools' COVID-19 Vaccine Requirement Violates 1st Amendment Texas LawyerMarianna Wharryhttps://images.law.com/contrib/content/uploads/sites/292/2022/05/Vaccination_2-767x633.jpgCOVID-19/Litigation/Education/CO… https://t.co/WtqXcQpnmk,en
2022-05-06 17:30:56+00:00,573609641,There needs to be an honest discussion regarding these ‘so called’ vaccine for Covid-19. Many families lost loved ones and many more injured.,en
2022-05-06 17:30:41+00:00,115537472,"Why did you get your COVID-19 vaccine? 💉 L.A. Care employees share what they looked forward to after receiving a #COVID19 vaccine. Today, we feature Brighton! Getting the vaccine is a powerful step in taking charge of your health. Protect yourself and your community! 💪 https://t.co/fuFJCUvLOA",en
2022-05-06 17:30:34+00:00,1508857388786458625,The Food and Drug Administration (FDA) on Thursday strictly limited who can receive Johnson &amp; Johnson's Covid-19 vaccine due to a rare but serious risk of blood clots. ...  #AssociatedPress #BloodClot #covid #Johnson&amp;ampJohnsonhttps://t.co/OYzJmDvGf3 https://t.co/QvA0hC4dic,en
2022-05-06 17:30:30+00:00,933870232879239168,"At Tonix, History Underpins a Modern Approach to COVID-19 Vaccines “At least in their current forms, mRNA vaccines have proven unable to evoke durable protective responses that most experts believe are the province of T cells, not antibodies.” $TNXP https://t.co/kCostNOnXa",en
2022-05-06 17:30:15+00:00,9601512,"The chance of dying after receiving the Janssen vaccine is about 1:2,000,000. But with multiple COVID-19 vaccines available, the FDA is limiting the use of the J&amp;J vaccine. https://t.co/v1DvupT5i3",en
2022-05-06 17:30:13+00:00,19650345,The U.S. Food and Drug Administration is limiting the use of Johnson and Johnson's Janssen COVID-19 vaccine as a last resort for adults who cannot accept a shot from another manufacturer.   https://t.co/um5EX7USU4,en
2022-05-06 17:30:13+00:00,236770150,FDA limits use of Johnson &amp;amp; Johnson COVID-19 vaccine over blood clot risk https://t.co/0ZLYLmQvH8 #Health https://t.co/eQQT882AOQ #news 650,en
2022-05-06 17:30:00+00:00,115086951,FDA dramatically narrows use of Johnson &amp; Johnson Covid-19 vaccine https://t.co/rZI3E7fgOh via @Politico,en
2022-05-06 17:29:43+00:00,1270217997190340610,FDA restricts use of Johnson &amp; Johnson COVID-19 vaccineMore medical news at https://t.co/JzvQpliO09#Peds #Pediatrics #MedTwitter #MedEd #MedNewshttps://t.co/CAKJ8XYJCP,en
2022-05-06 17:28:40+00:00,2468505655,"STOP THIS NOW..FOR FUK SAKES43,898 Dead 4,190,493 Injured Following COVID-19 Vaccines in European Database of Adverse Reactions https://t.co/HG89jh2J3d",en
2022-05-06 17:28:40+00:00,232668523,"I got the vaccine against COVID-19. Afterwards, I stayed all day long at the beach! 🏝️🍾",en
2022-05-06 17:28:29+00:00,357739924,Well isn’t this special. Remove Vaccine Mandates NOW!!!Fully Vaccinated Carnival Cruise Ship Hit With COVID-19 Outbreakhttps://t.co/2zc3RQzDjI,en
2022-05-06 17:28:12+00:00,853429465,FDA puts strict limits on this Covid-19 vaccine https://t.co/YorCrYpHNC,en
2022-05-06 17:28:03+00:00,1489064201872101376,"@CarlNicholls6 @ilaughhard2 @PattyCa18904386 @APFactCheck A group of scientists and medical researchers sued the FDA under FOIA to force release of hundreds of thousands of documents related to licensing of the Pfizer-BioNTech Covid-19 vaccine. That's why #pfizer released them now, not in 75 years",en
2022-05-06 17:27:38+00:00,1596829382,Obesity may reduce effectiveness of COVID-19 vaccines https://t.co/EW0IrZ00vf https://t.co/DlmuoQLTuU,en
2022-05-06 17:27:35+00:00,55060090,Obesity may reduce effectiveness of COVID-19 vaccines https://t.co/2IzQo9tZtr,en
2022-05-06 17:27:23+00:00,473198697,"2 all who called us murderers, should b fined, jailed, taxed. ALL I WANTED WAS INFO!- FDA restricts J&amp;J COVID-19 vaccine due 2 blood clot risk + #phizerdumphttps://t.co/cEShnDDbs7",en
2022-05-06 17:27:16+00:00,357739924,Thank you Georgia for the support of freedom and common sense.Georgia Governor Signs Bill Barring COVID-19 Vaccine ‘Passports’https://t.co/StWMND9V15,en
2022-05-06 17:26:47+00:00,1232012278578307075,We need to share the vaccines obviously China's too proud to buy the vaccine from us Maybe we can give it to themGlobal Death Toll from COVID-19 Tops 15 Million as Vaccine Inequity Continues to Prolong Pandemic https://t.co/ndN9Q7VTMH via @democracynow,en
2022-05-06 17:24:36+00:00,87204299,The TGA in Australia has published its weekly Covid-19 vaccine safety report (such as it is!) Data to May 1. https://t.co/Ps7mObPYoL,en
2022-05-06 17:23:51+00:00,1258121167656927233,FDA limits use of J&amp;J COVID-19 vaccine - Mayo Clinic News Network https://t.co/xRUHM4MyT4,en
2022-05-06 17:23:46+00:00,1518940621456748545,Been on Twitter since Elon Musk's purchase was announced. Have one question for you Twitter Veterans? Is discussion of the covid-19 vaccine taboo? Twitter comments are strangely quiet on vaccine issues.,en
2022-05-06 17:23:01+00:00,19347202,New Omicron variants BA.4 and BA.5 appear to be more infectious and have the potential to evade current COVID-19 vaccines and protection acquired from previous infection. https://t.co/PltGylsduX https://t.co/k3jhTzkRAw,en
2022-05-06 17:20:29+00:00,59754580,"Please please please, if you are pregnant, make sure are up to date on your COVID 19 vaccines. https://t.co/9Kf8zBgF0M",en
2022-05-06 17:19:57+00:00,34308223,Experts Identify 100 Plus Firms to Make Covid-19 mRNA Vaccines https://t.co/q4ESg2ncmk,en
2022-05-06 17:19:36+00:00,1120471017787281409,"And by ""COVID-19"" they mean the vaccine. COVID patients weren't having heart problems... vaccine recipients are. mRNA clots your blood.",en
2022-05-06 17:19:21+00:00,1474890634276360194,FDA Restricts J&amp;J’s COVID-19 Vaccine Over Risk of Blood Clotshttps://t.co/2XxfhwFZIV,en
2022-05-06 17:18:32+00:00,191615018,"Janssen COVID-19 Vaccine Could Cause Blood Clots, Warns FDA https://t.co/i0lIYZnUrb",en
2022-05-06 17:18:24+00:00,40767208,@MatteoRedaelli8 @LeibaParsec @DarioBressanini FDA limits J&amp;J COVID-19 vaccine due to rare blood clot riskhttps://t.co/ixBgs0Bjx5¯\_(ツ)_/¯,en
2022-05-06 17:17:51+00:00,44911541,FDA’s vaccine advisory committee plans to meet June 8 &amp; June 21-22 to discuss possible authorization of COVID-19 vaccines in younger populations. Click to see more from @KPMG_US Center for Healthcare Regulatory Insight. #KPMGHC #ATW360 https://t.co/UvEaENQ0HK https://t.co/F6HkSDN2PJ,en
2022-05-06 17:17:43+00:00,1466386613756317696,"#Bangladesh has ranked 5th out of 121 countries in the @NikkeiAsia Covid-19 Recovery Index which is highest in #SouthAsia. About 75.46% of the population has received at least a single shot of the vaccine, while 68.19% is completely vaccinated.https://t.co/zqPL6aGkBa",en
2022-05-06 17:17:43+00:00,3250894356,"The COVID-19 ""Vaccine"" Is Altering The Minds Of Those Who Take It - Liberty Planet https://t.co/7TpLx2yxcy",en
2022-05-06 17:17:08+00:00,956920856,FDA restricts J&amp;J’s COVID-19 vaccine due to blood clot risk https://t.co/PFuU2NlCTs via @nypost,en
2022-05-06 17:16:45+00:00,1323627336072368131,😯 Adverse Reactions to the Covid-19 Vaccinesamong Children in the USA as of April 22nd 2022Source: CDC Wonder https://t.co/P9NSN0DRFA,en
2022-05-06 17:16:37+00:00,67008915,The FDA has restricted the use of Johnson &amp; Johnson’s COVID-19 vaccine based on an updated analysis of the risk for a rare but potentially deadly blood-clotting syndrome. https://t.co/Ixlxuya5Wn,en
2022-05-06 17:15:01+00:00,1103213547423744005,"New study, report May 4, 2022:Researchers reveal the mechanism of action of century-old BCG vaccine. There's even some evidence that it can reduce severity of #COVID-19.https://t.co/OFQ7ffKVju#COVID19 #SARSCoV2",en
2022-05-06 17:14:41+00:00,2402300443,"@adriandix @KatrineConroy @Interior_Health In the last month 93% or 189 people of the 204 covid-19 deaths in BC are from vaccinated people. 7% or 15 people were not vaccinated. 85% of the 1,426 hospitalizations are vaccinated, 15% or 216 aren'tvaccinated. Critical care is 83% vaccinated. This vaccine isn't a vaccine. https://t.co/llDdY14C8e",en
2022-05-06 17:14:35+00:00,1259393256,@leighhmitchell @OurWorldInData SAC data is really misleading: just by counting 18 years and above and make it sound like MMR has high Covid-19 vaccine coverage rate. Sorry but not sorry I don’t trust SAC’s data whether it’s above 18 YO data or not.,en
2022-05-06 17:14:26+00:00,78714922,"The FDA's recommendation comes after they have recorded 9 deaths from blood clots related to the J&amp;J Covid-19 vaccine, which advises the public to receive either Pfizer or Moderna over J&amp;J. https://t.co/ocDeCG81iE",en
2022-05-06 17:14:02+00:00,1046497761665974275,FDA’s vaccine advisory committee plans to meet June 8 &amp; June 21-22 to discuss possible authorization of COVID-19 vaccines in younger populations. Click to see more from @KPMG_US Center for Healthcare Regulatory Insight. #KPMGHC #ATW360 https://t.co/dTd0IfgHg0 https://t.co/9VIRgUnuei,en
2022-05-06 17:13:06+00:00,816864430210318336,"The FDA's recommendation comes after they have recorded 9 deaths from blood clots related to the J&amp;J Covid-19 vaccine, which advises the public to receive either Pfizer or Moderna over J&amp;J.#FDA #COVID19 #COVIDisAirborne #CovidIsNotOver #COVID #pandemics https://t.co/JqFPhJxTes",en
2022-05-06 17:13:02+00:00,31557041,FDA limits use of J&amp;J COVID-19 vaccine via @BeckersHR https://t.co/MfvfxkmYcs,en
2022-05-06 17:11:50+00:00,3422447283,"@stevechapman65 @6WattsPerKg @mocycling I'd rather get @Scienceofsport or @LindaGailBekker on line 1. I asked the both of them for a link to their podcast on the covid-19 vaccine, which seems to have disappeared from the internet. But haven't heard back from them. https://t.co/hoqvNxhEec",en
2022-05-06 17:11:16+00:00,1499423930196627466,"Dr. Geert Vanden Bossche Predicts, COVID-19 Vaccinated Populations Could See Super-Variant Strain Of SARS-COV-2. Existing Vaccines Won't Help!https://t.co/l26iSIL0Tk",en
2022-05-06 17:11:00+00:00,18941920,U.S. regulators are strictly limiting who can receive Johnson &amp; Johnson’s COVID-19 vaccine due to a rare but serious risk of blood clots. https://t.co/D4z29xUxtq,en
2022-05-06 17:09:43+00:00,1710949182,"@JohnLalor18 @Richlin11a ""Although, like most vaccines and medicines, clinical trials of COVID-19 vaccines in pregnant women were not carried out prior to use of the vaccines in the general population, there is now growing evidence from clinical use which provides reassurance..""https://t.co/3fwJtl8QQO",en
2022-05-06 17:09:37+00:00,821763432391344128,#JNJ #COVID19 #vaccine story illustrates the dangers making risk-benefit recommendation with limited information. Unfortunately breeds mistrust @DanBarreiroKFAN  Back where it started: FDA restricts use of J&amp;J's COVID-19 shot because of blood clot threat https://t.co/g6BkfxkjrX,en
2022-05-06 17:09:26+00:00,214885768,“The U.S. Food and Drug Administration (FDA) said on Thursday it was limiting the use of Johnson &amp; Johnson’s Covid-19 vaccine for adults due to the risk of a rare blood clotting syndrome.”https://t.co/vm9imi0DVH,en
2022-05-06 17:08:41+00:00,3161549442,"Stay up to date on COVID-19 vaccines. Talk to your doctor about whether you need to wear a mask and take other precautions if you are high risk. Get tested if you have symptoms. Those with symptoms, a positive test or exposure to someone with COVID-19 should wear a face mask.",en
2022-05-06 17:08:30+00:00,1620898723,"@ThePollLady what about china why WHO is not talking about them or they dont live on this planet. No comments on low efficasy vaccines, draconian measures ,number of deaths, poor health system origin of covid 19. Is India the soft target",en
2022-05-06 17:08:21+00:00,23564230,"Dr. Ryan Cole has abused his power as a board member of the Central District Health in Idaho and as a private physician. Claiming that the COVID 19 vaccine caused cancer, he misdiagnosed patients, leading at least one to have extensive and unnecessary surgery. @audreydutton",en
2022-05-06 17:08:10+00:00,1124329619715444737,"""The University of Washington developed a vaccine for COVID-19...The scientists who developed the vaccine were hoping to create a “second-generation” version that could help aid vaccination efforts across the globe, according to the release."" - The Miami Herald https://t.co/TtJ1PppecU",en
2022-05-06 17:07:12+00:00,1466651412981374978,New study finds vaccines induce multiple immune system mechanisms to protect against severe COVID-19 illness https://t.co/KBLf8NEPhG  #science #biology #new #study #vaccines #immune,en
2022-05-06 17:06:37+00:00,1343363792936161280,Myanmar starts administering locally produced Sinopharm COVID-19 vaccines - https://t.co/X4Z8Xrz4nu - https://t.co/En0ipunzfG #GoogleAlerts,en
2022-05-06 17:06:07+00:00,2815733186,FDA Puts Strict Limits On Johnson &amp; Johnson Covid-19 Vaccine https://t.co/lW4lfRWQqU https://t.co/8aMb6K7jaS,en
2022-05-06 17:05:00+00:00,360666534,United States limits the use of J&amp;J’s COVID-19 vaccine..https://t.co/wIUdow9DmA.#ElSolLatino #yobrilloconelsol #ElSolLatinoNoticias #elsollatinonewspaper  #MyHispanicMediaSolution #CDC #Covid19 #FDA #JandJvaccine #JJsanticovid #JJsanticovidvaccine #JohnsonandJohnson https://t.co/y7cNvdu8Dj,en
2022-05-06 17:04:58+00:00,1684964316,FDA puts strict limits on Johnson &amp; Johnson Covid-19 vaccine - CNN https://t.co/5vdOJRPFD7,en
2022-05-06 17:03:10+00:00,358591568,Israeli Study Shows COVID-19 Vaccines Are Associated With An Increase In Emergency Cardiovascular Events#VaccineSideEffects #COVID19 #healthcare #mandates,en
2022-05-06 17:03:05+00:00,95506425,"The U.S. has bought more than twice as many doses of Covid-19 vaccines over the past two years than what’s been distributed domestically, raising questions about the nation’s vaccine campaign. https://t.co/1u4IBAgmp7",en
2022-05-06 17:02:38+00:00,3048868126,5 benefits of COVID 19 Vaccine go and get your jab...#YesToCOVID19Vaccine#GoForCOVIDVaccineToday@ICTAdvocates @macfound @YZYau @hamzaish https://t.co/ow8zaUrrI0,en
2022-05-06 17:02:32+00:00,1353999196353945600,"@JRodriguez81 @RocCalli @SaskiaPopescu Are we talking about prevention like in 2020 even if we got more than one vaccine + Merck/Pfizer pills? I'm repeating that we have our guns, we are not anymore dying like some years ago for COVID-19. We must deal with the fact that the emergency is now over.",en
2022-05-06 17:01:09+00:00,562152771,"Visit our mobile vaccination van in North End this weekend!Come along and get your 1st, 2nd or booster dose of the COVID-19 vaccine or get your vaccine questions answered by our friendly staff 🚐Find more information here ➡️ https://t.co/Qb3auhTv6N https://t.co/QwXaAALou2",en
2022-05-06 17:01:07+00:00,58352598,"FDA Limits Who Can Receive Johnson &amp; Johnson’s COVID-19 VaccineThe AP (5/5, Perrone, Neergaard) reports that on Thursday, the Food and Drug Administration “strictly limited who can receive Johnson &amp; Johnson’s COVID-19 vaccine.” The FDA “said the ...https://t.co/hk2gMXpVB2 https://t.co/AwoXgpF0Mq",en
2022-05-06 17:01:00+00:00,1267348936307568641,"From making personal sacrifices to care for their patients to administering COVID-19 vaccines – nurses have remained on the frontlines of the pandemic. We thank you and admire your passion, dedication, and commitment to keeping our nation safe. #NationalNursesDay https://t.co/NtWp0aLA07",en
2022-05-06 17:00:56+00:00,1024797162,"COVID-19 Vaccine Clinic May 17th, 12pm-2:45pmVillage Church330 SW Murray BlvdBeaverton, OR 97005https://t.co/ntouGjbrKw https://t.co/So166HzNy9",en
2022-05-06 17:00:36+00:00,16715398,FDA restricts Johnson &amp; Johnson's COVID-19 vaccine due to rare but serious risk of blood clots https://t.co/wAMB4mJXPT https://t.co/SYnhiGyNyn,en
2022-05-06 17:00:32+00:00,17155995,FDA limits use of the J&amp;J Janssen COVID-19 vaccine https://t.co/ue9IyKCIjU,en
2022-05-06 17:00:28+00:00,111354912,"New CDC MMWR finds among nursing home residents, additional #COVID19 primary or booster doses provide higher protection against Omicron infection than primary series alone. Get up to date with COVID-19 vaccines, including boosters when eligible. More: https://t.co/CFTTf6x9Ra https://t.co/7NKwyIwxi9",en
2022-05-06 17:00:27+00:00,115442398,"#VaxFact: Because none of the authorized COVID-19 vaccines in the U.S. contain the live virus that causes COVID-19, the vaccine cannot make you sick with COVID-19. Find a clinic at https://t.co/0j8GZ3cqZL https://t.co/NLvAgR5TSp",en
2022-05-06 17:00:16+00:00,209906181,"@leftychris3 @LogicalKnot @FraiseAdam The subsequent announcement (that Pfizer's CoViD-19 vaccine was given full FDA approval) was made on August 23, 2021.https://t.co/z7KtJQ2nMY",en
2022-05-06 17:00:14+00:00,236770150,FDA limits use of Johnson &amp;amp; Johnson COVID-19 vaccine over blood clot risk https://t.co/0ZLYLmPXRA #Health https://t.co/eQQT8822Zi #news 568,en
2022-05-06 17:00:12+00:00,34372074,U.S. regulators are strictly limiting who can receive Johnson &amp; Johnson’s COVID-19 vaccine due to a rare but serious risk of blood clots. https://t.co/mdvGlLbeca,en
2022-05-06 17:00:08+00:00,52727059,U.S. regulators on Thursday strictly limited who can receive Johnson &amp; Johnson’s COVID-19 vaccine due to the ongoing risk of rare but serious blood clots. https://t.co/Yodd592sCf,en
2022-05-06 17:00:02+00:00,41458916,"MedXpress, 6-5-22Study suggests severe obesity blunts antibody response to Covid-19 vaccinesMensen met obesitas (BMI &gt; 40) maken na vaccinatie minder antistoffen aan dan normaal BMI.Na vaccinatie met:Pfizer: 3 x minderCoronavac: 27 x minderhttps://t.co/TenZlWfJKQ Þ",en
2022-05-06 17:00:01+00:00,23711785,"Parents: the COVID-19 vaccine is an important tool to keep kids 5 and older safe. They may still get COVID-19, but the vaccine helps reduce their risk of becoming seriously ill. Talk with their doctor and learn more at https://t.co/JpY5veCyBQ. https://t.co/BudfBVV6JE",en
2022-05-06 17:00:00+00:00,25526995,💉 There are Covid-19 vaccine walk-in clinics open across #StokeOnTrent this week. ⏱ No appointments needed - just call in: #Packmoor #Longton #Milton #Shelton and #Tunstall ➡️ Full details/opening hours: https://t.co/3gRfFJHCwF https://t.co/CXwqKJ7pyd,en
2022-05-06 16:59:47+00:00,1595149746,"@DreJoanneLiu Equitable access for affordable medicines, vaccines &amp; surgeries for the underserved &amp; neglected population has always been an issue particularly in LMICs. It is obvious that this pandemic covid-19 has drawn the global attention &amp; revelation of this long standing unresolved issue.",en
2022-05-06 16:58:51+00:00,1420401358511935491,"@doggerybaw FDA began court-mandated release of thousands of pages on Pfizer's Covid-19 vaccine review documents on March 1, 2022January 2022 is “old” because it’s not factualbut I guess blindly trusting CDC is easier than admitting you’re wrong🍿",en
2022-05-06 16:57:38+00:00,726181817653465088,"FDA limits use of Johnson &amp; Johnson’s Covid-19 vaccine, citing clotting risk https://t.co/psP18tbEBJ via @statnews #COVID19 #CovidVaccine #johnsonandjohnson #bloodclotting",en
