date,userid,tweet,lang
2022-01-01 08:28:04+00:00,77445267,"@StateDept is committed to ending the global pandemic. Here's the latest deliveries of COVID-19 vaccines, in partnership with #COVAX: 🇵🇰 5M to Pakistan 🇱🇾1.2M to Libya 🇾🇪168K to Yemen 🇲🇻100K to Maldives Follow the latest here. https://t.co/04OkMeEjVk#Vaccineswork https://t.co/ReLAvCENrJ",en
2022-01-01 08:27:57+00:00,429112432,"Parson cites the effectiveness of COVID-19 vaccines and the work of health care professionals in his decision that it's no longer necessary ""to … https://t.co/ps7VyGnnVa #HR #humanresources",en
2022-01-01 08:27:40+00:00,1138376859614212098,"Ocugen's stock bounces after 'positive' results from COVID-19 vaccine candidate in children as young as 2 years oldShares of Ocugen Inc. surged 6.4% in morning trading Thursday, to bounce off a near 11-month low, after the biopharmaceutical company sai… https://t.co/p1HHitXWfg",en
2022-01-01 08:27:36+00:00,1287929600702586881,The Infowars host Alex Jones slammed Trump's social-media network and called him 'pathetic' for supporting the COVID-19 vaccine https://t.co/FNQsBePYV7 via @YahooNews How many deaths is this scumbag idiot responsible for?,en
2022-01-01 08:27:35+00:00,1138376859614212098,"J&amp;J's COVID-19 vaccine booster was 85% effective against hospitalization, in South Africa studyJohnson &amp; Johnson said Thursday that a South African Phase 3 study showed that its a booster shot of its COVID-19 vaccine was 85% effective in preventing COV… https://t.co/ihV7hTOT4e",en
2022-01-01 08:26:54+00:00,1266522622944251911,This is a Telegram group chat that spreads misinformation about both #Covid_19 and #vaccine. It is run by Qanon 'Patriot' @JarrinJackson. You all can do your part and report this Telegram group chat at https://t.co/Peo0LFu0qf. (Don't have to join his chat to report!) https://t.co/UvjLQgtw7L,en
2022-01-01 08:26:26+00:00,2703798199,Medicare: MRI to diagnose myocarditis after Covid-19 vaccine added to MBS https://t.co/HMw50pJQho via @newscomauHQ,en
2022-01-01 08:25:39+00:00,1337617328058482689,"#NewDelhi - According to a study conducted at various levels, vaccine manufacturing companies are working hard to prevent the eradication of the Covid-19 pandemic, Zee News stated on its DNA programme.#SaturdayMotivation https://t.co/kPgwcp8Kg6",en
2022-01-01 08:24:15+00:00,2841056607,"Every adult in the country now needs to get a Covid-19 booster vaccine, because two doses does not give you enough protection against catching Omicron. #Omicron #Covid19 #Covidvaccination https://t.co/ydmVzjU1bb",en
2022-01-01 08:24:14+00:00,828133781240320000,"Fauci: 'Seriously ill,' unvaccinated children in hospitals was 'avoidable! Republicans should be held accountable for surging Covid-19. They banned mask/vaccine mandates! https://t.co/8Yiw6HuvfO",en
2022-01-01 08:22:36+00:00,1279717771710836736,Update on COVID-19 Vaccine Availability in States/UTs  https://t.co/aYmdBefK06https://t.co/lCneeLfoKU,en
2022-01-01 08:21:23+00:00,411512649,COVID-19 Vaccine Facts https://t.co/LOF4KRoTUE via @CDCgov,en
2022-01-01 08:21:10+00:00,828133781240320000,The Marine Corps has now discharged more than 200 service members for refusing to follow COVID-19 vaccination mandates. Servicemen who refuse the vaccine can’t be deployed overseas!  https://t.co/TGi8mvW92A,en
2022-01-01 08:20:36+00:00,852124899829321728,"Missouri to end COVID-19 state of emergency, citing effectiveness of vaccine https://t.co/BqQ1p3np4H",en
2022-01-01 08:19:45+00:00,1227330071029043208,Japan Is Working on a COVID-19 Vaccine That Offers Lifelong Immunity https://t.co/KypzeuVvDX,en
2022-01-01 08:18:42+00:00,16076965,"WhiteHouse: RT @HHSGov: “We may be rivals on the field, but off of it, we face a common opponent: COVID.” COVID vaccines and boosters are our best defense. Get your free booster and stay in the game against COVID-19. Find vaccines near you at … https://t.co/s4g0uy4wu0",en
2022-01-01 08:18:09+00:00,1464490561818214400,"Although the current dominant strain of COVID-19 — the omicron variant — has been demonstrated to be more transmissible and much less deadly than prior strains, as well as dramatically mutated from the original strain after which the vaccines were modeled,",en
2022-01-01 08:18:08+00:00,1464490561818214400,"Even as the COVID-19 vaccines have now been shown to 1) lose effectiveness in a matter of weeks; 2) be ineffective at stopping transmission and spread of the virus; and 3) be inferior to natural immunity, and even as more than 20,000 vaccine-related deaths have been reported in",en
2022-01-01 08:18:06+00:00,1464490561818214400,"As COVID-19 vaccines became available in the U.S. through Emergency Use Authorization (EUA) from the FDA, these extremely new treatments were heavily promoted by Fauci, Gates, the media, Big Pharma, and social media under knowingly false pretenses, including repeated false claims",en
2022-01-01 08:16:24+00:00,255955558,@PMOIndia @narendramodi Covid-19 &amp; Vaccines are two of them ...,en
2022-01-01 08:16:20+00:00,3194927406,206 Marines Kicked Out for Refusing COVID-19 Vaccineshttps://t.co/2oT9nTgJAh,en
2022-01-01 08:16:13+00:00,723121888998748160,"Every adult in the country now needs to get a Covid-19 booster vaccine, because two doses does not give you enough protection against catching Omicron.Find out more about getting your vaccine here: https://t.co/8XnXiHw2M4 https://t.co/nPRVU5tr33",en
2022-01-01 08:16:02+00:00,2583678126,Why lockdown and climate policies are doomed to fail https://t.co/DNihcG3a0p via @theconwom Vaccines to protect against Covid-19 have not apparently excused the Prime Minister from his perceived obligation to put most of the population under what's little better than house arrest,en
2022-01-01 08:14:03+00:00,792263243330904068,"Year 2021 was America's Holocaust: Unprecedented Lives Destroyed by Experimental COVID-19 ""Vaccines""",en
2022-01-01 08:12:50+00:00,1170278756012847104,An Israeli hospital is studying the effectiveness and safety of a fourth dose of the Covid-19 vaccine.#covid19 #doses #vaccinations #israel #dailyupdates #dreamiens #prime https://t.co/6iZsrlEFfF,en
2022-01-01 08:11:33+00:00,856652799290916870,"As of Friday, Dec. 31, 2021, 88.1% (4392141) of eligible people five and older in B.C. have received their first dose of COVID-19 vaccine and ...COVID-19 pandemic update | BC Gov News https://t.co/s9DlnIbgwv",en
2022-01-01 08:11:24+00:00,856652799290916870,"""Congress, moreover, has specifically directed OSHA to use its existing regulatory authorities 'to carry out COVID-19 related worker protection ...Biden administration asks Supreme Court to uphold Covid-19 workplace vaccine policies https://t.co/e9vvgGFUiL",en
2022-01-01 08:11:19+00:00,856652799290916870,"Alberta is reducing the required isolation period for those who have COVID-19 but have received two doses of vaccine from 10 days to five days, ...Alberta reduces COVID-19 isolation period for fully vaccinated people from 10 to 5 days ... https://t.co/3PB3wVGX7b",en
2022-01-01 08:10:31+00:00,244911409,'We don't need a third shot of COVID-19 vaccine': US virologist | Part. 2 https://t.co/3Fh83T0d84 via @YouTube,en
2022-01-01 08:08:42+00:00,3131199549,Japan Is Working on a COVID-19 Vaccine That Offers Lifelong Immunity,en
2022-01-01 08:07:58+00:00,766694560378523648,@calvin_maestro You people are insane. The vaccine does not work. It’s not a vaccine when you have to take it multiple times. It’s a treatment with diminishing effect.  You are more concerned with not feeling stupid about being wrong. COVID-19 is weakening. Celebrate it.,en
2022-01-01 08:07:50+00:00,1245731370812538881,CDC Sued for Withholding Post-Licensure V-safe Data on COVID-19 Vaccineshttps://t.co/8uAUzj25ve,en
2022-01-01 08:07:29+00:00,381312528,"206 Marines have been separated for refusing to comply with the Pentagon’s COVID-19 vaccine mandate, according to a Marine Corps spokesperson.https://t.co/f2kp7QvPUs #NEPA #NEPABuzz",en
2022-01-01 08:07:07+00:00,828133781240320000,"House GOP committee deletes tweet spreading disinformation about Covid-19 booster shots. THIS IS THE REASON WHY COVID-19 IS SURGiNG AND PEOPLE ARE DYING BECAUSE OF REPUBLICANS. They banned mask/vaccine mandates. Sad part, most casualties are their voters!  https://t.co/AwSiER1fPL",en
2022-01-01 08:05:56+00:00,3222854576,"Missouri to end COVID-19 state of emergency, citing effectiveness of vaccine https://t.co/7FTwHETHVS",en
2022-01-01 08:05:36+00:00,1453856430960754689,"Missouri to end COVID-19 state of emergency, citing effectiveness of vaccine https://t.co/qRwh3rcjg2",en
2022-01-01 08:05:05+00:00,16453340,"Israel has approved a fourth vaccine dose for people most vulnerable to COVID-19, becoming one of the first countries to do so. https://t.co/TPIc3JOsed",en
2022-01-01 08:04:13+00:00,13200062,What will COVID-19 be like in 2022? More vaccines and masks – Fast Company https://t.co/2g93CgsUS2,en
2022-01-01 08:03:45+00:00,13200062,What will COVID-19 be like in 2022? More vaccines and masks – Fast Company https://t.co/ndPSGYYIgD,en
2022-01-01 08:03:05+00:00,1310466420241846273,Imran Khan tests Covid-19 positive 2 days after receiving Chinese vaccine https://t.co/tKDrNNMg2m,en
2022-01-01 08:01:25+00:00,3222854576,"Missouri to end COVID-19 state of emergency, citing effectiveness of vaccine https://t.co/7FTwHETHVS",en
2022-01-01 08:01:05+00:00,712220306,Covid-19 experts agree: 2021 was a failure for vaccine distribution https://t.co/XvBGL87aNK,en
2022-01-01 08:00:41+00:00,324914276,"US FDA expected to broaden Pfizer Covid-19 vaccine booster eligibility to youths ages 12 to 15 in the coming days, source says https://t.co/0MsROFT7iv",en
2022-01-01 08:00:35+00:00,562067020,"🎇 Start 2022 off right, by booking your COVID-19 vaccine 👉 https://t.co/kXjU1BnolK #GetBoosted https://t.co/EA1gQszGRd",en
2022-01-01 08:00:28+00:00,18999261,Dozens of Marines have been discharged over the past week for their refusal to comply with the military’s COVID-19 vaccine mandate.  https://t.co/yz96KWALUh,en
2022-01-01 08:00:28+00:00,123574840,"🎇 Start 2022 off right, by booking your COVID-19 vaccine 👉 https://t.co/oirDtsvxDN #GetBoosted https://t.co/zKVsBr1dVS",en
2022-01-01 08:00:19+00:00,562152771,"🎇 Start 2022 off right, by booking your COVID-19 vaccine 👉 https://t.co/ImEBYUe8el #GetBoosted https://t.co/3W6HPUOVVf",en
2022-01-01 08:00:18+00:00,52351492,"🎇 Start 2022 off right, by booking your COVID-19 vaccine 👉 https://t.co/6pTRNVknIS #GetBoosted https://t.co/G3uXrY32QR",en
2022-01-01 08:00:16+00:00,125595021,"🎇 Start 2022 off right, by booking your COVID-19 vaccine 👉 https://t.co/wpDTEkMmwl #GetBoosted https://t.co/8W7QdLWjoV",en
2022-01-01 08:00:11+00:00,140077855,"🎇 Start 2022 off right, by booking your COVID-19 vaccine 👉 https://t.co/bJ5pFcHu3g #GetBoosted https://t.co/M3GJquNeMc",en
2022-01-01 08:00:07+00:00,562087684,"🎇 Start 2022 off right, by booking your COVID-19 vaccine 👉 https://t.co/4UkoJRhaqD #GetBoosted https://t.co/kEZShCIKoF",en
2022-01-01 07:59:04+00:00,4733600184,COVID-19 Vaccine That Offer Life Long Immunity https://t.co/diN2pYZwd7,en
2022-01-01 07:57:00+00:00,4865350201,"For yourself, for your family. Get the COVID-19 vaccine today. Vacuna COVID: segura, gratuita y la opción correcta para su familia COVID Vaccine: Safe, Free, and the Right Choice for Your Family https://t.co/BYCezvXp6C",en
2022-01-01 07:56:55+00:00,2799146719,Novavax to submit COVID-19 vaccine EUA request to U.S. FDA next monthhttps://t.co/wNZRz07HpR,en
2022-01-01 07:55:53+00:00,25588496,People who vaccinate against Covid 19 will grow elephant trunks. And the vaccine doesn’t stop you from getting an elephant trunk. So get vaccinated.,en
2022-01-01 07:55:29+00:00,716075028,UNICEF COVID-19 Vaccine Market Dashboard - Update 31/12/2021: https://t.co/9dwhT3BOMU,en
2022-01-01 07:54:07+00:00,317244922,getting the covid 19 booster vaccine on the new year,en
2022-01-01 07:52:00+00:00,1119900799105228801,😷 A reliable assessment of COVID-19 vaccine protection duration - https://t.co/O8YmxH6oPa 👉 https://t.co/l8zluQYwIm 💊 #Medical #GroupZirigoza,en
2022-01-01 07:51:36+00:00,165042944,"“Sinovac's two-dose COVID-19 vaccine followed by a booster Pfizer-BioNTech shot showed a lower immune response against the Omicron variant.Thus, CoronaVac recipientsmay need 2 additional boosterdoses to reach levels neededagainst Omicron.” 💉 #Vaccine #Booster",en
2022-01-01 07:51:20+00:00,754692758754000898,Take your COVID 19 vaccine in Time &amp; Save your life : https://t.co/mFpANEjX1Q,en
2022-01-01 07:50:53+00:00,1274488660310790144,"@michola94 @aproko_doctor It's not fake, it's official doesn't guarantee your safety. The annoying part is that the side effects are much, even up to causing erection dysfunction. All the players in Europe that currently sick of Covid 19 took these useless vaccine even up to complete shot",en
2022-01-01 07:49:23+00:00,138074166,"The #Omicron variant of #coronavirus is largely resistant to antibodies from people who recover from #COVID -19 infection, and those vaccinated with two doses of the #Pfizer vaccine, according to a study https://t.co/e8GbZNDCGG",en
2022-01-01 07:48:36+00:00,1160449100828950529,"@DKThomp here’s a thought about how State policies have an impact: on the day Texas @GovAbbott celebrated “beating” @POTUS on vaccine mandates,  he sent a desperate letter begging for Federal help as #Covid_19 burns thru a State…that is antimask &amp; #antivax",en
2022-01-01 07:48:05+00:00,937732478826983424,"Geneva: The World Health Organisation (WHO) chief Tedros Adhanom Ghebreyesus said that he is optimistic that the Covid-19 pandemic will be defeated in 2022, provided countries work together to contain its spread. Ghebreyesus warned against “narrow nationalism and vaccine hoarding https://t.co/nHIfX3MAPb",en
2022-01-01 07:48:05+00:00,93470026,UC system fires physician who challenged COVID-19 vaccine mandate in lawsuit https://t.co/0Im8J8pLwq,en
2022-01-01 07:47:00+00:00,1436627268131037190,"My perfectly healthy 86 year old Mother (5'2"", 95 lbs, no prescriptions, walks 3-4 miles a day, eats only venison, buffalo, fruits and vegetables, BP 120/80),...forced to get the COVID-19 ""vaccine"" by her personal Doctor. https://t.co/4ysIxAjzOC",en
2022-01-01 07:46:43+00:00,885644898615078912,"@andyspence101 @Preciou56046475 @JSB01219230 @mattgaetz Wow, so many things wrong with this tweet.  Staff were overworked in 2020 before a vaccine dipshit.  I don't care what you think is just from the media...COVID-19 isn't just a flu: if you had a medical background you'd know this.",en
2022-01-01 07:45:38+00:00,1128402543158018048,"Trump COVID-19 Deaths, COVID-19 Statistics, Foreign Covid Stats of The Day, Stock Market Closes/Precious And Rare Metals, Joe Biden’s Border Catastrophe I, COVID-19 Lockdowns-Restrictions-and Authoritarianism News, Vaccine Manufacturers’ Stock Prices (Follow the Money) News,…",en
2022-01-01 07:45:24+00:00,1128402543158018048,Peter McCullough says that the ‘suppression of COVID-19 treatments such as Plaquenil (hydroxychloroquine) and Ivermectin in place of pushing the vaccines nonstop is all about causing fear and death among the American people.’,en
2022-01-01 07:45:21+00:00,1237939922570371072,"@MRobertsQLD ""Since around 2014, Wolf has been described as a conspiracy theorist""""She has objected to COVID-19 lockdowns and criticized COVID-19 vaccines.""""In June 2021, her Twitter account was suspended for posting anti-vaccine misinformation.""https://t.co/lMTrczp8QO",en
2022-01-01 07:45:00+00:00,1257408962749763584,"Missouri to end COVID-19 state of emergency, citing effectiveness of vaccine https://t.co/eUhwLVXE5L #FoxNews",en
2022-01-01 07:44:39+00:00,214151148,"1 year ago today i caught covid before we knew much about vaccines, was rocking like a crackhead in bed needing a fix was horrible. Forward a year n my arm is fucked from taking the booster n flu jab on the same day haha. At least im alive. Little wins man. #Covid_19  #vaccine",en
2022-01-01 07:43:57+00:00,1454632065048072197,https://t.co/iJkrmusPaqMales under 40 years old are more likely to experience heart inflammation after getting a booster shot of Pfizer’s COVID-19 vaccine than COVID-19 itself,en
2022-01-01 07:43:03+00:00,1193290714844717056,Do Africans know that BOB MARLEY was given sneakers with a CANCER laced pin by the WEST as they were afraid his CONSCIOUS MUSIC would make Africans free themselves? And you trust COVID-19 vaccines !,en
2022-01-01 07:42:37+00:00,237707187,"COVID-19 Vaccination: Over 151 Crore Vaccine Doses Provided To States And UTs So Far, Says Centre  https://t.co/Ls4RVEXTZU via @swarajyamag",en
2022-01-01 07:40:35+00:00,3343688313,"@cobbo3 They will, if the medical fraternity explore and develop molecular biology science. Medicine is changing as anything else, with help of computation! Some Covid-19 vaccines, took less than 6 months to develop, thanks to micro biology computation.",en
2022-01-01 07:39:21+00:00,166580345,Good Bye 2021 A Year of Great Blessings. Such as1. Discovery of COVID-19 VACCINE2. Resumption of Full Economic ActivityWelcome 2022. The Year of Action. Hope Science Continues to Pillar Mankind ....,en
2022-01-01 07:37:27+00:00,1857960974,'Curiosity and love science' supporting to turn this devastating COVID pandemic to an usual endemic...#mRNA a magic box!The couple behind BioNTech’s COVID-19 vaccine win a Princess of Asturias Award https://t.co/OmsBCF91O4,en
2022-01-01 07:37:08+00:00,274012006,🧐 Seems a bit nit picky we know but the big ACME Rx #BoosterVaccine sticker took up both of the “other” slots on our Covid-19 Vaccination Record Card. Will the CDC issue new cards for the next (&amp; subsequent) vaccines 💉? 🤷🏻‍♀️ Or shall we flip it over?,en
2022-01-01 07:36:03+00:00,34713362,Here's how African leaders are working together to ensure a repeat of the Covid-19 vaccine shortfalls https://t.co/8BMByYLGtL,en
2022-01-01 07:34:18+00:00,1628770033,"@ShabirMadh @NgomaNqo As a vaccinologist, what are you doing to upscale the vaccine uptake?Aew you the one wo advised MAC to do away with other Covid-19 interventions since they took your M&amp;G article word by word?Does DatCov breakdown deaths per vaccination status?",en
2022-01-01 07:34:02+00:00,3189637441,"Chemistry plays an important role everywhere whether in medicine, your relationships with each other, etc.. Covid-19 and all such pandemics look for the possible solutions while understanding the Chemistry among Viruses, Target Cell, Vaccine, Medicine, et…https://t.co/rRUtBVBCQC",en
2022-01-01 07:33:02+00:00,14222652,@jhey2020 @Steve_McMillan_ @LisaMarieBoothe The Pfizer-BioNTech and Moderna COVID-19 vaccines are messenger RNA vaccines also called mRNA vaccines. mRNA vaccines are some of the first COVID-19 vaccines authorized and approved for use in the United States.https://t.co/sKYcQNXaDw,en
2022-01-01 07:32:25+00:00,63484122,"Fact Check-COVID-19 public health measures do not violate Nuremberg code, COVID-19 vaccines are not experimental | Reuters https://t.co/YI3kmth87a",en
2022-01-01 07:30:49+00:00,1339165012267569152,"WCH Calls For Immediate Cease And Desist Of Covid-19 Vaccines, Gives Reasons To Demand https://t.co/SoSA6xGQpp",en
2022-01-01 07:27:07+00:00,1309856905859411969,Petition: Open a Public Inquiry into Covid-19 Vaccine Safety https://t.co/loVdXXWK0S,en
2022-01-01 07:26:54+00:00,1136398440932315136,"@CTVCalgary First of all, we have to get rid of those corrupted medical officers and politicians. Then open the use of HCQ and IVM as COVID-19 early treatment drugs. Find out the origin of the virus and develop the real vaccine.",en
2022-01-01 07:25:25+00:00,721480565535465472,@lindyli GOP governors are fighting government vaccines mandate and telling people not vaccinate but when hospitals full of patients of Covid 19 they are calling &amp; begging Biden for help federal government for Covid relief,en
2022-01-01 07:24:53+00:00,950124834394124293,Three-Year-Old Girl Dies From Cardiac Arrest One Day After Receiving COVID-19 Vaccine https://t.co/JuMcXFXxDa via @dreamspublicity,en
2022-01-01 07:23:22+00:00,4219319163,Novavax files COVID-19 vaccine data with FDA https://t.co/9yroIKdNyY,en
2022-01-01 07:21:57+00:00,16751631,Covid 19 released the first  Mnra vaccines using CRISPR. https://t.co/K60uxjxsl8,en
2022-01-01 07:21:12+00:00,3954,@_dam19 @lizzy_mac38 @NicolaSturgeon It's not a vaccine. A vaccine consists of the actual thing your immune system is to build a tolerance towards. There is no Covid-19 in the mRNA. It alters your DNA and destroys your natural immune system. I'm aware what's actually in it.,en
2022-01-01 07:21:00+00:00,3991108098,Registration for #vaccination against #Covid_19 for teens between the ages of 15 and 18 is beginning today on the COWIN portal. #vaccine #kids #children #vaccinate #India https://t.co/W8ARxyHwFe,en
2022-01-01 07:20:38+00:00,45867864,@HillReporter Abbott is against COVID-19 vaccine mandates! Now he wants help from FEMA to help stop COVID-19 from spreading in Texas.,en
2022-01-01 07:20:31+00:00,1467009394122661890,"Can people still get COVID-19 even after receiving 2 doses of the vaccine? Yes, no vaccine is 100% protective. People can get COVID-19 even after vaccination. However, the vaccination will help protect them from developing severe disease.@anubha1812 #cancelboardexams2022 #Omicron https://t.co/mEBj4I6hsZ",en
2022-01-01 07:18:45+00:00,1665745004,"According to Worldwide Experts1. Vaccine is to avoid severe infection &amp; death from #Covid_19 .2. #Omicron is fast spreading but not dangerous as CovidWhat's the point in doing LOCKDOWNS &amp; Ruining People's Livelihood.Instead Adopt Strict Rules, Fines etc .&amp; Allow ppl to Live",en
2022-01-01 07:18:39+00:00,45867864,Abbott is against COVID-19 vaccine mandates! Now he wants help from FEMA to help stop COVID-19 from spreading in Texas.,en
2022-01-01 07:17:51+00:00,1274488660310790144,@aproko_doctor Na people we the fear all these illusions dey contact am. Why should anyone in right sense  take Covid 19 vaccine knowing that it doesn't prevent someone from contacting the sickness? that means the side effects of the vaccine is suffered for just nothing.,en
2022-01-01 07:14:55+00:00,18956073,".@RandPaul said thousands die every month from COVID-19 because Anthony Fauci has been ""de-emphasizing therapeutics"" in favor of vaccines.He also claimed Fauci has been biased toward vaccines for years, pointing to his involvement in the AIDS epidemic.https://t.co/mmlzmMUqaZ",en
2022-01-01 07:13:43+00:00,1170219632994615297,"Deputy Commissioner Rajouri, Vikas kundal today chaired a meeting to review the preparedness for administering Covid-19 vaccines to children in the age group of 15-18 years to be started from January 3, 2022.@diprjk @infjammu @FOBRajourijk https://t.co/2UQMOUnLBj",en
2022-01-01 07:09:17+00:00,1029606796049043457,"A ‘very strange’ omicron variant symptom has emerged https://t.co/pHXnoxgvARBack to the beginning or are we going full circle. All the symptoms for Omicron appears to be identical to COVID 19! Difference is now we have vaccine! Delta attached to the lungs, Omicron shallower!",en
2022-01-01 07:08:34+00:00,370332027,"Encouraging study on COVID-19 vaccines: d vaccines work &amp; booster shots work even betterVaccination has been successful in curbing COVID-19Nigeria commenced booster shots since Dec 10, 2021 for adults older &gt;18yrs. I've been trying to get my booster since then with no success",en
2022-01-01 07:08:19+00:00,1323828697439326214,@WilliamBerkson @RiverdivaNM @TheRickWilson I believe you are the one that Miss informed. Look at the smallpox vaccine it took one shot and we eradicated the disease. Besides there's a cure for this so-called covid-19 you don't need a vaccine LOL. If you had the virus you have better immunity to it than any booster,en
2022-01-01 07:08:09+00:00,247175898,"WA Records 3 New COVID CasesWA has reported 3 new COVID-19 cases, including 2 related to the backpacker cluster and 1 linked to a returned traveller.35 COVID cases are active in the state, with 5,536 tests undertaken and 8,427 vaccines administered yesterday. https://t.co/QDMQ2j8cIa",en
2022-01-01 07:08:06+00:00,4761395296,"The women who conquered Covid https://t.co/tCcNYuUtC7 D enviably leading role of d women scientists in designing d vaccines 2 wipe out d covid -19 crisis,is highly instructive 4 d societies still denying equal access 2 women in all sectors.",en
2022-01-01 07:06:57+00:00,1421526529087926274,@Conner24026871 @BNODesk I will get the third Covid-19 Vaccine to improve my body.,en
2022-01-01 07:06:07+00:00,1054950476217749504,Why Trump’s recent comments on Covid-19 vaccine stoked criticism from supporters https://t.co/qf3HjgcLV5 via @IndianExpress,en
2022-01-01 07:06:00+00:00,1367531,"Missouri to end COVID-19 state of emergency, citing effectiveness of vaccine https://t.co/6f7LEKD9Bg",en
