date,userid,tweet,lang
2022-02-21 09:57:36+00:00,1464335643014742027,Covid 19 vaccines plandemic scamdemicExposed again again again,en
2022-02-21 09:56:53+00:00,68927629,"An accomplishment to make all Indians proud! Here are the numbers on the cumulative impact of @Network18Group #Sanjeevani - A Shot Of Life, a @FederalBankLtd CSR initiative to spread COVID-19 vaccine awareness. #PooraTikaLagao @Apollo24x7 @UWMumbai https://t.co/zGEHyNQnmM",en
2022-02-21 09:56:31+00:00,919870839125835776,"jacarandafm: The Department of Health has introduced changes to its Covid-19 vaccination programme, including a reduction of the time interval between first and second doses of Pfizer vaccine.",en
2022-02-21 09:56:04+00:00,283604227,"Andy Vermaut shares:When fact checking cuts both ways: Like many BMJ readers I was concerned by the issues raised in your report about potential covid-19 vaccine trial misconduct.1 As a researcher and academic interested in research integrity,… https://t.co/3hsXSfS2S0 Thank you.",en
2022-02-21 09:54:27+00:00,61366128,"""Another 16 patients died, including an 11-month-old baby – the city’s youngest coronavirus-related fatality – taking the death toll to 321."" Hong Kong confirms more than 7,500 Covid-19 cases, vaccine pass to launch in days https://t.co/1dM42Pm2U7 via @scmpnews",en
2022-02-21 09:54:00+00:00,2827080417,Book your flu vaccine appointment now and your COVID-19 booster. Visit https://t.co/3ICjDDIDMB to learn more. https://t.co/nEI2x0D83G,en
2022-02-21 09:51:07+00:00,52204828,FACT: Covid-19 Vaccines are almost 50 times Deadlier than the Flu Vaccines per Number of Doses administered according to official USA data https://t.co/BPWSNs23aI,en
2022-02-21 09:51:06+00:00,1118090725,What happened to COVID 19 vaccines expiring? Or it was only for the India batch🤷‍♂️ https://t.co/FhHgat43xr,en
2022-02-21 09:50:16+00:00,45345052,"Effectiveness of Maternal Vaccination with mRNA COVID-19 Vaccine During Pregnancy Against COVID-19–Associated Hospitalization in Infants Aged 6 Months — 17 States, July 2021–January 2022 https://t.co/CdABzeNwQL",en
2022-02-21 09:50:06+00:00,1232981306503503872,Are you fully protected against Covid-19? Booster vaccines are now available from thousands of locations across the UK. Here's a handy guide from the #NHS: https://t.co/k29JUgyz6F #Booster #BoosterJab #BoosterVaccine #BoosterDose,en
2022-02-21 09:50:01+00:00,727592059385827330,"#Canada #Vancouver #Canadians Through deaths #lockdownextensions, raised #suicides, #domesticviolence, #sexualabuse,  unemployment etc. #Covid_19 has caused havoc. #Hunger &amp; #riots R awaited. No drug no #vaccine STOP IT. Take advice https://t.co/9LRAScysZL https://t.co/zGvoMGHNX9",en
2022-02-21 09:47:28+00:00,1357977989967974401,A systematic review of vaccine-induced thrombotic thrombocytopenia in individuals who received COVID-19 adenoviral-vector-based vaccines | SpringerLink https://t.co/nHDVF8Z4MV,en
2022-02-21 09:46:48+00:00,1346067997451026433,🌍 Global COVID-19 vaccine rollout🟩🟩🟩🟩🟩🟩🟩🟩🟩⬜⬜⬜⬜⬜⬜ 62.29% (estimate)Vaccine doses deployed: 10.6BThe rollout seems to be speeding up#COVID19 #EpiTwitter #Vaccination #PublicHealth https://t.co/bACNJ72rhD,en
2022-02-21 09:45:02+00:00,1288230265,"There are lots of places to get your COVID-19 vaccine this week with no appointment, including Brighton, Crawley, Eastbourne and Newhaven.Check out our website for the latest dates, times and locations: https://t.co/8ymM835efX https://t.co/CrneeAwF2C",en
2022-02-21 09:44:20+00:00,3114832177,@JosibeanL @canmericanized @McDonaldsCanada @RMHBC “More than 280 million doses of COVID-19 vaccines have now been secured to support the COVID-19 vaccine roll-out.”,en
2022-02-21 09:44:04+00:00,784351656355897344,"1⃣ Strengthen our defenses against COVID-19 and reducing the risk of future coronavirus pandemics,by developing next-gen COVID-19 vaccines, and initiating the development of broadly protective coronavirus vaccines🔬(2/8)",en
2022-02-21 09:41:26+00:00,1311911672504868875,Indonesia seeks to launch home-grown Covid-19 vaccine by August https://t.co/tzgarTHP8H,en
2022-02-21 09:41:07+00:00,166539231,https://t.co/S2enPt8Dni Study Finds COVID-19 Vaccines Using mRNA Technology Safe for People With Cancer,en
2022-02-21 09:41:01+00:00,141412902,"New Zealand will lift COVID-19 vaccine mandates and social distancing measures after the Omicron peak has passed, Prime Minister Jacinda Ardern said on Monday, as protesters occupying the parliament grounds again clashed with police. https://t.co/ZLR528LfHZ",en
2022-02-21 09:40:07+00:00,1322201832,Are you worried about having the Covid-19 vaccine during your pregnancy? Have you read conflicting information? Send your questions and concerns to the independent Pregnancy and Vaccination helpline 👇#covid-19 #vaccination #booster #staffordshire https://t.co/amt7YhLe0n,en
2022-02-21 09:38:35+00:00,951515820,County council praised for Covid-19 vaccine rollout https://t.co/1BrjAoQ8mp,en
2022-02-21 09:38:03+00:00,1384174991533436929,Ahh I got the third dose of Covid-19 vaccine 🤧,en
2022-02-21 09:35:57+00:00,42586014,"🔍 Vaccinating the #undocumented in 🇪🇺 – Part 4: In 🇮🇪 confusing policy led to ‘mysterious’ official numbers on vaccinated #migrants. By @ShamimMalekmian | @dublininquirer, w/@LHreports. #Coronavirus #Europe #vaccines #migrants #Ireland #Covid_19 https://t.co/sdDl0n418U",en
2022-02-21 09:34:11+00:00,1459186127269629955,Translated Israeli MOH survey of reported adverse events after the third Pfizer vaccine shot for Covid-19 https://t.co/vagmoFn32g,en
2022-02-21 09:32:00+00:00,1245245167818465280,"Get your COVID-19 vaccines &amp; booster at Saltwells Education Centre #Dudley. Book or walk in every day 7.30am-6.30pm. They are welcoming people who need their 1st, 2nd, 3rd &amp; booster jabs. Check if you're eligible https://t.co/MzNpNkywIK... #GetBoostedNow #VaccinateBCWB https://t.co/JNb2cxazGJ",en
2022-02-21 09:32:00+00:00,35764366,"A booster will strengthen your protection against COVID-19 and give you the best possible defence for you and your family.You can now get a booster dose of a COVID vaccine, from 3 months after your second dose. Book your vaccine at: https://t.co/pdbf6iiu3v  #KeepEnfieldSafe https://t.co/kgz6rEaLyR",en
2022-02-21 09:31:03+00:00,44294298,"Public Health/ Immunization Consultant to support COVID-19 Vaccine Rollout Across the Age Groups in Bihar: UNICEF, Patna, Bihar https://t.co/MwjOQ7uwOI",en
2022-02-21 09:30:30+00:00,1954774334,Echo chambers on social media spreading COVID - 19 vaccine misinformation: Study - The HinduEcho chambers on social media spreading COVID - 19 vaccine misinformation: Study https://t.co/hUeB5i9rmL The Hindu#SocialMedia #SocialMediaAI#ai #itrtg,en
2022-02-21 09:30:08+00:00,296694466,"2. The DG says, however, no deaths among pregnant women have been reported so far this year.“The vaccine coverage of 94.7% for those age 18 and above has been achieved in October 2021 and this contributed to the decrease in maternal mortality due to Covid-19 complications.” https://t.co/bQipZOHs8S",en
2022-02-21 09:30:00+00:00,51391293,"The Department of Health has introduced changes to its Covid-19 vaccination programme, including a reduction of the time interval between first and second doses of Pfizer vaccine.",en
2022-02-21 09:29:53+00:00,63418417,"The Traffic light system can still be activated that's the idea, we have a smart government. Science will corner Covid-19 with more potent vaccines &amp; will become endemic. They kept chopping off the tops &amp; improved vaccines to minimise the dead rate of an unvaccinated population",en
2022-02-21 09:28:12+00:00,29892528,Coronavirus: Stemirna gets ready for China’s own mRNA Covid-19 vaccine as global multi-site human trials kick off | South China Morning Post https://t.co/3XkY2YR6Hf,en
2022-02-21 09:27:57+00:00,1203978236230803456,Remember to register your dependant to get their Covid-19 vaccine and stay protected throughout the school year. #GetVaccinated #LetsGetBackToLearningAndLivingTogether #BackToSchool #RaiseYourHandsForJabs https://t.co/0dEr80fcoo,en
2022-02-21 09:24:46+00:00,1455726321737211910,@TawakkalnaApp hello Salamu alayqum i take first vaccine for covid 19 in out side when i was in Phillipine so why did not coming my first dose on my tawakkalna thank u,en
2022-02-21 09:24:39+00:00,305766862,@Foley62 @immdaly “Freedom Convoy” wants the federal government to terminate all COVID-19 vaccine mandates and obligatory contact-tracing. But Canada doesn’t actually have an obligatory Covid-19 vaccine program.” From @ForeignPolicy : https://t.co/wHZxAG2IxO,en
2022-02-21 09:24:11+00:00,1341580537509470209,Percentage of vaccination coverage by type of school.The COVID-19 vaccine can protect your child from serious symptoms of COVID-19. Protect them.#PICKids https://t.co/36itDoysHo,en
2022-02-21 09:24:05+00:00,104788049,Starting from today (Monday) civil servants who have not been vaccinated with two doses of the vaccines against COVID-19 for at least 14 days will have to present a weekly test in order to go to work.https://t.co/NpAgWOUkEw,en
2022-02-21 09:23:48+00:00,22865905,"@rainbowstiel Dedicated Customer Service Representative for a scientific equipment/medical supply company! (We helped supply a lot of ""stuff"" for the COVID-19 vaccines, for example 🙂) Dedicated = 2 accounts specifically for me.",en
2022-02-21 09:23:11+00:00,37924397,CDC Study: Pregnant Women’s Vaccination Protects Baby From Covid HospitalisationmRNA vaccines are 61% effective at preventing Covid-19 hospitalisation in babies less than six months old whose mothers were vaccinated during pregnancy.https://t.co/tHXJ94hPEf,en
2022-02-21 09:23:02+00:00,1389208776885026820,"🇪🇪 COVID-19 vaccines in #Estonia - 21 Feb 2022💉💉 Fully vaccinated: 836,889 (+62) | 62.9%💉 At least 1 dose: 856,733 (+32) | 64.4%⏳ Time until 70% vaccinated (at least 1 dose) with last 7 days' pace: 802 days (03 May 2024)",en
2022-02-21 09:21:46+00:00,1968259734,"India is using locally-developed drones to deliver COVID-19 vaccines, access remote areas, and strengthen the vaccine delivery system—ensuring that everyone everywhere receives life-saving vaccines.https://t.co/tjvHN4brif",en
2022-02-21 09:18:50+00:00,1099819564081147904,CDC Study: Pregnant Women’s Vaccination Protects Baby From Covid HospitalisationmRNA vaccines are 61% effective at preventing Covid-19 hospitalisation in babies less than six months old whose mothers were vaccinated during pregnancy.https://t.co/15JLZR7w6G,en
2022-02-21 09:18:33+00:00,340681610,Debate erupts over off-label COVID-19 vaccine use for children under the age of five https://t.co/j3rvvLSVpX #trending,en
2022-02-21 09:18:12+00:00,1545915336,Did you test positive for #COVID19? You can take COVID-19 #vaccine 💉 3⃣ months after recovery. You must complete your COVID-19 vaccination.Get #vaccinated and continue to take all preventive and precautionary measures. #DoItAll #StopTheSpread https://t.co/cMQmzpOJ67,en
2022-02-21 09:17:23+00:00,1948120669,"@FortunaDecoris @ReutersFacts literally the first line in the article. ""Neither Canadian Prime Minister Justin Trudeau nor his family’s Pierre Elliott Trudeau Foundation have any shares in a Vancouver-based biotechnology company that produces a key component of Pfizer/BioNTech’s COVID-19 vaccine.""c'mon..",en
2022-02-21 09:16:26+00:00,543373086,The Covid-19 vaccine clinic at Bath Racecourse is closed again today.Keep an eye on our socials for an update about opening times tomorrow.,en
2022-02-21 09:16:04+00:00,1191453230661808129,"The protesters initially wanted an end to cross-border COVID-19 vaccine mandates for truck drivers, but the blockade turned into a demonstration against Trudeau and the government.https://t.co/vp70oeUfG8",en
2022-02-21 09:16:02+00:00,24291371,"COVID-19 vaccines, rentable businesses in US https://t.co/9fbALvkaom",en
2022-02-21 09:15:37+00:00,38400130,"Hong Kong maps terms of COVID-19 vaccine pass, with some exemptions https://t.co/lqXr6cgiHs https://t.co/nhL89EQtbq",en
2022-02-21 09:15:22+00:00,234684376,"Hong Kong confirms more than 7,500 Covid-19 cases, and 16 additional deaths, including an 11-month-old girl; vaccine pass to launch in days https://t.co/2p27Mwej3B via @scmpnews",en
2022-02-21 09:15:06+00:00,236770150,Italy recommends fourth COVID-19 vaccine dose for immunocompromised https://t.co/5Jy2WAdW6S #Health https://t.co/eQQT8822Zi #news 224,en
2022-02-21 09:15:05+00:00,126035915,"Got questions about the COVID-19 vaccine &amp; fertility? On Tuesday 22nd Feb at 4-5pm, @SWLNHS are hosting an information &amp; Q&amp;A session to discuss reproductive health &amp; the vaccine. You can register ahead 👉 https://t.co/tyqxyu4pbE or join us on this link 👉 https://t.co/q2knCb4L9p. https://t.co/csJSSSteQL",en
2022-02-21 09:14:35+00:00,830951414,"#Egypt is close to exporting COVID 19 vaccines to African countries, and is negotiating with vaccine companies for local manufacturing.",en
2022-02-21 09:13:32+00:00,988367904373706752,Buhari Excited As Nigeria Becomes 1 Of 6 COVID-19 Vaccine Manufacturing Bases In Africa https://t.co/JbZhyGI1mH,en
2022-02-21 09:13:22+00:00,76591376,The free Covid-19 vaccine saves lives and protects you from serious illness. Find your nearest walk-in centre: https://t.co/HhjmjyR21s #CovidCautious https://t.co/VBNVvM4uGU,en
2022-02-21 09:12:12+00:00,992685218,Fact sheet for interim authorization of the Pfizer-BionTech Covid-19 Vaccine https://t.co/CacXVSxLDi,en
2022-02-21 09:11:21+00:00,3988172242,Autoimmune hepatitis after COVID-19 vaccine #sciencedirect#montagnier keeps on being right. https://t.co/m25i56BYzO,en
2022-02-21 09:11:16+00:00,842887866,".@people_vaccine invites you to a webinar this Thursday, which is part of a series of activities leading to the 2nd year commemoration of the @WHO declaration of COVID-19 as a global pandemic. #PeoplesVaccine https://t.co/gIYIOSFxBL",en
2022-02-21 09:10:19+00:00,2527218818,"Nearly 2 lakh pregnant women have received the Covid-19 vaccine and none of them had major side effects. Hydration, paracetamol and a good diet can help pregnant and nonpregnant women overcome minor side effects.Vaccination can protect you and your baby! https://t.co/aKmuzFEAvy",en
2022-02-21 09:08:18+00:00,283604227,"Andy Vermaut shares:Hong Kong maps terms of COVID-19 vaccine pass, with some exemptions https://t.co/BZ0OilFaMb Thank you. https://t.co/O39AIq3kQ8",en
2022-02-21 09:07:59+00:00,1485235128708308994,@usembislamabad We can’t forget US COVID -19 vaccine donations repeatedly to eliminate this menace from Pakistan. Thanks USA.,en
2022-02-21 09:07:52+00:00,147548693,The COVID-19 vaccine made in China has created a virus that does not work. The Chinese are the enemy of mankind.,en
2022-02-21 09:06:51+00:00,37924397,"BA.2 Omicron Subvariant Possibly Severe As Delta, Lab Studies ShowLab research from Japan also shows BA.2 can evade vaccines, but a booster is 74% effective against symptomatic Covid-19 infection.Get boosted. Sarawak detected BA.2 in Kapit on Feb 6.https://t.co/TrehSQBQ8O",en
2022-02-21 09:05:38+00:00,1326561978308059137,"On https://t.co/wrYHBbPfcR : Hong Kong maps terms of COVID-19 vaccine pass, with some exemptions https://t.co/VmZMnQU9mF Join NewsPlayer+ #breakingnews #news #newsplayerplus",en
2022-02-21 09:05:33+00:00,849293340,AU-EU Summit: Ramaphosa refuses to budge on TRIPS waiver for Covid-19 vaccine manufacturing https://t.co/aqpGgRtbqI Includes some info on his discussion with Scholz on the waiver issue.,en
2022-02-21 09:05:23+00:00,213927131,LRT-1 and LRT-2 set up vaccination sites in selected Stations. Individuals 18 years old and above can now get their first dose or the booster Covid-19 vaccineMORE:https://t.co/jDk26zltvO #Covid19 #Covid19vaccine #Vaccine #DepartmentOfTransportation #LightRailTransit #DOTR,en
2022-02-21 09:03:21+00:00,1340022506,COVID-19 vaccine boosters percent - really interesting list ! https://t.co/5pea2h4Ek1,en
2022-02-21 09:03:20+00:00,938800345236439040,"Delhi administered only 9,503 Covid-19 vaccine doses on Sunday, which officials said was due to a saturation across all age groups, including children and those aged between 18 and 44.https://t.co/o2MxENqhpU",en
2022-02-21 09:02:44+00:00,1018935563402055681,I GOT MY COVID-19 VACCINE! https://t.co/3TvnYqeHgN,en
2022-02-21 09:02:06+00:00,768466040661635072,Covid 19 - the latest on vaccines &amp; boosters available to view for free on You Tube from - The ITP Support Association UK - YouTube https://t.co/bQCKWGR6jT,en
2022-02-21 09:01:34+00:00,21888511,"Do you have questions or concrns about getting your COVID-19 vaccine?Talk confidentially to a doctor from our vaccination advice service, who will be able to answer your questions.To book an appointment call us on 020 4506 8840 https://t.co/UzcHtBo8oQ",en
2022-02-21 09:01:00+00:00,2331761587,"There are two essential vaccines that you may need this winter ❄️- flu and COVID-19 booster 💉 Vaccines are the best way to protect yourself, friends and family from these dangerous viruses. Find out if you’re eligible now at https://t.co/xd0DnqYG2n https://t.co/xTQnknC2jE",en
2022-02-21 09:01:00+00:00,1845441302,"There are two essential vaccines that you may need this winter ❄️- flu and COVID-19 booster 💉 Vaccines are the best way to protect yourself, friends and family from these dangerous viruses. Find out if you’re eligible now at https://t.co/NbIfqeZqk3 https://t.co/jLhtSuYhWb",en
2022-02-21 09:01:00+00:00,345912345,"Every adult in the country now needs to get a Covid-19 booster vaccine, because two doses does not give you enough protection against catching Omicron.https://t.co/dsocBaUFAg+ https://t.co/er050YP6Aw",en
2022-02-21 09:00:45+00:00,72841956,Vaccines are the best protection we have against dangerous viruses like flu and COVID-19.Find out if you’re eligible for these two essential vaccines now at https://t.co/6x3qbk6ERm https://t.co/hhdAJsnLj9,en
2022-02-21 09:00:36+00:00,100453427,"Meet Justine, a Deaf Counsellor from Exeter sharing that she got the vaccine to protect herself, her family and others. 💉If you haven't had your COVID-19 vaccine yet, make sure to find a walk-in here https://t.co/fhKzPizOKq ➡️Book yours today https://t.co/KEggnPW6Hg https://t.co/43thgW3SBE",en
2022-02-21 09:00:31+00:00,419664131,#Hipra's vaccine for #COVID-19 enters its final trial phase. The #vaccine will now be tested on more volunteers.https://t.co/7iJrl9bO3y,en
2022-02-21 09:00:19+00:00,393343766,"12-15 year olds can get the COVID-19 vaccine at clinics across Leeds this half-term, including a pop up at the Trinity Centre. For details, see https://t.co/Ywz5ibxRyH https://t.co/kgpeQTaGQ3",en
2022-02-21 09:00:18+00:00,557036574,"This week please pop by one of our Covid-19 Vaccination Walk-In clinics if you have not yet had your first, second or booster vaccine!💉 💙 See you there!Details on which clinics are open here: https://t.co/5gwiXvVC2v https://t.co/U20Av5rFPo",en
2022-02-21 09:00:14+00:00,1216047747243094017,Italy recommends fourth COVID-19 vaccine dose for immunocompromised https://t.co/W8DymjAhb1 #Health https://t.co/F4vknBvP9i #news 369,en
2022-02-21 09:00:06+00:00,1492680947422330880,"""Prime Minister Jacinda Ardern insists she was 'absolutely not' responding to the Parliament protesters by outlining a plan to ease COVID-19 vaccine mandates."" https://t.co/i6zjifBfWI",en
2022-02-21 09:00:01+00:00,87791167,Kenya: Inside top secret Covid-19 vaccine smuggling racket https://t.co/oYBanmfGnl,en
2022-02-21 09:00:01+00:00,1194652989266354176,Most Nepalese received 1st&amp;2nd doses of Chinese #verocell vaccines agsnt Covid-19. And now we r receiving #Pfizer #Pfijer vaccines for booster. Wil it be effective and not have any side effects? @WHO @WHONepal ?,en
2022-02-21 09:00:01+00:00,4832329984,"Grab a jab at Bootle Cricket Club today!Over 18s can get their first, second or booster COVID-19 vaccines from 10am-4pm today and on 28 February. The vaccine gives you a strong immune response, without the damaging effects of the infection. https://t.co/zdU7c7EBAg https://t.co/QFsizUnc9o",en
2022-02-21 08:59:58+00:00,236770150,Italy recommends fourth COVID-19 vaccine dose for immunocompromised https://t.co/5Jy2WAdW6S #Health https://t.co/eQQT8822Zi #news 369,en
2022-02-21 08:58:54+00:00,958451994242572289,NOW PLAYING: Ad Council &amp; NAB - COVID-19 Vaccine PSA 6 - English (15sec). See the last 10 songs we played and listen 24/7 at https://t.co/TkjqT5omHb. #collegeradio #ccri,en
2022-02-21 08:58:35+00:00,2818927941,Petition: Don't offer covid-19 vaccine to 5-11 year olds until phase 3 trials complete https://t.co/qBRtS86edb,en
2022-02-21 08:58:24+00:00,767641086323863553,Former top doc says covid-19 vaccine mandates no longer needed in WA. #perthnews https://t.co/7WIjeamCJi,en
2022-02-21 08:57:42+00:00,1143314368161075200,The US and global COVID-19 vaccine equity https://t.co/UNouGqbrs9,en
2022-02-21 08:57:24+00:00,43483262,Explained: What's going on with Covid-19 vaccines for children under 5? - The Indian Express https://t.co/YX93mhjfpl,en
2022-02-21 08:56:53+00:00,1264922120,"'to force suspect mandatory Covid-19 vaccines on the British public turns us all into involuntary human experiments. This contravenes the Nuremberg Code, written after Nazi doctors were put on trial for performing their medical experiments on concentration camp prisoners.'",en
2022-02-21 08:55:22+00:00,716139887,"💉 With this week being the half term break in Shropshire, Telford and Wrekin, give yourself and your family extra reassurance and get your Covid-19 vaccines.  Visit https://t.co/puqz0KKmBQ to find your nearest walk in option or book your appointment. You can also call 119. https://t.co/uC0MclBv5L",en
2022-02-21 08:53:16+00:00,1320728211156881408,"🍋SHOT OF THE DAY | 21/02/2022🍋In today's shot of science on #COVID19: ""Neutralization of SARS-CoV-2 Omicron by BNT162b2 mRNA vaccine-elicited human sera""We summarised the article for you! Access here➡️https://t.co/8gDjdLF4ek#MedTwitter #MedEd #Covid_19 #COVID https://t.co/AVWICcmbKC",en
2022-02-21 08:52:56+00:00,1224643780730445824,"Over 11.18 cr COVID-19 vaccine doses available with States, UTs – ET HealthWorld https://t.co/quem6BxXKz",en
2022-02-21 08:52:39+00:00,71592661,"“The developing world has to learn some lessons from our past 18 months of experience in access to Covid-19 vaccines. The reality is that you will get a few minor donations, but the rest of the stuff is going to cost you money, which was the case as far as [SA was] concerned,”",en
2022-02-21 08:52:37+00:00,3198041813,"Since the start of 2022, over 50,000 children aged 5 to 11 have been infected with COVID-19. 🇲🇾#MashableSEA #Malaysia #COVID19 #Vaccinehttps://t.co/PSPmwRpdEU",en
2022-02-21 08:52:10+00:00,39239938,News: County council praised for Covid-19 vaccine rollouthttps://t.co/KFb2pE3Qqq,en
2022-02-21 08:49:47+00:00,159748045,Capetonians stage own freedom convoy against Covid-19  restrictions and vaccine mandates https://t.co/3fFtLxlpUs,en
2022-02-21 08:48:05+00:00,44900997,Medical professionals give divergent views on COVID-19 vaccine production https://t.co/3hi411VYZ9,en
2022-02-21 08:47:42+00:00,1347792909312139266,@lbb1970 Petition: Don't offer covid-19 vaccine to 5-11 year olds until phase 3 trials complete https://t.co/aeZTObOdaK,en
2022-02-21 08:47:30+00:00,1347792909312139266,@ShamezLadhani Petition: Don't offer covid-19 vaccine to 5-11 year olds until phase 3 trials complete https://t.co/aeZTObOdaK,en
2022-02-21 08:46:42+00:00,96549745,That’s quite a timeline 😳#COVID19 #Pharma (only one with True immunity…from Liabilities… I hadn’t heard about Post #vaxx Covid-19 and then saw on @Gutfeldfox @KatTimpf and the @dagenmcdowell got 2+2=2 vaccines and Covid-19 x 2. #rna https://t.co/lunbxDv6Kz,en
2022-02-21 08:45:56+00:00,49640359,The first @scotent grant of up to £12.5m will support research and development related to @valnevaSE's Covid-19 vaccine candidate https://t.co/lQ4IVA6we7,en
2022-02-21 08:44:22+00:00,40818836,@SpeakerPelosi @DrTedros Lets help people in less developed countries vaccinated with Covid-19 vaccines.,en
2022-02-21 08:43:44+00:00,360024367,"Over 11.18 cr COVID-19 vaccine doses available with States, UTs – ET HealthWorld https://t.co/XyuOXzslqd",en
2022-02-21 08:42:04+00:00,711020052,"@hand_to_eye @smenor I’m not against vaccines generally. We are talking about COVID 19 vaccines only, as a continued and mandatory Public Health measure that required of all workers as a means to redress the pandemic.",en
2022-02-21 08:41:47+00:00,396667365,"New lab experiments from Japan show that BA.2 may have features that make it as capable of causing serious illness as older variants of Covid-19, including Delta. It appears to largely escape the immunity created by vaccines. https://t.co/XPWAAlGD3P @CNN",en
2022-02-21 08:40:33+00:00,2182990690,Is Covid-19 HIV? Have they been using vaccines to destroy our immune systems all along? https://t.co/C69p54c2s0 via @BitChute,en
2022-02-21 08:40:10+00:00,236770150,Italy recommends fourth COVID-19 vaccine dose for immunocompromised https://t.co/5Jy2WAdW6S #Health https://t.co/eQQT8822Zi #news 981,en
2022-02-21 08:40:06+00:00,236770150,Italy recommends fourth COVID-19 vaccine dose for immunocompromised https://t.co/5Jy2WAdW6S #Health https://t.co/eQQT8822Zi #news 768,en
2022-02-21 08:39:19+00:00,266805738,Some COVID-19 vaccines could increase HIV risk: researchers https://t.co/t2nMUXmYS1,en
2022-02-21 08:38:42+00:00,1039903207,Valneva receives 12.5 mln pound COVID-19 vaccine manufacturing grant in Scotland https://t.co/yuK0efBEiR https://t.co/JwGY343IlT,en
