date,userid,tweet,lang
2022-12-30 06:30:26+00:00,1538518014253010947,"TB and COVID-19 vaccine awareness creation activities are continued at Addis Ababa,Harar&amp;DireDawa). we have distributed Brochures &amp; Flayers in the banks located in Addis Ababa targeting customer service providers and their customers.#USAID_UrbanTBLONActivity https://t.co/8czLRjcaek",en
2022-12-30 06:30:09+00:00,1506982275535470598,"@drishtiiaseng C. Both 1 and 2COVAXIN: It is India’s only indigenous Covid-19 vaccine.Produced By:Developed by Bharat Biotech, Hyderabad in collaboration with the Indian Council of Medical Research’s National Institute of Virology, PuneConstituents and Action:",en
2022-12-30 06:30:06+00:00,1010897337361694720,"The Department of Health (DOH) is drafting the guidelines for the bivalent vaccines against coronavirus disease 2019 (Covid-19) as talks with Moderna and Pfizer are underway, DOH officer-in-charge Maria Rosario Vergeire said Thursday. https://t.co/tElxVAqbDH",en
2022-12-30 06:29:53+00:00,1262330791364870144,From 'vaccine nationalism' to a global governance failure. My take on what's going on with China's new approach to covid-19.@DomaniGiornaleLa zero covid policy appena revocata si è ritorta contro la Cina: cosa sta succedendo https://t.co/jZP8Ua4dcg,en
2022-12-30 06:29:30+00:00,1527864852844367872,Herpes vaccine tests underway by company that made COVID-19 vaccines – Salon https://t.co/2t4RAJmUpq,en
2022-12-30 06:28:53+00:00,24155013,@poet_this @meredithmusing Effectiveness of the Coronavirus Disease 2019 (COVID-19) Bivalent Vaccine | medRxivhttps://t.co/Xwd5cUoAx1 https://t.co/I1IimwCyeA,en
2022-12-30 06:28:15+00:00,1499224600764243973,Effectiveness of mRNA BNT162b2 COVID-19 vaccine up to 6 months in a large integrated health system in the USA: a retrospective cohort study - The Lancet https://t.co/FTEErBfRfY,en
2022-12-30 06:27:20+00:00,636319456,"@kijomba1 It's become a business. Within no time , there is a vaccine for COVID-19, but not for cancer, HIV, and many ...",en
2022-12-30 06:22:38+00:00,1598398509987889171,"@AutismCapital or possibly any other virus. So let's watch the ""real"" pandemic begin now! In its Week 42 ""COVID-19 Vaccine Surveillance Report"", the UK Department of Health admits on page 23 that ""N antibody levels appear to be lower in people who become infected after two doses of vaccination""",en
2022-12-30 06:22:32+00:00,1489958961365536770,U.S. sends COVID-19 vaccines worldwide [rolling updates] https://t.co/ta8EMw6Q8n via @ShareAmerica,en
2022-12-30 06:21:14+00:00,1298723559682895883,Moderna says U.S. on the hook in COVID-19 vaccine patent case | Reuters   Guess who is representing big Pharma ? Kirkland &amp;E 💁🏼‍♀️ https://t.co/L3FbZjF6jU,en
2022-12-30 06:17:19+00:00,1091134547054473217,"Fact Check-VAERS data does not suggest COVID-19 vaccines killed 150,000 people, as analysis claims https://t.co/mpiPQ2vSx0",en
2022-12-30 06:17:16+00:00,1330487908655112201,"COVID-19 Vaccine Induced Axillary Lymphadenopathy, by @P_McCulloughMD https://t.co/mm5qUJtw9T",en
2022-12-30 06:14:16+00:00,1594362983102169088,"@MsTrixter @BlaylockMooky @Michael94173566 @1D10Two @AveryJames33 @ADevotedYogi @WebGuyTV @Unity_Coach @mpc_xetts @Ravi1236541 @MikeinHalifax @Tdillon06 @delboy00789 @andrew7rd @umfpt @trevormarr1 @Reneep43 @EarthOne_13 @RBarker0341 @Mummymobbsback1 @teamphil @AltavozMagalong @SteveBuckeye23 @TakethatCt @TruthPyRate @CoryRove @DHasper @mjoyce1950 @LauriHWilliams @GeezercitizenX @cha0te @skullapple27 @dray3time @LifechoiceN @arduatendit @BlasphemousBan1 @somedude710 @ZenTigerNZ @Justin00Wilton @mario19795947 @ana_viosi @F3_Haskell @aka_c00lest @Scary7Dr @Wolf_ofthe_West @KrugersDragon @stephenHarper9 @luvthmgators @ArtysHouse @Quoimio Let me get this straight. We're sitting here telling you that COVID-19 and the vaccines are bioweapons designed by the NIH, CDC, WHO . . .. . . and you're going to cite . . . the CDC to debunk me?LMFAO.1/",en
2022-12-30 06:13:24+00:00,1409027758164959232,COVID-19 Vaccine Induced Axillary Lymphadenopathy https://t.co/Egz8kHaDoq,en
2022-12-30 06:13:14+00:00,1535402397702295552,Department of Defense formally rescinds COVID-19 vaccine mandate for military | Just The News https://t.co/lodzeXA9jw,en
2022-12-30 06:13:12+00:00,1213630845556125696,Tu elección COVID o más COVID con miocarditis.  New Study Found A 9-Times Increased Rate Of Myocarditis In Males After mRNA Booster | 3 Or More COVID-19 Vaccine Doses Associated With A 6-Fold Increased Risk Of Infection Said Cleveland Clinic | ETC https://t.co/dNG1DqJjyc,en
2022-12-30 06:12:17+00:00,21039123,@CharlieTBeagle @DaRealMoK @drsimonegold @TomiLahren Governor Ron DeSantis' attempt to convene a statewide grand jury to investigate any and all wrongdoing in Florida with respect to COVID-19 vaccines is nothing short of a political circus. It's completely meaningless and will uncover nothing and cost Floridians millions.,en
2022-12-30 06:11:30+00:00,634952572,New law ends COVID-19 vaccine mandate for US troops | AP News https://t.co/90QksfyyOG |||,en
2022-12-30 06:10:43+00:00,46068140,Vaccines | Free Full-Text | A Possibility of Vasospastic Angina after mRNA COVID-19 Vaccination https://t.co/MS7v9vwMaX,en
2022-12-30 06:10:11+00:00,946956090935267328,"@Iran_GOV In other words, the Iran health ministry announced a bunch of lies. Typical. Your negligence and refusal to import Covid-19 vaccines killed our loved ones. You have the blood of so many Iranians on your hand. Your end is near.",en
2022-12-30 06:09:58+00:00,752475870,"For the love God, do not give this untested, toxic and lethal vaccine to your young children. The risks of the vaccine far outweigh the risks of children getting COVID-19…they are the least affected by the virus.",en
2022-12-30 06:09:47+00:00,1428128060784537600,For those that are still alive and have functioning hearts. The Moderna COVID-19 vaccine (mRNA-1273) clinical trial for this ends today - thankyou for participating. https://t.co/UYsROYLEWv,en
2022-12-30 06:09:37+00:00,113949656,"Read ""'Waste of taxpayer money': Experts 'baffled' by DeSantis' COVID-19 vaccine investigation' on SmartNews: https://t.co/LlkluGbBae",en
2022-12-30 06:09:27+00:00,937574413590863872,"@nathaliejacoby1 I don't think covid-19 vaccines are safe, I know for a fact that they are safe.",en
2022-12-30 06:08:39+00:00,187447305,"But, in October. So which is it?""It (bivalent Covid-19 vaccine) is a new vaccine from Pfizer. There is no additional procurement, but it will replace the existing orders of the old vaccines.https://t.co/Uy9EVgLFyG",en
2022-12-30 06:06:38+00:00,1310327040206348289,COVID-19 vaccine boosters for young adults: a risk benefit assessment and ethical analysis of mandate policies at universities | Journal of Medical Ethics https://t.co/5jg7CE85Gk,en
2022-12-30 06:05:54+00:00,1453813038696615937,"@DefiantLs scum would be walking on top of children if God forbid, Covid-19 was hemorrhagic like ebola and a vaccine of 2 seconds existed.  What's hilarious are blonde women howling about the vaccine injecting botox in their faces. Botox is botulism. Toxin",en
2022-12-30 06:05:19+00:00,983637695443288064,"Interactive sessions were held for the students regarding COVID-19, viral diseases, various vaccine preventable diseases and the universal immunization program. #@AzadikaAmritMahotsav; #@ICMRDELHI",en
2022-12-30 06:02:28+00:00,4435376173,@choozin2Bhere @DrKatEpi @elonmusk There are plenty of studies that prove some vaccines were 95% effective against the original Covid 19. There was studies showing that it was 80% effective against Delta. There was Fauci spreading misinformation about all of it based on politics and not science which lead to rumor,en
2022-12-30 06:01:31+00:00,1493730163380555776,"https://t.co/BPHaMTkbsO ""Booster mandates in young adults are expected to cause a net harm: per COVID-19 hospitalisation prevented, we anticipate at least 18.5 serious adverse events from mRNA vaccines""",en
2022-12-30 06:00:51+00:00,1346336915612549120,@HansMahncke @RobertKennedyJr @Covid19Critical #aflds #thomasrenz #infowars Well done. Warm wishes and appreciation to all voices of truth in their ongoing quest.Department of Defense formally rescinds COVID-19 vaccine mandate for militaryhttps://t.co/qVYehOpGLK,en
2022-12-30 06:00:11+00:00,1483985932327997440,@AmitAryaMD It’s almost like the vaccines made COVID-19 deaths worse not better. And this isn’t even factoring in the mRNA vaccine deaths.,en
2022-12-30 05:59:42+00:00,1587312455172120576,En sejr 🥳Judge Approves Historic 10M Settlement for Health Care Workers Fired Over COVID-19 Vaccine Mandate | CBN News 🥊#Vaccinemandate https://t.co/7uyveHm0Am via @CBNNews,en
2022-12-30 05:59:09+00:00,1574886303413542933,@PierrePoilievre @JustinTrudeau @CPHA_ACSP @ICCT_TheHague @UN Cheap Ivermectin and Hydroxychloroquine could have stoped Covid 19 dead in it's tracks if not for greed and arrogance.Big Pharma lied to sell vaccines they knew good and well were not safe or effective.Canadian🇨🇦 https://t.co/sP9tXAzsGW,en
2022-12-30 05:57:35+00:00,1604287018711896064,@BigunsWorld @prophetofTNT @TheNBACentral @thecomeback Except that's not what happened. mRNA vaccines have been studied for quite some time. It's safe. Developing one specifically for a COVID 19 variant came down to identification of proteins. You can test the effectiveness relatively quickly.,en
2022-12-30 05:57:27+00:00,938041501132738561,New Study Found A 9-Times Increased Rate Of Myocarditis In Males After mRNA Booster | 3 Or More COVID-19 Vaccine Doses Associated With A 6-Fold Increased Risk Of Infection Said Cleveland Clinic | ETC https://t.co/NFsbIKkAFh,en
2022-12-30 05:57:10+00:00,272290840,"@RWMaloneMD “One of the first large studies to compare deaths,hospitalizations,&amp; ER visits among COVID-19 vaccine recipients versus those who were infected shows vaccines were more effective in preventing negative outcomes...The study appears in the American Journal of Public Health.",en
2022-12-30 05:55:58+00:00,64132995,#Maharashtra facing a shortage of #Covid-19 vaccines @KDMCOfficial doesn't have stock of vaccine @mieknathshinde @TanajiSawant4MH @SanjeevScribe @ranjeetnature @rajplexus @diptivsingh @PrajaktaKasale https://t.co/2UZ0u2HwuB,en
2022-12-30 05:55:00+00:00,55186601,"#NSTnation The elderly, patients with comorbidities and people at risk of Covid-19 symptoms and complications may walk-in at any public health clinic or hospital starting Jan 9 to receive the vaccine. #Covid19 #Coronavirus #Vaccines https://t.co/7ZI3KaHPpr",en
2022-12-30 05:48:27+00:00,1406719234907021317,Can we speed up #Nuremberg2 ? We have no time to waste. #vaccines #DiedSuddendly #diedsuddenly #Covid_19 #vaccines #vaccine #VaccineDeaths #Vaccinemandate #vaccini #Vaccin #VaccineDevelopment #FauciLiedMillionsDied #FauciFiles #TwitFi #TwitterFiles #twitterfiles3 #USA #Trending,en
2022-12-30 05:48:17+00:00,27404490,"Additionally, surveillance for Covid-19 will also include testing samples of wastewater from planes coming from China — where they will be sent for PCR test and genome sequencing if tested positive for Covid-19.#Malaysia #News #covid19 #vaccine #health #MoH #china #travel https://t.co/6y9GbuCM3t",en
2022-12-30 05:48:03+00:00,1364475780,SARS-CoV-2 infection history and antibody response to three COVID-19 mRNA vaccine doses https://t.co/W9APqb7Jvc,en
2022-12-30 05:44:33+00:00,159033803,"𝗖𝗼𝘃𝗶𝗱-𝟭𝟵 𝘃𝗮𝗰𝗰𝗶𝗻𝗲 𝗳𝗼𝗿 𝗰𝗵𝗶𝗹𝗱𝗿𝗲𝗻 𝗯𝗲𝗹𝗼𝘄 𝗳𝗶𝘃𝗲 𝘁𝗼 𝗰𝗼𝗺𝗲 𝘀𝗼𝗼𝗻Nima Wangdi  Health ministry is collecting information about children between the ages of six months and five years, and those with chronic diseases for the Covid-19 vaccine.",en
2022-12-30 05:43:25+00:00,1364475780,SARS-CoV-2 infection history and antibody response to three COVID-19 mRNA vaccine doses https://t.co/6sLQDYwy6calexandrossfakianakis shared this article with you from InoreaderSARS-CoV-2 infection history and antibody response to three COVID-19 mRNA vaccine dosesvia Clini…,en
2022-12-30 05:42:14+00:00,55054823,‘Waste of taxpayer money’: Experts ‘baffled’ by #Deathsantis’ COVID-19 vaccine investigation https://t.co/7mrT0X73by #SmartNews,en
2022-12-30 05:41:50+00:00,1474630031611736067,Go ahead and take that nonsense of COVID-19 VACCINES at your own risk. #DiedSuddendly #Pfizer #VaccineDeaths,en
2022-12-30 05:41:40+00:00,1468725847485935618,"German Autopsy Report Attributes Three Sudden Deaths to Covid-19 Shot""About half the cases [of vaccine-induced myocarditis], there are no initial symptoms. The first manifestation is [often] sudden death found at home,"" warned Dr. McCullough. https://t.co/hgEOe0z58c",en
2022-12-30 05:41:16+00:00,22983450,"@tinyGammaGeek @AwakenWithJP Same could be said for vaccines. It’s sad to think about all the far right extremists that have perished of Covid-19 just because they didn’t want to get the “insurance”, *cough* I mean vaccine. https://t.co/w5N1rIljkc",en
2022-12-30 05:40:12+00:00,1550395834520326146,Judge Approves Historic 10M Settlement for Health Care Workers Fired Over Covid-19 Vaccine Mandate https://t.co/4KqjHdk0Vo,en
2022-12-30 05:34:02+00:00,55118669,"The government can still continue the rollout of vaccines if President Ferdinand ""Bongbong"" Marcos Jr. decides against the extension of the state of calamity due to COVID-19, but it cannot purchase additional doses, the Department of Health said Friday.https://t.co/kHN5Eo7ZA8",en
2022-12-30 05:33:50+00:00,1177015459469758464,"@csbritt63 I agree with you 💯%! Dr. Fauci IS that little prick! He brought down the presidency of Donald Trump along with Bill Gates! He’s been pushing the covid-19 vaccines that have side effects, and he’s part of that Great Reset! Dr. Fauci NEEDS to be brought down and put into jail!",en
2022-12-30 05:32:03+00:00,1586164050727239684,"@lindaholmes Read your post. Rand Paul posted this.  Just info; “The higher the number of vaccines previously received, the higher the risk of contracting COVID-19.” 🤔 hmmm? No other context.",en
2022-12-30 05:31:07+00:00,243499425,"Exciting times in healthcare!The advances in mRNA vaccines have been revolutionary in the fight against COVID-19, and now BioNTech is bringing this same technology to the fight against herpes simplex virus. These mRNA vaccines op…https://t.co/UCPSoPCtoV https://t.co/0G6qmVtlwF",en
2022-12-30 05:31:05+00:00,342066385,&amp;quot;Mild &amp;apos;Covid-19&amp;apos; Isn&amp;apos;t Linked To Heart Disease Or Strokes&amp;quot; The &amp;apos;MRNA&amp;apos; &amp;apos;Covid19&amp;apos; Vaccines Are! https://t.co/o1rrKjWRM4,en
2022-12-30 05:30:45+00:00,709947536,You may soon have to pay for antiviral medication to fight COVID-19 - WXYZ 7 Action News Detroit-- News | The Perfect Enemy: https://t.co/Mp0c21ry8h.#PrivateInsurance #PublicHealth #Vaccines https://t.co/IEaSZuAJCf,en
2022-12-30 05:30:34+00:00,37716311,York County COVID-19 vaccine clinic shutting down - WMTW Portland-- News | The Perfect Enemy: https://t.co/HaylGnAHBV.#Coverage #Vaccines https://t.co/D28s9nSMxP,en
2022-12-30 05:30:24+00:00,37716311,You may soon have to pay for antiviral medication to fight COVID-19 - WXYZ 7 Action News Detroit-- News | The Perfect Enemy: https://t.co/dwh5YLCVPk.#PrivateInsurance #PublicHealth #Vaccines https://t.co/wx5UzFhGZs,en
2022-12-30 05:30:22+00:00,709947536,York County COVID-19 vaccine clinic shutting down - WMTW Portland-- News | The Perfect Enemy: https://t.co/B548iC9HdF.#Coverage #Vaccines https://t.co/3Dhr18PHZ5,en
2022-12-30 05:29:00+00:00,1121529148726554626,Top Japanese Physician-Scientist Gives Dire Warning About COVID-19 mRNA Vaccines: ‘Scientifically Misconceived’ https://t.co/4lekz06NkC,en
2022-12-30 05:27:19+00:00,815341843428687872,#WINNING!Department of Defense formally rescinds COVID-19 vaccine mandate for military https://t.co/D4RhEqtTfm via @JustTheNews,en
2022-12-30 05:25:32+00:00,1025792965954949120,"@DrTomFrieden Single strand viruses like the flu, HIV and COVID-19 don't have vaccines. Impossible.",en
2022-12-30 05:24:11+00:00,1395757478806052864,"India isolates BF.7 strain, to test efficacy of Covid-19 vaccines https://t.co/r0eVAD2DYb",en
2022-12-30 05:23:43+00:00,422078695,"So, basically, Covid 19 was not the bio weapon. The vaccines were. Let that sink in.",en
2022-12-30 05:21:13+00:00,1445000873726332941,⚠️Natural immunity vs. vaccine-induced immunity to COVID-19 To better explain what mRNA shots do to your immune system#Pfizer #mRNA #Nuremberg2 #StoptheShots #diedsuddenly https://t.co/gpbLcRrVG1,en
2022-12-30 05:20:51+00:00,345034745,"@RandPaul Did you read the study or cherry-pick one line? I suggest you delete it immediately.""In conclusion, this study found an overall modest protective effect of the bivalent vaccine booster against COVID-19, among working-aged adults."" In other words, better to have vaccinated.",en
2022-12-30 05:16:09+00:00,162927796,@MrWojna @johnrackham82 Biden made the mistake of saying if you get the vaccine you won't catch covid thats a lie. The vaccine is to fight off the symptoms that covid 19 gives you,en
2022-12-30 05:15:24+00:00,1461080715957788688,‘Waste of taxpayer money’: Experts ‘baffled’ by DeSantis’ COVID-19 vaccine investigation https://t.co/4q7BspwHt9 #SmartNews,en
2022-12-30 05:14:57+00:00,1483808467345625089,"#COVID #Covid_19Expert #Allopathic #Doctors based on experience/post vaccine complications in the USA advising WORLD not to take Covidvaccines as they are harming the human body,Alternative Medicine is best,pls call 6284022613 @htTweets @ANI @MoHFW_INDIA @e_health_ @timesofindia",en
2022-12-30 05:14:25+00:00,895327070376546304,Top Japanese Physician-Scientist Gives Dire Warning About COVID-19 mRNA Vaccines: ‘Scientifically Misconceived’ https://t.co/M0Mh5seEwm,en
2022-12-30 05:14:11+00:00,1528889558620078080,"The development of the pandemic during the past year or so has made it clear they were probably right. It is now evident that the COVID-19 vaccines do little to protect against infection, and in fact,  https://t.co/MkTPfkN170 via @LD_Sceptics",en
2022-12-30 05:12:30+00:00,626391901,New law ends COVID-19 vaccine mandate for US troops | AP News https://t.co/HYU19cQK9L |||,en
2022-12-30 05:11:10+00:00,1548770761367625728,SK bioscience’s COVID-19 vaccine approved for use by Republic of Korea - IVI. https://t.co/fmj4TUyFP0,en
2022-12-30 05:09:26+00:00,128282557,The Lancet tiene otros datosInterpretationThe Cuban Abdala protein subunit vaccine was highly effective in preventing severe illness and death from COVID-19 under real-life conditions.https://t.co/v3ONjrqXcN,en
2022-12-30 05:08:36+00:00,1486709731934670859,"Re-post due to competing story: Li et al.: ""Intravenous Injection of Coronavirus Disease 2019 (COVID-19) mRNA Vaccine Can Induce Acute Myopericarditis in Mouse Model""; in vivo evidence that https://t.co/yVoth3kjVt",en
2022-12-30 05:08:19+00:00,102819146,@edelamadrid @DrPacoMoreno1 The Cuban Abdala protein subunit vaccine was highly effective in preventing severe illness and death from COVID-19 under real-life conditions. https://t.co/HoTEuBsRhR,en
2022-12-30 05:07:47+00:00,128282557,@DrPacoMoreno1 The Lancet MIENTE entonces Dr?InterpretationThe Cuban Abdala protein subunit vaccine was highly effective in preventing severe illness and death from COVID-19 under real-life conditions.https://t.co/v3ONjrqXcN,en
2022-12-30 05:05:31+00:00,71515126,COVID-19 vaccine patent battles continue into 2023 https://t.co/69zeXUIsKy,en
2022-12-30 05:04:26+00:00,1519524921503748096,"@RandPaul As someone who did vaccine researches in my earlier career, I would say these mRNA COVID 19 vaccines are not vaccines.  Unless of course, now Vaccine is re-defined just like the definition of man and woman. 😂",en
2022-12-30 05:04:18+00:00,1519359890237624322,@Leogonewild @H1dd3nH4nd It is well established that Covid 19 causes a great increased risk of abnormal clotting. It isn't only related to vaccines. It was happening ling before the vaccine was even developed. A known complication of Covid 19 disease. Unfortunately,en
2022-12-30 05:01:34+00:00,265074027,"@ThePrimalDino Because the planet has lost tech and biomedical yield value in addition to unobtanium. I mean, at drain horseshoe crabs for their blood, which was integral in the development of the COVID-19 vaccine. Pandora is an ecological growth diversity storm the likes unseen even on Earth.",en
2022-12-30 05:00:53+00:00,1265748177698738177,"@prima__facie ""The risk of such reactions is low and should not deter the use of COVID-19 or any other vaccinations.""The infamous vaccine disclaimer, or NERF as some are calling it.How do you know if the benefits outweigh the risks?",en
2022-12-30 04:59:04+00:00,1265748177698738177,"@prima__facie ""The history of autoimmunity should be evaluated in patients who will receive COVID-19 vaccines.""How many people develop autoimmunity without having a known history?",en
2022-12-30 04:56:57+00:00,1597032015215198208,CHARLIE WARD - UK DOCTORS CALL FOR IMMEDIATE HALT OF COVID-19 VACCINE https://t.co/EKm9SX7iX6,en
2022-12-30 04:56:40+00:00,892089726597033985,Florida high court OKs grand jury probe of COVID-19 vaccines | AP News https://t.co/kjIozuszxT,en
2022-12-30 04:55:26+00:00,1419476675146903555,"“During the past few months, there’s been an air of invincibility among people who have had COVID-19 or their vaccinations and boosters, and especially among people who have had an infection and also received vaccines.""https://t.co/F6l7PPmrmA",en
2022-12-30 04:51:35+00:00,777535287320797184,"@FamoCrypto @PeterSweden7 Amazing that Dr. Robert Malone, one of the main developers of mRNA is against the COVID-19 ""vaccines"". You need to do a little better research before you start praising the mRNA experimental biological agents so called ""vaccines"".",en
2022-12-30 04:49:09+00:00,17729172,@RenukaCCongress Indeed! Polio vaccine was discovered in 1956 and it took us 58 years to vaccinate everyone and be polio-free!Please do not mock the accomplishment of India's success with the Covid-19 vaccine. Let there be a film to celebrate it.,en
2022-12-30 04:48:21+00:00,1061667315375398912,"Slowly, the public is being made aware that Covid 19 was a bioweapon, and the same people who made it, covered up the origin, covered up viable treatments, and pushed vaccines that didn’t work. https://t.co/gYGsR5oWrX",en
2022-12-30 04:47:52+00:00,1280881348354269185,"COVID-19 Update▪️220.09 cr Total Vaccine doses have been administered so far▪️81,097 doses were administered in the last 24 hours▪️India's Active caseload currently stands at 3,609▪️Active cases stand at 0.01%Read here: https://t.co/XxcS6ULuSa https://t.co/gKeA1v6D7f",en
2022-12-30 04:46:57+00:00,1297563475930157057,John Stockton Shockingly Blames COVID-19 Vaccine For The Death Of ‘Over 100 Professional Athletes' https://t.co/A9vuCROFqQ,en
2022-12-30 04:46:53+00:00,1593633629837484033,Dr Gundry posted in the months following my getting the first two gene therapy/vaccines for work mandatethat the patients in an ongoing heart disease study (Pre covid 19) saw all of their heart disease markers go up after vaccinationI refused any further &amp; didn't get fired..,en
2022-12-30 04:45:09+00:00,231033118,"COVID-19 Update▪️220.09 cr Total Vaccine doses have been administered so far▪️81,097 doses were administered in the last 24 hours▪️India's Active caseload currently stands at 3,609▪️Active cases stand at 0.01%Read here: https://t.co/U71k7BfRD2 1/2 https://t.co/B5EJkaPMJh",en
2022-12-30 04:45:09+00:00,1519359890237624322,@DavidTaylorNYC @H1dd3nH4nd Covid 19 greatly increases risk of clots. This was known long before the vaccines were even developed.,en
2022-12-30 04:44:19+00:00,1559293746646118401,#vaccines #vaccine #VaccineDeath #COVID19 #Covid_19 reply’s are on &amp; they’re great,en
2022-12-30 04:43:06+00:00,53340475,"COVID-19 booster increases durability  of antibody response, research; addresses Pfizer, moderna mRNA vaccines https://t.co/6Q1sn8pEqt via @EurekAlert",en
2022-12-30 04:42:43+00:00,954047720360153088,Good I received both my COVID-19 Vaccines and all the Booster shots!!! So I'm good. No go away and play in the traffic,en
2022-12-30 04:40:59+00:00,1520791058862338050,"@ABSCBNNews You don’t act now,Don’t expect help from other countries to send COVID-19 Vaccines.The second time around is going to be worse.",en
2022-12-30 04:39:29+00:00,1518725589242417153,"COVID-19 and the ""vaccine"" were created to kill the weak and weaken the strong. Maybe even sterilize the next generation.",en
2022-12-30 04:38:22+00:00,462530857,@FoxNews I am shocked and appalled at @KattyKay_ ‘s uninformed and misguided views on the efficacy and necessity of the Covid 19 vaccine boosters for everyone. She is singing from the CDC’s song sheet in spite of the overwhelming evidence to the contrary.,en
2022-12-30 04:37:49+00:00,2565753420,#Opinion I Prof. K. Srinath Reddy View: A safe sub-unit protein vaccine will further enhance booster protection against Covid variants https://t.co/AQGXp2xrSV via @economictimes  #Covid-19,en
2022-12-30 04:35:57+00:00,822953341303083008,"@RandPaul Huh? ""In multivariable analysis, the bivalent vaccinated state was independently associated with lower risk of COVID-19 (HR, .70; 95% C.I., .61-.80), leading to an estimated vaccine effectiveness (VE) of 30% (95% CI, 20-39%).""",en
2022-12-30 04:33:43+00:00,1587342077217865728,"@ProudElephantUS My reason is I know Covid-19 is total scam and I did my research and the vaccine are fake. If this was about real virus or vaccine , they wouldn’t have done what they have for three years know.",en
2022-12-30 04:32:40+00:00,1295971835784204288,Department of Defense formally rescinds COVID-19 vaccine mandate for military https://t.co/XexDL61b9x via @JustTheNews,en
