date,userid,tweet,lang
2022-04-14 23:56:32+00:00,3008223606,@AndOrNorLyn @PfreedomRi @MostProudCanuck @CTVNews My latest: Snake Venom Key Ingredient In “Covid-19 Vaccine” Patents~See article:  https://t.co/s9gEPa00cw,en
2022-04-14 23:55:50+00:00,1354832865247244292,vaccination india: Over 186.29 crore Covid-19 vaccine doses administered in India: Union health ministry https://t.co/lUcQrr2To4,en
2022-04-14 23:55:47+00:00,414973680,"This rating advises international travelers to be up to date with their COVID-19 vaccines before travelling. The de-escalation in rating comes just three (3) weeks after the CDC reduced the rating from a Level 3 to a Level 2 on March 24th, 2022.",en
2022-04-14 23:55:05+00:00,482561817,Considerations in boosting COVID-19 vaccine immune responses https://t.co/QVPIuI12wX,en
2022-04-14 23:54:59+00:00,1185951649753423872,@FDA_Drug_Info Dear FDA please approve Covid-19 vaccines for kids under 5 this month in April 2022 or May 2022 please? I want to see it happening. We are waiting for it do they right thing sign it off. Make it right and good.,en
2022-04-14 23:54:34+00:00,4388052922,@timeoutburner @cher_aid @DonCryptoDraper @greg_price11 What I think is false is that you were more likely to get myocarditis from getting sick with COVID-19 then you are of getting Vaccine induced myocarditis I wasn’t arguing that both can cause it when I am arguing is that the increased likelihood via COVID-19 versus the vaccine,en
2022-04-14 23:52:55+00:00,69011492,"@DrEricDing And, parents still waiting for FDA to issue full approval for COVID-19 vaccine for kids 5-15, still being provided under Emergency Use Authorization. Why Are we still under EUA when if alleged best defense to protect ppl from getting/transmitting COVID-19, masks, aren't needed?",en
2022-04-14 23:52:12+00:00,16186671,#COVID-19  vaccines: they don’t do much but that’s how you know that they’re working.,en
2022-04-14 23:51:06+00:00,1399263325578567681,https://t.co/B55C4NYkh1 has some excellent articles on the lab-attached snake venom spike proteins in #Covid19 and the “vaccine” depop bioweapons. Dr. Bryan Ardis: “COVID-19 is not a virus – people die by being given a snake venom.” https://t.co/5nUfGYhN8O,en
2022-04-14 23:50:22+00:00,1412961327421681673,@CanadaSOS1 @iAmChrisJG @DJones1777 @guy369 @fprevost 😂🤣🤣PolitiFact - DNA damage from COVID-19 spike proteins in lab study does not apply directly to COVID-19 vaccines https://t.co/Yg6ly68kko,en
2022-04-14 23:47:05+00:00,309325348,Children who received expired COVID-19 vaccine still protected - medical advisor https://t.co/a6T2g0Zpan,en
2022-04-14 23:45:31+00:00,2297343444,"Victoria recorded further 7 COVID-related deaths  with 9,664 new infections, total active cases 57,910, 374 patients in Victorian hospitals with COVID-19, 14 in intensive care units &amp; 4 on ventilators. =~ 67% of adults with 3 doses of coronavirus vaccine. https://t.co/PR3EcXJ0v8",en
2022-04-14 23:44:38+00:00,14391192,Additional COVID-19 vaccine clinics set at Kane County mass vaccination site in Batavia https://t.co/tIs0oU8uoA,en
2022-04-14 23:44:37+00:00,272572385,Packed house here at @EastsideFire in support of firefighters who are about to lose their jobs over refusal to get the COVID-19 vaccine. https://t.co/GLdYIqbU9x,en
2022-04-14 23:44:12+00:00,848300388,"ON HOLD: SB 871 would require ALL CA students to have Covid-19 vaccine. Sen. Richard Pan, says he’s holding his bill b/c concerned too many children remain unvaccinated.CA now continues its less strict Covid mandate: parents can opt their kids out based on personal beliefs. https://t.co/yImR2gefmR",en
2022-04-14 23:42:59+00:00,777232520760877056,@CYOOPilotChad Please educate yourself on the safety of COVID-19 vaccines rather than believing armchair doctors.,en
2022-04-14 23:42:15+00:00,992231496,"@_______nah @HelenYaffe @bellybeastcuba Vaccines based on mRNA are not gene therapy. Gene therapy, by definition, requires modification of the genetic material of cells, which the mRNA vaccines cannot and do not do. Furthermore, the mRNA vaccines use a modified version of the CoViD-19 spike protein that cannot...",en
2022-04-14 23:41:29+00:00,410335377,"Sinovac Covid-19 vaccine recipients restricted from travelling to Europe can ask for Pfizer shots, says Khairy | Malay Mail https://t.co/LGhuKQhXuz",en
2022-04-14 23:38:33+00:00,1458126339639234562,Sad jab @sajidjavid walking back on zero #Covid_19 after forcing care home and #NHS staff to have #vaccines. The only difference is you’re allowed to vote and protest in #UK. He’d have done it if he’d been able to get away with it,en
2022-04-14 23:37:23+00:00,3053286153,"""ChildrenCOVID-19 mRNA Vaccine BNT162b2 is not recommended for children under 12 years.""",en
2022-04-14 23:36:22+00:00,14575130,Swissmedic Grants Conditional Marketing Authorization for Novavax COVID-19 Vaccine is the first protein-based vaccine to be authorized for use in Switzerland---using the old fashion way to make vaccines&gt;tried and tested unlike mrna technology ones..https://t.co/JINh0GaEug,en
2022-04-14 23:35:53+00:00,1341206110460473345,Yet another new #Covid_19 vaccine flavour coming soon https://t.co/ctEg7AOv2h,en
2022-04-14 23:35:09+00:00,1419867080812232705,"Walgreens COVID-19 Vaccine Appointments Near You/Walgreens検索・予約（English） website was updated, visit the page! https://t.co/TqHHgBXRsK",en
2022-04-14 23:35:08+00:00,15971233,"""Rising COVID-19 cases prompt warnings for Illinoisans ‘to remain vigilant and remain up to date’ on vaccine shots.""@mitchtrout reports.https://t.co/qxGPKoKfa9",en
2022-04-14 23:35:02+00:00,59545968,"Native Action Network is a Native-led, nonprofit organization that promotes Native women’s full participation in local, state, tribal, and national affairs. See their COVID-19 Vaccine Confidence webpage, encouraging indigenous peoples to vaccinate. https://t.co/YGBHZv36zV#NMHM https://t.co/NzqDhVhKOj",en
2022-04-14 23:34:04+00:00,82682647,"After Sisters Patty Young and Debbie Woods saw that people were hesitant to receive the COVID-19 vaccine, they began helping people in their community sign up for appointments. Today, they estimate that they have helped schedule 400 vaccine appointments. https://t.co/CcdR0sORMD https://t.co/TdE8HygwwN",en
2022-04-14 23:33:42+00:00,40061315,"Kids ages 5-11 may soon be eligible for a COVID-19 booster shot. Pfizer and BioNTech plan to submit for emergency use authorization, after the companies say results from a study reveal a third vaccine dose in that age group shows ""high immune response."" https://t.co/hYbgbobdhS",en
2022-04-14 23:33:22+00:00,32276830,California school COVID-19 vaccine mandate bill on hold https://t.co/UZ5U6YwOy5 via @mercnews,en
2022-04-14 23:30:09+00:00,17613674,"A third shot of the children's dose of Pfizer/BioNTech's COVID-19 vaccine raised Omicron-fighting antibodies by 36 times in kids 5 through 11 years of age, the companies said in a news release Thursday. https://t.co/fNm2k2EHFT",en
2022-04-14 23:29:26+00:00,4912737062,"@Freeeethinker1 Agreed. And just once I'd like these people claiming the effectiveness of the COVID-19 ""vaccines"" do have just SOME sort of even remotely credible data to backup their claim.The mountain of data showing how INEFFECTIVE they are is overwhelming, and it's ignored by ""experts.""",en
2022-04-14 23:24:49+00:00,1077435511470546946,"Session 1. Covid-19 vaccine development, strategies &amp; implementationCovid-19 leads to accelerated vaccines development. Quality, effectiveness &amp; safety were ensured in shortened steps of clinical trials Soon Rwanda will be the center for mRNA vaccine manufacturing in Africa. https://t.co/64vRCgvdmR",en
2022-04-14 23:24:48+00:00,330799438,"@chancetherapper @kimlesno do you know what he's ALSO for..? gutting Planned Parenthood, ""Praying"" Covid-19 away, rejecting all vaccines...look at what no experience in office is giving us now.",en
2022-04-14 23:24:21+00:00,1077435511470546946,"Session 3. Covid-19 &amp; Immunization in RwandaDr Jean specified since kick off vaccination, Rwanda hit the target nber.Getting a vaccine shot is not personal but public protection interest.Next age group is 5-11yrs &amp; we aim to obtain hard immunity by vaccinating many people. https://t.co/CfAaCANB1D",en
2022-04-14 23:23:00+00:00,1325563769045594118,"I don’t wear a condom, take a flu/HPV/shingles vaccine, take cold medicine, for YOUR benefit. It’s *always* been for my own benefit.A well established pattern established with other medicines &amp; vaccinations deviated with the COVID-19 messaging.Therefore, I remain skeptical.",en
2022-04-14 23:22:41+00:00,1311115580,"The Governor’s plan mandating the COVID-19 vaccine once it receives full FDA approval still stands, however, without legislative action, a personal belief exemption will be allowed. We will continue to keep you updated of any changes. #TUSD 2/2",en
2022-04-14 23:22:19+00:00,1456008647977275392,"""Thus, specific pre-existing immunity to seasonal coronaviruses may increase susceptibility to SARS-CoV-2 and predispose individuals to an adverse COVID-19 outcome, guiding risk management and supporting the development of universal coronavirus vaccines."" 🙏🏻🙏🏻",en
2022-04-14 23:22:02+00:00,55620779,"@NeuroCandies @BadVaccineTakes It's like they almost don't exist at all.(Since December 2020, more than 469 million doses of COVID-19 vaccine have been administered in the U.S., 10,483 reports of death have been received (0.0022%), according to the CDC. (Numbers as of Dec. 29, 2021.))",en
2022-04-14 23:20:28+00:00,2181383449,COVID-19 vaccines in national stockpile starting to expire as uptake slows | CBC News https://t.co/fg1gxMjFaL,en
2022-04-14 23:19:38+00:00,1296197642821804034,"DYK: It is safe to get flu, Tdap, and COVID-19 vaccines while pregnant. To learn more about Vaccines &amp; Pregnancy click here: https://t.co/joANRomECZ.FIND FREE VACCINES NEAR YOU AT: https://t.co/TvyyKXdFFS #IGotTheShotNYC , #NYCVaccineForAll https://t.co/vGwRBsf1sG",en
2022-04-14 23:18:49+00:00,25303905,"I know there can be many reasons why this is so, but anyone concerned that triple-vaccinated individuals are testing positive at a much higher rate?  #Covid_19 #Booster #vaccines  https://t.co/INAnQxny0V",en
2022-04-14 23:18:40+00:00,2918203464,California school COVID-19 vaccine mandate bill on hold https://t.co/2OV6c7PpHA via @eastbaytimes,en
2022-04-14 23:18:39+00:00,1209350569,"@CaliComm007 Data ??  What data Over 200,000 people who are pregnant have received COVID-19 vaccines (Pfizer, Moderna or Johnson &amp; Johnson’s Janssen) without any safety concerns. Vaccine safety has been well studied in multiple national and international studies. https://t.co/gBlJj2bFwF",en
2022-04-14 23:16:41+00:00,112870982,Autoimmune hepatitis developing after COVID 19 vaccine: Presumed guilty? https://t.co/zSaP9BGffd,en
2022-04-14 23:16:11+00:00,1325563769045594118,But COVID-19 vaccines are extremely flawed &amp; were released out of a state of panic. Fear always clouds judgement. Health officials coerced the masses with guilt (disguised as empathy) using a saying that turned out to be a massive lie- “You should take this to protect others.” ⚠️,en
2022-04-14 23:15:33+00:00,102107828,California school COVID-19 vaccine mandate bill on hold https://t.co/XFwH2V8NOg,en
2022-04-14 23:15:10+00:00,234369339,"Sign your nonprofit up for a mini-grant today! App'ns invited from programs working for equitable COVID-19 vaccine distribution in PA, including faith-based orgs.Learn more and apply today! ➡️ https://t.co/XFwo90vQ6P#LIVEVaccineGrant @PAHumanServices @PAHealthDept https://t.co/RWNzl1gu5y",en
2022-04-14 23:13:53+00:00,1437301906880151556,"@dnforca And there's the British Govt saying the complete opposite:""COVID-19 mRNA Vaccine BNT162b2 is not recommended for children under 12 years.""https://t.co/OVjnrIncLr",en
2022-04-14 23:11:50+00:00,16685803,"@KevinKileyCA Coward boy here @Zen232 on the left hasn't been straight with you folks,. NIH in UK is giving 5-11 COVID vaccines ""Children will be offered the Pfizer COVID-19 vaccine. Each vaccine is 1/3 of the dose of vaccine that is given to older children and adults."" https://t.co/HbqNLHO1Ay https://t.co/eypElpa595",en
2022-04-14 23:10:45+00:00,16664681,"Without the bill, the state will continue with a less strict COVID-19 vaccine mandate authorized last year by Gov. Gavin Newsom, allowing parents to opt their children out based on personal beliefs.https://t.co/6A4h3evep8",en
2022-04-14 23:10:35+00:00,1426823414321274880,Reports of Vulvar Ulcers in Adolescent Girls Following Pfizer COVID-19 Injections. Doctors say that it is “important to identify and explain possible adverse effects to help dispel the hesitancy patients might feel about receiving a novel vaccine.” https://t.co/jJNdzPLpzq,en
2022-04-14 23:10:00+00:00,39453212,UK approves Valneva's COVID-19 vaccinehttps://t.co/sn1aFPypJh,en
2022-04-14 23:09:23+00:00,1236331662126055425,MAGA doctor claims COVID-19 vaccines are part of Catholic plot to turn you into a 'hybrid of Satan' https://t.co/iD1qwpWlWK,en
2022-04-14 23:07:37+00:00,1450673432350265348,Sequential IgG antibody monitoring for virus-inactivated and adenovirus-vectored COVID-19 vaccine in Brazilian healthcare workers https://t.co/jsR1gc7m21,en
2022-04-14 23:07:12+00:00,1450673432350265348,"COVID-19 Mortality and Vaccine Coverage - Hong Kong Special Administrative Region, China, January 6, 2022-March 21, 2022 https://t.co/zpAL6lZ5TM",en
2022-04-14 23:07:05+00:00,19029839,Ryerson students file lawsuit against university over COVID-19 vaccine mandatehttps://t.co/X7ugw8WYcP #Ryerson #COVID19 #ontpoli,en
2022-04-14 23:06:47+00:00,1183158347266064384,Ryerson students file lawsuit against university over COVID-19 vaccine mandatehttps://t.co/9CHS5IJqGn #Ryerson #COVID19 #ontpoli https://t.co/YSVdDZSDDe,en
2022-04-14 23:04:50+00:00,746169697,@RobertS61212601 @censoredfox @RealMike56 Maybe because the vaccine was not sold that way? Do you recall Brandon saying if you get the shot you WiLL NOT get or spread Covid 19 ?,en
2022-04-14 23:04:47+00:00,1467739162338074624,dear covid 19 and all yer shit storm vaccines and all https://t.co/cxTXdagvXh,en
2022-04-14 23:02:30+00:00,1381003828045217798,"COVID-19 Vaccines Reduce Hospitalization and Death Rates, Contrary to Social Media Claims https://t.co/7D0mNFkxVJ",en
2022-04-14 23:02:06+00:00,1260148815161688067,covid: UK medicines regulator approves Valneva Covid-19 vaccine for adult use https://t.co/23wYeMkAAi,en
2022-04-14 23:01:41+00:00,1489673350255415309,Check Out our open discussion tonight at 7PM on Facebook Live! Prevention Starts With You. The COVID-19 vaccine Helps Protect You &amp; Your Family.,en
2022-04-14 23:01:30+00:00,1489673350255415309,"#PueblosVivos Transnational Villages Network Presents:'The Difference Between Vaccines' Currently, there are 3 types of vaccines that prevent severe illness and death due to COVID-19. - Messenger RNA (mRNA) Vaccines- Vector Vaccines- Protein Subunit Vaccines https://t.co/nkJdC7cYVC",en
2022-04-14 23:00:47+00:00,2861134652,💉 MAKE THE CHOICE | North Peninsula Area Regional Council Mayor Patricia Yusia made the choice to get her COVID-19 vaccination to be part of the fight against COVID-19.Read her story here ➡ https://t.co/ghYxLdf8uo #makethechoice #COVID19 #vaccine #getthejab #FirstNations,en
2022-04-14 23:00:46+00:00,1424983554992214017,Air Force Officer Facing Court-Martial After Refusing COVID-19 Vaccine https://t.co/9oFoIzQlAe,en
2022-04-14 23:00:43+00:00,92079978,"Make the best decisions to protect you, your family, &amp; your community. Talk with your health care provider to get the facts about COVID-19 vaccines. Find a vaccine location:☑️ Search https://t.co/x0bbsM8Xr9☑️ Text your ZIP code to 438829☑️ Call 1-800-232-0233Via @CHIRLA https://t.co/pxymsyJ7h8",en
2022-04-14 23:00:38+00:00,990802033,"COVID-19 Vaccines Reduce Hospitalization and Death Rates, Contrary to Social Media Claims https://t.co/tLX5ab75hU",en
2022-04-14 23:00:28+00:00,1261542900808237057,@Storiesofinjury Tracy Høeg MD posted this on Twitter:  Striking poster at American College of Cardiology conference showing strong association of mRNA COVID-19 vaccines with developing atrial fibrillation (arrhythmia) || this was just an FYI Tweet by Dr. Høeg.,en
2022-04-14 23:00:23+00:00,34666476,Are you up to date on your COVID vaccines? Booster doses are available for all COVID-19 vaccines. Visit https://t.co/S8JwYqk3vB for more info or call 833-540-0473 to request homebound service or transportation help.@lapublichealth https://t.co/L7tQ1bxz7H,en
2022-04-14 23:00:14+00:00,40778270,- 61.6% of people have had three doses of a COVID-19 vaccine*- 83.3% of people aged 12-15 have had one dose of a COVID-19 vaccine- 79.6% of people aged 12-15 have had two doses of a COVID-19 vaccine- 49.9% of people aged 5-11 have had one dose of a COVID-19 vaccine,en
2022-04-14 23:00:13+00:00,40778270,COVID-19 update – Friday 15 April 2022In the 24-hour reporting period to 4pm yesterday:- 96.1% of people aged 16+ have had one dose of a COVID-19 vaccine- 94.6% of people aged 16+ have had two doses of a COVID-19 vaccine https://t.co/X9JdZaJIcM,en
2022-04-14 23:00:05+00:00,1581482630,Siksika Health is managing 21 cases of COVID-19; 30 new and 53 recovered since Apr. 8 update. COVID-19 treatment is available for high-risk individuals; Siksika Nation members ages 18+ who contract COVID-19 and have 0 or 1 doses of COVID vaccine are encouraged to contact CDC Team https://t.co/ucCadOGxn4,en
2022-04-14 23:00:01+00:00,18982486,"Easier access to COVID-19 vaccine boosters could be a way of addressing the plateauing of Canadians getting the shot, public health and immunology experts say. https://t.co/dd9TeZOfOH",en
2022-04-14 22:58:30+00:00,196240793,"The CDC and FDA have approved second COVID-19 vaccine boosters for all people age 50 and older, and for all people age 12 and older with certain underlying health conditions.Make your second booster appointment now at Cook County Health! https://t.co/nGlp6Rl2XG",en
2022-04-14 22:56:13+00:00,2861607093,"COVID-19 Vaccines Reduce Hospitalization and Death Rates, Contrary to Social Media Claims https://t.co/GnNprADrE3 via @factcheckdotorg",en
2022-04-14 22:55:00+00:00,17509945,"This study by Noa Dagan, MD, in @NEJM looked at the effects of a fourth dose of the Pfizer COVID-19 vaccine in older adults.By @mms_walker, @MedPageID.#IDtwitter #medtwitter  https://t.co/Y64sInIxp6",en
2022-04-14 22:53:41+00:00,1409120687755862020,Please vote Republican so we can get rid of the covid 19 vaccine for immigrants and travelers coming to the USA!!!!,en
2022-04-14 22:50:59+00:00,48428348,@BeschlossDC He also developed 3 Covid-19 vaccines.,en
2022-04-14 22:50:44+00:00,1508593639794135043,@AARP I think we got the best vaccine for the covid 19,en
2022-04-14 22:45:54+00:00,1291751963093356544,@DarlyKagumire @lubersolz @albertKatruGuma Barack Obama tested positive for Covid-19 exactly one month ago.Think you got a better vaccine than him?,en
2022-04-14 22:45:36+00:00,111821281,"By getting the vaccine against Covid-19, we continue to protect ourselves &amp; keep our community safe. When we’re safe, we can get back to work safely, together. If you have questions about workplace guidelines or vaccinations, contact LA County 833-641-0303 #togetherfightingcovid https://t.co/ENCOvk75nZ",en
2022-04-14 22:45:12+00:00,1251981278,"As of 4pm today, Cambridge is reporting:183 newly reported COVID-19 cases.0 newly reported COVID-19 deaths.78.9 cases per 100,000 residents, 7-day moving average.93% of residents with at least one vaccine dose and 76% fully vaccinated.More at https://t.co/YgmNLKcIMc #CambMA https://t.co/vo4xAH6gsx",en
2022-04-14 22:45:02+00:00,1399754742281248771,"It’s been 2 years since we first heard about #Covid-19 and with so many developments and different #vaccines, we know you might still have questions. Visit us for the latest information and get answers you need in English and Spanish. https://t.co/ygnkg6vh5M",en
2022-04-14 22:44:05+00:00,1488696626054983681,The so-called health professionals pushing for the Wuhan coronavirus (COVID-19) vaccine programs around the globe have repeatedly said the vaccines are safe and effective. But hundreds of young and healthy athletes are dying because of them. https://t.co/XFXssY8Y7J,en
2022-04-14 22:44:00+00:00,1388602583741304840,First batch of Novavax COVID-19 vaccines now available in Quebec at walk-in clinics https://t.co/EOTMhfHjfn,en
2022-04-14 22:43:18+00:00,1477648441421574145,@bbfranklin4 @Akugizibwelivi4 @POTUS I didn’t say MNRA was just discovered  I said the technology existed but not the Covid 19 vaccine - in fact the man that self proclaimed creator of MNRA actually opposed its use for the vaccine as he thought it would make it worse.,en
2022-04-14 22:43:16+00:00,3363192905,@d47m122 @elonmusk @Alwaleed_Talal @Twitter @Kingdom_KHC Oh yeah Covid-19 propaganda and you could not say anything bad about vaccines!!  Meanwhile Fauci keeps on Lying !!,en
2022-04-14 22:43:13+00:00,339384330,"UK, inaprubahan ang bagong Valneva COVID-19 vaccine https://t.co/AOVkr5BkJA via @bomboradyonews https://t.co/CbkkASrgad",en
2022-04-14 22:41:42+00:00,1497800686469214214,Dr. Ryan Cole: Alarming Cancer Trend Suggests COVID-19 Vaccines Alter Natural Immune Response https://t.co/Cmppnndt87,en
2022-04-14 22:41:30+00:00,1253827938027548673,@DrTomFrieden Maybe due to vaccines against COVID-19?Is there any segregation?,en
2022-04-14 22:40:37+00:00,1955369634,"COVID-19 Vaccines Reduce Hospitalization and Death Rates, Contrary to Social Media Claims - https://t.co/TrPjIBa6XVCOVID-19 Vaccines Reduce Hospitalization and Death Rates, Contrary to Social Media Claims …#SNRTG #SocialMedia #SocialMediaNewshttps://t.co/ZiKdYlkizI",en
2022-04-14 22:38:54+00:00,863796693317427200,@CPHO_Canada VAERS data reveals 50-fold increase in ectopic pregnancies following COVID-19 vaccine shotshttps://t.co/V5Q9gg6XKm,en
2022-04-14 22:36:48+00:00,42985637,A vaccine expert says 56 children who received an expired dose of the Covid-19 vaccine are still likely to have high protection against the virus.https://t.co/QTTKgFZr5m,en
2022-04-14 22:36:31+00:00,819775088295673857,"@Richard75162402 @RobertKennedyJr Thank you. The same companies seedily selling snake venom, or naming a COVID-19 vaccine the Corbe Vaccine. Or that the key peptides in Sars-ncov2 are from rattlesnake &amp; crait &amp; cobra venom.",en
2022-04-14 22:36:10+00:00,412854291,"@PortlandMayn @AliceRHamilton @lovelilahart Hey, since you missed this in the first couple of sentences.. “However, since vaccines are not 100% effective at preventing infection, some people who are fully vaccinated will still get COVID-19.”",en
2022-04-14 22:35:59+00:00,1504254117702602753,"COVID-19 Vaccines Reduce Hospitalization and Death Rates, Contrary to Social Media Claims https://t.co/j8L89Nu6vy",en
2022-04-14 22:33:57+00:00,236951091,California school COVID-19 vaccine mandate bill on hold https://t.co/tkgHBJrtIf,en
2022-04-14 22:33:21+00:00,1393872456,"Complete COVID-19 Vaccine-Related Athlete Injury/Death List To-Date: 779 Cardiac Arrests, Serious Issues, 500 Dead https://t.co/iJOmjYT3S8 via @AdverseReport",en
2022-04-14 22:31:54+00:00,230769694,Pfizer and BioNTech Announce Data Demonstrating High Immune Response Following a Booster Dose of their COVID-19 Vaccine in Children 5 Through 11 Years of Age https://t.co/6jBIdpLfqv https://t.co/FvS98x2Bzt,en
2022-04-14 22:30:45+00:00,837489031411793920,Live Q&amp;A: Court Overrules Biden OSHA Vaccine Mandate; Swedes Unveil COVID-19 Hand Chiphttps://t.co/LLP1yJoFTm,en
2022-04-14 22:30:02+00:00,41618838,"The best course of action for families concerned about #COVID19 is to ensure all eligible members of a household, such as parents—including those pregnant or breast-feeding—and kids ages 5 or older, get vaccinated. Schedule your COVID-19 vaccine today: https://t.co/nc8UNI6BE8 https://t.co/u6fY4Xf7lP",en
2022-04-14 22:30:01+00:00,837489031411793920,"‘Unbelievable’ That WHO Approved China-Made COVID-19 Vaccines, but Not Canada’s: O’Toolehttps://t.co/adsl1MLNuR",en
2022-04-14 22:28:49+00:00,21856182,"Study Tracks COVID-19 Antibodies Over Timehttps://t.co/pxafuxh1LyThe antibodies generated by Pfizer’s COVID-19 vaccine rise more slowly and decline more quickly than those generated by the Moderna vaccine, according to a new study from UVA Health. The study also finds that ... https://t.co/V23H73iVXl",en
2022-04-14 22:28:35+00:00,1461561083940913154,"Writing off anyone who questions these vaccine mandates &amp; his obsession with these vaccines – which is second only to his obsession with depopulation, which we are told is an unrelated obsession – doesn’t seem to bolster his own position. #BillGates #Covid_19 #health",en
2022-04-14 22:27:10+00:00,2541083077,COVID-19 vaccines in national stockpile starting to expire as uptake slows | CBC News https://t.co/hmVLFo4rvy,en
2022-04-14 22:25:11+00:00,222552743,@thedailybeast Perhaps they don't want to risk traveling with a toddler and infant who are not eligible for the Covid-19 vaccine.,en
2022-04-14 22:23:54+00:00,1467526165657264135,"‘Unbelievable’ That WHO Approved China-Made COVID-19 Vaccines, but Not Canada’s: O’Toolehttps://t.co/umKwKYPB4c",en
2022-04-14 22:23:44+00:00,1205638720457715713,"Healthcare workers and others that work in so-called ""congregate settings"" will not have to receive a SECOND booster dose of COVID-19 vaccine to keep their jobs. Should we bow down  now? @GovMurphy",en
