date,userid,tweet,lang
2022-02-21 23:58:46+00:00,14613348,Does Lisa know the vaccine doesn't stop people from getting or transmitting COVID 19?,en
2022-02-21 23:58:18+00:00,1485759317621940226,BY Fifth Estate      EXPLAINEDTrudeau’s Failed Canadian-Chinese Joint Covid-19 Vaccine Venture https://t.co/eVr8sbeHME via @21stCenturyWire,en
2022-02-21 23:57:30+00:00,772506938181619712,"On behalf of the Mexican Government, the Foreign Ministry reports that Mexico delivered 2,000 doses of COVID-19 vaccines to Dominica on February 17 and 10,000 doses to #SaintVincentandtheGrenadines on February 18, 2022. 🇻🇨 https://t.co/3jpfE3IHZI",en
2022-02-21 23:57:28+00:00,4419438017,"@MakisMD Wrong! The patients in ICU &amp; those who are dying are NOT vaccinated. The vaccine will not always prevent COVID-19, but will lessen the severity of the virus, should a vaccinated person get it.",en
2022-02-21 23:56:08+00:00,407275329,Scotland will No Longer report COVID-19 Vaccine Deaths https://t.co/tG9PxKlJ9E via @EUTimesNET,en
2022-02-21 23:53:30+00:00,1165418786717147136,"bestie the soviet union’s negligence, corruption, and blatant propaganda during its reign is not the same as the worldwide goal to reduce covid-19 transmission and casualties through vaccines that have been studied for literal centuries .",en
2022-02-21 23:53:12+00:00,7587032,"The government is taking a calculated risk, relying on guidance for all of us to self-isolate if we have COVID symptoms leaving vaccines to act as our only real defence against COVID-19, writes Sky's @aTomClarke https://t.co/dmotAy94fC",en
2022-02-21 23:51:09+00:00,911266776,Technology Used for COVID-19 Vaccine Tested for HIV Prevention https://t.co/6OmA7mJfpx,en
2022-02-21 23:50:29+00:00,1684964316,"Potential for fourth Covid-19 vaccine dose is being 'very carefully monitored in real time,' Fauci says - CNN https://t.co/7QsOgOnjtv",en
2022-02-21 23:49:38+00:00,1000351207,COVID-19 mRNA Vaccines Can’t Change Your DNA – Here’s Why https://t.co/zbnBJmRowl,en
2022-02-21 23:49:20+00:00,499352772,Republican blocks House panel from advancing bill that would strip health secretary authority to add COVID-19 to list of required vaccines for school and day care #ksleg #ksed https://t.co/jQvsnRFAUn,en
2022-02-21 23:47:07+00:00,1146939503740764160,"The Philippines will recognize COVID-19 vaccine certificates of more countries, Malacañang said Monday as pandemic restrictions drastically eased worldwide.#JuanBulletin https://t.co/hCl9juffqq",en
2022-02-21 23:46:54+00:00,23922797,"1/5: Hong Kong confirms over 7,500 Covid-19 cases, vaccine pass to launch in days https://t.co/a82kwIy9sD",en
2022-02-21 23:46:35+00:00,7424642,"Universities will fully start administering third COVID-19 vaccine shots to students and staff later this month, and the education ministry is calling on more universities to consider such vaccinations. https://t.co/uFJxC2fj5S",en
2022-02-21 23:46:02+00:00,1263882379757867009,A fourth COVID-19 vaccine shot? A Cambridge doctor weighs in - WCVB Boston https://t.co/FbhCWKtU86,en
2022-02-21 23:45:12+00:00,1251981278,"As of 4pm today, Cambridge is reporting:9 newly reported COVID-19 cases.0 newly reported COVID-19 deaths.32.7 cases per 100,000 residents, 7-day moving average.92% of residents with at least one vaccine dose and 76% fully vaccinated.More at https://t.co/YgmNLKdgBK #CambMA https://t.co/Z4uaNu9nFw",en
2022-02-21 23:44:40+00:00,522396943,"@ryangrim take it easy on him, Ryan. He got long COVID-19 from the vaccine, despite the fact the vaccine doesn't have COVID-19 in it.",en
2022-02-21 23:42:29+00:00,761898097,Just got my 2nd COVID-19 vaccine shot 🙏🏽,en
2022-02-21 23:42:12+00:00,802874227753881600,"@MagnoliaJane7 @SwimmerJlo and that system responds to 'know' viruses etc.why we jump start with vaccines like smallpox,polio,DPT,MMR,etc.My masks I bought myself - not 'handed out' by anyoneno argument hope you stay health though COVID-19 might be Nature's wake up call to care about others",en
2022-02-21 23:38:25+00:00,880112324987822082,A fourth COVID-19 vaccine shot? A Cambridge doctor weighs in https://t.co/fUKHPNrAAc,en
2022-02-21 23:38:08+00:00,1484756613454241792,Last time I took 💉 was 1993...I haven't taken covid-19 vaccine sef,en
2022-02-21 23:38:06+00:00,961760708747698176,"@NicThorneAuthor Yes. Primary evidence: Disinfomation surrounding COVID-19 and its vaccine. Tens of thousands of unnecessary illnesses, suffering, and deaths.",en
2022-02-21 23:36:31+00:00,101043531,Dr. Ryan Cole is Sending Covid-19 'Vaccine' Warning: 'Cancers Are Taking Off Like Wildfire' (Video) - THE FIRST LIGHT REPORT https://t.co/nCFcnqOxlX,en
2022-02-21 23:36:01+00:00,87770695,"Tomorrow's the day! CSB/SJU are hosting a COVID-19 vaccine clinic on Tuesday, February 22. Learn more about CSB/SJU's efforts to promote the health and well-being of the entire community at: https://t.co/T4YLuTR8qa https://t.co/aBfGaCGgea",en
2022-02-21 23:36:00+00:00,736668061,#COVID-19 positivity rate drops to 2.16%; pop up vaccine clinic in Herkimer..https://t.co/QzQLyAh6h7,en
2022-02-21 23:35:14+00:00,878394308201598976,"@FloRoberts93 @niksta1974 @goodfoodgal Clearly didn't read cause from that ""mRNA vaccines BNT162b2 (BioNTech-Pfizer) and mRNA-1273 (Moderna/NIAID) have demonstrated high efficacy and safety in clinical trials for COVID-19 prevention""Talk about an own goal",en
2022-02-21 23:34:31+00:00,1110569229923901442,"@lpaul9375 @thomfire_mike @coachingbyvideo @61harpy @ajf140_amanda It will soon become apparent that large numbers of un-masked and un-vaxxed have survived the threat of Covid-19, and many will be angry. I attach the latest data from UKHSA which shows that the vaccines have negative effectiveness in most age groups. https://t.co/b9D4ESJcis",en
2022-02-21 23:34:07+00:00,1345077103436431362,The government hasten the Covid-19 vaccines.,en
2022-02-21 23:34:01+00:00,23803511,"68,000% INCREASE in Strokes as FDA and NIH SECRETLY STUDY  REPORTS  Neurological INJURIES  COVID-19 Vaccines https://t.co/6hGoynx2ix",en
2022-02-21 23:32:19+00:00,3071162052,"[Recap] Covid-19: Hong Kong sees 7,533 new cases as 11-month-old dies; vaccine pass to roll out Thurshttps://t.co/erZsxjcQhM https://t.co/rMhUzdRftw",en
2022-02-21 23:32:00+00:00,2598357146,The COVID-19 vaccines were made to save lives.It’s going to take all of us doing our part by getting vaccinated to keep our communities and loved ones safe. Learn more here ⬇️#MadeToSave https://t.co/d657R4WiCO,en
2022-02-21 23:31:37+00:00,841123369114357760,"Klaus Schwab's WEF: ""the COVID 19 pandemic has led to a heightened focus on the power of medical data, specifically so-called vaccine passports. These passports by nature serve as a form of digital identity."" https://t.co/65jrUgBV3R",en
2022-02-21 23:30:41+00:00,379574156,Excelente respuesta:Answer to What are the standards for the approval of new COVID-19 vaccines? by Dr Jo https://t.co/jJl1KLC2lN,en
2022-02-21 23:30:40+00:00,13406762,"@contrarywise3 @gregggonsalves A doctor who advise the public of COVID-19 vaccines: ""this is far and away the most lethal, toxic, biologic agent ever injected into a human body in American history"" doesn't need a think piece unless its about why such doctors are still licensed.",en
2022-02-21 23:28:48+00:00,3041394260,KOB4: Some New Mexicans received a text today about getting another COVID-19 booster shot. The state is rolling out a fourth COVID-19 vaccine dose for immunocompromised people. https://t.co/6m3BKoWqq1,en
2022-02-21 23:28:18+00:00,1456781635932889088,Shingles vaccine + COVID-19 vaccine = 🧟‍♂️,en
2022-02-21 23:27:58+00:00,17220423,Some New Mexicans received a text today about getting another COVID-19 booster shot. The state is rolling out a fourth COVID-19 vaccine dose for immunocompromised people. https://t.co/udMX5fRpk3,en
2022-02-21 23:26:10+00:00,1094601355921022976,I never forgot they said Covid-19 started when some bol in China ate a bat…now i need a vaccine card to travel 🥴,en
2022-02-21 23:25:18+00:00,346251068,✔️more than 77% of children aged 5 to 11 have received 1 dose of a COVID-19 vaccine (compared to less than half nationally) – with second doses happening in less than 2 weeks https://t.co/xrlc7oUAHo,en
2022-02-21 23:24:34+00:00,120004174,"As of 2/22/2022, 7:24:32 AM*MR UBE NEWS is FREE02-22-22DOH targets 80 percent vaccine coverage of seniors, persons w/ comorbidities before shift to Alert Level 1Ph 1,427 new COVID-19*",en
2022-02-21 23:24:30+00:00,1489006727211012102,@MercuryIntern @SueC00K I personally know more people that have died from the vaccine then I know of people dying from Covid 19.,en
2022-02-21 23:24:08+00:00,908005757882388480,Need a ride to a local COVID-19 vaccine clinic? AAYHF and Capitol Metro can help. https://t.co/H9siOOFXHb,en
2022-02-21 23:23:55+00:00,1409329030269005824,Serum Institute Of India Emergency Use Drug Regulator COVID-19 Vaccine Covovax 12 To 17 Year Age Group https://t.co/jrUllDda0l,en
2022-02-21 23:23:16+00:00,289118612,"#DRCOVID SAYS:""This is basically nature's vaccine that is running through the community"" -- Rand Paul on omicron If Rand's commentary was literally sponsored by Covid-19, how could you tell the difference? https://t.co/4u0GPmWLz9",en
2022-02-21 23:23:01+00:00,1443618714449027073,State Board of Health moves closer to mandating COVID-19 vaccine for children #WALeg https://t.co/pP0utzKQX6 https://t.co/d5xGFMHbcH,en
2022-02-21 23:22:05+00:00,1475241130354696199,"Covid-19 vaccines and treatments: we must have raw data, now https://t.co/HQh21FVuOs",en
2022-02-21 23:22:04+00:00,346251068,Can you believe it’s been a year since Maddy  became the first person in the ACT to receive a COVID-19 vaccine. As a community we’ve been through a lot during a challenging period. We’ve also seen incredible displays of community – none more than our high uptake of vaccination. https://t.co/OSGLhS2KKa,en
2022-02-21 23:18:36+00:00,16174187,Covid-19 Vaccines and Cost-Benefit Analysis https://t.co/pgBt08noZ4,en
2022-02-21 23:17:01+00:00,1356250736653463555,Covid-19 : why the vaccine could not be transmitted by a blood transfusion https://t.co/96HYyXBK91     By Eloise Aubé    Posted 20 Feb 22 at 18:42,en
2022-02-21 23:16:15+00:00,1174076979953504257,"Neil Cavuto, an immunocompromised Fox anchor who has dissented from the loudest voices at the right-wing network and spoken out in favor of Covid-19 vaccines, says a second case of Covid-19 nearly killed him.https://t.co/I50vIkvHcC",en
2022-02-21 23:15:28+00:00,1301963559304224768,"Billionaire Bill Gates states “omicron variant moved faster than COVID-19 vaccines, creating a high level of natural immunity.”Is this news reason for many mandates being lifted globally as politicians move to salvage careers as their narratives collapse? https://t.co/5WY2wqSw3r",en
2022-02-21 23:15:13+00:00,246019599,#cblive Now Luke O'Neill will push the #covid-19 vaccination remember quite well at the start of the pandemic he said it takes at least 7 to 8 years before a vaccine can be proven to be safe,en
2022-02-21 23:13:23+00:00,379297386,"https://t.co/8jSeQdeh3T On Feb 17, 59-yo Rep. Hagedorn died. The congressman was admitted to the Mayo Clinic Hospital in Rochester in Jan. He’d been vaccinated, but contracted the Covid-19, anyway. The vaccinated folks are catching it the most! Here's another vaccine's casualty.",en
2022-02-21 23:12:43+00:00,4828558791,FACT CHECK: 2009 Video Confirms COVID-19 Vaccines Are WHO's Secret Steri... https://t.co/axvWgklroQ via @YouTube,en
2022-02-21 23:11:42+00:00,1174076979953504257,"Fired Newsmax White House Reporter Emerald Robinson, dropped following a series of tweets promoting satanical conspiracy theories about the COVID-19 vaccine, has been hired by Mike Lindell’s streaming network.🙄Birds of a feather  https://t.co/wKXs83hog0",en
2022-02-21 23:11:03+00:00,1284972932008034304,"If such a law was brought forward, would you support freezing the finances of people who choose not to get a Covid-19 vaccine? #VaccineMandate",en
2022-02-21 23:10:21+00:00,75871759,FDA is considering FOURTH dose of COVID-19 vaccine and making it an annual shot | Daily Mail Online https://t.co/jzY9asyzmG,en
2022-02-21 23:10:01+00:00,14574475,"One Year of COVID-19 Vaccines: A Shot of Hope, a Dose of Reality https://t.co/GrGBaklzSN",en
2022-02-21 23:06:29+00:00,1430083013187043332,"@JohnOSullivan36 @clairegcoleman @vanbadham @FatherBob ""The standard you walk past is the standard you accept.""If you accept the spread of Covid-19 and vaccine misinformation you have no standards. Father Bob has no standards.",en
2022-02-21 23:06:02+00:00,41690216,New data show that infants younger than six months are significantly less likely to be hospitalized from #COVID19 if their mothers got the vaccine during pregnancy. Reach out to your health care provider with questions about COVID-19 and vaccination. https://t.co/EjajQOPjd1 https://t.co/lDCivUn2wz,en
2022-02-21 23:03:40+00:00,1274014663399923717,"Check out this news article for Port Arthur, TX https://t.co/g4nAXkquAI The total number of New COVID-19 positive cases reported is twenty-one.The PA Health Department is encouraging everyone to get a vaccine against COVID-19 to protect themselves and their family members.",en
2022-02-21 23:03:01+00:00,41541697,MCRI &amp; @CEPIvaccines have announced the launch of a global #clinicaltrial investigating the impact of administering reduced #COVID-19 #boostershots as part of efforts to ⬆️ access to #COVID19 #vaccines in low-income countries.Find out more 👉🏽https://t.co/10kgXCmjdb #MCRIresearch https://t.co/ZmyA974SME,en
2022-02-21 23:02:25+00:00,208128234,Biological E’s Covid-19 Vaccine Corbevax Gets Emergency Use Approval for Children Aged 12-18 https://t.co/Ym05FgXkvU,en
2022-02-21 23:01:48+00:00,1256116610,"@Donsvess @harrishfg Funny but the untested experimental forced COVID-19 vaccination doesn't actual work, unlike all the tested and fully approved vaccines of the past.",en
2022-02-21 23:01:27+00:00,116867062,"Covid-19 vaccines are offered at no cost to ALL community members, with no copays or financial burden for administering the vaccine.The Pfizer vaccine is available for anyone over the age of 5. Appointments are not needed to receive a Covid-19 vaccine.",en
2022-02-21 23:01:26+00:00,116867062,"Join our Mobile Clinic events at JB Sutton Elementary School and Morris K Udall School next week.See us for Covid-19 testing, 1st, 2nd, and booster doses of Moderna and Pfizer vaccines, well child exams, and more!Pre-register for these events here: https://t.co/blftfsEqXb https://t.co/PmYYdLRVFT",en
2022-02-21 23:01:13+00:00,160763593,"We are so grateful to have partnered with the City of Worcester's Equity Vaccine team to co-host a vaccine clinic! Thanks to their work, Michael here got their first COVID-19 vaccine shot. 💪⁠Reach out to the ACE team if you would like assistance navigating COVID-19 resources! https://t.co/JH4YtJJkC7",en
2022-02-21 23:00:51+00:00,353662827,"Good news on the #coronavirus front! Several new studies suggest that three  doses of a #COVID-19 vaccine - or even just two - can help the immune system mount a sustained, potent response to any coronavirus variant. Get out and get boosted; the life you save may be yours!",en
2022-02-21 23:00:48+00:00,3018960919,"The CDC refused to publish large amounts of COVID-19 data, instead choosing to keep it under wraps because of fears that the information would cause vaccine hesitancy, taking away the public’s ability to make fully informed decisions for itself. https://t.co/0fMDMLzh2T",en
2022-02-21 23:00:38+00:00,18161602,"Everyone over 18 get a COVID-19 booster. If you've had a 2-dose vaccine, boosters are recommended at least 6 months after, for the 1-dose vaccine, it's at least 2 months. Boosters are an additional layer of protection. @CDCgov @CityOfDallas https://t.co/xQhHOeVxTK",en
2022-02-21 23:00:23+00:00,1370605716,"@ZincKidd @Manishmenna @anthonyzenkus Key word on the article you sent is ""MIGHT"".""Beyond their substantial protection of individual vaccinees, coronavirus disease 2019 (COVID-19) vaccines might reduce viral load in breakthrough infection and thereby further suppress onward transmission.""",en
2022-02-21 23:00:07+00:00,302236021,Catch us at the Mission Bend Boys and Girls Club tomorrow from 5pm to 7pm and get your COVID-19 Vaccine! https://t.co/bTyVAIybrT,en
2022-02-21 23:00:01+00:00,284920800,Biological E's Covid-19 vaccine #Corbevax gets emergency use approval for children aged 12-18.#COVID19 #CovidVaccine https://t.co/vrL19jKu2t,en
2022-02-21 22:59:46+00:00,395645518,"@MiloD07 @fox8news Actually, we are suffering from his time in office.  He built nothing, other than the wall he didn’t finish, just tore down.  COVID-19 he handled poorly, actually did little other than put fire to create a vaccine that be discourage people from taking.",en
2022-02-21 22:59:36+00:00,20405295,"@miffythegamer @SpainOnAPlate @ReleaseGibbons @jonlis1 We now have a proven effective vaccine for Covid-19, hence why the removal of restrictive laws is now being put into place. If it were not the case then it would make sense it ensure isolation is set in law. The point is: we have a good line of defence.",en
2022-02-21 22:58:59+00:00,33654294,".@CMOH_Alberta, when are you recommending we get our next booster? Does the 1st booster lose efficacy around the 4mth mark? The flu vaccine is annual, any details on what vaccine schedule we are looking at for Covid-19? 🤔 #CovidIsNotOver #SaveTheDate #Covid19AB #abhealth",en
2022-02-21 22:58:35+00:00,265808064,"Greg Glenn, Novavax’s president of R&amp;D, said the mRNA vaccines have some “safety” and issues in terms of adverse side effects, which would make Novavax a particularly attractive option when Covid-19 becomes endemichttps://t.co/nh2mn6KbrC",en
2022-02-21 22:58:06+00:00,15448383,England’s chief medical officer Chris Whitty warned on Monday there will be new COVID-19 variants and said some of them could be more resistant to vaccines. https://t.co/kGzDTiIPlC,en
2022-02-21 22:56:02+00:00,15448383,"The government’s daily COVID-19 vaccination output has been “dramatically reduced” from 1 million to 500,000,” Secretary Carlito Galvez Jr., the nationwide vaccine manager, said. | @CMRamosINQ https://t.co/Oha4FXXAyA",en
2022-02-21 22:56:00+00:00,75173617,T-Mobile Board of Directors: Stop the T-Mobile Covid-19 Vaccine mandate for all employees - Sign the Petition! https://t.co/97AtFkgbWG via @Change,en
2022-02-21 22:54:01+00:00,31084625,From obscurity to a Nobel Prize nomination: Houston scientists acclaimed for their patent-free COVID-19 vaccine https://t.co/MgKyCShPkt,en
2022-02-21 22:53:36+00:00,15193667,JCVI advises a spring COVID-19 vaccine dose for the most vulnerable - https://t.co/Bvoo1aevJe https://t.co/G4k7aVgexM,en
2022-02-21 22:53:23+00:00,15193667,New UKHSA laboratory will ‘define future pandemic response’ with pioneering COVID-19 vaccines and variants research - https://t.co/Bvoo1aevJe https://t.co/YKXY1L5nQX,en
2022-02-21 22:52:34+00:00,47541189,A fourth COVID-19 vaccine may be recommended this fall https://t.co/9fEHnqFQwz via @YouTube #COVID19,en
2022-02-21 22:51:08+00:00,2861574083,"COVID-19 VACCINE DOSES IN TEXAS🔹23,572 administered doses reported today🔹8,072 first doses🔹7,388 J&amp;J or second doses🔹8,112 booster doses🔹Average 22,723 1st or 2nd doses/day (-3,622 in past week)@KXAN_News https://t.co/yEt9xfsOeC",en
2022-02-21 22:51:07+00:00,2861574083,"COVID-19 VACCINE COVERAGE IN TEXAS🔹58.95% of all Texans are fully vaccinated (+0.27% in past week)🔹69.60% have had at least one dose (+0.29%)🔹21.30% have had a booster shot (+0.30%)🔹42,326,320 total doses administered (+247,204)@KXAN_News https://t.co/Cbz0ftAp2W",en
2022-02-21 22:50:02+00:00,1334918783316713477,Fairy Bossmother’s Ball in Charleston! Free Covid-19 Testing and Vaccines for ages 5 &amp; up! #charlestonwv #covid19 #covidtesting https://t.co/wVVCOOpuVM,en
2022-02-21 22:49:39+00:00,17757925,"Well, damn. The vaccine saved his life. Hmmm. Neil Cavuto Returns To Fox Airwaves, Reveals He Was In ICU With COVID-19 | HuffPost Entertainment https://t.co/ETa7Lk9FSI",en
2022-02-21 22:48:45+00:00,2839374050,"Bills aplenty in @KASBPublicEd roundup. Tax credit for classroom supplies, COVID-19 vaccine, virtual schools, building needs assessments, and more. https://t.co/9oUeE3pEFr #ksleg #ksed https://t.co/AmjeRWy05t",en
2022-02-21 22:48:25+00:00,1195073167439491072,@BreezieLT @TheTeetering Vaccines + good ventilation effectively reduce COVID-19 transmission ✅How many seconds elapse before viruses breakthrough a 😷 (as opposed to a full Hazmat suit)?Do ineffective 😷 give people a false sense of security?Do Politicians like 😷 because they are easy to police?,en
2022-02-21 22:47:49+00:00,1195073167439491072,@emptynester62 @TheTeetering @JonesHowdareyou Vaccines + good ventilation effectively reduce COVID-19 transmission ✅How many seconds elapse before viruses breakthrough a 😷 (as opposed to a full Hazmat suit)?Do ineffective 😷 give people a false sense of security?Do Politicians like 😷 because they are easy to police?,en
2022-02-21 22:47:25+00:00,1195073167439491072,@TheTeetering Vaccines + good ventilation effectively reduce COVID-19 transmission ✅How many seconds elapse before viruses breakthrough a 😷 (as opposed to a full Hazmat suit)?Do ineffective 😷 give people a false sense of security?Do Politicians like 😷 because they are easy to police?,en
2022-02-21 22:46:33+00:00,891838990722228224,Did you recently test positive for COVID-19? You can get still get vaccinated or boosted—you only have to wait until your isolation period ends! Most people can end isolation after five days.Learn more and find a vaccine near you: https://t.co/RcegKfTSvz https://t.co/8tO6pWxPLt,en
2022-02-21 22:46:25+00:00,1127973857548226560,‘Transhumanism nanotechnology’ COVID-19 vaccine conspiracy theory is Pants on Fire https://t.co/L3WinZJtxX,en
2022-02-21 22:45:39+00:00,2927122207,"@Pava25 If you look at my CV, I have grants funding my research, but none of these grants have anything to do with COVID-19 or vaccines or infectious disease -- they are for developing statistical methods for complex biomedical dataPlus I teach and lead a group of biostatistics faculty",en
2022-02-21 22:45:22+00:00,18956073,"Billionaire Bill Gates said the omicron variant moved faster than COVID-19 vaccines, creating a high level of natural immunity. https://t.co/ThDtV0P5WN",en
2022-02-21 22:45:06+00:00,14838763,"The Partnership of African American Churches (PAAC) COVID-19 Surge Testing team will host a free COVID-19 testing, booster and vaccine clinic on Friday, Feb. 25, in Huntington. https://t.co/z5NyOieeY6",en
2022-02-21 22:44:49+00:00,1083852192539389952,A fourth COVID-19 vaccine may be recommended this fall https://t.co/Xn62fB1PaJ via @YouTube,en
2022-02-21 22:44:39+00:00,195792808,A fourth COVID-19 vaccine may be recommended this fall https://t.co/6U4GeAzZPR via @YouTube,en
2022-02-21 22:44:24+00:00,141025131,"https://t.co/Tm1vhLPOjRNeil Cavuto Returns To Fox Airwaves, Reveals He Was In ICU With COVID-19The Fox News anchor said it was ""touch and go"" for a while and credited the vaccine for saving his life.*******And  #foxnews  did not fire him!He looks pale. https://t.co/lxs8vduZUH",en
2022-02-21 22:43:25+00:00,170350940,"@cryptorebel_SV @AnneSmi72007257 Wowowowowowow !!!!Sosososososo cult !!!!!!!!!I hate myself.There are many people who say this on BSV.COVID-19 vaccine blah blah. World order, blah blah. If it was a community where conspiracy theories prevailed, I wouldn't have supported BSV.",en
2022-02-21 22:40:31+00:00,219254618,"Demonstrators rally against provincial and federal COVID-19 vaccine mandates and in support of Ottawa protestors, Friday, Feb. 4, 2022, outside the Manitoba Legislature in Winnipeg, Manitoba. (John Woods/The Canadian Press via AP)OAN NewsroomUPDATEDhttps://t.co/xNZ4lKL2RV",en
2022-02-21 22:38:59+00:00,971069981206048768,"@trolls4now @SenTedCruz ?If those are actu al occurring complications of the vaccine,  I know mthat many many many more are dead ,934,000 , or suffer/ suffering from those EXACT same ones...Furthermore, EVIDENCE shows, the few vaccinated that get COVID-#19 don't",en
2022-02-21 22:37:10+00:00,877800655477501952,"Which is best, vaccine-induced immunity, “natural immunity,” or “super immunity” to COVID-19? Science Based Medicine @ConventusCyber@FogorosR@UrsulaRepas@sudiptamalakar4@fintech_matt@LeonyMerks@andresvilarinohttps://t.co/hTNUMKNMhg",en
2022-02-21 22:37:02+00:00,25135739,"68,000% Increase in Strokes as FDA and NIH Secretly Study Reports of Neurological Injuries After COVID-19 Vaccines – National Addiction News https://t.co/O5ZgWRhlgQ",en
2022-02-21 22:37:02+00:00,3785618319,Germany: Stop Blocking Global COVID-19 Vaccine Access https://t.co/ynVU7VYUVL #globalcitizen,en
2022-02-21 22:36:55+00:00,1455952611279097859,COVID-19: President Buhari Welcomes WHO’s Approval Of Nigeria Among Five African Nations To Produce Vaccine https://t.co/QWKEYGnLC1,en
2022-02-21 22:35:49+00:00,1322976370138505218,"@maxseddon ""These aren't just Russian speakers, these are citizens of the Russian Federation,"" Medvedev says.Because RUS bribed them w/quick path to citizenship, membership in the Kremlin’s ruling party perks such as its COVID-19 vaccines or trade preferences for local manufacturers. https://t.co/KATJeqda9u",en
2022-02-21 22:35:24+00:00,72552866,": When deciding to get the COVID-19 vaccine to protect public health, Americans rated economic wellbeing higher than Europeans: Almost 75% of America's adult population is now fully vaccinated. https://t.co/9S4ZO5Me85",en
