date,userid,tweet,lang
2022-08-26 11:30:05+00:00,59284795,NIH: “The Lancet published a study… [that] showed that immune function among vaccinated individuals 8 months after the administration of two doses of COVID-19 vaccine was lower than that among the unvaccinated individuals.” https://t.co/ID1JVKD9Ny,en
2022-08-26 11:30:04+00:00,1310931467548196870,"@LisaMarieBoothe ""In all the studies on vaccine effectiveness against infection, virtually all still showed 90% or better effectiveness against hospitalization; the Mayo at 75%. So right now, vaccinated you will be about 10 times less likely to be hospitalized with covid-19"".",en
2022-08-26 11:29:41+00:00,1140632241216737280,List of centers administering Covid-19 Vaccine  In P South Ward.100% walk in Time: 9AM - 3PM(Topiwala Dispensary CVC  timmings will be 2PM - 8PM)Age group :- 12 - 14 years Vaccine :- CorbevaxAge group :-  15 years and above Vaccine :- Covaxin https://t.co/el8wadPnWs,en
2022-08-26 11:29:07+00:00,871589702918430721,🔊 @AndrejPlenkovic @MichealMartinTD @Xavier_Bettel @sanchezcastejon @jacindaardern Thanks for supporting #VaccineEquity through COVID-19. Will you join #GlobalCitizenFestival and pledge funds to the @WHO mRNA Tech Hub to empower developing regions to produce their own vaccines?,en
2022-08-26 11:29:03+00:00,1445120674599686146,Tucker Carlson: Democrats alerted us the COVID-19 vaccine wasn't properly tested |  https://t.co/bc5LYGJvtY,en
2022-08-26 11:28:59+00:00,1557302979706904577,"Australia Twitter: As states expand COVID-19 vaccines, prisoners stil... https://t.co/cj5BuU6Y7a",en
2022-08-26 11:28:13+00:00,576884224,"Despite the fact that the vaccines do not prevent the contraction or spread of COVID-19, Mayor Bowser plans to ban all unvaccinated children from DC schools, without even providing them with a virtual learning alternative. @DouglasKBlair @DailySignal https://t.co/3ObwCpzppC",en
2022-08-26 11:27:55+00:00,48075280,"Nate Silver claimed “liberal public health elites” pressured Pfizer to delay fast-track approval of its COVID-19 vaccine until after the 2020 presidential election, thus denying then-President Donald Trump a political win before voters headed to the polls.https://t.co/hfiHVuseqm",en
2022-08-26 11:26:41+00:00,1459092591987859502,"@ThomasInLeiden @MarionKoopmans @Ruud_Brouwer @patricksavalle @Dieren_Doc @DocDoorsnee @Marc_Veld @vanranstmarc @MolBiochemist En gezond dat het is. A new Swedish study published in MDPI found that the Pfizer vaccine goes into liver cells and converts to DNA, challenging claims so far that the mRNA COVID-19 vaccines do not change or interact with your DNA in any way.https://t.co/i0HMPZRiNO",en
2022-08-26 11:23:44+00:00,1315563182325284869,"Yes, Fauci and Gates Do Have Ties to COVID-19 Vaccine Maker https://t.co/sjkgCPY8Wf",en
2022-08-26 11:20:26+00:00,1215270243272220673,Congratulations to our NIHR Newcastle Clinical Research Facility colleagues for their nominations! 👏Including the work some of our very own BioResource team did with Covid-19 vaccine trials. 🤞🏅🏆,en
2022-08-26 11:19:31+00:00,4898552440,"@pissedfather666 No consistent associations were observed between the mRNA COVID-19 vaccines and coronary artery disease, coagulation disorders and cerebrovascular disease. https://t.co/drnbCijRx8",en
2022-08-26 11:19:05+00:00,1516013123722960897,Cardiovascular Effects of the BNT162b2 mRNA COVID-19 Vaccine in Adolescents @Preprints_org https://t.co/GcV30GOonA,en
2022-08-26 11:18:18+00:00,124262013,"3/ ""According to The Washington Post, during the COVID-19 pandemic, Catherine Austin Fitts ""worked with anti-vaccine activist Robert F. Kennedy Jr. to promote unfounded claims about the pandemic and to oppose lockdown measures put in place to slow the spread of the virus""",en
2022-08-26 11:16:15+00:00,907335807060643841,"Wonderful to see @UniofOxford - @AstraZeneca awarded @royalsociety ’s Copley Medal for rapid development &amp; deployment of a vaccine against Covid-19, as well as medals &amp; awards for contributions of others during the pandemic - thank you for your effortshttps://t.co/DTTeKxWXcc",en
2022-08-26 11:15:36+00:00,737662502553722881,"We want to hear from you! On Tuesday, Canada's Chief Public Health Officer, Dr. Theresa Tam, will be joining us to talk about COVID-19 vaccines for kids and other types of immunization ahead of the new school year.  Do you have a question you want answered? Tweet us! https://t.co/IqQMA0RNMM",en
2022-08-26 11:13:22+00:00,1482241371494920194,🔊 @AndrejPlenkovic @MichealMartinTD @Xavier_Bettel @sanchezcastejon @jacindaardern Thanks for supporting #VaccineEquity through COVID-19. Will you join #GlobalCitizenFestival and pledge funds to the @WHO mRNA Tech Hub to empower developing regions to produce their own vaccines?,en
2022-08-26 11:12:14+00:00,176166571,🔊 @AndrejPlenkovic @MichealMartinTD @Xavier_Bettel @sanchezcastejon @jacindaardern Thanks for supporting #VaccineEquity through COVID-19. Will you join #GlobalCitizenFestival and pledge funds to the @WHO mRNA Tech Hub to empower developing regions to produce their own vaccines?,en
2022-08-26 11:12:14+00:00,259172434,"@AngeliPV Because I promised someone I'd post the links to studies on serious adverse effects associated with Covid-19 vaccines on a higher thread, here they are.",en
2022-08-26 11:12:06+00:00,4834803076,Vaccine negative effectiveness  - COVID-19 vaccines update 56 https://t.co/dU4ppTz6yx via @YouTube,en
2022-08-26 11:12:01+00:00,30279713,"Following the FDA’s recent authorization, CDC recommends the use of #Novavax’s COVID-19 vaccine for #adolescents aged 12 through 17. https://t.co/sP5cclQTAh https://t.co/BIZFCWCT4c",en
2022-08-26 11:09:08+00:00,1391074481062531075,Angela K Shen:Factors Influencing Parental and Individual COVID-19 Vaccine Decision Making in a Pediatric Networkhttps://t.co/KUfCqSdn8X,en
2022-08-26 11:08:50+00:00,1531254787504750594,Attorneys for Pfizer Whistleblower Say Company Could be Liable for $3.3 TRILLION in Damages“Jackson’s lawsuit alleges that Pfizer violated the False Claims Act by providing bogus clinical trial results to garner the FDA approval of its COVID-19 vaccinehttps://t.co/vIPCF59ZPy https://t.co/8NpVFk5Er5,en
2022-08-26 11:08:00+00:00,1283467081,"The UNCT continued to keep COVID- 19 issues high on the agenda, supporting @BWGovernment efforts to mitigate the spread and effects of the virus. @UN also supported the country to procure vaccines via COVAX. Read more of our work -https://t.co/DdJUpNh1Zn https://t.co/6YfHZmZOQD",en
2022-08-26 11:07:51+00:00,782653361237561345,"The Trump administration pressured the FDA to accelerate the authorization of vaccines and unproven treatments for Covid-19 before Election Day, according to a report released by the House subcommittee on the coronavirus crisis.",en
2022-08-26 11:06:37+00:00,1889198738,"@BreesAnna @GBNEWS @MarkSteynOnline Thx Mark. An URGENT INDEPENDENT(not Pfizer!) SCIENTIFIC &amp; MEDICAL review led by DOCTORS/CORONERS of the causes of EXCESS deaths by Country/Age gp/Sex/COVID 19 Vaccination status for 19/20/21 &amp; YTD 22 for each European country,USA,Canada &amp; by regions where vaccine policies differ!",en
2022-08-26 11:02:34+00:00,43326045,"DC Public Schools' COVID-19 vaccine mandate punishes Black students, NAA... https://t.co/qOgDf2FYaL via @YouTube",en
2022-08-26 11:02:08+00:00,396439334,"COVID-19 Vaccines and Informed Consent, by @RWMaloneMD #terugvolgvrijdaghttps://t.co/yg19wEVoH2",en
2022-08-26 11:01:32+00:00,259172434,@isthisnetaken @Michael94173566 @rizzamae_ong @mpc_xetts @AngeliPV Intracellular Reverse Transcription of Pfizer BioNTech COVID-19 mRNA Vaccine BNT162b2 in Vitro in Human Liver Cell Line. https://t.co/vg0ghiKqF1,en
2022-08-26 11:01:23+00:00,1437531902773170179,🔊 @AndrejPlenkovic @MichealMartinTD @Xavier_Bettel @sanchezcastejon @jacindaardern Thanks for supporting #VaccineEquity through COVID-19. Will you join #GlobalCitizenFestival and pledge funds to the @WHO mRNA Tech Hub to empower developing regions to produce their own vaccines?,en
2022-08-26 11:01:22+00:00,1071502309,Data continue to show that #COVID19 vaccines are safe &amp; effective. Get vaccinated against COVID-19 as soon as you can. Get a booster shot when eligible. Find your vaccine: https://t.co/2eXKVRZBxO #SleeveUp https://t.co/14FU0Rrkrf,en
2022-08-26 11:01:20+00:00,369880898,"If you are not vaccinated or up to date on your COVID-19 vaccines, stay at least 6 feet away from other people, especially if you are at higher risk of getting very sick with COVID-19. https://t.co/ARQDmsbry7",en
2022-08-26 11:00:49+00:00,330993102,We have approved the Nuvaxovid (Novavax) COVID-19 vaccine in 12- to 17-year-olds after our review concluded the vaccine was safe and effective in this age group. Find out more: https://t.co/Jj8qno3GO7#lifesciences #covid19vaccines https://t.co/yft4KWLn8V,en
2022-08-26 11:00:20+00:00,259172434,"@isthisnetaken @Michael94173566 @rizzamae_ong @mpc_xetts @AngeliPV Lancet article - Risk of Infection, Hospitalization, and Death up to 9 Months After a Second Dose of COVID-19 Vaccine: A Retrospective, Total Population Cohort Study in Sweden https://t.co/FHHYJKHvQA",en
2022-08-26 11:00:16+00:00,1519705133948489729,@KabeloCollen11 That disease is more dangerous than covid-19 we need the vaccine 🤣🤣🤣🤣,en
2022-08-26 11:00:14+00:00,120184404,It’s not too late to help protect for yourself and those around you who may be more vulnerable to COVID-19. Make sure you’ve had all the recommended doses of the COVID-19 vaccine.For more information visit https://t.co/gF30NKanif#Vaccines4Students https://t.co/b1mmvq79zS,en
2022-08-26 11:00:14+00:00,329719276,Are you aware of who will be eligible for the COVID-19 vaccine this autumn? Will you have it if you are eligible?We want to understand how people feel about the vaccine and what would help them to receive it.Please take part in our short survey: https://t.co/E0dBTxv3Xb https://t.co/S2HLcVXni5,en
2022-08-26 11:00:00+00:00,1341157525429882886,"Major truths revealed &amp;  unbelievable stories told. Police on Guard keeps digging deeper &amp; the more we find, the firmer we standFull interview to be released on Monday August 29thThe Science, Religion &amp; Government on a collision course with the Covid-19 Vaccines https://t.co/ymiaArLc5S",en
2022-08-26 10:59:29+00:00,1372138002,UHNM and Midlands Partnership Foundation NHS Trust are working in partnership to launch a new adolescent Covid-19 vaccine clinical trial. The trial will evaluate how effective the Valneva vaccine is. Read more ➡️https://t.co/7uaxHUlcDE https://t.co/iDbcWAdp6z,en
2022-08-26 10:57:28+00:00,259172434,@mpc_xetts @Michael94173566 @rizzamae_ong @AngeliPV A Report on Myocarditis Adverse Events in the U. S. Vaccine Adverse Events Reporting System (VAERS) in Association with COVID-19 Injectable Biological Products. https://t.co/pTPxv4Evvh,en
2022-08-26 10:55:46+00:00,1487742046496604167,"@SineadFinnWex @SenatorKeogan The ad is completely made up! It says ""if you weren't made fully aware of the risks of covid 19 vaccine you are entitled to compensation""! And that's purportedly from UK gov, senator should have more cop on to be retweeting that.",en
2022-08-26 10:55:41+00:00,2750551661,Covid-19 Vaccines and Informed Consent https://t.co/G4qFiJTExW,en
2022-08-26 10:53:14+00:00,1351660896527872000,"Indovac, Inavec are official names for domestic COVID-19 vaccine: BPOM - ANTARA News https://t.co/t46fILOIZH",en
2022-08-26 10:51:55+00:00,700412341360287744,📢 Nate Silver: 'Liberal public health elites' pushed back approval of COVID-19 vaccines to stop Trump https://t.co/4p6n1P57vC via @ADNAmerica,en
2022-08-26 10:50:57+00:00,1055849314768044034,"The Federal Government has said the COVID-19 vaccine developed its agency is set for trial by November.It was gathered that the project, which is a mega research grant intervention tagged,  ‘Accelerated development of COVID-19 vaccines usinghttps://t.co/Y4bS6uGyJo https://t.co/upzpIDel0n",en
2022-08-26 10:50:13+00:00,742646602649731072,Providing vaccinations is an integral part of our health service. We are entering the busy vaccination season with both influenza and COVID-19 vaccines being offered in many pharmacies. https://t.co/6uCsuDpf63,en
2022-08-26 10:50:00+00:00,22012743,New Group Fighting Against College COVID-19 Vaccine Mandateshttps://t.co/C35QC4SfEg,en
2022-08-26 10:48:03+00:00,1479571476948951045,https://t.co/oGXOcclpnr FDA Ignored Moderna’s Pregnancy COVID-19 Vaccine Study via @epochtimes,en
2022-08-26 10:47:56+00:00,2243907186,"@operskapevacica @Efchristian @tedcruz COVID-19 vaccines are effective at preventing severe disease, hospitalization, and death.You'll notice that more and more people saying they are positive are *not* being put in intensive care; are not being put on ventilators; and are not being put into refer truck morgues?",en
2022-08-26 10:46:28+00:00,33025870,🔊 @AndrejPlenkovic @MichealMartinTD @Xavier_Bettel @sanchezcastejon @jacindaardern Thanks for supporting #VaccineEquity through COVID-19. Will you join #GlobalCitizenFestival and pledge funds to the @WHO mRNA Tech Hub to empower developing regions to produce their own vaccines?,en
2022-08-26 10:45:34+00:00,2961264281,"In regards to temp. measures: “With broad uptake of COVID-19 vaccines and increasing natural immunity and the significant reduction in disease severity they have afforded, it is anticipated that these measures will not be required at the start of the 2022-2023 school year.”",en
2022-08-26 10:45:31+00:00,270492072,Novavax COVID-19 vaccine approved for adolescents in U.K. https://t.co/FWA5vmGvkf via SeekingAlpha #news #SeekingAlpha,en
2022-08-26 10:45:29+00:00,1153573257867436034,Domestically-packaged COVID-19 Vaccine Factory to Break Ground in November https://t.co/e1CSLXQLk2 https://t.co/O8K27zn65D,en
2022-08-26 10:43:48+00:00,259172434,@isthisnetaken @Michael94173566 @rizzamae_ong @mpc_xetts @AngeliPV Excellent analysis of Thai study showing cardiac issues among children after 2nd dose of Pfizer Covid-19 vaccine https://t.co/makwmNsKAv,en
2022-08-26 10:43:05+00:00,1068216060,"COVID-19 Vaccines and Informed Consent, by @RWMaloneMD https://t.co/ATcpHxI8Zv",en
2022-08-26 10:40:09+00:00,523248016,"Survey: 56% of companies dropping COVID-19 vaccine mandates to retain talent, grow workforce | Just The News https://t.co/LXh6qCsstq",en
2022-08-26 10:40:09+00:00,1216793092134723586,"Survey: 56% of companies dropping COVID-19 vaccine mandates to retain talent, grow workforce | Just The News https://t.co/0Qo5ycrVIa",en
2022-08-26 10:40:03+00:00,1557907568487440385,I admire him and great player of tennis.I stand with him for refusing vaccines against Covid-19.,en
2022-08-26 10:39:38+00:00,259172434,@isthisnetaken @Michael94173566 @rizzamae_ong @mpc_xetts @AngeliPV South Korean study on association bet Covid-19 vaccines &amp; inflammatory cardiac adverse events among adolescents - https://t.co/shmLXbIqyr,en
2022-08-26 10:38:54+00:00,1444144278066900992,"One year ago, the @TorontoStar said those who chose not to take a COVID-19 vaccine should die.It was among examples of politicians and media dehumanizing those who made a certain medical choice.Join me at Bay &amp; Front at 4:00 PM today to promote freedom, love, and kindness. https://t.co/QxM1V2Qjka",en
2022-08-26 10:37:23+00:00,785106011434594304,"@DouglasKBlair @Trumplicanchic1 @MayorBowser How can you trusts vaccine when the Federal Government gives the near-total immunity of pharmaceutical companies to most lawsuits over COVID-19 vaccines,",en
2022-08-26 10:36:42+00:00,709366453531774976,Tucker Carlson: Democrats alerted us the COVID-19 vaccine wasn't properly testedhttps://t.co/Y4odVMeGwC,en
2022-08-26 10:35:47+00:00,15296897,$HEALTHCARE $SMALL-CAP $NEWS-METERED - Novavax COVID-19 vaccine approved for adolescents in U.K. https://t.co/ttcOSyw0P1,en
2022-08-26 10:35:41+00:00,1479521422787723268,COVID-19 vaccine mandates and mandatory masking in schools continue to be issues for Board of Education candidates https://t.co/3pQ77ENZlq #CarrollCountyMD #MDPolitics,en
2022-08-26 10:35:15+00:00,4783200859,(1/3) The @stgeorgestrust is inviting pregnant women to participate in a study evaluating booster doses of COVID-19 vaccines in pregnancy. This study will help provide key data for future national and international guidance. https://t.co/3mlopv65TT,en
2022-08-26 10:35:13+00:00,1428794459475648522,@jthrasher @DjokerNole A person told me claimed herself and rest of her family did not take the vaccine and her family doctor isn’t vaccinated.  She said look at what vaccination people experienced it.  Here it is https://t.co/LAcnhybPFY. Type Covid-19 vaccine and you will see how many ADR there.,en
2022-08-26 10:34:53+00:00,1422562311592714242,Locally-made COVID-19 vaccine for trial November https://t.co/SnrOjsEmjN https://t.co/Z8bCZkKXLC,en
2022-08-26 10:34:49+00:00,1520093371917869056,#WEFcrimesAgainstHumanityA COVID-19 #vaccine study on pregnant rats that showed abnormalities in newborns has doctors raising alarms.🔵 Watch now on @EpochTV 👇https://t.co/cJ4PdQYLG7 https://t.co/G1Je5YmTn2,en
2022-08-26 10:33:54+00:00,1475477342,"@qualud3s @dr_musgrave Absolutely because of covid 19, not the vaccines. The vaccines if anything has hastened us getting to a point where we can resume looking after patients",en
2022-08-26 10:33:01+00:00,1350813381649903617,"@F1knowledgeUK @flightlessP @JamesMelville Not wasting anymore of my time on you and your pathetic insults. For Pfizer Covid-19 vaccine the estimated study completion date is April 2023.  https://t.co/P3ZprTdp8h. Pfizer-vaccine has been given an “estimated study completion date” of Jan. 31, 2023 https://t.co/7bTXz6ozeu",en
2022-08-26 10:31:57+00:00,511740616,"The rise of the #data lakehouse: A new era of #data valueWith 65 million vaccine doses to administer at the height of the COVID-19 pandemic, Luigi Guadagno ..https://t.co/iuzr0NQxpO#Intelligencehttps://t.co/svRWLVY3Pf",en
2022-08-26 10:31:02+00:00,1519042758471729154,TUCKER CARLSON: Democrats are trying to shift blame about the COVID-19 vaccine to Trump https://t.co/hOHGFEXpRe #FoxNews,en
2022-08-26 10:30:22+00:00,835517790,The previous ban on “claims that COVID-19 vaccines do not reduce risk of contracting COVID-19” has been changed to a ban on “claims that COVID-19 vaccines do not reduce risk of serious illness or death.”,en
2022-08-26 10:30:00+00:00,43082514,"A batch of 283,000 doses of Pfizer Covid-19 vaccine donated by Australia arrived in Cambodia on August 26.",en
2022-08-26 10:30:00+00:00,73118256,The Minister of Health has announced that vaccination against Covid-19 and seasonal flu should start on September 5.#COVID19 #vaccine #health @DGSaude #portugal #portugalnewshttps://t.co/ngPPleOzqQ,en
2022-08-26 10:28:47+00:00,1282405036098650112,New Group Fighting Against College COVID-19 Vaccine Mandates https://t.co/iIx04hHqdK,en
2022-08-26 10:26:38+00:00,835517790,"Previously, YouTube banned claims that:➨ “The virus no longer exists or that the pandemic is over”➨ “COVID-19 vaccines are not effective in preventing the spread of COVID-19”➨ “Wearing a mask is dangerous or causes negative physical health effects”",en
2022-08-26 10:25:49+00:00,1456280382027059205,How we’re supporting COVID-19 vaccine education @YouTube https://t.co/W9kJFnnbeM,en
2022-08-26 10:25:34+00:00,1367573378303983621,"🚨Covid Update 🚨🇫🇷 France 🇫🇷France is reporting 17,701 new #COVID19 infections on average each day!During the last week reported, #France averaged 21,328 #vaccine doses that were administered each day.Data: Google News#Omicron #Covid_19 #France https://t.co/AOQAUKQg62",en
2022-08-26 10:24:54+00:00,1191743730665033728,The findings were issued in a report that claims Trump and his administration interfered with the FDA during the early days of the COVID-19 pandemic by endorsing vaccines and treatments that were unproven to remedy the virus. https://t.co/McDSyoKJ8B,en
2022-08-26 10:22:16+00:00,1326659647772762113,"COVID-19 Vaccines and Informed Consent, by @RWMaloneMD https://t.co/rR8uwiDuNB",en
2022-08-26 10:22:15+00:00,4836992285,TUCKER CARLSON: Democrats are trying to shift blame about the COVID-19 vaccine to Trumphttps://t.co/OHJRnhN8xy,en
2022-08-26 10:21:48+00:00,312587042,TETFund-Sponsored COVID-19 Vaccine Ready For Trial Novemberhttps://t.co/TQDGAaoaJu https://t.co/BfojXOBhoC,en
2022-08-26 10:21:15+00:00,81453110,"@drsbarreto @DjokerNole ""Myocarditis With COVID-19 mRNA Vaccines""https://t.co/lZAqLan3C2",en
2022-08-26 10:18:32+00:00,937962626222497793,BRIEF-UK's MHRA Approves Novavax COVID-19 Vaccine For 12 To 17 Years Age Group https://t.co/WKhxDoOHNz,en
2022-08-26 10:18:17+00:00,1388829121115947014,🔊 @AndrejPlenkovic @MichealMartinTD @Xavier_Bettel @sanchezcastejon @jacindaardern Thanks for supporting #VaccineEquity through COVID-19. Will you join #GlobalCitizenFestival and pledge funds to the @WHO mRNA Tech Hub to empower developing regions to produce their own vaccines?,en
2022-08-26 10:14:52+00:00,1327079723923476480,Former City of Windsor employees launch legal action over COVID-19 vaccine mandate | CBC News https://t.co/wyDshAFdcn,en
2022-08-26 10:14:25+00:00,1729556064,"Update today August/26/2022 of pandemic Covid-19 on the planet: Total confirmed 599,393,133. Total deaths 6,481,962. Total Vaccine Doses Administered 12,091,703,074 and daily graph. https://t.co/wUfjzH0VDf",en
2022-08-26 10:13:10+00:00,81453110,"@drsbarreto @DjokerNole You should start reading evidence based science research then...""The unnaturalistic fallacy: COVID-19 vaccine mandates should not discriminate against natural immunity""https://t.co/kNuwhDnvi6",en
2022-08-26 10:12:49+00:00,1327189955454660608,"Former ITV &amp; BSkyB Executive Mark Sharman challenges the official COVID-19 narrative including flawed statistics, high level media censorship, government media financial ‘bribes’, trust lost in doctors, vilification of those warning of vaccine damage https://t.co/MTl47pbN2F",en
2022-08-26 10:12:42+00:00,58023593,Novavax COVID-19 vaccine approved for 12 to 17s by MHRA | https://t.co/BvU5OvINHi | The Medicines and Healthcare products Regulatory Agency has concluded that Nuvaxovid is safe and effective in this age group,en
2022-08-26 10:12:25+00:00,17943765,"@Effthemta1 @ginacarano Simply put, no. At least not vaccines that don’t work on evolving illnesses like Influenza and covid-19. Those aren’t vaccines at all because they don’t 100% prevent a desease.",en
2022-08-26 10:11:28+00:00,2668970076,"The UK government admits once you have been double-vaccinated, you will never be able to acquire full natural immunity to Covid variants - or possibly any other virus. See: In its Week 42 ""COVID-19 Vaccine Surveillance Report"", #auspol #CovidVaccine https://t.co/MLQHKvUUZ3",en
2022-08-26 10:09:36+00:00,1312246113244794881,NOVAVAX COVID-19 VACCINE APPROVED FOR 12 TO 17S BY MHRA #News #Forex #COVID19 #VACCINE,en
2022-08-26 10:09:17+00:00,1375181716013379584,Attorneys for Pfizer Whistleblower Say Company Could be Liable for $3.3 TRILLION in Damages.  The lawsuit alleges that Pfizer and two of its subcontractors violated the False Claims Act by providing bogus clinical trial results to garner the FDA approval of its COVID-19 vaccine.,en
2022-08-26 10:07:57+00:00,1346930673219739650,A federal judge has temporarily halted the discharge of hundreds of Marines who were denied religious exemptions from the military’s requirement that they receive the experimental COVID-19 vaccine shots.,en
2022-08-26 10:07:35+00:00,1385633309200424962,Nice paper in @CellReports by my colleague Hani Zaher et al.!N1-methylpseudouridine found within COVID-19 mRNA vaccines produces faithful protein products https://t.co/BTEcfGHFCV,en
2022-08-26 10:06:30+00:00,475785874,"The COVID-19 vaccine is safe and protects you from contracting the virus. Ensure you receive all the required doses of the vaccine at the scheduled time.Chanjwa! Pata Chanjo, tuwe Chonjo!#Chanjwa #TuweChonjo@MOH_Kenya @MOH_DHP @Amref_Kenya @UKinKenya https://t.co/6PUfeEUZyN",en
2022-08-26 10:05:41+00:00,2651700817,"@NeilAxelrod @SeanKneale @AdamKinzinger ""C19 vaccines are effective at preventing severe disease, hospitalization, and death. However, since vaccines are not 100% effective at preventing infection, some people who are up to date with the recommended vaccines will still get COVID-19.""https://t.co/5XmC5We2Rq",en
2022-08-26 10:05:25+00:00,1346930673219739650,An analysis of internal documents found 44% of the pregnant women who participated in the Pfizer COVID-19 vaccine trials suffered miscarriages.,en
2022-08-26 10:04:25+00:00,999334884127592448,Domestically-packaged COVID-19 Vaccine Factory to Break Ground in Novemberhttps://t.co/tfVw7uh9gE,en
2022-08-26 10:03:25+00:00,3475690522,People aged 50 and over can now get their Covid-19 booster vaccine https://t.co/gx2zXsOvRy,en
2022-08-26 10:02:27+00:00,500830165,Webinar: Building Vaccine and Screening Confidence Training ProgrammeDates: 12 Sep to 10 Jan.Aimed at community champions and those in public/patient facing roles to support Flu and Covid-19 winter vaccination campaigns.For info/to book: https://t.co/7zXLyIxGwH@YHADPH https://t.co/jLOQgadnSB,en
2022-08-26 10:02:19+00:00,111613782,"5-11 year olds are eligible to get the Covid-19 vaccine. To find out what this means for your child, visit https://t.co/AxT6ujmocD If you have questions about the jab, you can speak to clinical staff at the site. https://t.co/ezE9h7X2gb",en
2022-08-26 10:02:02+00:00,97982011,Prof. Levi is a serious scholar and professor at MIT. But the complicit Israeli media continues to ignore the scandalous behavior of the @IsraelMOH to hide adverse events from COVID-19 vaccines. @Haaretz @972mag @ynetnews @MaarivOnline @IsraelHayomEng @IsraelHayomHeb,en
