date,userid,tweet,lang
2022-01-09 14:49:18+00:00,e97fc1bd304499c10a6cb6b5b613a8f9758c119622ea1a6e5a2d90963cfbe0ad,"Pro-vaxxers, how many experimental mRNA COVID-19 vaccines are you willing to inject into your body? When will you say enough?! This virus is highly treatable and over a 99% survival rate!",en
2022-01-09 14:48:45+00:00,6c7e5d9a779234e82b9129259e996ed3,People Injured by COVID-19 Vaccine Are Left in the Dark: Agricultural Pilot https://t.co/p0Zj0ljJIQ,en
2022-01-09 14:48:25+00:00,2612678d2f7a25c4d78d6f84ef54f640,I have started a petition to seek a 100% tax on all sales of covid-19 vaccines and test. If there’s no money to be made these companies will back down https://t.co/8QjINFmp3w #CoronaPositive #coronavirus #CovidVaccine @FauciFan #vaccine #Omicron,en
2022-01-09 14:47:58+00:00,1e2233ac12e0afa14a294985c6d98a3f,"If you believe the personal risks of the vaccine are at all comparable to the personal and communal risks of COVID-19, you should not sit on the Supreme Court. #SCOTUS #mandate #antivax",en
2022-01-09 14:47:38+00:00,3cb3517f9b280fa925efec72a0d1d3f48124f20e2a4f2cc79f45af6374644f55,COVID-19 rules changed to deal with food shortagesDistribution issues are affecting the new stage of Australia's vaccine rollout to younger children. It comes as Queensland becomes the first Australian state to delay the return to school over Omicron c… https://t.co/VcB7kCqQik,en
2022-01-09 14:47:37+00:00,3cb3517f9b280fa925efec72a0d1d3f48124f20e2a4f2cc79f45af6374644f55,"Children eligible for vaccine from Monday Jan 10From January 10, 2.3 million Australian children aged five to 11 will be able to get the Pfizer COVID-19 vaccine.https://t.co/9ELpucJAaC",en
2022-01-09 14:47:26+00:00,b37598d7fc69e35cea5a96906a6387a219f2d9039f52f4581faaf6135d476aa9,"@aaasandeep Yet, leaders of opposition question &amp; misguide citizens on management of Covid-19 by Govt of India. Can anyone remember a time when India was independent for vaccine &amp; efficiency of it going into arms?",en
2022-01-09 14:47:18+00:00,b4a35b9ee0741c102036b840fb003a2a,Novak has managed to prove that a problem with celiac disease can cause serious complications if he is vaccinated with any vaccine against Covid-19. He even corroborated these claims with a confirmation from a Cambridge scientist that the vaccine could harm him,en
2022-01-09 14:47:16+00:00,55ef4e4fe2997a237c682c282883303c,"Scientific Studies prove the Covid-19 Vaccines damage the Immune System, and suggest it may be permanenthttps://t.co/t7cmceu7Eq",en
2022-01-09 14:47:03+00:00,090c26e6d267db4e4b9cdfc26dfe7363,"Steve James, consultant anesthetist at the King’s College Hospital, said he doesn’t believe the science for mandating the vaccines is “strong enough” and government should consider that some doctors have had antibodies through previous exposure to COVID-19 https://t.co/NVqXzt4rCA",en
2022-01-09 14:46:59+00:00,2ff8f590afea1435f3047d141cbc58ae,"@AttyAbdul Now do smoking, heart disease, diabetes and so on. If the vaccine was effective, as promised, then perhaps you would have a valid argument. But studies are showing it's not. Hence the need for 3 or 4 shots. Next let's discuss adverse effects. BTW I got 1 of the shots &amp; COVID-19.",en
2022-01-09 14:46:52+00:00,fb4dd11ae37b3914d0570ed24c2b9c5d,"@aerztezeitung “A prior COVID-19 infection was associated with an 8% increase in the risk of having any side effects after the first vaccine dose."" https://t.co/hTIrusAq9E",en
2022-01-09 14:46:40+00:00,8751eca5ddc9cc4c1d678033dcc24557967a5a6bd02617dc4405cfec21ffa8fb,"Covid-19 has been around for about 2 years, why did Novac Djokovic not take a jab, a 1st &amp; 2nd doses before the Australian Open? He must be a vaccine hesitant person, looking for excuses. Not sure if he had Covid-19! Hahaha!",en
2022-01-09 14:46:37+00:00,61a622cea827477fae715e6997bfca7b,"CHUMLEY Supreme peril: Future of liberty hangs in SCOTUS hands with COVID-19 vaccine cases - https://t.co/hfE2JRbrJF - @washtimes If OSHA is to become the arbiter of all health-related issues, then employees' behaviors all hours of the day and night would become agency concerns.",en
2022-01-09 14:46:11+00:00,7dc9fe38571b41185b36b07c89affaa0,Registration for precautionary dose of COVID-19 vaccine begins on CoWIN portal on Saturday https://t.co/LZJBMXe7JY,en
2022-01-09 14:46:09+00:00,5b012265c213834244be516c9a8b00a6,Registration for precautionary dose of COVID-19 vaccine begins on CoWIN portal on Saturday https://t.co/rtZc0aGT7N,en
2022-01-09 14:46:08+00:00,43e7c2f2c6dd0afcd8da7dec1449debc0cce9788b3edd0a7f8ccd5a28b650b21,Registration for precautionary dose of COVID-19 vaccine begins on CoWIN portal on Saturday https://t.co/lKso0Bdth4,en
2022-01-09 14:45:03+00:00,c2cce086c145c1d726488e3cf679e79f9aba482d39f0c07da1d753218a30c24d,"If you have any questions about the COVID-19 vaccine or booster, all our vaccination centres have experts like nurse Agness Ndava, who will be happy to answer them. Visit the Essex Covid Vaccine website to find at clinic near you. Get Boosted today.  #CovidVaccine #GetBooster https://t.co/oys60e8sPq",en
2022-01-09 14:45:02+00:00,aca8b36352d986bb59794b7fbfc08bf2,"Alvernia University COVID-19 Update | January 9, 2022 Return to Campus 2022:⚫ Masking⚫ Vaccine/Booster Requirements⚫ Return Testing⚫ Updated quarantine/isolation guidelines⚫ Campus operations changesRead the update and all new FAQs ⬇️https://t.co/xdez8NFO9X https://t.co/V0yPPV7EAu",en
2022-01-09 14:45:00+00:00,ea24018aa2ff983bef6c5beef475b4ba,"ICYMI | With the Omicron variant of COVID-19 raging, a majority of institutions are putting their trust in vaccines and tried and true mitigation strategies to bring students back to campus this semester. https://t.co/Va7ct1lleU",en
2022-01-09 14:44:55+00:00,614a56938eef6864b8c7c9c73e8b7487,"⁦@CDCgov⁩ Moderna vaccine slightly more effective than Pfizer vaccine in preventing COVID-19 infection, hospitalization, and death | News | Harvard T.H. Chan School of Public HealthIf this is true, why continue pushing Pfizer over Moderna? https://t.co/BFGegLeRGG",en
2022-01-09 14:44:53+00:00,36bb38d6c3d01287c054907ee12c17813636d15efadcdcda4c3cf327477524a3,"COMMENT: ""For months, Djokovic, known for his reticence about taking a covid-19 vaccine, kept a lot of the world on tenterhooks as to whether he would play in the 2022 Australian Open.""#gripthttps://t.co/QAUyV1p0kg",en
2022-01-09 14:44:38+00:00,5f175d390a20d21c64f48b459eb7eec386c152b00c6c1b444957244e9a07c1c1,• Priority access to vaccinations for students and school staff;• Continued access to PCR testing;• N95s to school staff as soon as possible; and• Adding COVID-19 to the list of vaccines in the Immunization of School Pupils Act.**Employer paid SICK DAYS**,en
2022-01-09 14:43:04+00:00,aaf28f6c1764b5bd8e5ef7d67baed5ed,Anti-Vax Protesters Vow to 'Piss Off' Macron After French Lawmakers Approve COVID-19 'Vaccine Pass'.https://t.co/RAuJgYycrx,en
2022-01-09 14:42:38+00:00,b65d559b19b8dfcef790ebc260a63970,MOPH has approved the administration of Pfizer-BioNTech COVID-19 booster vaccines for children aged 12 to 15 years. #QNAhttps://t.co/JX0N2RCwcZ,en
2022-01-09 14:41:15+00:00,3c831244476ce5d6b23071dd19ccc81a652c2f1fce75813c7621d59fb8e048c2,A critical question hovers over SCOTUS decision on COVID-19 vaccine mandate: What if unvaccinated workers can’t find tests? https://t.co/YTp9N85AXF,en
2022-01-09 14:41:14+00:00,efe93f2346e8d37a33bc9f548232ba0e51415f0016d43c98213776eabf8c2e13,"Good morning Twitter peeps! Remember that Covid-19 still is a thing that exists! Remember to keep wearing masks in public, and get vaccinated! Despite what I've heard people say, I'm 100% sure the vaccine does NOT change your DNA or implant 5G tracking signals in your body. :)",en
2022-01-09 14:41:14+00:00,39ca5b33e7ba33ba737eb56bfdacb3080d38230d2267eab691eb4a2b606beb83,#BillsMafia #vaccination #VaccinationObligatoire  Gates Charged with Murder for COVID-19 Vaccine Death in India’s High Court – Death Penalty Sought https://t.co/tfThkGbmlt,en
2022-01-09 14:40:57+00:00,59e727dd107020e4ac7ebfad09b5b94962bd8b4782d8841a50604ba52a0f92f8,"@YB_PALADIN @CanvasPirate The courts constantly change the interpretation of the constitution to fit their current agenda.Likewise Polio and Hepatitis shots are permanent. Covid-19 ""vaccines"" are like flu shots. Flu shots are not mandatory.",en
2022-01-09 14:40:46+00:00,4fd91c098a53e5b7f1ab3b2e722c06e57a90e7e112350c7c52e7a467c73ae9d7,@Laurel4liberty @cprn911 I also think it is important to address risk/benefit. Other diseases have higher risks than Covid. If you have ever had a cold you may have natural immunity to Covid 19. Other diseases do not offer that. Covid “vaccine” is not like the others.,en
2022-01-09 14:40:27+00:00,693284824a14bfb29d4edf1f4583bcfb,I like coding for Covid-19 vaccine counseling. Insurance companies and @txmedicaidworks do not reimburse for it but it is the right thing to do. @texmed,en
2022-01-09 14:40:05+00:00,5c0e1fc1038d796b4ebfbe110e8cbfaa,RatoPati: COVID-19 vaccine card mandatory in public places from Jan 21 - https://t.co/LEVD6nlunk,en
2022-01-09 14:40:05+00:00,5c0e1fc1038d796b4ebfbe110e8cbfaa,RatoPati: COVID-19 vaccine card mandatory in public places from Jan 21https://t.co/4gEzkwEwOc -,en
2022-01-09 14:39:04+00:00,2ee31f3ec9636caa5aca7d37c68aacb2,CDC: Pfizer COVID-19 vaccine 91% effective at preventing MIS-C in kids 12-18 https://t.co/MTWFvPa81D,en
2022-01-09 14:38:45+00:00,59cf7828844d738477aba810cc2fbced6d4cbfad126a2af689485516cb035cb3,Just please stay home as much as possible. Just go out when it’s super necessary like getting a COVID-19 vaccine shot. Isolate/quarantine if you’ve developed symptoms and/or was exposed to someone who's covid+ and get tested within 5 days after the onset of symptoms/exposure.,en
2022-01-09 14:38:40+00:00,59cf7828844d738477aba810cc2fbced6d4cbfad126a2af689485516cb035cb3,"Is it really 2020 too? Or worse? Not really. Primary series of COVID-19 vaccines and boosters have helped reduce severity, minimize the chances of needing hospitalization and mortality unlike 2020. #BeatCOVID19#WeHealAsOne#COVID19PH https://t.co/kOaemr3rcM",en
2022-01-09 14:38:19+00:00,6a96c6ef43d0aa88ff933e96770c7025,PM reviews COVID-19 Situation in the country with particular focus on the preparedness in wake of rise in Covid cases fueled by Omicron variant🔸Ensure adequate health infrastructure at the district level: PM🔸Accelerate the vaccine drive for adolescents in mission mode: PM https://t.co/5eulOZgrUv,en
2022-01-09 14:37:48+00:00,b962b48d59fa46939915106bd327b530,"@CardinalBCupich This is very disrespectful to those of us whose ""experience"" has been losing family members due to the vaccine. My grandma survived covid 19 in 2020 with no problems, then died after being coerced into getting the vaccine about nine months later.",en
2022-01-09 14:37:18+00:00,6450a20fac8fbb1c4e284265aa4f9f29,Where can someone get first dose of Covid-19 vaccine? Asking for a friend.,en
2022-01-09 14:37:13+00:00,33b08cd81b226d24e67583b12627b1f62f26f72c1d73ae679efbdb1a521c6604,"Children Shouldn’t Get COVID-19 Vaccines, Harvard Professor Says",en
2022-01-09 14:37:10+00:00,8419243b3396aefc80ca3c6ead6f2547ea8503907c3ce87eec1374f98fbeae00,New research has found that a booster dose of a COVID-19 vaccine could produce sufficient antibodies to 'neutralize' the Omicron variant.https://t.co/qwpXKxIdjI,en
2022-01-09 14:37:04+00:00,3bb329149efb198f6cc9ef5325f70545,CDC: Pfizer COVID-19 vaccine 91% effective at preventing MIS-C in kids 12-18  https://t.co/ap7CGCfSwx,en
2022-01-09 14:36:45+00:00,808e25b9383c699751dfe5c8686fc2ad19f2d9039f52f4581faaf6135d476aa9,@recombobulating @JJJungleJim @RickyDHale @mads_mikkelson I didn’t followed what you said but does any public laboratory founded a vaccine for the COVID 19? All the COVID vaccine come from private company.,en
2022-01-09 14:36:15+00:00,7c63cad24082c46bd6ab218233341c8696f10a724928f80cba9ff656bcfcb4e8,"Example of Mass Formation Psychosis-  Despite all the data showing that the vaccines don’t work to stop the spread of COVID-19, people still push policies like vaccine passports and vaccine mandates as not only physically necessary but morally necessary as well.",en
2022-01-09 14:35:46+00:00,24e1855ce959e7db3d002b92d8ed8afd40c4c2b695144af394971d2e61654951,This is a Small case study of 15 children with myocarditis after vaccination “Association of myocarditis with the BNT162b2 messenger RNA COVID-19 vaccine in a case series of children:” https://t.co/WgXF1fN3cF,en
2022-01-09 14:35:15+00:00,332ff78d493b97fd9a1a8d7ea23298470de7c3003c81a9646f13be5396412fab,"The preprint “Evaluating Real-World COVID-19 Vaccine Effectivene…” (https://t.co/LbOo4TqoSc) has been reviewed by automated tools, find results here: https://t.co/T0FQbDx0pQ. We detected 3 of 5 rigor criteria, 0 resources, and no limitations statement.",en
2022-01-09 14:35:14+00:00,55ef4e4fe2997a237c682c282883303c,"German Government Data for the alleged Omicron variant of Covid-19, suggests that most of the “fully vaccinated” in the U.K., USA &amp; Germany will have full blown Covid-19 vaccine induced acquired immunodeficiency syndrome (AIDS) by the end of January 2022https://t.co/hvga5DD2qD",en
2022-01-09 14:35:13+00:00,2035e1bc3c3592c73468c2bb96dc3d271b36610fc1c0519d3938b2382554c15e,United States Department of Health and Human Services: Petition to add all COVID-19 vaccines to the Vaccine Injury Compensation Program (VICP) - Sign the Petition! https://t.co/ETA7OJ9mpD via @CdnChange,en
2022-01-09 14:35:10+00:00,a8e952c1258f695768a624807709ddd1d8226542fdd82554447e124088ddfbdc,@RebeccaAnneM @BradJDavis1967 @anniepeters08 @POTUS The breakthrough deaths stand as a reminder of how lethal COVID-19 can be. False dichotomy/binary thinking is pushing vaccine hesitancy. Everyone is fearful and what you fear most is driving your choices.,en
2022-01-09 14:34:44+00:00,8a4854ff108216c0c39ec65652c67c49ff3c8bdbe1fb51cde2aa49c078e59f85,PM reviews COVID-19 Pandemic Situation in the country with particular focus on the preparedness in wake of rise in Covid cases fueled by Omicron variantEnsure adequate health infrastructure at the district level: PMAccelerate the vaccine drive for adolescents in mission mode:PM,en
2022-01-09 14:34:01+00:00,0f5a9c3895a703c7e1ce5f95d1fb6b41,"Starting this week, the Ysleta Independent School District will host COVID-19 vaccine clinics at 38 schools. ➡️ VIEW DATES, LOCATIONS, AND PRE-REGISTER HERE: https://t.co/vsAVFZjF84 https://t.co/XSSBFJYYZO",en
2022-01-09 14:33:44+00:00,2c5001d01d010606dcc5d4b513b4e047,So the day has finally come. I have tested positive for COVID-19. This horrible disease has got to me now. I luckily don't have severe symptoms as of YET. I do hope people take this shit seriously. Get your vaccine. Get Boosted. This shit will not get to me inshallah!,en
2022-01-09 14:33:20+00:00,f3ebd6b736ea7f897232b3ca1b02123f,"Looking for a #COVID-19 vaccine? We have appt. slots open for tomorrow (Monday) at our Seneca Clinic - Must be 30+, Moderna only. Please book at: https://t.co/LuYsXWSl5W https://t.co/2dznRN8Pfs",en
2022-01-09 14:33:03+00:00,e69f3350947df59ae914a03b0d424eed,"RTStateDept: This week, the United States partnered with @gavi #COVAX to deliver nearly 5 million COVID-19 vaccine doses to 5 countries in Sub-Saharan Africa. These vaccines are safe and effective, with no political strings attached. https://t.co/jml1trDQSz",en
2022-01-09 14:32:45+00:00,24e1855ce959e7db3d002b92d8ed8afd40c4c2b695144af394971d2e61654951,Vaccine-induced immune thrombotic thrombocytopenia and cerebral venous sinus thrombosis post COVID-19 vaccination; a systematic reviewhttps://t.co/F1ZZDUEkwb,en
2022-01-09 14:32:21+00:00,0c8834b4f94e9462e9908f4a91561c6d,"77,737 doses of #Covid-19 vaccine administered to eligible persons in #Telangana on Sunday. 4,90,90,420 doses given since d launch of vaccination in Jan. last incl. 2,00,52,678 persons taking 2 doses each. Nearly 22.37 lakh doses of vaccine stock available with Govt. @THHyderabad",en
2022-01-09 14:32:10+00:00,091baf7a695bc09e58858f4a96c57c4c848207c8ab00f910a751581aab81f5e0,Go get the COVID-19 vaccine!,en
2022-01-09 14:31:37+00:00,e76b18306f8bd66b3acca33082264a4f,Parents question EXPERTS on Covid-19 Vaccines for 'Children'Watch live on FB at 7.30 PM https://t.co/7ObTpvZ8j7Requesting all parents to send this to your school groups! Let Parents join this very important and informative session to learn more about the Covid vax for children! https://t.co/NDOiij84r7,en
2022-01-09 14:30:42+00:00,348560f96f1c79905d9538b1ed3412b8,Moderna donates 2.7 million vaccine doses to Mexico as COVID-19 cases surge https://t.co/wFLbyvlrdt,en
2022-01-09 14:30:36+00:00,d9472c0aff09af6b999dbba60a662d4363915b89f1255bca0925eaa128d81974,COVID-19 Vaccine Alert! The Only OB-GYN Doctor In America to Reveal the Dangers of COVID-19 Vaccines https://t.co/iK7R2QP26M,en
2022-01-09 14:30:36+00:00,0c96e9a269167c1d54f6f93a4dde3cc8,CCMCC recommends : 1. Closing schools until Jan 292. Making COVID-19 vaccine card mandatory from Jan 213. Restricting mass gatherings with more than 25 people,en
2022-01-09 14:30:29+00:00,f77302f38485027d031a5cfa55bd3d92,COVID-19: Nearly Half of Adults Have Already Gotten Vaccine Boosters https://t.co/tGUqEBheoU,en
2022-01-09 14:30:00+00:00,e5aa5ef1155b9b10b01aeb78884900e7,⚕️🦠💉🏥2 years in: What's the best strategy to end the coronavirus pandemic? https://t.co/gzQgwEY359 via @dwnews #pandemic #Covid #Covid_19 #COVID19 #pandemic #Germany #Chilie #Argentina #vaccine #publichealth #kids,en
2022-01-09 14:30:00+00:00,c18b4073a0fda28c7d59f007f76461bc,"This week, the United States partnered with @gavi #COVAX to deliver nearly 5 million COVID-19 vaccine doses to 5 countries in Sub-Saharan Africa. These vaccines are safe and effective, with no political strings attached. https://t.co/8HnoesDWgB",en
2022-01-09 14:29:02+00:00,bc9e6494f255b4f62122bef85eed038dee294151a436de3b7a8901f191f4184b,1 in 3 states has already prohibited COVID-19 vaccine mandates in schools — even before the FDA has fully approved vaccines for children. https://t.co/2QGaDh6CTJ https://t.co/xlcvCrFjMA,en
2022-01-09 14:28:10+00:00,312eed4f7739a973df696b1c8678aa71f58ac743c75073a147d335d2c63a3535,@njdotcom Maybe I missed something here… what does the Covid 19 vaccine actually do?? Last time I checked all it did is possibly keep you from getting sick… so when it comes to transmission vaxed or unvaxed what is the difference…,en
2022-01-09 14:27:46+00:00,337aec2ce8ae025a6ddb4702a8c5e2c4,WARNING: COVID-19 Vaccine Is A KILLING Machine! Dr. Judy Mikovitz!!! https://t.co/V4wA9qU5Pa,en
2022-01-09 14:26:45+00:00,3bb3017e3695a588e8edb740e993c6bb,"Americans, the Government pushing lies blatantly in your face.....did you see funeral procession line up of cars everyday in your city? I did not! Did you? Covid-19 vaccines they pushing, yet the virus itself did you see funeral processions to match the news reports of deaths? No",en
2022-01-09 14:26:34+00:00,1596ff3e700baab2b365d4d76c1e0c02,"Warrant Investigation and Prosecution. Milk 🥛 is the Original Vaccine that defeated the Great Plaque"" in America. Donald Trump made Milk ""Companies destroy the milk! Knowing milk🥛 is the Remedology(Vaccine) That Rapidly Cure Influenza-Pnuemonia(Covid 19).Sanctions a must🌎👑🤴",en
2022-01-09 14:26:32+00:00,ed4b3a91685d580d0913a52f5878f5a8,An anti-science hysteria was on full display during oral arguments. Justice Sam Alito hounded the solicitor general about the alleged risks of vaccines while justice Neil Gorsuch likened COVID-19 to the flu. https://t.co/Jxr0cbfRht,en
2022-01-09 14:26:24+00:00,bb71bfbee710b492a80f67fbcef962a9,"""Vaccine skepticism has been joined not only with covid-19 denialism and Trumpism but with regulatory skepticism, and indeed with hostility to the idea that the federal government has any place regulating businesses at all.""https://t.co/qW2LoHqYJB",en
2022-01-09 14:26:22+00:00,7a0feca9635df0548751d12f634cc889b6f79280101362d8109c6079e1cfd156,COVID-19 Vaccines for Children and Teens  | CDC https://t.co/Ym8mqq4Uor,en
2022-01-09 14:26:00+00:00,c30e95f6608e3a6e927b861875929a1eed7209f0285efd8836ad8722f96500de,"Lmao! No real Honey, gingeroot, and garlic! Doesn't taste great but it got me and a few others back on our feet in three days! Great for the flu and colds! Sweat it out!Omicron: Vaccines remain the best defence against this COVID-19 variant and othershttps://t.co/yFUiNy3N0y",en
2022-01-09 14:25:22+00:00,24e1855ce959e7db3d002b92d8ed8afd40c4c2b695144af394971d2e61654951,Fatal cerebral haemorrhage after COVID-19 vaccinehttps://t.co/IWhKPeoZ3J,en
2022-01-09 14:25:15+00:00,b0ff7476ac7700d9d91fb0a1ef8a49b9,Anti-Vax Protesters Vow to 'Piss Off' Macron After French Lawmakers Approve COVID-19 'Vaccine Pass'https://t.co/zj0ynAug7V,en
2022-01-09 14:25:06+00:00,f13bf84e2e47be0a2d41200934910fdc8f392400d539037d450d623a668b4f39,@SenRickScott Vaccines safe lives. Most recent Covid-19 deaths are unvaccinated. Results speak louder than words.,en
2022-01-09 14:25:00+00:00,f473fbd2deb0045094864c69bab04c23,"2021 drug approvals! Include controversial accelerated approval for Biogen's Alzheimer's drug Aduhelm, Pfizer's record-shattering COVID-19 vaccine, Comirnaty, and others! $BIIB $PFE $BNTX $JNJ $MRK #pharma #healthcare https://t.co/yMvI7maITm",en
2022-01-09 14:24:44+00:00,df9ed2ba699cef7c3c6efd0134723057bcbd7e127e19920ecf3e4b5c53912f4e,Over 17.74 cr unutilized COVID-19 vaccine doses still available with States/UTs: Centre https://t.co/bSBty1Yn6v,en
2022-01-09 14:24:43+00:00,e795e221ca74ba54761fc85798009a3ebf801be1f1d569397999420f939b93a3,Children aged five to 11 years are eligible for the COVID-19 vaccine from tomorrow https://t.co/YOOawRJueR,en
2022-01-09 14:23:48+00:00,3f1a97d12678f0a76401c6bb2726fdcb,"“During the pandemic, the courts have rightly relied upon a century-old precedent of the Supreme Court in mandate cases, but they have gravely misunderstood and misapplied that precedent to uphold draconian and unjustified Covid-19 vaccine mandates.”",en
2022-01-09 14:23:47+00:00,3f1a97d12678f0a76401c6bb2726fdcb,"I do not know her personally, of course, but based on what I have read, I thought the following looked like an article @JennaEllisEsq might appreciate:COVID-19 Vaccine Mandates Fail the Jacobson Test Co-authored by Harvey Risch and Gerard Bradleyhttps://t.co/ZVIPMPece4",en
2022-01-09 14:23:32+00:00,e6537fe75435025f8e4ddde9ce8f8190,"🚨🚨🚨🚨🚨🚨🚨🚨🚨🚨🚨🚨Could the U.S. See a 4TH Covid-19 Vaccine Dose? Moderna, Pfizer Say 👉🏿. Y E S  . Time to admit &amp; FDA legally change name from VACINE to [therapeutic] along with other therapies for publics optional use @cspanwj @MaajidNawaz @talkRADIO @lbc @GBNEWS https://t.co/BdPEkT21lV",en
2022-01-09 14:23:22+00:00,9c056a049c2aaf5132655ff5f2a009392f26f72c1d73ae679efbdb1a521c6604,"@JustinTrudeau Covid 19 vaccines are under emergency use authorization!  Have they have been fully authorized for use now?  Have the trials ended and all data is going to be released on effectiveness, side effects and the amount of deaths they have caused? #NoMandatoryVaccines",en
2022-01-09 14:23:15+00:00,f0597716568f515d47c5954b20924b6c,Vaccine-induced immune immune thrombotic thrombocytopenia and cerebral venous sinus thrombosis after vaccination with COVID-19; a systematic review: https://t.co/WJYTkrGboN,en
2022-01-09 14:23:06+00:00,128c16482975f6bc9708ef2c6e0d9bb5,"Novak Djokovic was granted vaccine exemption after testing positive for Covid-19 in December, court documents show - CNN https://t.co/sJOPOwZF6G",en
2022-01-09 14:22:58+00:00,c252ec49aa8fbf36fe96ac1ebe3e5dac79ea6213d3066c465c1c6b56c644f894,"COVID-19  Vaccine Pop-Up Clinic - Sun Jan 16th, 2022 at @jcaontario from 12pm - 6pm. 1st,  2nd &amp; 3rd doses available See flyer for more details https://t.co/uv4DxDOYtH",en
2022-01-09 14:21:57+00:00,88adb0025f9f247f802080baf2b906f3a4e948f547e0f18a35d5664b023bb4c1,"The CDC states the the vaccine has been approved to prevent Covid-19, not to reduce the symptoms ! https://t.co/Imxf8h5s3K",en
2022-01-09 14:21:42+00:00,e71d69d90c7129a40e2881d4b490af5bc6d3c6052a4093355d74a63ef2606182,@johnpavlovitz Fake Christian: I don’t need a vaccine because God will protect me from COVID-19.Same Fake Christian: I need a gun because there are dangerous people running around that God won’t protect me from. 🤪,en
2022-01-09 14:21:37+00:00,9c0040bc15e20143e5f10561dfdacfcf967a5a6bd02617dc4405cfec21ffa8fb,@forbeshealth I'm pretty sure that's what is happening to the  people refusing the vaccine and then dying from COVID-19...or it's just a cult... either way those people are fucking nuts!!!,en
2022-01-09 14:20:34+00:00,7524ab224740e9731f00239da7de7fd919fabdf7cb2f5042a48b6c1e2cf2a424,"Apple stores in Dubai are currently closed due to outbreak of COVID-19 Among their staffs...Don't be deceived, please get your vaccine! It's totally free! https://t.co/7zOjUGUJYy",en
2022-01-09 14:20:09+00:00,f8093ead6a0363d555c0f2d09b4c482f,13 reasons why 5 to 11-year-old Children should not be given the Covid-19 Vaccine – The Expose https://t.co/urR3VEiVg9,en
2022-01-09 14:20:04+00:00,004bcfa35ebf279ebbc7a073fbe080e9230e8196c3f4e014ee7c1281de7de56c,A friend who's scared of COVID-19 and doesn't get hit. ---https://t.co/Y53BTkPjEH --- ! ---#COVID_19. #Friends. #Vaccine. https://t.co/VLt8Kqv5tg,en
2022-01-09 14:20:02+00:00,4aee06dcd551152764ba05465dca86f61f62d2ce53f91eea37a04886d1e7539d,@Ijustwannakno20 @QasimRashid @SenTedCruz boosters &amp; have not experienced any severe side effects.  Vaccine science is well known &amp; understood.  We know it works.  Data on the COVID-19 vaccine overwhelmingly confirm they are highly effective &amp; adverse side effects among the greater population are consistent with other…,en
