date,userid,tweet,lang
2022-07-24 15:01:11+00:00,2835276183,"this will be the first knock-on effect of covid-19 (quarantine, masks + vaccines) being so politicized. thanks again for nothing, trump. #frustrating",en
2022-07-24 15:01:05+00:00,318065652,"Anyone can get long COVID but the best way to prevent it is by getting the COVID-19 vaccine and booster and wearing a mask that has both a good fit and good filtration, like an N95, KF94, or KN95. https://t.co/McsllngkmY #VoicesofLongCovid https://t.co/daXNStbVI4",en
2022-07-24 15:00:22+00:00,76351588,Get the Facts! ✅Hear why Samantha decided to get vaccinated and is now encouraging others to #GetTheFacts about the COVID-19 vaccine. Watch below or by visiting: https://t.co/bs2JZ06P7oFor more info about the COVID-19 vaccine visit: https://t.co/Y8aLZK4R6L https://t.co/Qr16IOaIHw,en
2022-07-24 15:00:18+00:00,1214209408751685632,@10DowningStreet United Kingdom Criminal Organization Why has the so called safe &amp; effective COVID-19 (toxic injections) vaccines resulted in serious injury &amp; death?,en
2022-07-24 15:00:17+00:00,331244103,Our COVID-19 mobile vaccine clinic will be at the Peruvian Festival La Raza Park until 5 p.m. Register for an appointment at https://t.co/KwdSVEfOdu. No proof of identification or health insurance is required. https://t.co/shVU03FLTu,en
2022-07-24 15:00:01+00:00,360512052,"Discover this recently published special issue from Journal of Infection and Public Health: COVID-19 - Vaccine, Variants and New Waves. Edited by Rehab H. El-Sokkary. Read open access https://t.co/uuLPsWVDdi https://t.co/Z13EjIAJcf",en
2022-07-24 15:00:00+00:00,25526995,🚌The vaccine bus is coming... Catch it at:📍 @StaffsUni Leek Rd Campus car park ST4 2DEWed 27 July 11.30am-4.30pm📍 United Carpets car park 135 Waterloo Rd ST6 2EZFri 29 July 10.30am-3.30pm 💉Vaccines are the best protection against Covid-19 https://t.co/biQVz5Wedw,en
2022-07-24 14:58:41+00:00,225187661,"NEWS: China says Xi Jinping and other leaders have been given domestic Covid-19 vaccines, amid public concern over safety https://t.co/srELepnxbu Via @CNN https://t.co/limgZ4DMq8",en
2022-07-24 14:58:28+00:00,47086949,"China says Xi Jinping and other leaders have been given domestic Covid-19 vaccines, amid public concern over safety   https://t.co/DX7jAa4hqQ",en
2022-07-24 14:56:23+00:00,717190286322085889,"@SharylAttkisson Most vaccinated people refuse to admit the facts. Vaccines may have helped those who caught covid-19 but as the virus changed and got weaker, it appears to offer no benefit at all It is possible that it actually has a negative impact.",en
2022-07-24 14:55:48+00:00,1429288450654494722,"China says Xi Jinping and other leaders have been given domestic Covid-19 vaccines, amid public concern over safetyhttps://t.co/GmPpjzb06a",en
2022-07-24 14:55:10+00:00,40072072,@Biohazard3737 I got shingles after receiving Covid-19 vaccine.  And I was vaccinated for shingles.  I can’t get rid of the shingles.  No more boosters for me!,en
2022-07-24 14:52:25+00:00,1543384624541286401,@psypharmacopeia @michael_house9 @First10EM Your right we should keep the same measures that we had when COVID-19 first appeared and not adjust the population having two vaccines and 1-2 boosters. Sniffles are a killer,en
2022-07-24 14:49:40+00:00,1172554943787667456,"Americans trusted these Liars...unnecessary multitude of people left with a lifetime of side effects, or dead.Why have they not been arrested?Birx Says COVID-19 Vaccines Were Never ‘Going to Protect Against Infection’ https://t.co/mlVpNRPagT via @epochtimes",en
2022-07-24 14:49:36+00:00,94345362,"""Every person in the hospital sick with covid 19 is vaccinated, every person who dies from covid 19 was vaccinated. It's time to roll up your sleeves and get the shot."" who's gonna wanna get the shot now if the vaccine is making people sick and killing them.",en
2022-07-24 14:48:46+00:00,1434771787,Birx Says COVID-19 Vaccines Were Never ‘Going to Protect Against Infection’https://t.co/UA80mnHtSc,en
2022-07-24 14:48:36+00:00,1450102031625211904,"@sfsmyles @TrashPandaFTW @Acyn I remember @POTUS saying you wouldn't get COVID-19 if you got the vaccine. Look at him now, still has your loyal support. https://t.co/Y2DvQpNIxI",en
2022-07-24 14:47:35+00:00,3115929100,"600 Million Doses Later, Dr. Birx Admits She “Knew” COVID-19 Vaccines “Were Not Going to Protect Against Infection”🇺🇸💉@COVID19Up: Dr. Deb Birx admitted on Friday (July 22) that she ""knew"" the COVID-19 vaccines ""were not going to protect against infection"" https://t.co/IzWHQRZJZK",en
2022-07-24 14:47:21+00:00,1503521215410937860,"America’s Frontline News reported that renowned physician and medical expert Dr. Andrew Bostom, MD, MS had been suspended by Twitter after posting a recent peer-reviewed study showing the COVID-19 vaccine impairs sperm count in men.",en
2022-07-24 14:47:04+00:00,1255039838,"My ex-wife says my ex-wife and other leaders have been given domestic Covid-19 vaccines, amid public concern over safety - CNN https://t.co/3DMUWCRNtF",en
2022-07-24 14:46:59+00:00,1519690003944726528,Data from UK and Australia: people who get four or more doses of a COVID-19 vaccine are about 100 times more likely to be hospitalized than those who are unvaccinated.https://t.co/E60nHWfYYI,en
2022-07-24 14:45:50+00:00,294438257,"Time trends, factors associated with, and reasons for COVID-19 vaccine hesitancy: A massive online survey of US adults from January-May 2021 https://t.co/lFjmfGGwVi #covid19",en
2022-07-24 14:44:41+00:00,23610945,Report: Heavier menstrual bleeding can happen days after getting COVID-19 vaccine https://t.co/2eIojywNea,en
2022-07-24 14:44:34+00:00,1445951341688467461,"@RachelNotley Feelin' good after declining all of my COVID-19 vaccine.Trust science, not dangerous political spin. 🩸#ableg #abhealth",en
2022-07-24 14:41:06+00:00,116502194,"“It is the BA.5 variant … but thank goodness our vaccines and therapeutics work well against it,"" the White House COVID-19 response coordinator said.https://t.co/pWkXpzhtF6",en
2022-07-24 14:41:01+00:00,1221854014557560833,@thehill I see democrats want billions for COVID-19 vaccines not only for America but worldwide how can u think vaccine works when one’s jabbed keep getting positive tests even Biden. Toxic they r a lot of risks when boosted even destroys immune system mutates virus/‘CDC FDA.,en
2022-07-24 14:40:58+00:00,98665203,"Here's proof the medical ""experts"" lied to the public. Congress must bring Birx &amp; Fauci to Capital Hill (under oath) to find out why they lied.Birx Says COVID-19 Vaccines Were Never ‘Going to Protect Against Infection’ https://t.co/tsLn4d7W6W",en
2022-07-24 14:40:53+00:00,3400369827,@babymammoth_0 @sickofcranks @Chr15V @walks_sc @CreatePerhaps @Jjulian6412 @michaelpbreton Nope. That’s itThe vaccines are designed purely to prevent serious illness from Covid-19 and not for some evil purpose like your scared little mind has been gaslit to believe.And they work,en
2022-07-24 14:39:35+00:00,1355260130074484738,"Washington, DC Child COVID-19 Vaccine Mandate Illegal: Legal Expert https://t.co/z9tK9AmKLO“We need everyone to get vaccinated to stop the spread and protect vulnerable members of our community,” Councilwoman Janeese Lewis George, a Democrat, said during a hearing on the bill",en
2022-07-24 14:38:50+00:00,833901727501815809,"Report: Heavier menstrual bleeding can happen days after getting COVID-19 vaccine,https://t.co/pObMBoV5AO",en
2022-07-24 14:36:40+00:00,17409173,"The federal government gave Moderna $2.5 billion to develop a COVID-19 vaccine. (OUR TAX DOLLARS) Meanwhile, Moderna's CEO just walked away from the company with a $926 million golden parachute.This is what oligarchy looks like.",en
2022-07-24 14:36:34+00:00,1495189508127612936,"Birx now Says COVID-19 Vaccines Were Never ‘Going to Protect Against Infection’; this malfeasant said prior to get you to take the vaccine ""This is one of the most highly-effective vaccines we have""..“I knew these vaccines were not going to protect against infection.",en
2022-07-24 14:35:45+00:00,177360768,“The DHEC will not require that students get the COVID-19 vaccine for the new school year.”https://t.co/XHRjZa75Ho,en
2022-07-24 14:35:20+00:00,1434521960894107650,Revisionist history Birx Says COVID-19 Vaccines Were Never ‘Going to Protect Against Infection’https://t.co/PV0e7RLnjK https://t.co/BfaqOLdfDT,en
2022-07-24 14:35:02+00:00,25924647,China comments on Covid-19 vaccine safety https://t.co/QjBFBsiec4 #,en
2022-07-24 14:34:13+00:00,1491207136881389576,"Birx now Says COVID-19 Vaccines Were Never ‘Going to Protect Against Infection’; this malfeasant said prior to get you to take the vaccine ""This is one of the most highly-effective vaccines we have"".. https://t.co/SvC4j4zbyi",en
2022-07-24 14:31:02+00:00,708724060918710272,US Army Has Approved Only 20 Permanent Religious COVID-19 Vaccine Exemptionshttps://t.co/KwsIrsNOEu,en
2022-07-24 14:30:00+00:00,22997830,There’s a vaccine clinic open today in #CityofPG COVID-19 Testing and Immunization Centre. Head to 175-1600 15th Ave for all ages (5-11 and 12+). @shirleybondFor info on @Northern_Health clinics and how to book for ages 5-11 and 12+ visit: https://t.co/IJ3OEdEVdm,en
2022-07-24 14:29:52+00:00,21578604,Posts Misleadingly Omit Critical Data Supporting COVID-19 Vaccines for Youngest Kids https://t.co/yLJYPLraep via @factcheckdotorg,en
2022-07-24 14:28:23+00:00,1375927250529452032,Pfizer-BioNTech COVID-19 BNT162b2 Vaccine Effectiveness Study - Kaiser Permanente Southern California - Full Text View - https://t.co/38oMHEbqn3 https://t.co/35ICdXD50K,en
2022-07-24 14:28:03+00:00,1322549230351740928,Thanks to KKM for helping link the 2nd booster dose vaccines against Covid-19 for those eligible.,en
2022-07-24 14:26:01+00:00,191204442,Great news! The COVID-19 #vaccine is now available for children aged 6mo to 5 years. Learn why you should get your children #vaccinated in our latest blog: https://t.co/UvHf36rK0J https://t.co/z4R7L3I6Xj,en
2022-07-24 14:26:01+00:00,45951021,Great news! The COVID-19 #vaccine is now available for children aged 6mo to 5 years. Learn why you should get your children #vaccinated in our latest blog: https://t.co/ZVMtmDNKIy https://t.co/4Cf8eGhV8X,en
2022-07-24 14:26:01+00:00,222175543,Great news! The COVID-19 #vaccine is now available for children aged 6mo to 5 years. Learn why you should get your children #vaccinated in our latest blog: https://t.co/qlfbdSCCyt https://t.co/3SkqcvuzLn,en
2022-07-24 14:26:01+00:00,22839002,Great news! The COVID-19 #vaccine is now available for children aged 6mo to 5 years. Learn why you should get your children #vaccinated in our latest blog: https://t.co/Pt3xHC2XbZ https://t.co/ohbRacaOwM,en
2022-07-24 14:26:01+00:00,40035993,Great news! The COVID-19 #vaccine is now available for children aged 6mo to 5 years. Learn why you should get your children #vaccinated in our latest blog: https://t.co/r4vFAtsqrB https://t.co/OOsCknuMGj,en
2022-07-24 14:25:48+00:00,1348471338986594305,@C21stHuman @DonNewmeyer @shelbycat03 @SharylAttkisson @jjrocke “Intracellular Reverse Transcription of Pfizer BioNTech COVID-19 mRNA Vaccine BNT162b2 In Vitro in Human Liver Cell Line” https://t.co/nVE8PdNXYD,en
2022-07-24 14:25:03+00:00,822711212894916608,Tucker Carlson: Biden's COVID-19 positive test steps on vaccine message https://t.co/MsmPVgNzpV #FoxNews,en
2022-07-24 14:22:44+00:00,1700112116,"600 Million Doses Later, Dr. Birx Admits She “Knew” COVID-19 Vaccines “Were Not Going to Protect Against Infection”Dr. Deborah Birx admitted on Friday (July 22) that she ""knew"" the COVID-19 vaccines ""were not going to protect against infection https://t.co/aB6XC3bn6q",en
2022-07-24 14:22:01+00:00,103946239,"Seatbelt ✔️, Helmet✔️, Sunscreen ✔️, life vest ✔️, COVID-19 vaccination ✔️. Keep your children safe this summer, the @CDCgov recommends COVID-19 vaccines for children 6 months and older. https://t.co/TzwfSljzSY https://t.co/w8Efjiryg1",en
2022-07-24 14:20:09+00:00,223626456,"RT @WCTNEMA: A team of nurses from @TNDeptofHealth will be offering FREE Pfizer COVID-19 vaccines and boosters at the Franklin Clinic, 1324 West Main Street, every Wednesday in July.  Vaccines will be provided from 10:00a – 3:00p, and no apt is necessary. https://t.co/MS8BH7Ugro",en
2022-07-24 14:18:40+00:00,137993583,The study showed that immune function among vaccinated individuals 8 months after the administration of two doses of COVID-19 vaccine was lower than that among unvaccinated individuals:https://t.co/qrDOfwuUCm,en
2022-07-24 14:18:39+00:00,222126484,"scientific consensus, as well as attitudes toward COVID-19 vaccines and mitigation measures like mask wearing and social distancing, results indicate that those with the highest levels of opposition have the lowest levels of objective knowledge but the highest levels of",en
2022-07-24 14:17:22+00:00,1498657322670833668,More than 90% of the population have received the first dose of COVID-19 vaccines in #China .  All China 's incumbent Party and state leaders have completed vaccination against the coronavirus with domestically developed vaccines. https://t.co/O5zdkmSP5Z,en
2022-07-24 14:17:05+00:00,1161973934348095488,"""In this series of two patients who developed generalized eczematous reactions to the Pfizer‐BioNTech COVID‐19 vaccine, the reaction occurred with both doses, was managed by oral or systemic glucocorticoids and did not prevent safe administration of both doses of the vaccine.""",en
2022-07-24 14:16:37+00:00,137993583,‘The study showed that immune function among vaccinated individuals 8 months after the administration of 2 doses of COVID-19 vaccine was lower than that among unvaccinated individuals’. #booster #vaccination #COVID19 #MonkeyPox https://t.co/8ynw36c8BA,en
2022-07-24 14:15:04+00:00,41847726,Technology used to develop Covid-19 vaccines may also help combat a honeybee-killing pest.https://t.co/pre7S0uEVU,en
2022-07-24 14:10:13+00:00,1455580102515994626,@RepMTG Covid-19 vaccine has opened Pandora's box of disease.,en
2022-07-24 14:10:03+00:00,356132563,"Did you get the fourth Covid-19 vaccine dose? Reason for getting/not getting? If you are yet to get it but want to, any reasons for the delay?(This may end up being an article, and replies will be published. You can DM as well)",en
2022-07-24 14:09:33+00:00,4640105060,@seeragnar @RachelNotley The term “anti-vaxer” is made up to be divisive. I’m sure most if not all humans have had a vaccine at some point in their lives. The Covid-19 vaccine is experimental. No one should be taking without informed consent. https://t.co/S1TqpvOb7U,en
2022-07-24 14:08:10+00:00,6322792,@Thecolouroffire @dannyjpalmer @HSouthwellFE He hasn’t been in the paddock this year because you’re required to have completed COVID-19 vaccination course or have a medical condition making you unsuitable for any existing vaccine. He doesn’t have either.,en
2022-07-24 14:07:52+00:00,1513636629839335425,"@KEdge23 It's not ridiculous - don't judge! They might be #immunocompromised and not have ANY protection from their vaccines.Even if there was no one around for them to catch #Covid_19 from, a jogger or cyclist can appear very quickly.It's better to be safe than sorry, and #WearAMask.",en
2022-07-24 14:07:29+00:00,1363501348906500096,Adverse effects of COVID-19 vaccines and measures to prevent them https://t.co/0idGowPK01,en
2022-07-24 14:06:31+00:00,1519045651308421121,"600 Million Doses Later, Dr. Birx Admits She “Knew” COVID-19 Vaccines “Were Not Going to Protect Against Infection” https://t.co/HlhCwDtWIW",en
2022-07-24 14:05:16+00:00,983691674,COVID-19 Vaccines for People who are Moderately or Severely Immunocompromised https://t.co/BKCRd6yfta,en
2022-07-24 14:03:32+00:00,823284564759953408,"Washington, DC Child COVID-19 Vaccine Mandate Illegal: Legal Expert“There is no FDA-approved COVID shot available and therefore, individuals have a right under the emergency use authorization to refuse these shots,” https://t.co/Ph73a3nF2x via @epochtimes",en
2022-07-24 14:02:07+00:00,300857864,"If your child needs required shots for next year, get a head start on the summer to-do list and make appointments at our free clinics at @pgcps school-based wellness centers. Adult and child COVID-19 vaccine is available for families with back-to-school shots appointments. https://t.co/2lvynruARx",en
2022-07-24 14:01:54+00:00,211209573,"Dr. Birx federal COVID-19 adviser admitted this week that she ""knew"" the coronavirus vaccines ""were not going to protect against infection,"" a stunning declaration that comes roughly 18 months after the shots were first rolled out to the general public.",en
2022-07-24 14:01:33+00:00,1482135646340796416,"China says Xi Jinping and other leaders have received national Covid-19 vaccines, amid public concern over safety https://t.co/J4jTZr4gf7",en
2022-07-24 14:01:11+00:00,447576408,Birx Says COVID-19 Vaccines Were Never ‘Going to Protect Against Infection’.      Oh really?  Then why was she up there with Fauci?  https://t.co/y7D8tQDxuG,en
2022-07-24 14:01:08+00:00,171622913,The COVID-19 vaccine is free and available to children 6 months and older. No insurance needed!Find a vaccine near you: https://t.co/lVcfANFKmK,en
2022-07-24 14:00:44+00:00,117793973,"COVID-19 is still here. Maintain COVID-19 protective measures to stay safe. Get vaccinated, boosted and wear a mask. Find a vaccine site near you: https://t.co/X13qpGeKR2 https://t.co/hs5l3Ee2Hi",en
2022-07-24 14:00:43+00:00,359635214,Revisionist history Birx Says COVID-19 Vaccines Were Never ‘Going to Protect Against Infection’https://t.co/iXwiWwCEx6 https://t.co/5y774AR5X0,en
2022-07-24 14:00:15+00:00,2618368810,If you are pregnant the COVID-19 vaccine is the safest and most effective way to help protect you and your baby 👶 against the virus.For dates and times of where and when our midwife will be click below.➡️ https://t.co/POqhAfT3jD#teamSHSCT https://t.co/qjuejmxzD7,en
2022-07-24 14:00:15+00:00,1377580554586050561,The latest summary of gynaecological reactions to covid-19 vaccines. Data from MHRA weekly report to 13/07/22Report any changes in health or pregnancy problems after vaccination to the yellow card scheme at https://t.co/bx5mtOy9F8https://t.co/IWLzgBTP1f https://t.co/6iNaYF5KHJ,en
2022-07-24 13:59:51+00:00,228104799,"Alva Rvw-Crr: CDC, ACIP approve Novavax Covid-19 vaccine under emergency use authorization https://t.co/pZsujJqxGI",en
2022-07-24 13:59:32+00:00,1236309667640487937,Dr. Deborah Birx Admits She 'Knew' COVID-19 Shots Wouldn't Stop Transmission (VIDEO) https://t.co/Wj696m9tGV #corruption #covid #Vaccine,en
2022-07-24 13:59:11+00:00,792314484,Individuals with a history of autoimmune disease where not included in the randomized Covid-19 vaccine trials.,en
2022-07-24 13:58:59+00:00,716775092882112516,Lying bitchBirx Says COVID-19 Vaccines Were Never ‘Going to Protect Against Infection’ https://t.co/4XqdOe3lZv,en
2022-07-24 13:58:59+00:00,1058846906019971077,"SCIENCE IMMUNOLOGY19.07. 22 “The results revealed that, in contrast to natural infection, COVID-19 vaccines didn’t provoke robust IgA responses in the respiratory tract in our cohort” Most imp defence against respiratory viruses is our IgA response!https://t.co/eJSrBRC43R",en
2022-07-24 13:57:04+00:00,1285438843399868416,"‘COVID-19 Vaccines will go down as the greatest scandal and crime against humanity.’ - Christine Anderson, EU Parliament https://t.co/z1heRToKWq https://t.co/3kFMU3EhDd",en
2022-07-24 13:56:51+00:00,1423287928982179840,"Researchers describe a different way to build a COVID-19 vaccine, one that would, in theory, remain effective against new and emerging variants and could be taken as a pill, by inhalation or other delivery methods. #vaccine #biotechhttps://t.co/IxQuEiIBnk",en
2022-07-24 13:55:44+00:00,1042555851918192640,"https://t.co/JZmjgub83IInteresting article from NY times, so what is there no hope for NYC’s judicial system when it comes to covid? “each judge as owning thousands of dollars of stock in Covid-19 vaccine manufacturers”",en
2022-07-24 13:54:59+00:00,981699274403704835,Why is what #AnthonyFauci &amp; #DeborahBirx did/doing different from what #JosefMengele did?#ForcedUntestedVaccines#MyBodyMyChoice#SADS#Myocarditis#YoungPeopleSuddenlyDyingBirx Says COVID-19 Vaccines Were Never ‘Going to Protect Against Infection’ https://t.co/zOVBm9vRAC,en
2022-07-24 13:53:57+00:00,837154679494692864,Chinese President Xi Jinping and other leaders in the country have been given domestic Covid-19 vaccineshttps://t.co/xJ3ioGvn69,en
2022-07-24 13:50:22+00:00,713523037560111105,Doctors warn of low COVID-19 vaccine uptake among youngest children https://t.co/fCzBl9Hl72,en
2022-07-24 13:48:26+00:00,3231590395,Is it safe to take covid-19 vaccine during pregnancy? https://t.co/SdrcAgICDc #vaccination,en
2022-07-24 13:48:02+00:00,1435041609125666826,"Dr. Deborah Birx admitted on Friday (July 22) that she ""knew"" the COVID-19 vaccines ""were not going to protect against infection""—an astonishing claim that comes 18 months and 600 million doses after the experimental injections were first rolled out.",en
2022-07-24 13:47:05+00:00,1467856613113425921,@mtlhd2019 @margay77 @First10EM Nothing to prove. Ontario government website covid 19 data has shown this for the past few months before they decided about a month ago (June 23) to no longer give data about the vaccine status of those being hospitalized or in ICU. It was showing the opposite of their narrative,en
2022-07-24 13:46:22+00:00,1180960296652824576,"China said that all its leaders received locally-made Covid-19 shots, the first time a confirmation was made in the absence of a vaccine mandate for the country with the world's strictest controls against the virus. (Bloomberg)https://t.co/NPex2YfzgD",en
2022-07-24 13:45:04+00:00,2097571,Chinese President Xi Jinping and other leaders in the country have been given domestic Covid-19 vaccineshttps://t.co/BF0xKiBKNZ,en
2022-07-24 13:44:38+00:00,1304773449093582850,Dr. Ryan Cole: COVID-19 Vaccines Causing An Alarming Uptick In Cancers https://t.co/HUrruWT607,en
2022-07-24 13:43:54+00:00,1470728023729131524,"For all you people who took the experiment its on you those who were forced should be pissed!!!Birx Admits She Knew COVID-19 Vaccines Were Never ""Going To Protect Against Infection""",en
2022-07-24 13:43:11+00:00,49404200,Dr. Vasan &amp; Dr. Easterling | COVID-19 Vaccines for Children Under 5 PSA (Polish) https://t.co/Zb7xPDEjf1,en
2022-07-24 13:42:35+00:00,1426550146033233921,"@DavittJustin @TheLastAesir @ZubyMusic @nytimes You do not understand what you say. Not a source on that matter.  probably also thought the mRNA vaccine did something. Now Deborah Birx is fessing up to that evil hoax too. 600 Million Doses Later, Dr. Birx Admits She “Knew” COVID-19 Vaccines “Were Not Going to Protect Against",en
2022-07-24 13:42:13+00:00,756796452,"No vaccine is 100% effective, but immunization reduces the risk of dying from Covid-19 substantially, says the director general #DGHS #DG #covid19 https://t.co/WiVZAi6mCq",en
2022-07-24 13:42:08+00:00,1488927539313659917,"@laurierogersm @stndaginstrw @SalmanSima If you sincerely think that referring to the Covid-19 vaccine as an ""experimental therapy"" is an effective or reasonable argument, then nothing anyone says is going to dissuade you. You've bought the propaganda, and I hope you enjoy your prizes.",en
2022-07-24 13:40:19+00:00,394651921,@BalooHealer @PghBKennedy @ClastonB @JonathanTurley 1) Stats indicate reduced likelihood of severe illness or death for vaccine recipients - the benefit.2) Officials said that the vaccinated would not get COVID-19. Very damaging.3) Political leaders and public health leaders should have directed message to elderly &amp; overweight.,en
2022-07-24 13:40:12+00:00,16293915,"Purfleet Care Centre in Purfleet-on-Thames is hosting a NHS pop-up clinic for the COVID-19 vaccine on:🧑 Tuesday 26 July from 10am to 5pmJust turn up to this walk-in clinic for your 1st, 2nd or booster COVID-19 vaccine. https://t.co/VHwxOjVW1X https://t.co/3grxpPA5xo",en
2022-07-24 13:39:56+00:00,604586168,Another person long overdue for Prison....Birx Says COVID-19 Vaccines Were Never ‘Going to Protect Against Infection’ https://t.co/0bcDEuWFym via @epochtimes,en
2022-07-24 13:36:04+00:00,1195506048867733506,"@MeldakYellow “The COVID-19 vaccine is not unique in its reported impact on menstrual cycles. Changes to menstrual cycles in recipients of vaccines for typhoid, Hepatitis B and the Human Papillomavirus have been documented.”",en
2022-07-24 13:35:56+00:00,111070310,"Thousands report changes to menstrual bleeding after COVID-19 vaccine, study shows https://t.co/1a5EphucqP",en
2022-07-24 13:35:25+00:00,1455519315126484994,"@healthgovau Next time I get a COVID-19 booster, I'd rather have a Novavax vaccine.  Why must we have another mRNA booster if there is a large stockpile of Novavax?",en
2022-07-24 13:34:34+00:00,1378897893810036737,"There is a major role of #Pharmacist in preparation of #vaccines In #Covid_19 Pandamic time. but no one  will identify the Hard work of a #pharmacist ""If there is no pharmacist, there is no medicine &amp; if there is no medicine doctors means nothing""#vaccine",en
2022-07-24 13:34:04+00:00,1478558304217354241,"As Omicron strains spread, is this the forever plague? ""Until we have a vaccine that blocks transmission, we’re going to see more waves of COVID-19...Everyone who is over 50 should absolutely get their 4th booster. And everyone should be wearing masks”https://t.co/GVsuEcyvIH",en
2022-07-24 13:33:48+00:00,929377661285208071,Remove indemnity from the manufacturers of covid-19 vaccines - Petitions https://t.co/AXLmwyWEeT,en
