date,userid,tweet,lang
2022-04-14 10:00:20+00:00,979715809,"Winter is coming, which means the spread of colds, flu and COVID-19. 🥶😰Now is the time to get your COVID-19 booster vaccine to ensure you are fully protected.Find locations: https://t.co/tvbEzicosF #MornPenTogether #GetVaxxed #OurPeninsula  @PeninsulaHealth https://t.co/qcmbGPSdim",en
2022-04-14 10:00:09+00:00,15694286,Moderna is recalling one lot of its COVID-19 vaccine in Europe after a “foreign body” was found in one vial. Doses in the U.S. are not impacted. https://t.co/Nc9Zr1rEZ9,en
2022-04-14 10:00:09+00:00,236770150,UK's Medicines and Healthcare products Regulatory Agency approved Valneva COVID-19 vaccine https://t.co/0HIB4Tq2DN #Health https://t.co/eQQT8822Zi #news 952,en
2022-04-14 09:59:19+00:00,28011048,"PNN for Apr. 14, 2022 - NEJM: Fourth Doses of BNT162b2 mRNA COVID-19 Vaccine; Oral Nirmatrelvir for High-Risk COVID-19. PNN NewsWatch https://t.co/tkPSWQLqFr https://t.co/KTs7rLsyce",en
2022-04-14 09:59:04+00:00,27404490,"Sinovac Covid-19 vaccine recipients restricted from travelling to Europe can ask for Pfizer shots, says Khairy https://t.co/xkCwzwTi00",en
2022-04-14 09:58:29+00:00,1498550036594315264,covid: UK medicines regulator approves Valneva Covid-19 vaccine for adult use https://t.co/9hcthfhCsa,en
2022-04-14 09:57:41+00:00,1455725570617192448,Covid: UK drug regulator approves Valneva Covid-19 vaccine for adult use – Times of India https://t.co/BGMxSusq9L,en
2022-04-14 09:57:04+00:00,1504254117702602753,covid: UK medicines regulator approves Valneva Covid-19 vaccine for adult use https://t.co/Hn8GU4Epz0,en
2022-04-14 09:57:02+00:00,804072446131310592,@pastajoe5 @d_allen_h @TheDemocrats This post is FAKE NEWS! Energy prices were way up long before Putin attacked Ukraine and there were more deaths from covid-19 under the Biden administration then the previous administration and Biden had the Trump Vaccine. The American people are not Stupid!,en
2022-04-14 09:56:54+00:00,1420691239817515008,covid: UK medicines regulator approves Valneva Covid-19 vaccine for adult use https://t.co/AvoJBZxC07,en
2022-04-14 09:56:21+00:00,31361365,A Fourth Dose of COVID-19 Vaccine Does Not Induce Neutralization of the Omicron Variant Among Solid Organ Transplant Recipients With Suboptimal Vaccine Response - PubMed https://t.co/j7ug183oDH,en
2022-04-14 09:56:21+00:00,3309793159,covid: UK medicines regulator approves Valneva Covid-19 vaccine for adult use – Times of India https://t.co/7rELi9PXnl,en
2022-04-14 09:55:41+00:00,716266131988742148,"In a new study conducted in Italy, it was determined that corona virus vaccines halved the deaths from Covid-19 in the country.    According to the statement made by the National Institute of Health (ISS),https://t.co/J28IMQmCPT",en
2022-04-14 09:55:30+00:00,159076835,Not had your COVID-19 vaccination yet? Spring into action today!The vaccine gives you the best protection against COVID-19. Don’t miss out on getting your COVID-19 jab this spring.Visit https://t.co/paP6EBz5Zs to book your appointment or find a walk-in centre near you. https://t.co/dcLsn8bU5a,en
2022-04-14 09:55:12+00:00,16293915,"The #EPUT vaccination bus is at ASDA Tilbury in Thurrock Park Way today (14 April) until 3pm - it may leave early if the day's supply has been used. Just turn up to this walk-in clinic for your first, second or booster COVID-19 vaccine. Visit: https://t.co/pTwRUoRZ4A https://t.co/IJC71YbU1P",en
2022-04-14 09:55:08+00:00,1493589462894489613,COVID-19: Valneva vaccine granted regulatory approval by the MHRA | UK News https://t.co/MhPcTD0iPY,en
2022-04-14 09:54:11+00:00,154567002,"has become much more severe in only 2 years and continue to resist, despite many restrictions taken and the rapid birth of many vaccines, and move time to time to thise gender of viruses. With the Coronna Virus, the Covid-19,",en
2022-04-14 09:53:35+00:00,1380691106623447043,covid: UK medicines regulator approves Valneva Covid-19 vaccine for adult use – World news https://t.co/t0mTcJ4lMs,en
2022-04-14 09:51:58+00:00,1328929711,"Covid-19 update:▶️929 cases (-218)▶️435.1 cases/100,000 (-102.1)▶️3 deaths (-2)💉Total 1st vaccine doses = 148,158(+106)💉Total 2nd vaccine doses = 135,479(+275)💉Total boosters = 85,132 (+210) https://t.co/wPRn3eMr3b",en
2022-04-14 09:50:00+00:00,29959618,UK medicines regulator approves Valneva Covid-19 vaccine for adult use https://t.co/HWrLlQriVt,en
2022-04-14 09:49:17+00:00,1467130085828403205,COVID-19 vaccines are ineffective and even dangerous-data from the CDC shows that the vaccines have been useless in stopping the spread of COVID. https://t.co/9HKBwJawOi,en
2022-04-14 09:47:24+00:00,1402542105491214336,Major COVID-19 vaccine update: https://t.co/lQTMddQqcd,en
2022-04-14 09:45:25+00:00,236770150,UK's Medicines and Healthcare products Regulatory Agency approved Valneva COVID-19 vaccine https://t.co/0HIB4Tq2DN #Health https://t.co/eQQT8822Zi #news 168,en
2022-04-14 09:44:50+00:00,1470334895490838528,Multinational pharmaceutical companies have criticised the push by SA and India to introduce an intellectual property (IP) waiver on Covid-19 vaccineshttps://t.co/Jozq6Nsd1E #drug #global #africanews,en
2022-04-14 09:44:03+00:00,1119471918,Valneva COVID-19 vaccine approved by MHRA #Covid19RftLks https://t.co/TOoWvpJmah,en
2022-04-14 09:43:00+00:00,60443074,"Australian Doctor readers post hundreds of comments each week.Here, we include the highlights: Dr Simon Holliday's tussle with a kangaroo court, should you record your consults with patients, and Dr Hobart and COVID-19 vaccines.https://t.co/tN81PCVrXt",en
2022-04-14 09:42:02+00:00,1423291677012217871,Advisory Panel on COVID-19 Vaccines convenes meeting to conduct continuous benefit-risk analysis of authorised COVID-19 vaccines https://t.co/lAXkV0HquU,en
2022-04-14 09:40:50+00:00,19314414,"@HannahB4LiviMP @valnevaSE from gov info ""An ongoing pivotal randomised, observer-blind, active-controlled, Phase III superiority study is being conducted in the United Kingdom to investigate the immunogenicity and safety of COVID-19 Vaccine Valneva"" #humanguineapigs",en
2022-04-14 09:39:48+00:00,199722118,"@WFTV Please don’t make this political because it isn’t, and if you listen again, the newscaster made no statement regarding COVID-19.  There is a vaccine specifically for meningococcal disease: https://t.co/Hmyo7in23o",en
2022-04-14 09:38:40+00:00,141412902,"Britain approved on Thursday French firm Valneva's COVID-19 vaccine, bringing in a sixth coronavirus shot to the country.https://t.co/BPEeTYTBJJ",en
2022-04-14 09:38:31+00:00,1459579089178832896,https://t.co/zAI8CbuEMlPhoto Illustration by The Daily Beast/GettyAre you or a loved one feeling serpentine lately? The QAnon-right thinks your COVID-19 vaccine might have been laced...,en
2022-04-14 09:32:30+00:00,1492316113178611718,"Britain has now approved it's 6th COVID vaccine.This ""whole-virus inactivated COVID-19 vaccine"" reportedly meets the ""required safety, quality and effectiveness standards."" 🧐We shall see!🌎Individual natural immunity is still far superior! 🌍",en
2022-04-14 09:31:35+00:00,1316555586423549952,"April 14 - #NationThose aged 60 and above with #comorbidities will be allowed to get a #second Covid-19 vaccine #booster shot, says the Health Ministry. He also announced that adolescents aged between 12 and 17 will be allowed to receive #booster shots.https://t.co/Wq9EuwOg7u https://t.co/3WlIvhEJe2",en
2022-04-14 09:31:07+00:00,1359596284663988228,Paediatric populationThe safety and immunogenicity of COVID-19 Vaccine Valneva in children and adolescents less than18 years of age have not yet been established. No data are available.,en
2022-04-14 09:30:07+00:00,236770150,UK's Medicines and Healthcare products Regulatory Agency approved Valneva COVID-19 vaccine https://t.co/0HIB4Tq2DN #Health https://t.co/eQQT8822Zi #news 48,en
2022-04-14 09:30:00+00:00,978285801850245121,"The government approved French firm #Valneva's COVID-19 vaccine, making it the sixth available #coronavirus shot in the nation.https://t.co/Gb8VKb9Wte",en
2022-04-14 09:30:00+00:00,25066159,"You can get the COVID-19 vaccine during Ramadan, it doesn't break your fast.Find your nearest walk-in clinic or book online ➡️ https://t.co/i8oJbcrkKr https://t.co/j1C2kcWMe4",en
2022-04-14 09:30:00+00:00,18553103,"Our COVID-19 vaccine bus will be in Kilburn this Saturday 16 April, 11am-4pm 📍 opposite Kingsgate Resource Centre, Palmerston Rd, NW6 2JU💉Offering Pfizer 1st &amp; 2nd doses + boosters 🙂Everyone aged 12+ welcome 🚶‍♀️No booking needed - just walk-in 👉https://t.co/waoDsLqa4Y https://t.co/QXh9x2X9zx",en
2022-04-14 09:29:55+00:00,1371881866937171969,Covid-19 vaccines halve death toll in Italy https://t.co/L5u82iENdO,en
2022-04-14 09:26:14+00:00,1498608109065216000,"UAE ranks top on Global Ranking for Covid-19 response. With UAE's effective Covid-19 vaccine campaign and response, they will surely be on the top!#UAE #Covid19 https://t.co/LG6I0inHf6",en
2022-04-14 09:25:15+00:00,1119286872121851906,UK approves Valvena Covid-19 vaccine https://t.co/dV2r82t7nn,en
2022-04-14 09:23:03+00:00,1389208776885026820,"🇪🇪 COVID-19 vaccines in #Estonia - 14 Apr 2022💉💉 Fully vaccinated: 843,889 (+83) | 63.5%💉 At least 1 dose: 859,824 (+65) | 64.7%⏳ Time until 70% vaccinated (at least 1 dose) with last 7 days' pace: 1715 days (24 Dec 2026)",en
2022-04-14 09:19:01+00:00,178367209,Are you experiencing hearing loss or ringing in your ears?It could potentially be a rare side effect of Covid-19 vaccine!Read more here ⬇https://t.co/GCQ4hhOLN8,en
2022-04-14 09:18:46+00:00,1394986733851217921,UK approves Austrian-French drugmaker Valneva’s COVID-19 vaccine https://t.co/AoXegj8Bpp,en
2022-04-14 09:18:29+00:00,1260488764922761216,RT MHRAgovuk: The #Valneva Covid-19 vaccine has been approved for use.This is the sixth COVID-19 vaccine to be granted an MHRA authorisa…,en
2022-04-14 09:17:13+00:00,1346067997451026433,🌍 Global COVID-19 vaccine rollout🟩🟩🟩🟩🟩🟩🟩🟩🟩⬜⬜⬜⬜⬜⬜ 64.83% (estimate)Vaccine doses deployed: 11.4BThe rollout seems to be slowing down#COVID19 #EpiTwitter #Vaccination #PublicHealth https://t.co/RuxXlis8tg,en
2022-04-14 09:17:03+00:00,16608381,"Vaccines have halved Italy's COVID-19 death toll, study shows https://t.co/WqC3Bxdx9B",en
2022-04-14 09:15:12+00:00,21106414,First batch of Novavax COVID-19 vaccines now available in Quebec at walk-in clinics  https://t.co/ZpQ0isqKvV,en
2022-04-14 09:14:06+00:00,1451023953892462594,"@GOP Liars. For red and blue America, a glaring divide in COVID-19 death rates persists 2 years laterPost-vaccine, death rates in red states were 38% higher than in blue states.”ABC news.",en
2022-04-14 09:13:54+00:00,709719626482061312,"As away of demystifying Covid-19 myths about the vaccine, HURIC engaged the VHTs to find away of engaging the community to actively participate in the ongoing vaccination exercise. https://t.co/YfKWiE0Vvi",en
2022-04-14 09:13:39+00:00,270492072,Valneva's COVID-19 vaccine gets approval in UK https://t.co/HJti4kr2aD via SeekingAlpha #news #SeekingAlpha,en
2022-04-14 09:12:07+00:00,288121991,UK Gives Green Light to Use Valneva’s New Covid-19 Vaccine https://t.co/Gus9Sb4xgY,en
2022-04-14 09:10:54+00:00,751189165203652610,"COMMUNITY VACCINATION CLINIC - LECOM COVID-19 Vaccine Clinic - Fri, Apr 15, 2022 9:00am - 5:00pm @ LECOM Center for Health and Aging https://t.co/Httr5xyUbS",en
2022-04-14 09:10:23+00:00,1139544718352769024,UK approves Valneva COVID-19 vaccine for use https://t.co/NFiw3r7e1h,en
2022-04-14 09:10:05+00:00,20433284,UK approves Valneva's COVID-19 vaccine https://t.co/x20WVLWpqg https://t.co/cYEqHqzdZi,en
2022-04-14 09:09:00+00:00,20520172,Covid-19 vaccines are on over half-term (and a bit beyond) for all jab types and eligible ages including 5-11sGet your protection at Hopwood Medical Centre:Wed 20 April 5:30-7:30pmSat 23 April 9am-1pmMon 25 April 5:30-7:30pmWed 27 April 5:30-7:30pmSat 30 April 9am-1pm https://t.co/KFQtvzM6XJ,en
2022-04-14 09:08:57+00:00,805515175,Good news that a sixth vaccine has been approved for Covid-19 in the UK with Valneva #vaccine #COVID19,en
2022-04-14 09:08:25+00:00,1275308093807755264,Petition: Open a Public Inquiry into Covid-19 Vaccine Safety https://t.co/HZ4Yg882s6,en
2022-04-14 09:08:00+00:00,2550149892,NEW📢Tuberculosis vaccines in the era of COVID- 19 – what is taking us so long? A personal view by Pr Dockrell from @LSHTM_TB &amp; Pr McShane from @UniofOxford#tuberculosis #vaccine 💉Read📖https://t.co/seobi6WWJr,en
2022-04-14 09:07:01+00:00,87204299,The TGA in Australia has published its weekly Covid-19 vaccine safety report (data to April 10). https://t.co/lJ6LfCItg2,en
2022-04-14 09:06:26+00:00,2433233869,A fourth Covid-19 vaccine has been recommended for those over 50 or immunocompromised. But does that mean everybody who is eligible should rush out to their pharmacy or primary care doctor to get it?  Here’s what to consider. https://t.co/TZjav4oLYK,en
2022-04-14 09:05:02+00:00,1082279210306158592,"All 5- to 11-year-olds can now get a COVID-19 vaccine. Parents and guardians can book an appointment, call 119 or visit a local drop-in clinic. Visit https://t.co/d9XQ0w5eTr for more information. https://t.co/GPJ326By8B",en
2022-04-14 09:03:56+00:00,48326059,Sputnik V: What to Know About This COVID-19 Vaccine https://t.co/uiLInbeK06 via @healthline,en
2022-04-14 09:02:52+00:00,3071162052,Covid-19: Chief Executive Carrie Lam received her fourth dose of the Sinovac vaccine at the Community Vaccination Centre at the Hong Kong Central Library on Thursday. She urged those over 60 to get the fourth jab. Photo: GovHK. https://t.co/zSxOTD74pv,en
2022-04-14 09:02:49+00:00,1424472990599847947,Would-Be Immigrants Can Get Waivers for COVID-19 Vaccine Requirement: Lawyer https://t.co/TQ04244TAu,en
2022-04-14 09:02:24+00:00,77507779,"@Purple29726888 @74motherofhope It's been tested on ...Summary of the safety profiledivided in two cohorts, about 1,000 &lt; 30 years and 3,000 ≥ 30 years. In total, 3,037 participantsreceived COVID-19 Vaccine Valneva and 995 received Vaxzevria.",en
2022-04-14 09:02:14+00:00,2433233869,Vaccines prime the immune system to make protective antibodies if it encounters threats later on. A new study shows that a fourth dose of the Pfizer/BioNTech Covid-19 vaccine seems to offer short-lived protection against infection.  https://t.co/DZw5IVVUI4,en
2022-04-14 09:02:00+00:00,2449608931,💉 COVID-19 vaccines are acceptable for Muslims as agreed by most Islamic scholars at the @BritishIMA.Take care of your loved ones during Ramadan and book your COVID vaccination today on the NHS website 👉 https://t.co/tAO4qnG0oD #SafeRamadan💙 https://t.co/rnT7oB5EFS,en
2022-04-14 09:01:52+00:00,2433233869,From the New England Journal of Medicine: A new study shows the Efficacy of a Fourth Dose of Covid-19 mRNA Vaccine against Omicron.  https://t.co/jSt165ofyj,en
2022-04-14 09:01:03+00:00,18040230,"Elderly man consented to Covid-19 vaccine, rash is shingles - authorities https://t.co/IFJPf5fhOf",en
2022-04-14 09:00:53+00:00,1596829382,UK approves Valneva's Covid-19 vaccine https://t.co/bjf1hdqve8 https://t.co/8vrCzFlfZ4,en
2022-04-14 09:00:22+00:00,40193294,"A newly developed COVID-19 vaccine induces a robust immune response in immunocompromised patients, including those with cancers like leukaemia and lymphoma#Covid #Cancer #Vaccination #coronavirus  https://t.co/8aADJPWgKC",en
2022-04-14 09:00:21+00:00,2882807331,"Japan, the U.S., Australia and India have delivered the first batch of COVID-19 vaccines under their #Quad framework to Cambodia, looking to boost its influence in the Indo-Pacific region through so-called vaccine diplomacy. (via @NHKWORLD_News)https://t.co/uhUpljikKQ",en
2022-04-14 09:00:16+00:00,12413892,"No, the Moderna COVID-19 vaccine wasn’t recalled in the US https://t.co/2vTXcXBlq2",en
2022-04-14 09:00:08+00:00,1239123625904689152,"🕓 COVID-19 cases are increasing again. Protect yourself with a first, second or booster vaccine. It's not too late.👉 Book your vaccine appointment here: https://t.co/BHdHCp568k https://t.co/h21B6t5KFG",en
2022-04-14 09:00:07+00:00,934077170338746368,Get your Covid-19 vaccine this Easter🐰 Vaccination Centre @ UWE 15-16 AprilBristol Rapid Testing Centre 16 AprilRedcliffe Hill Pharmacy 16 AprilThe Radio Wing 16 AprilGreenway Centre 15-18 AprilSea Cadets 18 AprilVisit https://t.co/cBJGoYpphK for a full list of clinics. https://t.co/ISvMNV5056,en
2022-04-14 09:00:06+00:00,2267735730,"Some of Rutgers’ top health researchers are calling for a change in our approach to developing COVID-19 vaccines, and vaccines to fight future pandemics, to incorporate both https://t.co/klY6h7f1WP",en
2022-04-14 09:00:06+00:00,236770150,UK's Medicines and Healthcare products Regulatory Agency approved Valneva COVID-19 vaccine https://t.co/0HIB4Tq2DN #Health https://t.co/eQQT8822Zi #news 625,en
2022-04-14 09:00:01+00:00,15375209,"The country will receive from Bahrain an additional 240,000 doses of Covid-19 vaccines, 40,000 doses of which are Pfizer’s pediatric vaccines, the Department of Foreign Affairs (DFA) has announced.https://t.co/ajySOCuRGO",en
2022-04-14 08:59:06+00:00,1443169289842819072,People who got Sinovac vaccine nearly 5 times more likely to develop severe COVID-19 than Pfizer: Singapore study https://t.co/8o2Hwp76N3,en
2022-04-14 08:58:05+00:00,828065431,"@DrKGregorevic How proud your great forerunner Dr Mengele would be of your achievements in supporting the experimental Covid-19 ""vaccines"".",en
2022-04-14 08:57:10+00:00,1131040600138981379,"Live Report: COVID-19 examination and vaccine: Faculty of Medicine UIN Jakarta's Experience by Assoc. Prof. Hari Hendarto, Dean, Faculty of Medicine, UIN Syarif Hidayatullah, Jakarta. https://t.co/bVPJVhqLDC",en
2022-04-14 08:57:04+00:00,1103541456759709696,"Chicomnews: COVID Vaccine Distributions in Africa Were Once a Contested Issue Between the U.S. and China… But Not Anymore #auspol #chinesenews As U.S. donations of COVID-19 vaccines to Africa surge, China’s supply to the continent is slumping. Analysis fr https://t.co/SmJCJoOkt7",en
2022-04-14 08:56:34+00:00,316578097,"Vaccines have halved Italy's COVID-19 death toll, study shows https://t.co/Bi7iGx2OIR",en
2022-04-14 08:56:12+00:00,1221555313,"A total of 23 cases were identified in the last 24 hours. 2 130 893 vaccines have  been administered.By vaccinating you reduce your chance of getting severe COVID-19, hospitalisation and dying. Visit any vaccination site for your 1st, 2nd or Booster shot. #Vaccinessaveslives",en
2022-04-14 08:56:06+00:00,494814513,"CALLIE DE WET VACCINE SITE CLOSE AT 13:00 ON THURSDAY, 14 APRILThe COVID-19 vaccine site at Callie de Wet hall, Robertson will be closed from 13:00 (not 16:00 as previously communicated) on Thursday, 14 April 2022 and will re-open on Tuesday, 19 April 2022 at 08:00. https://t.co/1GduH3bT80",en
2022-04-14 08:55:16+00:00,103504694,"The general conclusion is what we already know of course, that both mRNA vaccines and inactivated whole virus vaccines provide sufficient protection against Covid-19 severe disease. https://t.co/gsnigwCPwt",en
2022-04-14 08:54:58+00:00,828841083257778176,"Air New Zealand Lifts COVID-19 Vaccine Proof, Negative Test for Domestic; 'No Jab, No Fly’ Policy for International Flights@FlyAirNZ#AirNewZealand #COVID19 #COVID19Vaccine #Domestic #InternationalFlights #WorldNewshttps://t.co/t9OjXEEQVO",en
2022-04-14 08:53:14+00:00,3314811637,"Highlights from the Health Minister's Press Conference- The Health Ministry will allow high-risk individuals to take a second COVID-19 booster shot. - It will be voluntary, and will not affect the vaccine status of those who choose not to take the jab.#COVID19 #COVIDBooster https://t.co/dn2gNKhChL",en
2022-04-14 08:52:09+00:00,22594051,"Covid-19: Grandad's rashes actually shingles, not reaction to vaccine, says Dr Dinghttps://t.co/NfiS0mEy8T  https://t.co/NfiS0mEy8T",en
2022-04-14 08:50:45+00:00,1471002374735073283,"""We may not be able to demonstrate sufficient efficacy or safety of our COVID-19 vaccine and/or variant-specific formulations to obtain permanent regulatory approval in the US, UK &amp; EU or other countries ..."" https://t.co/cGIHvl905a",en
2022-04-14 08:50:15+00:00,3468286633,Did Gilbert Gottfried Die From COVID-19 Vaccine?! https://t.co/f1sZLb7nlT,en
2022-04-14 08:49:32+00:00,31372539,Valneva's COVID-19 vaccine gets approval in UK https://t.co/axq2UgOdEC https://t.co/armzFzOrNN,en
2022-04-14 08:47:31+00:00,1434301978566406153,https://t.co/IXlqLkQku0COVID-19: Valneva vaccine granted regulatory approval by the MHRA https://t.co/TZI2KbPEx7,en
2022-04-14 08:46:44+00:00,3386294224,"‘First, governments must use the triad of testing, therapeutics (in particular, rapid antiviral pills) and vaccines to manage Covid-19 and replace the cruder non-pharmaceutical interventions of 2020 with scientific progress. Testing ✅’ 🤔 😡 https://t.co/a36GHYenCH",en
2022-04-14 08:46:44+00:00,1249996933080461312,"You can get your walk-in Dose 1, Dose 2 and Booster COVID-19 Vaccines at Cavan CVC next week at the below times: @HSELive @cavancoco @theanglocelt @NewsonNS @PublicHealth_NE https://t.co/V6zVDuLAPr",en
2022-04-14 08:46:35+00:00,1596829382,"Covid-19: Grandad's rashes actually shingles, not reaction to vaccine, says Dr Ding https://t.co/UFdu6wQlyD https://t.co/ZSq87IeDZI",en
2022-04-14 08:46:29+00:00,157997359,Covid-19 vaccine being produced in Scotland has been approved. https://t.co/3IMQNTigFC,en
2022-04-14 08:46:03+00:00,717251950903820288,Do you know why Covid-19 vaccines are injected in the upper arm? https://t.co/vHj20xLO2W,en
2022-04-14 08:45:09+00:00,23763620,COVID-19: Valneva vaccine granted regulatory approval by the MHRAhttps://t.co/A7EPWkFhhs,en
2022-04-14 08:43:53+00:00,2430140064,People who got Sinovac vaccine nearly 5 times more likely to develop severe COVID-19 than Pfizer: Singapore study https://t.co/g3YUmPeBDP,en
2022-04-14 08:43:34+00:00,1115994717391675392,Petition: Open a Public Inquiry into Covid-19 Vaccine Safety https://t.co/vZob9rUVeJ,en
2022-04-14 08:43:09+00:00,15296897,$VALN $INRLF - Valneva's COVID-19 vaccine gets approval in UK https://t.co/7a3y2zbHSj,en
2022-04-14 08:41:46+00:00,301429354,"“You are free (in Australia) until you say no to the (Covid-19) vaccine…”Pat, former nurse, 65, Victoria https://t.co/97jPDTKwD8",en
2022-04-14 08:40:19+00:00,323187873,The COVID-19 vaccine developed by Valneva has today been given regulatory approval by the Medicines and Healthcare products Regulatory Agency (MHRA),en
2022-04-14 08:39:43+00:00,950715965951627267,Medicines and Healthcare products Regulatory Agency (@MHRAgovuk ) have approved a new COVID-19 vaccine by @valnevaSE  for use in the UK.#COVID19 #CovidVaccines #healthcare https://t.co/cEDDoG3yC2,en
2022-04-14 08:37:45+00:00,55186601,"#NSTworld Last month, Valneva's Covid-19 vaccine -- which uses the traditional technology of inactivated virus -- received its first approval with an emergency authorisation for use in Bahrain.#Valneva #Vaccine #Covid19 #Coronavirus https://t.co/EwU1n8oXpf",en
2022-04-14 08:37:34+00:00,1497101567996329984,"Daily COVID-19 Updates: Georgia reports 237 new cases, 2 deaths #Georgia #COVID19 #coronavirus #vaccine https://t.co/leXUn2TEr1 via @GeorgiaOnline1",en
2022-04-14 08:37:31+00:00,555016964,Paying the vaccine-hesitant to get their COVID-19 shots could boost vaccine rates https://t.co/wAZETAmoN2,en
2022-04-14 08:36:45+00:00,1100017331995115520,South Africa should donate its spare Covid-19 vaccines https://t.co/qSDJtfUYYY,en
2022-04-14 08:35:30+00:00,1005738156665106433,"READ: Health Undersecretary Myrna Cabotaje assures enough supply of COVID-19 vaccines after the Food and Drug Administration (FDA) approved the rollout of a second COVID-19 booster shot for senior citizens, immunocompromised individuals, and frontline healthcare workers. https://t.co/qntNIHsCtF",en
2022-04-14 08:35:16+00:00,40016248,"Receiving three dose of Covid-19 vaccines does not make you fully protected.Most Malaysian who died of Covid-19 this year are vaccinated.Covid-19 is cruel. If it kills you, no one will be at your deathbed.Please mask up. Wash your hands. https://t.co/cqohputgZ6",en
2022-04-14 08:34:46+00:00,1076278521532768257,"Alike all other, this is 'old school' vaccine, made from deactivated part of the real Covid 19 virus https://t.co/Hn159qpy0m",en
2022-04-14 08:34:10+00:00,203119681,"Get your Covid-19 vaccine today at the Blue Hut Youth and Community Hub.📍49 Provost Street, N1 7NZ⏰11am to 1pm😃Age 12+👣Walk-in, no booking required https://t.co/s0hoxCuFnt",en
2022-04-14 08:32:00+00:00,35764366,"Think COVID-19 is a minor illness?Think again, 370,000+ people under 35 are experiencing the long-term effects of COVID-19.Don’t take the risk.Book your vaccine today at: https://t.co/pdbf6i0TbX#KeepEnfieldSafe https://t.co/3s2T5Tamma",en
2022-04-14 08:30:33+00:00,1232453459716313089,"@DrWallBolton Hi Helen, Can you confirm or deny that the covid 19 vaccines are still in phase 3 clinical trials ?",en
2022-04-14 08:30:22+00:00,555016964,UK approves Valneva’s COVID-19 vaccine https://t.co/hKl9BiPzTf,en
2022-04-14 08:30:17+00:00,16735210,South Africa should donate its spare Covid-19 vaccines - Doing so can bolster its soft power in the SACD region https://t.co/RXuxknkF3a https://t.co/cFE2cEHN17,en
2022-04-14 08:30:03+00:00,236770150,UK's Medicines and Healthcare products Regulatory Agency approved Valneva COVID-19 vaccine https://t.co/0HIB4Tq2DN #Health https://t.co/eQQT8822Zi #news 375,en
