date,userid,tweet,lang
2022-08-28 23:58:24+00:00,3682adfc627af1a5c5e125a1ce49b82f,"@SaiKate108 ""There is no evidence that Covid-19 vaccines are responsible for a rise in “unexplained” or “sudden” deaths. SADS deaths did not increase in England and Wales in 2021.""https://t.co/CihXBn8bLe",en
2022-08-28 23:55:55+00:00,858ca3386cde213399148e20f28b2db757577de74a3993d1393a19163ad0065e,"@notkaren007 @MyFTA9876 @VanSwanson @AdamKinzinger @GOPLeader @EliseStefanik Actually, Pfizer’s Covid vaccine is produced as two separate and distinct products with the same formulation… the licensed “COMIRNATY” and the EUA-authorized “Pfizer-BioNTech Covid-19 Vaccine.”",en
2022-08-28 23:55:21+00:00,31847659845e381aaf083101bfa5ebc8,"Could you help our research by completing an anonymous survey ""Health Practitioner Perceptions of COVID Vaccination in Aotearoa."" The study seeks to help us better understand the  perception of health practitioners on the COVID-19 vaccine https://t.co/q1ZeV9ZczR https://t.co/8rnnG0Mmb4",en
2022-08-28 23:51:47+00:00,e4d451a36f8148aada44d011f67c3a08,Here's When to Expect a 4th COVID-19 Booster Vaccine - Good Housekeeping https://t.co/JZ9NHtJpEp,en
2022-08-28 23:50:30+00:00,bd2998941df1a806b3c1026fc18f3f207981f6bc1eecb1bf0c3cfca33d4b8360,"All bullshit from the start,,Unscientific Covid-19 vaccine mandate needs to go https://t.co/tdyxojw8IX",en
2022-08-28 23:42:07+00:00,321c64c958fd1979e9207fe4aed7cad3,False Fact: Covid-19 vaccine keeps you free of catching Covid-19. Vaccine and boosted. I have had it twice now. Sick as a dog.,en
2022-08-28 23:41:05+00:00,6576b9449c3f4b9ff156223caca8b5f1,The university is hoping to provide for the community by standardizing and increasing the accessibility of COVID-19 vaccines for children. https://t.co/VVyWJMg7vL,en
2022-08-28 23:39:35+00:00,9935bc5cc44c0b6c13e4327c450089399af14ca0753c78b95cac5357bef5bb9a,Development of COVID-19 vaccines utilizing gene therapy technology - PubMed https://t.co/LsG9Ar2lRq,en
2022-08-28 23:39:09+00:00,74baa762d981df495ca209c4dd68ee84,#Somalia receives 1.6 million J&amp;J COVID-19 vaccine doses from #Sweden and the #Czech Republic https://t.co/iB67aKqzfl,en
2022-08-28 23:37:27+00:00,dae4db3f85a8513130c01d977b87f16921ad18b677019218d6f2be56de2b3cbe,"@mustaver @wef_happy @alangolds @DrJamesOlsson Everybody knows about this famous A-Z death.  That's not an mRNA vaccine, and it's one case.  Would you like me to do the same with COVID-19 deaths?  There are MILLIONS.  Hope you have lots and lots and lots of time.",en
2022-08-28 23:35:42+00:00,3b371f4b3d8d5a2f91d33f3795e0b067543f7c23ce106fbf8df5e71c3aff1c8b,Anti-COVID-19 vaccine mandate protest at Western University sees hundreds https://t.co/VMC1IsMwxX,en
2022-08-28 23:35:13+00:00,c8169f333f8e9bcb30094eaab104c7d0,Trump dealt with #Covid_19 in an emergency situation and got vaccines out. Biden has killed more people from it than died in the civil war and has gotten no new vaccines out; all he has done is blamed the unvaccinated while he 4 boosted caught it Just the facts,en
2022-08-28 23:34:56+00:00,444065149a8f07aad7591b7e4f3edcfa,"@JodiMitchell87 @vp1948 @LeslynLewis From this article: ""Pfizer/BioNTech and Moderna COVID-19 vaccines have received full approval by the Food and Drug Administration (FDA).""",en
2022-08-28 23:34:48+00:00,6afa115b4c1dcfefec1eec5b2b0b2e93,🔊 @AndrejPlenkovic @MichealMartinTD @Xavier_Bettel @sanchezcastejon @jacindaardern Thanks for supporting #VaccineEquity through COVID-19. Will you join #GlobalCitizenFestival and pledge funds to the @WHO mRNA Tech Hub to empower developing regions to produce their own vaccines?,en
2022-08-28 23:34:40+00:00,dc4c4cc966921b3193112b7bbe2dcf59e0cfaec972f28310c7b82ac3eae64c7a,"These people are on drugs. Oh, wait...'“We’ve validated the process several times over and continue to produce safe and effective vaccines against Covid-19,” a Pfizer spokeswoman said.'https://t.co/X690YdgyCr",en
2022-08-28 23:33:32+00:00,ddd4c50b60c066a46ffa1e95c380cc73,"@edward_baran NO..CDC recommendations for visas...  ""If an approved COVID-19 vaccine is available to the applicant in the country where the examination occurs, the applicant must complete the vaccine’s primary series and provide documentation to the panel physician in person.""",en
2022-08-28 23:33:04+00:00,ebf5906e8f63e68d43fb990ac2af35f3,"""By denying equitable access to COVID-19 treatments such as Paxlovid, high-income countries are making the same mistakes that they made with the vaccine rollout""via Think Global Healthhttps://t.co/D1KuaSYu2U#Fem4PeoplesVaccine #TRIPSwaiver",en
2022-08-28 23:31:59+00:00,fc65a49bc6b8c713e1499f657fdc34c2,"@pnjaban ... especially when it's emergency use authorization and not fully tested vaccine. The covid-19 vaccine should have never been mandated,only recommended use and voluntarily.",en
2022-08-28 23:30:20+00:00,6e5b0d11ca576cb9f16da10b4c9cb4e4,"@btal_podcast @nofacediapers @SleevesUpLA @CDCgov @LADeptHealth I literally debunked your debunk by actually reading the article you linked.From the article:  While the rollout is being scaled back for the majority of children, vaccines will be available for those at higher risk of severe COVID-19.",en
2022-08-28 23:28:24+00:00,afff76aed62365b3246263d392587ff39cc610c7352e7c8ea476a564560e3372,"More BS from Scott Aitchison .  Klaus would be proud!!  ""The COVID-19 vaccines are not experimental. They have been scientifically tested, clinically studied, and approved. They have and continue to save lives, and are what has helped us move past the worst of this pandemic.""",en
2022-08-28 23:28:01+00:00,1e8ed8e6054c012c4308719ac5243f54,"Recently, @CDCgov approved the Pfizer #COVID19 vaccine for children aged 6 months - 4 years and the Moderna vaccine for those 6 months – 5 years. The COVID-19 vaccines are among the most studied vaccines in U.S. history and have been proven to be safe and effective. https://t.co/s8V4dvamMD",en
2022-08-28 23:27:27+00:00,1984de5f96f1b63cb9e0139cd71f4ae3,"@Falcon7_Trader @WZ_420 Until its a second time, just like the Covid 19 vaccine",en
2022-08-28 23:26:44+00:00,02eaceb6050a7556e071191d83d8db34b5a280fa65141aeb570682fe5a8f004a,"""The British Government Has Begun Paying $140,000 for COVID-19 Vaccine Damage Victims.""https://t.co/m6gvCaAfeh",en
2022-08-28 23:23:42+00:00,76eedbaf6c33c3a429e9b453399c166b,🔊 @AndrejPlenkovic @MichealMartinTD @Xavier_Bettel @sanchezcastejon @jacindaardern Thanks for supporting #VaccineEquity through COVID-19. Will you join #GlobalCitizenFestival and pledge funds to the @WHO mRNA Tech Hub to empower developing regions to produce their own vaccines?,en
2022-08-28 23:21:52+00:00,facfa0b39f6dd8d91f2059a2e2032c6e4639bb3a8a241e587817f1dfc120431e,"@MistyKracken Judy is no hero for spreading medical disinformation about COVID-19 vaccines, which are actually reducing the severity of disease. CD8 and CD4 T cell counts increase, not decrease after vaccination. https://t.co/1UBOKyXkAZ",en
2022-08-28 23:21:27+00:00,74271ff95720dd9bda20f0a6ea21c5df6402aa26dfd96d85626f70ef4ddec72d,"The CDC came out and admitted they got everything wrong when it came to covid-19! The Masks don't work the vaccine doesn't really matter, quarantines was bad news. You won't see this on MSNBC. They even fired people and said they're restructuring. That's it? They screw America",en
2022-08-28 23:20:09+00:00,9897ec15fa556806b21b291b5844c8aef8c78e04712440dc0203d52989350475,"Did you know?63,089,671COVID-19 vaccine doses have been given to AustraliansBelle efficacité! https://t.co/qp1BKWiDnh",en
2022-08-28 23:19:50+00:00,729531ecb284796091805add502f137d4d2086facbc60fe60d03741a1e09481c,Moderna Slammed for 'Grotesque' Lawsuit Against Pfizer Over Covid-19 Vaccine Patentshttps://t.co/D86Rg5hGPB via @commondreams,en
2022-08-28 23:19:09+00:00,e3d3af84037cf89883380ad90bf8a79b7fff34f08a6c48e10bb9aa97dd0bed27,The Broken Hill COVID-19 Mass Vaccination Clinic at Coles Complex is now open Monday and Wednesdays 9am to 3.30pm and Thursdays 11.30am to 6.30pm. COVID-19 vaccines including booster shots are available at the clinic. Walk-ins are welcome. #fwlhd #COVIDvaccination https://t.co/YbGL8onHoL,en
2022-08-28 23:18:18+00:00,8219eafe5c047636e706bef902b93730,@AquaCrystal01 @AlldredgeKathy @E_V_Assistance @Sgtnewsnetwork Are you talking about the COVID-19 vaccine not being approved by the FDA?,en
2022-08-28 23:17:05+00:00,d21128961e7ab132814ef143c7dda844ff92c98d7b0fa2c1e6d3d090314b65f2,No special candidate for 2023 presidential election - Obasanjo - TheNewsGuru. COVID-19 vaccines produced in Nigeria will meet international ... that he does not have a special candidate for the 2023 presidential election. https://t.co/y0FfuVlt10,en
2022-08-28 23:17:00+00:00,af660d0eac436db3e5864869b7ff90585e21f5c39d57fbf40d788a49c1d5f90c,Moderna Files for Authorization for Its Bivalent COVID-19 Vaccine Booster https://t.co/pdYdwftjMm via @Contagion_Live,en
2022-08-28 23:16:53+00:00,f474dd882ad186c1dc08b8c2efd97126,Somalia receives 1.6 million J&amp;J COVID-19 vaccine doses from Sweden and the Czech Republic https://t.co/vpLPZJz6k6,en
2022-08-28 23:16:00+00:00,17906c557548aa079fa7750325874a3e,The Arizona Department of Health Services has announced a new COVID-19 vaccine option for unvaccinated people over the age of 12. @Jill_C_Ryan reports. https://t.co/IwBSZncL7c,en
2022-08-28 23:13:21+00:00,212c3597cc705ad78c0fb7eac8a94fbf,@Davidking92King Didn't you get the memo? Democrats think that the Covid-19 vaccine is bad and it's all Trump's fault. https://t.co/1lgZ4mgqDQ,en
2022-08-28 23:11:52+00:00,509f9cb97d9fb6a7046e8627cb9d94c72039da185039674ab7b92bcce3aadc5b,U.S. donating COVID-19 vaccines to Mexico as domestic demand drops https://t.co/tZkM6G2nEV,en
2022-08-28 23:10:01+00:00,a17efb5ce33ca60f3bddbee28d35ef7d,"Be gameday ready with a COVID-19 vaccine or booster. We're now vaccinating those age 6 months and up. We offer all vaccine types, 1st, 2nd, 3rd and booster doses, for ages 5+ (as appropriate). Open to the community and offered in your preferred language. https://t.co/Zf3ZyrZkbJ https://t.co/NoNmz4Mqot",en
2022-08-28 23:09:43+00:00,f3e9190d75732c8b60356d83c72fe2da,"Nigeria can now produce Covid-19 vaccine of acceptable international standard, says NAFDAC https://t.co/jbMZDH5PHa @NafdacAgency @Sayoakin01 via @globalfinanci14 @NCDCgov",en
2022-08-28 23:09:00+00:00,d53a46bab9bde278f63dc461556a88c4,"COVID-19 vaccine maker Moderna is suing Pfizer and the German drugmaker BioNTech, accusing its main competitors of copying Moderna’s technology in order to make their own vaccine. https://t.co/zwfeP7Ryhk",en
2022-08-28 23:07:42+00:00,c4ad2726f65a88a0f879f6f8fe9de17627498ad5805057d56e17f570d161a4fa,"@ramzpaul The opposite is true.  “liberal public health elites” pressured Pfizer to delay fast-track approval of its COVID-19 vaccine until after the 2020 presidential election"" https://t.co/ranh7Q6zRE",en
2022-08-28 23:07:02+00:00,6952ce5972f36a0aea00d8cbe81af1e6,"@DrNancyOlivieri @peoplesvaccine @nickdearden75 “Pfizer and Moderna applied enormous pressure to stop governments from waiving intellectual property rules on COVID-19 vaccines, tests, &amp; treatments. What they wanted was to ensure extraordinary profits &amp; stop low &amp; middle-income countries from making vaccines.""&gt;&gt;",en
2022-08-28 23:05:25+00:00,e5f10e48fd0f8b1d05d9ae11c7c35330,U.S. donating COVID-19 vaccines to Mexico as domestic demand drops – CBS News — Ned Hamson’s Second Line View of the News https://t.co/uheuO0dFGl,en
2022-08-28 23:03:58+00:00,76eaa872107dfb9acb7c32998b77c82997ac97db34f81002395d6bb4801e0ceb,COVID-19 Vaccine Safe in Patients With Heart Failure https://t.co/f921eEC0f8,en
2022-08-28 23:02:22+00:00,2cfadda7536c695da75c31a747ea8b048b2b94bc88445a933f33595e60d2cc3d,@Mister_Katanga @ShannonSharpe Because what he is allergic to is a main active ingredient. ▶From NIH website. 1/1/21 Anaphylaxis to the first COVID-19 vaccine: is polyethylene glycol (PEG) the culprit?Read some science. Pfizer &amp; Moderna are suing each other to keep the technology patent secret.,en
2022-08-28 23:02:18+00:00,688f904bfb9a0eefb4bc596f6bdc9d6cc2ee401c8eae867b2c9a941f20e7d24b,@whattheslark @Breedlove22 So you would blame COVID-19 in the huge spike of mis-carriage rates that are present in only those who have taken the Vaccine and not those who have had COVID? Interesting.,en
2022-08-28 23:00:15+00:00,24dc1b2daccf0c3fbf6d422895e0259d,"Kids’ lives can be messy and sticky. While you can’t protect them from everything, you can help protect them from COVID-19. Add vaccines and boosters to your child’s back-to-school list and help keep them safer this school year. https://t.co/oyko6V6aSs",en
2022-08-28 23:00:10+00:00,3429e5da2e7aa50114399a0548f112f3,- 69.5% of people have had three doses of a COVID-19 vaccine**^- 82% of people aged 12-15 have had one dose of a COVID-19 vaccine*- 78.3% of people aged 12-15 have had two doses of a COVID-19 vaccine* - 49.5% of people aged 5-11 have had one dose of a COVID-19 vaccine*,en
2022-08-28 23:00:09+00:00,3429e5da2e7aa50114399a0548f112f3,COVID-19 update – Monday 29 August 2022In the 24-hour reporting period to 4pm yesterday: - 96.9% of people aged 16+ have had one dose of a COVID-19 vaccine*- 95.4% of people aged 16+ have had two doses of a COVID-19 vaccine* https://t.co/Jv7tZSuvkW,en
2022-08-28 23:00:01+00:00,24f079dd00f73d640430a05f2379017a,"The Health Ministry has assured citizens that it is okay to obtain both Covid-19 vaccine and the seasonal influenza shot, stressing no interaction is likely to occur.#Egypt | #مصر #فيروس_كورونا https://t.co/HZbj2PuCJy",en
2022-08-28 23:00:00+00:00,1d816b54040975e282c657f6ecba5d84,"People with compromised immune systems don't always develop enough immunity against #COVID19 after two doses of vaccine, so receiving additional doses can boost their protection against the disease.All COVID-19 vaccines are safe &amp; effective for immunocompromised persons.#GetVax https://t.co/8pl2zPRTbV",en
2022-08-28 22:58:57+00:00,3ad6c3fb8c2456a60239820a23e159bf,@MabelJibrin It’s not up-to mil😂😂😅 you remember that kind of syringe we dey use for covid-19 vaccine,en
2022-08-28 22:58:06+00:00,dc74d4a83bf7f3d46c718a910d1164fbea798b00bd95a02326f5494e5f8d2e1a,Hundreds of Students Protest Western University’s COVID-19 Vaccine Mandate Requiring Booster Shot - https://t.co/DWQEFldWwDBy A... https://t.co/65JL6YIRzr,en
2022-08-28 22:55:01+00:00,4351c1e20d2bfcf7697cf5d3a323ec3f,"“Investigating and evaluating the potential unintended consequences of COVID-19 vaccine policies is crucial; however, in doing so, we must be careful not to overstate ... hypothetical unintended consequences”📣 New Commentary on vaccination mandates ➡️ https://t.co/bGV2m0whPh https://t.co/zNXBFDru6U",en
2022-08-28 22:54:37+00:00,e5a60798914b0cdbfc553ff0a2317f60401af86832f491e610d3c2b72f42a787,"@DaleGri02660341 More than 5.33 billion people worldwide have received a dose of a Covid-19 vaccine, equal to about 69.5 percent of the world population. Which would mean (15%) 799,500,000 people have had serious side effects.Putting it into context makes a difference",en
2022-08-28 22:53:30+00:00,8013c78b0be94e2cc85591c9f7172570,Federal officials will meet next week to determine which Americans will be eligible for Moderna and Pfizer's updated COVID-19 vaccine boosters.https://t.co/6WWaaTBlSf,en
2022-08-28 22:52:23+00:00,2125c76f76c029bf082bb4f3b7c5573bd36ea370d61b91913fe3b04d379b57b4,Just a reminder 🎗️Illinois hospital system to pay $10.3 million in settlement with workers over COVID-19 vaccine mandate https://t.co/qHnyQ4e4nZ,en
2022-08-28 22:50:15+00:00,63870fa8d6c8979cc9b80eb51faf6930,@_Dave_Koch @ABC If you suppress the immune system viruses will change easily?What are you saying? The COVID-19 vaccine makes COVID worse?,en
2022-08-28 22:50:02+00:00,8d1c0e91d0f7d446b4cb4f5a47086f7b,(E1)levating #COVID-19 #vaccine efficiency with #adenoviral E1 proteins via @science https://t.co/ZCNwi4ZbcL,en
2022-08-28 22:49:39+00:00,248ea80e45430c24f91d3eaf1960a03e361fd22d15a730ce4f48137e79c9db62,🔊 @AndrejPlenkovic @MichealMartinTD @Xavier_Bettel @sanchezcastejon @jacindaardern Thanks for supporting #VaccineEquity through COVID-19. Will you join #GlobalCitizenFestival and pledge funds to the @WHO mRNA Tech Hub to empower developing regions to produce their own vaccines?,en
2022-08-28 22:48:19+00:00,31605d505efe21365b988b7bdb70f8492c38ce37e225806d29d9c7703edc9bfb,"@fundementaling @thehill Doesn’t matter what you think I am doing, facts are facts, the United Kingdom obviously believes there is significant risk to those taking the mRNA COVID-19 vaccines which is why they have decided to pay out large sums of money to people who are vaccine injured.",en
2022-08-28 22:48:12+00:00,9c8b4e574a9913091bb0b2ffc2aee876b8d21c90a316b29ae741237b75b0b840,"@TheAngryEpi Coronavirus is aerosolized, not droplets (which fall to ground). Do you know your vitamin D level? Is it at least in the 50-60 ng/mL? Do you know how to treat COVID-19 w/early treatment protocols? Why are we still using a vaccine that neither prevents infection or transmission?",en
2022-08-28 22:47:25+00:00,ff9ede26e127ab2d97dd7daa03fce32b11b5758fb0253f3ec5d6f727f3ebbec2,Here’s When to Expect a 4th COVID-19 Booster Vaccine https://t.co/ruQe0Az2lQ,en
2022-08-28 22:45:39+00:00,8601feb7cd9fc087578c41cd6c29efd9fe22c4ecb12fe062ee73a439fad12242,"@JesseKellyDC @MZHemingway 6) His BP went so high he was moved to the cardiac unit. It took 3 oral meds &amp; 1 iv to bring it down. He was released &amp; relapsed 6 wks later &amp; it took another 5 days of IVIG to stop it. I browser searched “Guillain Barre Syndrome, Covid-19 vaccine”.",en
2022-08-28 22:43:34+00:00,0b2b0b31552557a5ca99c8c4e22875e2,Isn’t that an oxymoron?  Kind of like Covid-19 Vaccine.,en
2022-08-28 22:43:30+00:00,971ab18c5a7951c7169c85bf055185f7,"@JedediahBila In the UK 126.5 million vaccines have been delivered. 1,645 have died after having a Covid-19 vaccine, according to the MHRA Yellow card scheme, but not proven, only possibly linked. So the assumed death rate is roughly 0.00001300395%",en
2022-08-28 22:43:22+00:00,7dc4b10c08012d6621a9db9c49fc0fa6,"@HoovyTube @Babygravy9 I think OP thinks that this indicates COVID was manufactured and released specifically so they could sell a vaccine for it.It doesn't. The ""technology"" is mRNA vaccination technology related, it's not about COVID-19 specifically.",en
2022-08-28 22:42:43+00:00,c0f3776820662ea8484f9e30c984bee4,https://t.co/PiwslUUkpe Hundreds of Students Protest Western University’s COVID-19 Vaccine Mandate Requiring Booster Shot Hundreds of Students Protest Western U... # https://t.co/1fOff11DIh,en
2022-08-28 22:40:41+00:00,c0f3776820662ea8484f9e30c984bee4,https://t.co/e7ghw53bwx Hundreds of Students Protest Western University’s COVID-19 Vaccine Mandate Requiring Booster Shot Hundreds of Students Protest Western U... # https://t.co/jgrWR874EJ,en
2022-08-28 22:39:55+00:00,4317f080a41c7697db50e7a46174686c,#BREAKING Pfizer applies for Covid-19 vaccine approval for kids six months and over https://t.co/OJfwlBrucn,en
2022-08-28 22:33:06+00:00,123270daf8c3b92d1433e22a25433d9053d5496383456b562feaef683720535e,"The World Bank Group has paid tribute to the Philippines’ vaccination program against Covid-19, saying it was instrumental in expanding access to vaccines to all Filipinos.https://t.co/0Z73HNJsji",en
2022-08-28 22:33:04+00:00,cb8c6104b4a2ca665669f4388ab60723,Britain approves Novavax COVID-19 vaccine Nuvaxovid for children aged between 12 and 17 years - Times Now https://t.co/sG8jVvhnTi • https://t.co/le73xfx4Lb,en
2022-08-28 22:33:01+00:00,2b5ff7fae6a4e0aefdc9504a1f640665,NAFDAC promises first-class COVID-19 vaccines for Nigeria https://t.co/IbiEXTJKHe,en
2022-08-28 22:32:56+00:00,a2c1c399c24642685ec4575f82585b97dadec572bd582a07d671e7b0b8e84270,"The World Bank Group has paid tribute to the Philippines’ vaccination program against Covid-19, saying it was instrumental in expanding access to vaccines to all Filipinos.https://t.co/JOJFNVCu5A",en
2022-08-28 22:31:53+00:00,33dee8cfda71f953d9f2e3984299c6a3,@highmarkstadium Is there a reason why you’re hosting a mega church event called ‘steel city fest’ that preaches to not get the Covid-19 vaccine and other far right ideologies? @KDKA @WPXI @wqed @ThePittNews,en
2022-08-28 22:31:45+00:00,509f9cb97d9fb6a7046e8627cb9d94c72039da185039674ab7b92bcce3aadc5b,U.S. donating COVID-19 vaccines to Mexico as domestic demand drops https://t.co/tZkM6FKMNn,en
2022-08-28 22:31:11+00:00,77551b9ee446c5507f30c231170c443f,"Washington, DC Delays COVID-19 Vaccine Mandate for Students After Rulinghttps://t.co/53vwVgGXhm",en
2022-08-28 22:30:28+00:00,980713e84fbbbbf0c36b6b7265349ae28bdee193fc7107e37e0d96abf6844434,@PovallCarl @LolaGanzarolli @mrmarkdolan Does not mean because you have had the infection that you are immune for life. Immunity is very short-lived especially when new variants are easier to get passed it.Did you ask the doctor's opinion on the Covid-19 vaccine and are you vaccinated?,en
2022-08-28 22:29:20+00:00,9b6bd22c16a1a9218aca897742e87565,Tucker Carlson: Democrats alerted us the COVID-19 vaccine wasn't properly tested |  https://t.co/Ro2sAjMjvV,en
2022-08-28 22:29:17+00:00,9ed5580513bf69fb3711e98a63674c778c4633a90e5c446d7a7029b956145485,Unvaccinated marine describes the havoc Biden’s mandate wrought   Its been a year since President Joe Biden mandated that members of the military get COVID-19 vaccines. One America's Neil W....https://t.co/XXD1qW2eaI https://t.co/2NKjRbDtOJ,en
2022-08-28 22:28:45+00:00,81b7dd4f4e01229944dfb8b9d4569812667818ecca965833159a56dfee656137,"Do we want “herd immunity” against Covid-19, or not?The Novavax 2373 is the vaccine that can bring us to the “herd immunity”, even with the new variants. But only IF WE USE IT!",en
2022-08-28 22:27:31+00:00,4d003ffc4a0c56b8346af17179d49d07,"@nytimes ""Since vaccines became available, the unvaccinated have been far more likely to be hospitalized with severe Covid-19 than people who have been vaccinated."" Encourage everyone to get vaccinated ASAP. Also, flu shots are now available. Stay healthy!😷🙂",en
2022-08-28 22:25:45+00:00,8e2c3cc6ff293e3252808274fd2676a2fefa0abdfba8b4ac458ce6d0cbf432bb,COVID-19 Shots | What Is the Purpose of the COVID-19 Shots? The ENTIRE Intra-Body-Nano-Network-Administered-Through-Vaccines Transhumanism-The-Internet-of-Bodies-Central-Bank-Digital-Currency-Transhumanism-Great-Reset-Agenda-Explained (In 21 Minutes) https://t.co/kMb1x0I29u,en
2022-08-28 22:24:54+00:00,8613cf12e9a61cd12d006525946f80fd,"""Keeping him from playing because he has not received a Covid-19 vaccine undermines the credibility of the White House, which set the policy, and public health more broadly. I’m saying this both as a Democrat and a doctor ...""https://t.co/OIHIvNlZeW",en
2022-08-28 22:22:00+00:00,11c3a2113a7cede10c1656e6a6ae425592510504a4e219363553fdb85618b5c3,"""There is data showing that even vaccinated and boosted people can get mild to moderate COVID-19 disease, because their vaccine-induced protection is waning...""So what? We need more vax because people are getting mildly unwell?  Insane.https://t.co/38XYHCjYCY",en
2022-08-28 22:21:43+00:00,24263e1aa6c38a2b597745e54827653082f9660b63fdd777625ef092eb876ab8,Industry leaders see opportunity to leverage global attention on COVID-19 vaccine production https://t.co/OsoYyleOgT,en
2022-08-28 22:19:42+00:00,a3674b3422ab37428604ba496c8a5cc6,Wait … wut … what?!FDA set to authorize updated COVID-19 booster shots for newer Omicron strains WITHOUT completed human tests: Agency will assess new jabs based on mice research and older vaccines 💉🫣 Daily Mail Online https://t.co/4o3NSavfNU,en
2022-08-28 22:17:58+00:00,697a345e0e25e7c5b3f9c55fb495c904820a80599938968d2e0e1771a32abb25,"The ""pure blood"" claim is perhaps not so far-fetched.German Study: ""We have established that the COVID-19 vaccines consistently contain, in addition to contaminants, substances the purpose of which we are unable to determine”. #nzpolhttps://t.co/gcXGffmBF0",en
2022-08-28 22:15:58+00:00,a923271d16f83e4ec663731c762d00c8ca3956902d62bf7b27ac59ab4ed9ed04,Here’s When to Expect a 4th COVID-19 Booster Vaccine https://t.co/7dFOdPSoZD #SmartNews,en
2022-08-28 22:15:11+00:00,a77bd42731b8e188cce4f4c7c4a8624a,New boosters that target Omicron may be our most important #COVID-19 vaccines since 2020—but the US may be setting up the new shots to fail via @TheAtlantic https://t.co/tUmaXW0DkJ #StopTheSpread https://t.co/4E5eWdZ7Qz,en
2022-08-28 22:14:07+00:00,80e660e8c1951edba8d9b0b7fe2a42f311f84b1b15e75011c5a2e090e7491561,"Free COVID-19 Vaccines for Americans Could End by Fall, Prices Are Likely To Go Up https://t.co/gZhpOm49Wc via @YahooFinance",en
2022-08-28 22:14:05+00:00,079a17704271dda4f8b68d43565c9f980e20ff1af458b4b7e3a895da04ff7262,Here are the main points that were agreed upon between the Minister of Foreign Affairs of Tehran and the Minister of Foreign Affairs of Mali:1️⃣ 1 million Iranian vaccines for COVID-19 donated2️⃣ Opening a research studies center3️⃣ Build a modern slaughterhouse 👇🏼,en
2022-08-28 22:13:55+00:00,e83091a55f4d9e6bf1c77e1e2b24036c,@doctor_oxford The flaw in their argument is that we were lucky enough to get a very effective vaccine within a year. Otherwise social distancing and lockdown was the only realistic response to Covid 19,en
2022-08-28 22:13:46+00:00,971ab18c5a7951c7169c85bf055185f7,"@mrmarkdolan In the UK 126.5 million covid vaccines have been delivered. 1,645 have died after having a Covid-19 vaccine, according to the MHRA Yellow card scheme, but not proven, only possibly linked. So the assumed death rate is roughly 0.00001300395%",en
