date,userid,tweet,lang
2022-08-28 08:21:41+00:00,c262bd88b25f4d81c1ff891d0d7f86f10e20ff1af458b4b7e3a895da04ff7262,"Why are you giving covid-19 vaccines out at festivals?? No medical records, no ID checks, no questions asked just jab me up if over the age of 5!! This is not normal STOP FALLING FOR IT @NHSEngland @MarkSteynOnline @GBNEWS @mattletiss7 @beverleyturner @VIBUK1 https://t.co/o014HsK8UB",en
2022-08-28 08:21:38+00:00,e6323a1148dd78a5373ec3ef668b0ce068eb40b13948cf336e2d51d968739359,Petition: Remove indemnity from the manufacturers of covid-19 vaccines https://t.co/BobyAra79w #StoptheShots #StopTheWHO,en
2022-08-28 08:18:51+00:00,6f03acf1eeadaeb1eedfc9c4bcd5385d05294c66ab51e4e9c376f0a05ffb18e9,I got my Fourth Covid-19 Dose Vaccine and I got High Fever After 🤒👇 follow https://t.co/IIEt9mKXCf #VMAs #INDvsPAK #BBNaija #Pakistan #HYYHPavedTheWay #INDvPAK #VaccineSideEffects #vaccine https://t.co/zOtDqE09dM,en
2022-08-28 08:14:38+00:00,912ea38c00372cd7ff363568adef5b4c56e6912a46a10e7165d8707c6fc62479,We’re still living with #COVID-19. Don’t wait until cases are on the rise again before getting all of your recommended #vaccine doses. Your health is precious.@unicefcameroon  @echosanteinfo@ccouspcameroun  @pevcameroun #EndCovid237 #CmrFreeCovid19 https://t.co/5Vcu1yPEwS,en
2022-08-28 08:13:32+00:00,90c0aa1cbf965573dc06ad520f70c197,"This included expenditure on support services like transporting vaccines to the rural and interior areas, financing COVID-19 quarantine and treatment centres, and conducting swap tests.#AWANInews #AWANITonight https://t.co/WKoe09aMIH",en
2022-08-28 08:11:51+00:00,1ead606df044a54049b4417fc0690d7365f944c7b71ac19bdf2149743685968d,Moderna files lawsuit against Pfizer over ‘Covid-19 vaccine technology patent theft’ ... continue reading https://t.co/EntzDZSIbL,en
2022-08-28 08:11:00+00:00,caab2e1a60a7c71fcc2bfcc33abe2793,Symposium at #ICPE22 by @nabarund Updating the Public on COVID-19 Vaccine Safety – Considerations for Pharmacoepidemiologists 📌10:30am CEST / Congress Hall D5@UNCSPHResearch #COVID #Vaccines https://t.co/il6423znYL,en
2022-08-28 08:10:39+00:00,e79322e87cbcc410f717f462739a4d99063bf15884a091088e9196fc29f3984d,"This isn't the first time I've heard someone say a variation of the pandemic being over but like...what?Am I unaware of some magical vaccine? Last I heard the CDC stopped caring, that doesn't mean that Covid-19 and variants aren't still mutating and killing thousands..",en
2022-08-28 08:09:31+00:00,9206affac2accf6983c62599330041e1face0f33f4f6c32d655a09f9931d7107,Djokovic to miss US Open over COVID-19 vaccine https://t.co/OWVQpzEVot,en
2022-08-28 08:05:50+00:00,7d73c67c6994f92553c61f9de9b95222ca3956902d62bf7b27ac59ab4ed9ed04,"🤯Thomas Massie and Dan Bishop, and yet the American CDC and FDA Won't Do Anything? ""The British Government Has Begun Paying $140,000 for COVID-19 Vaccine Damage Victims.""@jdanbishop@RepThomasMassiehttps://t.co/vgj9trmMA8",en
2022-08-28 08:01:08+00:00,1248afa9b2f7167af8a62238cfaf418e,"You can get the Covid-19 vaccine today at Shama Women’s Festival, Family Fun Day.Wherever you live, find your nearest vaccine centre at:  https://t.co/VH6e95h6pR #GetVaxxedStayOnTrack https://t.co/UqRokSfkS0",en
2022-08-28 08:00:26+00:00,44eaad9ca2fe67f9fbae3df5acde2f65,"Australia’s COVID-19 vaccine rollout flawed, audit findshttps://t.co/qwOwAMXCiB",en
2022-08-28 07:55:45+00:00,a4396b631f9783c1dfc06af9dce3ef7e,Moderna files patent infringement lawsuits against Pfizer and BioNTech over mRNA Covid-19 vaccines - CNN https://t.co/QczukKovet,en
2022-08-28 07:52:51+00:00,1c2cda11077842c5efba64d13328b5f28124f20e2a4f2cc79f45af6374644f55,U.S. donating COVID-19 vaccines to Mexico as domestic demand drops https://t.co/zptoyGGAQm via @cbseveningnews,en
2022-08-28 07:51:37+00:00,0d915063233b0f26f616640cee968144,"@SkyNews Poor guy.Btw, my dad died of a ruptured brain aneurysm in 1998, aged 46 and definitely wasn't vaccinated.These headbangers IMMEDIATELY attributing every single premature death to the Covid-19 vaccine is seriously getting old.",en
2022-08-28 07:50:26+00:00,dd84b4e1ae198bfe6bc33bebfe6055b358a8fc30da2b993341db22333e515170,"@mindy_mali “The public health directive mandating the COVID-19 vaccine for workers in healthcare, hospitals, aged care and disability care remains unchanged.",en
2022-08-28 07:50:25+00:00,24277a5b58841fbd40e34487a41c407badcf551ed4a23e6b4b05131732b3e1ba,"The British Government Has Begun Paying $140,000 for COVID-19 Vaccine Damage Victims! https://t.co/NVeNdsmwGF",en
2022-08-28 07:47:08+00:00,3075035580c167be6e4d003785401009a0bebd371d9332249daec359debdaadd,@treytankish @EBL2017 It is like saying no one has died of the COVID-19 vaccine simply because you don't know any,en
2022-08-28 07:46:40+00:00,8fef76cd8906395407033e40b508bdd2,"@Johnnym41099971 @veryoddrequest @RealEddieHobbs More than 607 million doses of COVID-19 vaccines were administered in the United States from December 14, 2020, through August 17, 2022. During this time, VAERS received 16,077 preliminary reports of death (.0026%) among people who received a COVID-19 vaccine. Data",en
2022-08-28 07:45:34+00:00,65eb3ce53869a937cd9bd0b0e2726700,Petition: Remove indemnity from the manufacturers of covid-19 vaccines https://t.co/bn1PqSeLVf,en
2022-08-28 07:45:15+00:00,2f346d063a1dfa5b6ac2a2088bb6dafc,Petition: Remove indemnity from the manufacturers of covid-19 vaccines https://t.co/HamEowaOVl,en
2022-08-28 07:41:12+00:00,929cd604894146d2c4232055a4bf8ecc,@PlanetZuma @bmay January 2020 when he knew we were facing hundreds of thousands of deaths from Covid-19 &amp; had no vaccines! #LiarJohnson,en
2022-08-28 07:40:06+00:00,1e0e2121422e026a5f18d3d009c313d681df97e926acb78e7ea922d8dab33cfd,"""Keeping him from playing because he has not received a Covid-19 vaccine undermines the credibility of the White House, which set the policy, and public health more broadly. I’m saying this both as a Democrat and a doctor gravely concerned about eroded trust in our institutions.""",en
2022-08-28 07:39:40+00:00,0c10ea5d9ec8d4a080f1d0c1633508734fb14c7d5f2e689ca9ead074ae4f8600,"@avucic @Bundeskanzler 9..The German state should finance the constructionof pharmacies for vaccines (with neomicin)within,and against covid 19..when the patient gets stronger,we also give standard (pfizer) vaccines against covid 19.that would be a cure for covid 19..",en
2022-08-28 07:38:36+00:00,cbdc63849bd7e0874103bed253b74ab3,@Golden_Pup And holding the pharmaceutical companies to account for lying about the safety and effectiveness of the Covid-19 vaccines.,en
2022-08-28 07:38:34+00:00,d564c673700c7638b6049062ee33a1fc,A Case of Chronic Myelomonocytic Leukemia Unmasked After Receiving J&amp;J COVID-19 Vaccine - PubMed https://t.co/xezyKCeRBA,en
2022-08-28 07:34:04+00:00,3fefd69983681c3b7645bbd0c70d13706d4d5b14be9a1917202a8cbbd2b20a8f,Moderna sues Pfizer and BioNTech over COVID-19 vaccine | NHK WORLD-JAPAN News https://t.co/LwzE0CNluW,en
2022-08-28 07:32:51+00:00,bae8b2c94f1e103743374ee8eac5a9de7fff34f08a6c48e10bb9aa97dd0bed27,"COVID-19: Hebra, Sanofi, Moderna, Pfizer… What vaccines will be available in the fall? https://t.co/1mPcabcWsD",en
2022-08-28 07:32:26+00:00,c4e379843d7f82881709736c1640fbf3,"‼️Well Done Novak for saying NO to the Vaccine 💉‼️Especially in light of the UK 🇬🇧ACKNOWLEDGMENT OF DAMAGE to #vaxxers ⚠️The British Government Has Begun Paying $140,000 for COVID-19 Vaccine Damage Victims.https://t.co/WDRF1voj5f",en
2022-08-28 07:31:22+00:00,509f9cb97d9fb6a7046e8627cb9d94c72039da185039674ab7b92bcce3aadc5b,U.S. donating COVID-19 vaccines to Mexico as domestic demand drops https://t.co/nMBjPEXGRF,en
2022-08-28 07:31:20+00:00,510104a1b2e20eba42af26d8f17156e620d188cf0fc8aee9ea5fbd916abfa9ba,🔊 @AndrejPlenkovic @MichealMartinTD @Xavier_Bettel @sanchezcastejon @jacindaardern Thanks for supporting #VaccineEquity through COVID-19. Will you join #GlobalCitizenFestival and pledge funds to the @WHO mRNA Tech Hub to empower developing regions to produce their own vaccines?,en
2022-08-28 07:28:40+00:00,b064c720ca182d59bd2cbbc25cb927dd28f2fa8e1ee3c2a628a9623bdb55581d,Moderna sues Pfizer over COVID-19 vaccine patents : Shots https://t.co/sSkWfiTPuL,en
2022-08-28 07:26:16+00:00,19ee93b3232570c131ccd20900329e66,Moderna sues Pfizer over COVID-19 vaccine patents https://t.co/3CLdjdp1tr https://t.co/RZD95ql923,en
2022-08-28 07:26:02+00:00,dcf9a061a6d192f3e8bb02f267b76e0983c0f71d2d35593b7256bec5073d1c7c,@moderna_tx filed on Friday in both United States and Germany alleging that @pfizer and @BioNTech_Group's COVID-19 vaccine Comirnaty® unlawfully infringes patents Moderna filed between 2010 and 2016.#comirnaty https://t.co/Au7F5azpNe,en
2022-08-28 07:25:51+00:00,ea7ff83d0412710c4058f45bc10f7a46f6d7db877cd5d1a67aa1988cbc25e205,Reanalysis of the Society of Actuaries Group Life COVID-19 Mortality Survey Report Destroys Vaccine Efficacy Narrative https://t.co/Fao9G0izV4,en
2022-08-28 07:23:30+00:00,57a6b30bc623d657d42ed322248382532a8fd57e979a12401ccbd6a9401da8a2,@pfizer Pfizer Inc. Why has the so called safe &amp; effective COVID-19 (toxic injections) vaccines resulted in serious injuries &amp; deaths? https://t.co/TLl1lJe5k5,en
2022-08-28 07:22:24+00:00,2c5510faf543411e1f06648b2fc974c4,Will I need a COVID-19 vaccine to cruise? A line-by-line guide https://t.co/6uvWvBVrol #Photography #Travel #Photo #TravelDestination #Vacation #TravelTips,en
2022-08-28 07:21:50+00:00,6f2edbabc8fa33a59fe396f7d54381dc32fa63395a0455175035122beb089d4f,"""Moderna Sues Pfizer and BioNTech Over Covid Vaccine Technology"" by Rebecca Robbins and Jenny GrossTwo lawsuits filed in Massachusetts and Germany claim the Pfizer-BioNTech Covid-19 vaccine violated Moderna’s mRNA patents.#nytimes#newshttps://t.co/DTNJorLtOE https://t.co/zcAkKj5K0Y",en
2022-08-28 07:19:58+00:00,311411d965b6f7b3df2d493ee2d8ddd4,INFOGRAPHICS ON COVID-19 FAKE VACCINE#PNPKakampiMo#TeamPNP#WeServeAndProtect https://t.co/dJh1QCZyEe,en
2022-08-28 07:17:15+00:00,0bf538816264293dab9b93381e60ac60dadec572bd582a07d671e7b0b8e84270,🌍 Global COVID-19 vaccine rollout🟩🟩🟩🟩🟩🟩🟩🟩🟩🟩⬜⬜⬜⬜⬜ 67.64% (estimate)Vaccine doses deployed: 12.6BThe rollout seems to be speeding up#COVID19 #EpiTwitter #Vaccination #PublicHealth https://t.co/I4btyDVbNn,en
2022-08-28 07:17:09+00:00,b947dc17305be863814fd5c9ded31dad53d5496383456b562feaef683720535e,"Watch: Why isn’t there a nasal vaccine for Covid-19 yet? https://t.co/gIHmXnzLfT via @statnews May 19, 2022",en
2022-08-28 07:17:02+00:00,397b7e1bc566d4ba80fb389c320c7bb5,Moderna Files Lawsuit Against Pfizer Over COVID-19 Vaccine (Doesn't Fauci own some Moderna patent rights?)https://t.co/hUiCrknRb7 via @Republican Nation,en
2022-08-28 07:15:39+00:00,14d15e80ec6e606ddd7f24c5b2f89f58,🔊 @AndrejPlenkovic @MichealMartinTD @Xavier_Bettel @sanchezcastejon @jacindaardern Thanks for supporting #VaccineEquity through COVID-19. Will you join #GlobalCitizenFestival and pledge funds to the @WHO mRNA Tech Hub to empower developing regions to produce their own vaccines?,en
2022-08-28 07:15:14+00:00,3f90040c4f313b3b5abfe40d1131d1697981f6bc1eecb1bf0c3cfca33d4b8360,@DrMusenero @STIsecretariat @KiiraMotors @KagutaMuseveni Where is the covid 19 vaccine oba nawe tuseke,en
2022-08-28 07:14:31+00:00,13fa0678e376b9471eaed34aafafc7aa,Moderna Sues Pfizer And BioNTech Over COVID-19 mRNA Vaccines https://t.co/l83EKMWLl3,en
2022-08-28 07:13:29+00:00,19649c86e7308258e565733cb3482b3c,"""Some 10% of monkeypox vaccine doses have been given to Black people, though they make up over 30% of U.S. cases, the CDC reports.White people received about 50%.Experts warn disparities seen during COVID-19 may be repeated, with more affected gr… https://t.co/gZFE8C5zqe""",en
2022-08-28 07:11:33+00:00,7a89efe8f7ba43002ca869780fd13866e59f27bc56dc5633a8b5a84d568e9613,"The bi-national movement has led to 250000 people, including children, being vaccinated against COVID-19 in Mexico.U.S. donating COVID-19 vaccines to Mexico as domestic demand drops - CBS News https://t.co/92VYOIDEDS",en
2022-08-28 07:11:30+00:00,7a89efe8f7ba43002ca869780fd13866e59f27bc56dc5633a8b5a84d568e9613,"Here is information on the latest COVID-19 cases and hospitalizations, community transmission, breakdowns of vaccination rates, testing info and ...COVID-19 in California: Testing, treatment, vaccine info, case rates, headlines - KCRA https://t.co/keAe5GrUnG",en
2022-08-28 07:11:14+00:00,7a89efe8f7ba43002ca869780fd13866e59f27bc56dc5633a8b5a84d568e9613,"Moderna sues Pfizer, BioNTech over COVID-19 vaccine · Driving the news: Moderna is seeking unspecified monetary damages for patent infringement. · What ...Moderna sues Pfizer, BioNTech over COVID-19 vaccine - Axios https://t.co/ZK9rOpCVkS",en
2022-08-28 07:11:13+00:00,7a89efe8f7ba43002ca869780fd13866e59f27bc56dc5633a8b5a84d568e9613,"When the Biden administration announced COVID-19 vaccine mandates on Nov. 4 for businesses with 100 or more employees, protests erupted in cities ...Sociology professor finds three distinct themes in anti-COVID-19 vaccination protest slogans https://t.co/2MjTLTQ14v",en
2022-08-28 07:07:50+00:00,2c620f68b21f10e625c5259d4ff917ed,seyaria was in the lab creating the covid-19 vaccine,en
2022-08-28 07:04:50+00:00,c86c6d301eb8bc09efb5e56a9930dcfa4a10f634cb188351c6e5a7c048a8f49f,"LAC | DPH | COVID-19 Vaccination - How to get vaccinated - Department of Public Health https://t.co/KbFk9Xh49o Listing of appointments for COVID-19 Vaccination in the Los Angeles County. Includes information on eligibility, vaccine types, ...",en
2022-08-28 07:04:35+00:00,c86c6d301eb8bc09efb5e56a9930dcfa4a10f634cb188351c6e5a7c048a8f49f,"Covid-19. Will the fourth dose of vaccine be open to everyone by the fall? - OI Canadian https://t.co/qNgEJsiKpn After immunocompromised people and people over the age of 60, the second booster dose has been extended to new audiences since July 20, 2022.",en
2022-08-28 07:04:17+00:00,c86c6d301eb8bc09efb5e56a9930dcfa4a10f634cb188351c6e5a7c048a8f49f,"FDA Updates for Week of Aug. 22, 2022 - Managed Healthcare ExecutiveIn COVID-19 news, both Pfizer and Moderna have submitted applications for an updated booster vaccine, and the FDA grants EUA for Novavax vaccine ... https://t.co/hGQ45wRLJM",en
2022-08-28 07:03:21+00:00,12e89286f89772a43cb4986fc6d5a82a2f646e95eb058e470b09da86cd51fa32,"Covid-19 : Hipra, Sanofi, Moderna, Pfizer… What vaccines are available automatically? https://t.co/mzH2LyXAER",en
2022-08-28 07:00:49+00:00,0c2f02d520234df6ca2bd7598884d4ad,Moderna Is Suing Pfizer Over the mRNA Covid-19 Vaccines https://t.co/YJJAchSwrK,en
2022-08-28 07:00:07+00:00,26b64675a25796ab4fbbb5f0d1e075b4,"COVID-19 in California: Testing, treatment, vaccine info, case and hospitalization rates, headlines https://t.co/sR5fDnoYhx",en
2022-08-28 07:00:00+00:00,5b121598cc411889daeabe705aa75339f4daa29cb5db5e0878ee23e2044d41d4,#COVID-19 #coronavirus #vaccines and prior #infection slash risk of spreading #omicron ... | #COVID19 | #Transmission | #SARSCoV2 | #disease | #Illness | Via @NaturePortfolio https://t.co/Uz1VTiX5Xj,en
2022-08-28 06:59:21+00:00,bae8b2c94f1e103743374ee8eac5a9de7fff34f08a6c48e10bb9aa97dd0bed27,"Covid-19 vaccines: Pfizer/BioNTech accused by Moderna of patent infringement, we show you the case https://t.co/2oyTC5Z3wW",en
2022-08-28 06:58:38+00:00,12de6518a1bcedc1202f48476e67791bd8226542fdd82554447e124088ddfbdc,"Article:""The British Government Has Begun Paying $140,000 for COVID-19 Vaccine Damage Victims""https://t.co/y6MxxEObKK",en
2022-08-28 06:56:52+00:00,ef069faba7209650a4c5659a1269c4af0e20ff1af458b4b7e3a895da04ff7262,"Judge strikes down D.C.’s COVID-19 vaccine mandate on police, Union said rule was unfair, hurting recruitment; A D.C. judge has ruled that a COVID-19 vaccine mandate imposed by Mayor Muriel Bowser  https://t.co/0zbaInZr4V",en
2022-08-28 06:54:18+00:00,35dcfe4f61e4a2b8927632406347a9aa,"@Andrea12020212 @snpsandsnRNPs @therebelpath And one more clarification. My challenge is only to the COVID-19 vaccines. Broadly speaking, there are two types of vaccines being touted against COVID-19, one which relies on a virus that is recognized by antibodies to smuggle in a piece of SARS CoV-2, preferably a spike protein",en
2022-08-28 06:54:11+00:00,aef4a52d1d170f6deeb2a276378e8e3719f2d9039f52f4581faaf6135d476aa9,Tiredness was the best tough side effect of Covid-19 vaccine for me,en
2022-08-28 06:53:41+00:00,79db873ace27eff12d409480bcaf22cc,A million Americans died from Covid 19.  The only deaths I heard about connected to the vaccine were the clinical trials where people given the placebo died when they were exposed to Covid.  Ask your family member for their sources.,en
2022-08-28 06:50:03+00:00,151a080625adebba583eb6bab940127b,@cherryW22898349 My case is of Suspension for spreading 'misinformation' related to Covid-19 Vaccine.  Though all this Information was based on tweets of Learned and Respected people in the field of Science &amp; Politics. So let me remind U again that My account was not hacked.,en
2022-08-28 06:45:13+00:00,a7ddc33faa5dd4c3d1eb82bd6487f757195a785ef4efaa21721a2be3ba43c7d4,United States Donates an Additional 10 Million Pfizer COVID-19 Vaccines to Bangladeshhttps://t.co/ECnHvYcGSe,en
2022-08-28 06:39:29+00:00,d441ce50546d28d7a19ad2288587518f66f4d07eb42c00a2fa0f30ada02c72aa,@KeishaH18533476 @jessicaSaiyan Remember Rocker Meat Loaf ?  He was a big supporter of NOT TAKING COVID VACCINES !   As you know he died of Covid 19. https://t.co/koiBibCo4k,en
2022-08-28 06:38:03+00:00,ad635f0e040367166f102ddaf405794cd2ae4a5878490145239e9825edc2c016,@futipolo1 @SandeChin @XonRonPon @enlabeginning @Dame__Jane Evidence of ADE has not emerged for COVID-19 vaccines even though concerns have been raised.,en
2022-08-28 06:32:38+00:00,57a6b30bc623d657d42ed322248382532a8fd57e979a12401ccbd6a9401da8a2,"@gavi Gavi, the Profit Alliance Why has the so called safe &amp; effective COVID-19 (toxic injections) vaccines resulted in serious injuries &amp; deaths? https://t.co/TLl1lJe5k5",en
2022-08-28 06:32:18+00:00,8a9a765da9ab376c20cec64c98d8d4186043f5961f92ad22ef2ac1d266d313ef,🔊 @AndrejPlenkovic @MichealMartinTD @Xavier_Bettel @sanchezcastejon @jacindaardern Thanks for supporting #VaccineEquity through COVID-19. Will you join #GlobalCitizenFestival and pledge funds to the @WHO mRNA Tech Hub to empower developing regions to produce their own vaccines?,en
2022-08-28 06:31:19+00:00,ba9267648da41627b246bf3e64a830791b68d4f704faac8bb62762c7cb9f8b04,"@robbystarbuck “These COVID-19 vaccines have been given to hundreds of millions of people for more than a year, so we know they are extremely safe,” says Dr. Cunningham of the CDC.",en
2022-08-28 06:29:52+00:00,e1e34a57dc343a6d4bfb5fd8e1332220,"@markkuilmari @DrEliDavid @kymalainenkimmo @rzioni Age distribution does not explain it, unless the healthcare system is really crumbling, which it is to some extent. Some deaths may be caused by vaccines. There should have been warnings to avoid physical exercise for some time after a shot. Most excess deaths are from covid-19.",en
2022-08-28 06:29:17+00:00,6fcadcbe46dbcf6d8520e2a48ea76f53,Biden administration plans to offer the next generation of COVID-19 boosters soon after Labor DayHawaii Department of Health preorders 16K doses of new COVID vaccines via @staradvertiser https://t.co/uVwuSUjDzt,en
2022-08-28 06:22:10+00:00,7b2476d2152b9e25e417726b481ff114bb0c86be406a399d1774cde38568c637,"Only 10% of young children have received COVID-19 vaccination, 17-month-old baby boy in serious condition unrelated to vaccine https://t.co/X5oY50oUwk",en
2022-08-28 06:20:18+00:00,72f8e6889a2b96ab59e25000e5c9fbf6416160b90b8d13b94fc7810b3174e5cc,Petition: Remove indemnity from the manufacturers of covid-19 vaccines https://t.co/rAo0QjvgU3,en
2022-08-28 06:07:53+00:00,db60b59997fe67d2341234629c62010d65f944c7b71ac19bdf2149743685968d,Me looking at all the people that got the Covid-19 vaccine 🤣🤣🤣 https://t.co/LobP71rWvz,en
2022-08-28 06:07:17+00:00,7a24044abd4d7e71dc2f3e5e8abe721fe302a6ca7d7a1e55fea7e8ad684195d5,Moderna’s Covid-19 vaccine patent suit points to different virus to make infringement case against Pfizer https://t.co/EE2JqhQidB,en
2022-08-28 06:03:51+00:00,5ff35d13fb0337141772d0a30550581c,"@littleapostate I probably almost died from Covid-19 and the doctor was insulting me saying it’s my fault I didn’t take the vaccine.  In 3 months I recovered, was asked if I’d take the vaccine, NOPE.  Near death couldn’t get me vaccinated and if they try implanting chips, won’t be any different.",en
2022-08-28 06:02:00+00:00,617d9f313c8362f4c609ee30b06915b8,Moderna is suing Pfizer and its German partner BioNTech for allegedly stealing its mRNA technology in the development of their Covid-19 vaccine. https://t.co/XzLQbiY1pv,en
2022-08-28 06:01:47+00:00,dd0e306876226f946bda60c0a218a32bb7f21c9fa4f713b4bdc23392d14fb742,"The British Government Has Begun Paying $140,000 for COVID-19 Vaccine Damage Victims https://t.co/l2k1zOtVi7 via @pamelageller",en
2022-08-28 06:00:22+00:00,fc17b3d060eabc4aa31367e2154aa6eb277f581c54df9aae6435db282b72ef2f,"The Icelandic Health Insurance fund has to date received 46 applications for damage payouts after COVID-19 vaccination from a population of 311,000 – a rate 150 times higher than expected for flu vaccines. https://t.co/R7Sh4aLXvw",en
2022-08-28 06:00:05+00:00,08e0b563e00a0da7bbdbaf9e960c81fa,"The Icelandic Health Insurance fund has to date received 46 applications for damage payouts after COVID-19 vaccination from a population of 311,000 – a rate 150 times higher than expected for flu vaccines. https://t.co/uCvorsAkOH",en
2022-08-28 05:58:40+00:00,7679e38663890a3f02d8c03c97c96a800d38230d2267eab691eb4a2b606beb83,"@mnhealth Here's a youtube channel where a Minnesotan has documented her struggle w/ life altering, severe Covid 19 vaccine injuries: https://t.co/5oXP7vFpgk",en
2022-08-28 05:56:17+00:00,b65d5f2603c0e9f211d95882dc25bf93b140232ccaa89206273fbafc6e9889e6,Moderna sues Pfizer over COVID-19 vaccine patents : Shots https://t.co/31Jvi63Ruv,en
2022-08-28 05:55:21+00:00,f0ddcf6197aafa83030b83bc8b4ebde9ea798b00bd95a02326f5494e5f8d2e1a,Govt spent RM4.64 bil to buy 87.9 mil Covid-19 vaccine doses - The Edge Markets https://t.co/3u4NZ016QW,en
2022-08-28 05:55:15+00:00,5b7035be7e81a515ffb58b4bb99d71ec,Joe Rogan and Aaron Rodgers carving through the bs that our government has spilt out and lied about Covid 19 is maybe the best thing I’ve ever seen! They lied to all us. That vaccine doesn’t prevent you from getting Covid or spreading it like they said. Fools.,en
2022-08-28 05:53:56+00:00,f0ddcf6197aafa83030b83bc8b4ebde9ea798b00bd95a02326f5494e5f8d2e1a,Khairy: RM2.05 billion for the purchase of Covid-19 vaccines for Malaysians | New Straits Times https://t.co/y8Qwf99PLD,en
2022-08-28 05:46:42+00:00,0e63c34305caa0b07f87f5353226ea41,Here’s Aaron Rodgers telling Joe Rogan that the NFL sent some Fauci stooge to each team to threaten and pressure players into getting the Covid-19 vaccine as if it prevented the virus.  https://t.co/sO6IHoDUz9,en
2022-08-28 05:45:24+00:00,6fac630347fc16b783b89ba4f4b7dc7a8ea1710378c76cb62da8566507aae966,Petition: Remove indemnity from the manufacturers of covid-19 vaccines https://t.co/cak5X4qMzD,en
2022-08-28 05:45:00+00:00,87f51bbc9c5b9d17ac94a0c21897a727,"The Muntinlupa City government reported that the number of adults who have received their first booster shot of the Covid-19 vaccine has increased to over 181,000.https://t.co/djaKAsrD9A",en
2022-08-28 05:38:32+00:00,71038b567e20e5ae8a336486ebddee33,"@AgeBallbag @pbmosligo @PaMulMul1 @BelTel Your own link you posted: Conclusions: Overall, the risk of myocarditis is greater after SARS-CoV-2 infection than after COVID-19 vaccination and remains modest after sequential doses including a booster dose of BNT162b2 mRNA vaccine.",en
2022-08-28 05:31:19+00:00,509f9cb97d9fb6a7046e8627cb9d94c72039da185039674ab7b92bcce3aadc5b,U.S. donating COVID-19 vaccines to Mexico as domestic demand drops https://t.co/nMBjPEG5t5,en
2022-08-28 05:29:10+00:00,4c2bbd5844275a7a6e9f823942f89468b82db147a386529955b908d951f36d0c,Answer to I am hesitant to get the COVID-19 vaccine. What should I do? by Paul Cardin https://t.co/BOrtU8VdRt https://t.co/c5HD17QlDq,en
2022-08-28 05:27:58+00:00,cac17c37c38e6ec2fe58a44cb2a0e463,'Only the beginning': Hundreds protest Western University vaccine m... (https://t.co/Qfxt1iBDYh)A group of Western University students hold a protest against the school's COVID-19 mandates...Add your highlights:https://t.co/vIcgwqxs0X #Education,en
2022-08-28 05:26:37+00:00,e50e8a878d2bb5db534028a3e647447cbf801be1f1d569397999420f939b93a3,"Two months after the U.S. deployment of the vaccinations for that age group began, data from Pfizer NSE 0.01% Inc. revealed that the COVID-19 vaccine was 73.2% effective in children between the ages of 6 months and 4 years. Source - https://t.co/dk8t43kQfA#mba #covid19 #vaccine https://t.co/pTsINJegSj",en
2022-08-28 05:26:07+00:00,594fd1a9c6d009cc1a0d1cd9b91e27c843ef7227f779bef569e68162a3f13530,🔊 @AndrejPlenkovic @MichealMartinTD @Xavier_Bettel @sanchezcastejon @jacindaardern Thanks for supporting #VaccineEquity through COVID-19. Will you join #GlobalCitizenFestival and pledge funds to the @WHO mRNA Tech Hub to empower developing regions to produce their own vaccines?,en
2022-08-28 05:25:22+00:00,a5fec79b684b8dd9e64512bb1867e0b473bb1397ead7004ba8bfaffeeb24bcb3,Hello heroes! 🦸‍♂️🦸‍♀️ Join us for Merdeka Special Cleanup! 🇲🇾✨Date: 31/8/2022 (Wednesday)Time: 5:30pm ⏰ Venue: KTM Ipoh 🚂 Terms &amp; conditions:1) Complete 2 doses of vaccine 2) In a healthy condition 3) No close contact with Covid-19 patients 4) Wear 😷 https://t.co/fsMImuurcb,en
