date,userid,tweet,lang
2022-01-01 18:30:04+00:00,872744452728770560,"COVID-19 still exists! We recommend that you book an appointment for your booster vaccine. This is the best way to keep our community safe.To book today, please visit: https://t.co/4tlZsfThjwYouTube: https://t.co/SktcUcqycd https://t.co/jkhRqZVKmz",en
2022-01-01 18:29:25+00:00,279540297,"@SaharaReporters @PastorEAAdeboye Another every-year prophecy scam. None of them could predict Covid-19 before it took d world by storm during d 1st quarter of 2020. Aside that, they all ran to their hidings when called upon to help heal d world against Covid-19. Govts across d world then had to import vaccines.",en
2022-01-01 18:28:49+00:00,278216480,"Tip for vaccine hesitant ppl not paying attention: don't fall for ""#Covid_19 will give you natural immunity"" argument. mRNA vaccines do EXACTLY that: train your own immune system to recognize/be able to fight virus, WITHOUT having to get the disease.",en
2022-01-01 18:28:47+00:00,1079413854327586816,@realKyleKeegan I’ve heard many religions are against the Covid-19 vaccines.Is there any religion out there that considers the Covid-19 Vaccines a gift from their god?,en
2022-01-01 18:28:32+00:00,97712146,Israel approves fourth COVID-19 vaccine dose for some https://t.co/OkQvgOMhvB via @YouTube,en
2022-01-01 18:28:24+00:00,1445510340159016972,"Dwell Updates: Covid-19, Omicron and Vaccines InformationRead at: https://t.co/7bXeSdFvLl",en
2022-01-01 18:28:07+00:00,1234427004541227008,Indonesian man claims he was hired to take Covid-19 vaccines on behalf of 14 people https://t.co/YqH6PNoG7H #Unemployment #BayCrest #Recruiting #RecruiterTwitter #Hiring,en
2022-01-01 18:27:39+00:00,42614900,"@FredricMorenius 'They added that there is also likely to be increased capturing of death reports associated with the COVID-19 vaccine programme, given it has operated on an unprecedented scale under “Emergency Use Authorization” ...",en
2022-01-01 18:27:35+00:00,2361514592,"@CrashCoursePow @EagleScoutDJB @RJPilkenton @MythinformedMKE While yes there are covid studies, the covid 19 vaccines are a first of their kind. It literally is the first things you need to know. https://t.co/SQQPkPa0Z9",en
2022-01-01 18:26:47+00:00,1076318025450582019,"1/ Covid 19 is here to stay. At some point in the future I believe that I will catch it. However, until that day comes, I will wear masks, take boosters and follow the advice of the scientists. I believe that one day the science will create treatments and vaccines that will",en
2022-01-01 18:26:35+00:00,140237362,"Awesome, that's 206 future insurrectionists gone.Marines kick out 206 troops for refusing Covid-19 vaccine https://t.co/cvfU7Ql1Ne via @politico",en
2022-01-01 18:25:56+00:00,35773039,"Experts in some countries are already starting to advise fourth doses of COVID-19 vaccines. How many more might we need? The answers aren't yet clear, @KatherineJWu reports. https://t.co/oHMmL5bFuE",en
2022-01-01 18:25:14+00:00,1349795689463771137,Pancreatic Injury after COVID-19 Vaccine—A Case Report29 year old female (Medical doctor) - Pfizer BNT162B2/TOZINAMERAN https://t.co/SMUdeXl2nl,en
2022-01-01 18:24:46+00:00,579674546,"Booster shot 💉🦠 (@ COVID-19 Vaccine Center in Jeddah, Makkah) https://t.co/CuwF6suXLf",en
2022-01-01 18:23:45+00:00,1323329881875357697,@AndrewLazarus4 @JamesHesp What date was the  Covid 19 vaccine administered to the most vulnerable?'Ordinary' flu has killed similar numbers daily in the past since 1918/19.,en
2022-01-01 18:23:25+00:00,1349795689463771137,Recurrent Acute Pancreatitis Following COVID-19 Vaccine – A Case Study46 year old male- 2 days aftet Pfizer BNT162B2 https://t.co/IwXsYkuDI1,en
2022-01-01 18:23:04+00:00,2305862587,General Hospital News: Kirsten Storms’ Positive COVID-19 Test Sparks Vaccine Mandate Debate Once Again #GH #GeneralHospitalhttps://t.co/uTyDlRWGeU,en
2022-01-01 18:22:56+00:00,1348280686248157186,Dr Vernon Coleman – “We Finally Have Medical Evidence That Administering a Covid-19 Vaccine is Murder”! https://t.co/jKCDz2wMpn,en
2022-01-01 18:21:38+00:00,1349795689463771137,A case of acute necrotising pancreatitis following the second dose of Pfizer-BioNTech COVID-19 mRNA vaccine43 year old malehttps://t.co/eqch27F6jw,en
2022-01-01 18:21:18+00:00,42614900,"@FredricMorenius '""Health care providers are required to report to VAERS the following adverse events after COVID-19 vaccination…regardless if the reporter thinks the vaccine caused the AE.""'- Vaccin som är testade längre tid har inte samma rapportkrav",en
2022-01-01 18:20:08+00:00,2978990578,Pfizer COVID-19 Vaccine Clinical Trial Whistleblower's Documents Released https://t.co/7s5Lvrj0qN,en
2022-01-01 18:20:03+00:00,15652540,Dozens of Marines have been discharged over the past week for their refusal to comply with the military’s COVID-19 vaccine mandate.  https://t.co/t1qSfiXBFX,en
2022-01-01 18:18:35+00:00,1349795689463771137,COVID-19 mRNA Vaccine-induced Pneumonitis: A Case Report65 year old male- 3 days after Pfizer BNT162B2/TOZINAMERAN https://t.co/zNUL8zkq3f,en
2022-01-01 18:18:28+00:00,55484650,"We lost 7 doctors&amp;1nurse in my own hospital the NHI plus other hospital staff,only 1 was vaccinated,he had received a Chinese vaccine two weeks before his death from a second COVID 19 infection acquired from the cath lab work both times, mandatory vaccines a must,4 died in wave1.",en
2022-01-01 18:18:00+00:00,2905260526,"""Globally, as of 4:14pm CET, 29 December 2021, there have been 281,808,270 confirmed cases of COVID-19, including 5,411,759 deaths, reported to WHO. As of 28 December 2021, a total of 8,687,201,202 vaccine doses have been administered."" https://t.co/ANvLHGxOb7",en
2022-01-01 18:17:31+00:00,1343378512485478400,70-79 years old and haven’t been able to book a COVID-19 vaccine appointment on the provincial booking system? Walk-ins accepted TODAY at the Healthy Planet Arena. https://t.co/4QKTmzgLAB,en
2022-01-01 18:17:02+00:00,3316195462,CDC Sued for Withholding Post-Licensure V-safe Data on COVID-19 Vaccineshttps://t.co/rhHtEOcwtu,en
2022-01-01 18:16:33+00:00,1336111945603170305,"recently lost a friend he'd known for 50 years to COVID-19! He, like thousands &amp;thousands, did not have to die! But, he refused to protect himself, refused the vaccine. Now, he's gone, his family&amp;friends left behind, devastated! I'm vaccinated, have my booster, am willing to take",en
2022-01-01 18:15:50+00:00,3230198245,The UAE has announced that it will ban citizens who have not had three doses of a vaccine against Covid-19 from travelling abroad. https://t.co/91CuJXSFBV,en
2022-01-01 18:15:16+00:00,49672706,"@MrWBond I was never afraid of COVID-19 so I guess the pandemic never actually existed. I would really like to know the motivation of Bhattacharya, Kulldorf et. al. I get not liking shutdowns but they should just be all in on vaccines now. Not what happened.",en
2022-01-01 18:15:10+00:00,119182046,Top Israeli health official approves second COVID-19 vaccine booster for immunocompromised.https://t.co/gpnNrG1Pxk,en
2022-01-01 18:15:06+00:00,886712788336484352,Covid-19: why vaccine mistrust is growing | The Economist https://t.co/cfGsljnW4E via @YouTube,en
2022-01-01 18:14:59+00:00,605409314,Councils are front and centre in national and local planning for the COVID-19 vaccine roll out.Read our updated case studies here.👇 @ADPHUK @DJAFothergillhttps://t.co/tkGfkhDFOQ,en
2022-01-01 18:14:39+00:00,718373154943561728,"India sends 500,000 Covid-19 vaccines to Afghanistanhttps://t.co/dfeXKNjXr8",en
2022-01-01 18:14:26+00:00,1349795689463771137,COVID-19 vaccine induced interstitial lung disease60 year old male- Pfizer BNT162B2 https://t.co/hLq5iaj44e,en
2022-01-01 18:14:21+00:00,955306476,Marines kick out 206 troops for refusing Covid-19 vaccine https://t.co/rddgw8EfCq via @politico,en
2022-01-01 18:14:09+00:00,1452327038052978697,#Covid_19Until when are we going to ride the incoming waves of COVID-19?One of the main posulated reason for the spike of COVID cases is the false notion that masks are not needed for double vaccinated people. This is a dangerous misinterpretation of the concept of vaccines. 1/2,en
2022-01-01 18:13:00+00:00,4832329984,"Got your COVID-19 booster yet? Every adult in the country now needs to get a COVID-19 booster vaccine, to give you the best protection against catching #Omicron.Go to: https://t.co/FbeEgP6LmT https://t.co/aTjVEATIGl",en
2022-01-01 18:12:52+00:00,106328081,@Indigo1_ @Katttmom @beinlibertarian Please provide any evidence you have that “they” stated that vaccines would keep you from catching COVID-19.,en
2022-01-01 18:12:11+00:00,767739978243723264,@Gongkan1 @clouds_mek I do not have the vaccine because I do not want poison in my body I'm a registered nurse of 12 years and this vaccine does not contain any part of the virus so it is not a vaccine so if there's not a vaccine then there is no covid-19 the government sprays the streets,en
2022-01-01 18:11:01+00:00,65423567,"Booster doses of all COVID-19 vaccine types are now recommended for everyone 16+. It is okay to “mix and match” booster doses, meaning you can get a different vaccine for your booster dose than you got for your primary series. To learn more, visit https://t.co/X21hplpf3X. https://t.co/ff9JMAdkUZ",en
2022-01-01 18:10:09+00:00,3180075611,"What's COVID-19 Vaccine booster? Will I have to keep boosting? What's the booster for, was the vaccine weak or it underfights the virus? Please explain to me why I have to keep taking a vaccine? I find this area very green to medics. @citizentvkenya @MOH_Kenya @VickyRubadiri",en
2022-01-01 18:10:04+00:00,1349795689463771137,"COVID-19 vaccine-related interstitial lung disease: a case study86 year old male, 1 day after Pfizer BNT162B2 https://t.co/wpt6J0Cn8P",en
2022-01-01 18:09:40+00:00,3092148387,"Dr. Kirk Milhoan, MDPediatric CardiologyDr. Mark McDonald, MDChild PsychiatristDr. Rober MaloneInventor of the mRNA vaccine platform used in the Pfizer and Moderna Covid-19 vaccines https://t.co/4HlBemm0Ns",en
2022-01-01 18:09:16+00:00,70394965,"COVID-19 booster shots:Gov’t rolls out administration of vaccine booster shots. Fully vaccinated adults eligible for booster dose after six months.MoH recommends Pfizer and Moderna for booster shots. Police officers, Teachers, those with underlying conditions given priority https://t.co/3sobI6x4Aa",en
2022-01-01 18:08:41+00:00,39292745,"As soon as they force everyone to take the Covid-9 vaccine, utasikia CS Health Mutahi Kagwe akisema no government services without proof of Covid-19 booster shots. The real pandemic at this point is government tyranny in the name of curbing the spread of the disease.",en
2022-01-01 18:08:26+00:00,1361219164799606785,#Odisha : Vaccine Registration for 15-18yrs children#Vaccine #CoWIN #Covid_19 @HFWOdisha @IPR_Odisha @CMO_Odisha https://t.co/5n7H5eoS1W,en
2022-01-01 18:08:02+00:00,1412790319893057539,CDC Sued for Withholding Post-Licensure V-safe Data on COVID-19 Vaccineshttps://t.co/lmy7kLMYs7,en
2022-01-01 18:07:28+00:00,1279228962,Vitamin D: Nature’s Natural Covid-19 “Vaccine” | Nature's Real Health https://t.co/QQT3PJcHPX,en
2022-01-01 18:06:39+00:00,767739978243723264,@Mom_Pian @clouds_mek As the world knows there is no pandemic as the world knows there is no vaccine so why is everyone walking around with masks on this is what I don't understand the governments trick you into saying that there is covid-19 but there is nothing it's there to control the people,en
2022-01-01 18:06:35+00:00,842050030970277888,Marines kick out 206 troops for refusing Covid-19 vaccine - POLITICO https://t.co/8rnZfS6IRW,en
2022-01-01 18:06:31+00:00,17923419,"Why vaccine trials weren't responsible 'science' – not even close. "" look at ""historical controls,""  incidence of myocarditis. Within 8 weeks of ...offering of COVID-19 products to 12-15 yo, the rate of myocarditis cases was 19 x... the expected number."" https://t.co/9gKW5tf5Qy",en
2022-01-01 18:06:07+00:00,119294791,Ricky Gervais Would Fight an Old Lady for the COVID-19 Vaccine - Jimmy Fallon - Jan 2021 https://t.co/QzM2AbAdMB via @rickygervaisRicky is a parody of himself. He has all his awards behind him. He is his biggest fan. I have said this for years.,en
2022-01-01 18:05:27+00:00,1437267305512062981,Cruz accuses Fauci of playing politics with COVID-19 after recent comment about hospitalized children https://t.co/8DDgJRgMED via @Yahoo Ted Cruz as usual trying to politicize Covid 19.  Haven't you already caused enough deaths with your take on Covid vaccines? Have you no shame?,en
2022-01-01 18:05:27+00:00,1158539274997735425,"@marcorubio Remember when you cut in line before healthcare workers, the immunocompromised &amp; the elderly to get the first vaccines? Now that you're protected you suddenly stopped caring about Covid-19, cuz hey, you got yours so screw all of us, right? https://t.co/XlEcTPRlHo",en
2022-01-01 18:05:18+00:00,1446159769195192324,Biden Admin Seeks Quick Reversal of Order Blocking COVID-19 “Vaccine” Mandate https://t.co/VkcOBFDFro,en
2022-01-01 18:05:02+00:00,57662695,"A new survey by @PoliSciatNU prof. James Druckman, @jennifer_lin16, and @CarolinePippert highlights who participates in school board elections and what issues matter to them. Voters' top concerns include school safety, COVID-19 vaccines, and mental health. https://t.co/KitCIi7Mac https://t.co/5nEXP2LBaQ",en
2022-01-01 18:04:33+00:00,1244342369849401345,@JacobEdwardInc Every year I get the influenza vaccine some years it’s better then other it goes between 20% to 70% protection. So the Covid-19 vaccine work the same way. It’s not a vaccine for deceased like poliomyelitis or measles that protect 100%. The Covid-19 mutates.,en
2022-01-01 18:04:11+00:00,1345028942634364928,"With many states breaking Covid 19 case records, the @US_FDA still fails to approve #covaxin as a traditional vaccine platform option to mRNA hesitant citizens and it is proven safer for our children with no cases of myocarditis. @CDCgov @CDCDirector @POTUS @WHO are failing!",en
2022-01-01 18:03:48+00:00,2955151219,"@MythinformedMKE As a former vaccinating pharmacist, I always found it odd that almost without exception, the individuals that exhibited adverse events to the vaccine were the ones that had survived Covid-19 and had most certainly developed natural immunity.",en
2022-01-01 18:03:32+00:00,222260849,This is probably true for the average patient. But take a look at Covid-19 patients in the ICU and on ventilators. The overwhelming majority are unvaccinated.Your vaccine doesn’t prevent you from getting sick or getting others sick. But it does save lives.,en
2022-01-01 18:03:26+00:00,4520742375,"@CarryUrCross @BethanyCherisse @Verity36405235 Omicron is not a vaccine. Seriously? Omicron, like delta is a variant of SARS-2 Covid-19. Variants continue to develop when unvaccinated persons provide a host. The vaccines for Covid-19 are not live viruses. Please stop spreading fabricated misinformation.",en
2022-01-01 18:03:02+00:00,1457389981614452741,"Live Updates: Covid-19, Omicron and Vaccines News https://t.co/DMJo79XJPR",en
2022-01-01 18:02:38+00:00,842050030970277888,Marines kick out 206 troops for refusing Covid-19 vaccine - POLITICO https://t.co/8rnZfS6IRW,en
2022-01-01 18:02:22+00:00,1045402870403813376,"Lancaster ISD will offer COVID-19 vaccinations for Lancaster ISD students and parents on Monday, January 3.The clinic will offer the 1st, 2nd, &amp; booster dose of the following vaccines:💉Pfizer💉Moderna💉Johnson &amp; Johnson Click the link to register! https://t.co/0YIq14Doxh https://t.co/MPipSe6aS2",en
2022-01-01 18:02:18+00:00,713839291210792960,Benjamin Franklin's writing about losing his son to smallpox is a must-read for parents weighing COVID-19 vaccines today 👇#GetYourKidsVaccinatedhttps://t.co/GTaQRkvhI8,en
2022-01-01 18:02:05+00:00,39311859,Federal grant funds COVID-19 vaccine program for homebound Oklahomans https://t.co/Ek0b6UeaUi,en
2022-01-01 18:01:56+00:00,803461555094335489,"@CoryRuralReport @JDVance1 These vaccines have been researched for 30 years. More than 9 *billion* Covid shots have been given across the globe, with minimal side effects. Meanwhile, the vast majority (in the 90% range) of U.S. COVID-19 deaths now are in the unvaxxed. The vaccines work.",en
2022-01-01 18:01:53+00:00,1132795077753835520,"@VABVOX I - and my whole extended family - fit that description. I also know more than 10 friends and colleagues that refused the vaccine and have gotten COVID-19, to varying degrees of severity. 2 have gotten COVID more than once.",en
2022-01-01 18:01:52+00:00,3092148387,Dr. Robert W Malone and #TheUnityProject podcast:Covid-19 and vaccine observations from pediatric specialists https://t.co/4HlBemm0Ns,en
2022-01-01 18:01:47+00:00,1021361523589984256,"""It is time for rich-country governments and the pharmaceutical companies whose interests they serve to share vaccine doses equitably. Until everyone has access to a Covid-19 vaccine, no one is safe.""",en
2022-01-01 18:01:14+00:00,3229297004,"FWCOC will host a Covid 19 Vaccine and Testing Event for ALL on Sunday, Jan 9th.  To ensure we have enough resources, please register Today for your vaccination at https://t.co/sRrwdwV159.  Invite your family and friends to register and attend this event.#FWCOC #Growing https://t.co/R0mRoGFL9G",en
2022-01-01 18:01:06+00:00,108689047,"COVID-19 vaccines are now available for children 5-11 years old!If you have questions, talk to a healthcare provider or use a vaccine Consult Service.Learn more at:https://t.co/fVQibjybieyouth-parents#talk-it-out https://t.co/TvDE6qhzSl",en
2022-01-01 18:01:03+00:00,1158539274997735425,"Remember when Marco Rubio skipped the line in front of health care workers, the immunocompromised &amp; the elderly to get the first Covid-19 vaccine dose? And now that he's protected he wants you to get back to work cuz he don't give a fuck about you unless you make him money.",en
2022-01-01 18:01:00+00:00,1191855827667128320,Effectiveness of COVID‐19 vaccines: findings from real world studies in @theMJA https://t.co/UsMt27QJCF,en
2022-01-01 18:00:52+00:00,872744452728770560,"Getting your covid-19 vaccine makes you less vulnerable to covid-19. For more information, visit https://t.co/XW4GU0hYa4  If you have any queries, please call/text 07710 022382#NHSCOVIDVaccine #OneLoveTwoJabs #GrabAJab https://t.co/uJeJyng4CJ",en
2022-01-01 18:00:47+00:00,255053043,"I helped develop COVID-19 vaccine, let's reach unvaccinated by listening not shaming - USA TODAY https://t.co/UtLcGfgIrF #blockonlineshamers #shaming #bekind",en
2022-01-01 18:00:40+00:00,1448878207680274432,"@n8pennell Cumulative incidence of COVID-19 was examined among 52238 employees in an American healthcare system. C-19 did not occur in anyone over the five months of the study among 2579 individuals previously infected with COVID-19, including 1359 who did not take the vaccine",en
2022-01-01 18:00:16+00:00,407820462,"Everyone in the United States ages 5 years and older is eligible for a COVID-19 vaccine. Getting vaccinated is fast, easy, and free, and helps protect yourself, your family, and your community. Visit https://t.co/MFzEOHX2AT for more information. https://t.co/BSsrhsBJGT",en
2022-01-01 18:00:14+00:00,24920395,"Israel has approved a fourth vaccine dose for residents who are most vulnerable to COVID-19, officials said Thursday. https://t.co/o0swudm9YA",en
2022-01-01 18:00:09+00:00,32135940,There are multiple COVID-19 vaccination clinics. Vaccines are available at no cost to eligible adults and children with parental consent.👉 https://t.co/Y8CnnU6sAD#CCstaysafe #NuecesKnows https://t.co/s3FYgpUMBe,en
2022-01-01 18:00:09+00:00,47453990,There are multiple COVID-19 vaccination clinics. Vaccines are available at no cost to eligible adults and children with parental consent.👉 https://t.co/nfL1lWDUDd#CCstaysafe #NuecesKnows https://t.co/8nIbmExaHt,en
2022-01-01 18:00:06+00:00,429580982,Novavax files data with FDA to support its COVID-19 vaccine | WPFO - Fox 23 Maine https://t.co/zXbp4cBQdQ,en
2022-01-01 18:00:02+00:00,1405819204855599109,"New Mount Rose Missionary Baptist Church is opening its doors and offering free COVID-19 testing, vaccines, and monoclonal antibody treatments. 🩺https://t.co/6qWxSu0f0f",en
2022-01-01 17:59:06+00:00,8940342,From February 2021: The Houston vaccine expert has spent his whole life preparing for a battle like the one he’s found himself in since COVID-19 first came on the scene. https://t.co/E2hPVBHn1Y,en
2022-01-01 17:58:40+00:00,1199771785148993536,"Hospitals 🏥 see spike in fully COVID-VACCINATED getting COVID-19 , which proves old 2020 COVID vaccines don't work no more!Make NEW COVID VACCINE!This is failed leadership of @JoeBiden &amp; @KamalaHarris who push 2020 TRUMP vaccines! @DNC @SenateDemshttps://t.co/y8eoEdrwug",en
2022-01-01 17:57:02+00:00,624951249,"BREAKING: Effective today, Michigan athletics will require proof of a COVID-19 vaccine or negative-test protocol to attend indoor athletic events for everyone 12 and older. More -&gt; https://t.co/Ff3hArMVOv",en
2022-01-01 17:56:37+00:00,3396017475,A free PDF download now available 💜 A Covid – 19 Vaccine Social Story https://t.co/ChTl6IQSCQ,en
2022-01-01 17:55:29+00:00,3079004552,@AndyJ97209400 @RealDeanCain There is Covid-19 thanks to Fauci/Obama experiments they pay China to research which did get out as a pandemic! My ex was healthy &amp; died of Covid! But mandates for vaccines are unconstitutional &amp; firing our military &amp; medical is BS!! Especially with open borders with 60% Covid!🤬,en
2022-01-01 17:55:21+00:00,1384227059573002240,.@Timcast Stop comparing Covid-19 vaccines to the holocaust.,en
2022-01-01 17:54:40+00:00,1316705752862449665,"India has pledged to send another 500,000 doses of #COVID19 vaccines in the coming weeks as part of humanitarian aid for #Afghanistan“Today, India supplied the next batch of humanitarian assistance consisting of 500,000 doses of the Covid-19 vaccine (#Covaxin) to Afghanistan. https://t.co/47zO7bus2f",en
2022-01-01 17:54:15+00:00,1199771785148993536,"Doctors worry about breakthrough infections as more people than ever test positive for COVID-19@JoeBiden &amp; @KamalaHarris keep pushing 2020 TRUMP COVID vaccines, instead of making their own NEW COVID VACCINE!Failed leadership of @POTUS to kill millions!https://t.co/aOuP1VLw05",en
2022-01-01 17:54:01+00:00,66682604,"Today's viewing is this In Conversation Live with Kate Bingham, former Chair of the UK Vaccine Taskforce, discussing the strategy and strive behind the UK’s historical COVID-19 vaccine effort. @katebingham2 https://t.co/a1Bz0uoSlb",en
2022-01-01 17:53:51+00:00,852970642106351617,The COVID-19 vaccine is a photoshopped picture of Octomom in my apartment build….,en
2022-01-01 17:53:20+00:00,34127769,"MAN, 34, WHO MOCKED VACCINES DIES OF COVID-19.  https://t.co/DperXZnnRt",en
2022-01-01 17:52:40+00:00,134758540,India sends 5 lakh Covid-19 vaccines to Afghanistan https://t.co/73ocg0bDuu https://t.co/HyyfZKMMMP,en
2022-01-01 17:52:30+00:00,3604757952,"Vaccines can protect you from serious illness and death from COVID-19. But DYK that after being vaccinated, you should STILL😷 Wear a mask↔️ Keep a safe distance🪟 Open windows🤧 Cough/sneeze into your elbow👐 Keep hands cleanto protect others❓ Here’s why ⬇ https://t.co/Zy78iKDfaI",en
2022-01-01 17:51:57+00:00,710473981925658624,@MlMcNamaraTD @catherinegalway @Toibin1 @mattiemcgrathtd The Covid 19 vaccine is killing people. It must be halted immediately and vaxports abolished. @LeoVaradkar @MichealMartinTD @EamonRyan 👇,en
2022-01-01 17:51:40+00:00,52391511,Arduous trip through Amazon brings COVID-19 vaccines to vulnerable groups https://t.co/R3XpwLX48K,en
2022-01-01 17:50:16+00:00,632859279,#RhumbaRaha The United Arab Emirates has announced that it will ban citizens who have not had three doses of a vaccine against Covid-19 from travelling abroad.,en
2022-01-01 17:50:14+00:00,927969745076457473,The United Arab Emirates has announced that it will ban citizens who have not had three doses of a vaccine against Covid-19 from travelling abroad.https://t.co/4i1wTuMfMH,en
2022-01-01 17:50:09+00:00,416986537,Length of hospital stay and risk of intensive care admission and in-hospital death among COVID-19 patients in Norway: a register-based cohort study comparing patients fully vaccinated with an mRNA vaccine to unvaccinated patients https://t.co/aVqMqa1wD2,en
2022-01-01 17:50:02+00:00,17218697,Need a COVID-19 test or vaccine? Book your appointment today.Book your test: https://t.co/ts6hmq5jq9Book your vaccine: https://t.co/QA2ltYeQFx https://t.co/dE5TZ8Vt6u,en
2022-01-01 17:49:14+00:00,1157026407320641536,@Daly_Sunshine @ScottAdamsSays The benefit of the vaccine extends way beyond 6 months. A vaccinated colleague of mine just tested positive but is completely asymptomatic. That's not COVID-19. There is literally no vaccine that is 100% effective. The metric should be hospitalizations and deaths.,en
2022-01-01 17:49:07+00:00,24428772,Being unvaxxed is risky business. More Texans died of COVID-19 in 2021 than in first year of pandemic even though we now have the vaccine.  2021 COVID deaths driven almost exclusively by people not vaccinated. Good luck with 2022. https://t.co/u3DMdEAddX,en
2022-01-01 17:48:50+00:00,727582681148559360,New post (Update on COVID-19 Vaccine Availability in States/UTs) has been published on IBG News - https://t.co/VXOFkeU96N https://t.co/pyk6DtfSSR,en
2022-01-01 17:48:19+00:00,1339513266188529664,"IF ADULTS WERE NOT ASSHOLES TO BEGIN WITH DURING VACCINE DRIVE...NONE OF THEIR KIDS WOULD BE SICKER BY COVID-19...BUT ITS TEXANS CHOICE WITH THEIR FREEDOM AND THE PRICE IS GONNA BE PAID BY THEIR CHILDREN HEALTH...GOOD THING I DON'T HAVE CHILDREN, JUST CATS",en
