date,userid,tweet,lang
2022-04-08 08:19:48+00:00,a6d346306234fc48695c12f09708d855,"@SpeakerPelosi tests positive for COVID-19""The Speaker is fully vaccinated and boosted, and is thankful for the robust protection the vaccine has provided""Of we gek willen blijven",en
2022-04-08 08:17:09+00:00,e9229289e95addd07fbd681a6bd7df52,"Pfizer's Covid-19 Vaccine Documents Counter ""Safe And Effective"" Narrative https://t.co/BGHieGIVQM",en
2022-04-08 08:16:05+00:00,79f8eee2c524739069c9a9bc223a0149,"COVID-19 waste worldwide:• 87,000 tons of PPE• 2600 tons of plastic from test kits• 144,000 tons of waste from vaccines• 731,000 liters of chemical wastehttps://t.me/c/1241020428/50585",en
2022-04-08 08:15:41+00:00,5a784e0af1c6c37d50c92ef23e4cbb55a1b3b33e55e43c625bf935e6b97829c4,"They're ramping it back up before the midterm elections!Gee, I wonder why? (Chaos) US Appeals Court Clears Biden’s COVID-19 Vaccine Mandate for Federal Employees https://t.co/rRKfWRjaRd",en
2022-04-08 08:13:24+00:00,98da2394c01e9c1fc525dae5d72a3860000dda5eb3769faf1b01db77cb01159c,Pfizer documents: Pfizer hired ‘600 employees’ due to volume of Covid-19 vaccine adverse event reports https://t.co/14gNyvQG0y via @pamelageller,en
2022-04-08 08:13:07+00:00,012e09b8d301fc9a053f2d5b0a680940,The Therapeutic Goods Administration has recommended the booster be given six months after the primary course of a COVID-19 vaccine:https://t.co/VV8MDNTap3,en
2022-04-08 08:12:29+00:00,3d0954b87ec7743f03033da4162e695de7f21fd95e14ce910057474476c3fa58,US FDA: Current Covid-19 Vaccine Less Effective Against Omicron BA.2 https://t.co/13tLuQOVvi,en
2022-04-08 08:10:00+00:00,af42ed51acad3274a69faefb7a4c51d8,"@DeeWilliams7 The Supreme Court legal challenge against SA's vaccination mandates has been told the jab does not stop transmission of COVID-19. Giving evidence on behalf of benched AFLW player Deni Varnhagen, Professor Nikolai Petrovsky says it is because vaccine effectiveness is slow. #7NEWS https://t.co/cD5I84NXxk",en
2022-04-08 08:09:34+00:00,a407202b50203b372b925be05e84eba3,Are you at a greater risk of serious disease from a COVID-19 infection? Need to check when your next vaccine is due?Public Health Wales have created this useful vaccination schedule across all age ranges.Book your appointment 👇https://t.co/hJkpQiQ3dE https://t.co/WF6cUTrWR9,en
2022-04-08 08:09:25+00:00,93737b54b37b68c6d8c52f59a75f5f81,"There are lots of walk-in COVID-19 vaccine clinics which offer first and second doses to anyone aged 12+, as well as boosters for over 16s. If your child is aged 5-11, you can book their two paediatric doses on the NHS National Booking System.https://t.co/TL6th1wqwe https://t.co/Ym8RxFzyZD",en
2022-04-08 08:07:14+00:00,6df3330ecbc8ed0d4c5da42eebdf2d7c,"Still need a #COVID19 vaccine?You can get your 1st, 2nd and booster doses.There are various options for getting your COVID-19 vaccine in Bexley. For further vaccine info visit:  https://t.co/jAnTAhZs4L https://t.co/Nwx0I5Dq6I",en
2022-04-08 08:07:06+00:00,06e769573ea3be1e87854abdf57bcc7b,Appeals court upholds President Biden's federal employee COVID-19 vaccine mandate https://t.co/qPuAE6ZeY1,en
2022-04-08 08:06:57+00:00,57be277906bdde64d481701258921b89,Looking to have your COVID-19 vaccine? There are walk-in vaccination clinics taking place today and tomorrow at Allum Hall in #Borehamwood. Spring (2nd) booster doses are by appointment only. Book your booster via the National Booking Service at https://t.co/zqeu8RNb1l https://t.co/gGqorhL5FT,en
2022-04-08 08:06:44+00:00,6e7c832ab01a4ae1a407e772ba414bf0abbda9948c98c1504dba5fc4f623b6fd,From the New England Journal of Medicine: A new study shows the Efficacy of a Fourth Dose of Covid-19 mRNA Vaccine against Omicron.  https://t.co/MSAff6rRNr,en
2022-04-08 08:06:35+00:00,6e7c832ab01a4ae1a407e772ba414bf0abbda9948c98c1504dba5fc4f623b6fd,Vaccines prime the immune system to make protective antibodies if it encounters threats later on. A new study shows that a fourth dose of the Pfizer/BioNTech Covid-19 vaccine seems to offer short-lived protection against infection.  https://t.co/N6HYy3yBFd,en
2022-04-08 08:04:05+00:00,0102399ed67ea8762594638ffeb6c655,"The National Health Security Office (NHSO) has paid 1.71 billion baht in compensation to 14,034 people who developed side effects from Covid-19 vaccines over the past year. https://t.co/Vxl7woZlVi",en
2022-04-08 08:02:09+00:00,93959ba24e6277afb62e4660cf2e081f,What Will Trigger Modification Of COVID-19 Vaccines?https://t.co/zPNxqQsIJD #PinkSheet,en
2022-04-08 08:01:41+00:00,e93c326dea1864b6f28ae718713ab24a,Covid-19: More than 34 million vaccine doses administered in SA | News24 https://t.co/4VRmxiVGBq,en
2022-04-08 08:01:37+00:00,3c78cf2ab8a1bcadf340681a904d1538,"Both #Loughborough Hospital and Oakwood Pharmacy have Covid-19 vaccine walk-in clinics open today.To find out all the details including times and eligibility, please visit👇https://t.co/N9uRI0i1E5 https://t.co/NXcIodCrP6",en
2022-04-08 08:01:23+00:00,ec3ac287e1258307a12fa59062277467,"Gavi, MedAccess and Open Society Foundations partners to help countries procure additional COVID-19 vaccine | https://t.co/b6nkGufY7Chttps://t.co/b6nkGufY7C",en
2022-04-08 08:01:19+00:00,422abaaaae02190e99743c213c91d380,A fourth COVID-19 dose is now available for all Australians over 65 as well as other eligible populations as recommended by ATAGI. To find out if you are eligible head to the vaccine tracker below. https://t.co/ys8XNFOCQQ https://t.co/ai7qlIjZUz,en
2022-04-08 08:01:14+00:00,417b1d5fca9bde0527c1c851b84b18e5db15a47dae395a3dbcd6b5e4da06a090,@Karl_Lauterbach Your attempt to balance the national pension with a mercy killing law for the elderly is shattered. For God's sake retire. No an excess mortality linked to covid-19But an excess mortality linked to the vaccines.Some day you will have to pay for your diabolic deadly politics.,en
2022-04-08 08:01:00+00:00,5e5e3cbe67b6815baf1bbc2923447842,"Every adult in the country now needs to get a Covid-19 booster vaccine, because two doses does not give you enough protection against catching Omicron. https://t.co/BpxfemgHah https://t.co/CDRJeRfLZZ",en
2022-04-08 08:00:59+00:00,b81d6eebf4db844377ed70f4b2399895,"A single dose of the Pfizer vaccine reduces the risk of COVID-19 infection in children, new research from King's has found. https://t.co/9IgnNardR8#ForeverKings  🦁",en
2022-04-08 08:00:59+00:00,fe1da4addf334cd68a5ce2c6c0f04840,COVID-19 vaccine clinic at Salford Royal Mayo Building today❗✔️8.30am to 4pm ✔️Walk-in or book at: https://t.co/JVxBpPZJ3u✔️Boosters for 16+ (13 weeks later)✔️12+ first &amp; second doses (13 weeks later)✔️Bookings now available for ages 5 to 11Visit https://t.co/tym8Sq1pHO https://t.co/g5TCGvEfVI,en
2022-04-08 08:00:01+00:00,d535bf33123bae65c21346d8b2e08730,"Children aged 5 to 11 are now eligible for the COVID-19 vaccine. Parents and guardians, book from today. Please visit https://t.co/j5yzv8aDjk for more information or to book online. https://t.co/hNQrUvioTl",en
2022-04-08 08:00:00+00:00,e582fc4ce9e21455926e32d9340458cc,"Children aged 5 to 11 are now eligible for the COVID-19 vaccine. Parents and guardians, book from today.Please visit https://t.co/4JHdHsXMWR for more information or to book online. https://t.co/UB8cXMpZtA",en
2022-04-08 07:57:46+00:00,fae389c44ddd101c8241fc2436ba1d0af6d7db877cd5d1a67aa1988cbc25e205,FirstSquawk: U.S. FDA AMENDS JANSSEN'S COVID-19 VACCINE EUA TO ALLOW EXTENSION OF VACCINE SHELF LIFE FROM 9 MONTHS TO 11 MONTHS WHEN STORED AT 2-8 DEGREES CELSIUS,en
2022-04-08 07:57:39+00:00,1b7a7390122ef9f45760941f4a8d562237561f533fc963f510611d640ede0a2e,Saudi Health Ministry denies rumors on fourth dose of Covid-19 vaccine - Saudi Gazette https://t.co/cvoMUQKVHb #News #Saudi #السعودية #المملكة,en
2022-04-08 07:56:26+00:00,03d532f5f5158b3a3a19033ce3d78156,Get your COVID-19 vaccine this Easter 🐰✔The virus spreads easily and can make some people unwell. Find a walk-in centre near you - https://t.co/TCQ7kEqvrX https://t.co/J5bXfY9gF2,en
2022-04-08 07:54:49+00:00,b010840d06258a8ce46ea0169082dd40,"New article out in @PLOSONE: The COVID-19 Vaccine: Trust, doubt, and hope for a future beyond the pandemic in Germany https://t.co/wzmRvAENwj with colleagues #AmeliaFiske  #FranziskaSchönweitz #JohannaEichinger @bettizimm  #NoraHangel #AnnaSierawska @alena_buyx from @SolPan_Plus",en
2022-04-08 07:50:50+00:00,c870f0eb2eaf7eee1d269ae1904e930b,"[BUSINESS] Gov’t sets aside Sh7bn to COVID-19 vaccines: NAIROBI, Kenya, April 7 – The Government has allocated Shs 7 billion to enable the purchase of  Covid-19 vaccines and related expenses during the 2022.. https://t.co/XDsP5yAUSR",en
2022-04-08 07:50:00+00:00,87f51bbc9c5b9d17ac94a0c21897a727,The Department of Health (DOH) said it has already sent a request to the Food and Drug Administration (FDA) to amend the emergency use authorization (EUA) of Covid-19 vaccines to allow the administration of booster shots for children aged 12 to 17.https://t.co/pVFcKz7oSB,en
2022-04-08 07:49:00+00:00,316925a23a3a3eb51972549c33b690bd0d38230d2267eab691eb4a2b606beb83,"Save the Date for the TCD 'COVID-19 Immunology, Vaccines and Lessons for the Future' Conference. June 9-11, 2022! Keep an eye out for registration, which will open soon! https://t.co/iwoti4N7yP",en
2022-04-08 07:46:46+00:00,7ce6b9db256339f12a203b54447fe42b5dcc978a556b13bee04ccbfbc5a46d3d,ECDC and EMA issue advice on fourth doses of mRNA COVID-19 vaccines https://t.co/474h6dBcfo,en
2022-04-08 07:45:02+00:00,115a414968ce8e0dc941d4a2713612bf,"Getting the COVID-19 vaccine helps protect against serious COVID-19 infection, as well as reducing the risk of passing infection on to others.Even if you've already had coronavirus, the vaccine will top up any natural immunity. https://t.co/NTuF5D7U98 https://t.co/KOgjONpquL",en
2022-04-08 07:44:28+00:00,60c8f3c9babadf5f265f5137dc98d349416160b90b8d13b94fc7810b3174e5cc,💉@EMA_News starts rolling review of HIPRA COVID-19 vaccine ‼️The revision and subsequent approval of the HIPRA vaccine is the step before its commercialisation.Read here all the information 👇https://t.co/9iYjVQz11J #InnovationKillsTheVirus #RBDCOV #RBDCOVNews https://t.co/QgwZZwFJNL,en
2022-04-08 07:41:53+00:00,a1b032d5ab1d058e69ff6a5a2bb1d469,#Coronavirus Free Covid-19 Vaccines and Boosters #Covid19 https://t.co/eRDDmMq6qS,en
2022-04-08 07:40:16+00:00,fa71920b921ed1b203c002e82a225da5de5ce62e88d2fd90e93fc7bca74d1bc7,U.S. FDA AMENDS JANSSEN'S COVID-19 VACCINE EUA TO ALLOW EXTENSION OF VACCINE SHELF LIFE FROM 9 MONTHS TO 11 MONTHS WHEN STORED AT 2-8 DEGREES CELSIUS:,en
2022-04-08 07:40:00+00:00,14f83d68055f75d0d284c488e57b5653228335d9ea3ae439e4ea63707f934f2a,"SOUTH AFRICA: Health activists have launched legal action in a bid to compel the govt to disclose details of the advice it sought on COVID-19 vaccines and how it reached key decisions, ranging from which jabs to administer to who would receive them first.https://t.co/fzoioET4gq",en
2022-04-08 07:39:16+00:00,f36588d39769c6dc1393232d304a5fe4,"Cuba had developed five vaccines against COVID-19 that it is willing to share with the world, but is limited by the blockade that prevents it importing some essential production materials. https://t.co/iHQwaEVrp4",en
2022-04-08 07:38:42+00:00,f17fb6ac0f870b9f08c1aa09a64390eadce567b9adc3921c630417b9726da8ac,"Now imagine vaccines against polio and smallpox weren't mandated and people like you were left to make the decisions? The problem here is Covid-19 is not finished. But hey, you never believed it started in any case🙄🤷🏻‍♂️.",en
2022-04-08 07:35:23+00:00,05062b1dde848acb07d682ffaa5ae807,CNN: A federal appeals court has revived President Biden's Covid-19 vaccine mandate for federal executive branch employees. https://t.co/gSlG752eOf (via https://t.co/lgfjwGPwdG ),en
2022-04-08 07:34:58+00:00,1cac4c317fa2f2028d026b074dbf9c24,"More Ontarians, including those over 60, can book fourth COVID-19 vaccine dose today https://t.co/nCIZ34sK9Lhttps://t.co/nCIZ34sK9L",en
2022-04-08 07:34:48+00:00,a9c0f4119362bc15be839c6827f05f8c,FDA Floats Moving COVID-19 Vaccines To Flu-Like Model https://t.co/l5cIak5SMh #Money #Finance #Economics #Market,en
2022-04-08 07:34:41+00:00,022a5fc02d4ef08a063278e444792662a0a0b150e777820bcd7eb42602619ba9,"The timeline of narratives on COVID-19 in children:""children aren't susceptible""""schools are safe""......""most children now infected so what's the point of vaccines?""""Children aren't impacted""......""Children are getting hospitalised but these are mild hospitalisations""",en
2022-04-08 07:34:06+00:00,025de235bb586ecb85267961bc67e043,"Complete COVID-19 Vaccine-Related Athlete Injury/Death List To-Date: 779 Cardiac Arrests, Serious Issues, 500 Dead https://t.co/CdE2VJiFdL",en
2022-04-08 07:33:38+00:00,e69f3350947df59ae914a03b0d424eed,"RTStateDept: The United States is committed to saving lives and bringing an end to the COVID-19 pandemic. This week’s delivery of 52,650 doses of the Pfizer COVID-19 vaccine to Solomon Islands is an important step toward reaching that goal. https://t.co/DsI656dutF",en
2022-04-08 07:31:10+00:00,83db02e175f5d36e0f7ff96343d58452,"#Britain maintains a strong tradition of #innovation. As we look to the future, @annette_pass shares key lessons for infrastructure from the Covid-19 vaccine.#industryinsightshttps://t.co/0yDfoJ3FhO",en
2022-04-08 07:30:38+00:00,8cf9778f5d2db50315d239f6374462c600beb6091980b1bd2d470f5114f3b09e,A federal appeals court has revived President Biden's Covid-19 vaccine mandate for federal executive branch employees. https://t.co/apb9RKtKFH,en
2022-04-08 07:30:03+00:00,34372c5449f3f3756c845d7b1e8d751e,"If you are #fasting during daylight hours over #Ramadan, getting your #Covid19 vaccine will not break your fast, and getting vaccinated will help protect you and your family. Find your local NHS Covid-19 vaccine site here: https://t.co/KbZ7MY2bBo https://t.co/VJO42LfGlR",en
2022-04-08 07:30:00+00:00,2f35d95ff05b8a35055e4f543aea7f7e3363c9b71ad912bed775b34bad5e33a6,"From tomorrow, a thirty-second NHS clip will feature in cinemas across the South East to help raise awareness of the Covid-19 vaccine being available to all 5 to 11-year-olds.Visit https://t.co/lSJrjXqy6t to book online, or find a walk in near you. https://t.co/f3OgW86Htc",en
2022-04-08 07:29:41+00:00,bbacaad7abdbbfc3f232612f1ca0a8bb063bf15884a091088e9196fc29f3984d,US Appeals Court Clears Biden’s COVID-19 Vaccine Mandate for Federal EmployeesDISSENT CORRECT https://t.co/UAnO4mVIjX,en
2022-04-08 07:28:41+00:00,73307411b26d69239762bb4eb6518a68,Tracking an FDA advisory panel meeting on Covid-19 vaccines and boosters https://t.co/7nx3J8XzRH,en
2022-04-08 07:25:42+00:00,41ec2f47aaf792ae8ab09122e4494cd582f4682ac5aa63e8d69df89c4bc7e93b,“German Chancellor Olaf Scholz said he was disappointed the lower house of parliament on Thursday voted against a COVID-19 vaccine mandate”  Only in #Italy the denial of civil liberties &amp; the right to choose continues.  @robersperanza you are a disgrace. https://t.co/OX4S5mBWFv,en
2022-04-08 07:25:08+00:00,ea5932c2a18d050118a946fc8f68278d0fbbcbdc8d2cf85de825c23b1125388a,"@MenWhoLived3ce @BillyRalph @_balogun19 @_FADAKA I have never had vaccine hesitancy. For Covid-19 however, if you look hard enough, there’s enough reasons to believe that “the best interests of those to be vaccinated” wasn’t top 10 on the priority of big pharma and a lot of politicians.",en
2022-04-08 07:22:45+00:00,eabd8b7500c57f0bbc4f3a28126b6e8be01a25b9ff1a8debb4175dbb009c92b4,Update on COVID-19 Vaccine Availability in States/UTs  https://t.co/N8WAITpd4C,en
2022-04-08 07:22:23+00:00,eabd8b7500c57f0bbc4f3a28126b6e8be01a25b9ff1a8debb4175dbb009c92b4,Update on COVID-19 Vaccine Availability in States/UTs  https://t.co/N8WAITpd4Chttps://t.co/lCneeLfoKU,en
2022-04-08 07:22:14+00:00,decbe76fb2d72455f382ddb0ec618249967a5a6bd02617dc4405cfec21ffa8fb,@justinsteichen @goaloa @GiffMic @TheLeoTerrell Pfizer didn’t take the government money. And its vaccine rolled out first. The Trump administration badly bungled COVID-19 testing and vaccine distribution. And many Republicans actively encouraged people to remain unvaccinated.,en
2022-04-08 07:21:18+00:00,710cf21ad55deb2b9f29b0b1a90ed6e9,Take care of your T cell exhaustion - COVID-19 vaccines update 37 https://t.co/2zRD39BXvg via @YouTube,en
2022-04-08 07:21:06+00:00,160bfc77ba9fe5e7e768d62ba604a45978f2998e207d21b672d72f22f35c31f1,A federal appeals court has revived President Biden's Covid-19 vaccine mandate for federal executive branch employees. https://t.co/FzOzSuYLZt,en
2022-04-08 07:21:05+00:00,4de1ff21310a35291315dcd638802fa59096a03e82b127d8cf035674046442f2,Could Would Should What Will Trigger Modification Of COVID-19 Vaccines? - Pink Sheet https://t.co/I2sf8Q6Q7V #should #assumptions #Would,en
2022-04-08 07:21:04+00:00,d2415bbbb9f4609d2add60d0d00e77a3,Vaccine passport system to end on April 8; COVID-19 data reporting to now be weekly. Wow! The day is here! https://t.co/KfX0GBsNaU via @KamThisWeek,en
2022-04-08 07:20:47+00:00,4c6a613ecd3d212b72074d84fd09bd14,A federal appeals court has revived President Biden's Covid-19 vaccine mandate for federal executive branch employees. https://t.co/Zu1RjXApYW,en
2022-04-08 07:20:43+00:00,b76a5faea765eb23d4fefa3f6fb60ace9e674eea07990bb610036e9095788c88,About 25% of people who have never confirmed their case are not interested in getting a COVID-19 vaccine. https://t.co/Lwi3d8YfcM,en
2022-04-08 07:19:35+00:00,4c5e21d2981b8288dcd2ba10e0ba3d68,The New York state court system has fired 103 employees and banned four judges from courthouses for refusing to comply with a COVID-19 vaccine mandate.  https://t.co/FI8qJ1PwGg #COVID19 https://t.co/fLtG5VPaez,en
2022-04-08 07:17:45+00:00,32b31b178e9e0279bdee58f77743b2534a3e5a36661cce400bb0fb5a7eeee736,Case Report: Anti-NF186+ CIDP After Receiving the Inactivated Vaccine for Coronavirus Disease (COVID-19)@Tomas_Miszczuk @Nigelj08223326 @m_obserwator https://t.co/dlUmgLEBmZ,en
2022-04-08 07:17:23+00:00,8b91fb9f20d3e4c43c1e09a4fe01e3da,SA Police Commissioner too ill to appear at COVID-19 vaccine mandate court case  https://t.co/baAi1rLmZl,en
2022-04-08 07:17:08+00:00,8964eae79333e72e44f6f443fd841d5969e944ef7385ea9abdabff87296a581f,zerohedge: FDA Floats Moving COVID-19 Vaccines To Flu-Like Model https://t.co/2WvqW9R3t3,en
2022-04-08 07:16:40+00:00,4a22b32cf470a67e43f3242cf0a66a54,"Pfizer's Covid-19 Vaccine Documents Counter ""Safe And Effective"" Narrative https://t.co/PUHOQFiDjz",en
2022-04-08 07:15:05+00:00,69ef427da4c60acca037c4a24d91ea24,Federal COVID-19 vaccine mandate gets OK from appeals court https://t.co/Relb7hGHIZ,en
2022-04-08 07:15:01+00:00,f7660ba81ef330c0ea18e67ba987ebe7410e577447ec350790eae9001265aadf,https://t.co/Njoe3O0hUU | Covid-19: More than 34 million vaccine doses administered in SA - Learn about cryptocurrency and the stock market for FREE at https://t.co/lkFxXY9td9 #southafrica #southafricanews #mzansi #bitcoin #stockmarket https://t.co/4M9cKbi18z,en
2022-04-08 07:14:54+00:00,e1a2f98b2fd726b4b957d96f68dbfdf0,"New crop of COVID-19 mRNA vaccines could be easier to store, cheaper to use https://t.co/4CaACQs2q1",en
2022-04-08 07:14:01+00:00,720dc1c7cba95fd13614cacba0933e8c,Four Parasites Found in Pfizer and Moderna COVID-19 Vaccineshttps://t.co/AEvpRdd7pk,en
2022-04-08 07:12:12+00:00,b0367eac4021021e0eeb152e937606b88c78338d21d61b43cb8bdcbdc0b7f7ef,Appeals court upholds Biden vaccine mandate for federal employees NEW ORLEANS — President Joe Biden’s requirement that all federal employees be vaccinated against COVID-19 was uhpheld Thursday https://t.co/DXBxAYGqFw https://t.co/k30TjEYg0o,en
2022-04-08 07:11:08+00:00,d3290f44be3851bb801b0705c18b60b699545c132f3f60822bebdbda51f87340,@Sejofi1985 @EikePan Increasing COVID-19 vaccine boosters or vaccinating people who have not yet been vaccinated is unlikely to have any substantial impact on the omicron wave because by the time these interventions are scaled up the omicron wave will be largely over.https://t.co/TKvOug9FGJ,en
2022-04-08 07:08:27+00:00,189071497462b3d343188d081d0c2b81f6a0a9088fd0093a0b041eb023d1c1ba,Decoding COVID-19 mRNA Vaccine Immunometabolism in Central Nervous System: human brain normal glial and glioma cells by Raman imaging https://t.co/MeeFDGZz1f,en
2022-04-08 07:07:54+00:00,b8bbb0cc72dd2b5fd9abe8dbc61ed49b,Appeals court upholds President Biden's federal employee COVID-19 vaccine mandate https://t.co/NgQIjKN1bV,en
2022-04-08 07:07:35+00:00,d626bdc3aa4766161b90c55df3846add,"US Life Expectancy Falls For 2nd Year In a Row: https://t.co/Rsjt4VcEuQ #slashdot Despite the availability of life-saving COVID-19 vaccines, so many people died in the second year of the pandemic in the U.S. that the nation's life expectancy dropped for a second year in a row l…",en
2022-04-08 07:07:28+00:00,886bed886e7092c3316a9882440ad56e7981f6bc1eecb1bf0c3cfca33d4b8360,Children aged 5 to 11 are now eligible for the COVID-19 vaccine. Parents and guardians can book appointments now. Visit https://t.co/gx67HDTxCG for more information or to book online. https://t.co/RjYZoQynL5,en
2022-04-08 07:05:45+00:00,1cac4c317fa2f2028d026b074dbf9c24,Who is eligible for a fourth COVID-19 vaccine dose across Canada https://t.co/lEpBBn803lhttps://t.co/lEpBBn803l,en
2022-04-08 07:03:45+00:00,0502b55e7afd6884b4c48ee08c285d39,"Visit our mobile vaccine van in Croydon today and tomorrow to get your 1st, 2nd or booster dose of the COVID-19 vaccine 🚐You can also come along and have a chat about the vaccine with our friendly staff 🙌 https://t.co/ZIgi1TO3vx",en
2022-04-08 07:02:29+00:00,4a148b3c867a13c60baed4d6f77fe324,"George Watts Jr., died at just 24 years old after receiving the Pfizer-BioNTech COVID-19 vaccine. https://t.co/gmYwVCGByc",en
2022-04-08 07:01:07+00:00,4f427a4dd67cba9791cf57128ad6eca2,Appeals court upholds President Biden's federal employee COVID-19 vaccine mandate https://t.co/7rtyGz5HXk,en
2022-04-08 07:00:57+00:00,3a54ab61b584d47183f5fa8061a2da37e690d641e8fd5a31d0e1dc3d59bc278f,"Hamilton residents may book fourth dose of COVID-19 vaccine starting Thursday | inTheHammer Hamilton residents may book fourth dose of COVID-19 vaccine starting Thursday | inTheHammer , more details : https://t.co/BpnqSlql8Z",en
2022-04-08 07:00:41+00:00,83d0f84654122ce35a5e243942b1206a,"Thank you to more than 250,000 Cheshire East residents who have had their first, second and booster vaccine doses against COVID-19. It's never too late to get your COVID-19 vaccines. Our vaccine van will be visiting East of Weston Skate Park in Macclesfield from 10am - 4pm today https://t.co/r17FroLPAj",en
2022-04-08 07:00:10+00:00,a6431fc64c1f27bec62f8ff00e9720d6,"🏠 Good news. Those who need it can now get a COVID-19 vaccine from the comfort of their own home. On completion of a quick questionnaire or by calling 0300 790 6856, someone will be in touch to arrange a convenient time to visit. Read more: https://t.co/0fiPDP0fVV https://t.co/pdKoKTV4HY",en
2022-04-08 07:00:09+00:00,bf7242abe7ead9d4a7383f36799549e6,Research shows some Texas Latinos have doubts about effectiveness of COVID-19 vaccines https://t.co/zmPsRxWzvr,en
2022-04-08 07:00:01+00:00,6455b814c34d7ce581da88737f2d4de8f0226e9ca871386b5984996815a7e36f,"All vaccines work against COVID-19 that’s why Vee and Jada got jabbed!We hope more are staying informed about the importance of following health guidelines and ending vaccine hesitancy so we can all go back to a healthier, safer environment sooner.  #MagpabakunaNa https://t.co/XafWmvUr56",en
2022-04-08 06:58:05+00:00,4f2de257c20970ccac24810278b6bbe6,"Kids' need for COVID-19 booster shot being studied, says vaccine panel head https://t.co/fG8SgbROBW via @gmanews @DrTonyLeachon",en
2022-04-08 06:56:56+00:00,e7b9f0154db4e99efe3359ddc0a330bd,"@Jessdinos @thebeast6285 @gazthegaygasman @FutureProofCx @ProfessorFerg10 ""Earlier this month, the U.S. recorded more COVID-19 hospitalizations than last year’s peak, before vaccines were widely available.""This is just one of the many things I could quote from this article that show jabs don't work. 70% of hospital staff that were vaxxed got covid.",en
2022-04-08 06:56:04+00:00,a2d0c6ec46974c6b04363ce9efb3e881,Those eligible should get 4th Covid-19 vaccine dose for protection against severe illness: Expertshttps://t.co/7Vko37gXD3,en
2022-04-08 06:55:52+00:00,05857a0a177d71c23a095e6167eddbf8,#AccountabilityNow!#Jabbed2Death!Pfizer documents: Pfizer hired ‘600 employees’ due to volume of Covid-19 vaccine adverse event reports https://t.co/ITzgWZ2Or1 via @pamelageller,en
2022-04-08 06:53:31+00:00,274ad4e082812777c05309fe0a388a8a,Those eligible should get 4th Covid-19 vaccine dose for protection against severe illness: Experts https://t.co/EoqHi2rvdE,en
2022-04-08 06:52:01+00:00,4350d105d0802893ba44c4fd50c018bc256e9555b6b8616e3630b99fc00abd99,"#coronavirusUS #COVID #COVIDIOTS Through deaths #lockdownextensions, raised #suicides #domesticviolence, #sexualabuse unemployment etc. #Covid_19 has caused havoc. #Hunger &amp; #riots R awaited. No drug no #vaccine STOP IT. Take advice https://t.co/Q9gFNSRYsp https://t.co/hMwlss70uz",en
2022-04-08 06:44:09+00:00,21b2bb765d45f86e73ce69a96415bdb48297af1613975f306d106ba5d81b3f5b,"A sum of 7.0 billion has been allocated for the purchase of COVID-19 vaccines and related expenditures, 4.1 billion shillings for Free Maternity Health, 5.2 billion  for the Managed Equipment Services, and 1.8 billion  to provide medical coverhttps://t.co/pTMmpnHrVW #SokoNews",en
2022-04-08 06:39:37+00:00,d5d83fea7c2f8d6b057c0444c4aa7b12,@Econgrad5143 You &amp; I take the vaccine because at our age we need protection from dying of Covid-19 if infected. The vaccine doesn’t protect your daughter from getting infected (and infecting you). https://t.co/CkZTmuYoHM,en
