date,userid,tweet,lang
2022-08-26 17:35:38+00:00,4780245109,COVID-19 vaccine boosters expanded to children aged five to 11 in Alberta. #COVID19 #Vaccine #Boosters #Alberta #LNN #YQL https://t.co/W5H0mJCa1x,en
2022-08-26 17:35:36+00:00,503888136,WATCH LIVE: Biden addresses nation on one-year anniversary of Covid-19 s... https://t.co/GBncMSq4Cv via @YouTube. He takes credit for vaccines,en
2022-08-26 17:35:23+00:00,1563217648179064832,🔊 @AndrejPlenkovic @MichealMartinTD @Xavier_Bettel @sanchezcastejon @jacindaardern Thanks for supporting #VaccineEquity through COVID-19. Will you join #GlobalCitizenFestival and pledge funds to the @WHO mRNA Tech Hub to empower developing regions to produce their own vaccines?,en
2022-08-26 17:35:19+00:00,455911035,#Moderna said it is suing #Pfizer and its German partner #BioNTech for patent infringement linked to the development of the first #Covid_19 #vaccines.https://t.co/2BNimcBnrt,en
2022-08-26 17:34:57+00:00,1354855405613150210,@rtenews @JohnBoweActor @drcole12 @MedCouncilIRL @HSELive @SkyNews @nurseforethics @Iobey10 @MRobertsQLD @SaraHaboubi1 @BBCNews @AndersonAfDMdEP @SenRonJohnson @SenatorKeogan https://t.co/awU6gb6TPX Cervical longitudinally extensive myelitis after vaccination with inactivated virus-based COVID-19 vaccine.,en
2022-08-26 17:34:54+00:00,1064102493662044160,"#Moderna  said Friday it is suing rival vaccine makers #Pfizer  and #BionTech , alleging the partners infringed on its patents in developing their Covid-19 shot administered to hundreds of millions around the world.@NewIndianXpress @santwana99 https://t.co/oIAiGIKd80",en
2022-08-26 17:34:43+00:00,1560911156235190273,Moderna sues Pfizer and BioNTech over patents behind COVID-19 vaccine https://t.co/BDaTRp1Br5,en
2022-08-26 17:33:42+00:00,1519003166901039104,Article States Moderna developed Covid-19 vaccine years before the pandemic. I don't think this is all coincidence so would Moderna like to explain why make a vaccine for a virus that hasn't happened and then it is full blown years later and they jump to the rescue???,en
2022-08-26 17:33:25+00:00,3142088601,“Pfizer/BioNTech has not yet fully reviewed the complaint but we are surprised by the litigation given the Pfizer &amp; BioNTech COVID-19 Vaccine was based on BioNTech’s proprietary mRNA technology &amp; developed by both Pfizer &amp; BioNTech” $PFE &amp; $BNTX said in a statement to GEN,en
2022-08-26 17:33:14+00:00,24735707,Moderna sues Pfizer over patents behind COVID-19 vaccine. https://t.co/dTAdjUDsVE,en
2022-08-26 17:33:12+00:00,28605294,Moderna sues Pfizer over patents behind COVID-19 vaccine. https://t.co/Tm2nuYYmtl,en
2022-08-26 17:33:04+00:00,58529506,"COVID-19 vaccine maker Moderna is suing Pfizer and the German drugmaker BioNTech, accusing its main competitors of copying Moderna’s technology in order to make their own vaccine. https://t.co/ydPPlEeY71",en
2022-08-26 17:32:28+00:00,1406967325455052807,Moderna sues rival COVID-19 vaccine makers Pfizer and BioNTech https://t.co/XWfQJ1evz8,en
2022-08-26 17:32:04+00:00,1517275120015867904,"Because official Government data coming out of both the USA and United Kingdom reveals there are now at least 254 million “vaccine refusniks” in both countries, with approximately 3 in every 5 people either refusing a first, second, or third dose of the Covid-19 vaccine.",en
2022-08-26 17:31:44+00:00,1430415676230017024,"@LadyBB85125431 @MonolithicPeak @ATimRonan @deanandersonnyc @StirredCrazy @ingridschaaf2 @irena_korosec @EppsFaker @Maxamegalon2000 @itsthetruth_ikr @Jackie82549146 @AngryFleas @ryNOdis @dorthy_fromoz @GaryMcVaxxed @KariLakeFan @FlatEarthCity @Jay333N @ClemSkelton @RStabb26 @Vaxxedtothemax9 @debradewonda @CNN @washingtonpost @nytimes @MSNBC @BarackObama @AP @dominionvoting No, the Pfizer covid-19 vaccine is fully approved by the FDA, it has been for a very long time. It is currently fully approved for anyone 12 and older. I know, I know, you keep coming back with more nonsense, but I am not buying.",en
2022-08-26 17:31:43+00:00,3170426002,Moderna sues rival COVID-19 vaccine makers Pfizer and BioNTech https://t.co/VeFGtDi82a,en
2022-08-26 17:31:36+00:00,1517275120015867904,Government data reveals 254 million “Vaccine Refuseniks” across USA &amp; UK as 3 in every 5 people refuse a single or further dose of the Covid-19 VaccineThe authorities will never admit it...,en
2022-08-26 17:31:36+00:00,2939497901,"COVID-19 vaccine: Why Moderna is suing Pfizer, BioNTech https://t.co/7hYHb8W5v7 https://t.co/UuXXgCXimW",en
2022-08-26 17:31:04+00:00,828282503156944897,Pfizer/BioNTech ‘surprised’ by Moderna lawsuit alleging they copied their COVID-19 vaccine technology | Fortune https://t.co/Dqp3fj9S7z,en
2022-08-26 17:31:04+00:00,1469837212816715787,"@AriGoldkind There are other disputes ongoing:""The National Institutes of Health (NIH) is currently embroiled in a dispute over the ownership of patent rights to Moderna’s flagship mRNA COVID-19 vaccine (mRNA-1273)."" https://t.co/BLHLOjGEm4",en
2022-08-26 17:30:50+00:00,1424099325223837701,@US_FDA See this is why you are losing people’s trust. The covid vaccines do not prevent covid 19. Literally look around you at people who have had 4 covid vaccines in 18 months and still got covid. Try being honest please.,en
2022-08-26 17:30:48+00:00,242696106,"Moderna is suing Pfizer and its German partner BioNTech for patent infringement in the development of the first COVID-19 vaccine approved in the United States, alleging they copied technology that Moderna developed years before the pandemic. https://t.co/wMZF8gDN9a",en
2022-08-26 17:30:29+00:00,91478624,"Moderna filed lawsuits against Pfizer and BioNTech, the company said Friday, alleging they copied Moderna’s “foundational” mRNA technology used for its Covid-19 vaccine to create their own coronavirus shots. https://t.co/DYR41BrNYj https://t.co/3BLY22zgHd",en
2022-08-26 17:30:10+00:00,1430415676230017024,"@LadyBB85125431 @ATimRonan @MonolithicPeak @deanandersonnyc @StirredCrazy @ingridschaaf2 @irena_korosec @EppsFaker @Maxamegalon2000 @itsthetruth_ikr @Jackie82549146 @AngryFleas @ryNOdis @dorthy_fromoz @GaryMcVaxxed @KariLakeFan @FlatEarthCity @Jay333N @ClemSkelton @RStabb26 @Vaxxedtothemax9 @debradewonda @CNN @washingtonpost @nytimes @MSNBC @BarackObama @AP @dominionvoting No court ruled that, as the FDA already said in the original full authorizaton document, Pfizer=Corminaty. Pray tell do you have a comprehension problem ? The launguage was pretty dam clear. Again, Pfizer has only one Covid-19 vaccine, and it received full authoritzation.",en
2022-08-26 17:30:04+00:00,18149465,"COVID-19 vaccine maker Moderna is suing Pfizer and the German drugmaker BioNTech, accusing its main competitors of copying Moderna’s technology in order to make their own vaccine.https://t.co/CxaQ5egSv7",en
2022-08-26 17:30:02+00:00,361168224,Novavax COVID-19 Vaccine Approved For 12 To 17s By MHRA #covid19https://t.co/HkbFm5nJIv,en
2022-08-26 17:30:01+00:00,1519003166901039104,"Moderna suing Pfizer, BioNTech for patent infringement in development of COVID-19 vaccine | CBC News https://t.co/nGTHHcVa3P",en
2022-08-26 17:30:00+00:00,17288391,Moderna sues Pfizer over patents behind COVID-19 vaccinehttps://t.co/cJBZIWQM31,en
2022-08-26 17:30:00+00:00,22486849,"Drug-maker #Moderna is launching legal action against two rival companies, allegeding patent infringement around development of COVID-19 vaccines - https://t.co/GLENVHOqFe",en
2022-08-26 17:30:00+00:00,334944709,"Moderna sued Pfizer and BioNTech for patent infringement in the development of the first COVID-19 vaccine in the U.S. Moderna alleges Pfizer/BioNTech, without permission, copied mRNA technology that Moderna had patented between 2010 and 2016https://t.co/tkmthxgmC8 https://t.co/qav6fsw8I6",en
2022-08-26 17:30:00+00:00,1260105611565359105,"More than 211 crore 13 lakh COVID-19 vaccine doses have been administered in the country under Nationwide Vaccination Drive so far. The Health Ministry said, more than 31 lakh vaccine doses were administered in the last 24 hours. https://t.co/vCfDZShrl6",en
2022-08-26 17:28:47+00:00,1099192257171795969,Moderna sues rival COVID-19 vaccine makers Pfizer and BioNTech | Coronavirus pandemic News https://t.co/OrzkIArPjY,en
2022-08-26 17:28:34+00:00,1346521804928475136,@sarahzhang @TheAtlantic No one knows where the Covid-19 virus actually came from either. Or what the long term safety data will be for Covid-19 vaccines. I guess there’s a lot we don’t know. What’s your point?,en
2022-08-26 17:28:05+00:00,18242287,@Debunk_the_Funk Problems reading?“The main finding of the present study was the marked decline in protection against severe COVID-19 during Omicron BA.2 dominance among persons with two vaccine doses only”,en
2022-08-26 17:27:43+00:00,1035181520695250945,"Thank God I did not get the vaccinesI read the book BEHOLD A PALE HORSE  during the covid 19 stay at home That book predicted the vaccines shit, especially for we Africans. Time will still tell",en
2022-08-26 17:27:26+00:00,1110569229923901442,"@BronzeTalos @TamiBone @TravIsScience @Treeps3 @SwaledaleMutton @Puppieskitts @judysimpson222 @StevenWilson777 @Anymous84861064 @BreezerGalway @HeyNurseKat @The_Ouroboros__ @DiamondJimLowe @AdamYoung329 @appyman @BRIANARNOPP @AmaryllisPot @Rolo_Tamasi @johnsgunn @JordanB4815 @SoiferErica @NYTruthBot @Fornowago @dr_colemami @OldMackIsBack @ScepticalAussie @SSZ1967 @cjsnowdon @ZubyMusic @JoshJPhilipp @JanJekielek @EpochTimes I read that IVM was used to combat viruses, Covid-19 is a disease.The Covid vaccines are no more than 1% effective.The data clearly shows that.",en
2022-08-26 17:27:20+00:00,21134460,Moderna Files Lawsuit Against Pfizer and BioNTech Over COVID-19 Vaccines https://t.co/sc0Ns9iW6b,en
2022-08-26 17:26:43+00:00,1558947325,"Finally, One Honest Doctor Comes Forward to Report the Death and Devastating Injuries Linked to the COVID-19 Vaccinehttps://t.co/ykKwO3XMwd",en
2022-08-26 17:26:17+00:00,1215676546637164544,"https://t.co/JVNJh33Dgh enrollment closes this SUNDAY at 11:59 PM - please see flyer to enroll if you want to learn more about  COVID-19 vaccines and children, and live in LA county. $40 gift card! more info here:https://t.co/zrlXU3Ca9h",en
2022-08-26 17:26:16+00:00,1194333844016644097,TUCKER CARLSON: Democrats are trying to shift blame about the COVID-19 vaccine to Trump https://t.co/jIl9gzhKsI #FoxNews,en
2022-08-26 17:25:20+00:00,1511444670999638028,"Moderna Sues Rival COVID-19 Vaccine Makers Pfizer, Biotech Coronavirus Pandemic News https://t.co/hM0sxOWhk2",en
2022-08-26 17:24:56+00:00,954409474369966080,Moderna sues Pfizer and BioNTech over patents behind COVID-19 vaccine https://t.co/k2QYCTulXZ,en
2022-08-26 17:24:54+00:00,94579740,"Moderna sues Pfizer, BioNTech over patent infringement of its COVID-19 vaccine Biotechnology major Moderna on Friday su...https://t.co/PHXxJO6Gtb #CANINDIANEWS #COVID19VACCINE #MODERNA #PATENTINFRINGEMENT #PFIZERhttps://t.co/fZVEI9aS99",en
2022-08-26 17:24:35+00:00,1528785734920175616,Moderna sues rival COVID-19 vaccine makers Pfizer and BioNTech https://t.co/GLxel2VM7e,en
2022-08-26 17:24:12+00:00,1510501135689216003,Moderna sues rival COVID-19 vaccine makers Pfizer and BioNTech https://t.co/EWCUsjqWMM,en
2022-08-26 17:24:09+00:00,25589776,Moderna Files Lawsuit Against Pfizer and BioNTech Over COVID-19 Vaccines  https://t.co/I586rgXq1p,en
2022-08-26 17:24:03+00:00,1439135114596950016,"@BillyM2k Can t agree more.  Inflation around 15.5%, in my country  everything is expensive asf. Covid 19 is still active. Goverment told us we need  fourth dose of vaccine. We still need to have mask when we are in medical facilities. And i can count endlessly why this year suck.",en
2022-08-26 17:23:52+00:00,1558174037267910656,Moderna sues rival COVID-19 vaccine makers Pfizer and BioNTech | Coronavirus pandemic News https://t.co/IrNNqwTBn1,en
2022-08-26 17:23:24+00:00,3067444950,Moderna suing Pfizer over patent for ‘foundational’ COVID-19 mRNA vaccine - National | https://t.co/9Z5ONUTlLp https://t.co/xFIs0y70Rx Interesting!  Lawsuit?  @VoiceOfFranky @MerlinofCanada @intouchwit,en
2022-08-26 17:22:39+00:00,1112054210110070788,"Government data reveals 254 million ""Vaccine Refuseniks"" across USA &amp; UK as 3 in every 5 people refuse a single or further dose of the Covid-19 Vaccine https://t.co/TVtd5VblvB",en
2022-08-26 17:22:31+00:00,748308902,"@TheRickyDavila Don’t forget $500,000,000 to KODAK Film 🎞 company for Covid-19 vaccine which they never produced https://t.co/IPtTHHLFkP",en
2022-08-26 17:22:09+00:00,1268648928,Moderna Sues Pfizer Over COVID-19 Vaccine Technology | Health News https://t.co/UxIoLtmxto,en
2022-08-26 17:21:52+00:00,3297076870,"Our next covid-19 vaccine clinic is Tuesday 30th, walk-in clinic from 2pm to 3pm. Wednesday 31st walk-in clinic from 10am to 1pm and 2pm to 3pm. https://t.co/2rWMY9F0IV",en
2022-08-26 17:21:23+00:00,191301808,@JammerX19 @AdamKinzinger Pfizer is on record for stating the COVID 19 experimental vax does not protect against getting the virus or transmitting it. They also released multiple pages of vaccine adverse events that continue to mount up.  It should never be forced under these circumstances.,en
2022-08-26 17:21:18+00:00,1415562093839872003,"Moderna sues Pfizer, BioNTech for Covid-19 vaccine patent infringement- The New Indian Express https://t.co/68bo9zBLw8",en
2022-08-26 17:20:54+00:00,1514711347329654789,@DizzyRetro @ake2306 Please support + share the following Petition Alex Hicks created:Remove indemnity from the manufacturers of covid-19 vaccines:https://t.co/HsE9eSHb4k,en
2022-08-26 17:20:34+00:00,1354498558263701510,"@basiukiewiczpaw COVID-19 Vaccines and Informed ConsentBy John Allison, J.D.Updated July 18, 2022 https://t.co/37nD74P5MH",en
2022-08-26 17:20:09+00:00,1521847011716349955,@drmikehart @lincolnmjay @WesternU Hi @WesternU I’m vaccinated! How do you prove if I’m lying 🤥?  Many people have gotten fake documents and had the vaccine 💉 put in the sink instead of their arm.  Why don’t you mandate Antibodies tests for Covid-19 instead of not knowing who’s a danger to others? @drmikehart,en
2022-08-26 17:20:05+00:00,1380691106623447043,Moderna sues rival COVID-19 vaccine makers Pfizer and BioNTech | Coronavirus pandemic News https://t.co/oEYxfA3usH,en
2022-08-26 17:20:00+00:00,16568530,"COVID-19 vaccine maker Moderna is suing Pfizer and the German drugmaker BioNTech, accusing its main competitors of copying Moderna’s technology in order to make their own vaccine. https://t.co/4kasaOC1fP",en
2022-08-26 17:19:33+00:00,119973528,"Moderna sues Pfizer, BioNTech for COVID-19 vaccine patent infringement - Medical Xpress https://t.co/1YY4oTT4jo",en
2022-08-26 17:19:20+00:00,58498428,"COVID-19 vaccine maker Moderna is suing Pfizer and the German drugmaker BioNTech, accusing its main competitors of copying Moderna’s technology in order to make their own vaccine. https://t.co/hKDBVNbXAr",en
2022-08-26 17:19:12+00:00,620136960,"Moderna sued Pfizer and its German partner BioNTech on Friday for patent infringement in the development of the first COVID-19 vaccine approved in the United States, alleging they copied technology that Moderna developed years before the pandemic.#Moderna #Covid19 #Pfizer",en
2022-08-26 17:19:01+00:00,436624610,@citizentvkenya COVID-19 vaccine was all business,en
2022-08-26 17:18:28+00:00,185115193,Moderna sues rival COVID-19 vaccine makers Pfizer and BioNTech https://t.co/s295UbTcHn,en
2022-08-26 17:17:33+00:00,2928016519,"Top story: @9NewsAUS: 'COVID-19 vaccine maker Moderna is suing Pfizer and the German drugmaker BioNTech, accusing its main competitors of copying Moderna's technology in order to make their own vaccine.The company fil… https://t.co/y8DJD9lkFr, see more https://t.co/rL4pq4qBWZ",en
2022-08-26 17:17:22+00:00,2408856282,"@47_irish @GBNEWS @mattletiss7 ”A study of 301 teens in Thailand found mild and temporary heart rhythm changes after a second dose of the Pfizer-BioNTech COVID-19 vaccine among one in six teenagers,”.  - Reuters",en
2022-08-26 17:17:12+00:00,709947536,"Moderna sues Pfizer and BioNTech for using mRNA technology in their COVID-19 vaccine-- News, Social Impact | The Perfect Enemy: https://t.co/irgLFPwJAb.#Coronavirus #Vaccines https://t.co/qynrtOgPyo",en
2022-08-26 17:17:11+00:00,37716311,"Moderna sues Pfizer and BioNTech for using mRNA technology in their COVID-19 vaccine-- News, Social Impact | The Perfect Enemy: https://t.co/Qm8qq4tXzY.#Coronavirus #Vaccines https://t.co/ogLdLFUeq0",en
2022-08-26 17:17:10+00:00,1360317220665122819,"Heterologous third and fourth dose vaccine to reduce severity and mortality in COVID-19 patients during delta and omicron predominance: A cohort study in Chiang Mai, Thailand #covid https://t.co/kO8yjPUNHQ",en
2022-08-26 17:16:29+00:00,1206962017678110721,Moderna Is Suing Pfizer Over the mRNA Covid-19 Vaccines https://t.co/xLmCP9Xrb9,en
2022-08-26 17:15:36+00:00,14921083,Moderna is accusing Pfizer and its partner BioNTech of copying the core technology behind the companies' Covid-19 vaccines.  https://t.co/EvOoCptn2i,en
2022-08-26 17:14:40+00:00,1181226628581642240,@NYCMayor @amazon Im on vacation but have to go back to NYC to take a stupid weekly COVID test because I’m not boosted. Please end all COVID 19 vaccine mandates! This is getting ridiculous!,en
2022-08-26 17:14:32+00:00,2190212877,🔊 @AndrejPlenkovic @MichealMartinTD @Xavier_Bettel @sanchezcastejon @jacindaardern Thanks for supporting #VaccineEquity through COVID-19. Will you join #GlobalCitizenFestival and pledge funds to the @WHO mRNA Tech Hub to empower developing regions to produce their own vaccines?,en
2022-08-26 17:14:22+00:00,1101479600478130177,"2) There are two main reasons for taking the vaccine:1. Protecting ourselves.2. Protecting those around us.Without vaccinations, we will always be at risk of contracting Covid-19 infection",en
2022-08-26 17:14:10+00:00,761239282543693826,🔊 @AndrejPlenkovic @MichealMartinTD @Xavier_Bettel @sanchezcastejon @jacindaardern Thanks for supporting #VaccineEquity through COVID-19. Will you join #GlobalCitizenFestival and pledge funds to the @WHO mRNA Tech Hub to empower developing regions to produce their own vaccines?,en
2022-08-26 17:14:08+00:00,1240464380,@NateSilver538 So you’re ignoring the whole “pressured the fda to authorize unproven treatments for Covid-19” part.Or this part? “…White House attempts to block the FDA from collecting additional safety data on Covid-19 vaccines in order to get them to the public before the 2020…election.”😐,en
2022-08-26 17:14:00+00:00,24143255,"Moderna sued Pfizer and its German partner BioNTech for patent infringement in the development of the first COVID-19 vaccine approved in the United States, alleging they copied technology that Moderna developed years before the pandemic. https://t.co/49mP88HHxp",en
2022-08-26 17:13:15+00:00,1101479600478130177,COVID-19 Vaccine ..🦠 https://t.co/NCI6zBgIcN,en
2022-08-26 17:13:03+00:00,1514711347329654789,@michellespj @Judawakes @pfizer Please support + share the following Petition Alex Hicks created:Remove indemnity from the manufacturers of covid-19 vaccines:https://t.co/HsE9eSHb4k,en
2022-08-26 17:12:26+00:00,344075523,Military whistleblower report alleges COVID-19 vaccine illegally administered   https://t.co/wxIEWrwkwA    #Whistleblower #News,en
2022-08-26 17:12:02+00:00,59545968,"Don't be a sitting duck. If you are eligible for a booster dose of the COVID-19 vaccine, make an appointment to protect yourself from very contagious variants. Don't delay, plan to get boosted today! https://t.co/nXaANxX76R",en
2022-08-26 17:12:01+00:00,19347202,"Following the FDA’s recent authorization, CDC recommends the use of Novavax’s COVID-19 vaccine for adolescents aged 12 through 17. https://t.co/RjdiS3jfD2 https://t.co/O0EKpDHjnP",en
2022-08-26 17:11:37+00:00,3161549442,"Galveston County’s COVID-19 community level is MEDIUM.   •Stay up to date with COVID-19 vaccines.  •Get tested if you have symptoms.  •If you are at high risk for severe illness, talk to your healthcare provider about whether you need to wear a mask.*",en
2022-08-26 17:11:00+00:00,1270698246122409984,1⃣ day left to register! Can't wait to greet our Fairmount neighbors for tomorrow's COVID-19 vaccine and booster clinic. @RepDonnaBullock and I are bringing resources and refreshments for a happy and healthy start to the school year. Sign up here: https://t.co/tSIIJGvq5J,en
2022-08-26 17:10:06+00:00,1239295702725001216,"Though the #UnitedStates accounts for only about 4 percent of the global #population, it leads the world in COVID-19 cases and deaths, and among high-income countries is behind only #Russia in vaccine opposition.#FFS",en
2022-08-26 17:10:04+00:00,177891462,Why we should be cautious when interpreting studies measuring effectiveness of COVID-19 vaccines: https://t.co/qJkGf61T8L #COVID https://t.co/6IJeg4COYW,en
2022-08-26 17:10:02+00:00,17029248,"Kizzmekia Corbett, an African American woman, is praised as key scientist behind COVID-19 vaccine - ABC News via @ABC - https://t.co/LGP5hZXG4V",en
2022-08-26 17:09:33+00:00,483246871,@dbongino Miles Guo (Miles Kwok @miles in Gettr) warned the world in late 2020 that the Covid-19 vaccine is the true biological weapon to kill more people,en
2022-08-26 17:09:08+00:00,1518206158481330176,Moderna files patent infringement lawsuits against Pfizer and BioNTech over mRNA Covid-19 vaccines https://t.co/UPtFUpZffh,en
2022-08-26 17:09:01+00:00,56809821,"COVID-19 vaccine maker Moderna is suing Pfizer and the German drugmaker BioNTech, accusing its main competitors of copying Moderna’s technology in order to make their own vaccine. https://t.co/ghRXqZtnSl",en
2022-08-26 17:07:34+00:00,1279916310,"@Felipe_J_H @DjokerNole Over 1000 Scientific Studies Prove That the COVID-19 Vaccines Are Dangerous, and All Those Pushing This Agenda Are Committing the Indictable Crime of Gross Misconduct in Public Office.  Links here: https://t.co/AM025gk7Gx",en
2022-08-26 17:07:26+00:00,17220739,Moderna sues Pfizer over COVID-19 vaccine patent https://t.co/h76MG8pplE,en
2022-08-26 17:07:20+00:00,1127264833622220801,No evidence rise in deaths due to unknown causes in Canada is linked to Covid-19 vaccines - Full Fact https://t.co/xZAEOH1J8U,en
2022-08-26 17:07:17+00:00,253688871,The #GOVAXX buses and mobile indoor COVID-19 vaccine clinics are on the move.  Those aged 5+ in need of a #COVID19 vaccine can book an appointment or hop on the bus. Mobile indoor vaccine clinics are walk-in only. Find a bus or clinic near you: https://t.co/MB1MrsltQ7 https://t.co/rJEGXoeT8j,en
2022-08-26 17:07:04+00:00,1187525866697482247,Moderna Files Patent Infringement Lawsuits Against Pfizer and BioNTech Over Covid-19 mRNA Vaccines https://t.co/XTmpMNkGxY,en
2022-08-26 17:06:59+00:00,1276309263405789185,Pfizer/BioNTech ‘surprised’ by Moderna lawsuit alleging they copied COVID-19 vaccine technology https://t.co/2FkqkWhFsQ,en
2022-08-26 17:06:46+00:00,2549119543,"USArmy: Soldiers now have additional COVID-19 vaccine options: ➡️ https://t.co/Yr7Cws3w6x“With the availability of the NOVAVAX vaccine, we are pleased to have another tool to help combat the spread of COVID-19,” said @LTGDingle, #USArmy Surgeon General.",en
2022-08-26 17:06:39+00:00,1273044471337361413,Pfizer/BioNTech ‘surprised’ by Moderna lawsuit alleging they copied COVID-19 vaccine technology https://t.co/7Yae1wnjue,en
2022-08-26 17:06:26+00:00,1234879375734181888,"@BBCWorld If COVID-19 is anywhere, it is potentially everywhere.COVID-19 vaccines will save many lives.Mask wearing is also a good idea.",en
2022-08-26 17:06:22+00:00,1439405246518906881,"A mandated COVID-19 vaccine &amp; neg test to enter school, but neither required for influenza? Rationale?@I_Am_JohnCullen https://t.co/8QoOcSWr6e",en
2022-08-26 17:06:00+00:00,1514711347329654789,@Judawakes Alex Hicks created the following Petition:Remove indemnity from the manufacturers of covid-19 vaccines:https://t.co/HsE9eSp1Qc,en
2022-08-26 17:05:59+00:00,1558104802302763008,🔊 @AndrejPlenkovic @MichealMartinTD @Xavier_Bettel @sanchezcastejon @jacindaardern Thanks for supporting #VaccineEquity through COVID-19. Will you join #GlobalCitizenFestival and pledge funds to the @WHO mRNA Tech Hub to empower developing regions to produce their own vaccines?,en
2022-08-26 17:05:46+00:00,804101305,"@Dominiquetaegon What sacrifice is he making? He just needs to get vaccinated,   COVID-19 has not gone away vaccines are the answer!",en
2022-08-26 17:05:35+00:00,114848825,More news from the inbox: Bookings for COVID-19 boosters for kids aged 5-11 will open on Aug. 29 and doses will start being given on Aug. 31. It comes after Health Canada authorized the booster dose of Pfizer-BioNTech vaccine last week. https://t.co/qjW15pDfVC #ableg #abhealth https://t.co/j8wLWxX6wh,en
2022-08-26 17:05:09+00:00,1476993928997998592,PNBN News: Moderna sues Pfizer and BioNTech for infringing on mRNA vaccine patents used in blockbuster Covid shots: Following its announcement in March that it would begin enforcing its Covid-19 vaccine ... #biotech #news https://t.co/RJJan292wo,en
2022-08-26 17:04:14+00:00,1331116530000564224,Moderna Sues Pfizer Over COVID-19 Vaccine Patents https://t.co/TOxyHPTsal,en
2022-08-26 17:04:12+00:00,314208281,"Boosters expand to kids aged 5-11. Albertans can soon start booking COVID-19 vaccine boosters for children aged five to 11, based on recommendations from the National Advisory Committee on Immunization and the Alberta Advisory Committee on Immunization: https://t.co/DmXXOLc8z1",en
2022-08-26 17:04:06+00:00,3034814919,Moderna is suing Pfizer and BioNTech over their COVID-19 vaccine. Here's why an analyst says they're signaling the 'end of the COVID-19 pandemic.' https://t.co/5LMa6MzKnl,en
