date,userid,tweet,lang
2022-10-29 13:44:03+00:00,44aa3e1cf5514167195b7abc8c90cc03f010962a60bbbe11cc33d3cd7709d25f,Freedom Test #3The covid vaccine is experimental and is barely effective. At first there was hope it would work but by June of 2020 we knew that despite variants due to natural immunity Covid-19 was becoming nothing more than a bad cold for over 99% of the population.,en
2022-10-29 13:43:34+00:00,13c2a42548bcb589db5cb22a51511c6d5778c5810f57aec468d8e50711f967f6,California coronavirus updates: CDC will add COVID-19 vaccine to childhood vaccination recommendations https://t.co/jIDohyEWHU,en
2022-10-29 13:42:34+00:00,13c2a42548bcb589db5cb22a51511c6d5778c5810f57aec468d8e50711f967f6,New vaccine approach can help jumpstart immune response to COVID-19 https://t.co/zddR8Ldjc1,en
2022-10-29 13:40:28+00:00,7f3217c97a894393cc6ba607d5e114ecd21061e1756018b38e101fd959566190,"@jimmyfailla Actually…I believe, the pushing of the vaccine, spread Covid 19 more!!!!",en
2022-10-29 13:40:21+00:00,699695aabb3465f76493a33d07c00bd26f9adb7e2f20c44c9a9f890951e3fc3d,"@OohCrystal @fejimanz @Stillurfvseason Great point. If you had Covid 19 prior to vaccines and now have natural immunity, should you be mandated? Should you even be told you still need the vaccine, given the fact that natural immunity is stronger immunity?",en
2022-10-29 13:40:02+00:00,e2f83e783b66fbd0aa9b07ede6fee047f010962a60bbbe11cc33d3cd7709d25f,@HegKong Check out https://t.co/A9GG7q6P8q Type in Covid-19. It doesn't break down the info by each vaccine but the total possible side effects reported are in the millions.Here's a recent screenshot of the overall number. https://t.co/kaNwnB0T0N,en
2022-10-29 13:39:05+00:00,8dbc74d630a4e8adc29765d8ff4966c6,"Testing freespeech, Covid-19 vaccines doesn't work.",en
2022-10-29 13:39:03+00:00,5a182302913b2b451336e2a8409709ea,"@amyklobuchar Forcing every man, woman and child to take their unnecessary and dangerous Covid-19 vaccines and boosters really stuck it to big pharma. You sure showed them. Thanks as always for having our back lol. Never voting blue ever again!",en
2022-10-29 13:38:08+00:00,dc10150ef5d23e28be6e773c3ba17a008043f1f82cb0c60fa3ba3a38724b848d,Doctor Urges Global Pause of COVID-19 Vaccine. A doctor used to promote the vaccines until his father suffered SCA after getting vaccinated that led him to research information that revealed Pfizer and Moderna vaccines may have more risks than benefits.https://t.co/ksHoY0lBas https://t.co/vnzrEkBluQ,en
2022-10-29 13:37:34+00:00,62bfeb08dfaf8900e78252f3924c2a951fd21d868516be71dc36a1af427d6046,"""The estimated vaccine efficacy against Covid-19 was 36.8% among 2-to-5-year-olds and 50.6% (95% CI, 21.4 to 68.6) among 6-to-23-month-olds at a time when B.1.1.529 (omicron) was the predominant circulating variant.""Didn't they need to pass some threshold for the EUA approval?",en
2022-10-29 13:35:18+00:00,6065cbd4fe79f5809bf49711368850fa86c152b00c6c1b444957244e9a07c1c1,"regarding the way the contracts were signed by her  between the EU &amp; the producers of Covid vaccines.Court of Auditors found that to Nov. 2021, 71Billion € were signed on behalf of the member states without their knowledge to purchase up to 4.6 BILLION € of COVID 19 vaccines.",en
2022-10-29 13:34:11+00:00,c384075762d09a017e3ee06495c1c2b0,FDA urged to publish follow-up studies on covid-19 vaccine safety signals | The BMJ https://t.co/bDhwn1Xfcp,en
2022-10-29 13:32:56+00:00,ae0801eacdf4d01b26105ce8724fdd7659089353dc5259318694bdc3f025c91f,"Opinion | For Philly, it’s time to get the COVID-19 vaccine, ‘I cried with joy’.by Daniel Pearson",en
2022-10-29 13:31:25+00:00,e476823f3869226e092a6e6809f51007c5b1f8449c7dc51cb6d46912a8a5c008,The effectiveness of BNT162b2 COVID-19 vaccine … https://t.co/Q09fgaaS3m,en
2022-10-29 13:31:01+00:00,7e322b5636b5cc0b4379fa565c84c8eeb140232ccaa89206273fbafc6e9889e6,"@ScottAdamsSays Am a Nurse Practitioner and volunteer for my county health dept. COVID-19 vaccination clinics.  Constantly monitor for reports of COVID-19 vaccine related injuries. No deaths, no substantiated claims of injury. Reports of such are vastly overstated, IMHPO",en
2022-10-29 13:30:19+00:00,2ba927d12eeaeaacd7ff1dbc7b7078e1,"Leave your mark on a structural beam that will be part of our new facility! Attendees will have access to free flu shots (adults only), COVID-19 vaccines, health screenings, career opportunities and more! Join us Nov. 1 from 3 – 6 p.m. at Avondale Meadows YMCA, 3908 Meadows Dr. https://t.co/Q3WRlnms4F",en
2022-10-29 13:30:14+00:00,515ac48ef5e003e91c2a0f2fe809a6f2b8d21c90a316b29ae741237b75b0b840,@saylor @elonmusk Like the truth about the Covid-19 vaccine being a soft kill bio weapon,en
2022-10-29 13:29:30+00:00,e9df3fe203ec04b263db2c62c81a59bade73ef3bddfa536e5002d6c185e4d25b,"Doctor, the fact that those age groups are low risk with COVID-19, by ""boosting"" them against something they do not need to be boosted for, you are increasing the heart risks that come with covid, since vaccines do not stop transmission, and they add to the cardíac risks. 🤯🤷",en
2022-10-29 13:28:45+00:00,970e7de52e6ca3bdb5504d4e286b70a4964ac3ce1b4a7f083bb03c993d0b8870,U.S. Urges All WTO Members To Support Intellectual Property Waiver For COVID-19 VaccinesThe White House on Thursday called on all World Trade Organization members to support an intellect ..https://t.co/05V0mze7hQ,en
2022-10-29 13:28:09+00:00,aae90e89688fa1e9c53c6a4a66b8969a,Possible consequence of COVID-19 vaccine. If there is a good temporal Association might be worth further investigation yellow card?,en
2022-10-29 13:27:23+00:00,b1e2730defa6c3f86a7bb6e50fe522dc,@ThierryBreton @DigitalEU I keep seeing government sites promoting the Covid-19 vaccine saying it prevents the virus from spreading.We now know that you have known this information since December 2020.Will you shut down / sanction sites that make or have misinformed?,en
2022-10-29 13:27:10+00:00,ee7a0da33ba3e825593570f308c41f2acb8cfa55c0ef24869677a7b5d213677f,"""430. Will a Covid-19 Vaccine Change the Future of Medical Research?"" by Freakonomics Radio https://t.co/dupvvZb3pH #economics #podcastSee more posts at https://t.co/lo9TyPHhtw",en
2022-10-29 13:25:24+00:00,ce58aa082198fe986fc4326c79a082b8ed53a45e9142105dc61a70c4e1e0d72f,"""...four types of serious adverse events in elderly people who had had Pfizer’s covid-19 vaccine"".No-one should have been given this poison.https://t.co/rgEjYunJQy",en
2022-10-29 13:23:50+00:00,0e365886b80630022db627f486486137,@Timcast Sudden Adult Death Syndrome deaths are covering up a genocide caused by the Covid-19 vaccineshttps://t.co/Qp1mIfZgFC,en
2022-10-29 13:23:13+00:00,e1254f160c530c77135e9c55f1d23808,@julredman My personal response to lawyer Lisa Bildy's defense of Kulvinder Kaur Gill's HPARB review includes links to numerous articles that destroy her claims about COVID-19 vaccines &amp; lockdown efforts. Dr. Gill has never retracted her dubious claims. https://t.co/WTP4Ll3tJZ,en
2022-10-29 13:23:01+00:00,8638525c384d5499cd34acc57739a560,"@Afterhours_Live @SurfsBri Here are same exact words in EMA's documents concerning Pfizer Comirnaty Original, booster and Bivalent(BNT162b2 + BNT162b2 BA.1 + BNT162b2 BA.4-5)""Comirnaty is a vaccine for _active immunisation to prevent_ COVID-19 caused by SARS-CoV-2 virus""pics: page 15page 18page 141 https://t.co/J0ccP2aB6i",en
2022-10-29 13:22:18+00:00,fe315694b5d0de9e91d2533d9b547b3ab88f1933c24078871a80420844cd4a86,"@_katiehopkins_ Vaccine, Injured, Bereaved UK - is formed of 95 individuals and families who have either been severely injured or bereaved as a direct result of receiving a Covid-19 vaccine in the UK. https://t.co/VmjZL9ZffN",en
2022-10-29 13:21:09+00:00,74fb475312dd88560061c075958b0f1a4c91d24de7df4faa0f3ece466d954687,"@LouDobbs Lack of trust in the CDC, coercion, and government mandates for Covid 19 vaccines has a huge impact on this.",en
2022-10-29 13:21:03+00:00,f05b1d618d000bf338ab43158a8177f544bf9a805a82bc803e7fa147de2ce57f,News flash… The FDA has refused a Freedom of Information Act (FOIA) request to release the autopsy results of people whose deaths were reported to the Vaccine Adverse Event Reporting System (VAERS) after receiving a COVID-19 shot.,en
2022-10-29 13:20:39+00:00,5706c85b6338d7dbcac2e47560f774f0e47522bd5b0413b254edb8aef6fed064,"This info is not new as the misleading posts allege; it has been publicly reported by the company, health agencies &amp; multiple news media since De 2020. Pfizer's clinical trials were designed to measure its vaccine's effectiveness in preventing severe Covid 19",en
2022-10-29 13:20:38+00:00,5706c85b6338d7dbcac2e47560f774f0e47522bd5b0413b254edb8aef6fed064,"A viral claim that a Pfizer executive supposedly ""admitted to the European Parliament"" in October 2022 that the company's Covid-19 vaccine has not been tested on preventing coronavirus transmission omits important details about clinical trials for the jab. https://t.co/rVry6LV7ww",en
2022-10-29 13:20:35+00:00,7218ab259ad6898b5291ad5e99c51871356d992df00db4b891b931fee78ecabf,The clinical trial of the covid-19 vaccines lasted only 3 months. The raw data from the trials were not made public to allow other scientists to analyse them . The studies were industry funded and were not replicated by independent scientists.,en
2022-10-29 13:20:09+00:00,6213456c748d44b322b45e50dd229d75573c30fcc0fd979f19cff310fbfcd784,"Louise had her COVID-19 vaccines while pregnant to protect herself and her baby.  Pregnant women are eligible for the free flu vaccine and Covid autumn booster.  Speak to your midwife, GP practice or local pharmacy. https://t.co/8A3u4kcnun",en
2022-10-29 13:19:10+00:00,32520de036c84961cb9ac41c8f66313d35c40c5ad3cc6db2bd85875a7570e3f0,"@MillerKyle98 Hello, Mr.Kyle. 😊 How're you doing? I hope you're doing good.  May I have a question? If possible,I'll be glad to have the answer.Do many Americans believe in the vaccine effectiveness against the covid-19? Japan has the both good and both now.",en
2022-10-29 13:17:04+00:00,7406a3f35d225321c09d09135cecaf3c4504f42dc8f1e7f5079cd46c5784a9d5,@theShakinroom @DrMohammadIAdi1 @TheGr3atReset @Heatherjaney1 @sophiadahl1 He's been suspended. He cannot earn money from being a doctor therefore has to find other ways to earn money.Lying about covid-19 vaccines can be very lucrative.https://t.co/RRMiRW8ksh,en
2022-10-29 13:17:01+00:00,b7abb951014707454834af9a42c3135984ebe7de760d8cd19d0992d1e8bb001e,"We're BACK Montezuma by popular demand! Join us for a community cookout — get those COVID-19 boosters and vaccines along with all of the nonpartisan voting info you need before you vote this weekend.NOW❗️Sat, Oct 29 • 9am - 1pmRegister for location👉🏾https://t.co/yoZ4JElQ8a https://t.co/MUDeD6Q4Fo",en
2022-10-29 13:15:10+00:00,5d0254dadf2faafe881be806ca731b83,"lawmakers question Boston University on research creating new COVID-19 strain. IMO as physician and vaccine expert, this gain of function experiment was ill-advised, contrary to public health, dangerous. Where was IRB and university oversight? @pocket https://t.co/cQnqypkGql",en
2022-10-29 13:15:05+00:00,37bbfa94c7befb884be3aa26075ae9622659d899a110c8b911b7df9a57aeebf9,"@AndGoliath76 @foodsuriel @jyturriago @dbongino How do you contain a virus? COVID-19… Another form of the flu. I’m proud to say I have had it and overcame with NO VACCINE SHOT, and I’m completely immune to it! What about the greatest economy in the history of America? Trump! Energy independence!",en
2022-10-29 13:12:37+00:00,d9e6a919204c0ea3bec41c5afb72cde6410e577447ec350790eae9001265aadf,@GovKathyHochul New York lawmakers ready to revive push to mandate COVID-19 vaccine in schoolshttps://t.co/poizQryMiZ,en
2022-10-29 13:12:33+00:00,149f7c733f04d41229403b7b5da55f37970749ed408c47f6bd33f5883de02702,COVID-19 Vaccine*,en
2022-10-29 13:11:38+00:00,83c1c62a503ec6c554333c50241963afea8503907c3ce87eec1374f98fbeae00,"4/4 ✅Help the NHS this winter, get yer jag!If you are 16 and over and either an unpaid carer, or live with someone who has a weakened immune system. You can book your appointment for your 4th Covid-19 vaccine! https://t.co/PxloHIp4fe https://t.co/z8Tg4h1uKq",en
2022-10-29 13:09:48+00:00,679709ba387faa688868af9d7023ff8b,The Writing Solution : COVID-19 Vaccines &amp; Women's Health: (Part 3) Has y... https://t.co/rN4Cu3Xb5P,en
2022-10-29 13:09:11+00:00,cabb428b5f2f2ec4911299a66bc879d7,"Gates knew exactly what he was doing with Covid-19 VACCINES and what comes next. The Continual NIGHTMARE WORLD ""AFTER"", The World Economic Forum's ""GREAT RESET"" and where the World's People and Humanity will be Totally Subrogated to a Life Without freedomhttps://t.co/Z9vL24o0mK",en
2022-10-29 13:08:47+00:00,9735729f7c927fb52113db27ac92739d99545c132f3f60822bebdbda51f87340,"WORLD FIRST: ROBOTIC ARMS Assembling Via Nanotech Inside COVID-19 ""Vaccines"" - Filmed in Real Time https://t.co/KZ82fTMUIa via @BitChute",en
2022-10-29 13:08:12+00:00,679709ba387faa688868af9d7023ff8b,The Writing Solution : COVID-19 Vaccines &amp; Women's Health: (Part 2) Has y... https://t.co/ECSwTYvHJr,en
2022-10-29 13:07:55+00:00,203ebb5787d6c14cbd9e3a10e9dc1cc0,@kolipokieh eh the covid 19 vaccine shot is more sore now haha,en
2022-10-29 13:06:58+00:00,07de2f76e96922acb4986f2054379f51,"Lula has heavily criticised Bolsonaro’s handling of the Covid-19 pandemic, during which the president downplayed coronavirus, comparing it to “a little flu,” opposed mask wearing and spread misinformation about vaccines.",en
2022-10-29 13:06:30+00:00,679709ba387faa688868af9d7023ff8b,The Writing Solution : COVID-19 Vaccines &amp; Women's Health: Has your menst... https://t.co/CoEtsqwWQ7,en
2022-10-29 13:06:18+00:00,cabb428b5f2f2ec4911299a66bc879d7,"Gates, knew exactly what he was doing with Covid-19 VACCINES and next...The Continual NIGHTMARE WORLD ...""AFTER""...The World Economic Forum's ""GREAT RESET"" and where the World's People and Humanity will be Totally Subrogated to a Life Without being freehttps://t.co/Z9vL245R8C",en
2022-10-29 13:06:00+00:00,f1fd480bbfa1f581de66db3f198450e9,"Getting vaccinated is the best way we can protect ourselves from COVID-19.If you are eligible for your next COVID-19 vaccine, you can book an appointment: https://t.co/JfSxJC8Pw4#COVIDVaccine https://t.co/7c5pXeOEqz",en
2022-10-29 13:05:53+00:00,811b5053449cb5ec18afc2e30cc855ef7ae9b503673680c323c0616d186b7d5d,@CovidianCritic @FakieNosegrob00 @samanthamarika1 Your user photo looks sickly and gaunt. You sure look like you could use some medication to help your thinning blood. How about the COVID 19 vaccine? I hear it clots nicely. I’ll send you the name of my doctor at the VA. https://t.co/J7f5nFRwDB,en
2022-10-29 13:05:39+00:00,cfaf7ae5226c69a493b2715fb63018b04fb14c7d5f2e689ca9ead074ae4f8600,"@thedanholo @SavingAmerica4U @POTUS If Biden wasn’t such a lapdog for BLM, LGBTQ, covid 19 vaccine and mask mandates, I probably wouldn’t have been as mad at Biden as I am now. He’s gotta go. PRONTO",en
2022-10-29 13:04:49+00:00,6315f9b51b3211203772329b7861989bf963cd995f82474e37fd53b0377f1243,"@CovidianCritic @EdQa941eDBBr5GE @angelanashtn 100,000 pulmonary embolisms per year on average in US. One out of 3000 women on birth control pills will develop a blood clot and about 30 million women take the pill in US = 10,000. Less than 800 pulmonary embolisms traced to all 4 types of Covid 19 vaccines combined given in US",en
2022-10-29 13:04:08+00:00,5d397983b6109cb518db21a5d0eb3fb1,@RickeyH64219156 @JonathanHannah @IdunsDaughter @Jaytee116James @AspAlaAsnAsnTyr @richykirsh @mcfunny @Pouldeau61 @JimeeLiberty @Monstercoyliar @JKelleyK @TonyBaduy @RadioColor @barryjohnreid21 @tomsirolimus @reacharoundu @ShockTraumaRN @SkepticalMutant @doritmi @Cherylmm21 @ogilville1 @scottstocker4 @kevinault @jtmayes3 @AngryFleas @MaureenStroud @newstranslate13 @doom37455413 @AndrewLazarus4 @WendyOrent @Nockit1 @pawley_robert @ConsequentialBr @krebiozen @jarbot15 @JimBeam102 @Thskicksarefire @swedishchf @Alex_on_A14 @ShadowDroid616 @TheDrJon @nuhope2022 @Adrian7745 @statsguyuk @CurfewX @JDCBurnhil @HupperichWerner @KStateTurk The vaccine greatly reduces the chances of hospitalization or death.I'm almost 50 and the risks from COVID-19 far outweighed any risks from the vaccineI am the caretaker for elderly family members and I owe it to them to protect them as much as possible,en
2022-10-29 13:04:00+00:00,224d6d9a81d9725d51bf62839acc721a,"You must boost your vaccine to stay protected from COVID-19 and its variants. For more information on when and where to get vaccinated,  contact us or visit us at https://t.co/FtjKSnWHgH...#COVID19 #GetVaxxed #GetVaccinated #HealthyBaltimore #BCHDMythsVsFacts https://t.co/l2vKHpZSBc",en
2022-10-29 13:03:39+00:00,cabb428b5f2f2ec4911299a66bc879d7,"Gates, knew what he was doing with Covid-19 VACCINES and why a No goer - The Continual NIGHTMARE WORLD ...""AFTER""...The World Economic Forum's ""GREAT RESET"" and where the World's People and Humanity will be Totally Subrogated to a Life Without being freehttps://t.co/Z9vL24o0mK",en
2022-10-29 13:01:29+00:00,e6bb9fe458992602145b8ab66e0cccea,"Pop-Up COVID-19 Vaccine Clinic, TODAY from 10 am- 3 pm at the Gravenhurst Centennial Centre. https://t.co/hgAg6J5Feg",en
2022-10-29 13:01:28+00:00,99b83394d89ddc4b91d12f7b9cc13bbc,"VACUNAS GRATIS CONTRA COVID-19 /  FREE COVID-19 NEW VACCINE   29 de octubre                                            2:00 a 5:00 p.m.                         VALLEY GREEN PARK COMMUNITY CENTER                          3000 Valley Green Park, Jordan, MN 55352 https://t.co/MgM712kofE",en
2022-10-29 13:00:46+00:00,2ce19bc8a935fa498511fdaf6b67b52f,How Does #Cellular #Immunity Work? Cellular immunity and antibodies are both key to the vaccine and booster response for COVID-19.  https://t.co/vnuYQV9WwP,en
2022-10-29 13:00:35+00:00,9bbe80b8d83a9b67633b01ebc6864537976f6dfacd27a11d45edfcfad9c99416,The covid 19 vaccine is NOT safe!https://t.co/DWATgn4bbj,en
2022-10-29 13:00:04+00:00,7fe92458e5e40b31895adfdeb038d182,"@KirstenDE999 @DavidHenigUK https://t.co/39JAdv41zr""2 doses of any “mix-and-match” combination of accepted COVID-19 vaccines""Both AZ and Pfizer are accepted vaccines""...booster dose is not needed""Looks OK to me - maybe requirement has changed recently ?",en
2022-10-29 13:00:02+00:00,9ecf627c12a8c272f0531f8190dfb1a7,The NHS is encouraging those who are eligible to book flu vaccine and booster jabs this winter. See if you're eligible and book at:●Flu vaccine – NHS: https://t.co/YmgU0j4eRY●Covid-19 booster –NHS: https://t.co/6o5NUBB0aT https://t.co/VwGYRka8US,en
2022-10-29 13:00:02+00:00,6afdb36d009c70f27302fa17c79b9a96,"COVID-19 and flu spread more easily in winter and can both cause serious illness. So, if you’re eligible, make sure you have your free flu vaccine and the COVID-19 booster this winter #GetBoostedFind out how to book at https://t.co/Rv4MD2ng8t https://t.co/b4yZ7zLi60",en
2022-10-29 12:57:22+00:00,7216633be08d199fef61acafb3521216,Role of nanotechnology behind the success of mRNA vaccines for COVID-19. https://t.co/YHfEXvtpv9Watch this video as a scientist shows how the nanotechnology in the vaccine works under a microscope.https://t.co/9SGVjtqzVF,en
2022-10-29 12:55:26+00:00,941543e946a08676892a1b0fbac23347,"It doesn't even work. 36.8% for 2-5 yo50.6% for 6-23 months""...vaccine efficacy against Covid-19 was 36.8% (95% CI, 12.5 to 54.0) among 2-to-5-year-olds and 50.6% (95% CI, 21.4 to 68.6) among 6-to-23-month-olds, at a time when B.1.1.529 (omicron) was predominant...""",en
2022-10-29 12:53:59+00:00,465bca6c1689b5d23cf8b75f1c4558c49549ae45855bc5a38b18719939ab0ce0,"The man who allegedly attacked U.S. House Speaker Nancy Pelosi's husband early Friday posted memes and conspiracy theories on Facebook about COVID-19 vaccines, the 2020 election and the Jan. 6, 2021 attack on the Capitol https://t.co/i3HUh9e3SA",en
2022-10-29 12:53:13+00:00,4a93ceaa28533370fc581cd237e5c9ea,We may feel we are “done with COVID-19” but it’s not done with us. Only 17%  of Canadians have had the bivalent booster vaccine &amp; thus the immunity of 83% of Canadians is weak. That’s why case numbers are rising. Get vaxed!  #CovidIsNotOver @QueensuDOM @KingstonHSC @KFLAPH,en
2022-10-29 12:47:05+00:00,208a87941511d019113bbf626f6d2064418730e4496d801a0719a789095114ad,@cspanwj @AmeshAA Covid 19 is manageable without the vaccine— our natural immunity https://t.co/OuVEd67blX,en
2022-10-29 12:46:56+00:00,0d982cb4f6e7629d2f0867238e6213b9528c6c8b902ab4dd3f61052aa76d198d,"WORLD FIRST: ROBOTIC ARMS Assembling Via Nanotech Inside COVID-19 ""Vaccines"" - Filmed in Real Time - Dr. Nixonhttps://t.co/iCWEIHSd6g",en
2022-10-29 12:44:25+00:00,a07c07c293905d3ba52fb69645bc1f14227e57463df36947c830237844713b58,"New Neurologic Side Effects From the COVID-19 VaccinationsDr. Peter A. McCulloughJohn LeakeOct 28 2022SEISURES !!..., genetic material loaded on lipid nanoparticles is a terrible concept for a vaccine.brain  inflammatory injury, disability, and sadly in some victims–death. https://t.co/FP5IKqBiZ4",en
2022-10-29 12:43:24+00:00,9418204620153bea2bd9097df261cdfd,@nytimes The only way to keep the children safe is by giving him the covid 19 vaccine!!!!!!!!! /sarcasm,en
2022-10-29 12:41:42+00:00,fe9de5ca3b841d7972fbc5b402a0a38a2a8bdb92d49ae2511b1733c7417ae61e,"@Meta cracked down on Covid-19, masks, vaccines, virus source, and mandates; I don’t see diversity in thoughts or opinion from Facebook or Instagram",en
2022-10-29 12:41:06+00:00,152fefdc810e1e898b7302e8829f1a413a6636f74caf33b47343e4e221b354c1,@JanetMillsforME Janet Mills took away your right to religious freedom 👉🏼NOT to vaccinate your children (the summer before COVID-19). She DESTROYED Maine’s small business community &amp; fired HCW’s who did not want the bio-weapon jab. BAN THE VACCINE!!💉 https://t.co/txsh2OaMlo,en
2022-10-29 12:40:45+00:00,3ef7247b9d226d280f788dc111ca86e7,"- Spouting off unfounded Flat Earth claims- Missing 50+ games because of petulant refusal to get the COVID-19 vaccine- Promoting an anti-semitic fim on social mediaWill the @BrooklynNets finally admit they made a mistake, eat the $$ and just cut Kyrie?No, they won't.",en
2022-10-29 12:35:49+00:00,09d72cb194d25c91e0de8c2ccebb52bc,"Other posts included transphobic images and linked to websites claiming Covid-19 vaccines were deadly. “The death rates being promoted are what ever ‘THEY’ want to be promoted as the death rate,” one post read.https://t.co/4OKtcyVtqL",en
2022-10-29 12:32:58+00:00,e00ea7dcdd9a2d39978e878aed7a4150,@XAVIAERD You mean the covid-19  vaccine?,en
2022-10-29 12:29:11+00:00,4934e37031adf76f43ea5c27eb795128,"According to @StabellBenn, the underlying problem with documenting adverse events is that the covid-19 vaccines “were not tested properly.” /4",en
2022-10-29 12:29:09+00:00,4934e37031adf76f43ea5c27eb795128,"The FDA has been criticised for taking more than a year to follow up a potential increase in serious adverse events in elderly people receiving Pfizer’s covid-19 vaccine, @MaryanneDemasi reports for @bmj_latest https://t.co/nyHzOiwa8G /1",en
2022-10-29 12:22:57+00:00,728f87a07cda43a58fd453066822a9a316e0879a47e53d7ec76bd285931febf0,"@Raesmh @sanjoy0901 @Aadesh91227440 @anmol_ambani With or without vaccines, folks are dying🤔• Without vaccinations 💉 Covid-19 kills more• Many of unvaccinated US Military personnel have died of Covid-19👇🏾 https://t.co/JSWqXa4IyL",en
2022-10-29 12:21:07+00:00,7fb959bf029435fc9084cdd895a2c98cbc9e0e7531bb66407fb13b1a0fa0f1b3,"As a health professional, I thought CDC &amp; FDA were infallible but after reading Robert Kennedy's Book, THE REAL ANTHONY FAUCI &amp; how they are all about BIG PHARMA'S VACCINE PUSHING SCAM it's clear now they are about MONEY not health! Covid-19 tip of iceberg! https://t.co/qCO3Hk5sst",en
2022-10-29 12:19:59+00:00,8aa14a8634d34adcf9aa0777c7530e96,"The COVID-19 pandemic interrupted measles vaccine campaigns globally in 2020 and 2021, leaving millions of children unprotected against one of the world's most contagious diseases. https://t.co/KJEMk56H64",en
2022-10-29 12:19:58+00:00,2a83efef368d4835bd6b61eb5d6d30097fff34f08a6c48e10bb9aa97dd0bed27,"Time to test out @elonmusk's freed bird. COVID-19 ""vaccines"" are depopulation jabs and millions of people have been killed or maimed by them. The labor shortage is largely due to a clot shot-injured populace. #DiedSuddenlyNews",en
2022-10-29 12:19:21+00:00,d6ec8a6439b37125bb9bad3e0e92e4f2,I received the bivalent COVID-19 booster today. That’s nearly the full set of available manufacturers’ vaccines that I’ve had. #ThankYouNHS,en
2022-10-29 12:18:43+00:00,7fb959bf029435fc9084cdd895a2c98cbc9e0e7531bb66407fb13b1a0fa0f1b3,"As a health professional, I thought CDC &amp; FDA were infallible but after reading Robert Kennedy's Book, THE REAL ANTHONY FAUCI &amp; how they are all about BIG PHARMA'S VACCINE PUSHING SCAM it's clear now they are about MONEY not health! Covid-19 tip of iceberg!",en
2022-10-29 12:18:10+00:00,7fb959bf029435fc9084cdd895a2c98cbc9e0e7531bb66407fb13b1a0fa0f1b3,"@FLSurgeonGen As a health professional, I thought CDC &amp; FDA were infallible but after reading Robert Kennedy's Book, THE REAL ANTHONY FAUCI &amp; how they are all about BIG PHARMA'S VACCINE PUSHING SCAM it's clear now they are about MONEY not health! Covid-19 tip of iceberg!",en
2022-10-29 12:17:50+00:00,95249c86de1144a71ebe4cbea87bbc83,@samanthamarika1 You have got to be joking. Ivermectin is useless for COVID-19. The mRNA vaccines drastically reduced the rates of hospitalization and death. Unfortunately policymakers have chosen to eliminate all other mitigations from widespread use.,en
