date,userid,tweet,lang
2022-04-14 18:00:13+00:00,1224555674488586242,Get your children 5 and up vaccinated against COVID-19 to supercharge their immunity! Find a free vaccine near you at https://t.co/ronLBjcI6i. https://t.co/YhnXcAjCWz,en
2022-04-14 18:00:07+00:00,3686641520,Recent FDA COVID-19 Updates: Janssen COVID-19 Vaccine Shelf Life &amp; Sotrovimab EUAFDA updated Janssen COVID-19 vaccine EUA shelf life to 11 mons stored at 2-8 deg C &amp; Sotrovimab EUA updated to reflect no longer authorized to treat COVID-19 in U.S.More: https://t.co/ygPM7xoSvk https://t.co/YwSd6WJJ39,en
2022-04-14 18:00:01+00:00,794032358,"Even if you’ve already had COVID-19, you can still get it again. Getting vaccinated and boosted is the best way to protect yourself from getting very sick — or developing long-term health problems from COVID. Find a vaccine near you at https://t.co/DtdsunP5bf. https://t.co/BEACog2IGV",en
2022-04-14 18:00:01+00:00,850455051965431808,This cohort study of patients receiving 3-dose mRNA COVID-19 vaccines found no increase in the #EHR reporting of severe adverse events after the third vaccine dose compared with before vaccination &amp; after prior doses. @_nference @mayoclinic https://t.co/vReB10tcuE,en
2022-04-14 17:59:01+00:00,415773218,Visit our Oshawa or Pickering #COVID19 vaccine clinic &amp; drop by to see our oral health staff. FREE dental screenings are available for kids &amp; youth 17 &amp; younger. Note: Kids under 5 years old are NOT eligible to receive COVID-19 vaccine.Learn more https://t.co/ul1TpF4oxJ https://t.co/3z5lcGr54Z,en
2022-04-14 17:58:48+00:00,491909540,"It is. You can say whatever you want. Threaten, harass, intimidate and go to jail. We already have those laws. Report it to police. But you mean fake vaccines, Democrat cover ups, Hunters computer and real Covid-19 stats.",en
2022-04-14 17:58:33+00:00,1386738793894588421,@MarinaGlogovac @DFisman Published July 22 2021People vaccinated with mRNA COVID-19 vaccines who develop COVID-19 generally have a lower viral load than unvaccinated people.https://t.co/FHhRrgh2Yd,en
2022-04-14 17:58:31+00:00,844290324,UK #covid19 deaths still exceedingly high 7 day count up by 665 today.  This is neither “living with COVID-19” nor acceptable. We need vaccines+ mitigations now👇 https://t.co/uhISeTGIkd,en
2022-04-14 17:58:03+00:00,239961753,COVID-19 vaccines and boosters are available at CaroMont Health clinics and doctor's offices around the region. Make your appointment today: https://t.co/qWJ7AiZ1N7 https://t.co/8oX5hfHDOz,en
2022-04-14 17:57:08+00:00,12002642,COVID-19 vaccine status update https://t.co/lQKQcfHSar,en
2022-04-14 17:56:22+00:00,1511021405004992514,"#Pharmaceutical packaging market is projected to reach $ 144.2 Billion by 2027. The #Covid_19 vaccines will likely use packaging, drive the major growth.https://t.co/JU9YfaHnlA",en
2022-04-14 17:56:11+00:00,1244987768,"Parents, Caregivers: your children 5 &amp; older should get a COVID-19 vaccine. Everyone 12 &amp; older should get a booster when they’re eligible. If your kids haven’t received a vaccine or a booster, make an appointment https://t.co/9cFqGJCybY or visit a doctor#TogetherFightingCovid https://t.co/rIWkbyxzrl",en
2022-04-14 17:54:48+00:00,1287330760534429696,"A third shot of the children's dose of Pfizer/BioNTech's Covid-19 vaccine raised Omicron-fighting antibodies by 36 times in kids 5 through 11 years of age, the companies said in a news release Thursday https://t.co/6PIt8rqEC1",en
2022-04-14 17:52:27+00:00,336858870,"@DwnDak @AmmahStarr 1/2 First""Actually protection from infection lasts longer, and shown more durable than vaccines."" is wrongFrom John Hopkins:""New studies show that natural immunity to the coronavirus weakens (wanes) over time, and does so faster than immunity provided by COVID-19 vaccination.""",en
2022-04-14 17:51:00+00:00,43070633,First whole-virus COVID-19 vaccine approved for use in the UKhttps://t.co/qA7iTDGUwy,en
2022-04-14 17:50:00+00:00,537753360,"@JenniferHlusko @AndreaGrebenc @MargoShuttle Somewhat pleasantly surprised to see a letter from HDSB this afternoon titled ""Masking and vaccines encouraged to limit spread of COVID-19"" - better than previous messaging - but missing a request to wear masks on buses.",en
2022-04-14 17:49:04+00:00,16954081,Washington State Board of Health votes against requiring COVID-19 vaccines for schoolchildren https://t.co/GjVV2M3GGH,en
2022-04-14 17:49:01+00:00,100453427,"Get your COVID-19 vaccine next Tuesday in Brixham. 💉There's no need to book, just walk in. Please see the graphic for the full details. https://t.co/nLVsZFpU4d",en
2022-04-14 17:49:00+00:00,2167789257,"Appointments are available at COVID-19 vaccination centres in Wirral over the school Easter holidays. Children aged 5 to 11 years are now eligible for their first dose. You can book a first, second, third or booster of the coronavirus vaccine at https://t.co/vEzgpy4NJf",en
2022-04-14 17:48:58+00:00,759251,"A third shot of the children's dose of Pfizer/BioNTech's Covid-19 vaccine raised Omicron-fighting antibodies by 36 times in kids 5 through 11 years of age, the companies said in a news release Thursday https://t.co/jEG8K4waTy",en
2022-04-14 17:48:54+00:00,2374255178,Thank you to Jim Cafone for his presentation on building Pfizer’s COVID-19 vaccine supply chain here at tOSU! Interesting to hear the manufacturing and logistics innovations needed to get the vax out. The Ohio State University Fisher College of Business L…https://t.co/I9MPCUtrgs,en
2022-04-14 17:48:01+00:00,97673156,"The #federal government has missed the deadline to update employees on whether its #COVID-19 vaccine mandate will remain in place, leaving thousands of public servants  wondering whether they can return to work.https://t.co/QN5HMhjq7e",en
2022-04-14 17:48:00+00:00,40933920,#AndinaEnglish Peru: Over 69.7 million COVID-19 vaccine doses applied 👉 https://t.co/rMGL7VhvlW https://t.co/m5EAEqVcCT,en
2022-04-14 17:46:51+00:00,17994536,The Washington state Board of Health has decided that COVID-19 vaccines will not be required for students to attend K-12 schools this fall.https://t.co/o8gGF15Vd1,en
2022-04-14 17:46:12+00:00,1238576862491824129,COVID-19 vaccines in national stockpile starting to expire as uptake slows https://t.co/PhOxWc4qL5,en
2022-04-14 17:45:38+00:00,1509206965083414540,Available now: Pfizer vaccines! Looking to get your first dose or a booster? Book an appointment with us! Visit our website (link in bio) or call 832-530-4159 for more information.#vaccine #covid_19 #covidvacccine #pfizer #booster#houston #houstonmedical #houstonrheumatology https://t.co/cG2i9pW9yr,en
2022-04-14 17:44:27+00:00,1053326020328083456,@nilikm @TorontoStar @MarinaGlogovac If you took some time to read the studies they clearly show that vaccines help REDUCE the spread significantly of COVID-19. Please stop spreading misinformation.https://t.co/VTtpt78Dh1,en
2022-04-14 17:43:38+00:00,961364966711345152,"#TogetherFightingCOVIDYou don’t need proof of immigration status to get a #COVID19 Test, Vaccine, or Booster! Vaccines are free and available to anyone 5 years old and up.Learn more at https://t.co/FFdAxk87vC #Covid_19 #COVID #vaccine #vaccinated https://t.co/HPzevfBJ4v",en
2022-04-14 17:43:35+00:00,293131808,ICYMI: you can now find info about...✅ free high-quality masks✅ vaccine and booster sites✅ COVID-19 tests✅ life-saving therapeutics...all on one website! Click the link below for more. https://t.co/hgFD3cUy5V,en
2022-04-14 17:41:39+00:00,1134049078424162304,Pfizer/BioNTech's COVID-19 Vaccine Booster Shows High Immune Response In Kids Aged 5-11 Years $PFE https://t.co/kBAMDfOzME,en
2022-04-14 17:41:15+00:00,106348682,"Booster doses for inactivated COVID-19 vaccines: if, when, and for whom - The Lancet Infectious Diseases ✅✅✅ https://t.co/lMMu1hkNCj",en
2022-04-14 17:39:59+00:00,57709461,"MacCheck now offers the optional ability for McMaster students, faculty and staff members to upload a record of their COVID-19 vaccine booster dose:    https://t.co/J30zXQ8hsB https://t.co/QJAdipwZUt",en
2022-04-14 17:39:24+00:00,399359849,Great news today for those of us involved in the #Valneva #Covid_19 vaccine trial and grateful thanks to all the scientists and staff involved @RoyalSurreyBBC News - Valneva Covid vaccine approved for use in UKhttps://t.co/RN4nAbu6Pk,en
2022-04-14 17:39:20+00:00,1479228279173308426,"@MCCH2021 @heatherstarr8 @Neil4Denise @Smockedindaface @YouTube SM-102 is a synthetic amino lipid which is used in combination with other lipids to form lipid nanoparticles.[1] These are used for the delivery of mRNA-based vaccines,[2][3][4] and in particular SM-102 forms part of the drug delivery system for the Moderna COVID-19 vaccine.",en
2022-04-14 17:39:10+00:00,860267471705604096,Would-Be Immigrants Can Get Waivers for COVID-19 Vaccine Requirement: Lawyer https://t.co/p7QX07kUtE,en
2022-04-14 17:39:09+00:00,1242082182748872705,Pfizer-BioNTech COVID-19 vaccine booster spurs strong immune response in kids 5–11More medical news at https://t.co/pvWdUgzL00#Epidemiology #MedTwitter #MedEd #MedNewshttps://t.co/nQ80RMhAow,en
2022-04-14 17:37:12+00:00,4327179197,"The United States Government has so far donated over 400,000 doses of #COVID19 vaccines to The Gambia via #COVAX. Today’s arrival of 19,890 #Pfizer vaccines will further boost #Gambia’s COVID-19 vaccination. Thank you🇺🇸! https://t.co/EL6O1sJOFq",en
2022-04-14 17:37:01+00:00,1271686381505581056,"Pfizer-BioNTech COVID-19 vaccine booster spurs strong immune response in kids 5–11For more up-to-date medical headlines, visit https://t.co/8ugyCPRjur#MedicalNews #MedTwitter #MedEd #MedNewshttps://t.co/f9SuOdJXAd",en
2022-04-14 17:35:35+00:00,2462158291,@BabaCugs All Vaccines have a course of time in your body. Some last less than a year. The flu vaccine is a great example as is the Covid-19 vaccine. So wha are the questions?,en
2022-04-14 17:34:06+00:00,1131075626,"12-15 year olds can now receive the COVID-19 vaccine, getting vaccinated will help them stay in school 🎓 💉For locations, dates &amp; times across Tameside please visit 👇🏼 Walk-in or book. https://t.co/YBYUu8wJ4w https://t.co/E64xcROpjU",en
2022-04-14 17:34:02+00:00,1240386128177291271,@EricaSteussie It was a good response. We administered 93 COVID-19 vaccines at the Convention Center. We also administered 24 COVID-19 vaccines via our homebound program (call 328-2427 for info) and 32 COVID-19 vaccines at the @WashoeHealth clinic.,en
2022-04-14 17:32:49+00:00,1490808231656108032,"@dustinhayre @bly_nell @louietraub @trocbe 98% of us that got #Covid_19 BEFORE the #vaccine, survived. Sounds like the vaccine doesn’t do shit.",en
2022-04-14 17:32:23+00:00,106348682,"Reported cases of multisystem inflammatory syndrome in children aged 12–20 years in the USA who received a COVID-19 vaccine, December, 2020, through August, 2021: a surveillance investigation - The Lancet Child &amp; Adolescent Health ✅✅✅ https://t.co/8GpYGU7pzF",en
2022-04-14 17:32:16+00:00,16361563,🚨JUST IN - The Washington state Board of Health has decided that COVID-19 vaccines will not be required for students to attend K-12 schools this fall. https://t.co/7zUWSSDhDh,en
2022-04-14 17:32:07+00:00,518942236,"Also, UnitedHealthcare will be onsite that morning to administer COVID-19 vaccines for the whole family, including booster shots. Won't you join us?!?#UCSpride #RUN4UCS https://t.co/t1H2lSjp4v",en
2022-04-14 17:31:27+00:00,76957426,"We're out at ACCESS Brandon TODAY until 3:00 p.m. to offer first dose, booster and/or pediatric COVID-19 vaccines to our CPS families and friends. We hope to see you there! #ACCESSmyshot https://t.co/hCzWNV5NWq",en
2022-04-14 17:30:14+00:00,236770150,UK's Medicines and Healthcare products Regulatory Agency approved Valneva COVID-19 vaccine https://t.co/0HIB4Tq2DN #Health https://t.co/eQQT8822Zi #news 851,en
2022-04-14 17:30:02+00:00,18935711,The Valneva vaccine is made with the decades-old technology used to manufacture shots for flu and polio. It is the sixth COVID-19 vaccine the U.K. has cleared and the only one that utilizes a “killed” virus.https://t.co/hoTP3XsOtE,en
2022-04-14 17:27:29+00:00,1411910919169318925,Telit and Controlant Partner on Global COVID-19 Vaccine Distribution Program – IoT Business News https://t.co/G5acZ1EBt6,en
2022-04-14 17:27:15+00:00,2776817201,"Can't make it to one of our clinics? Get vaccinated at home! The ""Vax Visits"" program makes it even easier to get your COVID-19 vaccine. Call the Erie County Department of Health (@ECDOH) at (716) 858-2929, 8:30 AM – 4:30 PM,  Monday – Friday.Learn mo... https://t.co/RM2WDoviYh https://t.co/ETt6FMyCdq",en
2022-04-14 17:25:30+00:00,3905016019,Parents &amp; Caregivers: your children ages 5 yrs+ should get a COVID-19 vaccine. Everyone ages 12 yrs+ should get a booster when they’re eligible.Make your kiddos an appointment today!Contact their healthcare provider or visit https://t.co/4gXwILoAA3.,en
2022-04-14 17:24:38+00:00,135367737,"I don't have any complaints about getting vaccinated with the 4th dose of the Pfizer mRNA COVID-19 vaccine once it has been authorized. The same goes for following the mask mandate, and safety measures. If it's for the greater good, then so be it.",en
2022-04-14 17:24:06+00:00,87521860,"Dr. Paul Auwaerter discusses new vaccine boosters, global impact of the pandemic, and the BA.2 subvariant. #Covid_19 https://t.co/upmXHJ8Nae",en
2022-04-14 17:23:47+00:00,19128902,Guatemala has seen millions of COVID-19 vaccines expire in the last month. Here is my latest for @AJEnglish on how the lack of communication by authorities and the rise of conspiracies led to low vax rates and the loss of millions of vaccines https://t.co/aBbW95FcKi,en
2022-04-14 17:22:50+00:00,106348682,Systemic sclerosis and COVID-19 vaccines: a SPIN Cohort study - The Lancet Rheumatology ✅✅✅ https://t.co/XHe0clKANn,en
2022-04-14 17:22:34+00:00,588319696,"...care services, transparency in the distribution of #Covid_19 vaccines and accountability of all #Covid_19 relief materials. https://t.co/XB47ewboRc",en
2022-04-14 17:20:02+00:00,29961662,Pharmaceutical company @valnevaSE has been given regulatory approval by th eMedicines and Healthcare products Regulatory Agency for its Covid-19 vaccine 💉#ScotlandIsNowhttps://t.co/R4HU364PPv,en
2022-04-14 17:19:00+00:00,953395932929908737,High vaccine effectiveness against severe Covid-19 in the elderly in Finland before and after the emergence of OmicronAnd.... yes: vaccines are still working! A 3rd dose is needed; VE against severe COVID-19 disease remains high!https://t.co/UF28umI1je,en
2022-04-14 17:18:18+00:00,259380252,Free Covid-19 vaccines for anyone five and older next Saturday morning at Lake Forest Elementary.  @ricsprincipal @ricscounseling https://t.co/FUjufnqMD4,en
2022-04-14 17:17:24+00:00,1224799906063376386,"Once eligible, all New Yorkers 16 and older should get a free COVID-19 vaccine booster shot after receiving their full vaccine series.Stop by @NYCHealthSystem location to get it: https://t.co/mqjLh5FumH https://t.co/NkmFnt8KzA",en
2022-04-14 17:17:10+00:00,106348682,COVID-19 vaccine perceptions and uptake: results from the COVID-19 Global Rheumatology Alliance Vaccine Survey - The Lancet Rheumatology ✅✅✅ https://t.co/D6udeGOEMo,en
2022-04-14 17:16:28+00:00,1434249123641769988,4th Covid-19 vaccine shot: Do you need one? https://t.co/uU4UQwhikK,en
2022-04-14 17:16:13+00:00,1493525956463521799,"Instead of hesitancy, School children are happily taking COVID-19 vaccine in Punjab. With support from SARD Volunteers, This new cohort is making creative selfie stands in schools. @JSIhealth @USAID_MOMENTUM @MoHFW_INDIA @sard_delhi @mygovindia #COVID19 #VaccinesWork #Punjab https://t.co/c0B5rc4vLz",en
2022-04-14 17:16:00+00:00,2331761587,"Every adult in the country now needs to get a Covid-19 booster vaccine, because two doses does not give you enough protection against catching Omicron. https://t.co/BpxfelZ6iJ https://t.co/hUlUGqg4lF",en
2022-04-14 17:15:03+00:00,25562183,"Britain's medicines regulator on Thursday approved the use of Moderna's COVID-19 vaccine in children between six and 11 years, as the country bolsters itself for fighting coronavirus infections amid the spread of new virus variants. https://t.co/NJs8OYe4KY",en
2022-04-14 17:13:14+00:00,4176864433,"@Goosedancer @DarrenBurchill Why are we killing our young people? ""The so-called health professionals pushing for the Wuhan coronavirus (COVID-19) vaccine programs around the globe have repeatedly said the vaccines are safe and effective. But hundreds of young and healthy athletes are dying because of them.""",en
2022-04-14 17:12:04+00:00,207603568,"The Easter Bunny is brining more than candy this year! 🐇Get your 1st, 2nd, 3rd or 4th COVID-19 vaccine dose  Sunday at the @TOPublicHealth Easter Parade Pop-up Clinic. Running 11am - 5pm at the historic Toronto Fire Station 227 (1904 Queen St. E). https://t.co/4VYlIcHuFv",en
2022-04-14 17:12:00+00:00,634877232,"As a medical resident, @soupmd_ worries about the anger many of his peers feel towards patients unwilling to be vaccinated against COVID-19. If my compassion for vaccine hesitant patients wanes, does the quality of the care I provide suffer too? https://t.co/7i9qJKF5HT",en
2022-04-14 17:11:33+00:00,1336732635348004958,@elonmusk COVID-19 was made in a lab. The vaccine doesn’t work. Some of the highest rate of  people who were catching COVID-19 were the vaccinated  and double vaccinated at that. The media is lying to you all. @elonmusk should run big tech companies.,en
2022-04-14 17:11:24+00:00,45621185,Opinion: 'Big Tobacco' COVID-19 vaccine: what were the Liberals thinking? The liberals haven't got enough brains in the whole cabinet to even have a thought.,en
2022-04-14 17:10:03+00:00,14292247,📣 Calling our community!Please give 5 minutes to complete an international survey open to people with or without coeliac disease evaluating the risk of adverse events in both groups post COVID-19 vaccines.Share the link with family and friends: https://t.co/Sz7M5XjVwK https://t.co/qCvM46YuQW,en
2022-04-14 17:09:32+00:00,1452730505787551750,Covid-19: UK approves vaccine from Franco-Austrian laboratory Valneva - #laboratory #europe #uk https://t.co/Wt4GoKJBbO,en
2022-04-14 17:09:26+00:00,2709451526,Do you have questions about the COVID-19 vaccines for children of ages 5-11? Check out this fact sheet for answers!  https://t.co/azvW80E2Vs,en
2022-04-14 17:08:03+00:00,747681780,Alt 8/11 shot with an mRNA booster shot showed similar protection against emergency department/urgent care visits due to COVID-19 (79%) as 3 shots of mRNA vaccines (83%). Three mRNA shots though provided more protection against overall hospitalization (90%) than a Janssen shot,en
2022-04-14 17:08:02+00:00,747681780,"Alt 5/11 Appeals court okays the COVID-19 vaccine mandate for federal employeesA federal appeals court upheld President Biden’s requirement that all federal employees be vaccinated against COVID-19, with exceptions for medical and religious reasons. Last week, a panel of the",en
2022-04-14 17:08:01+00:00,747681780,"Alt 2/11 test before traveling (no more than 3 days) and 3-5 days after the cruise, regardless of COVID-19 vaccination status. The CDC urges cruise-goers to stay up to date on their COVID-19 vaccines and consider their personal health risks before boarding.",en
2022-04-14 17:08:00+00:00,104745251,"The @BMWK has budgeted €2.9 billion and contracted #BioNTech, @wackerchemie, @cordenpharma, @CureVacRNA, #GSK, @idtbiologika and #Celion to produce mainly mRNA-based covid-19 vaccines to address the current pandemic and future outbreaks through 2029. https://t.co/XC0FPImiTG",en
2022-04-14 17:08:00+00:00,24143255,Pfizer and BioNTech say a third dose of their COVID-19 vaccine produced significant protection against the omicron variant in healthy children aged between 5 and 11 years in a trial. https://t.co/0mxn7lNFIT,en
2022-04-14 17:07:02+00:00,727631459968638976,"@RealZaneZeiter Max Blumenthal speaking at the medical freedom (anti- Covid-19 vaccine mandate) rally in Los Angeles. Sunday April 10, 2022.https://t.co/bzOqLq3wrA",en
2022-04-14 17:06:50+00:00,798805325298049025,"@Taiwan_CDC Injecting vaccine to COVID-19, cause alot of people died! Both in America and China, other countries and places are the same situation.it cause a lot of side effect, that is bad efdect!",en
2022-04-14 17:06:42+00:00,14385336,Pfizer has made $37bn on its Covid-19 vaccine but still refuses to share its vaccine tech with countries in the global south. Join us on 28 April to tell Pfizer: no more pandemic profiteering! 👇https://t.co/UBa5FKNpFR,en
2022-04-14 17:06:31+00:00,798805325298049025,"@Taiwan_CDC I feel we don't need to develop vaccine to COVID-19! We can solve COVID-19 problem too! For example, North Korea! There are only four countries in the world that have no COVID-19 cases!",en
2022-04-14 17:05:51+00:00,896429028260933632,"'Officials stressed that there is ""no link"" to COVID-19 jabs as none of the children affected have received a coronavirus vaccine. The UKHSA said that (whilst) adenoviruses do not typically cause hepatitis, it is a known rare complication of the virus.' #covid19UK #ToryLies",en
2022-04-14 17:05:04+00:00,4326463994,"@JiminySpeaks With the Liberal/NDP alliance in place for 3.5 years, the Cons &amp; pee pee Pierre are irrelevant, in our fast-changing world. Russian War. Climate Changes &amp; natural disasters. Covid 19 waves 6-10! Vaccines. Oil &amp; gas are out EV is in. Leadership matters. #Trudeau2025🇨🇦",en
2022-04-14 17:02:59+00:00,1456357158803709958,"""Authorized to PREVENT COVID-19"" For all of the people claiming vaccines were never meant to prevent infection. What a joke @pfizer @AlbertBourla How long does that protection last? 30 days?",en
2022-04-14 17:02:34+00:00,1038903233476001793,Kudos to @USEmbassyBanjul for this critical support and now we need to start translating vaccines es into immunization against Covid-19,en
2022-04-14 17:02:06+00:00,34923877,Vaccination is the best way to protect your child from COVID-19. Learn how mRNA vaccines work like invisible coaches to teach your child's immune system to recognize the virus. #VaccinesWork #ThisIsOurShot https://t.co/LdlyxnO565 https://t.co/ifrqNRd704,en
2022-04-14 17:02:03+00:00,36099461,"As National #MinorityHealthMonth continues, @PHLearning is hosting a COVID-19 vaccine clinic this Saturday, April 16. No appointment or insurance required and a food bank event will be on site! #BoostYourCommunity https://t.co/NlqXG5YPnc",en
2022-04-14 17:01:35+00:00,940310669001342976,Why shouldn't you tell an Easter egg a joke?It might crack up!Get a COVID-19 vaccine or booster dose today! https://t.co/6VhK21ms2G,en
2022-04-14 17:01:00+00:00,2414853302,💉 COVID-19 vaccines are acceptable for Muslims as agreed by most Islamic scholars at the British Islamic Medical Association - BIMA Take care of your loved ones during Ramadan and book your COVID vaccination today on the NHS website 👉 https://t.co/9bg1TDKWR4 #SafeRamadan💙 https://t.co/LMCsy3GuKO,en
2022-04-14 17:00:45+00:00,964438119453003776,#questiontime The first country in the world that has authorized the use of a plant-based COVID-19 vaccine is?a)      USAb)      Australiac)      Canadad)      Brazil,en
2022-04-14 17:00:44+00:00,1305565146618748929,"Get vaccinated and boosted to protect yourself and your loved ones. For more information about where to get a free COVID-19 vaccine, visit https://t.co/0W0hkADGPU https://t.co/qTT3UOCAim",en
2022-04-14 17:00:41+00:00,990802033,GB News interview features misleading claims about Covid-19 and vaccines https://t.co/ooDd6IXghX,en
2022-04-14 17:00:38+00:00,262270117,The Past Is so Present: Understanding #COVID-19 Vaccine Hesitancy Among #AfricanAmerican Adults Using Qualitative Data.Read the study. https://t.co/3a039dZEyc https://t.co/lFMvA8MppH,en
2022-04-14 17:00:31+00:00,64166152,"💉 Health Centres will continue to provide Sinopharm and Johnson &amp; Johnson COVID-19 vaccines, during regular hours of operation. | #TrinidadandTobago #Youthere1 https://t.co/90i1H2xzOM",en
2022-04-14 17:00:25+00:00,776116251898712064,"As of today, we have:🏥 31 patients hospitalized ( 26 unvaccinated / 5 vaccinated)🏥 6 patients in ICU (6 unvaccinated / 0 vaccinated)🏥 5 patients on ventilators (5 unvaccinated / 0 vaccinated)Call 833.822.5523 to schedule your COVID-19 vaccine. https://t.co/FsvxsMaO4A",en
2022-04-14 17:00:13+00:00,236770150,UK's Medicines and Healthcare products Regulatory Agency approved Valneva COVID-19 vaccine https://t.co/0HIB4Tq2DN #Health https://t.co/eQQT8822Zi #news 596,en
2022-04-14 17:00:02+00:00,1448387671336779778,"Need to get your COVID-19 Vaccine?Come out to Rancho San Miguel today: April 14, 2022, between 12:00 PM to 5:00 PM.COVID-19 vaccines are available for children and adults.",en
2022-04-14 17:00:02+00:00,237024183,Get your children 5 and up vaccinated against COVID-19 to supercharge their immunity! Find a free vaccine near you at https://t.co/vPHlF1hfyn. https://t.co/rsU05RE7gt,en
2022-04-14 17:00:01+00:00,281329012,Did we get it right? Who are we missing?Powered by @chipublichealth Visit https://t.co/Yo85mvB5fc to learn more about protecting your child with the COVID-19 vaccine.#ProtectChicago https://t.co/9duMjki3O0,en
2022-04-14 17:00:00+00:00,3460109487,"In today's #Covid19 roundup: The UK’s drug regulator on Thursday became the first in the world to approve Valneva’s Covid-19 vaccine, which becomes the sixth Covid-19 vaccine to be granted an MHRA authorization.https://t.co/CBLu8O9NPN",en
