date,userid,tweet,lang
2022-05-23 18:23:05+00:00,14956372,What's next for COVID-19 vaccines for youngest US children https://t.co/Y84HRSNFen,en
2022-05-23 18:22:32+00:00,108352504,What's next for COVID-19 vaccines for youngest US children https://t.co/YkIxNwzdRp,en
2022-05-23 18:22:01+00:00,46420098,May 31 COVID-19 Vaccine Clinic information and registration can be found at https://t.co/dhwk9Q8FtD https://t.co/96iowqx87z,en
2022-05-23 18:20:57+00:00,1301304955957997573,"COVID-19 #boosters are now available for kids 5+! With #COVID19 cases rising, it's important that everyone is up to date w/ their #vaccines, including kids. Get &amp; share the facts at https://t.co/m3ZHdPWJZz. @KFF @AmerAcadPeds @DoctoraEdith #GreaterThanCOVID #BetweenUsAboutUs https://t.co/RT5sK83f3i",en
2022-05-23 18:20:41+00:00,1428551821,Coronavirus (COVID-19) Update: FDA Announces Tentative Advisory Committee Meeting Schedule Regarding COVID- 19 Vaccines https://t.co/BwOCux3gbA,en
2022-05-23 18:20:36+00:00,1513790431120793601,New post: Parkland Health Reminding Residents its Offering COVID-19 Testing and Vaccines in Dallas County https://t.co/5RUVDM9zrr https://t.co/06rvycsudA,en
2022-05-23 18:20:05+00:00,16813752,What’s next for COVID-19 vaccines for youngest US children https://t.co/gWcpLnckm0,en
2022-05-23 18:19:35+00:00,1105892061184704512,Testing Our Luck: Will Animal Research Give Us a COVID-19 Vaccine? https://t.co/UveAsBs3kq via @sentient_media,en
2022-05-23 18:19:05+00:00,44426926,What’s next for COVID-19 vaccines for youngest US children https://t.co/rDoOyB8TUj,en
2022-05-23 18:18:45+00:00,93470026,"Pfizer vaccine: Three-dose Covid-19 vaccine produces strong immune response in young children, Pfizer and BioNTech say - CNN https://t.co/NdmmXF9mfE",en
2022-05-23 18:18:42+00:00,807654124640550913,"The search for longer-lasting Covid-19 vaccines - Holy Shit. If Dr. Fauci is suggesting a move away from mRNA, we are all in trouble bc that means he knows it’s an epic disaster… https://t.co/joiphayaqO",en
2022-05-23 18:18:23+00:00,25530716,What's next for COVID-19 vaccines for youngest US children https://t.co/iJKA7gEo3w,en
2022-05-23 18:18:23+00:00,21335246,What's next for COVID-19 vaccines for youngest US children https://t.co/gCE4deMQjh,en
2022-05-23 18:18:10+00:00,33529614,"Three doses of Pfizer’s COVID-19 vaccine offer strong protection for children younger than 5, the company announced Monday. Pfizer plans to give the data to U.S. regulators later this week in a step toward letting the littlest kids get the shots.https://t.co/22sI6kpQbU",en
2022-05-23 18:17:29+00:00,23788966,What's next for COVID-19 vaccines for youngest US children https://t.co/rpUzjll1m6,en
2022-05-23 18:16:18+00:00,1427361863830949908,"👀 May 2022 @CNN:  ""scientists are urgently [asking]... whether some of this drop off in our protection [vs. covid infection] may be a result of the mRNA technology used to build some Covid-19 vaccine.""The zeitgeist is shifting rapidly.https://t.co/DYz90HrdOJ https://t.co/IbzS1bPJLV",en
2022-05-23 18:15:25+00:00,3296548417,"Hoping this gets approved soon! SICK of the babies being put in danger by a bunch of self-centered adults. Pfizer, BioNTech report 80 percent efficacy of Covid-19 vaccine for youngest children https://t.co/3VGJEMBsEp via @politico",en
2022-05-23 18:15:15+00:00,26350330,"Pfizer says that testing shows its three-shot COVID-19 vaccine is safe, well-tolerated and 80% effective at preventing illness in children ages 6 months to under 5 years. https://t.co/ABDq4gAqnC",en
2022-05-23 18:15:07+00:00,24905550,What's next for COVID-19 vaccines for youngest US children https://t.co/oFItaPeHGh,en
2022-05-23 18:14:50+00:00,145036955,Everyone 5+ years who is fully vaccinated against COVID-19 is now eligible for a booster.Join the @YMCASeattle and Stepping Stone Pediatrics for a booster vaccine pop-up at the Kent YMCA on May 26 (4 - 7pm). Vaccines are FREE and no appointment is required. -@CityofKent https://t.co/aE3Bv1Shn4,en
2022-05-23 18:14:30+00:00,3827798114,"We follow CDC eligibility requirements for COVID-19 Vaccine Boosters. If you want to get up-to-date on your shots, come to one of our free clinics! Wednesdays, 5:30-7:30pmThursdays, 10am - 4pmLocation: 2401 SE 14th St, Des Moines To schedule an appt. call (515) 612-9577 https://t.co/Rhia2TguYA",en
2022-05-23 18:14:28+00:00,28785486,"Amid myriad proven COVID-19 prevention measures—masks, vaccines, contact tracing—one of the most powerful tools to prevent transmission is a good ventilation system that frequently recirculates fresh air. https://t.co/oBotoF0ryX",en
2022-05-23 18:13:03+00:00,2818010701,Covid-19: Government sets aside $473m for fourth vaccine dose https://t.co/oVZRNSCj4X https://t.co/LlhaR32T7f,en
2022-05-23 18:12:57+00:00,166483418,"""The U.S. International Development Finance Corporation (DFC) or its predecessor agencies have so far provided India with $5.8 billion, of which $2.9 billion is outstanding, for COVID-19 vaccine manufacturing, healthcare, renewable energy, financial inclusion and infrastructure.""",en
2022-05-23 18:12:20+00:00,68931280,AstraZeneca’s COVID-19 vaccine receives EMA approval for use as third-dose booster - https://t.co/vzs1ZoK9y0,en
2022-05-23 18:12:00+00:00,252114970,":Help us create a safer, healthier New Jersey by getting your child vaccinated. If they are 5 years or older, they are eligible to receive a COVID-19 vaccine. Talk to your pediatrician to find out how the vaccine can help protect your child. https://t.co/W9q4E8ifT1 https://t.co/PBimEImmq7",en
2022-05-23 18:11:18+00:00,399463138,"Two asks by Egypt AU Rep- on hunger &amp; COVID!1. In d short-term,consider Africa hedgefund 2 cushion continent against food price fluctuations.2.Let Africa start purchasing COVID-19 vaccines from within d continent 2 boost d nascent but growing vaccine prod'n capacity. #AUHS2022",en
2022-05-23 18:10:00+00:00,32496789,"Pfizer says it plans to give data to U.S. regulators later this week, showing that three doses of its COVID-19 vaccine offer strong protections for kids younger than 5. https://t.co/rqIkNXBM0W",en
2022-05-23 18:09:35+00:00,262020364,"Top story: Pfizer vaccine: Three-dose Covid-19 vaccine produces strong immune response in young children, Pfizer and BioNTech say - CNN https://t.co/qI0xXbhkyl, see more https://t.co/C6Y2v6Sh7q",en
2022-05-23 18:09:33+00:00,1014927366265692161,WHO reviews evidence on fourth COVID-19 vaccine doses https://t.co/rZTn49w5n5,en
2022-05-23 18:09:32+00:00,321651713,About 18 million children under the age of 5 are the only Americans not yet eligible to receive the COVID-19 vaccine. That could all change soon!,en
2022-05-23 18:09:30+00:00,1315410517268324353,US sees risk of COVID-19 supply rationing without more funds https://t.co/VbtIcuNvnY Or the drug companies could donate the vaccines. since they have been paid for the first 4 rounds of vaccines.,en
2022-05-23 18:07:00+00:00,136783073,If #Pfizer says so! Pfizer says 3 doses of its COVID-19 vaccine protect kids under 5 https://t.co/RV4P6w5sBL,en
2022-05-23 18:05:36+00:00,1270909240924872705,"""Towards the emergence of a new form of the neurodegenerative Creutzfeldt-Jakob disease: Twenty six cases of CJD declared a few days after a COVID-19 “vaccine” Jab""Co-authored by Nobel prize winning French virologist Luck Montagnier https://t.co/JBn7ZUElEx",en
2022-05-23 18:04:57+00:00,912407640931799040,@LeoVaradkar @Merck Do not close down this country iraland again or you will hear the Irish people and the whole of Ireland coming if Ireland is closed down again it's finished some one is making money out of this COVID 19  the vaccine companies are,en
2022-05-23 18:04:49+00:00,961851660787003395,"@ErinMcCreary Ask yourself this: Have you yet to receive a booster recently, but hung out with someone who had been boosted with an mRNA Covid-19 vaccine within the last 3 months? Specifically the last month? If the answer is yes, then that is probably your answer as to why you have Covid.",en
2022-05-23 18:04:26+00:00,98613701,"a.@DCPCR reached out to 25,244 adolescents for their Covid-19 vaccination, spoke to their parents about the need &amp; relevance of the vaccines for adolescents from their health, as well as education. Many parents had concerns &amp; queries which we addressed &amp; ensured their vaccination https://t.co/roRboSGYNy",en
2022-05-23 18:04:24+00:00,98613701,"9. We made extensive plan to protect children from Covid-19 III wave, and prioritised three groups: adolescents (15-18 years), pregnant women, and children with special needs considering the effectiveness &amp; efficacy of vaccines.",en
2022-05-23 18:04:14+00:00,1247590354406256641,"SII might have to destroy 200 million COVID-19 vaccines due to oversupply, says Adar Poonawalla https://t.co/aqG0dMcZDg",en
2022-05-23 18:03:50+00:00,1511475649071890435,POTUS regarding monkeypox: “I just don’t think it rises to a level of the kind of concern that existed with COVID-19 and the Smallpox vaccine works for it. But I think people should be careful.” https://t.co/qnXHFVDaNJ,en
2022-05-23 18:02:33+00:00,48788453,Pfizer COVID-19 vaccine: when could little kids get the vaccine? : NPR https://t.co/ayLYQp0XJK,en
2022-05-23 18:01:59+00:00,36368631,"Book an appointment at our mobile COVID-19 vaccine clinic at Regiopolis-Notre Dame 👉 Tuesday, May 24 from 3 to 5 p.m. 👉 All doses available👉 Walk-ins available for those eligible 5 years of age or olderBook ahead: https://t.co/BQgqZJnZjQ@LimestoneDSB @alcdsb https://t.co/zlbOKp6WR4",en
2022-05-23 18:01:55+00:00,62546305,The Centers for Disease Control and Prevention (CDC) Thursday recommended children ages five through 11 receive COVID-19 vaccine booster shots.Read more at: https://t.co/UU0WlFtjwh https://t.co/LUxuiLVLzL,en
2022-05-23 18:01:52+00:00,577106143,"UPCOMING CLINIC | The GO-VAXX bus will be returning to Pelham Thursday May 26.  Make your way to the  mobile vaccine bus for your 1st, 2nd or booster dose of a COVID-19 vaccine at the Meridian Community Centre, from 10 a.m. to 6 p.m.  https://t.co/AOzlOLM3ZT #PelhamON https://t.co/z6vn4sFhi8",en
2022-05-23 18:01:47+00:00,42644393,"Hey Raleigh residents! 📣 Want to get the COVID-19 vaccine in YOUR community? Then stop by our pop up vaccine clinic happening TOMORROW!📆Tuesday, May 24🧺Brentwood Coin Laundry📍 2229 New Hope Church Rd., Raleigh⌚ Noon - 6 p.m.💻 Learn more at https://t.co/s8aTzzizth https://t.co/NmW0jTefX3",en
2022-05-23 18:01:47+00:00,120578352,"Congratulations to the Bloomington, Indiana team on their third Facility of the Year Award! The team cut six months off its original schedule to bring life-saving COVID-19 vaccines to patients, faster. Tour the Bloomington main campus now: https://t.co/dJMAy1LnCK https://t.co/4XIsNupEXQ",en
2022-05-23 18:01:24+00:00,25723686,Our goal is to help EVERYONE get protection from COVID-19. Visit the link below to find a clinic near you and help us make a #HealthyNevada. https://t.co/4Y0kjZrglU......#NorthernNevada #SouthernNevada #PublicHealth #Prevention #VaccinesSaveLives #Healthcare #Vaccine https://t.co/s3Xdu3wUAi,en
2022-05-23 18:01:23+00:00,6577642,Pfizer reported that a third COVID-19 vaccine dose in children under the age of 5 produced a “strong” immune response.  https://t.co/sFLBaAJaUa,en
2022-05-23 18:01:14+00:00,190275594,"Drop by the MobiVax clinic tomorrow, May 24 in MOOSE CREEK for a first, second or booster (third or fourth) dose of the COVID-19 vaccine, if eligible. First come, first served. https://t.co/9AbPd4nb8q https://t.co/uAGD21CU4S",en
2022-05-23 18:01:14+00:00,190275594,"Drop by the MobiVax clinic tomorrow, May 24 in Crysler for a first, second or booster (third or fourth) dose of the COVID-19 vaccine, if eligible. First come, first served. https://t.co/9AbPd4nb8q https://t.co/kGfjE7mu0R",en
2022-05-23 18:01:10+00:00,4857887712,We supplied Made-in India Covid-19 vaccines to 100 nations: PM Modi tells Indians in Japan https://t.co/9ydujwtSc2,en
2022-05-23 18:00:30+00:00,17464780,"Three Doses of Pfizer’s Covid-19 Vaccine 80% Effective in Young Children, Company Says - WSJ https://t.co/Cd93GBcJni",en
2022-05-23 18:00:27+00:00,119084466,Boosters -- A Pfizer vaccine booster for children is now authorized by the FDA. Get the details in our updated article about COVID-19 Vaccines. https://t.co/YR7Nx5bHdi https://t.co/7EQWUs2wwE,en
2022-05-23 18:00:19+00:00,1427340837982195716,Please sign...Petition: Open a Public Inquiry into Covid-19 Vaccine Safety https://t.co/Qrxfpeq90z,en
2022-05-23 18:00:19+00:00,1491438930490576901,"Mark your calendars for the Mental Health Resources Fair hosted by Emmanuel Temple Apostolic Church!Tuesday, May 24 10AM- 3PM.900 6th St. Vallejo, CA.There will be Free lunch, clothing, health screenings, dental screenings, COVID-19 vaccines &amp; testing and more! https://t.co/pcnH3Md9Gv",en
2022-05-23 18:00:18+00:00,1491438930490576901,"Let's Get Vaccinated Solano!Upcoming COVID-19 vaccine clinics available in Vallejo!No appointment needed!5/24 Tuesday900 6th St. Vallejo, CA https://t.co/B9YnjssHgE",en
2022-05-23 18:00:16+00:00,10649692,"Pfizer's pediatric COVID-19 vaccine has an efficacy of 80.3%, according to a preliminary analysis. If the FDA agrees with Pfizer's findings, it's possible that young children could be eligible to receive the vaccine within the first weeks of the summer.https://t.co/UexNVdc8OS",en
2022-05-23 18:00:06+00:00,3419251203,Covid-19—How Europe’s vaccine donations went tragically wrong ⁦@LucienHordijk⁩ &amp; ⁦@pretpat⁩ via ⁦@bmj_latest⁩  https://t.co/M0cdlxyI7u,en
2022-05-23 18:00:05+00:00,19045811,"We are fortunate to live where there is an ample supply of COVID-19 vaccine. ""Others are not so privileged,"" writes this North Vancouver grandmother. https://t.co/qUzcipZboI",en
2022-05-23 18:00:04+00:00,15945699,"COVID-19 vaccines are available for anyone ages 5 and older. Get a free vaccine and $50 gift card for each dose or booster from Ramsey County, while supplies last. Schedule your appointment today: https://t.co/WVphzz6wt9. https://t.co/SNr6dKMZqW",en
2022-05-23 18:00:01+00:00,285165232,"The U.S. General Accounting Office estimates b/w 7.7-23 M Americans will develop long COVID or post-COVID-19 condition. What are the symptoms, who is it affecting &amp; how effective are vaccines, monoclonal antibodies &amp; antivirals at preventing this syndrome? https://t.co/XOKg6bnMqC",en
2022-05-23 18:00:01+00:00,1220508725364117507,The Centers for Disease Control and Prevention (CDC) Thursday recommended children ages five through 11 receive COVID-19 vaccine booster shots.,en
2022-05-23 17:57:59+00:00,1392831444616101888,"Yesterday, I tested positive for COVID-19. Thankfully I am fully vaccinated &amp; boosted. I'm confident that the vaccine will allow for a swift recovery. https://t.co/jFvQNZ4qQvVaccines are free &amp; effective. Find a center near you: https://t.co/q94BYloHSD",en
2022-05-23 17:57:59+00:00,81179597,"Here are the issues with what Jones and some others have been claiming about the AstraZeneca and Johnson &amp; Johnson Covid-19 vaccines, writes @bruce_y_lee for @Forbes. https://t.co/NfIOKTvJZB",en
2022-05-23 17:57:56+00:00,3534222021,(The Independent):#Alex #Jones promotes false conspiracy that monkeypox outbreak is due to Covid-19 vaccines : The monkeypox outbreak theory is just the latest unproven claim to be promoted by the anti-vaxer .. https://t.co/VUMBm51eQM,en
2022-05-23 17:57:43+00:00,1518927208332632064,Researcher: ‘We Made a Big Mistake’ on COVID-19 Vaccine https://t.co/4hok8gbmI8,en
2022-05-23 17:57:42+00:00,1491030714695012353,"@ArtysHouse @AdventureTazy @KatieM12121 ""Bullous pemphigoid after second dose of mRNA- (Pfizer-BioNTech) Covid-19 vaccine: A case report""https://t.co/wPB79GEHMJ",en
2022-05-23 17:57:16+00:00,21521950,"Three Doses of Pfizer's Covid-19 Vaccine 80% Effective in Young Children, Company Says  https://t.co/rEacjeRCQl",en
2022-05-23 17:57:14+00:00,191615018,"Air Force Cadets To Receive Degree, No Commission Over COVID-19 Vaccine Refusal https://t.co/Gph8mmjx11",en
2022-05-23 17:56:59+00:00,1475054452377899018,"Did Moderna Trial Data Predict ‘Pandemic of the Vaccinated?“A new study based on Moderna’s Phase 3 clinical trial data suggests recipients of Moderna’s COVID-19 vaccine may be more likely to suffer repeated infections, perhaps indefinitely.”https://t.co/L4ay8ZEUfJ",en
2022-05-23 17:56:05+00:00,158862523,"As COVID-19 rates continue a months-long climb, officials are urging vaccines, boosters and to consider altering large school gatherings. https://t.co/qWedTW5eMR",en
2022-05-23 17:55:24+00:00,1486227574598483970,"Pfizer has been flush with cash in recent quarters, thanks in part to sales of its COVID-19 vaccine and now its pill treatment for the virus, Paxlovid. https://t.co/6RqFCoxhg4Pfizer to spend $11.6B on migraine treatment maker BiohavenPfizer is spending $11.6 billion to buy t... https://t.co/5OdMlJwqbI",en
2022-05-23 17:55:23+00:00,635331334,@CNBC Pfizer has left over vaccines which they don’t know what to do with or how to market. COVID-19 is over no one wants the 3rd shot.,en
2022-05-23 17:54:59+00:00,1151261114384171008,"Air Force Cadets Who Refused Vaccine Will Not be CommissionedThree cadets at the Air Force Academy who refused the Covid-19 vaccine will not be commissioned as officers upon graduating, according to a report in the New York Post.https://t.co/AEwHLvGzGb",en
2022-05-23 17:54:49+00:00,1248362036611944456,I was supportive of a cautiously expedited vaccine EUA for older people who were at risk of covid-19.But what are we doing now?Clinical data for 10 kids is sufficient?No data on severe outcomes?No data on prior infection?This isn't science anymore. It's dogma.,en
2022-05-23 17:54:37+00:00,165869074,"As COVID-19 rates continue a months-long climb, officials are urging vaccines, boosters and to consider altering large school gatherings. https://t.co/qWFxqOO3Qf",en
2022-05-23 17:54:16+00:00,1250156125053423619,Covid-19 Live Updates: Pfizer Vaccines and More News - The New York Times https://t.co/9WQZldjVOX,en
2022-05-23 17:53:51+00:00,41046031,Officials expected to decide on new COVID-19 vaccine design in early July - ABC News - https://t.co/kp7rjy8GnW via @ABC,en
2022-05-23 17:53:41+00:00,1346606089031176192,Don't miss your shot! Get your vaccine this week.#VaccinesSaveLivesNo deje de vacunarse. Ve a ponerte la vacuna esta semana.#VacunasSalvanVidasCOVID-19 and Flu Shots available. Vacunas de COVID-19 y del Flu disponibles. https://t.co/I6OSIkcqso,en
2022-05-23 17:52:47+00:00,878018761432977409,Covid-19 cases are on the rise and the US is running out of vaccine and antiviral funding - Vox https://t.co/8XMgHILUzK,en
2022-05-23 17:52:37+00:00,169963553,The examples of flu and COVID-19 vaccines procurement show that the flexibility built into procurement procedures has enabled WTO GPA signatories to respond to opposed market and health situations. Find out more in the new #WTOGPA Insights Series 👉 https://t.co/1ok41IyKgY https://t.co/IUsrkpvG9m,en
2022-05-23 17:51:33+00:00,1335275589247197187,"https://t.co/pkq16qmn1u EU approves AstraZeneca's COVID-19 vaccine as booster shot.On May 23, British/Swedish multinational pharmaceutical company AstraZeneca said  that its COVID-19 vaccine Vaxzevria has been approved by the European Medicines Agency (EMA) as a booster.....",en
2022-05-23 17:50:13+00:00,263363120,Will you vaccinate your young children against Covid-19? The @nytimes is looking for parent reactions to the news that three doses of Pfizer's vaccine seem to work well in children under 5. https://t.co/dML7cybsyt,en
2022-05-23 17:49:54+00:00,190337035,"COVID‐19 vaccine effectiveness in patients with hematologic malignancy [May 18, 2022] @DrDimpyShah @Dr_Pankil_Shah @mtmdphd Transplant ID https://t.co/oSy3pwAzP8 #COVID19Vaccine #COVID19nCancer #bmtsm #leusm #lymsm #mmsm #mpnsm #IDonc",en
2022-05-23 17:49:30+00:00,35829818,"In long-awaited data, Pfizer said its 3-dose vaccine was 80% effective against symptomatic omicron COVID-19 infection in children 6 mos.-5 yrs.Q: Why in the literal HELL ON EARTH would you give a bot shot to a child with a 99% chance of natural recovery?https://t.co/kwwakiDjC3",en
2022-05-23 17:49:10+00:00,158794559,"As COVID-19 rates continue a months-long climb, officials are urging vaccines, boosters and to consider altering large school gatherings. https://t.co/zroCPekpIG",en
2022-05-23 17:48:35+00:00,806675383013806080,"The Daily Beast: Pfizer COVID-19 Vaccine 80% Effective in Young Kids After 3 Shots, Companies Say.https://t.co/1iTweyaIuyvia @GoogleNews",en
2022-05-23 17:48:08+00:00,158795174,"As COVID-19 rates continue a months-long climb, officials are urging vaccines, boosters and to consider altering large school gatherings. https://t.co/UBAP2y1842",en
2022-05-23 17:47:02+00:00,891529310757986304,"Free COVID-19 Vaccine, Booster Shots &amp; At Home Testing Kits 10am to 1pm https://t.co/5a2ZAsX5Tf",en
2022-05-23 17:46:50+00:00,1475671816559640579,"President Biden said Monday that the U.S. has enough vaccines to deal with a possible monkeypox outbreak and said the situation does not rise ‘to the level of the kind of concern that existed with COVID-19,’ @USATODAY reports: https://t.co/8yvN8nBscd",en
2022-05-23 17:46:36+00:00,1415358899633414150,"@Dr89120 Was China aware of ""Monkeypox"" long time ago? Why are they always running ahead of time same as Covid-19 vaccine in China (first vaccine was available on Feb 26, 2020 but Wuhan virus outbreak was in Jan 2020), what is linkage in between? dropped again?https://t.co/Y1NHhshZvk",en
2022-05-23 17:46:31+00:00,35829818,"In long-awaited data, Pfizer said its 3-dose vaccine was 80% effective against symptomatic omicron COVID-19 infection in children 6 mos.-5 yrs.Q: Why in the literal HELL ON EARTH would you give a bot shot to a child with a 99% chance of natural recovery?https://t.co/kwwakilanV",en
2022-05-23 17:46:27+00:00,497562702,"Kids 0-5 *still* do not have a COVID-19 vaccine! Wrote this for ⁦@Zocdoc⁩ on the latest vaccine news for little kids.🐣(And to parents of littles, WOW - kudos for staying strong and holding onto your sanity while this wait just drags on 😞) https://t.co/Amuaqrclo8",en
2022-05-23 17:46:25+00:00,1028743871965134849,"Good news finally as a 3 dose vaccine for 5 years &amp; under. Pfizer vaccine: Three-dose Covid-19 vaccine produces strong immune response in young children, Pfizer and BioNTech say - CNN https://t.co/XXcspLhRPX",en
2022-05-23 17:45:51+00:00,1518672236093210624,Arizona Governor Approves Ban on School COVID-19 Vaccine Mandates https://t.co/ysT0OGGBx5,en
2022-05-23 17:45:43+00:00,409247305,"@greg_price11 @RyanAFournier how about:""There is clear evidence that current vaccines are indisputedy significantly protective against Omicron variant for persons that have previously contracted COVID-19.""CDC is broadbrushing data on alpha &amp; delta for the unvax'd/uninfect'd to make ""protective"" statements",en
2022-05-23 17:45:12+00:00,750175692,"As COVID-19 rates continue a months-long climb, officials are urging vaccines, boosters and to consider altering large school gatherings. https://t.co/9gDxceDiC3",en
2022-05-23 17:45:08+00:00,821592481,Covid-19 Live Updates: Pfizer Vaccines and More News | #coronavirus | #kids. | #children | #schools https://t.co/NFyyyfoPul,en
2022-05-23 17:45:00+00:00,45488011,"If Pfizer's data pans out, when will little kids get the COVID-19 vaccine?https://t.co/PYFT0NbY7Z",en
2022-05-23 17:44:15+00:00,38142380,"Three doses of Pfizer’s Covid-19 vaccine will offer strong protection for children younger than 5, the company announced  https://t.co/pO6VEyZ9Hk",en
2022-05-23 17:44:02+00:00,14327705,"'Three cadets at the U.S. Air Force Academy who have refused the Covid-19 vaccine will not be commissioned as military officers but will graduate with bachelor’s degrees, the academy said Saturday.'What about their college costs paid by US?https://t.co/J98X1po3v3 via @nbcnews",en
2022-05-23 17:41:35+00:00,22597864,"@07HDSB You seem to be ignoring my argument completely. Does Alberta have the raw data set available for Covid-19 deaths broken down by age and vaccination status? If you can tell me where to download it, I promise you I can walk through it to prove that vaccines are highly effective.",en
2022-05-23 17:41:16+00:00,1518735712727838727,"Monkeypox Scandal EXPOSED - Proof It Was Planned For May '22The Covid 19 virus has been a vehicle for governments to impose restrictions on civil liberties of its citizens, including intimidation to force vaccines.https://t.co/azouMzzXyy",en
2022-05-23 17:40:29+00:00,39355100,Minnesotans share horror stories of alleged COVID-19 vaccine injuries https://t.co/SkB7c1VWvT via @YouTube,en
2022-05-23 17:40:20+00:00,15108530,"U.S. FDA sets June meeting dates for Moderna, Pfizer small children COVID-19 vaccines https://t.co/EirQW9owlV https://t.co/EfvHpCxd5U",en
2022-05-23 17:40:02+00:00,1526238913450450944,"Air Force Cadets To Receive Degree, No Commission Over COVID-19 Vaccine Refusal https://t.co/pWBPG9ePvf - SO SAD! STOP FORCED COVID Vaccine @usairforce",en
2022-05-23 17:40:00+00:00,171514805,All Ohio Managed Care (Medicaid)/My Care members:  ✔️age 5+ who receive their 1st dose of the COVID-19 vaccine between 6/15/2021-6/30/2022 OR✔️age 12+ who receive their COVID-19 booster shot between 4/1/2022-6/30/2022Will receive a $100 incentive! https://t.co/qhiJCAiirE,en
2022-05-23 17:38:00+00:00,18941920,Pfizer says three small doses of its COVID-19 vaccine protect kids under 5 and that it plans to give the data to U.S. regulators later this week. https://t.co/WiiHySp44K,en
2022-05-23 17:37:28+00:00,65101419,Pediatric COVID-19 vaccines are here 🙌,en
