date,userid,tweet,lang
2022-01-01 23:59:25+00:00,97548523,‘Church of Ubuntu’ sacks worker for getting COVID-19 vaccine @smh_andrew https://t.co/CqSZLiqf7b,en
2022-01-01 23:58:20+00:00,289118612,DON’T PITY THE FOOLAnti-vaccine Christian broadcaster Marcus Lamb dies at age 64 after contracting Covid-19. https://t.co/7Ur0zsZ1NZ 04,en
2022-01-01 23:58:20+00:00,750513752,"Safe, streamlined, low-cost vaccines for middle- to low-income countries central to world fight vs COVID-19. Without widespread vaccination of popns in Global South, additional variants will arise, hindering progress achieved by vaccines available in US &amp; other Western countries.",en
2022-01-01 23:57:44+00:00,1440198971352182791,Answer to Could there be a Covid-19 vaccine that even those against the vaccine would like? by Roger Cook https://t.co/J0E3P1kARI,en
2022-01-01 23:56:46+00:00,955518551695220736,Sometimes #twitter does the work for you. #vaccines #Covid_19 #MensHealth #OmicronVarient https://t.co/RsWhKvkb5V,en
2022-01-01 23:55:02+00:00,1288888623480410116,"Louisiana COVID-19 hospitalizations double in one week, vaccines urged https://t.co/IOqLZSvI4x https://t.co/wTLKLanPlQ",en
2022-01-01 23:53:13+00:00,750513752,Texas Children’s Hospital and Baylor College of Medicine COVID-19 Vaccine Technology Secures Emergency Use Authorization in India https://t.co/eJkYZD36Ag,en
2022-01-01 23:53:01+00:00,19615058,‘Deep’ Thinker SCOTT ‘WINO’ WEINRICH Says COVID-19 Vaccines Are Not Real Vaccines https://t.co/rZ7CfYzM77,en
2022-01-01 23:52:52+00:00,921400462838042624,"Vaccine Effectiveness against COVID-19 among Symptomatic Persons Aged &gt;=12 Years with Reported Contact with COVID-19 Cases, February - September 2021  https://t.co/XLG6w1zeD0 #medRxiv",en
2022-01-01 23:52:38+00:00,807205741,"@HollyKai2 @MJLEGIOX @BernieSpofforth It may not be in ""your"" best interest but it is in the best interest of humanity for every person on Earth that is eligible, to get the Covid-19 vaccines. Yes there are exceptions but the vast majority who can get them, should.",en
2022-01-01 23:52:30+00:00,1195389607166324737,"TWiV 848 🩺 In COVID-19 clinical update #95, Daniel Griffin discusses new CDC guidelines for isolation &amp; quarantine, EUA for Molnupiravir, vaccine safety in 5-11 year olds, Omicron outbreaks in Nebraska and Denmark, Baylor’s COVID vaccine &amp; more. 📺 https://t.co/eyYGinlojZ https://t.co/MgqyBbMniz",en
2022-01-01 23:52:13+00:00,235924730,"If you enjoyed the @joerogan podcast with Dr. Robert Malone, also check out episode #1717 with Alex Berenson.  Equally as informative about what’s going on with #vaccines and #Covid_19.",en
2022-01-01 23:51:38+00:00,635867372,"@ksorbs Alabama man dies after 43 hospitals with full ICUs turned him away; family urges COVID-19 vaccinesThe family of an Alabama man who died of heart issues more than 200 miles from his home is asking people to get vaccinated...""https://t.co/7Rbhzh60VS?",en
2022-01-01 23:51:21+00:00,1379088512155324419,Covid-19 vaccinations: African nations miss WHO target #vaccine  https://t.co/aOi5tMksFe,en
2022-01-01 23:51:10+00:00,1331989924149653507,"The problem with @chiproytx  is that 824,000 Americans have died from Covid-19. Vax is your duty as an American. You do it to protect your co-workers, your family, and yourself. Vaxes required in the military, or you're out. Children get the polio and measles vaccine as mandatory",en
2022-01-01 23:50:51+00:00,2761595046,@NordicNomadEsq @h_appleby Is that what Pfizer was doing when they said the vaccine would prevent Covid-19? https://t.co/XO8ZyP8GPx,en
2022-01-01 23:50:33+00:00,1418338769527312386,#RestoreMaloneNow@RWMaloneMD is being canceled for “promoting vaccine hesitancy”. He’s a scientist and it’s crucial in his field to be constantly hesitant and distrustful. Big Tech and Pharma have loved COVID-19. Don’t let them silence truth,en
2022-01-01 23:50:00+00:00,16425419,Here are the COVID-19 vaccine pop-up clinics taking place around San Antonio.  https://t.co/JR9oOC0njB,en
2022-01-01 23:49:13+00:00,1674122750,Cell fusion as backup mechanism to covid19 spread and survival versus ace2 binding.  Long covid implications and evolution for immune evasion? #covid19 #medicine #vaccine #Covid_19 #Omicron #breaking https://t.co/3CRBwJs0pG,en
2022-01-01 23:47:45+00:00,139891948,CDC study: COVID-19 vaccine rarely caused serious problems in kids aged 5 to 11 https://t.co/i4KmWp7hEf,en
2022-01-01 23:46:33+00:00,976098246882885634,"There are currently 51candidatesOut of which, 10 candidates are in phase 3.#coronavirus #COVID #Covid-19 #vaccine #vaccines #vaccinationUse #telegram and add bot 'CoronaTrackerNepal_bot' to get details and notifications.Source: https://t.co/HmUwd0efIQ",en
2022-01-01 23:46:06+00:00,3060790364,"Is the COVID-19 Vaccine Trustworthy? – A Biblical Conversation about Sci... https://t.co/XnUTqZ9zUP via @YouTubeA church with a common sense appeal to Vaccine; intelligent, thorough &amp; comprehensive both scientific &amp; biblical perspective with empathy for the community at large.",en
2022-01-01 23:45:35+00:00,469661898,New York Times Editor Dies Just One Day After Getting Moderna Covid-19 Booster Vaccine https://t.co/pFiep5AECh,en
2022-01-01 23:45:20+00:00,928629589152337920,"Chief Nerd, [Jan 1, 2022 at 22:19]The Australian government has admitted there have been at least 79,000 COVID-19 vaccine side effects and is now offering compensation to those seriously injured https://t.co/gA5l2xnO6q@ChiefNerd https://t.co/MCiKhmevtA",en
2022-01-01 23:44:42+00:00,2774095489,"Our new preprint dropped:Early signals of significantly increased vaccine breakthrough, decreased hospitalization rates, and less severe disease in patients with COVID-19 caused by the Omicron variant of SARS-CoV-2 in Houston, Texas https://t.co/ik4O9rmz04",en
2022-01-01 23:44:32+00:00,1251421953296003072,"Bellflower City Hall - Kiosk, By Appointment Only16600 Civic Center Drive, Bellflower, CAOpen: 7:30 am - 4:00 pm44 Slots Available Tuesday Fulgent COVID-19 Testing and Vaccine Search https://t.co/PrcVmMfIaS",en
2022-01-01 23:43:29+00:00,1432239323378708483,"79,000 cases....Australia now is compensating COVID-19 vaccine patients for serious adverse events. Australian news reports that the COVID-19 vaccines have led to at https://t.co/rUBHDdpBbg",en
2022-01-01 23:41:35+00:00,534826529,"Global Perspective of COVID-19 Vaccine Nationalism https://t.co/7KmZmJ20Uf""",en
2022-01-01 23:41:34+00:00,534826529,"Predicting the impact of COVID-19 vaccination campaigns - a flexible age-dependent, spatially-stratified predictive model, accounting for multiple viral variants and vaccines https://t.co/Jw8QbiE44i""",en
2022-01-01 23:41:32+00:00,534826529,"Effectiveness of COVID-19 vaccines against Omicron or Delta infection https://t.co/DtlDtayh3k""",en
2022-01-01 23:40:22+00:00,584871749,"@veritanonbugia @whereinmyworld @RADarkoMD Liar.  ""Based on the totality of scientific evidence available, do the benefits of the Pfizer- BioNTech Covid-19 vaccine when administered as a 2-dose series (10 micrograms each dose, 3 weeks apart) outweigh its risks for use in children 5-11 years of age?Yes: 17No: 0""",en
2022-01-01 23:40:13+00:00,14810786,"RT @KLFY ""More than 200 Marines separated for refusing COVID-19 vaccine https://t.co/mScnPfjJz2""",en
2022-01-01 23:40:06+00:00,825732773856047106,@sunandsandrule @Gailisgailis1 @JemNicoleRN Cocktails of drugs to survive. Many on ventilators. Many left with long covid too. The risks from covid 19 on pregnant women is just too significant . They need vaccines !,en
2022-01-01 23:40:05+00:00,247460595,"A few days ago we brought you the story of this jerk who refused to certify the county’s election after Joe Biden won. He also spewed the nonsense that COVID-19 and vaccines were a government plot of some sort. So, not a good guy at all.  https://t.co/LCgBqJV8m6",en
2022-01-01 23:39:58+00:00,1087885393440182272,"@TroyGre82110819 @oilbaroness @TheUSASingers Unvaccinated have the risk of COVID- 19, but vaccinated have both: risk of getting  Covid-19 AND the risk  of vaccines side effects.",en
2022-01-01 23:39:44+00:00,256721085,Vaccines and variants mark a turbulent year of COVID-19 in Illinois. https://t.co/RNMyog7R0q via @dailyherald,en
2022-01-01 23:38:29+00:00,584871749,"@veritanonbugia @GYamey @RADarkoMD The vote:""Based on the totality of scientific evidence available, do the benefits of the Pfizer- BioNTech Covid-19 vaccine when administered as a 2-dose series (10 micrograms each dose, 3 weeks apart) outweigh its risks for use in children 5-11 years of age?Yes: 17No: 0""",en
2022-01-01 23:38:08+00:00,921400462838042624,"Predicting the impact of COVID-19 vaccination campaigns - a flexible age-dependent, spatially-stratified predictive model, accounting for multiple viral variants and vaccines  https://t.co/DYbYENmG4s #medRxiv",en
2022-01-01 23:38:04+00:00,921400462838042624,Global Perspective of COVID-19 Vaccine Nationalism  https://t.co/Zoz0ez8NL8 #medRxiv,en
2022-01-01 23:37:55+00:00,921400462838042624,Effectiveness of COVID-19 vaccines against Omicron or Delta infection  https://t.co/3tA28S831y #medRxiv,en
2022-01-01 23:37:51+00:00,1281571246401032192,"@andreagail_k @SwaggyPikachu @xbraap @Hippotastic1 @NiaSpeaks_ @JesseKellyDC Millions of people die every day from preventable things. Never gave a shit before 2019 and I still don’t now. 70-80% of Covid-19 hospitalizations are people who are obese but instead of running nationwide diet and exercise campaigns, we’re pushing for vaccines. Follow the money.",en
2022-01-01 23:37:35+00:00,16019697,"MSU will start to require proof of vaccination or a negative COVID-19 test to participate in on-campus arts events beginning Jan. 4. MSU students, faculty and staff will only need to show their MSU ID as proof of compliance with the vaccine mandate. https://t.co/KTfmtSllsN",en
2022-01-01 23:37:35+00:00,15577108,"The latest Covid-19 numbers, hospitalisations and vaccine data will be released by the Ministry of Health from 1pm. https://t.co/r0b7blYQb9",en
2022-01-01 23:37:20+00:00,22522919,More than 200 Marines separated for refusing COVID-19 vaccine https://t.co/5ADFnEt1cf,en
2022-01-01 23:37:08+00:00,2376970800,Over 1.4cr adolescents in UP eligible for Covid-19 vaccine https://t.co/B9rd4Fd1WB,en
2022-01-01 23:36:47+00:00,928629589152337920,"Chief Nerd, [Jan 1, 2022 at 22:19]The Australian government has admitted there have been at least 79,000 COVID-19 vaccine side effects and is now offering compensation to those seriously injured https://t.co/gA5l2xnO6q@ChiefNerd https://t.co/PMlbQgcegC",en
2022-01-01 23:36:46+00:00,1040979248134144000,"This dude is in a country store talking to the owners while they’re making food. “My buddy just died today from COVID-19, and I lost my dad too a few months back to it. The shit is real and it sucks.” Then proceeds to say how he won’t get the vaccine, and refuses to wear a mask.",en
2022-01-01 23:36:30+00:00,38817939,@lorearchie1 Tons of people getting Covid 19  despite their vaunted vaccines that one dare not ridicule. https://t.co/0ekkA7psiw,en
2022-01-01 23:35:19+00:00,121333842,Investigation Has Launched After Three-Year-Old Girl Dies From Cardiac Arrest One Day After Receiving COVID-19 Vaccine in Argentina https://t.co/YyYGEHvafY,en
2022-01-01 23:35:00+00:00,33502398,"Novavax Inc. said it filed data Friday with the Food and Drug Administration to support clearance of its long-anticipated COVID-19 vaccine, a different kind of shot than current U.S. options. https://t.co/aoiDTlVcAw",en
2022-01-01 23:34:58+00:00,39285270,When people say oh the vaccine was never meant to stop you from getting the virus … let them watch this and then tell you #Covid_19 https://t.co/6MFrG2SJl8,en
2022-01-01 23:34:31+00:00,14537566,"At the very least they were wrong about EVERYTHING since the vaccine rollout. It's okay to question what goes into your body, especially since the narrative keeps changing.Narrative- 100% safe- Cannot be infected or spread after vax- Boosters, I guess 🤷‍♂️#COVID19 #Covid_19 https://t.co/LGmm0nZok4",en
2022-01-01 23:34:02+00:00,3152216312,#Health #News Over 200 Marines Separated For Refusing COVID-19 Vaccine https://t.co/i2FvCVHrpU,en
2022-01-01 23:32:45+00:00,2489007720,"Don't Look Up is such a perfect commentary on everything we are dealing with : COVID-19/pandemic, vaccine hesitancy, climate change, our dependency on oil/fossil fuels",en
2022-01-01 23:32:22+00:00,1333667947047370758,"@AlbertBourla Oh my goodness  didn't you read your own link! He Did NOT say 100% effective. He Said QUOTE ""91.3% vaccine efficacy observed against COVID-19'.""Did you just post someone else's link,? you should be more careful.Maybe let them know they're spreading false info.",en
2022-01-01 23:32:04+00:00,17130917,"Michigan Athletics sets COVID-19 vaccine, testing policy for indoor sporting events https://t.co/rLBVJYyC0X",en
2022-01-01 23:29:37+00:00,41626609,"medRxiv: Early signals of significantly increased vaccine breakthrough, decreased hospitalization rates, and less severe disease in patients with COVID-19 caused by the Omicron variant of SARS-CoV-2 in Houston, Texas https://t.co/dfe0eLolpM https://t.co/cmQCNoPFmV",en
2022-01-01 23:29:29+00:00,1387096409225187333,The Infowars host Alex Jones slammed Trump's social-media network and called him 'pathetic' for supporting the COVID-19 vaccine https://t.co/DLgqvb3prj,en
2022-01-01 23:29:05+00:00,8795772,"Michigan Athletics sets COVID-19 vaccine, testing policy for indoor sporting events https://t.co/NTb8P4WFi1",en
2022-01-01 23:28:57+00:00,241792442,"@Joeycules @trustyrusty3 @TPRNews Cost of monoclonal antibody treatment to government is $3,000 to $5,000 per dose. The cost of COVID-19 to government for Pfizer vaccine is $24 per shot. The vaccine is fully approved by FDA the antibody treatment is experimental and is an ineffective treatment for omicron virus.",en
2022-01-01 23:28:47+00:00,971169901,"In my brief conversation with him, Elrich sounded a little tired, but said he was trying to have a sense of humor over his positive COVID-19 test. He also emphasized his belief in the vaccine, in preventing serious illness from the virus.",en
2022-01-01 23:28:23+00:00,253536859,Biden adviser’s brother to lobby for Taiwanese company that made a COVID-19 vaccine | Fox Business https://t.co/F4WfS2qnp4,en
2022-01-01 23:27:39+00:00,1472012379512872970,"@totalylosthere Dude my grandpa had stomach pains and he couldn't see a doctor because of covid-19, he has his vaccines but couldn't see a doctor.",en
2022-01-01 23:27:31+00:00,1534231406,"@babaerodati How many is madami exactly, can you compare the number to how many Covid death related to when Covid-19 vaccine was not invented?",en
2022-01-01 23:26:00+00:00,49173925,"World renowned physician and scientist, vaccine and infectious disease expert @PeterHotez has offered to go on the show to discuss COVID-19, and of course mcafee goes for the dude that plays a sex dr on tv",en
2022-01-01 23:25:36+00:00,921598674,@20naomijess21 @BumpstockBarbie Unless you have specific conditions that make COVID-19 particularly dangerous the vaccines are not very effective. People like you that posses little to no scientific knowledge are dangerous to everyone.,en
2022-01-01 23:24:27+00:00,208307373,"@StribGuy @covid_clarity You used the word credible, I see a sales pitch.I see no evidence to compel me to get the Covid 19 vaccine.  I see enough evidence to suggest the vaccine is not as safe as purported.I've been vaccinated to experience every third world dumpster on the planet and had Covid.",en
2022-01-01 23:23:59+00:00,36287570,COVID-19 vaccine hesitancy and media channel use in Japan: could media campaigns be a possible solution? https://t.co/DnQnMvYVxc,en
2022-01-01 23:23:39+00:00,1059534182,"@SpookyCy How long have you been sick for? And where you extremely symptomatic? I'm really worried. I'm vaxxed + boosted AND had Covid-19 Dec 2020.. I was so sick for over a month. I'm worried even with ""natural antibodies"" and all these vaccines I won't be good still",en
2022-01-01 23:23:33+00:00,50730375,"@TheEStreetJ @coachmattgymrat @vwurbs @AdiaBarnes What is a small sacrifice?  Omicron is 140 x more transmissible than the original COVID-19.  Only N95 masks will do anything.  Cloth masks are useless, according to the CDC, &amp; vaccine/ booster shots aren't making much of a difference in transmission either.  What do you want?",en
2022-01-01 23:23:13+00:00,793501220,Another conservative media personality has died of COVID-19 after hating on vaccines https://t.co/QwOCFQrvPo,en
2022-01-01 23:23:12+00:00,573240324,There is no Covid 19 control plan at the minute. What passes for a plan is just a scheme to make it look like cases are coming down. RAT tests are fine but need to be available and affordable or free. To recommend them and not have them availabl is the same as the vaccine rollout,en
2022-01-01 23:22:50+00:00,1311392224115142657,"COVID-19 is been hard for everybody,My wife she tested positive for Covid-19,I’m to,My only problems is that I can’t get tested because I don’t have health card ,I only have one vaccine so far, I got the test when I was in jail,God Bless everyone.",en
2022-01-01 23:22:14+00:00,3045127582,My God..😟😥A man has set himself and his car on fire in front of horrified diners while screaming about Victoria's Covid-19 vaccine mandates. https://t.co/J5qcHXsLLA,en
2022-01-01 23:20:23+00:00,38817939,@lorearchie1 No Lorraine. I don't trust it. Maybe for at risk people who haven't already had Covid. I referred to Hydroxycloraquine or Ivermectin &amp; zinc. Regarding Covid 19 vaccines for youth? CRIMINAL. Worried about Covid?  You got a Vaccine but don't force it on me nor on my kids.,en
2022-01-01 23:19:56+00:00,1428749963731738632,"Happy New Year! Challenging year, but we can be grateful for robust vaccines and treatment modalities: 1918 Spanish Flu, 50 million deaths (global population: 1.8 billion); COVID-19, 5.4 million deaths (global population: 7.7 billion). https://t.co/GLCfwYNl9M",en
2022-01-01 23:19:15+00:00,1220577325051449346,@TheUSASingers Trump dubbed the Covid-19 vaccines as “one of the greatest achievements of mankind.” Are you saying that you don't believe that?,en
2022-01-01 23:18:50+00:00,976327411058044928,"Early signals of significantly increased vaccine breakthrough, decreased hospitalization rates, and less severe disease in patients with COVID-19 caused by the Omicron variant of SARS-CoV-2 in Houston, Texas https://t.co/gZYF1yQBAX",en
2022-01-01 23:16:50+00:00,1094459046680133632,"Not to judge, but if you haven't had COVID-19, then the choice right now is effectively between having a vaccine and getting infected with omicron. Only one of those choices has no COVID virus in it, and it's not omicron. https://t.co/MkD4no0gOf",en
2022-01-01 23:15:53+00:00,1244697275865186305,"@Livelifejoyful2 @ajz6383 @magoo_maga @TommyDoubter @danedneymd Can Omicron Evade COVID Vaccines?Experts say they aren't sure if the omicron variant can evade the existing COVID-19 vaccines or natural antibodies.""WE JUST DON'T KNOW"" said Dr. David Hamer, an infectious disease specialist at Boston Medical Center.",en
2022-01-01 23:13:10+00:00,1464749516033253376,"Dr. Steve Hotze: COVID-19 ""vaccine"" is NOT a vaccine, but a dangerous experimental gene therapy. https://t.co/Y8FtsgILyg via @BitChute",en
2022-01-01 23:13:04+00:00,259976170,Our heroes working to Stop Covid-19 Vaccine Mandates for Healthy K-12:https://t.co/al4yjiw9zB,en
2022-01-01 23:12:54+00:00,1093727980428226560,Moderna Covid 19 vaccine now available at Desoto Family Care Clinic!CALL US AT 662-510-5353 to set your appointment ! https://t.co/WkG4KyH8Dp,en
2022-01-01 23:11:59+00:00,3903346112,"@JDVance1 What is this “got the jab” crap?!   Let’s create a little chart, JD: one column is the number of people who have died from Covid-19; the other is those who have died as a@result of taking the vaccine for Covid-19.  But we really don’t need to do that, do we.",en
2022-01-01 23:11:54+00:00,555450691,Is This Irrefutable Proof The COVID-19 Vaccines Are Killing People? [VIDEO] https://t.co/UZjNXmJGdP via @redvoicemedias,en
2022-01-01 23:11:21+00:00,534826529,"Humoral immune responses against SARS-CoV-2 variants including omicron in solid organ transplant recipients after three doses of a COVID-19 mRNA vaccine https://t.co/sUot4AZCIH""",en
2022-01-01 23:11:15+00:00,725153625832484865,The moral peril of taking most COVID-19 vaccines - LifeSite https://t.co/N4WwikEnHP,en
2022-01-01 23:11:09+00:00,255340030,"AZ announces 23% revenue growth to $15.54 billion in 1st half of 2021, 2nd quarter growth of 31% to $8.22 billion. When sales of its COVID-19 vaccine (Vaxzervria) are excluded, revenue increased 14% in H1 to $14.37 billion, 17% in Q2 to $7.33 billion.https://t.co/kZcb78FnfM",en
2022-01-01 23:11:02+00:00,167880395,"@MichaelRosenYes Ppl shld watch the 3 Ryl Inst Xmas lectures on BBC iPlayer. They explain all abt the virus, antibodies, testing, vaccines etc. Very interesting &amp; I highly recommend you watch it.#Covid_19 #Omicron #CovidTesting #CovidVaccine",en
2022-01-01 23:10:29+00:00,1453270633,Biden administration asks Supreme Court to uphold Covid-19 workplace vaccine policies #NewsBreak https://t.co/0BJAN7JynP,en
2022-01-01 23:10:14+00:00,1471811607986585600,A man has lit himself on fire in front of horrified diners in Richmond on Saturday while screaming about Victoria's Covid-19 vaccine mandates.,en
2022-01-01 23:10:12+00:00,910707507366027265,@bravo90092212 @letuspraytoGod You need to meet eligibility requirements to get financial support under the COVID-19 vaccine claims scheme.Who can get it？https://t.co/RmjieRImci,en
2022-01-01 23:09:55+00:00,19416232,"The vaccine does not prevent contraction or transmission of the virus, but it drastically reduces the effects of Covid-19. With Omicron, this is leading to infected people with little to no symptoms. 2/#covid19nfld",en
2022-01-01 23:09:42+00:00,921400462838042624,Humoral immune responses against SARS-CoV-2 variants including omicron in solid organ transplant recipients after three doses of a COVID-19 mRNA vaccine  https://t.co/9d2RnqX0m8 #medRxiv,en
2022-01-01 23:08:22+00:00,900695816,"@Malinowski We also need federal support for research into new and improved vaccines and treatments, including for the growing problem of #LongCovid, and support for those disabled by this disease. Will you cosponsor the Cures 2.0 Act (HR 6000) and the COVID-19 Long Haulers Act (HR 2754)?",en
2022-01-01 23:08:09+00:00,1438080231882084353,@l_means @BernieSpofforth It's simple. If enough people get COVID-19 around the same time the pandemic is over. So you think they can fully develop a vaccine for a virus they never knew is existed in 9 months but they can't manipulate a virus to be more allusive in 2 years?,en
2022-01-01 23:06:08+00:00,534826529,"Early signals of significantly increased vaccine breakthrough, decreased hospitalization rates, and less severe disease in patients with COVID-19 caused by the Omicron variant of SARS-CoV-2 in Houston, Texas https://t.co/Nov8XPefhu""",en
2022-01-01 23:05:56+00:00,921400462838042624,"Early signals of significantly increased vaccine breakthrough, decreased hospitalization rates, and less severe disease in patients with COVID-19 caused by the Omicron variant of SARS-CoV-2 in Houston, Texas  https://t.co/vHwObfSPEI #medRxiv",en
2022-01-01 23:04:45+00:00,134299459,@GregAbbott_TX The Abbott Administration has fought all mask and vaccine mandates when they are needed most.The rest of the USA is urging the Texas gov't to step up in this fight &amp; provide the guidance and mandates necessary to help protect Texans &amp; mitigate the spread of COVID-19.,en
2022-01-01 23:04:09+00:00,1034274425674362886,Bradley Beal Speaks On Why He Finally Got The COVID-19 Vaccine https://t.co/uDO4sYG3Jp,en
2022-01-01 23:03:34+00:00,1360647301342060545,@ruiz20059 Sure. If you belong to an organized religion who’s leader had already prohibited ALL vaccines pre-Covid-19. Like the Pope or Dali Lama,en
2022-01-01 23:03:01+00:00,1453270633,A right-wing radio host said Trump needs an 'intervention from a friend' after the former president advocated for the COVID-19 vaccine #NewsBreak https://t.co/qfOe4BRfER,en
2022-01-01 23:02:01+00:00,1119900799105228801,😷 Novavax Submits Final Data Packages to U.S. FDA as Prerequisite to Emergency Use Authorization Application Request for COVID-19 Vaccine - Yahoo Finance 👉 https://t.co/qOVVNOENVe 💊 #Medical #GroupZirigoza,en
2022-01-01 23:01:41+00:00,1332939078036287490,Understanding mRNA COVID-19 Vaccines https://t.co/a2lxWJbOZg via @CDCgov,en
2022-01-01 23:01:24+00:00,525010943,COVID-19 vaccines for animals: Will we need to vaccinate our cats and do...  https://t.co/fibsGOuTGm via @YouTube,en
2022-01-01 23:01:03+00:00,17781471,"Both locally and nationally, the intensive research and aggressive rollout of vaccines in 2021 provided significantly more protection and created a path for adapting to COVID-19 in the future.https://t.co/zn9ZKTCLJB",en
2022-01-01 23:01:03+00:00,1477162042876477441,"@JustinTrudeau You recently violated section 319(2) of Canada’s criminal code by openly and publicly inciting hatred against Canadians unvaccinated with the unapproved experimental Covid-19 vaccines. You called them racist, women haters and asked if they should be “tolerated”.",en
2022-01-01 23:00:02+00:00,996019192074817536,"It's amazing listening to those claiming that those supporting vaccines to combat the COVID-19 pandemic are actually beset by ""Mass Formation Psychosis"", when in describing it can just as easily be describing the QAnon Trump-obsessed insurrectionists. There's zero self-awareness.",en
