date,userid,tweet,lang
2022-07-24 23:57:35+00:00,238373280,https://t.co/T5dJjwZ2MsMonkeypox? Hepatitis? Sudden Adult Death Syndrome? Something is very wrong and it’s because of the Covid-19 Vaccines,en
2022-07-24 23:56:38+00:00,1322739335402147840,"What should a medical historian say when a general calls, asking for advice on a pandemic vaccine rollout? Find out @statelibrarynsw on 11 Aug with @Sydney_CHS member Warwick Anderson!Virus on the march? Military model &amp; metaphor in the Covid-19 pandemic https://t.co/dU6LJep5Xa",en
2022-07-24 23:56:10+00:00,1444966760952651784,"@JasonLa81624885 @Takin_Thepis_s If you're referring to COVID-19, the only truly unvaccinated person, is someone who has never had any COVID-19 vaccine at all. 🙂",en
2022-07-24 23:56:02+00:00,46315077,"The Moderna and Pfizer COVID-19 vaccines were granted emergency use authorization in late 2020 to prevent symptomatic COVID-19, and were promoted by many health officials, including Birx.AND FORMER PRESIDENT TRUMP AS WELL‼️‼️‼️",en
2022-07-24 23:55:58+00:00,1521579267628277760,"Without Vaccines, Children Have the Strongest Immunity to COVID-19https://t.co/0AmTMtbxyJ",en
2022-07-24 23:54:56+00:00,16139287,"Thinking About Covid-19, ContEric Topol on 'Season 3, Episode BA.5' &amp; the Importance of Developing &amp; Rolling Out Nasal Vaccines for Mucosal Immunity:https://t.co/6H2p2JyfWp https://t.co/pLwJPOVTRc",en
2022-07-24 23:54:29+00:00,1542770304996425728,@WSJ Vaccines caused Covid-19 virus to mutate + gain of function promotes it. All planned for depopulation,en
2022-07-24 23:53:00+00:00,1372594677229096961,"Govt. pushing for more vaccinations while CDC covers up injuries, deaths from COVID-19 vaccines - https://t.co/RMV1h3pacw",en
2022-07-24 23:51:11+00:00,777232548,Some people felt like the covid-19 vaccine wasn’t necessary cuz it wasn’t that bad but I’ll be damned if I let anyone without the monkey pox vaccine near me,en
2022-07-24 23:50:57+00:00,981376562842005504,Monkeypox? Hepatitis? Sudden Adult Death Syndrome? Something is very wrong and it's because of the Covid-19 Vaccines https://t.co/bUCLCuvjjc,en
2022-07-24 23:49:09+00:00,6519522,"@Choosy_Female @modernlyre Over the past 2 years, we've assessed our COVID-19 safety protocols as the pandemic evolved. On April 25, we removed the mask requirement for those attending blood drives &amp; donation centers due to updated CDC mask guidance, lower infection rates &amp; vaccine effectiveness. (1/2)",en
2022-07-24 23:45:44+00:00,2634707302,VALUE BALTIMORE Ambassadors Present Breaking News in the fight against Covid-19!!The CDC unanimously approved Novavax Covid vaccine  giving the United States another weapon in its Covid vaccine arsenal.Novavax's COVID vaccine unanimously recommended by CDC https://t.co/mPllVra4HL,en
2022-07-24 23:45:33+00:00,2634707302,VALUE BALTIMORE Ambassadors Present Breaking News in the fight against Covid-19!!The CDC unanimously approved Novavax Covid vaccine  giving the United States another weapon in its Covid vaccine arsenal.Novavax's COVID vaccine unanimously recommended by CDC,en
2022-07-24 23:45:15+00:00,1528366010666991620,@zerohedge I wonder why they didn’t say COVID-19 Testing Kits? That make more sense. I been thought of this COVID-19 was part of bio-weapon attack especially with the vaccines. If those who are vaccinated are targeted with a catalyst agent  then most of the population is wipe out. 😲,en
2022-07-24 23:42:13+00:00,1495887566947684355,"@ABCWorldNews @marcusmoore POPES intervention in closing of religious institutions during Pandemic,illegal implementation of face masks,face shields,mandated,threats vaccines,bribes bullying,MURDER OF SENIOR CITIZENS IN NURSING HOMES, HOSPITALS,PERJURY ON DEATH CERTIFICATES Covid 19,NEGLECTED CHILD ABUSE?",en
2022-07-24 23:38:29+00:00,6519522,"@VincentThaThird @covid_parent Although that rumor has been circulating, it isn't true. Rest assured, you can donate blood, platelets, and plasma after receiving the Covid-19 vaccine as long as you're feeling healthy and well at the time of donation.",en
2022-07-24 23:36:44+00:00,1368742328463208448,"Novavax Statement on U.S. Availability of the Novavax COVID-19 Vaccine, Adjuvanted https://t.co/XdSmJrCXVE",en
2022-07-24 23:36:33+00:00,1093727980428226560,Moderna Covid 19 vaccine now available at Desoto Family Care Clinic!CALL US AT 662-510-5353 to set your appointment ! https://t.co/4uLsn0qgWB,en
2022-07-24 23:35:01+00:00,1386480479738662919,@realDrBirx is as much responsible for THOUSANDS of deaths caused by the Covid-19 #vaccine as Anthony Fauci.,en
2022-07-24 23:34:55+00:00,567098701,@hkstockobserver @pajolicoe Thank China for resolute dynamic Covid management! Be happy the government cares so much to keep you safe! BILLIONS of Americans have already succumbed to COVID-19. Dynamic mgmt is the only thing holding back TRILLIONS of deaths in China. Have you had your Monkeypox vaccine?,en
2022-07-24 23:33:31+00:00,1479268023659896839,@ComeOnM48634420 @RobertT13960924 @2AGuaranteed @GeraldoRivera Anything he  failed had to do with the none stop  Democrat harassment impeachment investigations Russia Russia. Trump still did great after the Dems Covid-19  Virus spreadAnd Trump pushing he was able to produce a vaccine.  Joe Biden can't even fix our baby milk shortage.,en
2022-07-24 23:32:26+00:00,1950346866,"Fact check: Trump wrongly takes full credit for Pfizer’s COVID-19 vaccineBy HOPE YEN and LAURAN NEERGAARDAssociated PressNov 13, 2020 at 4:36 pm",en
2022-07-24 23:31:50+00:00,604932009,US Army Has Approved Only 20 Permanent Religious COVID-19 Vaccine Exemptions - https://t.co/O3k6zf10Wo,en
2022-07-24 23:31:35+00:00,3288751494,Dolly Parton's contribution of a $1 million donation to coronavirus research at Vanderbilt University's Medical Center helped fund the study and development of Moderna's COVID-19 vaccine candidate.,en
2022-07-24 23:29:39+00:00,46315077,"The witch -excuse my language.  Cc:  ⁦@raoult_didier⁩ ⁦@CaudeHenrion⁩ ⁦@GVDBossche⁩ ⁦@P_McCulloughMD⁩ ⁦@LucMontagnier⁩ EBBirx Admits She Knew COVID-19 Vaccines Were Never ""Going To Protect Against Infection"" | ZeroHedge https://t.co/f4QaHHogz7",en
2022-07-24 23:27:18+00:00,1425562170478141442,"Kuku Community, Tune in As Moses Answers Your Questions About the COVID-19 Vaccine! 💉#SouthSudan #Kukuhttps://t.co/rwC2AU0bOG",en
2022-07-24 23:27:17+00:00,4827310158,"@CarolinaGirlDJT @SteveVanBallz @thee_von @__GiveMeLiberty Ask to see the vial: The FDA-approved COMIRNATY® (COVID-19 Vaccine, mRNA) and the EUA-authorized Pfizer-BioNTech COVID-19 Vaccine have the same formulation and can be used interchangeably to provide the COVID-19 vaccination series.  FDA approved the Biologics License Application",en
2022-07-24 23:22:10+00:00,1427342441175261192,I have never heard of monkeypox and they are saying it’s ENDEMIC in so many countries. The fact it’s not emergency until it starts affecting the West is disgusting and we see how they prevented those countries from creating their own vaccines with Covid-19,en
2022-07-24 23:21:52+00:00,815745130078445568,Do COVID-19 vaccines prevent death in children? - Singapore update https://t.co/qZiVCMf5nP via @YouTube,en
2022-07-24 23:18:33+00:00,1490057525001170948,"China says Xi Jinping and other leaders have been given domestic Covid-19 vaccines, amid public concern over safety https://t.co/dDpEONFysc",en
2022-07-24 23:18:09+00:00,257137215,Birx Says COVID-19 Vaccines Were Never ‘Going to Protect Against Infection’ https://t.co/oOP5YZCmRl via @epochtimes,en
2022-07-24 23:17:48+00:00,1342356452317548544,@ENirenberg Thanks for the thread! Very helpful. There seems to be some ongoing work on the mucosal adjuvant issue (https://t.co/peMQJizVUn).Also worthwhile to note mucosal vaccines have potential benefit far beyond COVID-19 as Figure 1 shows.,en
2022-07-24 23:15:09+00:00,1550108312066301953,Hey @TeamYouTube 2 channels Gratia Plena and CristoYTuCatolico run by the same person is spreading Covid 19 Vaccine and Political misinformation,en
2022-07-24 23:14:57+00:00,492960154,Novavax: Everything You Should Know About the Newest COVID-19 Vaccinehttps://t.co/WAisxdA2Jl,en
2022-07-24 23:13:19+00:00,1475895392688648194,"IgA nephropathy in a pediatric patient after receiving the first dose of Pfizer-BioNTech COVID-19 vaccinehttps://t.co/9ZStDd4ypl«previously healthy 12-year-old boy(.)proteinuria, and acute kidney injury &lt; 24 h following the first dose of Pfizer-BioNTech vaccine» https://t.co/LQWCEDlG98",en
2022-07-24 23:10:07+00:00,1451120083498061828,"BEWARE @WHO declaration of 'Monkeypox pandemic.'Worldwide rollout of next-generation #smallpox #vaccines likely be justified by health authorities DESPITE lack of evidence of safety, especially when it interacts with #genetic vax like that of #Covid_19.https://t.co/GRfMEjopWg https://t.co/pW5LZhRbRS",en
2022-07-24 23:07:39+00:00,75521696,How COVID-19 vaccines may affect periods https://t.co/tWsAJCs1b5,en
2022-07-24 23:07:19+00:00,342319220,@LtGovTX Dan Patrick tests positive for #Covid_19 for a 2nd time. Didn't he in 2020 suggest he &amp; other seniors should be willing to die to get the economy going again? This was before we had vaccines so I guess he &amp; other seniors in TX don't have to worry about sacrificing now.,en
2022-07-24 23:06:26+00:00,921880207870459904,"""Biden, who has insisted that Covid is a 'pandemic of the unvaccinated,' last year assured Americans they would not get COVID-19 if they get the jabs.""VIRAL VIDEO: Politicians Catching Covid After Claiming Vaccines Stop Transmission https://t.co/XETxkg29ZW",en
2022-07-24 23:03:51+00:00,25974703,"@AndrewStoeten Mikolas: ""I wish I didn't get a COVID-19 Vaccine,it affected my performance and I would have been named an All-Star""",en
2022-07-24 23:03:50+00:00,961073840855109632,"The ""conspiracy theories"" about mRNA Covid-19 vaccines were not theories. They were true. It was a big psyop to cause harm.https://t.co/3hjGJRzHHq",en
2022-07-24 23:03:01+00:00,14293310,How COVID-19 vaccines may affect periods https://t.co/sb6QwOXsZm,en
2022-07-24 23:01:46+00:00,1479899271440834570,"China says Xi Jinping and other leaders have been given domestic Covid-19 vaccines, amid public concern over safety https://t.co/qI6SDnUr1Z",en
2022-07-24 23:01:43+00:00,1491030714695012353,"@octavia11260421 @Brittan16054721 @julesserkin @Marilynrules1 @thehill ""adolescents with COVID-19 mRNA vaccine-related myopericarditis, a large portion have persistent LGE abnormalities, raising concerns for potential longer-term effects. LGE is an indicator of cardiac injury and fibrosis ... associated with worse prognosis""https://t.co/vQmB0oUAsB",en
2022-07-24 23:00:13+00:00,1327051112684261377,"@Em_ily_Cards Nolan Arenado is a young, healthy athlete that is at practically zero risk from covid-19.  He doesn't want to take a vaccine that has unknown long term effects and doesn't prevent infection or transmission.  Seems like a sound decision.",en
2022-07-24 23:00:03+00:00,40778270,- 68.8% of people have had three doses of a COVID-19 vaccine* - 82.5% of people aged 12-15 have had one dose of a COVID-19 vaccine- 78.8% of people aged 12-15 have had two doses of a COVID-19 vaccine - 49.8% of people aged 5-11 have had one dose of a COVID-19 vaccine,en
2022-07-24 23:00:02+00:00,40778270,COVID-19 update – Monday 25 July 2022In the 24-hour reporting period to 4pm yesterday: - 96.8% of people aged 16+ have had one dose of a COVID-19 vaccine - 95.3% of people aged 16+ have had two doses of a COVID-19 vaccine https://t.co/ox5ynwCnoL,en
2022-07-24 22:59:22+00:00,1491030714695012353,"@octavia11260421 @Brittan16054721 @julesserkin @Marilynrules1 @thehill Study ""Increased emergency cardiovascular events among under-40 population in Israel during vaccine rollout and third COVID-19 wave"", published 28 April 2022:https://t.co/q9HFirHWx8",en
2022-07-24 22:58:51+00:00,62216044,"I can't imagine why.Historical mistrust in government, health care industry contributes to COVID-19 vaccine hesitancy for African Americans https://t.co/qv2lRpNLIZ via @medical_xpress",en
2022-07-24 22:58:14+00:00,1924601095,Operation Nasal Vaccine—Lightning speed to counter COVID-19 https://t.co/W5MXmlJyMI,en
2022-07-24 22:58:08+00:00,1499997947349590019,"""Results: A higher risk of reporting serious adverse reactions was observed for the COVID-19 vaccines in comparison to the influenza vaccines. Individuals age 65 and older were associated with a higher frequency of death, hospitalisations, ...""https://t.co/bj4x1Szznz",en
2022-07-24 22:57:09+00:00,1321920252364656645,@RonFilipkowski @LaraLeaTrump - your FIL did not develop the vaccines. They were in the works for nearly a decade before Covid-19 appeared. We are not stupid.,en
2022-07-24 22:55:27+00:00,930814982870257665,@RandPaul Trump Admits Getting Covid Vaccine Booster—Trump flown to hospital after Covid-19 diagnosisLeft it there,en
2022-07-24 22:55:07+00:00,226790638,"Cancer Australia’s FAQs about COVID-19 vaccines for people with cancer are available in multiple languages, including Arabic, Chinese (Traditional and Simplified), Hindi, Vietnamese, and Tagalog. View them at: https://t.co/gWziXBY2HD https://t.co/nShOupz2ka",en
2022-07-24 22:54:01+00:00,4877139586,"@ElMenaDeVox @yer_conscience @MsongelwaZu @SizweLo An example: during the Covid-19 pandemic, RT promoted vaccination to Russian audiences, while broadcasting anti-vaccine messages to Western audiences, discrediting vaccines.What is this if not a conscious, planned, massive disinformation campaign?",en
2022-07-24 22:53:39+00:00,1491030714695012353,"@octavia11260421 @Brittan16054721 @julesserkin @Marilynrules1 @thehill A study ""Incidence and association of adverse reactions to COVID-19 vaccines reported to pharmacovigilance systems in the European Union and the United States"", published 3 February 2022:https://t.co/dL4f5Np5el",en
2022-07-24 22:53:08+00:00,1347994190790029312,"@KimBragdon @AesPolitics Agreed.  The Dolt downplayed Covid-19 but would have loved to take credit for vaccine, even though he didn't have a plan to roll it out, whereas Despot treated it with depraved indifference and, I think, profited off the therapeutics clinics he promoted instead of vaccine + more.",en
2022-07-24 22:52:49+00:00,1491030714695012353,"@octavia11260421 @Brittan16054721 @julesserkin @Marilynrules1 @thehill 5. ""the BNT162b2 vaccine also induces a reprogramming of the innate immune response.. this may contribute to a more balanced inflammatory response during COVID-19 infection, or it may contribute to a reduced innate immune response to the virus.""https://t.co/HLyMd8drGk",en
2022-07-24 22:52:07+00:00,38763754,"@RobbieTheFire @ 45:02 Q: when the government told the American people if they took the vaccine they couldn’t get it (Covid-19), where they guessing or lying?. A: “I think it was hope.”",en
2022-07-24 22:52:06+00:00,1491030714695012353,"@octavia11260421 @Brittan16054721 @julesserkin @Marilynrules1 @thehill 4. Study ""Decoding COVID-19 mRNA vaccine immunometabolism in the central nervous system: normal glia [non-neuronal brain cells] and gliomas [brain tumours] of the human brain using Raman imaging"". Some quotes from this study 🔻https://t.co/xtqAXxb6u6 https://t.co/ppp5CP2S7d",en
2022-07-24 22:49:59+00:00,874643313084829696,"@dreadGodshand @NickAdamsinUSA Trump said that the COVID-19 vaccines were ""one of the greatest achievements of mankind,"" that ""the vaccines work,"" and that ""the ones who go to the hospital and get sick are the ones who don't take the vaccine.""",en
2022-07-24 22:49:12+00:00,1538287705271967744,"Birx now Says COVID-19 Vaccines Were Never ‘Going to Protect Against Infection’; this malfeasant said prior to get you to take the vaccine ""This is one of the most highly-effective vaccines we have"".. https://t.co/LXmQ2VTa8z",en
2022-07-24 22:49:09+00:00,1061845553317703680,@RonFilipkowski acute respiratory syndrome (SARS) &amp;Middle East respiratory syndrome (MERS) are 2 diseases caused by coronaviruses closely related to the virus that causes COVID-19. Researchers began working on developing vaccines for these diseases after they were discovered in 2003 and 2012,en
2022-07-24 22:48:58+00:00,1686805202,"@wozzer1963 @Dendog_UK @dksdata Stop ignoring:""LINE-1 is a reverse transcriptase that converts mRNA into DNA, so it is not surprising that the study would show it converting mRNA from the Pfizer COVID-19 vaccine into DNA. That is literally what it is meant to do.""",en
2022-07-24 22:48:56+00:00,1522732262671986688,Birx Says COVID-19 Vaccines Were Never ‘Going to Protect Against Infection’https://t.co/fj63gCtbvU,en
2022-07-24 22:47:51+00:00,1279228962,Vitamin D: Nature’s Natural Covid-19 “Vaccine” | Nature's Real Health https://t.co/Mr54Z2llPV,en
2022-07-24 22:45:53+00:00,2796935377,"@Cold_Peace_ Stay in your limits. Never ever try do any misadventure with us. You will get befitting reply if you do so. You will spread COVID 19, we will make vaccine &amp; distribute it in whole world, you will try Galwan, we will push you back with more casualties than us.",en
2022-07-24 22:45:24+00:00,1686805202,"@wozzer1963 @Dendog_UK @dksdata The study only looked at whether mRNA from the Pfizer COVID-19 vaccine can be transcribed into DNA by the LINE-1 enzyme.And the study showed – yes, it can… because that’s what the LINE-1 enzyme does.Stop being told what to think by meme's.",en
2022-07-24 22:45:00+00:00,39450389,"Birx Admits She Knew COVID-19 Vaccines Were Never ""Going To Protect Against Infection"" | ZeroHedge#Birx  https://t.co/44j7z5in4w",en
2022-07-24 22:43:07+00:00,1550660222619885570,"Birx Admits She Knew COVID-19 Vaccines Were Never ""Going To Protect Against Infection""https://t.co/HbLj6JRAWr",en
2022-07-24 22:41:26+00:00,1279228962,Worried About Potential Covid-19 Vaccine Side Effects or Whether You Should Get Vaccinated at All? | Nature's Real Health https://t.co/Mr54Z2llPV,en
2022-07-24 22:41:25+00:00,898775126,"Birx Admits She Knew COVID-19 Vaccines Were Never ""Going To Protect Against Infection.""https://t.co/L8xjEcepQh",en
2022-07-24 22:41:23+00:00,2938602215,Doctor ADMITTING  that Covid-19 vaccines would” not protect against infection”🚩🚩,en
2022-07-24 22:41:22+00:00,1289960872136314881,Covid-19: Is the US compensation scheme for vaccine injuries fit for purpose? | The BMJ https://t.co/b4VmJfRmYF,en
2022-07-24 22:39:25+00:00,392115122,"Fantastic thread for a primer on the potential, and limitations, of intranasal COVID-19 vaccines 👏🏽",en
2022-07-24 22:38:05+00:00,1161973934348095488,"@noetechnesis In the context of vaccinating older and/or immunocompromised adults, our observations can be the starting point for further evaluation of a possible relationship between COVID-19, COVID vaccines, and herpes zoster.https://t.co/LT2k3frNZF",en
2022-07-24 22:37:29+00:00,1501675286731100161,@MutzUk @Dendog_UK @dksdata Don't ignore.5. ConclusionsOur study is the first in vitro study on the effect of COVID-19 mRNA vaccine BNT162b2 on human liver cell line. We present evidence on fast entry of BNT162b2 into the cells and subsequent intracellular reverse transcription of BNT162b2 mRNA into DNA.,en
2022-07-24 22:37:26+00:00,2205848491,Arenado and Goldy aren’t automatically “stupid pieces of shit” just because they made a decision to not get the vaccine for Covid-19.,en
2022-07-24 22:35:57+00:00,24119183,"@McCainSuzanne Yep, only things Trump accomplished, a $2T tax cut for the wealthy and the COVID-19 vaccine. That being duly noted, Trump let 250K or so folks die before he ramped up the vaccine development. Trump said COVID-19 would be gone by spring of 2020. Oops!",en
2022-07-24 22:35:26+00:00,1501675286731100161,@MutzUk @Dendog_UK @dksdata Read to end.5. ConclusionsOur study is the first in vitro study on the effect of COVID-19 mRNA vaccine BNT162b2 on human liver cell line. We present evidence on fast entry of BNT162b2 into the cells and subsequent intracellular reverse transcription of BNT162b2 mRNA into DNA.,en
2022-07-24 22:35:15+00:00,1373700231229968385,"@Proportionatty Claim: The COVID-19 vaccine doesn't stop virus spread, so it can't protect othersClaimed by: Social mediaFact check by USA Today: Falsehttps://t.co/2Or4n0Y56g",en
2022-07-24 22:31:45+00:00,1545689449492799489,"Experts Assessed Data Released By European Medicines Agency, &amp; Concluded: ""All 4 Covid-19 Vaccines Must Be Withdrawn, Authorization For Use Must Be Canceled ""AS A MATTER OF URGENCY.""https://t.co/UfwY8lFIDV",en
2022-07-24 22:30:00+00:00,1408440930621919232,"Could the next generation of vaccines be needle-free? Exciting work from our friends @UQ_SCMB led by @ChrisLDMcMillan and @drdavidmuller demonstrates that nanopatch delivery of a COVID-19 vaccine can induce broad immunity, even against omicron. https://t.co/FeAGKhGimb",en
2022-07-24 22:25:42+00:00,1366111403728330758,Remember this. The reason why we mightn't get a vaccine for Covid 19 is because we've not got any for the previous 18 Covid viruses. Simon Harris sorry for ‘awful boo-boo’ about 18 viruses before Covid-19 https://t.co/ixf8XHfK1z,en
2022-07-24 22:25:41+00:00,1502497817687961603,"China says Xi Jinping and other leaders have been given domestic Covid-19 vaccines, amid public concern over safety https://t.co/DlQdDtS47D",en
2022-07-24 22:25:21+00:00,1339884096647028738,"I applaud the initiatives of recruitment policy of Ministry of Defence. It is really needed for the country to have national services trained people. However the compulsory Covid 19 vaccine requirement have dropped my trust in the provision, Force majeure of take it or leave it!",en
2022-07-24 22:24:30+00:00,1060156236,"90% of China's populationgot COVID-19 vaccine shotsmade in China.After near 3 yearsand counting,Covid-19 keeps infectingChinese living in China.Pres. Biden got 2 shotsof COVID-19 vaccinemade in the USA.Latest news saysBIDEN GOT INFECTEDwith COVID-19 virus.WOW !!",en
2022-07-24 22:24:19+00:00,368052678,"Washington, DC Child COVID-19 Vaccine Mandate Illegal: Legal Expert https://t.co/kUep9GMJUc via @epochtimes",en
2022-07-24 22:22:23+00:00,2269557301,"Birx Admits She Knew COVID-19 Vaccines Were Never “Going To Protect Against Infection” A year ago, President Biden told the world during a now infamous CNN townhall that “you’re not going to get COVID if you have these vaccinations.”ZH",en
2022-07-24 22:21:52+00:00,1266563068223504389,Novavax: Everything You Should Know About the Newest COVID-19 Vaccine: CNET https://t.co/6BJNSt0ZHc MORE w/ EcoSearch: https://t.co/BH03KGexeg,en
2022-07-24 22:15:27+00:00,24600338,Novavax: Everything You Should Know About the Newest COVID-19 Vaccine https://t.co/mCH1T9dWv3,en
2022-07-24 22:15:09+00:00,15135715,"The youngest age group has had a difficult time finding a place to get the COVID-19 vaccine, and Upstate Hospital is stepping up to meet that demand.https://t.co/RVAdVz8xuK",en
2022-07-24 22:09:35+00:00,1474692305198235650,"@CaitlinDineen I highly recommend Sputnik V COVID-19 vaccine, after it the disease is not terrible)))",en
2022-07-24 22:09:21+00:00,326747625,"The United States has helped more than 30 nations in Asia combat COVID-19, donating millions of vaccine doses, while partnering to save lives and boost economic recovery.https://t.co/nxFfCax8Yh",en
2022-07-24 22:08:41+00:00,1387083790376394753,💥💥💥76 #UK #doctors sign open letter to government #warning against COVID-19 #child #vaccine https://t.co/0sd6yfdDf5,en
2022-07-24 22:08:06+00:00,1252396121294602240,China says Xi Jinping and other leaders have been given domestic Covid-19 vaccines News Link: https://t.co/UsZrb08qYG#yourchoicenews #latestnews #news #currentnews #newspaper #newsupdate #dailynews #worldnews #newspapers #newsfeed #newsoftheday #l...https://t.co/UsZrb08qYG,en
2022-07-24 22:06:43+00:00,1498029559068954627,"Risk of infection, hospitalisation, and death up to 9 months after a second dose of COVID-19 vaccine: a retrospective, total population cohort study in Sweden - The Lancet https://t.co/VzLEdjoscD",en
2022-07-24 22:06:08+00:00,775793412045877249,@jmjones @hochman Narrator voice. The risks of the vaccine do not outweigh the risks of getting infected by the Covid 19 virus. 🤦🏻,en
2022-07-24 22:05:35+00:00,1326114116210053120,"idea: if you want right wingers to take the Covid-19 vaccine, just tell them to think of the vaccine as shooting the foreign virus with a concealed carry needle",en
2022-07-24 22:05:11+00:00,376506495,"Thousands report changes to menstrual bleeding after COVID-19 vaccine, study shows https://t.co/x0hkzjSUsT",en
2022-07-24 22:04:35+00:00,467110966,@AlixG_2 No fact check on Twitter saying that the story is false. No news media saying anything 🙄 In other words It's the most daming evidence against covid-19 vaccines! https://t.co/1Oo6YOKTfz,en
2022-07-24 22:02:07+00:00,1542203681004830722,"#Covid-19 - India’s #Covaxin Vaccine Effect as on July 24 2022India’s projection has 22.79 times less forecast deaths than United Kingdom’s, 21.54 times less forecast deaths than USA’s and 19.65 less forecast deaths than Europe’s https://t.co/6L2g06mWrP",en
2022-07-24 22:01:41+00:00,1493999453900087303,Monkeypox is only circulating in countries where the Pfizer vaccine has been distributed and is being used to promote the technocratic Great ResetAny country where monkey pox is said to be circulating is also a country that has distributed the Pfizer Covid-19 injections to the https://t.co/slUOmhhVvj,en
2022-07-24 22:01:26+00:00,1301602104398802944,"@52dUs @TimRunsHisMouth @MostlyPeacefull AIDS was created not by gay people , AIDS does not discriminate ! The first aids patient just happened to be gay ! So they started calling it the gay virus !! What I’m saying is the COVID-19 vaccines has the aids virus in it to keep your immune system weak unable to fight ! 🤔😔",en
