date,userid,tweet,lang
2022-11-05 09:19:41+00:00,546be46c52cef19b4c8237f5ae6436fc8d646697a2a9475eed2a8299ee9216e8,Chickens coming home to roost Pfizer exec admits Covid-19 vaccine wasn’t even tested to see if it would prevent transmission🤡* QuadVaxxed-turnip https://t.co/Q3CDpuu3Vm,en
2022-11-05 09:18:13+00:00,f57accef5b8532840235cb0b995a0d480e20ff1af458b4b7e3a895da04ff7262,TrustHealthInf: Frequently asked questions on #Covid 19 #vaccineshttps://t.co/pJY872U0sm North Korea fires missiles into sea amid US-S. Korea drills,en
2022-11-05 09:18:13+00:00,f57accef5b8532840235cb0b995a0d480e20ff1af458b4b7e3a895da04ff7262,TrustHealthInf: Frequently asked questions on #Covid 19 #vaccineshttps://t.co/pJY872U0sm South Korean military says North Korea fired 4 missiles into sea,en
2022-11-05 09:18:13+00:00,f57accef5b8532840235cb0b995a0d480e20ff1af458b4b7e3a895da04ff7262,TrustHealthInf: Frequently asked questions on #Covid 19 #vaccineshttps://t.co/pJY872U0sm Iran acknowledges sending drones to Russia for first time,en
2022-11-05 09:18:12+00:00,f57accef5b8532840235cb0b995a0d480e20ff1af458b4b7e3a895da04ff7262,TrustHealthInf: Frequently asked questions on #Covid 19 #vaccineshttps://t.co/pJY872U0sm Prison-like center puts focus on UK's response to migrants,en
2022-11-05 09:15:54+00:00,eb54be06db87865b433dff95b8219f57063bf15884a091088e9196fc29f3984d,"“Sweden has consistently taken a more cautious approach to vaccine approval than the United States throughout the COVID-19 pandemic, including by recommending against the shots for kids below age 12 while the United States was moving forward for that…” https://t.co/Y1s9rWSIPw",en
2022-11-05 09:13:17+00:00,18acacfb7b47aedc9af705d284bbb192,Moderna’s COVID-19 vaccine safe and effective in children 6 months to 5 years of age https://t.co/8lSa4qF55h,en
2022-11-05 09:11:01+00:00,7a89efe8f7ba43002ca869780fd13866e59f27bc56dc5633a8b5a84d568e9613,"Effective with date of service Aug. 31, 2022, Medicaid and NC Health Choice programs cover Moderna COVID-19 Vaccine.Moderna COVID-19 Vaccine, Bivalent Booster Dose (6 years through 11 years of ... - NC Medicaid https://t.co/bELCJ8iBoN",en
2022-11-05 09:10:15+00:00,5b9b7c4c2e68d01aaccce31c18594363,The threat of COVID-19 vaccine worshipershttps://t.co/mE3sABNWei,en
2022-11-05 09:06:57+00:00,419114dd503e08f7842ffab97202ddab,A slick operation this morning at the Desborough suite @rbwm Received my 4th Covid 19 jab and flu vaccine (yes I’m in that age group)Thank you to all the volunteers &amp; @FrimleyHealth and @Redwoodsurgery for their efficiency in the process. 🙏 👏❤️ https://t.co/qNkOtEspe5,en
2022-11-05 09:05:46+00:00,0df464e9ddc6d14f697a334c0dc8a013,WORLD FIRST: ROBOTIC ARMS Assembling Via Nanotech Inside COVID-19 &amp;quot;Vaccines&amp;quot; - Filmed in Real Time - Dr. Nixon https://t.co/KKU6a9bXj8,en
2022-11-05 09:05:26+00:00,6fac630347fc16b783b89ba4f4b7dc7a8ea1710378c76cb62da8566507aae966,Shouldn't those that profited pay?Petition: Remove indemnity from the manufacturers of covid-19 vaccines https://t.co/cak5X4rkpb,en
2022-11-05 09:04:55+00:00,7109a6d477b92a92f733e263627a9345,"United States now the only western country to require COVID-19 vaccine proof for entryThe U.S. Transportation Security Administration (TSA) has extended its COVID-19 vaccine proof requirement for non-U.S., nonimmigrant # # # # # # # #https://t.co/KYuTsjmNwA https://t.co/QfFHIkj6It",en
2022-11-05 09:04:54+00:00,32b31b178e9e0279bdee58f77743b2534a3e5a36661cce400bb0fb5a7eeee736,Rutgers has been selected as a clinical trial site for the global Pfizer-BioNTech research study to evaluate the safety and efficacy of the bivalent COVID-19 vaccines in children under age 5.https://t.co/hLDB3QVOYe,en
2022-11-05 09:02:54+00:00,04d055637abc0e4642feeb919644b8e3c0770185f326c5091c9da80dc878a602,TSA to Continue Requiring COVID-19 Vaccine Proof for Non-US Citizens to Enter Country https://t.co/1i4WRDGyjz,en
2022-11-05 09:01:22+00:00,4d9ab7ea10fd060b1a46d614d89f5848,Protection provided by COVID-19 vaccines decreases over time and flu viruses can change every year. Vaccines are the best protection we have against these viruses that can cause serious illness. Find out if you’re eligible at https://t.co/nTX7VwLGtH and book now. https://t.co/eIP02mueFg,en
2022-11-05 09:01:09+00:00,252100ce1bbfee28edebe1ebad1fa70b,All pregnant women are eligible for free flu and COVID-19 vaccines. Book your appointments now with your GP surgery or pharmacist or ask your maternity services. https://t.co/ojsSktIjnC,en
2022-11-05 09:00:44+00:00,86e34b31db673af99226e7031215ff9c,"🤔 Are you protected this winter? ➡️ Both flu and COVID-19 can cause serious illness. If you're over 50, pregnant or part of an at-risk group, you should consider getting your free flu vaccine and COVID-19 booster.Find out more  👉 https://t.co/649aLPXKWC https://t.co/fuw3uIotPJ",en
2022-11-05 09:00:31+00:00,eabad3e71ef0449a16d36af05bb4f024,"Covid-19 and flu spread more easily in winter and can both cause serious illness. So, if you’re eligible, make sure you have your free flu vaccine and the Covid-19 booster this winter.Find out how to book at https://t.co/LxhGV2ItWb https://t.co/2GgpXJDJ8K",en
2022-11-05 09:00:23+00:00,995db06ea6ec4dcc7c74f9b5ce406417,"COVID-19 and flu spread more easily in winter and can both cause serious illness. So, if you’re eligible, make sure you have your free flu vaccine and the COVID-19 booster this winter #GetBoostedFind out how to book at https://t.co/Ze4nZ634ql https://t.co/hV9as0A18c",en
2022-11-05 09:00:04+00:00,364578827f18efc6e4480031b7e61d26,"The federal government is poised to stop paying for COVID-19 vaccines, tests and treatments in the coming months, shifting the costs onto the public. https://t.co/ScSXc6neOk",en
2022-11-05 09:00:02+00:00,eea7e891131ce6a6ad8f38ae1c9ecba6651d5744beb0834c7b55c917cc35e1d8,"🌲 Our COVID-19 vaccine is an evergreen offer.That means if you haven’t already taken it up, you can still do so.For further information visit📲: https://t.co/31tJi94yud https://t.co/PQeiPRC864",en
2022-11-05 09:00:02+00:00,a923d24009cd172613547e168e1ede01,Boost your immunity this winter. If you’re over 50 you're eligible for a free flu and COVID-19 booster vaccine this winter.Book now ➡️ https://t.co/xeaSOGHaDj https://t.co/vDz4i1dqsN,en
2022-11-05 09:00:00+00:00,44e004a539d95633a0bbe341d33f79ac,"If you're aged 50 or over, get your free flu vaccine and COVID-19 booster now 💉💉Vaccines are our best protection against getting seriously ill this winter.https://t.co/UUmghGtiqX https://t.co/Ca2SryDoxZ",en
2022-11-05 08:57:12+00:00,57a11c6113bc7af8ff4eb9dd1b5d18950706c2058785c58c956dc6d91586eb41,TSA to Continue Requiring COVID-19 Vaccine Proof for Non-US Citizens to Enter Country https://t.co/eVETCljbpS,en
2022-11-05 08:56:04+00:00,b4a6d05bbf2d02e662d0a8ec8ef0248e12247f9e92607b6001f66d36c6ad05ef,Did I miss the year long conversation that there should have been about Pfizer admitting to European Parliament that they did not test whether the vaccines/boosters stop transmission of Covid-19?,en
2022-11-05 08:54:20+00:00,217650b676b40292a0dd7870c524d6ea,Dr Anthony Tanoto Tan on different T cell responses in different COVID-19 vaccines https://t.co/efq2oOHhcw via @YouTube,en
2022-11-05 08:54:18+00:00,ff35e329b512a163a387f9cbfd3402f72dbda1e3d3d55dc80e3d1f9e96c270cc,"@fovillian_67 @Drewthehrguy @pavlovhoney1 @SethAbramson “Oil doesn’t just fuel cars. Petrochemical products range from generating heat, electricity, plastics, synthetic materials and asphalt, PPE, COVID-19 vaccine vials, &amp; even timed-release capsules in aspirin” Cost of everything goes up. https://t.co/J9sm1cvOll",en
2022-11-05 08:53:15+00:00,3e9d5cc8b0a70e9b8c8ae2084e02e9e05778c5810f57aec468d8e50711f967f6,Pfizer’s COVID-19 Vaccine Goes Into Liver Cells and Is Converted to DNA: Study #juststop  https://t.co/ixU6Hu8Hts,en
2022-11-05 08:51:12+00:00,a3ccf1d2d740ee6f4c249f0f1424850936d376b178bdacd2cbde247fd168fb5f,Frequently asked questions on #Covid 19 #vaccineshttps://t.co/BAiWaRkdVy North Korea fires missiles into sea amid US-S. Korea drills,en
2022-11-05 08:51:11+00:00,a3ccf1d2d740ee6f4c249f0f1424850936d376b178bdacd2cbde247fd168fb5f,Frequently asked questions on #Covid 19 #vaccineshttps://t.co/BAiWaRkdVy South Korean military says North Korea fired 4 missiles into sea,en
2022-11-05 08:51:11+00:00,a3ccf1d2d740ee6f4c249f0f1424850936d376b178bdacd2cbde247fd168fb5f,Frequently asked questions on #Covid 19 #vaccineshttps://t.co/BAiWaRkdVy Iran acknowledges sending drones to Russia for first time,en
2022-11-05 08:51:10+00:00,a3ccf1d2d740ee6f4c249f0f1424850936d376b178bdacd2cbde247fd168fb5f,Frequently asked questions on #Covid 19 #vaccineshttps://t.co/BAiWaRkdVy Prison-like center puts focus on UK's response to migrants,en
2022-11-05 08:46:49+00:00,cf438bb29c62ff9287668678b3158bf02a6265a3e828d3496bd586b6b07d8060,Waterbury Woman Who Created False COVID-19 Vaccine Records is Sentenced | USAO-CT https://t.co/ruEN81EJoQ,en
2022-11-05 08:46:25+00:00,2c83fef881bfeb26510fb5b8c82d6c91,"@joetsai1999 Respect u as an owner,  but the front office is just horrible.  First, hired Steve Nash (hof player), terrible Coach.  Now, the guy doesn't think Covid-19 vaccine doesn't prevent the disease",en
2022-11-05 08:44:15+00:00,378a6bb11ebc1d74a72a1a22d1f12180be5b252c99f4a68dd17250e01c25b48b,"Life Insurance Representative Diagnosed With Cancer After Receiving Covid-19 Vaccine 💉(2022)She went to the doctor, and was hit with a bombshell. She had fluid around her lungs that could be cancerous. The malignant cells in her lungs are classified as Stage 4 cancer .. https://t.co/mqVN7WmYx4",en
2022-11-05 08:42:59+00:00,6acaa982740d1f77f004be1aa825d207,@TobyonTV The State made the problems &amp; continues to increase them. Covid 19PCR testLockdownFurloughDangerous vaccinesUkraine WarFuel crisisBird fluFood crisisNet ZeroAll caused by our Governmentthe absence of an Opposition +WEFWHOUNBilderbergTrilaterals&amp; Bill Gates,en
2022-11-05 08:42:00+00:00,928a11d6ba2ff707eb468cafc3876add,"Getting vaccinated is the best way we can protect ourselves from COVID-19.If you are eligible for your next COVID-19 vaccine, you can book an appointment or find a walk-in clinic near you➡️https://t.co/pyI5NbbG6V📸Nenagh Vaccination Centre is one of three Midwest clinics. https://t.co/9R7SYR97LQ",en
2022-11-05 08:40:30+00:00,9fcc83e9229d5799fdd6aade5a61a2ddfa9b2dae10ab40a052cea46c40134018,"@summrcal @charliekirk11 @QTWIQ1 Worked so hard to protect?  Is this a joke?Their suppression of Covid -19 ""vaccine"" side effects caused the death of thousands of innocent CHILDREN worldwide. Many of these criminals you are defending should be arrested.",en
2022-11-05 08:37:57+00:00,378a6bb11ebc1d74a72a1a22d1f12180be5b252c99f4a68dd17250e01c25b48b,Female News Anchor Diagnosed With Cancer After Receiving The Covid-19 Vaccine 💉 (2022)Dr. Ryan Cole was warning people about the cancer risk from the vaccines near the start of the pandemic but many people just dismissed him as a conspiracy doctor .. https://t.co/eLH1Tv5nNJ,en
2022-11-05 08:37:38+00:00,b82116f9395fee22227ff48eec48f8ce9026c3d2d73e7cca99b009e9e8e5029f,https://t.co/ddNwD1cWTQPfizer/BioNTech say updated Covid-19 booster generates 'substantially higher' protection against Omicron subvariants than original vaccineGreat News! Get boosters!,en
2022-11-05 08:36:26+00:00,378a6bb11ebc1d74a72a1a22d1f12180be5b252c99f4a68dd17250e01c25b48b,Female Journalist Diagnosed With Cancer After Receiving The Covid-19 Vaccine 💉 (2022) https://t.co/fAnPJOaex0,en
2022-11-05 08:36:20+00:00,08fb1d7bfe0ddc6fd23e080fb5c8e0c03bb819105eb3e0efadda40f12429ebc8,"WORLD FIRST: ROBOTIC ARMS Assembling Via Nanotech Inside COVID-19 ""Vaccines"" - Filmed in Real Time - Dr. Nixon",en
2022-11-05 08:35:10+00:00,378a6bb11ebc1d74a72a1a22d1f12180be5b252c99f4a68dd17250e01c25b48b,Male News Anchor Diagnosed With Cancer After Receiving The Covid-19 Vaccine 💉(2022)We tried you warn you but you ridiculed all of us. https://t.co/s3Y9QymlOv,en
2022-11-05 08:31:51+00:00,5a2d04515071a15bb236d2c179f716b814917d47d2b1b4a99085fc8dc4de4ad0,@_AfricanSoil Covid-19 that it's vaccine is forced on us 😭😭😭😭,en
2022-11-05 08:29:01+00:00,74c0a1ff496fcdf3dfd83689ba2369ca,"@TodaywithJulius Atrocious tyranny is what the Covid-19 MASKS, Vaccines and FORCED LOCKDOWNs imposed on U.S. Americans! NONE of these mandates were LAWS passed by Congress. NEVER AGAIN!",en
2022-11-05 08:24:08+00:00,cea1aa01b6119c5f3252e60ae6d98b2883c0f71d2d35593b7256bec5073d1c7c,"What about an EU Inquiry into Covid-19 Misappropriation of funds, genocide of vulnerable ppl by eliminating proper medical care through Government, HSE &amp; NPHET protocols, sudden deaths dramatic increase, 50-70% of deaths now caused by blood clots as part of vaccine side effects? https://t.co/JYAeAFKCSG",en
2022-11-05 08:22:29+00:00,90cc5faac9495485ae5eb17ec13ef51a5faa40f0391fc1b8fcc8da0e9d814164,"BA.5-Bivalent-Booster Elicits Better Neutralization Than Parental Vaccine But Does Not Produce Robust Neutralization Against BA.2.75.2, BQ.1.1, XBB.1 - Thailand Medical News https://t.co/9D3s2GLFG6 #Covid_19 #CovidVaccine",en
2022-11-05 08:21:49+00:00,a8422acf5ff6e5029da364ee12bda231,@BillGates For the production of B.Grimm's mRNA vaccine in collaboration with Chulalongkorn University and Unison to produce drugs to treat Covid-19 as listed above.https://t.co/74OAo1x6G1,en
2022-11-05 08:20:08+00:00,20e82bbd493de6a8ff2d51ad5def1bd8c964f39abcb25518fdd9c16e8b23e1c6,COVID vaccine hoarding might have cost &gt;1 million lives~45% of COVID-19 deaths in low-income countries may been averted if 20% coverage was achieved by end of 2021Deaths would have been lower if vaccines had been shared more equitablyhttps://t.co/Lx9cY6PYCx,en
2022-11-05 08:18:35+00:00,db2938516da871d49930d7723fe72c18,"@TTribbleTrooper @Jessssuhh @JimboCopeland @MovieHooligan The definition of a vaccine is, and always has been:""Stimulates the immune system to produce an immune response to a pathogen.""Which is exactly what all the COVID 19 vaccines do.",en
2022-11-05 08:18:22+00:00,f57accef5b8532840235cb0b995a0d480e20ff1af458b4b7e3a895da04ff7262,TrustHealthInf: Frequently asked questions on #Covid 19 #vaccineshttps://t.co/ct9Nm9mCCx 15 killed in Russia cafe blaze after flare gun discharged,en
2022-11-05 08:18:22+00:00,f57accef5b8532840235cb0b995a0d480e20ff1af458b4b7e3a895da04ff7262,TrustHealthInf: Frequently asked questions on #Covid 19 #vaccineshttps://t.co/ct9Nm9mCCx Russia emergency officials say a fire in a cafe has killed 15 people in a city north of Moscow,en
2022-11-05 08:18:04+00:00,11ecf0310fb0c4572d7ca156c4a16a30,"@BasedCrusader99 @CovidSolidarit1 Except relative to flu patients, the risk of venous thromboembolism was/is significantly greater among COVID-19 patients both before and after vaccine availability - a 60% and 89% higher risk, respectively.",en
2022-11-05 08:17:14+00:00,1a05e8df580acf2cbcc145e0c9284449,"@KitSeason @kimmiejs With the exception of the (now revoked) legislation impacting on the health and social care sector, the Government has not legislated for the COVID-19 vaccine to be mandatory.",en
2022-11-05 08:16:49+00:00,1a05e8df580acf2cbcc145e0c9284449,"@MegTea33 @kimmiejs With the exception of the (now revoked) legislation impacting on the health and social care sector, the Government has not legislated for the COVID-19 vaccine to be mandatory.",en
2022-11-05 08:15:59+00:00,1a05e8df580acf2cbcc145e0c9284449,"@dailyoptic @kimmiejs With the exception of the (now revoked) legislation impacting on the health and social care sector, the Government has not legislated for the COVID-19 vaccine to be mandatory.",en
2022-11-05 08:14:46+00:00,867e684f498572d3fa4801d0ae0efd59bcbd7e127e19920ecf3e4b5c53912f4e,Former NDP MLA Thomas Dang pleads guilty to hacking Alberta's COVID-19 vaccine records portal https://t.co/kvmWAXkj24,en
2022-11-05 08:13:37+00:00,96691e8d3062f1ec7a7980280090ed309e674eea07990bb610036e9095788c88,"On plain sight. And this is exactly what they did with covid 19 and with the vaccines they produced to inject in people. I’m 100% sure of this, the vaccines ( Pfizer, moderna, AstraZeneca, j&amp;j ) are designed to alter humanity DNA and shut down their immune system. People are dyin",en
2022-11-05 08:12:45+00:00,b8cc88bc3bd2df82f1a089a53b767facca3956902d62bf7b27ac59ab4ed9ed04,"Is the ""cure"" for protection worse than catching Covid-19, especially post catching the virus &amp; gaining B, T cell &amp; antibody protection naturally? We locked down to wait for this ""cure"" at very high cost...Vaccine Safety Update https://t.co/zDlKzZmlEE via @LD_Sceptics",en
2022-11-05 08:12:02+00:00,69ef427da4c60acca037c4a24d91ea24,"Flu hospitalizations up, doctors urge Ohioans to utilize vaccines for flu and COVID-19 https://t.co/bcKKQWUuhG",en
2022-11-05 08:11:04+00:00,7a89efe8f7ba43002ca869780fd13866e59f27bc56dc5633a8b5a84d568e9613,Researchers estimated the effectiveness of monovalent messenger ribonucleic acid (mRNA) coronavirus disease 2019 (COVID-19) vaccines against ...Efficacy of booster messenger ribonucleic acid COVID-19 vaccinations against SARS-CoV-2 ... https://t.co/AlljjFSnGq,en
2022-11-05 08:10:13+00:00,8ccf826483bb0371dfd5197d806c03ba9f8ec903e8110664eb58e435fa0e8edc,"There are two essential vaccines that you may need this winter – a flu vaccine and a COVID-19 booster. Vaccines are the best way to protect yourself, friends and family from these dangerous viruses. Find out if you’re eligible at https://t.co/C5zl4MrQGv and book now. https://t.co/ot7YGKZR0P",en
2022-11-05 08:08:00+00:00,f8be1bce8bdad67b7a130f6232aa8e72f6bdd3bba9746466c30f31257ce2a1af,"If you are 50 years old or over, get your free flu #vaccine and COVID-19 booster now.Find out more ➡️ https://t.co/UCB4WtFloz#NHS #COVID #Wolverhampton https://t.co/mZUEGmwh4B",en
2022-11-05 08:01:52+00:00,6312e563b45882a51a59a484bca21fcbd21061e1756018b38e101fd959566190,Evaluating COVID-19 Vaccines #shorts https://t.co/3sIE3dc82c via @YouTube,en
2022-11-05 08:01:25+00:00,9c618ad414b359872b322de7713972f5f1801e9c70d0db1f66665cab4a217d64,Boost your immunity this winter. Vaccines are the best way to protect you and your baby from the harms that flu and COVID-19 can cause.Book your appointments now with your GP surgery or pharmacist or ask your maternity services.#Wiltshirehttps://t.co/pH7tqrIesZ https://t.co/l0EOrUvfYM,en
2022-11-05 08:01:13+00:00,13ac6a92a7215a9815c3fc737aef971962b6d4dbea7de1f8f47072f85e8b312e,"@maolesen Considering how many people have been vaccinated as well as getting covid 19, how can they be so sure it's covid 19 and not the vaccine causing the damage? Don't have an answer for this? Yes, I didn't think so",en
2022-11-05 08:01:05+00:00,e49b0cb12410bf32a096b84e36a82780,"@robertlufkinmd I'm not so sure that I admire the covid-19 lockdowns and vaccine mandates, even though I don't understand them.",en
2022-11-05 08:00:30+00:00,071cfe37ad769178ba5a73968da6b8de57914b804d1a0a8cd528e6db790a7f4e,Pfizer and BioNTech Announce Updated Clinical Data for Omicron BA.4/BA.5-Adapted Bivalent Booster Demonstrating Substantially Higher Immune Response in Adults Compared to the Original COVID-19 Vaccine https://t.co/GZoDT3YPgd,en
2022-11-05 07:55:32+00:00,e9c5c310a33772d43d7354237b4910f2cee4ea7571378a940e002dce2e82bbf9,@BillGates @georgesoros Each and every country must do lucky draws Those people who have taken all the doses only those must be allowed to take part in the lucky draw COVID-19 Vaccine,en
2022-11-05 07:52:02+00:00,114b3f482c3d5fcccc3bcf31e7556343fe802b11e4e33630c7765b0192a04760,@gimmickannoying Body autonomy? Fuck the covid 19 vaccine I'm never getting it. Wait now we wait...,en
2022-11-05 07:51:50+00:00,f646418a00d5065cf0b355a1d4f8405d101fac41e00179e45ad8fd405591b3ae,"""Chinese Covid-19 vaccines causing leukaemia, China's National Health Commission document reveals: Report; but The World Health Organization (WHO) had validated the Sinopharm vaccine and Sinovac"" https://t.co/b3FOgB2OfY",en
2022-11-05 07:51:32+00:00,a3ccf1d2d740ee6f4c249f0f1424850936d376b178bdacd2cbde247fd168fb5f,Frequently asked questions on #Covid 19 #vaccineshttps://t.co/6SZb91o7Ww 15 killed in Russia cafe blaze after flare gun discharged,en
2022-11-05 07:51:31+00:00,a3ccf1d2d740ee6f4c249f0f1424850936d376b178bdacd2cbde247fd168fb5f,Frequently asked questions on #Covid 19 #vaccineshttps://t.co/6SZb91o7Ww Russia emergency officials say a fire in a cafe has killed 15 people in a city north of Moscow,en
2022-11-05 07:48:45+00:00,416eefd91638fa5322299de20591f3a9a1b3b33e55e43c625bf935e6b97829c4,Japan Bombshell: COVID-19 Vaccines 4X+ Myocarditis Risk than Background Population: 'Extremely High Myocarditis Death Odds'  https://t.co/gUsyOKHPHA,en
2022-11-05 07:41:33+00:00,c2b7596240bfee3b4cacc2c1302b0087063bf15884a091088e9196fc29f3984d,Pfizer/BioNTech say updated Covid-19 booster generates 'substantially higher' protection against Omicron subvariants than original vaccine - CNN https://t.co/25iR1Mqr8k,en
2022-11-05 07:30:49+00:00,40d503a130373cdd81a63c3c64d15521,Petition: Remove indemnity from the manufacturers of covid-19 vaccines https://t.co/PKqOxp8ECo,en
2022-11-05 07:30:40+00:00,8dfe11c89c1c90e5a1425af565e1bf13573c30fcc0fd979f19cff310fbfcd784,"In the fight against #COVID-19, a #vaccine is a critical part of addressing the global health crisis by decreasing rates of infection, disease, and death worldwide. https://t.co/HYwTWYFtRi",en
2022-11-05 07:24:25+00:00,77117dd160424699e8ba963307eccafd,HHS Hosts Historic Ethic Physicians Briefing on Updated COVID-19 Vaccines https://t.co/PZNSB5Wl13,en
2022-11-05 07:22:12+00:00,e627e17d336f5053513f136562047816,"@sardesairajdeep @IndiaToday Shri Sampat Saral sez, the current dispensation has just one mission statement: build Lord rAma temple. Thusly , you can't expect them to worry about bridges, education, pUl nor producing Covid-19 vaccine which alas was made possible by their bete noire Shri Nehru Ji.",en
2022-11-05 07:18:20+00:00,6fcbeb8162621a8a00e5da5537aa8873,The Lies the the intentional Deaths of our Boarder Agents The Deaths of our Military Soldier's and all the Deaths of our Family member's do to the COVID 19 Vaccines was enforced by the Biden Regime. There Blood is on the hands of all Democratic Politicians! Your Days are Numbered,en
2022-11-05 07:17:20+00:00,0bf538816264293dab9b93381e60ac60dadec572bd582a07d671e7b0b8e84270,🌎 Global COVID-19 vaccine rollout🟩🟩🟩🟩🟩🟩🟩🟩🟩🟩⬜⬜⬜⬜⬜ 68.15% (estimate)Vaccine doses deployed: 12.9BThe rollout seems to be speeding up#COVID19 #EpiTwitter #Vaccination #PublicHealth https://t.co/afblspIbir,en
2022-11-05 07:12:04+00:00,94c925bda076c1f2790440699ecb89153a934e905453a92b5b6498760bc10a98,@Pickles_Malone @DrMohammadIAdi1 For fear may get COVID-19 from someone who doesn't care who they give it to and will end up in the hospital but no one was ever forced to get the vaccine shot and those whose jobs were terminated because they refused well then offered their jobs back 2,en
2022-11-05 07:12:00+00:00,a8422acf5ff6e5029da364ee12bda231,"@BGrimm_Energy For example, at present, B.Gimm's companies can produce drugs to treat Covid-19 such as sotrovimab, remdesivir, molnupiravir etc. or produce mRNA-type vaccines in collaboration with Chulalongkorn University.  https://t.co/eO2P9Xg3iM and  https://t.co/6U26V67rZU",en
2022-11-05 07:06:25+00:00,c047b87ea58e3016362c2f8c7b356df15135c7784d89dc84a9d84551f61190fb,"@ZacBissonnette Stop calling the COVID-19 mRNA a vaccination. It is a lie and confuses the public. A vaccination prevents contagion and prevents transmission. The so-called COVID vaccination does neither because it is an mRNA, not a vaccine.",en
2022-11-05 07:04:57+00:00,15a2b7454859828739efa6c644c4d1ab2039da185039674ab7b92bcce3aadc5b,"@Sniffy2 @hot_and_dead @GoAngelo You cant make predictions? ""Musk told the New York Times’ Kara Swisher he won’t take a Covid-19 vaccine once it’s available"" Awesome! Good for him!",en
2022-11-05 07:04:37+00:00,f4a0f5278f2dd905868714a5b36e1b0ba1911246fd711d4971f4ff9a9e365382,"@ZacBissonnette young people by ridiculous margins. By contrast,  COVID-19 primarily affected the elderly and we forewent targeted protection in exchange for one-size fits all medicine that we have NO CLUE what the repercussions will be.3) Vaccine mandates literally led to enabling the",en
2022-11-05 07:02:22+00:00,a0e268cd74a5957b876a2ae73a353bec98337e3dc34525c5d51d1023ec262913,"@Clayton89430236 @ManBearPig2626 @ShortedTriac @TheeCompTroller @little_nenee @JoeBiden Yep. That's who I was talking about. Biden. Trump never would have tried to mandate vaccines, or control how doctors treated COVID 19, etc. And, Trump had wanted to fire Fauci after he'd been in his position for decades, &amp; I believe was planning to do it right after election.",en
2022-11-05 07:01:36+00:00,83d0f84654122ce35a5e243942b1206a,"Vaccines are our best protection. If you are 50 years and over, you can get your free Covid-19 booster at Middlewich Victoria Hall on Civic Way from 9am to 1pm or at Hollowood Chemists on West Street in Crewe from 9:30am to 5:30pm today. Find out more at https://t.co/1ySmGQevJn https://t.co/lHqkGKtwHG",en
2022-11-05 07:00:01+00:00,54484dd1060c2b0095fed02fc0a1bf563569d9d89f716b642f1ef4344451dddd,"Due to the Interruptions of vaccination campaigns and immunization activities by the COVID-19 pandemic, many children that live in remote, fragile, and conflict-affected areas were unable to get vaccines. #PolioVaccinationUG #NVIntroductionUG #VaccinesWork https://t.co/nygqWbFThU",en
2022-11-05 06:58:59+00:00,c047b87ea58e3016362c2f8c7b356df15135c7784d89dc84a9d84551f61190fb,"@claushetting Stop calling the COVID-19 mRNA a vaccination. It is a lie and confuses the public. A vaccination prevents contagion and prevents transmission. The so-called COVID vaccination does neither because it is an mRNA, not a vaccine.",en
