date,userid,tweet,lang
2022-04-08 17:48:41+00:00,2ba0e0030aff6ac2054f3f95bab9daf6,Animals at Calgary Zoo receive the first dose of COVID-19 vaccine https://t.co/wAyZpmJhDH GET RID OF THAT SILLY THUMBS UP INDIVIDUAL AND REPLACE WITH A PICTURE OF ANINTELLIGENT GORILLA FACE WOULD BE GOOD.,en
2022-04-08 17:48:01+00:00,f917245593acbfbe04f997a5e7fe3789,"#Pfizer hired 600 employees in the months after its COVID-19 vaccine was authorized in the United States due to the “large increase” of reports of side effects linked to the #vaccine, according to a document prepared by the company.https://t.co/vu63LJQtL5",en
2022-04-08 17:47:32+00:00,7e897c9af631d316447b9e51f0a89c0c6315af655a3798edd9e5bd9b253d0b10,"$11 million COVID-19 vaccine outreach contract to a tiny, inexperienced business run out of a Montrose apt by 1 woman who just happens to have worked as a Democratic operative &amp; whose bid for the project initially scored lower than a reputable, much larger competitor: UT Health.",en
2022-04-08 17:47:04+00:00,7e897c9af631d316447b9e51f0a89c0c6315af655a3798edd9e5bd9b253d0b10,"@NYAnna22 $11 million COVID-19 vaccine outreach contract to a tiny, inexperienced business run out of a Montrose apt by 1 woman who just happens to have worked as a Democratic operative &amp; whose bid for the project initially scored lower than a reputable, much larger competitor: UT Health.",en
2022-04-08 17:46:25+00:00,052e833334904e1f701c18adae2676c5,"Help fight COVID-19 and keep your family safe with the COVID-19 vaccine. Covid-19 vaccines are safe, effective, and free. https://t.co/nYPymUe3fQ",en
2022-04-08 17:46:04+00:00,f19af229579e7d30c0b91d676fadb432,"“Moderna Inc said on Friday it was recalling 764,900 doses of its COVID-19 vaccine made by its contract manufacturer Rovi after a vial was found contaminated by a foreign body.”",en
2022-04-08 17:46:02+00:00,4351c1e20d2bfcf7697cf5d3a323ec3f,New Practice paper on sex representation in trials for several COVID-19 vaccines and treatments finds “no structural under-representation of women in the trials of the assessed medicinal products” — results inconsistent with some prior studies➡️ https://t.co/IfRkPMrnDy https://t.co/zAvJq0RWP7,en
2022-04-08 17:45:04+00:00,f56934eeb2a305231ceff93ecedec5bd,"#LATEST: Moderna on Friday said it was recalling 764,900 doses of its COVID-19 vaccine made by its contract manufacturer Rovi after a vial was found contaminated by a foreign body, Reuters reported. https://t.co/0jrH423znM",en
2022-04-08 17:45:03+00:00,71ba1f1ea104615177b3043c5a970722bc4ad4ac6e8ca30939073f5a44ae5f41,Who is eligible for the 2nd booster? Schedule your appointment today at https://t.co/AxjQZ18zyl. Need help scheduling? Call 330.451.1681 for help today. Getting your COVID-19 vaccine keeps Stark County Strong. Healthy. Together. https://t.co/lcxZqZGQfU,en
2022-04-08 17:45:00+00:00,664c7d067235c0d6428b1a25b55f191c8297af1613975f306d106ba5d81b3f5b,Exports of an Indian COVID-19 vaccine halted after WHO finds problems at manufacturing plant | Science | AAAS https://t.co/WvgYNSvNls,en
2022-04-08 17:44:21+00:00,24ba82962de59f267845aa43265b265fada00787cccf4bd6c554d28530124682,ECDC and EMA Issue Advice on Fourth Doses of mRNA COVID-19 Vaccines https://t.co/iGz0k1Sjvj,en
2022-04-08 17:43:28+00:00,d237e3f3ce320b6e05b2ff585078180e,"Get vaccinated at home! The ""Vax Visits"" program makes it even easier to get your COVID-19 vaccine. Call the Erie County Dep't of Health (@ECDOH) at (716) 858-2929, 8:30 AM – 4:30 PM,  Monday – Friday.Learn more (or sign-up for any other clinic) at: https://t.co/RM2WDoviYh https://t.co/zMqi8AN6wE",en
2022-04-08 17:41:03+00:00,2bce2b0798d961aab3f45abaeec4ddb0efba49bbaa167c403b729780bb04eb05,"New Research: Willingness to Receive COVID-19 Vaccine and Associated Factors Among College Students in Gondar City, Northwest Ethiopia: BackgroundThe increasing incidence of coronavirus disease 2019 (COVID-19) continues to cause morbidities,… https://t.co/vtSyVAb34k #Education",en
2022-04-08 17:40:00+00:00,704270cb899e402e2b67a16c4dcdbef9,Help your community stay informed about the safety and effectiveness of #COVID19 vaccines and boosters. This will help community members feel ready to get the best protection available against COVID. Join the COVID-19 Community Corps at https://t.co/dRE98fr8G0. #WeCanDoThis,en
2022-04-08 17:39:00+00:00,77a632e7e07d816e8905dec30b9865ca830238aaf7c1bb2f3252b9fb324d78d2,ONLINE FIRST @ASAMonitor: 🌎In The Know: COVID-19 Vaccines Saved Lives ❌Quality and Regulatory Affairs: ASA’s Advocacy on USP &lt;797&gt;: The Campaign to End the 1-Hour Rule ▶️Read: https://t.co/6EwcUdV3mN https://t.co/BdYdNS8bnT,en
2022-04-08 17:38:15+00:00,a2287365435d61497bf1c595c048a57f765cd6d09b31e4c75faf5a262ee136c2,Third Dose of COVID-19 Vaccine Significantly Increases Immune Responses in Most Patients With Multiple Myelomahttps://t.co/XWvJ3vk9Og,en
2022-04-08 17:37:58+00:00,490a31560ebd64cfbf05d6571a591d45,Vaccine card: B.C.’s last major COVID-19 measure liftedhttps://t.co/IUvPj4jgZk,en
2022-04-08 17:37:26+00:00,91e03e42be391f8998a269b1576b14ab,😯 Exports of an Indian COVID-19 vaccine halted after WHO finds problems at manufacturing plant https://t.co/P47Tc8fWX4,en
2022-04-08 17:37:26+00:00,f773d23a2dc8aad804f10b068b67de70,Vaccines in your salad? Scientists growing medicine-filled plants to replace injections | WWLPCovid-19 vaccination now in vegetables??  https://t.co/8AYebnsQSh,en
2022-04-08 17:37:12+00:00,3028c4e8e1a9795f0c4f763c79bc14fbbd7ba630a47e9a4dbfb329c2006dc191,COVID-19 vaccine decision of the US Court of Appeals - #court #us https://t.co/oqmK5Wdz7i,en
2022-04-08 17:36:27+00:00,0ad989a5b4d34bbf3bebac728afb9abb,"Government has written to Pfizer to determine how to dispose of 260,000 expired doses of their COVID-19 vaccine.https://t.co/5SIpsoEKLe",en
2022-04-08 17:35:47+00:00,7735d2a671f99ee161b07e9d9aea8a55,"Just two weeks until our Team Green Resource Fair!! Mark your calendars for Saturday, April 23 from 1-4pm.  Come on out to Feltonville Recreation Center, where we will host family-fun activities, a pop-up COVID-19 vaccine clinic and more. I hope to see you there! #SpreadTheWord https://t.co/ot3XI6LqQC",en
2022-04-08 17:35:42+00:00,31e7fb0416f3575ae97dd86c826b59d6,"Today, we celebrate our lead team. They were very pivotal in making sure our drive thru COVID-19 vaccine clinic went smoothly. We so appreciate their help! #NPHW https://t.co/bLbylfBKWg",en
2022-04-08 17:35:40+00:00,de1ca09b295eba0f35847d413739d3c2a7c12f5ddb58be84beb7a0315f40a65e,"No proof COVID-19 vaccine affects menstruation or fertility, despite various unsupported claims on social media https://t.co/2St07zTvAD",en
2022-04-08 17:35:35+00:00,a9104cc0d3b233b8611d2c215370ca10101fac41e00179e45ad8fd405591b3ae,"Pfizer's Covid-19 Vaccine Documents Counter ""Safe And Effective"" Narrative https://t.co/o4eN5A1T68",en
2022-04-08 17:35:09+00:00,919b83af6fcf7e9d67b381dc585765fb,FDA’s Vaccine Panel Questions The Sustainability Of Our Covid-19 Strategy https://t.co/MNBbTRBKSs,en
2022-04-08 17:33:11+00:00,5482df86c52fc3fcfdbe30ffc9ce2faa,"@Lisaskygirl_ @RookieRed45 @Jane75172128 @jwerb Covid-19 is NOT a cold. It is in the Coronavirus family, but it is far from a cold. I'm part of an involuntary test group - no vaccine, no treatment available, they didn't even think it was widespread enough for me to have it, when I got it.  9 months later, no antibodies to it.",en
2022-04-08 17:32:47+00:00,43dcef0bd4fab9586975919626b26359efebf53433a2584f1d1fed1c45cdbee3,"🔥On March 24th, 2022, New York City Mayor Eric Adams announced that professional athletes and performers would be exempt from the COVID-19 vaccine mandate that still applies to all New York City municipal employees in the five boroughs of NYC. https://t.co/uXnXCflBNS",en
2022-04-08 17:32:05+00:00,bd19e480f6d379c58aee8c03f79d88064d9991957655dac241f70aabccfc3d0a,"#WashingtonDC #Coronavirus Psaki, Garland, Pelosi: Covid-19 spreads among leading Democrats and Biden officials: Several dozen tested positive after a dinner hosted by the Gridiron Club, where proof of vaccine was requiredGrowing numbers of prominent… https://t.co/7R745i4nUy",en
2022-04-08 17:31:16+00:00,f8bc916279f2c62cbf88e1c3b4140478,ECDC and EMA have concluded that it is too early to consider using a fourth dose of mRNA COVID-19 vaccines in the general population.Read full article here: https://t.co/1acsp2fr7i,en
2022-04-08 17:31:12+00:00,683ceda1247c13790b4b223f6980e924,Getting a #COVID-19 vaccine is a safer choice for yourself and others! Get vaccinated to #protect yourself and your #family. Find a COVID-19 vaccine near you! #VaccineFinder  https://t.co/ppcGO3Yi4j https://t.co/0PnGXsUNAG,en
2022-04-08 17:30:40+00:00,4dfc7260ed18f72072fa2ad4c8264517,ECDC and EMA have concluded that it is too early to consider using a fourth dose of mRNA COVID-19 vaccines in the general population.Read full article here: https://t.co/rdjKOJ1k07,en
2022-04-08 17:30:18+00:00,4195f3e77f7ec30cfd755ea42b9a00cf238599685f1fc9a28e36f092a5b4ae2b,More than 7 million Virginians have received 1 dose of COVID-19 vaccine https://t.co/U7MLLGSyGS,en
2022-04-08 17:30:08+00:00,7ba5284d1392e1993435c42acf7229a3,Iran exports COVID-19 vaccines to 10 African countries https://t.co/iahOGUdnGa #Business https://t.co/eQQT88jDQQ #news 266,en
2022-04-08 17:30:03+00:00,5d26016b4c9073d49b4bcabc4b576469,"🍴Starting today, COVID-19 vaccine card are no longer needed to dine in at restaurants in B.C. https://t.co/uMwFsqmVA2",en
2022-04-08 17:30:00+00:00,8886824d6c4292b8c9b104c453cd651a,👀 Did you hear the news? 📣 The fourth dose of the COVID-19 vaccine is now recommended for people who are immunocompromised.Getting your booster now means taking the first step to boosting your immune system against COVID-19.🔗https://t.co/41DeUHVYHJ#AllInAgainstCOVID https://t.co/ALPLOhDhZb,en
2022-04-08 17:30:00+00:00,3116ea2d53f01a4531d7756e5a839ed6,GeoVax is conducting two Phase II COVID-19 vaccine clinical trials with its GEO-CMO4S1 vaccine. One of the trials is among immunocompromised patients. #covid19 #clinicaltrialshttps://t.co/dkr7i4SapL,en
2022-04-08 17:29:44+00:00,db60c2c9c889c50002f53d99f1d39c71,COVID-19 update for April 8: Vaccine passports end today in B.C.  https://t.co/FGoMn6XRB4 https://t.co/2yzZoNK1Ap,en
2022-04-08 17:26:58+00:00,30c2d935a8ebaa25386afb9d929bafa7c561aeb8b1e8bf3f0948474f0c52081d,Federal Vaccine Program Hasn’t Helped Those Whose Lives Were Altered by COVID-19 Shot https://t.co/SrhH3eFhBU via @epochtimes,en
2022-04-08 17:26:07+00:00,b6bab59434b5c5da79fde4996ed07946,@eatsruns @rmwilliams56 @jwerb There is a risk to getting vaccinated too. It is annoying that these vaccines don't prevent infection or transmission and it seems like a lot of big name politicians are catching covid-19 every time you turn around.Scientists need to go back to the drawing board &amp; do better.,en
2022-04-08 17:25:30+00:00,3660290fca4f47dc0840cc9ecff80bd5,"@Master_Yoda_1 @ShereenBhan @adarpoonawalla Oh fuck, this Moderna's trial publication. You can't use it as an evidence to support their claims or your claims. Show me a study with no conflicts of interest that shows absolute risk reduction of covid-19 vaccine and efficacy in transmission, infection and severity.",en
2022-04-08 17:24:25+00:00,5d9a80d28d37393cd86b9f8bcd32173e5206d9c856013edc1ac158f2803f4261,CBC News Changed the Headline: [Some B.C. restaurants prepare to welcome more dine-in patrons as COVID vaccine passport program ends]- to - [B.C. restaurants prepare to welcome more patrons as COVID-19 vaccine card requirement ends] https://t.co/SIrTCqYmbT,en
2022-04-08 17:22:06+00:00,85860cef2042cee98516e2985f40052e,"“To create the COVID-19 vaccines, all types of scientists came together to save countless lives.” – @VP Kamala Harris, in the new issue of Pathways. Learn more about this free #STEM and ELA resource on vaccine science. https://t.co/O8zdgSoQ74 #NIGMSPathways #BiomedicalBeat https://t.co/pxJh0Uu6BL",en
2022-04-08 17:22:05+00:00,94a1f1ecb719edbd3710143d58a913b9,Appeals court reinstates COVID-19 vaccine mandate for federal workers https://t.co/H4Lh9XcVV1,en
2022-04-08 17:21:40+00:00,c48775b7c9f723b6fa3de4059845240f,Appeals court reinstates COVID-19 vaccine mandate for federal workers https://t.co/pcdHno9b2B https://t.co/GBQE3gd1l1,en
2022-04-08 17:21:28+00:00,4673783f44c86e743580982a2dc4c55d064f32514e00abf0494687746e11514f,Vaccines help mitigate the severity and long-term risks of Covid-19. Vaccines &amp; boosters are available and free. Visit your neighborhood pharmacy!,en
2022-04-08 17:21:25+00:00,66f4547c14e6bebca9ada3caf17927b685d105f85cfe92f4d02a8d1a7f9a2937,✨Happening tomorrow!✨Just a friendly reminder that we will be having our Covid-19 Vaccine drive with Asian Youth Center on the 9th from 10 am to 2 pm @ Smith Park in San Gabriel. Scan the QR code to schedule your appointment!🥳Walk-ins are also welcome! 🥳 https://t.co/tLlO0ZtZsX,en
2022-04-08 17:21:15+00:00,77aad4022e2c0449c8342e59260b7cd6,"Got my 2nd COVID-19 vaccine booster today--3 Moderna &amp; last one Pfizer. Arm's not sore, but my left eye can now render objects in Predator vision? https://t.co/DAWva5xDn1",en
2022-04-08 17:19:07+00:00,6b13727103c33b0b882e44efd67e0cd9,"WHO) has raised unspecified concerns about the manufacturing of Covaxin, one of India’s home-grown COVID-19 vaccines. WHO said it had found problems during a March inspection of the production facilities of Bharat Biotech @speakshoutroar  @VishnuFNO    https://t.co/QnrrQXRZij",en
2022-04-08 17:18:51+00:00,1d97fdafde2c431d75264696860de9a9d92f4f7e9dbca8303606cb43efe617a5,"@itsAaron77 @GBNEWS “Following widespread use of these vaccines across the UK, the vast majority of suspected adverse reaction reports so far confirm the safety profile seen in clinical trials.” It added: “The expected benefits of the vaccines in preventing COVID-19 and _",en
2022-04-08 17:16:30+00:00,01c4cfad4363e5600ec0301ec406d5bb,Raghav @sundar__raghavand his students from @NUSMedicineMedical students demonstrate efficacy of COVID-19 vaccines in multiple immunocompromised patient groups https://t.co/6FbBplyp71,en
2022-04-08 17:16:03+00:00,65554cbde6f9203ce13c587ee6200fb9,#MRI Can Detect #Myocarditis in Young Patients #Vaccinated Against #COVID-19: https://t.co/F1RDbBEqmb #Vaccines #hearthealth https://t.co/o37730SMEl,en
2022-04-08 17:15:53+00:00,3cba1bd68376dd75e2f8731a2c3d4cc1,Vaccines are key to reducing the risk of COVID-19 during the 6th wave. Appointments are now required - book through the provincial booking system over the phone at 1-833-943-3900 or online at https://t.co/usqmPCM6q3 #GetVaxxed #GetBoosted,en
2022-04-08 17:13:27+00:00,34fcd01a10e7877ce2fb6e8c0e2acdf2,"2/3) Example: BRHD partnered w/ @VIAschool to create low-stimulation areas at our COVID-19 vaccine sites. VIA staff &amp; community members w/ lived experience came to our sites before they opened to provide input on everything from physical layout, signage, lights, sound, &amp; more!",en
2022-04-08 17:12:59+00:00,f5227d0c7b46fe4e5eef9f3f3c3359b7,Moderna recalls thousands of Covid-19 vaccine doses in Europehttps://t.co/YWhCLffIsV,en
2022-04-08 17:12:31+00:00,80a31c42a1a72d9e53295424c4c320a7,"Stay up to date on COVID-19 vaccines. Talk to your doctor about whether you need to wear a mask and take other precautions if you are high risk. Get tested if you have symptoms. Those with symptoms, a positive test or exposure to someone with COVID-19 should wear a face mask.",en
2022-04-08 17:12:05+00:00,21adc1803dd029f76ac12ae4cf6073a3,Moderna recalls thousands of COVID-19 vaccine doses in Europe https://t.co/U90sPo2qwH https://t.co/QIXUDTmsTI,en
2022-04-08 17:11:05+00:00,d5fc3a5012f5a19df42150d9aa5b3300f1801e9c70d0db1f66665cab4a217d64,"Prior to the COVID-19 pandemic, a vaccine could take 10 years or more to develop🔬 That changed in response to SARS-CoV-2: the world rallied together and produced a safe and effective vaccine in just 326 days🚑 Could we go even faster? #100DaysMission https://t.co/k8U9D0vf1f https://t.co/2fyfOuQJdZ",en
2022-04-08 17:10:21+00:00,a08abde2c6616e929170408a9ac5d0aa,T cell exhaustion - COVID-19 vaccines update 37 https://t.co/MsuG3POsiX via @YouTube,en
2022-04-08 17:10:07+00:00,3e7894430691435340ab06fb492600f6,"Happening tomorrow (Sat 4/9)! Free COVID-19 vaccines, car repair, at-home test kits, masks, &amp; more. To schedule a vaccine, call (734) 787-6477 for English and (734) 492-5747 for Spanish.#WashtenawCounty #HealthyTogether #Ypsilanti @PackardHealth @MichiganCEAL",en
2022-04-08 17:09:36+00:00,5bd1feccf78bb5f656afdfc9e29821677a0b998ca9aff54c3be6fcccf7210728,Comparison of health-oriented cross-regional allocation strategies for the COVID-19 vaccine: a mathematical modelling study https://t.co/fYGJGnh9Ww,en
2022-04-08 17:09:21+00:00,47ff9bf2aef93a5474c5a845f9d94a2a,".@CDCgov advises getting your booster shot 5 months after receiving your primary COVID-19 vaccine series. However, you should get your booster shot 2 months after receiving the single-dose J&amp;J/Jansen vaccine. Visit https://t.co/nBz2k6Vg9n to locate a vaccination clinic near you. https://t.co/uHkdOmuYMP",en
2022-04-08 17:09:20+00:00,2b95f6ed41cd3eebf6a0d78b91d261d4,Federal vaccine mandate reinstated as COVID-19 cases surge in NYC and Washington DC – Digital Journal https://t.co/V8eYvUCqMG,en
2022-04-08 17:09:19+00:00,9f37708283b706384d5505e360b7e587,"“Despite the availability of life-saving COVID-19 vaccines, so many people died in the second year of the pandemic in the U.S. that the nation's life expectancy dropped for a second year in a row last year, according to a new analysis.” https://t.co/v6VVqtV46E",en
2022-04-08 17:09:18+00:00,000b85d2e8307a68e9eb71a32d14eddf,Interesting…“She said her doctors believe a combination of chronic COVID-19 and her body’s response to the Pfizer COVID-19 vaccine triggered an extremely rare disease – transverse myelitis “https://t.co/5rQA0frYV5,en
2022-04-08 17:09:00+00:00,a7e5391ff6996d104ad387971dd7d382,"The Novavax COVID-19 vaccine is now available for adults 18 and older. Novavax can be used as a first, second, or third (booster) dose – on its own or as part of a mixed series with another approved vaccine. To book your appointment, visithttps://t.co/XE3uNHYFCc https://t.co/2fgRSZsTv1",en
2022-04-08 17:07:29+00:00,2f51356f47748699f65588ae6ded8cb7,"Life expectancy drops again ""Despite the availability of life-saving COVID-19 vaccines @NPR? 93.2% of all COVID ""reported"" deaths have been 50+ years old. While focusing on vax'ing young adults and children who were not at risk. COVID #SeniorGenocidehttps://t.co/qS91aP2DhU https://t.co/G9RUHt5SUm",en
2022-04-08 17:07:02+00:00,edb5bb5ec74b31a9b97271222c61ee63,"New CDC MMWR study found some people can be reinfected with #COVID19 shortly after initial infection. To best protect against reinfection, everyone ages 5+ years should stay up to date on their COVID-19 vaccines. Learn more: https://t.co/Or3iD6RVZG https://t.co/H7tuLEZLSp",en
2022-04-08 17:07:00+00:00,e1edb8d67cb60ab8916e4eaa4edee7cf,"Unmask the Facts - This edition covers how to order your second round of free COVID-19 at-home tests, brain changes linked to COVID-19, the dangers that COVID-19 poses to kids in 2022, and new research about vaccine dosing for children. https://t.co/HWhpt9tvZu https://t.co/oPrGmD9Wwq",en
2022-04-08 17:06:23+00:00,6d817f817a79bfe563bdf0849db1aa40,"Norristown NAACP, &amp; Montgomery County will be hosting a COVID-19 Vaccine Virtual Conversation on Thursday, April 28 at 7pm. Join us for conversation as we connect  community leaders with the community to share the latest information on COVID-19 vaccines https://t.co/bdS9XMhrvX",en
2022-04-08 17:06:15+00:00,b26833c9f6dcb13272a227b035b1ea51cc66a4a8924dd0b82011aa7cad80cc56,"Covid-19 Cases, Vaccine Boosters and Testing News: Live Updates https://t.co/CQRxyW23XD",en
2022-04-08 17:05:10+00:00,4e3fb2d430196d00aa78b599a09e7cec,"Good news for 18+ citizens!Precautionary COVID-19 vaccine doses to be available from 10th April, 2022 at Private Vaccination Centres. #IndiaFightsCorona #LargestVaccineDrive https://t.co/T34j53BJLT",en
2022-04-08 17:05:06+00:00,27f47991383e257219421ae49f10670c,"Reminder: The mass COVID-19 vaccination clinic at the Sports and Learning Complex will no longer offer vaccine after 2 p.m. today, April 8, 2022. There are #COVID19vaccine clinics operating throughout the County.Clinic locator: https://t.co/M1IdL1NtXq https://t.co/6V7R7KUl4E",en
2022-04-08 17:04:40+00:00,1fae1e1f166cfd415c34dbf65b7713c2,"I get why Black people don't trust the medical field to get the COVID-19 vaccines or vaccines in general. I got my shots &amp; booster, but I get it.I don't trust those assholes in the medical field either. They don't listen to us, and there is serious bias in referrals.",en
2022-04-08 17:04:25+00:00,54df66812c96cf0002a0198e5228a78115eb187b9ce4f71f90b9d03eacf51213,Federal vaccine mandate reinstated as COVID-19 cases surge in NYC and Washington DChttps://t.co/tGFW9rL3sS https://t.co/mNqlqwJL56,en
2022-04-08 17:04:23+00:00,000b85d2e8307a68e9eb71a32d14eddf,Do COVID-19 vaccines cause hearing loss? WHO investigating reports https://t.co/Blw1DPKZEM,en
2022-04-08 17:04:16+00:00,dfb26ee51104033da3649a74c614e3af,"Moderna recalls thousands of Covid-19 vaccine doses in EuropeApril 09, 2022 12:43 AMThe lots were distributed in Norway, Poland, Portugal, Spain and Sweden in January.https://t.co/KKt9LF0won https://t.co/vVToX8OLt8",en
2022-04-08 17:02:39+00:00,f34fe3574e54d4bea05b9dc1673c283ef041e39ed57db66f7af108e88fc5c211,"@FDRLST Imagine thinking that Dolly Parton, who gives out free books to kids, and who donated $1 million to COVID-19 vaccine research, is on your side of the aisle. https://t.co/T5dwp9Z6Zh",en
2022-04-08 17:02:24+00:00,e32a203f8f84b0d2e16caee8a0d9977c,Children aged 5 to 11 are now eligible for the COVID-19 vaccine.Visit 👉 https://t.co/SHKbKGI0GE for more information &amp; to book online. https://t.co/2VkcG82vZG,en
2022-04-08 17:02:14+00:00,607a7d9428001c7704e54130d71bbb16,Andy Vermaut shares:4th dose needed? Experts weigh in on latest COVID-19 vaccine study - https://t.co/H5IaUwoQyd:… https://t.co/COiAMG54Ow Thank you. #AndyVermautSharesThisNewsWithLoveAndHopes #TheWorldCanBecomeABetterPlaceSomedaySometime #WeNeedMoreLoveForWorldPeaceNowAndAlways https://t.co/BIjDzpesvv,en
2022-04-08 17:02:12+00:00,4a22b9bda22b691c612ac30f54b90921,"People aged 75 and over, and people aged 12 and over who are immunosuppressed, are now eligible for a Spring COVID-19 booster vaccine.  The NHS will contact eligible people to book their next vital jab. Visit https://t.co/7cNpDjW3ZA for more information. https://t.co/8vMr3VrjJD",en
2022-04-08 17:02:12+00:00,410c65bdd87ddcc8a6798028723df3d0,"People aged 75 and over, and people aged 12 and over who are immunosuppressed, are now eligible for a Spring COVID-19 booster vaccine.  The NHS will contact eligible people to book their next vital jab. Visit https://t.co/o2EYGGXcsY for more information. https://t.co/BS769LXxoT",en
2022-04-08 17:02:11+00:00,c50d92c639c683252757593f232f8cb9,4th dose needed? Experts weigh in on latest COVID-19 vaccine study - https://t.co/KJ2Lm0laaN https://t.co/cdjEGTACts https://t.co/hGZWLDRmCq,en
2022-04-08 17:01:56+00:00,debeed7b35662f034b21dd0b7672e36a,No Appointment Needed! Here is the upcoming Metro Health hosted pop-up COVID-19 vaccine clinic hours across the city. To find the nearest vaccine clinic visit us online at https://t.co/YLcnpmdF0J https://t.co/kqQDK2ylIb,en
2022-04-08 17:01:26+00:00,684e4d436fa5e2d6160937d58a174f7d7961af9c94b05b1bbf1858256f1dbb58,NYC Health + Hospitals/Coney Island Nursing Director Manjinder Kaur and her two daughters all got the COVID-19 vaccine to keep themselves and each other safe. Get your vaccine or booster shot today. @NYCHealthSystem @ConeyIslandHosp https://t.co/rPrufFHn6T https://t.co/p8KAPzTKZh,en
2022-04-08 17:01:20+00:00,b491747706481e368dc358027ff781544fb14c7d5f2e689ca9ead074ae4f8600,"People aged 75 and over, and people aged 12 and over who are immunosuppressed, are now eligible for a Spring COVID-19 booster vaccine.  The NHS will contact eligible people to book their next vital jab. Visit https://t.co/DG642Cf1o0 for more information. https://t.co/GnSZoEVvSo",en
2022-04-08 17:01:20+00:00,69f94405e466280d35944b11b2629696f963cd995f82474e37fd53b0377f1243,"People aged 75 and over, and people aged 12 and over who are immunosuppressed, are now eligible for a Spring COVID-19 booster vaccine.  The NHS will contact eligible people to book their next vital jab. Visit https://t.co/GDAKvoytBb for more information. https://t.co/wkOqzfWdXZ",en
2022-04-08 17:01:11+00:00,a999c5a2f6490176fa716ec014eecd9f,Children aged 5-11 are now eligible for the Covid-19 vaccine.If your child has recently had COVID-19 they will need to wait 12 weeks after infection before getting vaccinated. You can book an appointment  for a smaller dose of the COVID-19 vaccine.👇 https://t.co/hW2KDMCplK https://t.co/gAQgH2fJSZ,en
2022-04-08 17:00:33+00:00,d48f34cebd404d93b4f12c608e3b46fca78d6d900129fb41c0a71326aead0ef2,"Covid 19 #vaccines reduce the risk for infection, serious illness and death. Please visit https://t.co/SESDFuz8P3 #ctbiotech #ppe https://t.co/l10kKxdi5l",en
2022-04-08 17:00:26+00:00,d918ff146e930ae494287193a795a8e90d38230d2267eab691eb4a2b606beb83,"For more information on Covid-19, including available vaccines, please visit our hub https://t.co/QkMO1FZaPG https://t.co/GAXn4Tk5Tw",en
2022-04-08 17:00:25+00:00,46cd1951a5387e36fa6fe0ff83b93624,"Due to changes in federal COVID-19 relief funding, uninsured people who seek COVID testing, vaccine, &amp; treatment will potentially have to pay for those costs out of pocket. People’s Community Clinic will continue not to charge patients for these services. https://t.co/UjMFbVvVnz",en
