date,userid,tweet,lang
2022-07-24 09:18:50+00:00,1160383973119238144,"Shingles eh?""To date, there is no data available on the safety of mRNA COVID-19 vaccination in AIIRD patients, as immunosuppressed patients were excluded from the vaccines’ clinical trials.""Hmm.  Probably should have tested those vaccines a bit more.https://t.co/PEs3V0dCxi",en
2022-07-24 09:18:36+00:00,1462438536385282048,Birx Says COVID-19 Vaccines Were Never ‘Going to Protect Against Infection’ https://t.co/Nd0fwu9DWU,en
2022-07-24 09:17:13+00:00,1308355861966921729,@RachelNotley You mean the science paid for by political spin doctors? Riiiiight 🙄#Covid_19 #Vaccines,en
2022-07-24 09:16:48+00:00,794778854,Patient Education Webinar with Dr. Aditi Barghava PhD. who talks about the University of California Research Study: 'People’s Response to COVID-19 Vaccine Efficacy and Safety' https://t.co/XGUrO5kXLR,en
2022-07-24 09:12:23+00:00,779825043719196672,"Why do you use words like ""low level of thinking..extremely shallow...?""How far in school have u gone? It's like U invited a Covid-19 vaccine!Or even made a Hoe or toothpick;what have you made that defines you as KAKENSA(Brainy chap)?We have a name for chaps like U,but won't say!",en
2022-07-24 09:11:23+00:00,1519662494310088704,#MonkeypoxMonkeypox? Hepatitis? Sudden Adult Death Syndrome? Something is very wrong and it’s because of the Covid-19 Vaccines:https://t.co/oFCemvMV2S,en
2022-07-24 09:11:00+00:00,990757043161059329,@blanc0981 Vaccine trials for children and adolescents and other COVID-19 vaccines are ongoing and WHO will update its recommendations when the evidence or epidemiological situation justifies a change in policy.COVID-19 has also been a more serious and dangerous disease among older people.,en
2022-07-24 09:09:22+00:00,990757043161059329,@blanc0981 Can children and adolescents get vaccinated against COVID-19?The Pfizer vaccine can be safely administered to children from 5 years of age. Both Moderna and Pfizer vaccines are licensed for use in children from 12 years of age.,en
2022-07-24 09:09:09+00:00,1250536454264160256,@DrTedros @WHO 1000 Peer Reviewed Studies Questioning Covid-19 Vaccine Safetyhttps://t.co/F06Nm1OdwE,en
2022-07-24 09:08:00+00:00,1250536454264160256,@CiscoRucinski @DrTedros @WHO Clearly the mask use has left you oxygen deprived. 1000 Peer Reviewed Studies Questioning Covid-19 Vaccine Safetyhttps://t.co/F06Nm1OdwE,en
2022-07-24 09:05:14+00:00,1423179035278905348,The largest study to date shows how Covid-19 vaccines affect periods https://t.co/gTHSD0hlyy,en
2022-07-24 09:00:42+00:00,1328929711,"When you book your 5 – 11 year old a COVID-19 vaccination at one of the large vaccination centres listed below, you can also bring along other members of the family who may be due their vaccines: https://t.co/jO9ONYdGLS",en
2022-07-24 09:00:07+00:00,242241907,"If you are under 18 and at higher risk from COVID-19 due to an underlying health condition, you should wait at least 12 weeks from a confirmed COVID-19 infection to get your vaccine. Find out more at https://t.co/StFCxqAQo2 ◀️#NHSGGC https://t.co/7nJFmbEhr5",en
2022-07-24 08:57:47+00:00,1551121056131612672,"@BadCustSvc101 @NSWHealth @drkerrynphelps From the reportQuote: ""Over 95 per cent of people aged 16 and over in NSW have received two doses of a COVID-19 vaccine, while more than 68 per cent of people eligible for their third dose have received it.""The rest are NOT unvaxed or undervaxed. There's Natural Immunity too",en
2022-07-24 08:56:46+00:00,581782217,Los Angeles Imposes COVID-19 Passport on Children Aged 12+ #children #covid #mandate #vaccine https://t.co/w701NhCJ7k #DemocratsAreTheProblem,en
2022-07-24 08:51:06+00:00,53874435,"@Cocolettii @TexasLindsay_ ‘..efforts to create an HIV vaccine over a decade ago, where a promising vaccine candidate actually increased the risk of some men catching the virus.Exactly how the vaccine increased the risks of HIV transmission is unknown….Ad5 is used as a vector in some Covid-19 vaccines.’",en
2022-07-24 08:50:57+00:00,859780896,"Hammond: FDA Relied on Scientific Fraud to Authorize Pfizer's COVID-19 Vaccine for Infants and Toddlers, by @lifebiomedguru https://t.co/P4ihqFJFvB",en
2022-07-24 08:48:29+00:00,1086194312096800768,Birx Says COVID-19 Vaccines Were Never ‘Going to Protect Against Infection’ https://t.co/1IL4spkd3T via @epochtimes Indeed. This has been blatantly obvious for the last 2 years.,en
2022-07-24 08:47:03+00:00,947197745470853124,"@HeikkiVienta ""Unfortunately, some people continue to spread misinformation suggesting that ADE is an ongoing concern for COVID-19 vaccines; however, scientists and clinicians are continuing to monitor COVID-19 infections and, to date, no evidence to validate this concern has emerged.""",en
2022-07-24 08:46:49+00:00,2517016539,"""Governments must use the triad of testing, therapeutics (in particular, rapid antiviral pills) and vaccines to manage Covid-19 and replace the cruder non-pharmaceutical interventions of 2020 with scientific progress""",en
2022-07-24 08:44:19+00:00,337275737,"A Covid-19 vaccine walk-in clinic for those aged 5-11 is open today at #Loughborough Hospital.The clinic will be running from 10.15am-1.30pm.For all the details, visit👇https://t.co/N9uRI0i1E5 https://t.co/zWkwWXGJBc",en
2022-07-24 08:43:35+00:00,491594719,"@Hamish1McTavish @AimiL33 The article you sent says 'Conclusion With up to 6 months of follow-up and despite a gradually declining trend in vaccine efficacy, BNT162b2 had a favorable safety profile and was highly efficacious in preventing COVID-19.'",en
2022-07-24 08:40:11+00:00,1390590130629484551,US Army Has Approved Only 20 Permanent Religious COVID-19 Vaccine Exemptions https://t.co/tiDjupkQRU,en
2022-07-24 08:39:04+00:00,289016182,She's a 10 but she thinks the COVID-19 vaccine is safe AND effective.,en
2022-07-24 08:37:44+00:00,219254618,"The U.S. Army announced on July 21 that it has approved just 20 permanent religious exemptions for the COVID-19 vaccine after having received 8,000 requests so far.https://t.co/KIIk7QLiUH https://t.co/tjGOqoZGl5",en
2022-07-24 08:37:25+00:00,1345526539039944704,Royals’ Whit Merrifield apologizes for COVID-19 vaccine comments https://t.co/nh7z68poUV,en
2022-07-24 08:36:17+00:00,1399780599347482624,💉  In autumn / winter vaccinated people drive infections and there are more deads again👉  Risk of #Covid_19 -19 27x higher among vaccinated (https://t.co/a5S5fVvHos)#Covid_19 #CovidIsNotOver #vaccine #VaccineInjured #Impfung #Impfnebenwirkungen #LauterbachRausschmissSofort https://t.co/G7XqUHdp1B,en
2022-07-24 08:30:09+00:00,825795936400052224,European Commission Approves Purchase Agreement Amendment for Valneva's Inactivated COVID-19 Vaccine - GlobeNewswire https://t.co/0qFCUyJpgX,en
2022-07-24 08:29:49+00:00,1492575160355983360,"@nazarinveronica @stephan19573 @merryweathe1 @HowardGriffiths This all goes back to my original question. People are treating ""COVID-19"" like it's garenteed to kill you... its not, so there fore not everyone needs to get a vaccine that could potentially cause more damage,",en
2022-07-24 08:27:47+00:00,1360522401008787458,Confidential Documents prove Pfizer is guilty of committing major fraud in COVID-19 Vaccine Clinical Trials – The Expose https://t.co/k6XLoT39um,en
2022-07-24 08:20:29+00:00,2171888910,"@LesGuessing @Aramati6 Been hearing that since vaccines started. ""a former adviser to the Biden administration on COVID-19 suggested that 98% to 99% of the Americans dying of the coronavirus are unvaccinated.""",en
2022-07-24 08:19:04+00:00,615103079,"Dr. Deborah Birx admitted (on Friday (July 22) that she ""knew"" the COVID-19 vaccines ""were not going to protect against infection""—an astonishing claim that comes 18 months and 600 million doses after the experimental injections were first rolled out. https://t.co/DFKOPTDy0e",en
2022-07-24 08:16:10+00:00,1662351091,"@9NewsSyd @sophie_walsh9 There's concerns Australia is facing a surge in COVID-19 vaccine injuries* cases which could have serious and lasting impacts on the community and put further strain on our hospitals.There you go, @9NewsSyd fixed your headline for you.",en
2022-07-24 08:15:21+00:00,709947536,"Vitamin D for COVID-19: where are we now?-- News, Social Impact | The Perfect Enemy: https://t.co/rEChbPxIxt.#Vaccines https://t.co/wNTM8XIh0a",en
2022-07-24 08:15:20+00:00,37716311,"Vitamin D for COVID-19: where are we now?-- News, Social Impact | The Perfect Enemy: https://t.co/RUOG7kg4V2.#Vaccines https://t.co/MabfbeGR1W",en
2022-07-24 08:15:07+00:00,1437639657852788736,"body breaks down the mRNA and removes it within a few days after vaccination. Learn more about how the mRNA COVID-19 Vaccines work on the CDC’s website.In viral vector adenovirus vaccines, spike protein DNA is placed inside a modified version of a different virus that doesn’t",en
2022-07-24 08:12:11+00:00,847307741932564484,Me waiting for those intranasal covid-19 vaccines like … https://t.co/kr06UNrUAx,en
2022-07-24 08:07:44+00:00,1504254117702602753,I Thought My Swollen Lymph Nodes Were Side Effects From the Covid-19 Vaccine https://t.co/0c5ShMcyuT,en
2022-07-24 08:00:11+00:00,1439518154292666370,@TawakkalnaApp hi I want my Covid-19 vaccine certificate urgently I m in india my SIM card is of there r many poblems I want to come back soudi Arabia,en
2022-07-24 07:58:28+00:00,802335697436864512,"Birx Admits She Knew COVID-19 Vaccines Were Never ""Going To Protect Against Infection"" https://t.co/wEwDYKoiES",en
2022-07-24 07:57:28+00:00,1437639657852788736,"trainees, of 5 large departments were surveyed to determine whether they received the COVID-19 vaccine and which type, and any symptoms they experienced after receipt of either vaccine dose. We hypothesized that vaccine recipients would be more likely to miss work or feel",en
2022-07-24 07:56:47+00:00,2594355852,"Dr. Robert Malone is the Chief Medical &amp; Regulatory Officer, and listed as the “original Inventor of the mRNA Vaccine Platform used in the Pfizer and Moderna COVID-19 vaccines”“Inventor” is doing a lot of work to infer a relationship and an expertise that may not be accurate.",en
2022-07-24 07:55:22+00:00,1452535394235559939,OMGClarence Thomas claims COVID-19 vaccines are made with cells from terminated pregnancieshttps://t.co/S9J0Y0JAnN,en
2022-07-24 07:54:52+00:00,322518891,How can we have informed consent when the ingredients were a secret ?   Italian Judge explains  the lunacy and corruption of COVID-19 vaccine mandates,en
2022-07-24 07:54:25+00:00,1322947365783904257,Operation Nasal Vaccine—Lightning speed to counter COVID-19 https://t.co/iAB7y8idKW,en
2022-07-24 07:54:17+00:00,1366231824544972800,"@Moonlig72469358 ""Fact Check-COVID-19 vaccines do not contain graphene oxide | Reuters"" https://t.co/0gjotjeIFLhttps://t.co/8ZJVPlXNDO https://t.co/j5ht8SXi4s",en
2022-07-24 07:53:19+00:00,1509974760461152258,@Reuters Is that the same monkeypox that is on the Pfizer papers they had to release as side effects of covid-19 vaccines that they tried to Bury for 75 years. People need to wake the fuck up.,en
2022-07-24 07:52:41+00:00,1513586727641915396,Did you know that COVID-19 vaccine does not negatively affect placental health? https://t.co/CF8qe3n5e2#covidprecautions #vaccinatedandhappy #placenta #MedBoundTimes #MedBound #MedTwitter #Medical #CovidIsNotOver @newsgramDOTcom @MedBoundHQ @gd3kr @dilruba25 @DrMiguelAristi,en
2022-07-24 07:51:01+00:00,14551642,@GoCarsonCity celebrating frontline workers and COVID-19 Vaccines #HeroesDay  https://t.co/0xzpcN5J2x,en
2022-07-24 07:50:57+00:00,1903187629,A Novel COVID-19 Vaccine Using Modified Bacterial DNA | @scoopit https://t.co/WDdZdaKYyX,en
2022-07-24 07:50:15+00:00,815308143441756161,"Birx Admits She Knew COVID-19 Vaccines Were Never ""Going To Protect Against Infection""The vaccinated fanatics (that’s you ⁦@2GB873⁩ and ⁦@abcsydney⁩ ) won’t like this bit of honest truth#auspol  https://t.co/da2WXwUR7w",en
2022-07-24 07:45:38+00:00,1519110211751010304,"@Christi92101700 @CL0zan0 @KariLake Biden had three vaccines because of Trump’s Herculean efforts &amp; more people died from Covid-19 underMagoo Biden in 2021 than 2021. Democrats supply chain issues, hyper inflation, open borders, &amp; a world on fire. It’s only going to get worse as Biden-Harris want 2 end fossil fuels",en
2022-07-24 07:45:32+00:00,1446354733963177984,Royals’ @WhitMerrifield apologizes for COVID-19 vaccine comments https://t.co/JkKRzjowHB,en
2022-07-24 07:39:00+00:00,804092749,@KaMacingwane01 I missed the covid 19 vaccines with the trust of my natural immune system to fight on my behalf. Fear does not live here.,en
2022-07-24 07:38:54+00:00,18662181,The Greed is growing with the new facts about Covid-19Vaccine.,en
2022-07-24 07:35:26+00:00,15448383,"China’s COVID-19 vaccines are safe and have been given to leaders of the state and ruling Communist Party, officials said on Saturday, as Beijing steps up efforts to allay public concerns about safety that risk hampering its vaccination drive. | @Reuters https://t.co/2xcixCUZVU",en
2022-07-24 07:34:37+00:00,1398457159114018820,"@OliverLipinski @MiddleDRoad2 @WChrisNunn A modified virus being used in four COVID-19 vaccine contenders — called adenovirus 5 (Ad5) — has been shown to increase transmission of the AIDS virus in the past, the researchers wrote - all I know 40% increase in deaths among 18-65 since vaccine came out. Not good",en
2022-07-24 07:34:25+00:00,380865861,"Birx Admits She Knew COVID-19 Vaccines Were Never ""Going To Protect Against Infection"" https://t.co/w3wHHdqHqn #Money #Finance #Economics #Market",en
2022-07-24 07:28:28+00:00,1547844125608726528,"@lono89 @NSWHealth Go and read The Truth About COVID-19: Exposing The Great Reset, Lockdowns, Vaccine Passports, and the New Normal Then you will understand all this crazy stuff.",en
2022-07-24 07:26:57+00:00,1237364454406447104,Operation Nasal Vaccine—Lightning speed to counter COVID-19 https://t.co/2RIb4TWInw,en
2022-07-24 07:25:03+00:00,577211499,"CN COVID-19 But in all seriousness: If that kept me from getting long Covid? My arm is ready. It's super quick anyway when well organisedOnly problem is, that we don't have enough vaccines, our healthcare system is at its limits and I suspect no politician wants to pay for it",en
2022-07-24 07:23:18+00:00,1453990572,China says COVID-19 vaccines are safe as it reveals leaders have received shots  https://t.co/habLJlARhj,en
2022-07-24 07:22:21+00:00,2426216556,"After many months of claims that these vaccines would prevent the spread of the pandemic, Dr. Birx now says COVID-19 vaccines were never ‘Going to Protect Against Infection’https://t.co/qFF9GX7b3S",en
2022-07-24 07:20:38+00:00,852124899829321728,Royals’ @WhitMerrifield apologizes for COVID-19 vaccine comments https://t.co/KtuCFzjUrk,en
2022-07-24 07:20:26+00:00,612931307,Archived again - Safe or not Safe?    ACS Risk Biomarkers Significantly Increase After mRNA COVID-19 Vaccine - The Cardiology Advisor  https://t.co/WRFOm47WNn,en
2022-07-24 07:18:46+00:00,296694466,Individuals who are eligible for a second Covid-19 booster shot can now book their appointments via MySejahtera. Currently only the Pfizer-BioNTech vaccine is being administered for second booster jabs. Those who wish to access the booking link must update the app. https://t.co/ionCExMdcl,en
2022-07-24 07:17:39+00:00,1368270193085054976,"zerohedge: Birx Admits She Knew COVID-19 Vaccines Were Never ""Going To Protect Against Infection"" https://t.co/42ZaTfJqlU",en
2022-07-24 07:16:55+00:00,1346067997451026433,🌍 Global COVID-19 vaccine rollout🟩🟩🟩🟩🟩🟩🟩🟩🟩🟩⬜⬜⬜⬜⬜ 66.92% (estimate)Vaccine doses deployed: 12.3BThe rollout seems to be slowing down#COVID19 #EpiTwitter #Vaccination #PublicHealth https://t.co/m72zjxrleh,en
2022-07-24 07:13:29+00:00,2397468266,Birx Admits She Knew COVID-19 Vaccines Were Never “Going To Protect Against Infection” https://t.co/cpZLrlT2R2,en
2022-07-24 07:11:12+00:00,856652799290916870,"China's COVID-19 vaccines are safe and have been given to leaders of the state and ruling Communist Party, officials said on Saturday, as Beijing ...China says COVID vaccines are safe as it reveals leaders have received shots | Reuters https://t.co/Iquv0EZKJ9",en
2022-07-24 07:11:09+00:00,856652799290916870,The World Health Organization said Friday it has updated its global COVID-19 vaccine strategy to prioritize reaching those most at risk from the ...WHO Updates COVID-19 Strategy to Vaccinate Those at the Most Risk https://t.co/Go8rsZbNq5,en
2022-07-24 07:09:51+00:00,25406480,AwesomeCapital: Birx Admits She Knew COVID-19 Vaccines Were Never ... https://t.co/uS6b2YQvi5,en
2022-07-24 07:09:07+00:00,1517813272115769344,"“Monkeypox, Hepatitis, SADS…Something is VERY wrong and it’s because of the Covid/19 vaccines” https://t.co/EU3iDijbGp",en
2022-07-24 07:08:41+00:00,1192148026271371264,FoxNews: Royals’ @WhitMerrifield apologizes for COVID-19 vaccine comments https://t.co/u1BpLRo7ea,en
2022-07-24 07:07:20+00:00,321649323,"Medscape: American adults who haven't yet gotten vaccinated against COVID-19 should consider a new option from Novavax, a more traditional type of vaccine. https://t.co/TUPJn1xoyh https://t.co/LUsAEoC6wT",en
2022-07-24 07:07:02+00:00,629205465,Birx Says COVID-19 Vaccines Were Never ‘Going to Protect Against Infection’ https://t.co/6RAjbNsPgj,en
2022-07-24 07:06:05+00:00,1917731,"Thousands report changes to menstrual bleeding after COVID-19 vaccine, study shows https://t.co/KfmlNY4yV6 https://t.co/WCSYQ5yds8",en
2022-07-24 07:05:30+00:00,3222854576,Royals’ @WhitMerrifield apologizes for COVID-19 vaccine comments https://t.co/DiMKlmRLSF,en
2022-07-24 07:05:29+00:00,727742277200818180,The fight against COVID-19 is yet to be over! Get your precautionary vaccine dose today.Book your appointment now: https://t.co/MaNVDAO7cG #IndiaFightsCorona @MinistryWCD @PIBWCD https://t.co/sxNZBDDCCT,en
2022-07-24 07:05:21+00:00,1453856430960754689,Royals’ @WhitMerrifield apologizes for COVID-19 vaccine comments https://t.co/gBkKwW4hoZ,en
2022-07-24 07:04:37+00:00,1487674614759112705,Book your appointments for the COVID-19 vaccine for kids 5 and under - https://t.co/k2jfskoBI2 https://t.co/hLR9cqNuYu Immunocompromised youth aged 12 to 17 will also be able to receive their second booster if at least six months have passed since their first ...,en
2022-07-24 07:04:36+00:00,1487674614759112705,"Details of autumn Covid-19 vaccination rollout announced, but hundreds of thousands not eligible https://t.co/WVJjTfKwMX A third booster vaccine will be offered to those aged 65 years and older, and those aged 12-64 years who are immunocompromised.",en
2022-07-24 07:04:34+00:00,1487674614759112705,"New recommendations issued for Covid-19 booster vaccines - Irish Examiner https://t.co/1MmQnUzzPL Children between the age of 5 and 11 who are immunocompromised are to be given a booster vaccine against Covid-19, according to recommendations ...",en
2022-07-24 07:04:32+00:00,1487674614759112705,Third Covid-19 booster recommended for pensioners and immunosuppressed - Belfast Telegraph https://t.co/GVqfmXDmGJ A first booster has also been recommended for those aged 5-11 years who are immunocompromised. NIAC has also recommended that Covid-19 vaccines may be ...,en
2022-07-24 07:04:30+00:00,1487674614759112705,"COVID-19 Vaccines Now Available for 6 Months and Older - Cornwall Seaway News https://t.co/cGpmHBSw3s -12 years or older, with a moderate or severely immunocompromised condition, and received their 1st Booster at least 4 months ago; or",en
2022-07-24 07:04:29+00:00,1487674614759112705,"Minister confirms updates to Covid-19 vaccination programme - The Clare Herald https://t.co/o82XXDG3TZ A third mRNA booster vaccine for those aged 65 years and older, and those aged 12-64 years who are immunocompromised.",en
2022-07-24 07:04:28+00:00,1487674614759112705,"which covid vaccine is best for immunocompromised patients | PREMIERE NEXT https://t.co/1bwic8uSmI Immunocompromised People Should Feel Safe Getting Pfizer, Moderna Covid-19 Vaccines, Study Finds: · Priya P - March 23, 2022 0 ...",en
2022-07-24 07:01:36+00:00,3222854576,Royals’ @WhitMerrifield apologizes for COVID-19 vaccine comments https://t.co/DiMKlmRLSF,en
2022-07-24 07:00:19+00:00,1377580554586050561,The latest adverse reactions to covid-19 vaccines by System of Care (SOC). Data from MHRA report with data cut off of 13/07/22Report any side effects to the yellow card scheme at https://t.co/bx5mtOy9F8 https://t.co/6VR72s9Oxh,en
2022-07-24 07:00:06+00:00,14749520,"COVID-19 in California: Testing, treatment, vaccine info, case and hospitalization rates, headlines https://t.co/sR5fDnoYhx",en
2022-07-24 06:59:45+00:00,2167580387,"In its global fight against Covid-19, the German government will provide 1.5 bn USD in 2022 alone, 928 mio. USD of which will go to the “Last Mile” aimed at funding vaccine logistics support, in-country readiness measures, delivery systems, and support for vaccination campaigns.",en
2022-07-24 06:58:32+00:00,101386226,China comments on safety of Covid-19 vaccines — RT World News https://t.co/NtWezBVmC4,en
2022-07-24 06:58:00+00:00,1678161991,INFOGRAPHICS ON COVID-19 FAKE VACCINE#PNPKakampiMo#TeamPNP#WeServeAndProtect https://t.co/XzeudqjmYv,en
2022-07-24 06:47:51+00:00,1544103547649740800,France and the UK to expand the supply of COVID-19 vaccines。https://t.co/OTVmpbrmzB,en
2022-07-24 06:46:51+00:00,383140759,"Very well worth reading this nicely researched article. My takeaway: A policy of Covid-19 non-vaccine-induced herd immunity is not only unethical, it’s negligent. And some of us are on the record saying so 28 months ago while good ol’ Sweden still pursued it. #Covid19Aus",en
2022-07-24 06:45:52+00:00,1385609356578889737,"COVID-19 update: vaccines and boosters work. Period.I haven't coughed in hours after testing positive less than 24hrs ago, and even my headache is gone. It's deceptive, though; I know I'll be shedding for at least a week. I won't infect anyone else. https://t.co/TFNvRDwSeN",en
2022-07-24 06:44:58+00:00,1362130269289996290,Menstrual Cycle Changes Associated With COVID-19 Vaccinehttps://t.co/Cpo0BtWDUJ,en
2022-07-24 06:42:52+00:00,1434435443613908993,"China has made a renewed push to promote the safety and effectiveness of its Covid-19 vaccines by pointing out that they were good enough for the country's entire leadership, including President Xi Jinping.",en
2022-07-24 06:41:05+00:00,1291757951187902464,"Birx Admits She Knew COVID-19 Vaccines Were Never ""Going To Protect Against Infection"" | ZeroHedge https://t.co/IMIRV5slGz",en
2022-07-24 06:38:44+00:00,49159095,Birx Says COVID-19 Vaccines Were Never ‘Going to Protect Against Infection’ https://t.co/BiMCZhHJun via @epochtimes,en
2022-07-24 06:35:09+00:00,395312602,Due a COVID-19 vaccine?You can get a vaccine without an appointment at a local drop-in clinic.  Running today (24 July) in Drongan.Check here to see how many vaccine doses you are eligible for: https://t.co/X6thB52XNKAlternative local drop-ins here: https://t.co/CC2AwaVBB8 https://t.co/eQRjdhH981,en
2022-07-24 06:31:46+00:00,18662181,It's time to clean house on all Covid-19 experts on Vaccine effectiveness. Just get them out of the publicVOICE and inform people. the CDC i spart of the VACCINE lie a getting Pharma Kickbacks.,en
2022-07-24 06:31:22+00:00,1715434532,China comments on safety of Covid-19 vaccines https://t.co/gqSRLTSFHl,en
2022-07-24 06:30:55+00:00,1478228683521290240,Royals’ Whit Merrifield apologizes for COVID-19 vaccine comments https://t.co/RGkIQVjwUN,en
2022-07-24 06:28:46+00:00,1297154614467399680,"Birx Admits She Knew COVID-19 Vaccines Were Never ""Going To Protect Against Infection"" https://t.co/XXQHLcMCET #news #feedly",en
2022-07-24 06:27:21+00:00,1218115722,"▪️India’s Cumulative COVID-19 Vaccination Coverage exceeds 201.99Cr▪️Over 3.85Cr 1st dose vaccines administered for age group 12-14 years▪️India's Active caseload currently stands at 1,52,200Read: https://t.co/0Y2R3nd7hM #IndiaFightsCorona https://t.co/yqxTgYrYvK",en
2022-07-24 06:26:28+00:00,762969396511924224,"▪️India’s Cumulative COVID-19 Vaccination Coverage exceeds 201.99Cr▪️Over 3.85Cr 1st dose vaccines administered for age group 12-14 years▪️India's Active caseload currently stands at 1,52,200Read: https://t.co/abjBSnRF9i #IndiaFightsCorona https://t.co/Xeh93o0NOH",en
2022-07-24 06:26:02+00:00,9294762,"The country is in a ""strong position"" with the Covid-19 situation in view of high vaccine coverage, though the present surge in cases in some states indicate that the virus is still around, an expert said.https://t.co/8ddOiJghqG",en
2022-07-24 06:25:48+00:00,111596475,"Birx Admits She Knew COVID-19 Vaccines Were Never ""Going To Protect Against Infection""  https://t.co/gvPzGl93gv",en
2022-07-24 06:24:04+00:00,1371174006712369157,"@RoystonPotter @GovCox @GovernorGordon @GovAbbott @GovernorLittle @POTUS @HHSGov @CDCgov Birx Admits She Knew COVID-19 Vaccines Were Never ""Going To Protect Against Infection""https://t.co/VTafYZFux2",en
2022-07-24 06:23:02+00:00,447054242,@tripleGGGx @LiaWalters2 @HeyNurseKat Never said that at all.The covid vaccines work the same way as every other vaccine in history it reduces the spread and infection of covid 19 and the reason to mandate them is clearly because  vaccinated covid is less dangerous than the unvaccinated covid.,en
2022-07-24 06:20:09+00:00,276900575,"Meet Lucas Odhiambo, a #UNVolunteer with @UNICEF #Kenya 🇰🇪He supports the delivery of essential services to disadvantaged children &amp; adolescents. During the COVID-19 #pandemic, his work involved facilitating the delivery of essential vaccines to Kenya.https://t.co/6v3Igfpgss",en
