date,userid,tweet,lang
2022-05-06 13:03:11+00:00,916787510822436864,$JNJ FDA restricts Johnson &amp; Johnson’s COVID-19 vaccine due to blood clot riskhttps://t.co/EO0ZskvhcB,en
2022-05-06 13:03:03+00:00,1139299804419362817,"We make our choices with the information we have at the time. Nobody should regret getting, or not getting, a Covid-19 vaccine.",en
2022-05-06 13:02:44+00:00,15761637,"The Omicron variant of Covid-19 is much less likely than Delta to result in long Covid in people who have had two doses of a vaccine, new figures from the UK suggest. https://t.co/m3WUPGuSEs",en
2022-05-06 13:02:40+00:00,13171622,Pharmalot.. Pharmalittle.. Good Morning: FDA restricts access to J&amp;J Covid-19 vaccine; Novartis halts production of two cancer drugs over quality issues &amp; More news.. https://t.co/dzx2YMwcy6 #pharma #COVID19 #vaccines #opioids #FDA #insulin $JNJ $NVS $PFE $WBA $ILMN,en
2022-05-06 13:01:57+00:00,1379086170009788417,COVID-19 Vaccine Victim Ryleigh Jones https://t.co/KUdYJSmIbO,en
2022-05-06 13:01:45+00:00,33933259,"As COVID-19 cases are on the rise again, vaccines are one of the key ways to help end the pandemic. When you can, get vaccinated. #LongLifeForAll https://t.co/FFb2IxScNN",en
2022-05-06 13:01:38+00:00,1069155337,"No need to leave your home to get your COVID-19 vaccine or booster! Now TNs with disabilities over the age of 18 can get their COVID-19 vaccines from the comfort of their home. No proof of disability, age, or citizenship required. Call 800-342-1660 to register today. https://t.co/Bsiqi1kS4o",en
2022-05-06 13:01:28+00:00,889508767552995328,FDA Limits J&amp;J COVID-19 Vaccine Over Blood Clot Risk – Friday Live https://t.co/GUETUzZevf,en
2022-05-06 13:01:11+00:00,747961431119826944,Moderna seeks emergency use authorization for Covid-19 vaccine for children ages 6 months through 5 years https://t.co/y9BU3OCeN4,en
2022-05-06 13:00:54+00:00,47086949,FDA Limits J&amp;J's COVID-19 Vaccine Over Blood Clot Risk   https://t.co/bFk4MYXLfb,en
2022-05-06 13:00:37+00:00,86337942,"Have you gotten your booster? It is still important to be protected against Covid-19.If you have had your first and second vaccine, then you can get your booster at any vaccination center, walk in with no need to book.For more information, visit https://t.co/KAGKtmIZq7 https://t.co/W9lDDeTwO4",en
2022-05-06 13:00:31+00:00,1466886975831650304,FDA Limits J&amp;J COVID-19 Vaccine Over Blood Clot Risk – Friday Live https://t.co/VjQBCzKlDw,en
2022-05-06 13:00:31+00:00,237028256,Our COVID-19 Vaccine team will be at @tstcwaco today (5/6). Swing by if you need your COVID-19 vaccine or booster. You do not have to be a student to attend.Where: TSTC Student Recreation Center3801 Campus Dr.When: 11am-3pm,en
2022-05-06 13:00:31+00:00,1202115582,"Please join us for Global Health Week (May 16-20), part of @mcgillu’s #McGill200 celebrations. Speakers include low-cost COVID-19 vaccine developer @PeterHotez and global health leader @agnesbinagwaho. https://t.co/IZBTx0uNZZ https://t.co/ovkQkutQ6Q",en
2022-05-06 13:00:18+00:00,33988019,U.S. regulators on Thursday strictly limited who can receive Johnson &amp; Johnson’s COVID-19 vaccine due to the ongoing risk of rare but serious blood clots. https://t.co/scirvrkx0K,en
2022-05-06 13:00:14+00:00,236770150,FDA limits use of Johnson &amp;amp; Johnson COVID-19 vaccine over blood clot risk https://t.co/0ZLYLmPXRA #Health https://t.co/eQQT8822Zi #news 705,en
2022-05-06 13:00:09+00:00,24920395,U.S. regulators on Thursday strictly limited who can receive Johnson &amp; Johnson's COVID-19 vaccine due to the ongoing risk of rare but serious blood clots. https://t.co/4gsUyJ3ZFJ,en
2022-05-06 13:00:03+00:00,2178755959,"They want you to believe the Pfizer dump was not REAL EVIDENCE.Proof it WAS?Just look at the latest news.FDA Restricts J&amp;J's COVID-19 Vaccine Due to Blood Clot RiskIT WAS A REAL DUMP, don't let them fool you.",en
2022-05-06 13:00:03+00:00,1250290602509365248,"Claim: A Pfizer document shows that its COVID-19 vaccine is not safe for women who are pregnant or breastfeeding.  Fact: This finding was not conclusive and was taken from an outdated report by @MHRAgovuk, not Pfizer. Read our investigationhttps://t.co/Vjf18uV9fg",en
2022-05-06 13:00:02+00:00,355581570,"We have pop-up COVID-19 vaccine clinics at the Beechgrove site in #ygk May 5 to 8 for 12+ individuals.  All doses (#1, 2, 3 &amp; 4) for anyone eligible.  Both Pfizer &amp; Moderna vaccine available.  Book at: https://t.co/1nluI6a9Cy. https://t.co/GHAThAJvay",en
2022-05-06 13:00:00+00:00,18553103,If you or your child is over 12 &amp; immunosuppressed they're eligible for a Spring booster (4th dose) of the COVID-19 vaccine. Book an appointment online💻 https://t.co/us8UfSaDDaVisit a clinic or our vaccine bus for a walk-in appointment 🚶‍♀️https://t.co/waoDsLqa4Y https://t.co/WRKfyJanTl,en
2022-05-06 12:59:49+00:00,1496974239206973453,Africa’s first Covid-19 vaccine production facility is on the verge of closure – Health News https://t.co/ZkU407gV1Q,en
2022-05-06 12:59:23+00:00,4423439899,"The second Youth COVID-19 Vaccine Day is coming up on May 12th! Together with the YMCA of Greater Londonderry for children and teens ages 5-17 to get their first or second dose. Registration is on-site, along with resources, giveaways and prizes. #NHhealthy #InNHforNH https://t.co/MbNGQsDMHo",en
2022-05-06 12:58:56+00:00,4917121001,FDA Limits Use of J&amp;J's Covid-19 Vaccine:Agency makes the change after confirming nine deaths tied to a clotting condition among those who received the one-dose shot…  https://t.co/PEJh35WdBv,en
2022-05-06 12:58:44+00:00,389281501,FDA restricts Johnson &amp; Johnson's COVID-19 vaccine due to blood clot risk https://t.co/cUjG6bdUqA,en
2022-05-06 12:58:27+00:00,1456357158803709958,"Just to circle back here.Johnson &amp; Johnson's COVID-19 vaccine received EUA approval in the US in ~February, 2021. Shortly thereafter reports of blood clots came in possibly linked to the vaccine. 1 year, 2 months later: ""Restriction on JNJ vaccine due to blood clots"" @US_FDA",en
2022-05-06 12:57:35+00:00,983691674,Safety and Efficacy of the COVID-19 Vaccine in Kidney Transplant Recipients https://t.co/RdOWZibZXc,en
2022-05-06 12:56:37+00:00,21780652,FDA puts strict limits on Johnson &amp; Johnson COVID-19 vaccine https://t.co/5Q3uo5GXus,en
2022-05-06 12:55:14+00:00,237460655,"Find COVID-19 guidance to protect you, your family, and your community at https://t.co/2mrgu2aSyO, a one-stop resource for the latest information on COVID-19 prevention and reduction methods including masks, treatment, vaccines, and testing. https://t.co/OmPyUBiFYb https://t.co/5BoyAMEoDJ",en
2022-05-06 12:55:03+00:00,868057998182240256,The COVID-19 vaccines offer the best protection for pregnant women and their babies.https://t.co/MFpOOa9Hz4 https://t.co/tsjBxvwoj2,en
2022-05-06 12:55:03+00:00,983527219,https://t.co/umAFeb1fxz FDA Limits J&amp;J's COVID-19 Vaccine Over Blood Clot Risk,en
2022-05-06 12:54:58+00:00,2312490275,FDA Restricts J&amp;J’s COVID-19 Vaccine Over Risk of Blood Clots https://t.co/Q5B92wcbYo,en
2022-05-06 12:54:55+00:00,396101078,"@ShankieTheClown @Mark_TaylorUK Any drug or #vaccine test, also those for #Covid_19, should report any problem. By ignoring the problems encountered by people who have not taken anything as reference material, this report must be regarded as irrelevant and #misinformation or completely #fake.",en
2022-05-06 12:54:07+00:00,18557134,Efficacy and Safety of a Recombinant Plant-Based Adjuvanted Covid-19 Vaccine - https://t.co/dGnEXlqsAQ,en
2022-05-06 12:53:58+00:00,561742581,FDA Limits J&amp;J’s COVID-19 Vaccine Over Blood Clot Risk https://t.co/IuCJwrB2x5,en
2022-05-06 12:53:56+00:00,790019230389248000,FDA Limits J&amp;J’s COVID-19 Vaccine Over Blood Clot Risk https://t.co/i3OwukfXzJ,en
2022-05-06 12:53:13+00:00,312412918,"Hamsters can transmit the virus to their uninfected brethren and display similar pneumonia symptoms to humans. The rodents, including Golden Syrians (Mesocricetus auratus), emerged as a useful animal model for COVID-19 drug and vaccine research. https://t.co/USev3Ocph8",en
2022-05-06 12:53:08+00:00,15383946,"The FDA slows J&amp;J’s roll. The agency said that J&amp;J’s Covid-19 vaccine should only be used by adults for whom it’s a last resort, citing the risk of rare but life-threatening blood clots. So, why would anyone get this shot? #vaccine #CDC #publichealth #beaware",en
2022-05-06 12:52:27+00:00,47441125,Odd that reviewing to data is an after thought once millions have received it.  FDA is not promoting human health but rather drug industryFDA Limits J&amp;J's COVID-19 Vaccine Over Blood Clot Risk | ZeroHedge https://t.co/KZWOC0p5N3,en
2022-05-06 12:51:56+00:00,288935074,ICYMI: US regulators have restricted use of the Johnson &amp; Johnson COVID-19 vaccine https://t.co/6azA4of8gV,en
2022-05-06 12:51:48+00:00,1519129184563572747,"Warning!!  Disinformation!!  Hey Mayourkas, get you’re crazy Mary Poppins Truth czar (who’s uglier than pootin’ in church btw) to censor this article immediately!!!FDA Limits J&amp;J's COVID-19 Vaccine Over Blood Clot Risk | ZeroHedge https://t.co/YaDX3uIz5x",en
2022-05-06 12:51:16+00:00,22433809,"CRAZY LOGIC: Pro-abortion movement’s slogan — “My Body, My Choice” — has lost credibility. Why? Pro-abortion public officials have mandated, as a condition of employment, COVID-19 vaccines. Pennsylvanians must elect a governor who will abolish abortion.  https://t.co/mTxip2W2OT",en
2022-05-06 12:50:12+00:00,18869909,The U.S. Food and Drug Administration (FDA) said on Thursday it was limiting the use of Johnson &amp; Johnson’s Covid-19 vaccine for adults due to the risk of a rare blood clotting syndrome https://t.co/dTZgSV2QG7 (@CNBC via @DanCollins2011) #Covid19,en
2022-05-06 12:50:02+00:00,423972447,"Gov. Brian Kemp signed legislation Tuesday that would ban COVID-19 ‘Vaccine Passports“We will always stand up for the rights of our people against government overreach,” the governor said.LEARN MORE: https://t.co/M6IDY3ACWk#VaccinePassports #rights  #SB345",en
2022-05-06 12:49:36+00:00,18662181,WE really don't know about COVID-19 and fullyunderstand the VACCINES effects on ADULTS/CHILDREN/ Pregnancy.Do not TRUST this SOCIAL MEDIA or another. If you trust your doctor talk to him/her.,en
2022-05-06 12:49:07+00:00,69691860,FDA puts strict limits on Johnson &amp; Johnson Covid-19 vaccine https://t.co/uLBs7IezPU #SmartNews,en
2022-05-06 12:48:50+00:00,110194870,FDA Restricts Use Of J&amp;J COVID-19 Vaccine Due To Blood Clot Riskhttps://t.co/B5hTo4tcZz,en
2022-05-06 12:48:47+00:00,2787027678,Something you won't hear about unless you dig.BREAKING: FDA limits use of Janssen COVID-19 vaccine  https://t.co/B4MgTcMtCV via https://t.co/fmZ2wQmU8L,en
2022-05-06 12:48:01+00:00,1518973643275087874,"COVID-19 vaccines more likely to kill people than save lives, research reveals. Look up VAERS platform on the CDC WEBSITE and multiply the injures and deaths times 40, VAERS ONLY REPORTS 1% OF THE DEATHS AND INJURIES.",en
2022-05-06 12:47:47+00:00,1270220114340851712,FDA Limits Use of Johnson &amp; Johnson COVID-19 Vaccine Due to Risk of Rare Blood ClotsMore medical news at https://t.co/WN5LVUzAcd#PharmaTwitter #MedTwitter #MedEd #MedNewshttps://t.co/G4peS7akcB,en
2022-05-06 12:47:30+00:00,1518952685826977794,"COVID-19 vaccines more likely to kill people than save lives, research reveals – https://t.co/Zrqp31TJ2o https://t.co/WG3Ha03BFh",en
2022-05-06 12:47:08+00:00,1310277697776607232,"Dr. Sucharit Bhakdi, a Thai-German microbiologist and expert on the mRNA COVID-19 injections, has warned that the ""vaccines"" are very dangerous. They will kill more people daily, and those who survive will be easier subjects for the New World Order to control. https://t.co/3OAqgflN8F",en
2022-05-06 12:46:28+00:00,2824877293,@DaveBaggett4 @brathet @CharlieCrist There were never any federal/state/local government mandates to get a COVID-19 vaccine.,en
2022-05-06 12:46:27+00:00,1183540088967499777,"CDC report admits 74.2 million people in the USA have not had a single dose of a Covid-19 Vaccine, &amp; another 157 million have refused a 2nd or 3rd dose“The American people have seen right through President Biden’s propaganda and lies on the effectiveness of the Covid-19 vaxx",en
2022-05-06 12:46:14+00:00,17046810,"@BlockInvest99 @JamesMelville Killed much more than any flu though in the last two years (would have been much more without the vaccines) -3rd on the list of most likely to die of 1) Heart Disease, 2) Cancer 3) Covid-19.. so not sure why you think it is just a mild flu?",en
2022-05-06 12:45:16+00:00,18856867,FDA Limits J&amp;J's COVID-19 Vaccine Over Blood Clot Risk https://t.co/nBaipeqFIW,en
2022-05-06 12:45:06+00:00,1271686381505581056,"FDA Limits Use of Johnson &amp; Johnson COVID-19 Vaccine Due to Risk of Rare Blood ClotsFor more up-to-date medical headlines, visit https://t.co/8ugyCPRjur#MedicalNews #MedTwitter #MedEd #MedNewshttps://t.co/5QLZuIFhic",en
2022-05-06 12:45:00+00:00,239861560,U.S. regulators on Thursday strictly limited who can receive Johnson &amp; Johnson's COVID-19 vaccine due to the ongoing risk of rare but serious blood clots. https://t.co/LPU59D8lWS,en
2022-05-06 12:44:14+00:00,1422487138642235392,"As of Thursday, about 3.35 billion COVID-19 vaccine doses had been administered across the Chinese mainland, and nearly 757 million people had received the booster jab https://t.co/HDaqfWGMjq",en
2022-05-06 12:44:03+00:00,2226229321,"@CSOPartnership_ @realityofaidAP @realityofaid @ipmsdl_ @PCFSGlobal @PANAsiaPacific @ILPS_Official @cprh_ph @APR_net Enabled by neoliberal policies such as the WTO agreement on #TRIPS, Pfizer &amp; other TNCs monopolised the production and distribution of COVID-19 vaccines. In the process, Pfizer has gone out its way to bully countries in the global South, such as in Latin America. https://t.co/CMqMfIYupD",en
2022-05-06 12:42:28+00:00,1519475937221529600,FDA restricts J&amp;J’s COVID-19 vaccine due to risk of blood clots https://t.co/jtgqQ6eSgL,en
2022-05-06 12:41:37+00:00,166981201,Do you really need a 4th #COVID19 shot? -- Experts says a fourth dose of COVID-19 #vaccine will be needed to head off another wave of new cases.#SriLanka will administer the 4th #booster! #lka https://t.co/NssCEwLI1x,en
2022-05-06 12:40:10+00:00,3913309695,"@Jesus_is_G_d @DavidLevan15 @briggs1662 @chelsyhogan A study that says ""Preliminary findings did not show obvious safety signals among pregnant persons who received mRNA Covid-19 vaccines."". I don't think that's the evidence you're looking for.",en
2022-05-06 12:40:09+00:00,1164801968251887619,"💬 ""New data released from the Africa Health Research Institute in South Africa show that the Pfizer/BioNTech COVID-19 vaccine may be less effective at preventing infection by the Omicron variant.""Find out more: https://t.co/L7Su96tb13#MDNewsline #Omicron #Variant #COVID https://t.co/pXHJHr9NgD",en
2022-05-06 12:38:28+00:00,2175720200,"It's not too late to get your vaccine today! Our walk-in COVID-19 vaccine clinic for anyone aged 5 and over is open now, until 4.30pm at Cherry Tree Shopping Centre, Liscard https://t.co/gjohPruTBO https://t.co/V5EUR7Jlgf",en
2022-05-06 12:38:26+00:00,86731384,"@TanmayS34115600 @Covi1979749381 @vijaygajera @RahulGandhi We did it Covaxine is Indigenous , Covishield is Mass produce of AstraZeneca - “ Both COVISHIELDTM(manufactured by Serum Institute of India Pvt Ltd) and COVID-19 Vaccine AstraZeneca (manufactured by AstraZeneca) are ChAdOx1 nCoV- 19 Corona Virus Vaccines (Recombinant).",en
2022-05-06 12:37:08+00:00,1317435099697348608,FDA limits use of Johnson &amp; Johnson Covid-19 vaccine to people 18 and older for whom other authorized or approved vaccines are not accessible or clinically appropriate due to the risk of a rare and potentially life-threatening side effect.https://t.co/iufnbNRIui,en
2022-05-06 12:36:51+00:00,1404206195745951752,FDA limits use of J&amp;J's Covid-19 vaccine for adults due to clotting risk https://t.co/1d7xfwQKki,en
2022-05-06 12:36:51+00:00,17602680,U.S. regulators strictly limited who can receive Johnson &amp; Johnson's COVID-19 vaccine due to the ongoing risk of rare but serious blood clots. https://t.co/FT86q6ktGC,en
2022-05-06 12:36:16+00:00,4832329984,"Leo is 9 years old and has had his first COVID-19 vaccine. He’s sharing his experience of getting the jab, to encourage other children his age to get protected. Book a jab for anyone aged 5+ here: https://t.co/nvrRd9rrMI https://t.co/h73c1QfxIZ",en
2022-05-06 12:36:04+00:00,35733056,"MoHAP: 1,747 doses of COVID-19 vaccine administered https://t.co/cuozJvdKV5 https://t.co/RgF6iCLCuc",en
2022-05-06 12:35:38+00:00,2788959950,Fact check: Could sixth-graders get vaccines without parents' conse... (The Sacramento Bee)California lawmakers this year set out to advance bills that would require COVID-19 vaccines...Add your highlights:https://t.co/4QjXY9Vz59 #Parenting,en
2022-05-06 12:35:37+00:00,825021717420580864,Fact check: Could sixth-graders get vaccines without parents' conse... (The Sacramento Bee)California lawmakers this year set out to advance bills that would require COVID-19 vaccines...Add your highlights:https://t.co/xRmJoCj2bd #CA #California,en
2022-05-06 12:35:23+00:00,253238171,FDA restricts J&amp;J's COVID-19 vaccine due to blood clot risk https://t.co/rfI2ss2UOT,en
2022-05-06 12:34:20+00:00,262869187,FDA Limits Use of Johnson &amp; Johnson’s Covid-19 Vaccine https://t.co/3Wn6jN0zm2,en
2022-05-06 12:33:04+00:00,21531121,FDA restricts J&amp;J’s COVID-19 vaccine due to blood clot risk https://t.co/lzM3U1F5y3 via @nypost,en
2022-05-06 12:33:03+00:00,44699893,Get your COVID-19 vaccine at clinics across the city this weekend. Ages 5+. Clinic locations &amp; hours: https://t.co/iKeukczimG https://t.co/0ysOqQMIfp,en
2022-05-06 12:31:48+00:00,1346067997451026433,🌏 Global COVID-19 vaccine rollout🟩🟩🟩🟩🟩🟩🟩🟩🟩⬜⬜⬜⬜⬜⬜ 65.44% (estimate)Vaccine doses deployed: 11.6BThe rollout seems to be speeding up#COVID19 #EpiTwitter #Vaccination #PublicHealth https://t.co/PT3r8OuOR2,en
2022-05-06 12:31:07+00:00,37004385,U.S. regulators on Thursday strictly limited who can receive Johnson &amp; Johnson's COVID-19 vaccine due to the ongoing risk of rare but serious blood clots. https://t.co/PdyYfuF9J8,en
2022-05-06 12:31:01+00:00,15391102,The FDA said it decided to restrict Johnson &amp; Johnson's COVID-19 vaccine after taking another look at data on the risk of life-threatening blood clots.  https://t.co/kBnPaRWsVb,en
2022-05-06 12:30:23+00:00,2172115956,Posts misrepresent outdated UK document on COVID-19 vaccines. https://t.co/Muv2lOHNCg,en
2022-05-06 12:30:17+00:00,100453427,"Get your COVID-19 vaccine on Tuesday in Ilfracombe! 💉There's no need to book, just walk in anytime between 11:00am-5:00pm. https://t.co/qy8Ge2l0pC",en
2022-05-06 12:30:13+00:00,236770150,FDA limits use of Johnson &amp;amp; Johnson COVID-19 vaccine over blood clot risk https://t.co/0ZLYLmPXRA #Health https://t.co/eQQT8822Zi #news 556,en
2022-05-06 12:30:03+00:00,247351807,#COVID-19 Update: @US_FDA Limits Use of Janssen COVID-19 #Vaccine to Certain Individuals https://t.co/snLMpNTFNB https://t.co/KtVRXU7mi9,en
2022-05-06 12:30:00+00:00,252114970,"Children and teens should get the COVID-19 vaccine because they can:- Get very sick from COVID-19- Have both short and long-term health complications from COVID-19- Spread COVID-19 to others, including at home and school https://t.co/W9q4E8ifT1 https://t.co/aLec7nyF27",en
2022-05-06 12:29:36+00:00,1454244213231607809,"@AllTheRisks @catherinefowle1 1. Thought this was odd -- pg 42 of the original trial data ""Suspected COVID-19 cases that occurred within 7 days after any vaccination were 409 in the vaccine group vs. 287 in the placebo group.""  Credit for find: https://t.co/nJDm722lzz",en
2022-05-06 12:29:14+00:00,830426120487047168,FDA Strictly Limits Use of Johnson &amp; Johnson’s COVID-19 Vaccine Due to Blood Clot Risk https://t.co/0rBC0A5N5F,en
2022-05-06 12:29:09+00:00,43742509,"FDA limits use of Johnson &amp; Johnson’s Covid-19 vaccine, citing clotting risk https://t.co/H4KPCshcWS via @statnews",en
2022-05-06 12:28:34+00:00,815393683335806976,FDA restricts J&amp;J’s COVID-19 vaccine due to blood clot risk https://t.co/S2RGW24zPK,en
2022-05-06 12:28:20+00:00,17659340,Nearly half of all Torontonians 60 and up have now received a fourth dose of COVID-19 vaccine.https://t.co/hedDcGAipH,en
2022-05-06 12:28:15+00:00,1497112337488113667,@Amit2022001 @suspendedsamir @ranvijaylive @WHO @BBCIndia @BBCWorld Isn't omicron a Covid-19 variant and isn't kids life important ? Q is why Pfizer with it's indemnity clause was forced on India when we already had our own vaccines ? True.. Half knowledge is very dangerous,en
2022-05-06 12:27:48+00:00,1359547699121430530,"@APFactCheck ""One of us..."" 🧟 All are safe until we tell you otherwisePOLITICO: FDA dramatically narrows use of Johnson &amp; Johnson Covid-19 vaccine.https://t.co/cHaAmtpoGj",en
2022-05-06 12:27:42+00:00,1031963742811185154,FDA puts strict limits on Johnson &amp; Johnson Covid-19 vaccine - CNN https://t.co/WQm5wAFBJ1,en
2022-05-06 12:27:08+00:00,1132559626065592321,"Safety risk pushes FDA to cut off $JNJ Covid-19 vaccine with some limited exceptions - https://t.co/My7ert6QLn ""The announcement from FDA on the restrictions now casts a larger spotlight on $NVAX potential protein subunit vaccine, which is going before an FDA adcomm on June 7.""",en
2022-05-06 12:27:05+00:00,1518599994638573570,"@TELODICO2 @intuslegens the weekly emergency call counts were significantly associated with the rates of 1st and 2nd vaccine doses administered to this age group but were not with COVID-19 infection rates. While not establishing causal relationships, the findings raise concerns regarding vaccine-induced",en
2022-05-06 12:27:04+00:00,147827317,From ABC News:FDA limits J&amp;J COVID-19 vaccine due to rare blood clot riskhttps://t.co/VUyDZ6IjZw,en
2022-05-06 12:25:24+00:00,201225656,A Covid-19 nasal spray vaccine is in the works: Populations across the world may soon get their COVID-19 vaccine without the need for that painful needle. The third phase of clinical trials is underwa.. https://t.co/7BWrfZaduU via @MaudhuiHouse,en
2022-05-06 12:25:19+00:00,1121086201505599488,I think it’s too late now… 😠FDA Restricts J&amp;J’s COVID-19 Vaccine Over Risk of Blood Clots https://t.co/chrvYR1QDx,en
2022-05-06 12:25:01+00:00,1260148815161688067,FDA Restricts Use Of J&amp;J COVID-19 Vaccine Due To Blood Clot Risk https://t.co/Eh8Mt0tKIx,en
2022-05-06 12:24:39+00:00,94543339,Two Lies the Union Govt Told the Supreme Court on COVID-19 Vaccines https://t.co/KE9ldbJaCu via @thewire_in,en
2022-05-06 12:24:20+00:00,365417317,Death spikes in the vaccinated with the new variant...DUHHHHHHH...CNN: FDA puts strict limits on Johnson &amp; Johnson Covid-19 vaccine.https://t.co/CNOOx4WO6uvia @GoogleNews,en
2022-05-06 12:24:14+00:00,227872601,"Charles River Community Health, the Massachusetts Department of Public Health and JAHAN Women and Youth Intercultural will be offering a COVID-19 Vaccine Clinic at the CRCH Waltham site on Saturday, May 14 from 10:00 am - 4:00 pm.See the attached fliers for more information! https://t.co/yhWp5fEQ79",en
2022-05-06 12:22:43+00:00,28822712,Not fake news~~~~ People should be reinstated who had their accounts shut down. FDA Puts Strict Limits On Johnson &amp; Johnson COVID-19 Vaccine https://t.co/0iGlbAvqfK via @YahooNews,en
2022-05-06 12:22:35+00:00,2875685303,"""Risk of a rare and dangerous clotting condition called thrombosis with thrombocytopenia syndrome (TTS) after receiving the vaccine - FDA puts strict limits on Johnson &amp; Johnson Covid-19 vaccinehttps://t.co/fOYZHj9sdo",en
2022-05-06 12:22:01+00:00,191346576,The US health regulator has limited use of Johnson &amp; Johnson's Covid-19 vaccine for adults due to the risk of a rare blood clotting syndrome. #pfizerdocuments is also trending.,en
2022-05-06 12:21:25+00:00,2988582995,#OnlineFirst with #PMT #JPharmTechnol this week: case of acute kidney injury &amp; rhabodmyolysis potentially associated w/COVID booster vaccine by K. Unger &amp; colleagueshttps://t.co/fe2kYXyciy#Covid_19 #pharmacy,en
2022-05-06 12:20:21+00:00,1358261825037627393,FDA Restricts J&amp;J’s COVID-19 Vaccine Over Risk of Blood Clotshttps://t.co/jFND8TUh9J,en
2022-05-06 12:20:11+00:00,1062131204,FDA restricts J&amp;J’s COVID-19 vaccine due to blood clot risk - Breaking911 https://t.co/eF6xkkEBPY,en
2022-05-06 12:19:34+00:00,49404200,Does the vaccine give children COVID-19? | Children’s Health https://t.co/66OjQq27Zi,en
2022-05-06 12:19:24+00:00,1293853495909654533,"DFSS Youth Services Chicagobility RFP – https://t.co/EHWlAb684f The COVID-19 vaccines are safe and effective, and are an important tool for ending the global pandemic. Vaccines protect you and the people https://t.co/PvEqqBAd87 #rfpproposaltemplates",en
2022-05-06 12:19:00+00:00,1289957362514702342,❌  Is the COVID-19 vaccine responsible forthe rise in the number of unexplainedhepatitis cases in children under the age offive?Learn more about the work of the Counterterrorism Group ➯ https://t.co/Oi0BnqCUhu🚫 #disinformation #BREAKING#FactsMatter #factcheckfriday https://t.co/uY0s3Fqu5N,en
2022-05-06 12:17:44+00:00,1086568572971819008,"1,000 Peer Reviewed Studies on Covid-19 Vaccine Safety#NoVaccineMandates https://t.co/cUyhPApECU",en
2022-05-06 12:16:58+00:00,1290936204817440768,FDA restricts Johnson &amp; Johnson COVID-19 vaccine due to blood clot risk https://t.co/aECsdPaUUt,en
