date,userid,tweet,lang
2022-12-31 07:10:08+00:00,1437583922519429124,"COVID-19 UPDATE - 220.10 cr Total Vaccine doses (95.13 cr Second Dose and 22.40 cr Precaution Dose) have been administered so far under Nationwide Vaccination Drive91,732 doses administered in last 24 hoursIndia's Active caseload currently stands at 3,653 https://t.co/ZIhCt5ZHTa",en
2022-12-31 07:07:04+00:00,976098246882885634,"There are currently 51candidatesOut of which, 10 candidates are in phase 3.#coronavirus #COVID #Covid-19 #vaccine #vaccines #vaccinationUse #telegram and add bot 'CoronaTrackerNepal_bot' to get details and notifications.Source: https://t.co/HmUwd0efIQ",en
2022-12-31 07:06:48+00:00,1516699454568603649,@TeddyDanielsTV amount of Casualties that we will have and you know this better than anyone in a Military operation you will lose people and Covid-19 vaccine is a Biological Weapon Mass Murder Genocide poison these people are truly EVIL Satan Level !!!!,en
2022-12-31 07:02:34+00:00,1285290021709328384,"In its letter, the Sindh government has sought mandatory Covid-19 vaccination for *international as well as domestic travel.* This is extreme &amp; a death warrant....#ZaidHamid #Pakistan #PakArmy #Vaccine #GlobalGoals #GreatResethttps://t.co/paPOutr0Ra",en
2022-12-31 07:00:31+00:00,172867574,New law ends COVID-19 vaccine mandate for US troops | AP News https://t.co/C9RAAH0vWM ||,en
2022-12-31 06:58:00+00:00,718368960903847936,"COVID-19 UPDATE - 220.10 cr Total Vaccine doses (95.13 cr Second Dose and 22.40 cr Precaution Dose) have been administered so far under Nationwide Vaccination Drive91,732 doses administered in last 24 hoursIndia's Active caseload currently stands at 3,653@MoHFW_INDIA https://t.co/lObzqphWBt",en
2022-12-31 06:53:22+00:00,1429179266869104641,"@akheriaty Secure the border. Open the pipeline. Defund Ukraine. Burn all COVID-19 vaccines. Implement Fairtax &amp; eliminate the IRS. Flush out the FBI &amp; CIA. Impose term limits for govt. officials. Investigate Fauci, Pharma, &amp; Hillary. Indict H. Biden &amp; the Biden Crime Fam. Get tax on Pelosi",en
2022-12-31 06:51:16+00:00,31106780,"I have babalaas, this covid-19 vaccine really messed up things for us . Motho can no longer do 3 glasses of G&amp;T",en
2022-12-31 06:51:00+00:00,1248044560040615936,"@CDCDirector It's 3 yrs Covid-19  now.Every one feeling fatigue with Covid-19 awareness and prevention.If can,  Vaccines researchers to explore Optimum Strategy  or  95% effectively  dissolve or  neutralize off ALL  variants now and future.This way pave Permanent Solution.#COVID19",en
2022-12-31 06:50:54+00:00,1601460323558498304,COVID-19 Vaccine Induced Axillary LymphadenopathyAbnormal Mammograms Driving Clinical Concerns and More TestingREAD NOW:https://t.co/T1K885kP1YSubscribe ➡️⬇️➡️ @naomirwolf,en
2022-12-31 06:48:04+00:00,1425291671558836229,"@BernadetteNTF @TJNugent520 @MFrance923 You also probably believe the Covid-19 ""vaccines"" are safe and effective too.",en
2022-12-31 06:46:01+00:00,1164401188709765120,"@frandeebee Covid-19 vaccines are trial vaccines, these are facts.In all the years I followed phase 3 trials I have never seen one with so many injuries and where the trial continues.Under normal circumstances, a phase 3 trial like this would be closed.It is a scandal against science.",en
2022-12-31 06:45:23+00:00,37716311,California #Coronavirus updates: Sacramento County moves out of highest CDC COVID-19 risk level - Capital Public Radio News-- News | The Perfect Enemy: https://t.co/QHBG0pxvmb.#Black #Children #Coverage #Medicare #PublicHealth #Vaccines https://t.co/cwa1ethTP2,en
2022-12-31 06:45:21+00:00,709947536,California #Coronavirus updates: Sacramento County moves out of highest CDC COVID-19 risk level - Capital Public Radio News-- News | The Perfect Enemy: https://t.co/rp6eODNl8W.#Black #Children #Coverage #Medicare #PublicHealth #Vaccines https://t.co/aktWqr1bZW,en
2022-12-31 06:43:49+00:00,743278147995480064,"@thesmokingrdog @ggronvall @elonmusk @pmarca @ichudov Covid-19 is still causing deaths, just far fewer thanks to vaccines and previous infections where world is building immunity, as well as better treatments. Malhotra is a quack for the most part and has sold out to the grifters. He can't analyze data very well and left out Covid.",en
2022-12-31 06:42:44+00:00,1524431689765720064,@hrkbenowen I have a solution for her. PPP Please go get another Covid 19 Vaccine 🤣🤣,en
2022-12-31 06:42:33+00:00,1534785726562594816,"@DALupton ""GY has received research funding from Gavi, the Vaccine Alliance (Gavi) and the Bill &amp; Melinda Gates Foundation, both of which support COVID-19 vaccine development and deployment"". Please do better.",en
2022-12-31 06:39:00+00:00,634952572,New law ends COVID-19 vaccine mandate for US troops | AP News https://t.co/90QksfyyOG |||,en
2022-12-31 06:38:23+00:00,814264788,"@Gthompson111_Bo @PierreKory Some of them do work. Gates' kids probably have 10 of them that we don't even know about because he wants us dead, but let me tell you: they're not jabbed with the Covid-19 ""vaccine"". Because it's not a vaccine.",en
2022-12-31 06:35:46+00:00,896351423457185792,"https://t.co/WX028qmPM5 =My_SW 😁💛🍊💜😁 ,i've booked an Appointment togo for my &lt; Covid~19 Vaccine | 2nd*Booster 💉Shot &gt; this UpcomingFri ! 😁✌️ = i CANNN (!!)Keep My💎Mom &amp; Myself💜🥭 SAAAFE 🛡️even though it's Still Ideal* My💎MomTakes d Shot 💉 Herself  !  🙏 https://t.co/IoFChSDQ0C",en
2022-12-31 06:32:24+00:00,1267397813089910789,"@MarkAll26740409 @GovMurphy The higher the number of vaccines previously received, the higher the risk of contracting COVID-19 (Figure 2).https://t.co/ynUqCUDFK6 https://t.co/VyAhjtKbm2",en
2022-12-31 06:31:34+00:00,1453831236556832775,@juanangelpagani EXPERTS WARNING ABOUT THIS WAVES OF NEW VIRUSES THAT ARE EXPANDING THROUGHOUT CHINA AND MAYBE THE ACTUAL VACCINES CAN T FIGHTING SO WE NEED A NEW EFFORT FROM OUR SCIENTISTS TO PRODUCTION A NEW TOOL AGAINST THE VARIANTS OF COVID 19 ACTUALLY THREATENING CHINA,en
2022-12-31 06:30:43+00:00,304307433,@TeslaYinTexas @Gitmo99 That's not what the trial data shows. The antivaxxers say the Covid-19 trials were flawed &amp; they vaccines are expermental yet refuse to accept the Ivermectin trial data. It doesnt work. It's an anti parasitic drug not an antiviral  treatment.  https://t.co/0aSQDfxDSH,en
2022-12-31 06:30:02+00:00,28123142,"The mRNA used in the Pfizer and Moderna COVID-19 vaccines is broken down within a few hours to a few days after vaccination, and discarded from the body. https://t.co/a5ny33pQSW",en
2022-12-31 06:29:52+00:00,1580742696343322626,Covid-19 Vaccine: Issues and Way Forward IIOXQUYhttps://t.co/vT1bxpccQZ https://t.co/LHUksuR02e,en
2022-12-31 06:29:46+00:00,8015612,Hundreds of fired healthcare workers who refused Covid vaccine get $10.3 million settlement– A US judge approved a multimillion-dollar settlement on Dec. 19 for workers who were fired by an Illinois healthcare system for refusing to get a Covid-19 vaccinehttps://t.co/IqRpEjXQuT,en
2022-12-31 06:24:54+00:00,1546531870309064705,"@RWMaloneMD Tell me this, are you against the covid 19 vaccine?",en
2022-12-31 06:24:31+00:00,1112714156887543808,"COVID-19 UPDATE - 220.10 cr Total Vaccine doses (95.13 cr Second Dose and 22.40 cr Precaution Dose) have been administered so far under Nationwide Vaccination Drive91,732 doses administered in last 24 hoursIndia's Active caseload currently stands at 3,653@MoHFW_INDIA https://t.co/ATQczynKJU",en
2022-12-31 06:21:40+00:00,1510916338201604097,"And, please don't forget good old fashioned analog lies: Tell them what they want us to tell them. Tell them what we want to tell them.   Just in either case, don't tell them the truth. Most of this Covid-19 stuff from lockdowns to vaccines stopping infection and spread are B.S.",en
2022-12-31 06:19:38+00:00,826297816796581888,@CDCDirector Do your damn job before we're back to square one.Scientists at Columbia  warned that the rise of subvariants  “further compromise the efficacy of current COVID-19 vaccines and result in a surge of breakthrough infections as well as re-infections.”https://t.co/4btOtqLFFK,en
2022-12-31 06:17:49+00:00,938050028047945729,"@ChoigeChoi It is well.We defeated Covid-19. We shall overcome the post Covid-19 scars.We have the weapon, Covid-19 Vaccine. Easy!",en
2022-12-31 06:12:26+00:00,21371939,2020 – The World Health Organization issues its first emergency use validation for a COVID-19 vaccine. #OTD,en
2022-12-31 06:10:43+00:00,91963370,"1979 Swine Flu vaccine: 1 serious event per 100,000 vaccines, vaccine withdrawn1999 Rotavirus vaccine Rotashield:. 1-2 serious events per 10,000 vaccines, vaccine withdrawnCovid 19 mRNA vaccines: 1 serious event per 800...",en
2022-12-31 06:09:44+00:00,76575627,"@RobertKennedyJr Swine flu Vax (1976)1 serious adverse event per 100,000 vaccinations. Immediately withdrawn!Rotavirus Vax Rotashield (1999) 1 to 2 serious adverse events per 10,000 vaccinations. Immediately withdrawn!Covid-19 Vax 1 serious adverse event per 800 and the vaccine is mandated! 🤡",en
2022-12-31 06:09:16+00:00,1595673658088951808,Top Japanese Physician-Scientist Gives Dire Warning About COVID-19 mRNA Vaccines: ‘Scientifically Misconceived’ https://t.co/38TOND1Wuq,en
2022-12-31 06:02:40+00:00,508591081,"""Together, our findings indicate that BQ and XBB subvariants present serious threats to current COVID-19 vaccines, render inactive all authorized antibodies, and may have gained dominance in the population because of their advantage in evading antibodies.""https://t.co/Y3Cwa6xf1F",en
2022-12-31 06:02:14+00:00,1519744440042016769,"Cleveland Clinic:The higher the number of vaccines previously received, the higher the risk of contracting Covid-19.#covid #vaccines",en
2022-12-31 06:01:43+00:00,1545140464487120898,Covid-19 Vaccines Have Saved Millions of American Lives; Booster Shots are Critical https://t.co/FAI2BvXlrM,en
2022-12-31 06:01:28+00:00,1591908347246440448,"@WHO @PeterHotez @BCM_TropMed People asking questions isn't anti-vaccine. It's pro-choice and pro ""informed"" consent which i believe wasn't a thing for these covid 19 vaccines.",en
2022-12-31 05:57:43+00:00,205543773,"@ELHopkins It's the mRNA COVID-19 vaccines that are causing ""long covid"" and immune problems, not so much the cold/virus itself... https://t.co/PY9c8tQtfK",en
2022-12-31 05:57:02+00:00,429770684,"China Covid-19 surge a cause for concern, prompting nations to impose entry restrictions. The vaccine pass system in China will be scrapped but compulsory masks in public places will continu https://t.co/fBdmO6tBj3",en
2022-12-31 05:54:45+00:00,1339425008951709699,@elonmusk @SecretService I ALREADY UNPLUGGED MYSELF WIRELESSLY &amp; THE PERSON YOU SEE IN THE PROFILE PICTURE IS NO LONGER HIMSELF AND ALREADY HAD THE COVID-19 VACCINE 21 YEARS AGO AS COVID-19 IS A REDACTED PILL THAT WENT INCOMPLETE AND TERMINATED AS ALSO THE WHITE HOUSE ALARMS NEVER WENT OFF AS CONFIRMED,en
2022-12-31 05:53:22+00:00,1588971486647312385,"@realstewpeters Double jeopardy is what I call those who had ""vaccine"" then active covid 19, 2 months later result in heart issues, systemic issues. I'm no Dr just speculation. Crazy the articles on Tom often  forgets to mention he had both. Shot causes inflamation in heart. Even mild can",en
2022-12-31 05:52:40+00:00,60514666,"Chang Shih-chung (張世忠), chairman of Medigen Biotechnology Corp., was released on bail early Friday after being questioned on alleged insider trading activities involving its COVID-19 vaccine-making subsidiary, Taipei prosecutors said.https://t.co/65VikJhXxX",en
2022-12-31 05:50:07+00:00,4295790075,EU doubles support to global COVID-19 vaccine initiative to €1bn https://t.co/zFT7xTK167,en
2022-12-31 05:48:01+00:00,1436925512383799297,"COVID-19 Update▪️ 220.10 cr Total Vaccine doses have been administered▪️ 91,732 doses administered in last 24 hours▪️ India's Active caseload currently stands at 3,653▪️ Active cases stand at 0.01%▪️ Recovery Rate currently at 98.8%.#Covid #COVIDIsAirborne #Ronaldo #Pele https://t.co/Yp749S89oq",en
2022-12-31 05:47:48+00:00,4888733177,"Let the war begin. @JustinTrudeau @theJagmeetSingh I will never take a COVID-19 vaccine and will never recommend it to another human being and will always say that COVID vaccines don’t work, rather, they kill and injure. What do you want to do about it?",en
2022-12-31 05:47:29+00:00,181091536,COVID-19 vaccine boosters for young adults: a risk benefit assessment and ethical analysis of mandate policies at universities | Journal of Medical Ethics https://t.co/heqSjswM2v,en
2022-12-31 05:46:52+00:00,58628268,"@jseivers75 @RandPaul Since Dec. 11, 2020, the Pfizer COVID-19 Vaccine has been available under EUA in individuals 16 years of age &amp; older, &amp; the authorization was expanded to include those 12 -15 years of age on May 10, 2021.[https://t.co/AFxt0P0BHs].",en
2022-12-31 05:46:31+00:00,20970395,The #WHO and Dr. Peter Hotez recently issued statements accusing anyone with concerns about the COVID-19 vaccines of being mass murderers and called for governments around the world to take action against them,en
2022-12-31 05:44:56+00:00,986693681989210113,I am worried. Covid 19 is back with vengeance. Is SA ready? Where is your mask? Where is your sanitizer? Ready to apply for a tender at govt deptmnt? Ready for isolation?  Ready for another vaccine booster? Looks like we are about to re-live the past life. https://t.co/vyLkl7vHx3,en
2022-12-31 05:44:10+00:00,772872674712268802,"@RandPaul “Among 51011 working-aged Cleveland Clinic employees, the bivalent COVID-19 vaccine booster was 30% effective in preventing infection”",en
2022-12-31 05:44:08+00:00,819392442,Top Japanese Physician-Scientist Gives Dire Warning About COVID-19 mRNA Vaccines: ‘Scientifically Misconceived’ https://t.co/czLryQB9eR,en
2022-12-31 05:42:15+00:00,1555646257611390981,⁦@PressSec⁩ ⁦@WhiteHouse⁩ Top Japanese Physician-Scientist Gives Dire Warning About COVID-19 mRNA Vaccines: ‘Scientifically Misconceived’ https://t.co/OmsBFjZvav,en
2022-12-31 05:41:18+00:00,231033118,"COVID-19 Update▪️ 220.10 cr Total Vaccine doses have been administered▪️ 91,732 doses administered in last 24 hours▪️ India's Active caseload currently stands at 3,653▪️ Active cases stand at 0.01%▪️ Recovery Rate currently at 98.8%Details https://t.co/cWEDbaGmYt1/2 https://t.co/RhkmsGi8jE",en
2022-12-31 05:40:06+00:00,2492210048,@RobGouveiaEsq Going on 3 years NO VACCINE and zero Covid 19 diagnosis.,en
2022-12-31 05:39:45+00:00,354957945,"Retweet selected by the https://t.co/kmOCQTFIJb team |  China's Covid-19 vaccine to cost around $150, expected by year's endmanufacturer Sinopharm CEO #world_news https://t.co/Duc9mweINm https://t.co/BvM3zMMLtK",en
2022-12-31 05:39:14+00:00,779808608313675776,Dr. Aseem Malhotra: From Vaccine Pusher to Vaccine Debunker—How I Changed My Mind About the COVID-19 Jab https://t.co/UeXwOdz9ZH via @epochtimes,en
2022-12-31 05:37:59+00:00,1551619793890918400,"Who in Canada pushed the Covid-19 vaccine on children? Wgat is Canada’s children’s death stats? Never mind it won’t be truthful, it will be redacted!What a fucking mess!Can I say that @erinotoole @PierrePoilievre Why aren’t you guys asking these questions instead of me/us?",en
2022-12-31 05:37:22+00:00,356004346,New Study Found A 9-Times Increased Rate Of Myocarditis In Males After mRNA Booster | 3 Or More COVID-19 Vaccine Doses Associated With A 6-Fold Increased Risk Of Infection Said Cleveland Clinic | ETC https://t.co/fTvyyLUbHO,en
2022-12-31 05:37:02+00:00,14361260,"The mRNA used in the Pfizer and Moderna COVID-19 vaccines is broken down within a few hours to a few days after vaccination, and discarded from the body. https://t.co/VLyzO0Am2D",en
2022-12-31 05:36:34+00:00,851587080056602624,@WogPogReal Pandemic Scenario:Date completed: October 2017SPARS = SARS = SARS-CoV-1 = SARS-CoV-2 = COVID-19Recovery:Chapter Seventeen: Vaccine Injury (Page 59) https://t.co/IW4jS1uZDn,en
2022-12-31 05:36:02+00:00,1520295249830195200,Slow on the draw. What do you think the Vaccine (COVID-19) is for? It’s not a cure. Problem is people are catching on to quickly. Forcing hasn’t been as successful as desired.,en
2022-12-31 05:33:56+00:00,77888292,"@LisaLovingIt @drgonzo718 @ZekeEmanuel @Lawrence Vaccines are supposed to eradicate a disease, like Polio, the German measles, Scarlet Fever, Etc. COVID-19 is a “shot” NOT a vaccine. You take the polio VACCINE you won’t get polio. You take the flu or COVID shots, you can still get the flu or COVID.",en
2022-12-31 05:33:09+00:00,1414478214848606210,"@wakeupsg 4) Review covid 19 spent, contracts, vaccine injuries etc",en
2022-12-31 05:30:38+00:00,1376449366853058566,"WOW @pfizer, what do you have to say about this? BELOW⬇️I told you I was not going to stop exposing you an tell ( We The People of America ) to get the Real 100% Honest Truth Live on Tv and release the real evidence ( PDF ) of the COVID-19 Vaccine...",en
2022-12-31 05:25:32+00:00,1096933400668078081,@alexmeshkin I wonder how long it will be before they come out with another vaccine for us to take for covid-19 they seem to say now that we can take one once a year I don't believe that I believe it sooner than that,en
2022-12-31 05:23:17+00:00,1520035044684873728,"@60Minutes Lol, experts said the cov 19 vaccine would keep you from getting covid 19 virus, experts also said by 2020 the same thing you are saying now!!!",en
2022-12-31 05:21:04+00:00,1058703612279324672,"(1/4)The correct answer of #200PinsForPrelims is option (c)COVAXIN is India’s first indigenous Covid-19 vaccine developed by Bharat Biotech, Hyderabad in collaboration with the Indian Council of Medical Research’s National Institute of Virology, Pune.",en
2022-12-31 05:18:20+00:00,164976578,"@doritmi @MartinKulldorff The COVID-19 vaccines were sold to the public on the basis of lies, e.g., that 2 doses would induce durable sterilizing immunity and end the pandemic by conferring herd immunity, that natural immunity is inferior, etc.",en
2022-12-31 05:16:36+00:00,1351935042243735554,@Spencer_Tracy1 @samsqautch @PierreKory Dr Malone invented the mRNA technology. He was against using mRNA technology for COVID 19. He's against THIS vaccine. Look up the unusual blood clots morticians are seeing.,en
2022-12-31 05:14:44+00:00,1267397813089910789,"foundation for COVID-19 vaccine promotion.  Public posting of raw data is a reasonable response: “Open data” is becoming the norm in science and is now required by many leading journals.   The time has come for the FDA and EMA to reopen their investigations, and for Pfizer,",en
2022-12-31 05:14:43+00:00,1267397813089910789,"release all information needed for a comprehensive assessment of these products.COVID-19 vaccines are now among the most widely disseminated medicines in the history of the world. They have cost taxpayers tens of billions of dollars, rivaling the annual US federal expenditure",en
2022-12-31 05:14:36+00:00,1267397813089910789,It is less clear which groups are at risk for serious adverse vaccine reactions. Those at low risk for hospitalization may still be at risk of serious vaccine reactions. We only considered mRNA vaccines and it is not clear that other COVID-19 vaccines confer the same risk.,en
2022-12-31 05:14:33+00:00,1267397813089910789,"Last week, along with an international group of physicians and scientists, we published a study suggesting that the risks of COVID-19 vaccines may be greater than previously reported.  Using publicly available data from Pfizer and Moderna studies, we found one serious adverse",en
2022-12-31 05:10:48+00:00,571344828,"@CPHO_Canada Swine Flu vaccine 1976- 1 serious adverse effect per 100,000- vaccine withdrawn. Rotavirus vaccine 1999- 1 to 2 serious adverse effects per 10,000- vaccine withdrawn. Covid-19 mRNA vaccines 1 serious adverse effect per 800- vaccine officially promoted......",en
2022-12-31 05:09:00+00:00,626391901,New law ends COVID-19 vaccine mandate for US troops | AP News https://t.co/HYU19cQK9L |||,en
2022-12-31 05:07:57+00:00,1396492046672695301,"@RahulGandhi @kharge @narendramodi Covid 19 cases India are going down in last 6 months with December avg 200 cases. It looks things are better than before. Government should improve vaccine/booster %, restrict Chinese passport immigrants instead media hype and blocking BJY",en
2022-12-31 05:04:13+00:00,1473732837522219009,"@docchai2022 @catturd2 @Imagecaptured Please, please tell us you are up to date with your Covid-19 vaccine boosters.  🤞",en
2022-12-31 05:02:27+00:00,289118612,"Monday night it was announced that Orange County California Deputy District Attorney Kelly Ernby, a rising star in the GOP who railed against vaccine mandates died of COVID-19. She was 46 years old. https://t.co/EFOB78Je6O 02",en
2022-12-31 05:00:26+00:00,1316995278847660032,COVID-19 still around us. Get your booster dose vaccine for better protection!@DGHisham @KKMPutrajaya @protecthealthco,en
2022-12-31 04:58:52+00:00,1493197842424291336,"We are pleased to welcome you all to submit your Abstracts at the 16th European Biosimilars Congress during April 03-04, 2023 #Barcelona, #Spain. The conference mainly focuses on the theme “#COVID-19 effect on supply of drugs and #vaccines through over the world”. https://t.co/tnl7KVy6bj",en
2022-12-31 04:58:41+00:00,50727459,"@FauciFan Sadly, males aged 12-39 who took a Moderna COVID-19 booster compared to a second dose experienced a 9-fold increase in the risk of myocarditis.Denmark, Finland, Norway, and Sweden have recently stopped recommending mRNA vaccines for males under 30.",en
2022-12-31 04:58:04+00:00,50727459,"Sadly, males aged 12-39 who took a Moderna COVID-19 booster compared to a second dose experienced a 9-fold increase in the risk of myocarditis.Denmark, Finland, Norway, and Sweden have recently stopped recommending mRNA vaccines for males under 30.",en
2022-12-31 04:52:51+00:00,1521488065289666561,"@CARBON465 @briebriejoy Ya know a fun topic that I don’t imagine we won’t agree on and would have a good debate, same topic in which I would debate Destiny (and I’m no fool to his ability) Covid 19 vaccines and or pandemic response",en
2022-12-31 04:52:35+00:00,1577575941341061120,"@CPhenom69 Just look at the death statistics of countriesThe countries that did not use our vaccines have 0 deaths from Covid-19 todayWhy ???For example, Iran",en
2022-12-31 04:52:26+00:00,1542511474320343046,Is the Omicron XBB variant 5X more virulent than the Delta variant of COVID-19??! 😱https://t.co/D1u3dRw3ib#TechARP #COVID19 #OmicronXBB #OmicronVariant #DeltaVariant #OmicronVirus #Coronavirus #Vaccine #India #Singapore #Danger #Safety #Facts #FactsCheck #Hoax #FakeNews #Fake,en
2022-12-31 04:43:51+00:00,1926562094,@NHSWI Also see Podcast: American Thought Leaders with Dr James Thorp (01/12/2022) no one should have Covid-19 vaccine especially pregnant women. @AngusMacNeilSNP @ABridgen @Debi49400012 @DrAseemMalhotra @AlexSalmond @NicolaSturgeon,en
2022-12-31 04:43:00+00:00,1585639503804665858,CONFIRMED: COVID-19 mRNA Vaccines Can Cause Severe Liver Damage.https://t.co/iH74Lr42AG,en
2022-12-31 04:42:12+00:00,1509162723204304897,"A ferritin-based COVID-19 nanoparticle vaccine that elicits robust, durable, broad-spectrum neutralizing antisera in non-human primates https://t.co/om80Mlqy1Y",en
2022-12-31 04:40:28+00:00,1354206968169324546,Fact check: Belief COVID-19 vaccines are not effective comes from misinterpreted data https://t.co/VtycfHLbOc,en
2022-12-31 04:40:10+00:00,1518708383821537281,"@Comment_Monos Its the vaccine. Covid 19 was manufactured in a lab, and like the flu, it is more deadly in the elderly &amp; those with compromised immunity. It is important to note that the Hospital Protocols killed more people by administering Remdisiver &amp; not allowing Ivermectin.",en
2022-12-31 04:39:40+00:00,1495514832216285184,@shmuelcshapira It can also effect babies hearts in-uteroHow many pregnant women know this?💔“We present herein two cases of fetal supraventricular tachycardia following the administration of the Pfizer-BioNTech COVID-19 vaccine during pregnancy.”https://t.co/fpL1nP9Doj,en
2022-12-31 04:38:04+00:00,1449909279264280576,"2./ “The study involved 50k Cleveland Clinic employees…” Pay attention docs and nurses, it gets good! “Risk of COVID 19 increase with time since the most recent prior COVID 19 episode and with the number of vaccine doses previously received.” Imagine our shock 😱😱 https://t.co/WzIYZta4Bq",en
2022-12-31 04:37:39+00:00,1238916248504655873,@Kam_Bach covid 19 vaccines n boosters saves lives don t like it get out of canada  if numbers go sky high because of the anti maskers i ll be ticked off,en
2022-12-31 04:35:39+00:00,1433988239723925509,@Banton6Mike @snapthennap @AnitaBourque Does the Covid 19 vaccine prevent transmission?,en
2022-12-31 04:34:09+00:00,511629865,@muligensMattis @Silje_Schevig @elaine_sommers @DrAseemMalhotra Yes but Covid-19 💉 was a “vaccine” created to prevent severity of disease and to prevent hospitalization ... &amp; this “vaccine” does not prevent you from getting COVID and does not prevent you from transmitting COVID.,en
2022-12-31 04:33:20+00:00,2359347697,"@ultrcide @97__Kevin @PadraigBelton @nathaliejacoby1 2) Since December 2020, more than 469 million doses of COVID-19 vaccine have been administered in the U.S., and VAERS has received 10,483 reports of death (0.0022%), according to the CDC. (Numbers as of Dec. 29, 2021.) Significantly less ,but still peoples own choice",en
