date,userid,tweet,lang
2022-12-31 23:58:05+00:00,1590406508516413441,"@globeandmail China 90% vaccinated, I take it vaccines dont work on Covid-19! 🤣",en
2022-12-31 23:54:40+00:00,1519480166698860544,"Based on passive surveillance reporting in the US, the risk of myocarditis after receiving mRNA-based COVID-19 vaccines was increased across multiple age and sex strata and was highest after the second vaccination dose in adolescent males and young men.https://t.co/Y2YadFKIPf",en
2022-12-31 23:52:51+00:00,1585842073634209792,"@AnniMovsisyan @isa_bee25 @ABrokenBattery The American Society of Gene + Cell Therapy stated on December 11, 2020:“Today’s FDA approval of the COVID-19 vaccine BNT162b2 from Pfizer and BioNTech marks a great day for the USA and a significant milestone for the field of gene and cell therapy.”https://t.co/KmRZGkENgO",en
2022-12-31 23:51:26+00:00,1470133949901033480,Never forget the numpties who tried  to coerce and shame those who didn’t                                                   All the Celebrities Who Have Received the COVID-19 Vaccine https://t.co/5JO8v8xBcj,en
2022-12-31 23:49:50+00:00,1366240364542234631,Dr. Sucharit Bhakdi: The COVID-19 Vaccine Is Destroying The Hearts &amp;amp; Brains Of Billions Of People! https://t.co/Jlm2ydcB2O,en
2022-12-31 23:43:57+00:00,1218459042311368704,"Our parents died from Covid 19 and related issues. Please be responsible to all Australian by at least testing all arrived Mainland Chinese for Covid 19. No more  suffering, please. Don't ask us to do the vaccine again. It is their responsibility for not spreading the virus to us",en
2022-12-31 23:41:12+00:00,37716311,7 Covid-19 Realities To Consider In 2023 - Forbes-- News | The Perfect Enemy: https://t.co/yODCRxmg0p.#Coronavirus #Coverage #Economy #Uninsured #Vaccines https://t.co/203AtLMLzv,en
2022-12-31 23:40:41+00:00,709947536,7 Covid-19 Realities To Consider In 2023 - Forbes-- News | The Perfect Enemy: https://t.co/ch7iaWd19j.#Coronavirus #Coverage #Economy #Uninsured #Vaccines https://t.co/0IwxMgQiOf,en
2022-12-31 23:39:28+00:00,1328166103,Vaccine immunity can be inherited by the next generation!  - COVID-19 va... https://t.co/adRHd5mj9n via @YouTube,en
2022-12-31 23:36:30+00:00,626391901,New law ends COVID-19 vaccine mandate for US troops | AP News https://t.co/HYU19cQK9L ||,en
2022-12-31 23:35:25+00:00,850527333165420546,Here's how COVID-19 vaccines can protect you and your baby. https://t.co/vJMZTetxqj,en
2022-12-31 23:34:58+00:00,1051592244078080000,"@annatime94 😳‘our findings indicate that BQ and XBB subvariants present serious threats to current COVID-19 vaccines, render inactive all authorized antibodies, and may have gained dominance in the population because of their advantage in evading antibodies.’https://t.co/zEhoAQ5vl7",en
2022-12-31 23:33:51+00:00,814106958,@akheriaty Shut down the Covid 19 vaccine program &amp; Promote early treatments protocole for Covid 19.,en
2022-12-31 23:33:23+00:00,1571248533868617729,@NightShiftMD @Thomsod How many COVID-19 vaccines did she get?,en
2022-12-31 23:31:31+00:00,1594135694280122369,"@amuse Sounds like we could use them in matters like Hunter Biden and his laptop, or the Covid-19 origins, masking debate, vaccine efficacy, even the Southern border and crime. Education might be the one area that they (Democrats) won't be able to spin the story. It's not a partisan iss",en
2022-12-31 23:31:01+00:00,221912346,@RishiSunak Prick billionaire's elite  why we was locked down plandemic fake he was partying with mates . Covid-19 con vaccine con,en
2022-12-31 23:25:54+00:00,202322417,Health workers will still need to be immunized with a primary COVID-19 vaccine series unless they have an exemption from the provincial health officer.https://t.co/9oplCVeb2G,en
2022-12-31 23:25:28+00:00,19240249,Health workers will still need to be immunized with a primary COVID-19 vaccine series unless they have an exemption from the provincial health officer.https://t.co/4p4V8H1KbM,en
2022-12-31 23:25:24+00:00,20711586,Health workers will still need to be immunized with a primary COVID-19 vaccine series unless they have an exemption from the provincial health officer.https://t.co/4bidc7DkB1,en
2022-12-31 23:24:29+00:00,1594179920825143298,"@TheChiefNerd The COVID-19 ""vaccine"" is the culprit",en
2022-12-31 23:22:17+00:00,1922301836,Risk benefit analysis says stop #vaccine mandates. Re-evaluate data. #Covid_19,en
2022-12-31 23:21:45+00:00,1170566997450645507,"Why we probably won't get new covid-19 vaccines in 2023Any new covid-19 vaccine must be better than the ones we already have, setting a high bar for approval that is not expected to be met in 2023. https://t.co/jHNxonDIBX",en
2022-12-31 23:21:32+00:00,1448797739936935953,"@SaudeemFoco @PeterHotez @DrTedros @mvankerkhove @dr_nesio @fiocruz Would love to see a debate between @PeterHotez  and @stkirsch on the safety and effectiveness of COViD-19 vaccines.  Steve has challenged Peter.  Hey Peter, here’s a great opportunity to prove Steve Kirsch to be the world’s greatest misinformation spreader!",en
2022-12-31 23:11:12+00:00,3381516280,"https://t.co/i3zLiQlhW7  “Scientists and public health officials have been closely monitoring the XBB subvariant family for months because the strains have many mutations that could render the Covid-19 vaccines, including the omicron boosters,",en
2022-12-31 23:10:56+00:00,1519695068776452096,COVID-19 Vaccines are unsafe. There are grave side effects from it @CDCgov @NIH @pfizer @CNN @FoxNews @MSNBC @washingtonpost @nytimes @Newsweek hush hush about it.,en
2022-12-31 23:09:45+00:00,44460814,"@DALupton “GY has received research funding from Gavi, the Vaccine Alliance (Gavi) and the Bill &amp; Melinda Gates Foundation, both of which support COVID-19 vaccine development and deployment.”  Two can play at this game, hon.",en
2022-12-31 23:08:25+00:00,1217851607108313089,"@DrPaoloMezzana ""Blistering disorders are being increasingly recognized as a cutaneous side effect of COVID-19 vaccination. Dermatopathologists should continue to be aware of the various clinical and histopathological presentations of vaccine-related reactions."" https://t.co/16OQKUmddS",en
2022-12-31 23:07:59+00:00,1587287843394637824,@DrEricDing @Phil_Lewis_ No President Obama and Secretary Hillary Clinton didn't have anything to do with covid 19 trying to find a vaccine for the bird virus in China because it was starting to jump from animals to humans the birds fly world wide try and study Microbiology first.,en
2022-12-31 23:07:53+00:00,1217851607108313089,"@DrPaoloMezzana Eosinophil-rich linear IgA bullous dermatosis induced by mRNA COVID-19 booster vaccine:https://t.co/4sbIrRPN4j""With the recent recommendation of a second booster COVID-19 vaccine, an increased number of immune-mediated cutaneous reactions may potentially be observed.""",en
2022-12-31 23:07:23+00:00,386431613,@PeterHotez  Why won’t you debate Steve Kirsch on the VAERS data on the covid-19 vaccines?  Your silence appears to be damning!  If they are safe why can’t you debate and prove us doubters wrong?,en
2022-12-31 23:07:06+00:00,17258366,Top Japanese Physician-Scientist Gives Dire Warning About COVID-19 mRNA Vaccines: ‘Scientifically Misconceived’ https://t.co/PPfwGaoSc8,en
2022-12-31 23:06:50+00:00,1429247617670606850,"@robinmonotti Please let I know who said this?After vaccinated Covid-19 vaccine, I, my families and my colleagues are all well.In this June, it’s just 2 years after my first vaccinated, Is it OK to come back hear and Retweet it? https://t.co/ePdlWlP3Pq",en
2022-12-31 23:06:47+00:00,1217851607108313089,"@DrPaoloMezzana serious complication that can arise from some COVID-19 vaccines. If not caught early and treated properly, VITT can be deadly."" https://t.co/NOTeKri6Hb",en
2022-12-31 23:05:57+00:00,779518854,"@Furrowed_Brow69 Yeah, I think there were/are labs doing both vaccine studies. The Astra Zeneca Covid-19 vaccine was a viral vector marketed as a preventative vaccine, NOT a therapeutic.",en
2022-12-31 23:04:40+00:00,1582042954495148034,@DylanOgline Fauci and Gates should be in jail for funding gain of function research to create covid-19 which has done what it has done to the world while he profits from vaccines. There is evidence of this.,en
2022-12-31 23:02:33+00:00,1067668201486475264,@michaelshermer I still would like to see you speak on the Covid 19/experimental vaccine mandate debacle. Most accused of being conspiracy theorists were actually right about their claims. Why do you think conspiracy theorist is being used to paint vax skeptics as incorrect?,en
2022-12-31 23:01:40+00:00,92586353,"Like sharing life's most meaningful moments, show them love when you help them stay up to date on free COVID-19 and flu vaccines. Boost up today! Visit https://t.co/gzvtUhXGIo or call 833-308-1988. https://t.co/umPj3A4gx8",en
2022-12-31 23:00:31+00:00,116766949,"#Covid-19 #vaccine #spikeproteins are killing people, not merely the “#virus”  https://t.co/aIvGV9hqPY https://t.co/mRq7DCLEL3",en
2022-12-31 23:00:30+00:00,1006978429,@NarrativeResist @BretWeinstein @HeatherEHeying Does any mRNA vaccine code for a spike protein or is this something specific to the Covid-19 vaccine and potentially not part of a mRNA vaccine that will be produced to use against the Flu?,en
2022-12-31 23:00:18+00:00,15645871,"#Covid-19 #vaccine #spikeproteins are killing people, not merely the “#virus”  https://t.co/AOBFAf8COR https://t.co/tkCYTKj33A",en
2022-12-31 23:00:17+00:00,27860681,➡️ $10 billion spent ➡️ 78 countries➡️ 633.5 million vaccine dosesMore about @WorldBank Group's COVID-19 health response our #YearInReview: https://t.co/QxBDRyIVED https://t.co/98PxBToooF,en
2022-12-31 23:00:07+00:00,334944709,A tangle of high-stakes U.S. patent disputes over COVID-19 vaccines could be tamed by court rulings or grow even more complex next year. @blakebrittain has the details https://t.co/NokPSjNqGt https://t.co/Tp607DwbLp,en
2022-12-31 22:59:49+00:00,31447151,They finally admit it!Pfizer’s COVID-19 Vaccine Linked to Blood Clotting: FDA https://t.co/7azwh0TlSd,en
2022-12-31 22:59:46+00:00,1096651339734663170,"@AndrewJLipscomb @KamalaHarris At least one vaccine for COVID-19 was ready while President Trump was in office, but the democRats refused to let him approve the release just so they would get credit for it instead of him.",en
2022-12-31 22:58:02+00:00,1904192581,@nhrudi1 @kathrynw5 @Curmudgeon56 @CBSNews Example #2- COVID-19 vaccines are safe and effective. https://t.co/OgeqzQttBU,en
2022-12-31 22:49:40+00:00,1405004497848442880,"@maddenmichaele @brixwe These clots (thromboembolisms) are frequent among deceased people and are mainly caused by obesity, sedentarism, smoking, and now COVID-19, not vaccines.",en
2022-12-31 22:47:52+00:00,1486474116706222085,@oneflewbytheby @ConspiracyDad3 Trump incited the Operational Warp Speed vaccine roll-out. Anyways this Covid-19 bullshit woke me up and yes of course a vaccine has to be properly vetted in 4 phases of clinical trials which BTW they bypassed the Preclinical trials with animals and went right to humans.,en
2022-12-31 22:47:07+00:00,1485197803039203334,@CDCDirector Why you injured millions of people with your Covid-19 Vaccine. another new year with ungoing health issues. My life it's ruined  !!! #vaccineinjuries,en
2022-12-31 22:47:04+00:00,116766949,"#COVID-19 #vaccine #spikeproteins are #SHEDDING, giving people #heart #attacks, #strokes and more  https://t.co/udt5VvEQXQ https://t.co/rU3Cs4yvHc",en
2022-12-31 22:46:57+00:00,15645871,"#COVID-19 #vaccine #spikeproteins are #SHEDDING, giving people #heart #attacks, #strokes and more  https://t.co/LPXxAL4K3C https://t.co/zO0FuASRYc",en
2022-12-31 22:43:13+00:00,536744675,@MartyMakary @RandPaul Over 300 people still dying each day from #covidVaccines effective protection from severe illnessUnvaccinated ~40 times more likely hospitalizedAdditional #Covid_19 information from medical professionalshttps://t.co/k4I4czL6llWhy does GOP demonize scientists helping us?,en
2022-12-31 22:42:57+00:00,1584513137545469957,The Search for a Covid-19 Vaccine (Understanding the Covid-19 Pandemic) QXKUHTNhttps://t.co/WZOSwaU9ov https://t.co/qd93p3K8xr,en
2022-12-31 22:42:43+00:00,1154063679517810689,A busy June 2022 continues with two big events on 6/21: #CHAM Fellowship Graduation &amp; the start of #COVID-19 vaccines for children as young as 6 months of age at @MontefioreMMG! #VaccinesWork  @MontefioreNYC  @AudreyUongMD @DrFerdowsi @BuckenmyerTara @nicolejsuttonmd @DrAnna_MD https://t.co/FLC6eKYkCI,en
2022-12-31 22:42:08+00:00,1400023122733043714,"@HegKong I don't know anyone who died from Covid-19, but I've lost a family member because of the vaccine. And that was very upsetting for our family.",en
2022-12-31 22:40:17+00:00,1362958165097259010,Pfizer’s COVID-19 Vaccine Linked to Blood Clotting: FDA https://t.co/V9w9KL19ZE,en
2022-12-31 22:40:17+00:00,1543782322415321088,Top doctor says she suffered COVID-19 vaccine injury | 9 News Australia https://t.co/RkNETe8JFr via @YouTube,en
2022-12-31 22:37:59+00:00,1501174413663903749,"US Senate Panel on COVID-19 Vaccines: What They Are, How They Work, and Possible Causes of Injuries @P_McCulloughMD https://t.co/779PZ0poIo via @MalcolmOutLoud",en
2022-12-31 22:37:28+00:00,1482376782477201419,"Great short video, very informative.  Proof &amp;apos;Covid-19&amp;apos; Vaccines Caused Death! Dr. &amp;apos;Sucharit Bhakdi&amp;apos; &amp;amp; Dr. &amp;apos;Arne Burkhardt&amp;apos; https://t.co/S9cY09pwl5",en
2022-12-31 22:37:13+00:00,46823997,Top Japanese Physician-Scientist Gives Dire Warning About COVID-19 mRNA Vaccines: ‘Scientifically Misconceived’ https://t.co/RWsvODX3ZX,en
2022-12-31 22:35:26+00:00,20651091,@CarlosPerdue22 @FiddleAsUSBurns About 95% of the adult population in Australia has had at least two COVID-19 vaccinations. There was substantial public demand for the vaccines during the roll-out and some useful apps to help people book appointments. 💉👍 https://t.co/0qq0x9Zbej,en
2022-12-31 22:35:24+00:00,315359046,"@BogochIsaac @MackayIM You must be fully vaccinated with the primary series of an accepted COVID-19 vaccine to travel to the United States by plane. Only limited exceptions apply. For more information, see Requirement for Proof of COVID-19 Vaccines https://t.co/wK4EgdpKwW",en
2022-12-31 22:34:25+00:00,3180217266,"Top story: CDC data shows COVID-19 numbers on cruises after vaccine rules dropped https://t.co/JHSfjirulm, see more https://t.co/IOLowYJVYx",en
2022-12-31 22:33:55+00:00,1656443526,Every time one take this jab the weaker is our immune system…it not like other vaccines…it RNA … biological someone said we know where the flu comes from but we don’t know where COVID-19 came from???do Research For years biological warfare was done  soldiers ..still suffer,en
2022-12-31 22:32:57+00:00,1287058883052281856,"@KetsVikno @CGWeatherHub @AmitAryaMD Everyone sympathises with the families of the 47 but you should also sympathise with the families of the 213,000 people who've died as a consequence of having Covid-19. It's no consolation for the 47 but the vaccines have proved to be very safe.",en
2022-12-31 22:31:41+00:00,1437434468030107650,@tatereeves I fully support Republicans decision to NOT get the Covid 19 vaccine. More Power to youhttps://t.co/yM7fZr3NFj,en
2022-12-31 22:31:31+00:00,51824585,Which of the following best describes your COVID-19 and vaccine situation? No COVID means you've never had it.,en
2022-12-31 22:29:16+00:00,55124399,@EcoFashionByBG @erdocAA Many became self acclaimed “experts” on COVID-19 &amp; touted themselves locally &amp; nationally as such without actually having taken care of an ill patient. Many became millionaires by having their staff perform Covid testing &amp; administer vaccines while they hid in their offices.,en
2022-12-31 22:27:03+00:00,1584814310009851906,Longshot: The Inside Story of the Race for a COVID-19 Vaccine STMTOCGhttps://t.co/T9mhmvKDbG https://t.co/UE36zW6DNb,en
2022-12-31 22:26:29+00:00,1267438291118366723,"@GeekGrammy @VikaasShanker @naomirwolf I didn't say that shedding would cause heart problems. I said shedding, appears to be a real phenomena. One that is not necessarily exclusive to the Covid-19 vaccines. Honey.https://t.co/RhFt4mcadV",en
2022-12-31 22:22:07+00:00,1431708935665377281,"All the news media is talking about how covid-19 is coming back with a vengeance... The problem with all of this is that-- The people has wised up knowing that the this virus is Man-made and controlled by man, The vaccine was made before the virus came-- (What's up with that)",en
2022-12-31 22:21:25+00:00,444156863,"Thank u, Dr Fauci!!!  Your brilliance &amp; warning about the deadly Covid-19...&amp; the importance of your speaking as a qualified professional, our USA 🇺🇸 has kept more citizens safe w/ our vaccines!  We appreciate the service you gave to our dear country!  🗽🇺🇲❤🤍💙",en
2022-12-31 22:20:49+00:00,2810811825,@harryhol @mkeulemans New Study Found A 9-Times Increased Rate Of Myocarditis In Males After mRNA Booster | 3 Or More COVID-19 Vaccine Doses Associated With A 6-Fold Increased Risk Of Infection Said Cleveland Clinic | ETChttps://t.co/uAxzOCJ7dN,en
2022-12-31 22:18:59+00:00,1498879530425262080,"@iHFNVTRFLsn7aIE @hyakutanaoki @iHFNVTRFLsn7aIE , you should look at the real world data. ”The higher the number of vaccines previously received, the higher the risk of contracting COVID-19” https://t.co/AtCNRIxbUL",en
2022-12-31 22:18:59+00:00,865756130,"https://t.co/jzUaKko2vtTakeaway points from 42 million people in the UK who were vaccinated against COVID-19• You’re more likely to get myocarditis from COVID infection than from vaccination• If you are a young male, myocarditis risk is lowest with Pfizer’s vaccine",en
2022-12-31 22:18:21+00:00,289118612,"Monday night it was announced that Orange County California Deputy District Attorney Kelly Ernby, a rising star in the GOP who railed against vaccine mandates died of COVID-19. She was 46 years old. https://t.co/EFOB78Je6O 01",en
2022-12-31 22:16:43+00:00,713570786112569344,[CLIP] Dr. Tess Lawrie: COVID-19 Vaccines Cause Inflammation in 'Every O... https://t.co/fSnggixYU3 via @YouTube,en
2022-12-31 22:15:02+00:00,239950631,safety data analysis of Covid-19 mRNA vs 1976 Swine Flu vaccine vs 1999 Rotavirus vaccine by Dr John Campbell @Johnincarlisle #cdnpoli @CPC_HQ @PierrePoilievre @TimUppal @MelissaLantsman @AndrewScheer @LeslynLewis Enough evidence to halt &amp; investigate https://t.co/AAbmxVKAyA,en
2022-12-31 22:14:47+00:00,536744675,@SenTedCruz Over 300 people still dying each day from #covidVaccines effective protection from severe illnessUnvaccinated ~40 times more likely hospitalizedAdditional #Covid_19 information from medical professionalshttps://t.co/k4I4czL6llWhy does GOP demonize scientists?#texas,en
2022-12-31 22:12:34+00:00,133504478,"No, COVID-19 vaccines aren't gene therapy | Ap | https://t.co/nR9nlTGUZC - Berkshire Eagle https://t.co/YEgTwyBLnD #strategy #competitiveintelligence #marketing #competitivemarketing #pharma #biotech #pharmaceutical #healthcare https://t.co/vBSlkvaWX0",en
2022-12-31 22:10:43+00:00,900325361455702019,"@ZakkNs Hajde link.Ja sam nasao ovo:In conclusion, this study found an overall modest protective effect of the bivalent vaccine booster against COVID-19, among working-aged adults. The effect of multiple COVID-19 vaccine doses on future risk of COVID-19 needs further study.",en
2022-12-31 22:06:53+00:00,347568180,"India isolates BF.7 strain, to test efficacy of Covid-19 vaccines https://t.co/emcVBRbqMZ @timesofindia",en
2022-12-31 22:02:04+00:00,1484655149935210498,FDA is finally releasing what everyone's been saying!!Pfizer’s COVID-19 Vaccine Linked to Blood Clotting: FDAhttps://t.co/WOXS6gDdZd,en
2022-12-31 22:01:29+00:00,18517858,"Is the COVID-19 vaccine safe? Do I still need to wear a mask after I get the vaccine? Find the answers to these questions and more in our plain language video playlist all about COVID-19, available in both English and Spanish: https://t.co/36yDR8Yue4",en
2022-12-31 21:56:12+00:00,2233682748,@RWMaloneMD New California law says This law allows doctors to face discipline for spreading so-called misinformation or disinformation about COVID-19—including information about vaccine effectiveness and other treatments—and categorizes such as,en
2022-12-31 21:54:42+00:00,262715869,"@Serienya @KarinBarasa @stkirsch Exactly.  They harp on maybe 40 per million incidence of vaccine-caused myocarditis, while COVID-19 causes something like 450 cases per million. https://t.co/yWLDdJqhSw",en
2022-12-31 21:54:03+00:00,1292775725011877893,"UK Nurse Lecturer &amp; Researcher @DrJohnCampbell3 is calling for an immediate pause in the Covid-19 mass vaccine rollout, in light of the manifest risks associated with these experimental vaccines. Dr Campbell opines that the risks &amp; harm now outweigh any benefit. #StopTheShotsNow",en
2022-12-31 21:51:08+00:00,1316971714933383174,Visit the COVID-19 Information Center for vaccine resources.,en
2022-12-31 21:44:33+00:00,1583575822732087303,2-Pack - Kids COVID Vaccine Pin - I've Been COVID Vaccinated Pin - Blue Mask Metal Lapel Pin - COVID-19 Vaccinated Pin - Coro HP0WEXChttps://t.co/lu9XayupTg https://t.co/ykzrjfr0WU,en
2022-12-31 21:42:53+00:00,1456742568444588035,CDC Whistleblower: “Vaccines Never Meant to Stop Covid-19” | Real Raw News https://t.co/HDxWOaADSV,en
2022-12-31 21:39:21+00:00,1423361120270696450,Yeadon used as a source in 2022!!He thinks that...The Spanish Flu was a 100 year old hoaxCOVID-19 vaccines would depopulate the earth within 2 yearsThe moon landings were a hoax,en
2022-12-31 21:37:01+00:00,1612731506,"Proposal to China/US: make Taiwan a special economic zone with guaranteed self government for 50 years, construct a unity tunnel to join to mainland, get 100 million Covid-19 bivalent vaccine doses from MRNA😎🇨🇦😸..a new year’s resolution",en
2022-12-31 21:34:44+00:00,1432102635981598720,"Theres No Future without effective mitigation ! “BQ and XBB subvariants present serious threats to current COVID-19 vaccines, render inactive all authorized antibodies” Bring BACK ISOLATION, MASKS (n95). Mandate ventilation Standards @AlboMP @PMalinauskasMP @SAHealth @theTiser",en
2022-12-31 21:31:13+00:00,988650336,@lonestarmoocher Congressman George Santos has developed a vaccine for COVID-19 and all variants thereof.,en
2022-12-31 21:29:30+00:00,1975570584,@WhiteRabidbat @woodsjeff53 @mmierek @ClownWorld_ With how much they’ve made and continue to make off this “pandemic” I can assure you it won’t be 20 years. “Federal Purchases of Pfizer and Moderna COVID-19 Vaccines have Totaled $25.3 Billion at an Average Price of $20.69 per Dose” $25 billion dollars worth of “free vaccines”. https://t.co/BAeeEOskDN,en
2022-12-31 21:28:57+00:00,3307109408,"@D_Z_Falcone @DB09215406 I think most (not all) conspiracy theories are nothing more than paranoia, but I agree with you that some have merit.   For example, I'm pro-vax, but even I question the COVID-19 vaccines.  Much to my horror, my concerns are being validated right before my eyes.",en
2022-12-31 21:28:38+00:00,1518755415206551552,"@BeezyManzell @calleymeans Overconsumption of sugar has a more significant public health cost in aggregate than COVID-19. If we can regulate vaccine compliance, why not food choices?",en
2022-12-31 21:28:10+00:00,3732529093,@pewilliams @TexasMonthly How is the vaccine saving lives when the survival rate of COVID 19 is 99.9% without taking any vaxxines🙄,en
2022-12-31 21:25:53+00:00,709947536,CDC lists 4 Connecticut counties under 'high' community transmission of COVID-19 - FOX61 Hartford-- News | The Perfect Enemy: https://t.co/0RpO63BLa9.#Coverage #Vaccines https://t.co/U0FzIhJ9Dx,en
2022-12-31 21:25:42+00:00,37716311,CDC lists 4 Connecticut counties under 'high' community transmission of COVID-19 - FOX61 Hartford-- News | The Perfect Enemy: https://t.co/cdr26WvQIx.#Coverage #Vaccines https://t.co/6TMeisNKSR,en
2022-12-31 21:24:38+00:00,106977430,@USRepMikeFlood https://t.co/rCfFunIrvdI'm not fed up with the Covid-19? I’m not vaccinated with the vaccine because I have greater blood in me ? I was never sick with the flu or Covid-19. God has blessed me. Therefore he is a God and Jesus Christ!,en
2022-12-31 21:23:55+00:00,1606421418773815296,@RyanMattaMedia @riteaid @cvspharmacy @Walllgreens The Covid-19 vaccine literally contains self replicating nano robots in it that creates the Covid-19 spike proteins that clog arteries.,en
2022-12-31 21:21:32+00:00,127868962,Covid-19 vaccines saved an estimated 20m lives during their first year https://t.co/YOR0cf4qNc,en
2022-12-31 21:21:25+00:00,50989447,"This is the best criticism I have seen of what is wrong with the rollout of the COVID-19 ""vaccines"", boosters and the medical and scientific malfeasance at the heart of it all. If you are wondering what New Year's resolution you might make, it ought to be watching this film! RT",en
2022-12-31 21:19:33+00:00,48162456,"@FDRLST Beware: The mRNA genetic Covid-19 ""therapy"" (aka ""vaccine"") will cause more deaths by mid October 2023 than the #Covid19 virus itself. See: https://t.co/m03xSJg81Y and https://t.co/PfKOdrk73E",en
2022-12-31 21:18:30+00:00,1091857187935264769,"Fact check: No, stiff person syndrome isn't caused by COVID-19 vaccine - USA TODAY https://t.co/5Z1dz8kFfi via @GoogleNews",en
2022-12-31 21:14:32+00:00,3768771,"@LongGame360 The federal government has paid and spent more than $30 billion on COVID-19 vaccines, including the new bivalent boosters.",en
