date,userid,tweet,lang
2022-02-21 14:19:30+00:00,2957071245,"@rodonet @muso512 @firuzimehta From the AU document""All people 5 years and over can be vaccinated against COVID-19 if they do not have any contraindications to the vaccine.""So take the experimental vax and experience the contraindications yourself coz there isn't any long term safety data available !!",en
2022-02-21 14:19:21+00:00,86316804,We worry that the queen has Covid 19 but don't give a hoot when 1.2 billion people in Africa are denied vaccines because of apartheid? 😒,en
2022-02-21 14:19:15+00:00,526210877,France’s “freedom convoy” against covid-19 vaccine mandates was mainly powered by homegrown movements but I found some Canadian figures who were egging it on and are part of an existing network of anti-vaxxers across the two countries https://t.co/QtWgGeVkEU,en
2022-02-21 14:17:44+00:00,958108647900483584,"Covid-19 vaccines and treatments: we must have raw data, now | The BMJ https://t.co/Rc2ojKUToH",en
2022-02-21 14:17:43+00:00,628448503,UNICEF launches first-ever ‘U-Report Challenge’ to boost Covid-19 vaccine uptake in Africa https://t.co/TYDG3qnclB,en
2022-02-21 14:17:41+00:00,140798905,#CovidVaccine: @PanaceaBiotec to manufacture Covid-19 vaccine jointly with government; know what it means for investors@PanaceaBiotec #COVID19 https://t.co/yk7waOHCDl,en
2022-02-21 14:17:29+00:00,722437538346979332,"Fact check: Fox News has been repeatedly inaccurate in its coverage of the Canadian ""Freedom Convoy"" protests against vaccine mandates, Covid-19 restrictions and Prime Minister Justin Trudeau. https://t.co/WAuLSKyQVO",en
2022-02-21 14:17:13+00:00,1255172430835838982,"The #IndianArmy on 19th Feb used #drones for supplying the booster doses of #Covid - 19 vaccines to the forward troops in snowbound areas of Jammu and Kashmir. https://t.co/QZl7g2fLiNEver since the #Covid outbreak, contribution of Indian Army has been indispensable! 🙏",en
2022-02-21 14:16:13+00:00,17710740,The Drugs Controller General of India has granted restricted EUA to #BiologicalE's COVID-19 vaccine #Corbevax for the 12 to 18 years age group#CovidVaccine #vaccines https://t.co/bzIOjTHkMZ,en
2022-02-21 14:16:11+00:00,19042993,"Hong Kong confirms more than 7,500 Covid-19 cases, vaccine pass to launch in days https://t.co/lkVuEMbNlS via @scmpnews",en
2022-02-21 14:15:15+00:00,236770150,Italy recommends fourth COVID-19 vaccine dose for immunocompromised https://t.co/5Jy2WAdW6S #Health https://t.co/eQQT8822Zi #news 106,en
2022-02-21 14:15:10+00:00,25562183,"South Africa's health department said on Monday that it was changing COVID-19 vaccination rules to try to increase uptake, as inoculations have slowed and the country has ample vaccine stocks. https://t.co/SEBlA94Us8",en
2022-02-21 14:14:53+00:00,608310777,Graph shows how much risk the Queen is at from COVID-19 given widespread reports she had 3 doses of vaccine https://t.co/QpnCASlNCg,en
2022-02-21 14:14:37+00:00,1339316246819594245,"World Health Organization approves the setting up of mRNA Covid-19 vaccine production centres in Egypt, Kenya, Nigeria, Senegal, South Africa and Tunisia. https://t.co/Jz5KjlvFUt https://t.co/xRbMRK5i3Y",en
2022-02-21 14:14:11+00:00,1447803086270050306,"AU-EU SUMMIT: Ramaphosa refuses to budge on TRIPS waiver for Covid-19 vaccine manufacturing https://t.co/8l9VoUaigOWhat's to Cyril Ramaphosa is that there is a STRONG REASON for such a seemingly negative behavior in the summit. If TRUTH be TOLD, COVID-19 was/is a RUSE and a",en
2022-02-21 14:13:37+00:00,950068358631837696,"@lukewestbooks @garrr_scallywag @feverdreamcabal @malc2021 @StephenPAdams @robbysoave ""How Do We Know the COVID-19 Vaccine Won’t Have Long-Term Side Effects?"" https://t.co/8ATUYenCpOWe already knowVaccines are safe and the AAP recommends children receive covid vaccines",en
2022-02-21 14:12:31+00:00,150246405,"Covid-19 vaccine boosters will be offered to all children aged 12-15-years, the Department of Health has said. https://t.co/BFcRCO88vn",en
2022-02-21 14:12:30+00:00,1120819174476062722,"“Fox News has been repeatedly inaccurate in its coverage of the Canadian “Freedom Convoy” protests against vaccine mandates, Covid-19 restrictions and Prime Minister Justin Trudeau.”Surprise!",en
2022-02-21 14:12:21+00:00,27402457,⚠️Vaccine Pass vaccination rules (including for those recovered COVID-19 patients) https://t.co/mJ0oYTZV1h,en
2022-02-21 14:12:16+00:00,1113747196099399680,"Biological E Limited's Corbevax vaccine, India's first indigenously developed Receptor Binding Domain (RBD) Protein sub-unit vaccine against #COVID-19, has received emergency use authorisation (EUA) from India's drug regulator for the 12 to 18-year age group: Biological E Limited",en
2022-02-21 14:11:56+00:00,223531999,The @CDSCO_INDIA_INF has granted emergency use authorisation to COVID-19 vaccine #CORBEVAX for 12-18 year age group.It is 🇮🇳's 1st indigenously developed Receptor Binding Domain Protein sub-unit vaccine against COVID-19.This will further strengthen our fight against #COVID19.,en
2022-02-21 14:11:18+00:00,1489311797341569026,@JAMBHQ really frustrating souls here in Makurdi that one must present the COVID-19 vaccine card. And @NCDCgov staff is busy here exploiting souls that they must pay 1k for the proof of card without even vaccinating you.Nigerian Corruption everywhere!,en
2022-02-21 14:11:02+00:00,6429252,"Potential for fourth Covid-19 vaccine dose is being 'very carefully monitored in real time,' Fauci says - CNN https://t.co/2AvBw7jF4W https://t.co/RjD6raVVOy",en
2022-02-21 14:10:50+00:00,623298279,"#HongKong confirms more than 7,500 new Covid-19 cases, vaccine pass to launch in days as residents urged to stay homehttps://t.co/CAYnw7c4bj https://t.co/2YhmNSaFJR",en
2022-02-21 14:10:44+00:00,1337807453384282113,"Covid-19 Live Updates: Mask Mandates, Vaccines and More https://t.co/MxYhw63v3z",en
2022-02-21 14:09:51+00:00,432697203,The @CDSCO_INDIA_INF has granted emergency use authorisation to COVID-19 vaccine #CORBEVAX for 12-18 year age group.It is 🇮🇳's 1st indigenously developed Receptor Binding Domain Protein sub-unit vaccine against COVID-19.This will further strengthen our fight against #COVID19.,en
2022-02-21 14:09:35+00:00,99953326,Over 548 million COVID-19 vaccine doses have been administered in the US. Click to see more from @KPMG_US Center for Healthcare Regulatory Insight. #KPMGHC #ATW360 https://t.co/RJmoGjBybu https://t.co/cHfbsFbFSH,en
2022-02-21 14:09:03+00:00,3875594838,#Democracy #Canada Ruby on Rails creator backpedals about Bitcoin: 'We need crypto': Ruby on Rails creator makes u-turn on Bitcoin due to Canada’s financial crackdown on COVID-19 vaccine protesters. https://t.co/XQzSFzsZpO  | https://t.co/vqHPEDx05k   | https://t.co/FHLhKCQA7o https://t.co/SalxlfwAuZ,en
2022-02-21 14:08:59+00:00,834079504226275328,Covid Vaccine: Panacea Biotec to manufacture Covid-19 vaccin https://t.co/lru96d8XJX,en
2022-02-21 14:08:24+00:00,133152120,"""The public is assured that all COVID-19 vaccines with an emergency use authorization from the Food and Drug Administration are proven to be safe and effective against COVID-19...""",en
2022-02-21 14:08:00+00:00,1028770525160660993,"Iran is returning about 820,000 doses of AstraZeneca COVID-19 vaccines donated to the country by Poland presumably because they were made in the United States.https://t.co/aBN68IJqPF",en
2022-02-21 14:07:19+00:00,787546010,"Covid-19 Live Updates: Mask Mandates, Vaccines and More - The New York Times https://t.co/rDBIescj2P #news #topstories #berkleybearnews",en
2022-02-21 14:07:15+00:00,359476138,"Should COVID-19 vaccines be mandatory?The Minister of Health, Jane Aceng has defended the Shs4M fine that GVT seeks to impose on individuals who decline mass vaccination, saying the move is intended to set punitive measures in order to protect vulnerable members in the community",en
2022-02-21 14:07:00+00:00,20790145,@SanRiiss @SaneMarchHare I've been exposed to covid-19.I tested slightly positive for Covid.I WASN'T SICK with Covid however.THAT'S how vaccines work.I was asymptomatic and I no longer tested positive two days afterwards.,en
2022-02-21 14:05:39+00:00,79251075,"Stupid people: ""it was never about stopping the spread, it was about not overwhelming the TikTok nurses!""Remember this?""their Covid-19 vaccine trial has been completed, showing the vaccine to prevent 95% of cases of the disease"" https://t.co/3Wrovosm4R",en
2022-02-21 14:05:04+00:00,2748891110,"Thank you, Bronson Vaccine Clinic staff, for all that you do to keep our community safe and healthy! Schedule your COVID-19 vaccine or booster online now: https://t.co/HjhCwbV51b https://t.co/9GjtfxxVJf",en
2022-02-21 14:05:00+00:00,43855487,Serum Institute of India has sought emergency use authorisation from India's drug regulator for its Covid-19 vaccine Covovax for the 12 to 17 year age group#SerumInstituteofIndia #Covovax #CoronavirusVaccination #Vaccines https://t.co/iEDam4K0i2,en
2022-02-21 14:04:03+00:00,1183264020708515840,India approves third COVID-19 vaccine for youngsters 12 and above - Newsworldpress @ https://t.co/gIjBzFQoQ9 https://t.co/XQa5ycGJSd,en
2022-02-21 14:04:01+00:00,87711816,"In low-income countries, fewer than 10% of people have received at least one dose of a COVID-19 vaccine. This compares with about 80% in high-income countries. https://t.co/88PO35w98D https://t.co/F60Z7lAZyR",en
2022-02-21 14:04:01+00:00,2353731720,"West Virginians ages 12 and older are eligible to receive a #COVID19 vaccine booster shot. By staying up to date on COVID-19 vaccination, including a booster, you protect yourself and loved ones. Find a vaccination location near you: https://t.co/cpLpDCfQKJ. https://t.co/HQWg0FxjY0",en
2022-02-21 14:03:56+00:00,260853848,"It’s normal to have questions about COVID-19 vaccines for children. If you have concerns, talk to a healthcare provider first. https://t.co/x1Z4swmOPt #CovidVaccine https://t.co/NJfHQCP7cR",en
2022-02-21 14:03:44+00:00,2549601438,"👉 Boost yourself and your bank account in the latest Covid trial.If you're aged 18-30 and have had two doses of Pfizer or Moderna vaccine but not had a booster yet, then you could take part in the COVID-19 vaccine booster study.Find all the details at https://t.co/Hl84kYrwkC https://t.co/VZULFOlk6P",en
2022-02-21 14:03:41+00:00,33933259,"Getting the COVID-19 vaccine?This is what you need to know before, during and after.  https://t.co/gcmnME2eOp",en
2022-02-21 14:03:31+00:00,2966254751,"Planning to tick the COVID-19 vaccine off your list this week? We have plenty of places for you to get your first, second or booster dose in Wolverhampton. Getting protected can significantly reduce the risk of hospitalisation if you catch the virus. #COVIDVaccine 💉 https://t.co/W2cpVupxXe",en
2022-02-21 14:03:19+00:00,1217242807,"@InJim @5dconsciousness @McNado1 The best way to take care of your immune system is to get the vaccine.In any event, good luck for the next time you get Covid-19.",en
2022-02-21 14:03:04+00:00,2567538421,Quick pit stop at our Manchester vaccine site to say hi to the team 🙌 Get a free COVID-19 vaccination/booster with no appointment and no insurance everyday from 12-7pm! Located at 840 Hooksett Rd.Find all of our free vaccination sites in NH here: https://t.co/9K12r3Y2yk https://t.co/PVxTcPiBkp,en
2022-02-21 14:02:34+00:00,787546010,FDA Delays Meeting On COVID-19 Vaccine For Children Under 5 To Review More Data https://t.co/MfJgSm5cvw #news #topstories #berkleybearnews,en
2022-02-21 14:02:33+00:00,425696495,"If you’re unvaccinated, you’re about 8 times more likely to be hospitalised with COVID-19 than if you’ve had both doses of the vaccine and the booster. 💉Get vaccinated now💉 https://t.co/OH6urFAsvC",en
2022-02-21 14:01:54+00:00,1068019538,It's not too late to get vaccinated. The COVID-19 vaccine is safe &amp; effective &amp; means you can keep living your life while protecting others. Visit https://t.co/8rWBPWBVvA to book an appointment or find your nearest drop-in clinic. #TakeItFromThem https://t.co/y5XRbRG5V1,en
2022-02-21 14:01:52+00:00,3088516882,"📣 New Podcast! ""Ghana, Rwanda, Senegal Partner BioNTech to Produce Vaccines"" on @Spreaker #africa_business_radio #african_countries #covid_19 #news #vaccine https://t.co/1e5PTcfVn0",en
2022-02-21 14:01:48+00:00,4857887712,Serum Institute seeks EUA for Covovax Covid-19 vaccine for 12-17 years age group https://t.co/lCPhZdm8BT,en
2022-02-21 14:01:38+00:00,1355347989821186058,"CDC Grant Program Spends $5,000 Per Shot to Convince Minorities to Get COVID-19 VaccineMeanwhile everybody else loses their jobs… 🧐🧐🧐🧐🧐🧐https://t.co/fNw79gr6pB",en
2022-02-21 14:00:58+00:00,835836298996887552,"CDC Grant Program Spends $5,000 Per Shot to Convince Minorities to Get COVID-19 Vaccine https://t.co/mSisW4pM34 Download our app to read more at https://t.co/xMe0ayhB67",en
2022-02-21 14:00:19+00:00,17158205,You've got virus and vaccine questions - we've got an expert. Join us on Tuesday afternoon for a COVID-19 Q&amp;A with Dr. Nicholas Turner from Duke University. You must register at https://t.co/ouL83zikr9 to take part in this exclusive opportunity. https://t.co/v9KPEmYDQ7,en
2022-02-21 14:00:03+00:00,329751703,"WCCHD offers walk-in COVID-19 vaccines, COVID-19 boosters, and free flu shots Tuesday from 9:00 a.m. – 12:00 p.m. and 1:00 - 5:00 p.m. at the Taylor Public Health Center. Pfizer (5+), and Moderna are available. Taylor Public Health Center: 115 W 6th St. Taylor, TX 76574 https://t.co/szXtHcMKFF",en
2022-02-21 14:00:02+00:00,1429674999766347777,"How the COVID-19 Vaccine WorksWhen you are immunized with the COVID-19 vaccine, it teaches your immune systems how to recognize and fight the virus that causes COVID-19. It takes 2 weeks for the vaccine to build immunity against the virus.#Houston #Sugarland #FreeDelivery https://t.co/D1jh2u9iLJ",en
2022-02-21 14:00:02+00:00,15781769,"COVID-19 outbreaks are especially severe in @ICEgov detention centers, and yet ICE is denying mRNA vaccine boosters to detained people . Sign the letter asking them to provide boosters to all eligible detainees: https://t.co/Jr6SvjqzqU",en
2022-02-21 14:00:02+00:00,245777874,Covid-19 booster vaccines have been approved for children aged between 12 and 15.https://t.co/jkkuRBtvDv,en
2022-02-21 14:00:01+00:00,551083552,"In our COVID-19 vaccination clinic:✅ Vaccines are available for all people 5 and older ✅ All brands and doses are available✅ All shots are free, no insurance or ID needed✅ No appointment is neededVisit us to take your shot Monday-Friday! https://t.co/hjH6NVtZRh https://t.co/DxXCAiVOG9",en
2022-02-21 14:00:01+00:00,1331842589780185089,"PM Skerrit thanks Govt of Mexico, as it donates COVID-19 vaccines to Dominicahttps://t.co/JaXuviYg3g@SkerritR #covid19 #vaccine #covid19vaccine #AstraZeneca #dominica",en
2022-02-21 13:58:40+00:00,7619982,"The same people who oppose the COVID-19 vaccine – proven safe and already used by billions of people –because ""I don't know what's in it,"" have no problem lining up to download Trump's ""Truth Social"" app, and you can just imagine what's in there.",en
2022-02-21 13:58:19+00:00,1405398376229842946,"CDC Grant Program Spends $5,000 Per Shot to Convince Minorities to Get COVID-19 Vaccinehttps://t.co/DKC03EwE9f",en
2022-02-21 13:58:00+00:00,69298376,"If you're 16 and over, you can book your booster vaccine at a day and time that suits you on our website. You can book 3 months after your last vaccine. If you've had COVID-19 since you were vaccinated, please wait at least 3 months.#ForUsAll | https://t.co/7IXh3bwZkx https://t.co/Qk861p10Dg",en
2022-02-21 13:57:52+00:00,225307321,Just commented on @thejournal_ie: Covid-19 vaccine booster to be offered to all children and young people aged 12- - https://t.co/w6kmhrrv0p,en
2022-02-21 13:57:41+00:00,18639442,'Unbecoming and nonsensical': Doctor reacts to Eric Trump's Covid-19 vaccine claimshttps://t.co/9Q3Y4NRNAC,en
2022-02-21 13:57:30+00:00,1392751646979940354,COVID-19 Vaccine &amp; Infertility https://t.co/BMUlrQY8js,en
2022-02-21 13:57:10+00:00,84142850,💉 Youth Aged 12 - 17 Are Now Eligible For Booster COVID-19 Vaccines 👉 https://t.co/gt13PfgoaT 💉 https://t.co/Y06pbyfKkD,en
2022-02-21 13:56:46+00:00,19658826,Today’s covid-19 news:· Australia opens borders to vaccinated travellers· Boris Johnson to announce England’s “living with covid” plan later today· New Zealand plans to lift vaccine mandates https://t.co/Jubp7Ra7cB,en
2022-02-21 13:56:42+00:00,949014508089020416,"@RoccoLovesYou @LauraFurniss Covid 19 can lead to Myocarditis. Furthermore, the rate of reports of Myocarditis post C19 vaccine, is lower than that in other environments. We've had a problem with cardiac health for years. The antivax mob only pretend to care about it for political reasons.",en
2022-02-21 13:55:04+00:00,38400130,India approves third COVID-19 vaccine for children 12 and above https://t.co/igsr6KCZ1n https://t.co/zmYPAzzlN7,en
2022-02-21 13:55:00+00:00,15589496,"{ incontrovertible fact } ""As of February 2022, COVID-19 vaccines are neither safe nor effective.""#ArrestFauci https://t.co/bvDMbr5jg5",en
2022-02-21 13:53:58+00:00,967017170524717056,Covid 19: Biological E’s Corbevax vaccine gets emergency use approval for 12 to 18 age group https://t.co/izCJH5tF4A,en
2022-02-21 13:53:43+00:00,2527973556,@DrJ56013122 does anybody know when data will be available to determine if the covid-19 vaccines are partly responsible for immunodeficiency and increased rates for herpesvirus and other opportunistic infections?,en
2022-02-21 13:53:35+00:00,1443202242450964483,"Last week, hundreds of motorists from all over France started off in a version of Canada’s 'Freedom Convoys' to protest against the country’s coronavirus mandates. The aim was to reach Paris and call for removal of COVID-19 vaccine pass mandate to travel https://t.co/zOheAQuJYF",en
2022-02-21 13:53:33+00:00,262711743,"""Even as a third of Michigan residents lack any vaccine protection against COVID-19, some Michiganders are now getting their fourth COVID inoculation."" https://t.co/EvLJUnyEKp",en
2022-02-21 13:53:17+00:00,817976607398731776,DCGI gives final approval to COVID-19 vaccine Corbevax for 12-18 year oldsRead @ANI Story | https://t.co/SVlBtrD7uT#Corbevax #CovidVaccine https://t.co/7DiP1tVkMc,en
2022-02-21 13:52:23+00:00,856511006457044993,"@nytchinese It seems the US could make every product in 1 second. So can the US make a super-vaccine to cure all the Covid-19 patient in a time? If your answer is no, the US can't, that means vaccine takes time, and your comment on this is false.",en
2022-02-21 13:51:51+00:00,1443202242450964483,"Police officers on horseback allegedly plowed through a crowd of Canadian protesters known as the ""Freedom Convoy"" as they continued to protest the government's COVID-19 restrictions and vaccine mandates in Ottawa. https://t.co/7GQPARDBVK",en
2022-02-21 13:51:03+00:00,1091862159162626048,@MollyJongFast Do you not see the difference between the MMR vaccine(or any other vaccine) and the Covid 19 vaccine? Honest question. Blanket labeling people anti vaxxers because they are apprehensive about this vaccine borderlines malicious if it’s not purely ignorant,en
2022-02-21 13:50:39+00:00,886216985251430400,The part of the Great Reset pertaining to COVID-19 was always about amplifying the divisions between people. To create a new religion around it. Its sacrament is the vaccine. Its Lord’s prayer is demonizing ivermectin and trusting the science. Its vestment is the mask.,en
2022-02-21 13:50:09+00:00,1229211434447515650,"Taxpayers funded toxic EU jabs propaganda! Enrich big pharma that  have lied, harmed, manipulated data &amp; hid facts, with corrupt CDC &amp; FDA which have done the same. “CDC Grant Program Spends $5,000 Per Shot to Convince Minorities to Get COVID-19 Vaccine”https://t.co/j2hAAXV1av",en
2022-02-21 13:50:02+00:00,1334918783316713477,"Free Covid-19 Testing, Vaccine &amp; Booster Clinic! No appointment necessary! #covid19 #testing #booster #vaccination #vaccinationclinic #westvirginia https://t.co/vdIyNnrCMp",en
2022-02-21 13:49:39+00:00,1333930276997660674,"Understanding Variants- COVID-19 is caused by a virus that is continually evolving, and new versions are predicted to emerge. Comment down below what drives you to act against Covid-19!#usa #northcarolina #covid #vaccine #VaxVan #COVID19 #Monday#covidvariant https://t.co/wrscrrchUk",en
2022-02-21 13:47:24+00:00,3094759706,Covid-19 Vaccines Were Deadly in Rare Cases. Governments Are Now Weighing Compensation. - WSJ https://t.co/tRySCxolqw,en
2022-02-21 13:47:04+00:00,44699893,REMINDER: Many COVID-19 Vaccine Clinics are closed today for Family Day. Clinics will re-open tomorrow. Clinic locations &amp; hours of operation: https://t.co/tbhJPeyptu https://t.co/Djav3mhdib,en
2022-02-21 13:46:44+00:00,4830499503,"Worcester has a 61 percent COVID-19 vaccine rate. Events during school break will aim to increase that number, especially in young people. https://t.co/ubRsGGXHuX",en
2022-02-21 13:46:37+00:00,1057753803943014401,"CDC Grant Program Spends $5,000 Per Shot to Convince Minorities to Get COVID-19 Vaccine https://t.co/QXZynR8jzV",en
2022-02-21 13:45:47+00:00,1415562093839872003,Serum Institute Of India Emergency Use Drug Regulator COVID-19 Vaccine Covovax 12 To 17 Year Age Group https://t.co/9qvFi7Iw9q,en
2022-02-21 13:45:40+00:00,1400382639886934020,"check this one ✅COVID-19 vaccine syringes to have trackers on the outsideRFID microchips, which will be on the outside of the syringe when a vaccine is ready, are meant to record when and where vaccinations take place.✅https://t.co/25VN8prQI1 via @WUSA9",en
2022-02-21 13:45:40+00:00,260277552,Having trouble reconciling the various Government regulations dealing with COVID-19? We summarise the latest obligations and requirements under the vaccine pass arrangement and other key COVID-related restrictions. https://t.co/KLYCDr7Ajz#Vaccine #Omicron #COVID19 #HongKong https://t.co/FAbbiNQEg9,en
2022-02-21 13:45:14+00:00,1179396972324802561,"a graph of daily new confirmed COVID-19 deaths in Germany, overlaid on a graph of daily vaccine doses (7-day rolling average). https://t.co/oI0go52ibh",en
2022-02-21 13:45:09+00:00,1247445958700331008,"India's third homegrown Covid-19 vaccine Corbevax ( two doses), is the third vaccine approved for use in children aged 12 and above in India after Zydus Cadila's DNA shot ZyCoV-D and Bharat Biotech's Covaxin.",en
2022-02-21 13:44:17+00:00,2152969818,Ivermectin . Am I understanding that this medicine for parasites is also a deterrent for Covid-19. pharmaceutical companies are wasting their time and money on a fix when we have 3 vaccines that work. Do they think the unvaccinated would rather put this poison in their bodies.,en
2022-02-21 13:43:11+00:00,2527973556,"At any age, if you a breathless and covid-19 positive seek medical attention immediately regardless of your vaccine status",en
2022-02-21 13:42:51+00:00,2814988704,".#COVID19 vaccines💉 are safe! They protect you, your family👨‍👩‍👧 &amp; community against severe illness caused by COVID-19. #Vaccineswork#393Helpline@usaidzimbabwe @echo_EU @MOHCCzim https://t.co/sYtIJzJmoq",en
2022-02-21 13:42:10+00:00,817066321305341952,"The yearly averages then look like this:2385 cases of stroke per year following COVID-19 vaccines3.5 cases of stroke per year following all FDA-approved vaccines combinedThat’s an astounding 68,043% increase in the cases of stroke following COVID-19 vaccines!",en
2022-02-21 13:41:14+00:00,1479704829224095746,Serum Institute of India seeks emergency use authorisation from India's drug regulator for its COVID-19 vaccine Covovax for 12 to 17 year age group,en
2022-02-21 13:40:34+00:00,245238118,"@anthonyzenkus “A growing body of evidence suggests that COVID-19 vaccines also reduce asymptomatic infection and transmission. Substantial reductions in SARS-CoV-2 infections will reduce overall levels of disease, therefore, SARS-CoV-2 virus transmission.”https://t.co/l6z4sjUojR via @CDCgov",en
2022-02-21 13:40:24+00:00,827025847412482049,"COVID-19 Vaccine: DCGI approves Corbevax, 12-18 year olds will get this vaccine#LatestNewshttps://t.co/hxx0BbrcpD",en
2022-02-21 13:40:23+00:00,1348353903306305543,"Covid-19 Live Updates: Mask Mandates, Vaccines and More https://t.co/3nvmezWwz4",en
2022-02-21 13:40:04+00:00,1377508445432115203,"The increased prevalence of the disease is a major factor driving the development of the #COVID19  vaccine, which will propel the global COVID-19 #Vaccine Market forward.Read More-https://t.co/h8JSyVaBpO@pfizer @moderna_tx https://t.co/6VeBeSsNm5",en
2022-02-21 13:40:00+00:00,65073830,"Check out this week’s #NYCTestandTrace #COVID19 testing sites #onStatenIsland. Testing is no cost to you. COVID-19 vaccines are available at select locations. Text ""COVID TEST"" to 855-48 for more info. Hours and locations: https://t.co/qjyyFp3hYa https://t.co/9SsJTx1C6l",en
2022-02-21 13:37:35+00:00,1445466312260554767,Federal Vaccine Program Hasn’t Helped Those Whose Lives Were Altered by COVID-19 Shothttps://t.co/ztCVLjHkyb,en
2022-02-21 13:37:06+00:00,1413415228394647556,"🤦CDC Grant Program Spends $5,000 Per Shot to Convince Minorities to Get COVID-19 Vaccine https://t.co/R7MRcPur7u Download our app to read more at https://t.co/qviEYC028k",en
2022-02-21 13:37:06+00:00,1189542419131457536,"Dr. Jonathan Reiner responds after Eric Trump, son of former President Donald Trump, said Covid-19 vaccines represent the ""stripping of freedoms"" in the US.https://t.co/iK7WeNg9DL###",en
