date,userid,tweet,lang
2022-08-26 23:59:42+00:00,1420875669702070273,"The British Government Has Begun Paying $140,000 for COVID-19 Vaccine Damage Victimshttps://t.co/7kye5AIC03Should come out of Fauci's bank account",en
2022-08-26 23:56:31+00:00,2398817712,"@SocietalCanary @reneecallier @WaitingOnBiden Considering that SCOTUS didn't consider COVID-19 a workplace threat when it overturned Biden's OSHA vaccine mandate in 2021 (still dealing with Delta), I'm very skeptical they would consider COVID today a national emergency to fit the bill's text.",en
2022-08-26 23:55:24+00:00,1381905890559680513,💥One 🐍company going after another 🐍company...🚨Moderna sues Pfizer and BioNTech over patents behind COVID-19 vaccine https://t.co/VgJ1RKad9H,en
2022-08-26 23:55:09+00:00,413119537,Moderna sues Pfizer/BioNTech for patent infringement over COVID-19 vaccine /via @globeandmail https://t.co/TDPWmmBH3Z,en
2022-08-26 23:54:25+00:00,2837064436,🔊 @AndrejPlenkovic @MichealMartinTD @Xavier_Bettel @sanchezcastejon @jacindaardern Thanks for supporting #VaccineEquity through COVID-19. Will you join #GlobalCitizenFestival and pledge funds to the @WHO mRNA Tech Hub to empower developing regions to produce their own vaccines?,en
2022-08-26 23:54:23+00:00,42195974,@DanAlbas @CanadianPM @PierrePoilievre @CPC_HQ We're also waiting on you and your party to denounce @LeslynLewis for comparing COVID-19 vaccines to Nazi atrocities!🤬#CdnPoli  #CPC #CPCNonsense#CPCldrhttps://t.co/eHWhxWLRE2,en
2022-08-26 23:52:04+00:00,1478389008,@rjriess1 @judyannaggie Wait until DC @MayorBowser is forced to pay millions to COVID-19 vaccine-damaged citizens bcz she forced them to get vaxxed. Then she’ll be thanking all those who didn’t.,en
2022-08-26 23:51:24+00:00,425937551,COVID-19 Vaccines and Informed Consent https://t.co/NRmMzj6YPQ,en
2022-08-26 23:51:21+00:00,1343696622710968320,"UK financial compensation for individuals and families who have been harmed by the COVID-19 vaccine, despite repeated claims by U.S. corporate media denying any negative health impacts of the vaccines created by their largest advertisers. https://t.co/qIMHiih10O",en
2022-08-26 23:51:08+00:00,50547284,@JacquieNlgirl They’re experts at fear-mongering about vaccines and ignoring the negative health consequences of Covid-19. 🤦🏻‍♂️,en
2022-08-26 23:50:14+00:00,1478225102072340481,🔊 @AndrejPlenkovic @MichealMartinTD @Xavier_Bettel @sanchezcastejon @jacindaardern Thanks for supporting #VaccineEquity through COVID-19. Will you join #GlobalCitizenFestival and pledge funds to the @WHO mRNA Tech Hub to empower developing regions to produce their own vaccines?,en
2022-08-26 23:50:00+00:00,85601740,"Michigan - Ypsilanti mutual aid event Pull Over Prevention works to decrease unnecessary traffic stopsFree car repairs, COVID-19 vaccines, and more will be provided at the Pull Over Prevention and Mutual Aid Fair on Sept. 10 https://t.co/vPlohVo3tW @TheEasternEcho https://t.co/4yUGzekyoD",en
2022-08-26 23:49:29+00:00,769772036336021504,Been waiting for this since 2021.moderna was first and it was apparent immediately that everyone else copied moderna.CNN: Moderna files patent infringement lawsuits against Pfizer and BioNTech over mRNA Covid-19 vaccines.https://t.co/NskO4yQU2Mvia @GoogleNews,en
2022-08-26 23:47:11+00:00,1502405481981042690,"Moderna sues Pfizer, BioNTech for patent infringement over COVID-19 vaccine https://t.co/wfzh2OdyZn",en
2022-08-26 23:46:32+00:00,16415533,"A mayoral candidate who spread misinformation and conspiracy theories about the Covid-19 vaccine also lied about having an Emmy, and said she helped a woman who had failed to conceive with IVF become pregnant through meditation. https://t.co/mUzM8pdYoR",en
2022-08-26 23:46:13+00:00,24238411,🔊 @AndrejPlenkovic @MichealMartinTD @Xavier_Bettel @sanchezcastejon @jacindaardern Thanks for supporting #VaccineEquity through COVID-19. Will you join #GlobalCitizenFestival and pledge funds to the @WHO mRNA Tech Hub to empower developing regions to produce their own vaccines?,en
2022-08-26 23:46:03+00:00,30048373,Widespread Claims Misrepresent Effectiveness of COVID-19 Vaccines https://t.co/4sarEBOoEG #DebunkingViralClaims https://t.co/lgJubLB4K9,en
2022-08-26 23:44:28+00:00,1506402571233103874,Moderna sues rival COVID-19 vaccine makers Pfizer and BioNTech https://t.co/UcU18KDmfg via @AJEnglish,en
2022-08-26 23:44:17+00:00,24207115,"@iLoveJaneAdams I was vacced as well and I still got COVID-19. It's not a vaccine, it's a super spreader. Apparently it is even dangerous to some people.",en
2022-08-26 23:44:02+00:00,1535810774664646657,@GovRonDuhSantis @tedcruz It's evil bc Covid-19 was created 2 destroy &amp; divide us &amp; that's what the left has always wanted!!..Those Covid-19 vaccines are evil..,en
2022-08-26 23:43:40+00:00,1559169282642165761,🔊 @AndrejPlenkovic @MichealMartinTD @Xavier_Bettel @sanchezcastejon @jacindaardern Thanks for supporting #VaccineEquity through COVID-19. Will you join #GlobalCitizenFestival and pledge funds to the @WHO mRNA Tech Hub to empower developing regions to produce their own vaccines?,en
2022-08-26 23:42:32+00:00,119973528,Pfizer 'surprised' by Moderna COVID-19 vaccine patent lawsuit - AOL https://t.co/cCschxULBN,en
2022-08-26 23:42:26+00:00,40057705,CDC backs use of Novavax COVID-19 vaccine for teens https://t.co/RqsFmw86RI,en
2022-08-26 23:41:58+00:00,15448383,"Moderna sued Pfizer and its German partner BioNTech for patent infringement in the development of the first COVID-19 vaccine approved in the United States, alleging they copied technology that Moderna developed years before the pandemic. | @Reuters https://t.co/IcvUEQvaUu",en
2022-08-26 23:41:15+00:00,200838452,Coronavirus Update: Moderna sues Pfizer/BioNTech for patent infringement over COVID-19 vaccine https://t.co/LTIVqhAfmA,en
2022-08-26 23:40:35+00:00,1328428962675109890,Moderna sues Pfizer for allegedly copying COVID-19 vaccine technology https://t.co/sDGK6d3Glb,en
2022-08-26 23:38:34+00:00,50547284,"It’s been well over a year since my first Covid-19 vaccine. I’m starting to think that I was duped and ripped off.I was promised DNA-changing mutant powers by anti-vaxxers and yet, here I sit, powerless.",en
2022-08-26 23:37:40+00:00,1296171665278349318,"@Rectitude2022 @Chrisbr63640791 Yes.""(READ) CDC allegedly failed to perform promised 'routine surveillance' of Covid-19 vaccine adverse events""1/2https://t.co/0KvIjCwcvl",en
2022-08-26 23:36:52+00:00,1519073833700888576,Pfizer/BioNTech ‘surprised’ by Moderna lawsuit alleging they copied their COVID-19 vaccine technology | Fortune https://t.co/TDebXe3yul,en
2022-08-26 23:36:43+00:00,1413243152,🔊 @AndrejPlenkovic @MichealMartinTD @Xavier_Bettel @sanchezcastejon @jacindaardern Thanks for supporting #VaccineEquity through COVID-19. Will you join #GlobalCitizenFestival and pledge funds to the @WHO mRNA Tech Hub to empower developing regions to produce their own vaccines?,en
2022-08-26 23:34:33+00:00,288349895,Barbados receives Pfizer COVID-19 vaccines for children 12 and under https://t.co/X8WHFNoKqp https://t.co/7MXbVEMVM2,en
2022-08-26 23:33:50+00:00,455395758,@ZackPea74015598 @VisentinMark @StaceyMonette27 @students4agency @WesternU @huronatwestern @KingsAtWestern We know the long term effects from vaccines that have been rigorously studied much better than the long term effects of COVID-19,en
2022-08-26 23:32:56+00:00,3015861954,"The British Government Has Begun Paying $140,000 for COVID-19 Vaccine Damage Victims. https://t.co/qAstuvmGgW THE GOVERNMENT SHOULD NOT PAY BECAUSE THAT IS THE PEOPLE PAYING … THE PHARMACY COMPANY SHOULD BE PAYING!",en
2022-08-26 23:32:50+00:00,29905232,"20220826: Tom Murphy AP: Moderna sues Pfizer over patents behind COVID-19 vaccine [""Pfizer spokesperson says the company is surprised by the lawsuit, given that their vaccine is based on proprietary technology developed by both BioNTech and Pfizer""",en
2022-08-26 23:32:09+00:00,101134636,@j_sato Beneficial non-specific effects of live vaccines against COVID-19 and other unrelated infections https://t.co/Tukb6Nae3L,en
2022-08-26 23:32:00+00:00,2488541,"COVID-19 vaccine maker Moderna is suing Pfizer and the German drugmaker BioNTech, accusing its main competitors of copying Moderna’s technology in order to make their own vaccine. https://t.co/ucn5S40M5V",en
2022-08-26 23:31:02+00:00,1500229806528634882,@bajanking43 @EmmaMacaleer @lifewithmyboys @Chusmama @smc429 @goRubenRuben @SenJohnKennedy Covid-19 vaccine deaths stir rage - The Observerhttps://t.co/nvloR0xr8l,en
2022-08-26 23:30:42+00:00,1095868856034197504,"I miss anthony fauci, covid 19 masks and vaccines tbhthat was a good time",en
2022-08-26 23:30:40+00:00,23326619,🔊 @AndrejPlenkovic @MichealMartinTD @Xavier_Bettel @sanchezcastejon @jacindaardern Thanks for supporting #VaccineEquity through COVID-19. Will you join #GlobalCitizenFestival and pledge funds to the @WHO mRNA Tech Hub to empower developing regions to produce their own vaccines?,en
2022-08-26 23:30:00+00:00,474464413,"“Moderna believes that Pfizer and BioNTech’s COVID-19 vaccine Comirnaty® infringes patents Moderna filed between 2010 and 2016.""https://t.co/VCGCACdQpz",en
2022-08-26 23:27:52+00:00,185115193,Moderna sues Pfizer and BioNTech over patents behind Covid-19 vaccine https://t.co/62ENCYzghG,en
2022-08-26 23:26:08+00:00,1327959146,@iLoveJaneAdams Since I got my COVID-19 vaccine I have the pain in my knee constantly.,en
2022-08-26 23:25:40+00:00,745747580210970624,Great!Moderna Slammed for 'Grotesque' Lawsuit Against Pfizer Over Covid-19 Vaccine Patentshttps://t.co/Pm4VA4bkN8 via @commondreams,en
2022-08-26 23:25:27+00:00,1428033841785081868,🔊 @AndrejPlenkovic @MichealMartinTD @Xavier_Bettel @sanchezcastejon @jacindaardern Thanks for supporting #VaccineEquity through COVID-19. Will you join #GlobalCitizenFestival and pledge funds to the @WHO mRNA Tech Hub to empower developing regions to produce their own vaccines?,en
2022-08-26 23:20:30+00:00,1691491086,"The British Government Has Begun Paying $140,000 for COVID-19 Vaccine Damage Victims. -- Which seems to be getting no coverage in the American media. Wonder why. https://t.co/mGlmxW2X2T",en
2022-08-26 23:19:35+00:00,1223615885140582402,Widespread Claims Misrepresent Effectiveness of COVID-19 Vaccines – https://t.co/K3FubxECai https://t.co/FLvQY7UbMT,en
2022-08-26 23:18:06+00:00,23113271,"Moderna suing Pfizer, BioNTech for patent infringement in development of COVID-19 vaccine | CBC News https://t.co/zRhZxVeyzD",en
2022-08-26 23:17:51+00:00,351084907,Moderna sues Pfizer/BioNTech for patent infringement over Covid-19 vaccine https://t.co/6YntKiFGHj,en
2022-08-26 23:17:41+00:00,1522129566567116800,Moderna sues Pfizer and BioNTech over Covid-19 vaccine patents (via @thejournal_ie) https://t.co/y9M4bbnYu3,en
2022-08-26 23:17:25+00:00,493130286,@iLoveJaneAdams I shouldn't have because I have post vaccine syndrome.  I will not take any more COVID 19 vaccines or boosters.,en
2022-08-26 23:16:06+00:00,1432880991799025665,Join the #VaxHou team this Saturday for the #NBOTB HBCU S.T.E.M. College Recruitment Fair! 🥳  There will be COVID-19 vaccines provided by the @houstonhealthdepartment! PLUS GIFT CARDS for every vaccine recipient at this event! 🤩 https://t.co/Iaaa63yld5,en
2022-08-26 23:16:03+00:00,14323759,Judge Matthew W. Brann refused to vindicate the opinion of a Geisinger employee that COVID-19 vaccines and tests are a hoax. https://t.co/1u7kNnkq90,en
2022-08-26 23:15:11+00:00,247351807,"The Most Common Questions About The Updated #COVID-19 #Vaccine, Answered https://t.co/BOUDGuoH4z via @HuffPost with #NFID Medical Director William Schaffner, MD #GetVaccinated https://t.co/HSvMUyUQCo",en
2022-08-26 23:13:04+00:00,1921599894,"Moderna’s Covid-19 vaccine patent suit points to different virus to make infringement case against Pfizer - MedCity News https://t.co/KFhabVwdhF, see more https://t.co/lcFzrpIlFv",en
2022-08-26 23:10:52+00:00,1145774135332802560,"NEW: COVID-19 vaccine data now include NYC children under 5 years old. Currently, 6% of this age group have received one dose of the COVID-19 vaccine, and 2% are fully vaccinated.To explore all COVID-19 data, including data on vaccinations, visit https://t.co/OfjiX1yofu. https://t.co/RsXetg23nv",en
2022-08-26 23:10:11+00:00,1457206457666240512,"@alexmeshkin Vaccines are not the answer. Many people refuse the shot. New mutant variants are formed every day! Only way to stop is to replace air filters on airplanes so Covid-19, Delta, Omicron only stay in Wuhan, India and Africa!Another variant coming from Africa from weak HIV infected!",en
2022-08-26 23:10:00+00:00,1297898104784654336,Read: Moderna files lawsuit against Pfizer over patent ‘covid-19 vaccine technology theft’ https://t.co/Pt2sfi5F9Z,en
2022-08-26 23:09:40+00:00,24827393,"@atRachelGilmore @CdnPressNews CORRECTION: Ontario COVID-19 Science FICTION Table. @DrFahadRazak says, ""the facts reflect that COVID is still here.""CORRECTION: The facts reflect that COVID vaccines are useless.",en
2022-08-26 23:08:57+00:00,3505013620,🔊 @AndrejPlenkovic @MichealMartinTD @Xavier_Bettel @sanchezcastejon @jacindaardern Thanks for supporting #VaccineEquity through COVID-19. Will you join #GlobalCitizenFestival and pledge funds to the @WHO mRNA Tech Hub to empower developing regions to produce their own vaccines?,en
2022-08-26 23:07:52+00:00,28824136,@moderna_tx Sues @pfizer and @BioNTech_Group Over Covid Vaccine Technology: Two lawsuits filed in Massachusetts and Germany claim the Pfizer-BioNTech Covid-19 vaccine violated Moderna’s mRNA patents.https://t.co/doaSTmuFNA via @RebeccaDRobbins et al,en
2022-08-26 23:06:22+00:00,462348811,🔊 @AndrejPlenkovic @MichealMartinTD @Xavier_Bettel @sanchezcastejon @jacindaardern Thanks for supporting #VaccineEquity through COVID-19. Will you join #GlobalCitizenFestival and pledge funds to the @WHO mRNA Tech Hub to empower developing regions to produce their own vaccines?,en
2022-08-26 23:05:06+00:00,22147610,"A monthly clinic seeking to provide equal access to COVID-19 vaccines, at-home tests and health screenings launched Friday in Mankato. https://t.co/JXLNl79Fsj",en
2022-08-26 23:05:00+00:00,263365424,"To Americans: Have you stopped talking to a person, or avoided a person, on account of a disagreement on any of these issues?National politics – 32%COVID-19 mandates &amp; vaccines – 30%Morality – 25%Religion – 24%Immigration – 22%State politics – 21%https://t.co/ljbz7TFWQE",en
2022-08-26 23:04:40+00:00,198789395,@stephenasmith @RealMikeWilbon  the CDC basically admitted that the vaccines don't prevent COVID-19. Do you think all the people who refused to take the vaccines are justified?,en
2022-08-26 23:04:37+00:00,707987761,Moderna said it is suing Pfizer and its German partner BioNTech for patent infringement linked to the development of the first Covid-19 vaccines.The US biotech company is alleging that mRNA technology it developed before the pandemic was copied. https://t.co/GbfIDRNIx7,en
2022-08-26 23:04:37+00:00,3207625312,VAERS Summary for COVID-19 Vaccines through 5/6/2022 https://t.co/0reNrK4wcT,en
2022-08-26 23:03:10+00:00,1365984327339814913,Two lawsuits filed in Massachusetts and Germany claim the Pfizer-BioNTech Covid-19 vaccine violated Moderna’s mRNA patents.  https://t.co/onVsVqy7jR,en
2022-08-26 23:03:09+00:00,451751944,Two lawsuits filed in Massachusetts and Germany claim the Pfizer-BioNTech Covid-19 vaccine violated Moderna’s mRNA patents.  https://t.co/1NkUDwBr3O,en
2022-08-26 23:02:57+00:00,1080972087047512064,“We present a rare case of chronic myelomonocytic leukemia after receiving the J&amp;J COVID-19 vaccine with the rare association of limited scleroderma.”https://t.co/nZBwqlrAGG,en
2022-08-26 23:01:59+00:00,4306496294,"There is a report from Japan.This is happening in real time in Japan. Japanese are bragging on Twitter about their fourth dose of the COVID-19 vaccine. At the workplace, you have to get the fourth vaccination and try to vaccinate the infant.https://t.co/VxTmn8QDh8",en
2022-08-26 23:01:11+00:00,1489814774410059782,another theatre script to distract the minds of the profane. 🎪🤹‍♀️🤹‍♂️🤡Moderna sues Pfizer over Covid-19 vaccine patents. 👇https://t.co/eI0zcMMJYe,en
2022-08-26 23:00:58+00:00,990802033,"SciCheck DigestAs the virus that causes COVID-19 has evolved, the vaccines have become less effective in preventing symptomatic infection while remaining highly effective in preventing severe disease and death. This shift has been misrepre https://t.co/qN6FaFklZM",en
2022-08-26 23:00:52+00:00,40778270,- 69.5% of people have had three doses of a COVID-19 vaccine**^- 82% of people aged 12-15 have had one dose of a COVID-19 vaccine*- 78.3% of people aged 12-15 have had two doses of a COVID-19 vaccine* - 49.5% of people aged 5-11 have had one dose of a COVID-19 vaccine*,en
2022-08-26 23:00:51+00:00,40778270,COVID-19 update – Saturday 27 August 2022In the 24-hour reporting period to 4pm yesterday: - 96.9% of people aged 16+ have had one dose of a COVID-19 vaccine*- 95.4% of people aged 16+ have had two doses of a COVID-19 vaccine* https://t.co/oshTqpj4Vw,en
2022-08-26 23:00:24+00:00,234947344,Guest post: What happened when we tried to get a paper claiming ‘billions of lives are potentially at risk’ from COVID-19 vaccines retracted.https://t.co/kpdXN5k16U https://t.co/WsnnSrXs5k,en
2022-08-26 23:00:18+00:00,58984122,Novavax Nuvaxovid™ COVID-19 Vaccine Granted Expanded Conditional Marketing Authorization in the United Kingdom for Use in Adolescents Aged 12 Through 17 (source: prnewswire) https://t.co/GAoUJGQQsr https://t.co/avAfEXvPiB,en
2022-08-26 23:00:10+00:00,30012029,"Covid-19 vaccine maker Moderna is suing Pfizer and the German drugmaker BioNTech, accusing its main competitors of copying Moderna's technology in order to make their own vaccine. https://t.co/rINam24kSM",en
2022-08-26 23:00:09+00:00,17308428,"Moderna is suing Pfizer and BioNTech, accusing the companies of infringing on Moderna’s patents when they partnered to develop their own COVID-19 vaccine. https://t.co/JEJejocfyk",en
2022-08-26 23:00:06+00:00,1116803891293827074,#Patent infringement #lawsuit over #COVID-19 #coronavirus #vaccine ... | #mRNA | #Moderna | #Pfizer | #BioNTech | #SARSCoV2 | #technology | Via @guardian https://t.co/MwSRH5tlus,en
2022-08-26 23:00:03+00:00,964958062686756869,"Moderna sues Pfizer for allegedly copying its COVID-19 vaccine to Trump, Descends Into Water At BMW Championship.",en
2022-08-26 23:00:00+00:00,21267976,"Join @NASW on September 29 for a free webinar to discuss new Covid-19 vaccines, updated booster formulations, living with a controlled (versus an urgent) pandemic, and more! Earn 1.5 CE from the comfort of your own home.Register:  https://t.co/gfXE3Dery5 https://t.co/gHxCgg6l4J",en
2022-08-26 23:00:00+00:00,16273831,Moderna Sues Pfizer Over Patents Behind COVID-19 Vaccinehttps://t.co/tWve6EG6t2,en
2022-08-26 22:58:42+00:00,1516004055318892545,"Moderna sues Pfizer, BioNTech for patent infringement over COVID-19 vaccine https://t.co/FuDHReMbRN",en
2022-08-26 22:58:03+00:00,16620002,"""Moderna suing Pfizer over patent for ‘foundational’ COVID-19 mRNA vaccine - National | https://t.co/XJTXBOLGOC"" https://t.co/SsfQakS3wI",en
2022-08-26 22:56:43+00:00,276445663,"Moderna is suing rival Covid-19 vaccine makers Pfizer and BioNTech, alleging their shot infringed on key patents involving mRNA technology https://t.co/2UOLHD6x6x",en
2022-08-26 22:56:17+00:00,16136540,"The war of the #vaccines    Moderna suing Pfizer, BioNTech for patent infringement in development of COVID-19 vaccine https://t.co/s9lTPJcCnF",en
2022-08-26 22:56:09+00:00,1474427296203292678,Trump has until September 24 to distance himself from the covid-19 vaccine. 🍻👍 https://t.co/llprvmJ1xU,en
2022-08-26 22:55:34+00:00,1180263306092781571,"@afrofairy1 Washington, D.C. students will now have until Jan 3, 2023 to get vaccinated against COVID-19 if they want to attend school. All other vaccines traditionally required stay?",en
2022-08-26 22:54:25+00:00,16285710,"Dr. Jerome Adams sat down with WISH-TV’s medical reporter, Dr. Mary Gillis. Adams weighed in on Dr. Fauci’s retirement, the new COVID-19 bivalent vaccine and the e coli outbreak in Indiana. Check out the conversation below @DrMaryGillis reports.https://t.co/aVyX8KnBXd",en
2022-08-26 22:54:10+00:00,1899275323,Moderna sues rival COVID-19 vaccine makers Pfizer and BioNTech https://t.co/520rFcA5fl via @AJEnglish,en
2022-08-26 22:53:11+00:00,1316595805546057728,"RT https://t.co/VzzXVgUV6i: https://t.co/NgR0AFNwtU - As the virus that causes COVID-19 has evolved, the vaccines have become less effective in preventing infection, but remain highly effective in preventing severe disease. https://t.co/Ka6ocgZeK7",en
2022-08-26 22:52:38+00:00,1874813442,Moderna sues Pfizer and BioNTech over patents behind COVID-19 vaccine https://t.co/R6Deg1ohFC,en
2022-08-26 22:51:10+00:00,1489747303078445066,Two lawsuits filed in Massachusetts and Germany claim the Pfizer-BioNTech Covid-19 vaccine violated Moderna’s mRNA patents.  https://t.co/io0tlLEYqB,en
2022-08-26 22:51:09+00:00,1365984327339814913,Two lawsuits filed in Massachusetts and Germany claim the Pfizer-BioNTech Covid-19 vaccine violated Moderna’s mRNA patents.  https://t.co/onVsVqPalR,en
2022-08-26 22:51:09+00:00,451751944,Two lawsuits filed in Massachusetts and Germany claim the Pfizer-BioNTech Covid-19 vaccine violated Moderna’s mRNA patents.  https://t.co/1NkUDwjhPG,en
2022-08-26 22:51:08+00:00,1302684144082747393,Two lawsuits filed in Massachusetts and Germany claim the Pfizer-BioNTech Covid-19 vaccine violated Moderna’s mRNA patents.  https://t.co/YxfMhUTKct,en
2022-08-26 22:50:22+00:00,17350034,Moderna Sues Pfizer and BioNTech Over Covid Vaccine Technology: Two lawsuits filed in Massachusetts and Germany claim the Pfizer-BioNTech Covid-19 vaccine violated Moderna’s mRNA patents. https://t.co/mZdjbPCpml https://t.co/dO95HBDHOd,en
2022-08-26 22:49:17+00:00,4491531140,What Jonas Salk's approach to the polio vaccine can teach us about the COVID-19 shothttps://t.co/PXBmByqexf,en
2022-08-26 22:48:59+00:00,1176994477,"Moderna is suing Pfizer and BioNTech for patent infringement over mRNA Covid-19 vaccines. Also, questions are arising about whether the anti-viral pill Paxlovid is an effective treatment for Covid-19 @elizcohencnn reports @EricaRHill https://t.co/jmRBDBYvWt",en
2022-08-26 22:47:07+00:00,8736882,Coronavirus Update: Moderna sues Pfizer/BioNTech for patent infringement over COVID-19 vaccine https://t.co/geVVEoFEM7,en
2022-08-26 22:47:03+00:00,4782164908,"The British Government Has Begun Paying $140,000 For Covid-19 Vaccine Damage Victims https://t.co/Y4lzGJlK8H #news #riskmap",en
2022-08-26 22:46:14+00:00,1528936343954685952,"【#G-Times NEWS】🔥 - AstraZeneca Announces Dropping the Vaccine Business 🔥 - On August 23rd, the CEO of pharmaceutical major AstraZeneca said that the company will not engage in the Covid-19 vaccine business in the long run.#CCPVIRUS#TakeDownTheCCP#CCP≠CHINESEa",en
2022-08-26 22:45:51+00:00,2632450275,"The British Government Has Begun Paying $140,000 for COVID-19 Vaccine Damage Victims. https://t.co/Rw1wTvxGgK",en
2022-08-26 22:45:12+00:00,1251981278,"As of 4pm today, Cambridge is reporting:25 newly reported COVID-19 cases.0 newly reported COVID-19 deaths.15.1 cases per 100,000 residents, 7-day moving average.90% of residents with at least one vaccine dose and 74% fully vaccinated.More at https://t.co/YgmNLKdgBK #CambMA https://t.co/t0oE9HWiSg",en
2022-08-26 22:45:06+00:00,493580137,Moderna Sues Pfizer Over Covid-19 Vaccine Patents https://t.co/GOe3gl8Mfm,en
2022-08-26 22:44:52+00:00,1233495541578895361,"Moderna suing Pfizer, BioNTech for patent infringement in development of COVID-19 vaccine https://t.co/3j7JPryKY8",en
2022-08-26 22:43:39+00:00,1105606035753091072,Petition: Remove indemnity from the manufacturers of covid-19 vaccines https://t.co/axcPXduxuC,en
2022-08-26 22:42:24+00:00,733680837959389184,"The British Government Has Begun Paying $140,000 for COVID-19 Vaccine Damage Victims. https://t.co/QQ7dZ3QemQ https://t.co/ypbz8oeg0M",en
2022-08-26 22:42:10+00:00,21344507,"As the virus that causes COVID-19 has evolved, the vaccines have become less effective in preventing infection, but remain highly effective in preventing severe disease. https://t.co/72zlB1vIam",en
2022-08-26 22:41:23+00:00,25939776,🔊 @AndrejPlenkovic @MichealMartinTD @Xavier_Bettel @sanchezcastejon @jacindaardern Thanks for supporting #VaccineEquity through COVID-19. Will you join #GlobalCitizenFestival and pledge funds to the @WHO mRNA Tech Hub to empower developing regions to produce their own vaccines?,en
2022-08-26 22:41:16+00:00,252165928,"DC mayor's 'no shots, no school' program postponed hours after separate COVID vaccine mandate struck down https://t.co/7aCsPJ1Dg8 #FoxNews Washington, D.C. students will now have until Jan 3, 2023 to get vaccinated against COVID-19 if they want to attend school.",en
2022-08-26 22:41:11+00:00,403331585,Today!!Novavax Nuvaxovid™ COVID-19 Vaccine Was Granted Expanded Conditional Marketing Authorization in the United Kingdom for Use in Adolescents Aged 12 Through 17,en
2022-08-26 22:41:09+00:00,361952040,Moderna sues Pfizer over patents behind COVID-19 vaccine https://t.co/Q7v0Ls2K0o via @WBUR,en
2022-08-26 22:40:20+00:00,1391394601,"@ztretchy @fyourbss 11-17-2020, the American Society of Gene &amp; Cell Therapy (ASGCT) announced “COVID-19 Vaccine Candidates Show Gene Therapy Is a Viable Strategy”.“These findings, announced by Moderna and Pfizer demonstrate GENE THERAPY is a viable strategy for developing vaccines to combat C19”.",en
