date,userid,tweet,lang
2022-06-29 09:47:19+00:00,1048070359482687488,"【論文】Gut microbiome, Vitamin D, ACE2 interactions are critical factors in immune-senescence and inflammaging: key for vaccine response and severity of COVID-19 infection　https://t.co/rEijDETrzT",en
2022-06-29 09:46:32+00:00,475719261,"📢If you haven't had your first, second or booster dose of the covid-19 vaccine it's never too late.  There are appointments and walk in clinics available all across Somerset now. Our friendly, specialist teams are looking forward to welcoming you.➡️ https://t.co/Jg0dclK4Yx https://t.co/T6hiou7ZJz",en
2022-06-29 09:46:30+00:00,1329093319,"MC Explains | GEMCOVAC-19, Indias first mRNA Covid-19 vaccine, and how it scores over Pfizer, Moderna... Read on JioNews https://t.co/Uzt62O1LRb",en
2022-06-29 09:46:30+00:00,27629414,"We’re adding new features to the NHS App as part of the government’s Plan for Digital Health and Social Care. From March 2023, you’ll be able to book Covid-19 vaccines, receive NHS reminders, and manage hospital appointments at participating trusts.https://t.co/yGwSKkTt2t https://t.co/9zEtucVObB",en
2022-06-29 09:45:54+00:00,1709439680,“Vaccines have been an important factor in the current decline of severe cases and deaths from COVID-19 that we now see today.” https://t.co/0pu4Fb6gR0,en
2022-06-29 09:44:54+00:00,549017081,"Sick forever: COVID-19 VACCINES cause severe inflammation, thus “targeting” and worsening pre-existing chronic health issues, diseases, disordershttps://t.co/4kvUhGpoWJ",en
2022-06-29 09:44:31+00:00,88394738,South Korea Approves First Homemade COVID-19 Vaccine https://t.co/JGVpWpIaCz,en
2022-06-29 09:44:20+00:00,1953001,‘Defining moment of our professional lives’ – behind the COVID-19 vaccine comms plan #pr #comms https://t.co/83tIGMrqF6 https://t.co/UhkO1dMsDs,en
2022-06-29 09:43:54+00:00,1523727427515686913,"Courtesy visit by the VHT(Village Health Teams/leaders)  and  creating COVID-19 vaccine Awareness  of the safety, effectiveness, and benefits of COVID-19 vaccination.#nakawa #VaccineSideEffects  #vaccine https://t.co/hcZ95OaY9y",en
2022-06-29 09:39:06+00:00,783214744463257600,▪ S. KOREA'S 1ST DOMESTIC COVID-19 VACCINES. Korea's first domestic COVID-19 vaccine approved by Ministry of Food and Drug Safety#COVID19 #SouthKorea #vaccineArirang News ▶ https://t.co/mVDEocNgm0News Center ▶ https://t.co/mZQ2egcQgF https://t.co/rUY2T2UBUn,en
2022-06-29 09:37:37+00:00,2375562552,The US FDA faces an important decision as to whether to instruct companies that make COVID-19 vaccines to update the viral strain or strains of SARS-CoV-2 those products targetRead more here: https://t.co/OnU6ELajJQ,en
2022-06-29 09:36:30+00:00,1287541639997792257,South Korea approves first home-made Covid-19 vaccine (Independent)Health officials in South Korea have approved the country's first domestically developed Cov...Add your highlights:https://t.co/e4scliCpDY #COVID19 #coronavirus,en
2022-06-29 09:35:50+00:00,632775011,DCGI approves India's maiden mRNA vaccine against COVID-19 - https://t.co/iARDuEJceyhttps://t.co/iARDuEJcey,en
2022-06-29 09:35:44+00:00,1418123708812562435,"💉 💉Childhood vaccine schedule 💉💉Based on what the Covid-19 vaccine has exposed, where do you now sit in regards to the standard vaccine schedule for babies/children?",en
2022-06-29 09:35:20+00:00,1287541639997792257,"South Korea Approves First Domestically Developed COVID-19 Vaccine (https://t.co/gkOlFTVvKn)SEOUL, South Korea  Health officials in South Korea on Wednesday approved the country's firs...Add your highlights:https://t.co/TlNmex4Srk #COVID19 #coronavirus",en
2022-06-29 09:35:17+00:00,2790816990,"South Korea Approves First Domestically Developed COVID-19 Vaccine (https://t.co/Oot8LGuXcK)SEOUL, South Korea  Health officials in South Korea on Wednesday approved the country's firs...Add your highlights:https://t.co/Fqbrw7LZRu #Wellness",en
2022-06-29 09:33:54+00:00,166539231,https://t.co/IY5CjVJhy1 Which COVID-19 vaccine type and timing are best during pregnancy?,en
2022-06-29 09:32:36+00:00,225187661,NEWS: #Uncategorized #COVID19 #overnight #wire South Korea Approves First Domestically Developed COVID-19 Vaccine https://t.co/Fa71oC1fCU Via @Time https://t.co/iQRQVSImMA,en
2022-06-29 09:30:38+00:00,1487113503483777030,South Korea Approves First Domestically Developed COVID-19 Vaccine https://t.co/ohQvWrU45Y,en
2022-06-29 09:30:14+00:00,21037096,"Health officials in South Korea on Wednesday approved the country's first domestically developed COVID-19 vaccine for people 18 years or older, adding another public health tool in the fight against a prolonged pandemic.   https://t.co/N1S2fww8s4",en
2022-06-29 09:30:10+00:00,138099943,"Health officials in South Korea on Wednesday approved the country's first domestically developed COVID-19 vaccine for people 18 years or older, adding another public health tool in the fight against a prolonged pandemic.  https://t.co/iBfj2qGraw",en
2022-06-29 09:30:00+00:00,179459971,Update COVID-19 vaccine to target omicron variants: Advisory panel to USFDADecision expected in July https://t.co/KKPXL4WW8T https://t.co/BPE5TduT6m,en
2022-06-29 09:30:00+00:00,15375209,"The rest of the 12 to 17 age group can get their first booster shot of Covid-19 vaccine starting on Thursday, June 30, an official of the Department of Health (DOH) said.https://t.co/ELusO3p5jX",en
2022-06-29 09:29:46+00:00,1363792261562130434,"ICYMI on monday, please take a minute or two of your time to fill in this survey on COVID-19 vaccines. https://t.co/Wtwd1UvDQn",en
2022-06-29 09:24:09+00:00,1510944533567188992,"NEW - Sesame Street's Elmo now advertises mRNA injections against COVID for young kids under 5 in the United States.""It's okay to have questions about COVID-19 vaccines for children! Elmo's dad Louie talked to their pediatrician, and learned that Elmo getting vaccinated",en
2022-06-29 09:24:03+00:00,208056970,"HKNR — China-manufactured vaccines turn out ineffective amid rising COVID-19 cases: A study by the University of Hong Kong has lowered the Chinese vaccines' effectiveness further, limiting it to just 60 per cent.  View article... https://t.co/NJWxii0RAa",en
2022-06-29 09:23:59+00:00,1562877217,"You can still get your 1st, 2nd or booster COVID-19 vaccine by:📅 Booking an appointment online or by calling 119🚶‍♀️ Visiting a vaccination clinic in #Walsall where you can walk in without an appointmentFor more information, visit the NHS website:https://t.co/WxHblT8mZc https://t.co/wFWpjXw5Nd",en
2022-06-29 09:23:52+00:00,997769632361730049,"With life almost completely back to normal… Are you glad you got the Covid-19 vaccine, or do you regret it? Share your views by completing this short survey: https://t.co/ZPYZkMCNiR",en
2022-06-29 09:23:51+00:00,1084632780774944768,This is just blatantly criminal.  There are no rules it appears as the laws fail to be enforced and big pharma show they control everything.No Safety Data to Back CDC’s Recommendation on Co-administering COVID-19 Injections and Other Vaccines in Children https://t.co/XawamI4MZc,en
2022-06-29 09:23:26+00:00,68927629,"#MCExplains: With the DCGI’s approval, GEMCOVAC-19 becomes the first indigenous mRNA Covid-19 vaccine to be available in India.Take a look at the key features of GEMCOVAC-19 👇https://t.co/w6c7nSQ1LHby Ayushman Kumar | #GEMCOVAC19 #Covid19vaccine #DCGI #India https://t.co/aFwOslCL2A",en
2022-06-29 09:22:08+00:00,15761637,South Korea approves first home-made Covid-19 vaccine https://t.co/oOPpHcJbJD,en
2022-06-29 09:18:41+00:00,17084854,Coming off methotrexate doubles antibody levels after covid-19 vaccine https://t.co/C8YLLGnMY0,en
2022-06-29 09:18:11+00:00,1147928910,"Famed Covid-19 vaccine maker Moderna is set to open a vaccine research and manufacturing centre in the UK, in a £1bn investment. #Investment #Vaccine #Research https://t.co/f6Wvk4eAvX https://t.co/aQhro5MdCO",en
2022-06-29 09:13:44+00:00,7417202,"A ""bivalent"" Covid-19 booster seems like a no-brainer, but it's not. 1) Including most recent variants slows time to market. 2) No data yet that bivalent better than today's boosters. 3) Will people stop believing current vaccines are effective? They are!https://t.co/c4NmkoPtJr",en
2022-06-29 09:11:44+00:00,1474502390740971520,"68.42% of Victorians 16+ have had three doses of a COVID-19 vaccine.91.72% of Victorians 5+ have had one dose, 89.03% have had two doses.56.54% of Victorians aged 5-11 have had one dose, 40.46% are fully vaccinated.",en
2022-06-29 09:11:30+00:00,2821017554,South Korea approves use of 1st homegrown COVID-19 vaccine Get the latest news on Telegram: https://t.co/VkWFQJhAxZhttps://t.co/R4BfnOtpRO,en
2022-06-29 09:11:28+00:00,17084854,Model predicts effectiveness of COVID-19 vaccines against circulating SARS-CoV-2 variants https://t.co/f4tNsZmLUw,en
2022-06-29 09:08:26+00:00,270901021,"Demands for compulsory Covid-19 vaccination not backed by Science: UHONo scientific evidence to suggest that vaccines prevent transmission, adverse impact or death, claims a body of public health experts who advocate a public debate on the issuehttps://t.co/74Nv32ZxNf",en
2022-06-29 09:06:22+00:00,941675887,"@JohnB_Aberdeen @princessjack @WoodG252000 @LucyGoBag Nobody doubts that vaccines have very rare side effects. But Covid-19 causes vaccine-preventable disease, hospitalization, MIS-C, Long Covid and death, including in kids. IMHO the very large benefits outweigh the small risks, including in kids.",en
2022-06-29 09:04:22+00:00,1431333740685545478,"COVID nonsense continues @Jonathan_Witt ""ticket holders for shows...on campus will need to show either a vaccine certificate, a negative rapid test no more than 72 hours old, or a certificate that states you have had COVID-19 in the last three months.""https://t.co/X0Hb8hVW03",en
2022-06-29 09:02:03+00:00,623938271,South Korea Approves First Domestically Developed COVID-19 Vaccine https://t.co/50raXiCr8H,en
2022-06-29 09:02:00+00:00,1485145310313828354,Sesame Street character Elmo got his COVID-19 vaccine in a public service announcement now that children under age 5 are eligible for the shot. https://t.co/NtoYihPIeh,en
2022-06-29 09:02:00+00:00,14408705,Sesame Street character Elmo got his COVID-19 vaccine in a public service announcement now that children under age 5 are eligible for the shot. https://t.co/g8RKAcKJlJ,en
2022-06-29 09:01:55+00:00,1076057537252900864,Masks off but Covid-19 is still in the air. Long overdue or too soon? 😷 Share your views about the Covid-19 and the Covid-19 vaccine by filling in the following survey : https://t.co/05P11Yd1m0https://t.co/05P11Yd1m0,en
2022-06-29 09:01:44+00:00,1419213050356256768,South Korea approves first homemade Covid-19 vaccine https://t.co/uoSvILdHL8,en
2022-06-29 09:01:23+00:00,15761637,"Paschal Donohoe said face masks have contributed to the national effort to contain Covid-19, but appealed to people to get a booster vaccine if they had not already. https://t.co/MSSrWTdbRY",en
2022-06-29 09:01:15+00:00,1266211555558875137,"CDC recommends COVID-19 vaccines for everyone 6 months and older. Getting vaccinated can help protect you from severe disease, hospitalization, and death from COVID-19.Find a vaccine near you: https://t.co/vqoNuI6oNO #hellobaby  #hbs #hellobabysurrogate #surrogacy https://t.co/EoEegT0393",en
2022-06-29 09:00:24+00:00,795509594,"Ochieng said that the project also entails the establishment of smart vaccine production, making Kenya one of the centres for vaccine production in Africa. “This will address the vaccine challenges which were evident with the Covid-19 pandemic,” said Ochieng.",en
2022-06-29 09:00:07+00:00,242241907,"There is a minimum time that you should wait after a positive test or your first COVID-19 symptoms, or since your last dose of the vaccine, before coming forward. Find out more at https://t.co/StFCxqAQo2 ◀️#NHSGGC https://t.co/WRqLdNgjkC",en
2022-06-29 09:00:05+00:00,23489273,"COVID-19 in the U.S. is definitely not what it once was, but there are still changes in vaccines, and research is still not fully understood.  https://t.co/R2lZk3xUAM",en
2022-06-29 08:58:44+00:00,2484673278,South Korea approves first homemade COVID-19 vaccinehttps://t.co/8PDyYagRU6,en
2022-06-29 08:58:36+00:00,2548327358,"""COVID-19 vaccination has substantially altered the course of the pandemic, saving tens of millions of lives globally. However, inadequate access to vaccines in low-income countries has reinforced the need for global vaccine equity and coverage."" https://t.co/0Ll0FaJAfu",en
2022-06-29 08:58:05+00:00,1057538984,"They stood accused of making posts on the business’ Facebook and Instagram accounts between February 9 and 17 calling on the public to boycott the Covid-19 vaccine, therefore making the government’s anti-epidemic work more difficult.",en
2022-06-29 08:57:51+00:00,1392027840493748224,"Covid-19 News Story that Has Me Concerned about More than the Virus | by Justiss Goode | Jun, 2021 | Medium - via @pensignal  Read this story https://t.co/Va1QJUme8P about how one #teenager struggled to go against his parents wishes about getting the #covid #vaccine this year.",en
2022-06-29 08:56:16+00:00,150405477,"@Ssabbasi9 @DThucydides So yes, it is you who can't do simple maths and analysis of data. ADB, WB, etc. provide funding every year, COVID-19 or no COVID-19. The amount earmarked for COVID-19 assistances is not ONLY for vaccines but fighting the impact of COVID-19 locally, be it for health sector or",en
2022-06-29 08:55:29+00:00,1394202783503421441,South Korea approves country's first domestically developed COVID-19 vaccine #SouthKorea #Covid19 #Vaccination https://t.co/777nlRzG9y https://t.co/afkSA4OVGy,en
2022-06-29 08:55:22+00:00,111556701,Sesame Street character Elmo is given COVID-19 vaccine shot in PSA urging parents to have children vaccinated https://t.co/4jmpH2ZpIK,en
2022-06-29 08:55:05+00:00,55060090,South Korea Approves First Domestically Developed COVID-19 Vaccine https://t.co/iUp2Db99XT,en
2022-06-29 08:54:12+00:00,1359068448,The COVID-19 vaccines offer the best protection against coronavirus which can be serious in later pregnancy for some women.For more information visit: https://t.co/4rhTHfeaub https://t.co/TtyXY0XyCv,en
2022-06-29 08:53:53+00:00,839848894670356480,South Korea approves first homemade Covid-19 vaccine - Hindustan Timeshttps://t.co/mZ2jWugeH4#WorldNews#Share_if_you_agree https://t.co/VDMZEYYpkx,en
2022-06-29 08:52:52+00:00,1399814811286917120,Study says COVID-19 vaccines do not prevent reinfection https://t.co/RuT64ajdsi,en
2022-06-29 08:52:51+00:00,1522741471635456005,Study says COVID-19 vaccines do not prevent reinfection https://t.co/BTx95TJPm9,en
2022-06-29 08:52:44+00:00,1192478123872473091,"COVID-19To overcome COVID-19, the G7 reaffirmed its “commitment to enabling equitable global access to and delivery of safe, effective, quality-assured and affordable vaccines, therapeutics, diagnostics, and other essential medical goods”.Gender equality.#MediaScapeNews #G7",en
2022-06-29 08:50:53+00:00,931368170333409280,South Korea approves first domestically developed COVID-19 vaccine ⚠️⚠️⚠️ https://t.co/uTvGQ2YPEy,en
2022-06-29 08:49:51+00:00,1368837350118236162,@MoHFW_INDIA  #COVIDFor some reason till now we have not taken the second dose of covid 19 vaccine yet our certificate is showing complete with both the doses how is it possible?!,en
2022-06-29 08:49:19+00:00,958451994242572289,NOW PLAYING: Ad Council &amp; NAB - COVID-19 Vaccine PSA 6 - English (15sec). See the last 10 songs we played and listen 24/7 at https://t.co/TkjqT5omHb. #collegeradio #ccri,en
2022-06-29 08:49:11+00:00,937962626222497793,South Korea approves first homemade COVID-19 vaccine https://t.co/4IB6K6fjAT  #southkorea #COVID19 #china #covidー19 #healthinformationsystem #Wuhan #health #covid19response #covid19pandemic #WHO #healthcare #vaccine #homemade #CovidVaccine,en
2022-06-29 08:48:51+00:00,1430959855649665027,Gov. Lee Orders COVID-19 Vaccine Mandate for Tennessee State Guard Despite Force’s Non-Federal Funding and Role https://t.co/agtZQpRIh1 via @ArizonaSunTimes.   Don’t give in. Why is our Governor allowing this? We can’t even get recruits now do to wokeness,en
2022-06-29 08:47:52+00:00,1363197453038735360,"Everyone has the right to freedom of expression, and with us your opinion matters so tell us what you think about the covid 19 vaccine by participating in this surveyhttps://t.co/fp69qFRGZA",en
2022-06-29 08:47:47+00:00,419111219,"Some important questions remain after the recent authorizations of two COVID-19 vaccines for infants, toddlers, and young children through 5 years of age.https://t.co/iPkmnDVmXk https://t.co/gvtber45hT",en
2022-06-29 08:47:43+00:00,799644743768502272,"@Cram68597546 @crikkit64 @RmFanDetective @7NewsPerth Mycoarditis is definitely a well documented risk of the vaccine (and covid-19, not that you hear much about that). It's a sad outcome for this family. But the risk was and is definitely real. Some people will experience the rare side effects. As with all medications.",en
2022-06-29 08:47:41+00:00,1504254117702602753,South Korea Approves First Domestically Developed COVID-19 Vaccine https://t.co/MnelSrqILQ,en
2022-06-29 08:46:57+00:00,1338151970603999233,Please fill this Survey to share your views and opinions about the Covid 19 vaccine ♥️ https://t.co/EC8KxQ6Z2v,en
2022-06-29 08:46:23+00:00,1376899376761565184,South Korea Approves First Domestically Developed COVID-19 Vaccine https://t.co/u7zxTjtTk6,en
2022-06-29 08:45:25+00:00,1462040002972454915,South Korea approves first do-it-yourself Covid-19 vaccine | World Informationhttps://t.co/aNT3yHxaqy,en
2022-06-29 08:42:53+00:00,1530950986289774592,@AnneliesdeZeeuw @GorkumPascal @mkeulemans @MarionKoopmans 17/2/22 - ‘The unnaturalistic fallacy: COVID-19 vaccinemandates should not discriminate againstnatural immunity’ https://t.co/V8dlbjOBs4,en
2022-06-29 08:42:17+00:00,203123011,South Korea approves first homemade COVID-19 vaccine https://t.co/J8QHHOnFdH,en
2022-06-29 08:41:53+00:00,1465424808,Are you you for Covid-19’s Vaccines 💉 or you against them? Share your views on this survey: https://t.co/j65pkuAdlG,en
2022-06-29 08:40:01+00:00,1529817976022499329,South Korea approves first domestically developed COVID-19 vaccinehttps://t.co/bk4WbhiE5T,en
2022-06-29 08:39:57+00:00,43585028,Another fab study by @maddyarden @CeBSAP on co-producing and testing messages to promote COVID-19 vaccine uptake in young people of Pakistani heritage in Bradford.. great to see such practical research being done alongside #publichealth teams! 👏👏#DHPConf @divhealthpsych https://t.co/HXDGDwihgP,en
2022-06-29 08:38:48+00:00,1878462302,Africa: 1 Million People in Conflict-Affected Regions Receive Two Doses of the Covid-19 Vaccine https://t.co/PaPSEsQI2P,en
2022-06-29 08:37:54+00:00,1338884647,"📅Tonight at 7pm!Do you have questions about the Covid-19 Spring Booster vaccine for people with a weakened immune system? Get them answered by Dr Oge and @drchrisgeorge on @NHSEnglandLDN Instagram Live!Follow them now, so you don't miss out! ➡️ https://t.co/TRb9sQgg8U https://t.co/FaaQ6AAq5R",en
2022-06-29 08:37:28+00:00,1901298962,South Korea has approved first domestically developed COVID-19 vaccine https://t.co/06LkNgcmQv,en
2022-06-29 08:36:44+00:00,43326045,"@MelisCattish The vaccine companies are working on NEW vaccines for covid-19. We need to get all of us - at least 98% of us - vaccinated against these NEW strains. Otherwise, we're all going to die from the new variants. Mandatory vacations! I mean vaccinations.https://t.co/DvwudVLVbF",en
2022-06-29 08:35:20+00:00,586831123,"@KBFsouls @seanjward You do realise though the reason the vaccines worked is because the virus got weaker, there is a different variant since covid 19 March 2020, its milder, thus the reason less hospitalisations and milder symptoms",en
2022-06-29 08:34:31+00:00,1321571336,South Korea approves first homemade COVID-19 vaccine - Lincoln Journal Star #fitness #trend https://t.co/IdavZHPRa1,en
2022-06-29 08:34:28+00:00,288121991,FDA Advisor Suggests COVID-19 Booster Vaccine for Fall https://t.co/cPNouCSmYe,en
2022-06-29 08:33:06+00:00,38400130,South Korea approves first domestically developed COVID-19 vaccine https://t.co/IgKwII9JjU https://t.co/SUhkHtFxy9,en
2022-06-29 08:33:00+00:00,14293310,South Korea approves first domestically developed COVID-19 vaccinehttps://t.co/m5RbMCJbYi,en
2022-06-29 08:32:43+00:00,36327407,"Health officials in South Korea approved the country's first domestically developed COVID-19 vaccine for people 18 years or older, adding another public health tool in the fight against a prolonged pandemichttps://t.co/6TH7cMaZD2",en
2022-06-29 08:32:35+00:00,1490057525001170948,South Korea approves first homemade COVID-19 vaccine https://t.co/ixsNfFYD78,en
2022-06-29 08:32:33+00:00,1468595202189578241,South Korea approves first home-made Covid-19 vaccine https://t.co/BvUadUHezY,en
2022-06-29 08:32:29+00:00,1482135646340796416,South Korea approves first homemade COVID-19 vaccine https://t.co/662LF5xBcK,en
2022-06-29 08:31:56+00:00,1527392322442371072,South Korea Approves First Domestically Developed COVID-19 Vaccine https://t.co/9UTT4Wi7MD,en
2022-06-29 08:31:22+00:00,1389198969197240326,State unable to find any country willing to take 4.5m unused Covid-19 vaccines – The Irish Times/but the taxpayer will still pay for them though 🤬🤬 https://t.co/jDvC9POEDy,en
2022-06-29 08:31:13+00:00,1224643780730445824,Gennova Biopharmaceuticals mRNA COVID-19 vaccine receives EUA from DCGI – ET HealthWorld https://t.co/ENaMQXkist,en
2022-06-29 08:31:12+00:00,43855487,"India's first indigenous mRNA vaccine Gemcovac-19 likely to be available soon, @sohinidastweets reports. #Gemcovac19 is only third mRNA vaccine to be approved for Covid-19 in the world. Read more. #mRNA #CovidVaccine #Vaccination #coronavirushttps://t.co/7Fjca3yDdI",en
2022-06-29 08:30:09+00:00,26548941,"If you’re thinking about having a baby, already pregnant or breastfeeding make sure you have your Covid-19 vaccine if you’re due a dose. It offers you &amp; your baby the best protection against the virusFor more info visit https://t.co/puFNQJGuw7… #MyBabyandMeLLR https://t.co/1uiKlg538A",en
2022-06-29 08:30:09+00:00,48331473,"If you’re thinking about having a baby, already pregnant or breastfeeding make sure you have your Covid-19 vaccine if you’re due a dose. It offers you &amp; your baby the best protection against the virusFor more info visit https://t.co/B0TPCMl1Gc… #MyBabyandMeLLR https://t.co/i6K7ALHHlM",en
2022-06-29 08:30:03+00:00,1919734885,"If you’re thinking about having a baby, already pregnant or breastfeeding make sure you have your Covid-19 vaccine if you’re due a dose. It offers you &amp; your baby the best protection against the virusFor more info visit https://t.co/G8k0MUNrz8… #MyBabyandMeLLR https://t.co/c036VA7UCE",en
2022-06-29 08:30:02+00:00,1647401204,More vaccine 'enabler' than IP waiver? Will the @wto's COVID-19 deal help developing countries or undermine the value of innovation? Sarah Speight investigates. https://t.co/K2aKGusBYt #waiver #covid19 #vaccine,en
2022-06-29 08:27:53+00:00,1368511599993094144,Another case of generalized bullous fixed drug eruption following an adenoviral vector-based COVID-19 vaccine (ChAdOx1 nCov-19)https://t.co/CAMYaVlBCb,en
2022-06-29 08:26:49+00:00,362952039,South Korea approves first homemade COVID-19 vaccine (from @AP) https://t.co/EWgFuE1xdU,en
2022-06-29 08:26:16+00:00,360024367,Gennova Biopharmaceuticals mRNA COVID-19 vaccine receives EUA from DCGI – ET HealthWorld https://t.co/XxuBBfYxXr,en
2022-06-29 08:24:58+00:00,4919856936,"To those waiting for replies, I’ve been struck down with COVID-19. I’m so grateful for the vaccines because I know I would be in a far worse state than I currently am! Please be patient and I’ll get back to you ASAP 💕",en
2022-06-29 08:22:52+00:00,1353397559809732608,"@mpc_xetts When you use the same measurement for the unvaccinated control group, the natural immune system has 99.2% efficacy in stopping Covid-19? But that’s higher than the efficacy of the vaccine. See the problem?",en
2022-06-29 08:22:43+00:00,1647798644,GLOBALink | China hands over additional 10 mln COVID-19 vaccine doses to #Ethiopia https://t.co/W88f6WZL9X,en
2022-06-29 08:22:40+00:00,2722533764,"Glad to present the fantastic resources created by @MAFfilmsforlife &amp; supported by the @TheBMA at @woncaeurope2022 Cocreation of accessible, digital resources with communities to address Covid-19 vaccine hesitancy 🔑 @RCGP_NELondon  #woncaeurope2022https://t.co/H6iz0cQeDB https://t.co/omZjR91NDW",en
2022-06-29 08:22:05+00:00,872362506630705153,Elmo gets his COVID-19 vaccine in new Sesame Street PSA https://t.co/WeXdDhjxQN,en
2022-06-29 08:17:37+00:00,1639176810,"Pat Lowie Gie Itchon conducted daily visitation and coordination to RHU staff in brgy Laang, Lagangilang, Abra regarding monitoring of update on Covid-19 cases in the Municipality, vaccines fraud, and other measures to lessen the spread of Covid-19 and its variants. https://t.co/OMmGGgc7kD",en
2022-06-29 08:17:04+00:00,19903360,South Korea approves first home-made Covid-19 vaccine https://t.co/tcTgaroRoe,en
2022-06-29 08:16:37+00:00,1639176810,Beware on Fake COVID-19 Vaccine https://t.co/MEUHLNazyq,en
2022-06-29 08:16:05+00:00,1497914780,@MLevitt_NP2013 Public Health has been hijacked by the vaccination industry. This has not happened overnight. SADS is clearly associated with the Covid-19 vaccines. Is the spate of potentially lethal adenovirus hepatitis just coincident with the incorporation of a chimp virus?,en
