date,userid,tweet,lang
2022-03-20 23:58:48+00:00,fb1dead8554cd0710b1df56b8a14d2fc,@FBIAntifa @othersteve @OAlexanderDK The strategic stockpile vaccine was approved in 2007. It CANNOT be given to many people due to contraindications and risks. The one that is not being stockpiled which is safer was approved in 2019. Both vaccines have been given to far fewer than the Covid-19 vaccines.,en
2022-03-20 23:58:10+00:00,86ade639579a96e8f9d2a22869e0f616748736d7c31d767e217d2b1b596f2c32,Moderna COVID-19 Vaccine for Children Approved https://t.co/W0Q2bNDJjD,en
2022-03-20 23:56:32+00:00,2510d22f8621cc644881fba608d68f34,Johnson &amp; Johnson's Covid-19 vaccine worked better than it gets credit for and may play an important role in the future - CNN - https://t.co/IspPmubq7O,en
2022-03-20 23:54:28+00:00,5de0083c52aae27da45b26209539cbc6,"Gravitas: Was Pfizer's Covid-19 vaccine trial ""compromised""? https://t.co/SUMbTLdt2S via @YouTube",en
2022-03-20 23:54:05+00:00,2d079c075831e68f3c9c08984edc2a72,"Over time, the Johnson&amp;Johnson Covid-19 vaccine has stronger protection against breakthrough infections than the mRNA vaccines.https://t.co/l4piwxKkec",en
2022-03-20 23:54:04+00:00,09b27ddbff4bd9105c07673c2187f9fc,Sorrento reports results with universal chimeric mRNA COVID-19 vaccine https://t.co/A4mf6XVYGV,en
2022-03-20 23:51:40+00:00,ad7b2a4131a046924e21498831652e7ba9f1a56e0acb1069736d34ea57bcfc70,"Days after receiving her COVID-19 vaccine, mother complained of headaches and died 17 hours after being admitted to hospital; her family expressed concerns about her treatment #NewsBreak  https://t.co/BBlshEadFw",en
2022-03-20 23:50:55+00:00,90014236aee67f146eb88462672e2191,"How COVID-19 Vaccines Save Lives, Even if Vaccinated People Get Sick https://t.co/egfYaOlN6k",en
2022-03-20 23:50:53+00:00,e1d33a2b4fb47b3704e0ff91b982f55a,"How COVID-19 Vaccines Save Lives, Even if Vaccinated People Get Sick https://t.co/Jw6CpvdbfK",en
2022-03-20 23:50:52+00:00,055ea9c71eb68930858c6195d3ee29e9,"How COVID-19 Vaccines Save Lives, Even if Vaccinated People Get Sick https://t.co/XuGkF9iFwB",en
2022-03-20 23:50:35+00:00,0cb14e28ed53825ea44225903b9c1acf4486eae99ee249ab587270a413fabbdd,"How can Canadian Colleges and Universities continue to uphold vaccine mandates?Answer: they have extreme liberal ideologies that are rooted in hate, intolerance and discrimination.End All College Covid-19 Vaccination Mandates ⋆ Brownstone Institute https://t.co/3oVx1llZ8y",en
2022-03-20 23:47:47+00:00,ff180f328121d4004bd2664a7a9142c81748d7a3a06c2c099fb19fd93698426a,Vaccine Hunters Canada launched with a mission to help Canadians find COVID-19 vaccine appointments.#canada #littleindiaapp #covid19 #covidvaccine #vaccinehunterscanada #vaccineappointments https://t.co/qVYAbwDRuR,en
2022-03-20 23:45:22+00:00,12b6d14cdbd5600dd34f36f7eff16052,@covid_parent Experiencing any of these common side effects shows that the vaccine is working ...runner up- The COVID-19 vaccines are undergoing the most intense safety monitoring of any vaccine in US history,en
2022-03-20 23:45:08+00:00,b743a0c45ee02f64a53b512c4697d72f,"White House Covid-19 funds are running out. Here’s what that means for treatments, tests and vaccines: https://t.co/Jx5qhqFXzf https://t.co/aycnTwcDSc",en
2022-03-20 23:44:18+00:00,40d5c75144eafa0e94f11662ea28baa6d21061e1756018b38e101fd959566190,PLEASE DONATE TO THIS IMPORTANT LEGAL CHALLENGELegal challenge to Covid-19 vaccine rollout to 5 million healthy 5 to 11-year-olds.  Brought by Children’s Covid Vaccines Advisory Group (CCVAG).   #TimeToPause #AllRisksNoBenefit @Togetherdec https://t.co/ZjQYxhZHpS,en
2022-03-20 23:43:39+00:00,e2d0288ff3c27bdb847651e0fcc05411,'Reassuring' data suggests the J&amp;J vaccine may still have a role to play against Covid-19https://t.co/75ysCPzqay,en
2022-03-20 23:43:22+00:00,543c54ba85b489800c8025b0623b5c5af6bdd3bba9746466c30f31257ce2a1af,Russia announces world’s first COVID-19 vaccine; Vladimir Putin's daughter gets first shot https://t.co/8kbXYLjH0N,en
2022-03-20 23:41:41+00:00,f65706f1c598d9a370826f51816d1c65,Dr. Mark Hobart - Australian Health Authorities on Notice - Withdraw COVID-19 Vaccines Immediately https://t.co/yzOzkvxrnC,en
2022-03-20 23:37:37+00:00,fe0133dc9cb83dcbd91b28009ac31f4e,@davidkurten So you have had the Johnson &amp; Johnson or AZ COVID-19 vaccine which is a vector vaccine?,en
2022-03-20 23:35:58+00:00,242e62fe3f7ef4082ba466c9a7dfe2e6,"@FionaMattatall Russians have been using the anti-vax movement as an ""active measure"" to cause disruption to western societies for decades. Anti-vaxxers  are susceptible to Russian propaganda. Russians have tried to disrupt confidence in the mRNA Covid-19 vaccines, which they do have produce.",en
2022-03-20 23:35:43+00:00,ff5a76a40a412610720903b43de864370750146f59895f8ad0dcecbfbad7e2e8,Can a vaccinated person pass spike proteins from a COVID-19 vaccine to an unvaccinated person via shedding? https://t.co/sPXmy1XGL8,en
2022-03-20 23:35:16+00:00,78cd8affc38ab46abb6bb409f67ccf6e,"A fourth dose of the Covid-19 vaccine is expected to be approved for use in Ireland, according to Tánaiste Leo Varadkar.Or is Leo leaking again? https://t.co/q8rAVRWSAv",en
2022-03-20 23:33:47+00:00,e69f3350947df59ae914a03b0d424eed,"RTStateDept: This week, the United States—in partnership with @gavi #COVAX and the African Vaccine Acquisition Trust—donated more than 2.7 million safe and effective COVID-19 vaccine doses to four countries in Sub-Saharan Africa. https://t.co/CY5zzesGf1",en
2022-03-20 23:31:25+00:00,520f735237a246785236735b249aae90d49b011cf741ab13cb64582df53c6244,Communism! US Army Announces First Separations Over COVID-19 Vaccine Refusalshttps://t.co/Cnj2U3KDog,en
2022-03-20 23:31:09+00:00,c127756ca2b9e693995f8b3747a72ea2230e8196c3f4e014ee7c1281de7de56c,Identification of Biomarkers New Treatments and Vaccines for COVID-19 1st ed. 2021 Edition PDF EBOOK EPUB https://t.co/TxtaUGLBax,en
2022-03-20 23:30:54+00:00,11d151a9b72f3ce4e0d71373439f5d8f51857d32d7f3bbba40f1a5df0540a36a,'Reassuring' data suggests the J&amp;J vaccine may still have a role to play against Covid-19https://t.co/sjIY9wcCVT,en
2022-03-20 23:30:50+00:00,ca2826241b94ae1d8341bb84ec830604,@Functionalsss Glad to enlighten you:COVID 19-vaccines are effective and can lower your risk of getting and spreading the virus that causes COVID-19. COVID-19 vaccines also help prevent serious illness and death in children and adults even if they do get COVID-19.,en
2022-03-20 23:30:22+00:00,4bd05b9c82a66f0b8579884d64877ef2,"@Rose_Brenn Anyone would do anything more if they got a sticker. 🤷🏻‍♀️ The most disappointing thing for me about getting the Covid-19 vaccine was that they didn't have stickers. Yes, I'm a grown woman.",en
2022-03-20 23:28:28+00:00,3592ee43035682d3ad5ed7ee374ec433b3cdc8104a42103f9c87f4c7e2a0c5e4,"mRNA Vaccines – Layman’s version (Pfizer/Moderna COVID-19 vaccines), plus some FAQs, Animation. https://t.co/9toQoLCQMg",en
2022-03-20 23:25:33+00:00,552d7c75636f6c96ec3879e2244a5acd9a4ed47a15e96d3f5d74eaae81f02182,'Reassuring' data suggests the J&amp;J vaccine may still have a role to play against Covid-19https://t.co/gFCjedoynY,en
2022-03-20 23:23:45+00:00,63e7055d37856e428a4886a9135522e3,'Reassuring' data suggests the J&amp;J vaccine may still have a role to play against Covid-19https://t.co/qSm0p6I9rh,en
2022-03-20 23:22:08+00:00,7022419255954df216ba444c1ad5dc36a1911246fd711d4971f4ff9a9e365382,"If we die within three weeks of testing positive for the Rona (nomatter what other factors wereinvolved), we will be counted as aCOVID-19 death. But if we drop dead within a day of taking the COVID-19 Vaccines, it has nothing to do with it. Isn’t funny?",en
2022-03-20 23:19:59+00:00,b18234de2801df035ae8e9780c1dfd27,'Reassuring' data suggests Johnson &amp; Johnson vaccine may still have a role to play against Covid-19 https://t.co/7olK8me9yx,en
2022-03-20 23:19:02+00:00,ffdada5310f5a1e1f7e35631d7b44e903a6636f74caf33b47343e4e221b354c1,US Army Announces First Separations Over COVID-19 Vaccine Refusals https://t.co/M47qBw1x6c,en
2022-03-20 23:14:34+00:00,b5aacaeb3fb5a0ce6b79e57da4c7f173,"@katieorourke78 @docstardust @carlsmythe @mcfunny @WendyOrent @SkepticalMutant @desertrosekathy @hippocritus @CoralBlob @_mamadeb @swedishchf @melissa94307909 @pete988007766 @Top_Muppetries @greenboat @Alaskacryptogi1 @TonyBaduy @JonInTn1 @FrankDElia7 @volpiranyas @TakethatCt @quigley_jesse @wendy_Lynnette @ghoppe @Kathmarval @AGoldsmithEsq @Monstercoyliar @AndrewLazarus4 @foofdawg @Mchael21592783M @stevenmosher @crabb_vicki @DCGreenZone1 @provaxtexan @infinitebritt @tenebra99 @i_am_joli_anne @LiamKav @clownworld_bobo @JustPlaying2Win @EstesPga @gobantwo2 @ZaynJaffer @JawKneeFaiv @MickusDickus @policing_uk @BrockKrause @dodi_rains @RenfieldThomas @TwitterSafety The vaccines do prevent covid-19 - just not completely. Except the first, none of these are examples of misinformation banned.And they're certainly not an excuse for your efforts to mislead people about covid-19 vaccines.",en
2022-03-20 23:14:16+00:00,49f2ef6d96682a02580781339ccbfce3a0a0b150e777820bcd7eb42602619ba9,'Reassuring' data suggests the J&amp;J vaccine may still have a role to play against Covid-19https://t.co/dImj4a91VV Now You Know. Ty for reading.,en
2022-03-20 23:13:42+00:00,c6f9bccb4bfc1844a984c6a2dbccb038,Here’s the latest on possible 4th COVID-19 vaccine shot for Americans https://t.co/ymU4O4Fo6r https://t.co/FMIKeyilCh,en
2022-03-20 23:13:41+00:00,f323110c382167350bfdcd851657a6e7,Here’s the latest on possible 4th COVID-19 vaccine shot for Americans https://t.co/a9myrKZoNv,en
2022-03-20 23:13:20+00:00,09b27ddbff4bd9105c07673c2187f9fc,"Sorrento reports results with universal chimeric mRNA COVID-19 vaccine https://t.co/tm9tKqUJau See the rest of the story here.https://t.co/tnMXlCjEqv provides the latest financial news as it breaks. Known as a leader in market intelligence, The Fly's real-time, streaming news…",en
2022-03-20 23:13:07+00:00,03f3b80bd33e613d4d21930d7fb574a116e25e4f09fa8d460afbbf545fcf313f,'Reassuring' data suggests the J&amp;J vaccine may still have a role to play against Covid-19https://t.co/c8vOcLaWHh,en
2022-03-20 23:12:59+00:00,9acb42e13160592d756e1747bd6050ba,Here’s the latest on possible 4th COVID-19 vaccine shot for Americans https://t.co/Z9AUHJDKEk,en
2022-03-20 23:11:17+00:00,5f874b421ea8c76c542317f1ad10dae9eef61d95f8c653dacf523015092c3b47,"@nathaliejacoby1 Covid 19 is no different to any other transmissible virus ever around us it was just made out to be dangerous,  I can get sick any day of the week from any other person, the fact is you got vaccine as you believe in it so why don't you trust it works.",en
2022-03-20 23:10:57+00:00,a38378695f77b3ba6fa2590352459a8b6043f5961f92ad22ef2ac1d266d313ef,"How COVID-19 Vaccines Save Lives, Even if Vaccinated People Get Sick https://t.co/gZsYcnaoJF",en
2022-03-20 23:10:36+00:00,546019412c807171d9612fe0faf02cc140c68a166134116d964e60bce4ff10d1,the Covid-19 vaccine ended up to be wrong choice for a 33-year-old Louisiana man who died late January after developing an autoimmune disease hours after receiving his second Covid-19 shot last year.https://t.co/Mj69ZQuReD,en
2022-03-20 23:07:36+00:00,3439bbccfee4387bad590602c7ba3539410e577447ec350790eae9001265aadf,"@ScienceWDrDoug Severe and fatal side effects of the COVID-19 vaccines are incredibly rare, with just 0.0003% of those having had a dose experiencing fatal effects.",en
2022-03-20 23:07:01+00:00,207353c7929bf362a18b26c8766eb41b6f9adb7e2f20c44c9a9f890951e3fc3d,News - Japan on Sunday pledged to offer Cambodia about $428 million in aid and 1.3 million doses of COVID-19 vaccines through the COVAX global vaccine-sharing programme.  #News #Today #BreakingNews #World,en
2022-03-20 23:05:36+00:00,a778f134a09a0d8cc2a280fd018bfa65,"How COVID-19 Vaccines Save Lives, Even if Vaccinated People Get Sick https://t.co/IblDvXO1Kh",en
2022-03-20 23:04:32+00:00,fd82c4452e3f837119d92a31117d959b8b2b94bc88445a933f33595e60d2cc3d,"How COVID-19 Vaccines Save Lives, Even if Vaccinated People Get Sickhttps://t.co/NroxfOq3wo",en
2022-03-20 23:04:00+00:00,a38378695f77b3ba6fa2590352459a8b6043f5961f92ad22ef2ac1d266d313ef,"How COVID-19 Vaccines Save Lives, Even if Vaccinated People Get Sick https://t.co/11eIpH6Sjw",en
2022-03-20 23:03:37+00:00,2bd1b4d9aebf4e887d128ac24c2a9d69,"@Sc00bzT @BSidesLV Day 4 of Covid-19 here. Got 3 vaccine shots last year, last one was Moderna in beginning of December. Lighter and faster than a cold, no fever. Can recommend vaccination. Hope to see you in Vegas!",en
2022-03-20 23:03:00+00:00,8305b0d15de7a3f3f1fba4ca8521bbfd,"JUST IN: The US public and even some health experts may have underestimated the Covid-19 vaccine made by Janssen, a division of Johnson &amp; Johnson, new data shows. And there's emerging evidence that it could still play an important role ahead. https://t.co/Lx7JSqRVDD",en
2022-03-20 23:02:18+00:00,d42e7369c321f86aa07213d886d1b3b9,"@TheParlermaid ""In the event an EUA is issued for this product, it would still be considered unapproved and it would be under further investigation...Licensure of a COVID-19 vaccine will be based on review of additional manufacturing, efficacy, and safety data, providing greater assurance of...",en
2022-03-20 23:00:23+00:00,8ccf9c4a594bd24d68470f614861956c,Florida to Become First State to Recommend Against COVID-19 Vaccines for Healthy Children https://t.co/Hr9RnXQtTt via @news_ntd,en
2022-03-20 23:00:22+00:00,d3cb504087b38f3c742768e70b54a374,"Is it time for yet another Covid-19 booster shot? Pfizer-BioNTech and Moderna seem to think so, but some vaccine experts aren't so sure. https://t.co/OQ759qnQa9",en
2022-03-20 23:00:14+00:00,76c0baf2199c2b610660c2a1cb4a3427,"Word has it there’s a COVID-19 vaccine clinic taking place at the Boys and Girls Club of Kawartha Lakes (107 Lindsay St. S, Lindsay) from 3-6pm on Tues, March 22. No appointments are needed, all eligible residents welcome 😎 https://t.co/07QA58ncQq",en
2022-03-20 23:00:02+00:00,c18b4073a0fda28c7d59f007f76461bc,"This week, the United States—in partnership with @gavi #COVAX and the African Vaccine Acquisition Trust—donated more than 2.7 million safe and effective COVID-19 vaccine doses to four countries in Sub-Saharan Africa. https://t.co/g3XQ0N3Gbu",en
2022-03-20 23:00:00+00:00,8ee80b5c197bf06789e040cad42820d4,Moderna is coming out with a 4th COVID-19 vaccine. Looks promising but I might hold out for the 4 SE.,en
2022-03-20 22:59:47+00:00,12b5c3707340a7b60aac1aeb2b15de41,not to be insane but there are other things that can kill you that you might need to be vaccinated for is the thing. and if you need information about those vaccines it makes it MUCH HARDER if you have to navigate seven thousand automated covid 19 resources!!!!!!!!!!!!!!!!!!!!,en
2022-03-20 22:58:34+00:00,62c5f19cf3b7b325856cc269c22d6261,"Monash Health’s COVID-19 Update for Monday, 21 March 2022.Walk-in vaccinations are available for children aged 5 to 11 and people aged 12+ at our Sandown, Cranbourne and Dandenong vaccination clinics. You can also book your vaccine at https://t.co/PfeEXK0t76 https://t.co/BEDeVDpXTr",en
2022-03-20 22:56:58+00:00,e57940fdac0340d9542911805c50372f,"Went to the footy at the Gabba on Saturday night. Firstly, had to check in with the Qld. App. Secondly, had to show Covid-19 vaccine passport, Thirdly, electronic ticket to get in.",en
2022-03-20 22:56:29+00:00,6415364601938ecf7b39e1afbf09c91fea8503907c3ce87eec1374f98fbeae00,'Reassuring' data suggests Johnson &amp; Johnson vaccine may still have a role to play against Covid-19 #SmartNews  https://t.co/XlnCNjQH2A,en
2022-03-20 22:55:09+00:00,d218ee7a4bb165115a42e4a7146ba7601cf17de156c8908d20d3c4a53202ff02,@FaheemYounus Covid-19 was a largely preventable disease when omicron arrived. Vaccine  misinformation and distrust put gas on a fire and we were pushed back on our heels.Vaccine  distrust is intertwined with frustration over other issues.,en
2022-03-20 22:48:33+00:00,a6b1ca45abb93d708b5bf3fbde72f6db7e0a68c9e2c104fe86131b51681ffa1f,"COVID-19 VACCINATIONSchedule: March 21 to 25 for adults, minors ages 12-17 years old, and kids ages 5-11 years old.Available Vaccines: Sinovac, Moderna, Pfizer, Janssen--- for 1st shot, 2nd shot and booster shotsVenue: All district health centers in Iloilo City.",en
2022-03-20 22:46:38+00:00,620c68ab9d74888bcdd2a7458ec75596b140232ccaa89206273fbafc6e9889e6,"#Covid #Vaccine #Death #Unimaginable Days after receiving her COVID-19 vaccine, mother complained of headaches and died 17 hours after being admitted to hospital; her family expressed concerns about her treatmenthttps://t.co/FAHMaLUgsq",en
2022-03-20 22:46:35+00:00,a43e4768a2db1a4a6797d1c2d39c64fd,"""Covid-19 is now less deadly than the influenza virus in England"", most agree due to natural immunity and vaccines. ""Prof S Madhi says the findings are somewhat applicable to SA."" https://t.co/8sOi1jjwBf",en
2022-03-20 22:46:27+00:00,8ea5119009fc4d1acea3c523836d769c,'Reassuring' data suggests the J&amp;J vaccine may still have a role to play against Covid-19https://t.co/vfoVo5F8dP,en
2022-03-20 22:45:39+00:00,cb7eeaf38d9cc727500e5230522d2062fea17c5f2663bf580f635c658daf4771,"Watch: Spike protein in nucleus ""NEWS"" - COVID-19 vaccines update 32by Merogenomicshttps://t.co/JY0sC96D0Mhttps://t.co/JY0sC96D0M",en
2022-03-20 22:45:13+00:00,7f1b7fb47ff6e33439dba0250b19a8b48297af1613975f306d106ba5d81b3f5b,"Robert F. Kennedy, Jr. and Dowd discussed the financial and moral implications of fraudulent data from the COVID-19 vaccine trials.https://t.co/YeG1EWxLwz",en
2022-03-20 22:45:12+00:00,979cb02f654f441e0a8ca7b8e26a56f4,"As of 4pm today, Cambridge is reporting:18 newly reported COVID-19 cases.0 newly reported COVID-19 deaths.20.9 cases per 100,000 residents, 7-day moving average.92% of residents with at least one vaccine dose and 76% fully vaccinated.More at https://t.co/YgmNLKcIMc #CambMA https://t.co/5WPanqdJZv",en
2022-03-20 22:41:18+00:00,e7dd479738e12694e70a179b3db6e5a739c4ff3565d633fb331dccb8ac16606c,"Doses of COVID-19 Vaccines per 100ppl VS New deaths due to COVID-19 per 1M of ppl. What a strange ""coincidence"" https://t.co/YazxsEG1GM",en
2022-03-20 22:41:01+00:00,0e4984c0d84c524736c35fcff1738b3c0870abd36f3f3d09134fdd13e7b06a81,Investigation of metallic contaminations found in vector- and mRNA-based COVID-19-”vaccines”: Preliminary Results https://t.co/TQqwBWsLsR,en
2022-03-20 22:40:50+00:00,9996a9a33af23127a68725da855ffc61,Protestors took to the streets of the Canadian city of Vancouver to rally against COVID-19 vaccines and mandates. See what it looked like. #CGTNAmerica #CanadaCOVID #antvaxxprotests #Canadai,en
2022-03-20 22:35:01+00:00,98df22a90f0145cfee05375ca0849b76,Do you have a question about the #COVIDvaccine and cancer? Find out more at Cancer Australia’s information about COVID-19 vaccines for people with cancer. Visit: https://t.co/7WoXsqcENe https://t.co/ETaWvBjXTa,en
2022-03-20 22:33:46+00:00,b5ba703c0ac0d879060ebd0fff11976465f944c7b71ac19bdf2149743685968d,"To get a more complete appreciation for the true impact of the COVID-19 vaccine mandate on the Canadian Armed Forces, more detail needs to be obtained on who exactly is being lost. Releasing a 2-year 2Lt has a different impact than releasing a 15-year Sgt. #ImpactStatement",en
2022-03-20 22:32:28+00:00,13e30eccaaaeebe4c9d4e3d97d931f97418735fb69029101208356c6509b45b9,Been studying. Does COVID-19 vaccine booster count as a sick day or almost a vacation? Getting a booster tomorrow morning. Stocked on some juice and snack type of foods. Probably will be in bed as per usual after vaccination for me. https://t.co/udKE1F8l53,en
2022-03-20 22:31:49+00:00,05a3e53debc7ad1dcf2092ec9576e799,Covid-19 is making feel like Political science is the mother of all Sciences!The unvaccinated are blamed for the death of the vaccinated.Vaccines doesn't guarantee safety.Face masks are ultimate and NOT at the same time.Repeated jabs are ultimate and NOT enough.CONFUSED!,en
2022-03-20 22:30:04+00:00,7ba5284d1392e1993435c42acf7229a3,New COVID-19 vaccine registered in Russia https://t.co/ixkuAoTnB7 #Health https://t.co/eQQT8822Zi #news 33,en
2022-03-20 22:29:23+00:00,a5efbd9e231cc0eaf607e68fe2451816,"A cost-benefit analysis of Covid-19 vaccine mandates. A seminar by Martin Lally *IN PERSON or ONLINE* Fri 25 March 12:30 - 13:30  RHMZ02, Mezzanine Level, Rutherford House, VUW   https://t.co/ms6hFj3x6v",en
2022-03-20 22:26:30+00:00,769fcc2453993dc0d9e47f13f24be079a0a0b150e777820bcd7eb42602619ba9,Covid-19 Vaccine Effectiveness against the Omicron (B.1.1.529) Variant | NEJM https://t.co/YGt2W0BHjW,en
2022-03-20 22:26:00+00:00,12a68262d96bc124226c967588f72681,"@PJWEB5 @andrew7rd @YouTube We don't know all the side effects of anything,  from vaccines, to Covid 19, to weed, to carrots. But given the data and knowledge we have, we can put pretty good odds at it being negligible for vaccines and high for Covid 19.",en
2022-03-20 22:25:55+00:00,9509f5de6f44768f4ce220c068d1a3c2,"Cabinet is due to review the country's Covid-19 restrictions today, with any decisions announced on Weds. @UCNZMaths Professor @MichaelPlankNZ thinks vaccine passes will go, but warns measures can't be put away for good with the threat of new variants. https://t.co/7X6qDvFj4K",en
2022-03-20 22:25:14+00:00,31a32c17ed1e8513f1ef20c08cf96aec,@bettersaidthan1 @mstephens789 @Chadgirthley @josh_wingrove @zerohedge How did we go from training wheels to being anti-vaccine? BTW I’m tripled vaxxed and Covid-19 free! And the former orange fuck couldn’t ride a tricycle without help.,en
2022-03-20 22:24:28+00:00,4af581ee67f0c2813b0547b569c8f112c847d398688dfb9f755752fbc79b15ba,"@ThisIsOurShot Hmmm.....one can still contract Covid-19 after receiving the Covid-19 ""vaccine""The Covid-19 ""vaccine"" is NOT acting like other PROVEN vaccines with long term data!",en
2022-03-20 22:22:56+00:00,e7c655d2ace1a870af6247dbb5ce514199f643619929e2bb088c6d27871e0a8c,"Ontario: on March 20, numbers released by the Ministry of Health show health officials administered 11,936 vaccine doses on Saturday, down from, 15,321 doses the day prior (CNMNG News 🇨🇦)https://t.co/by3U2kNOTn#Covid_19 #Ontario #vaccinations #Canada #Covid",en
2022-03-20 22:16:08+00:00,94c696a71314c88b6617ffc48a6493fb,"@JulieLeask Long overdue!&gt;6.3 million Australians – 1/3 of eligible – are yet to be boosted900,000 over-60s &amp; 180,000 First Nations people1.1 million Children aged between 5 and 11 have had not received a single dose of a COVID-19 vaccine",en
2022-03-20 22:15:02+00:00,ac6dccc45318b27dfa08797c89fa26b2,I got my 4th dose of Pfizer COVID-19 vaccine at 1710. Let's see how I feel. https://t.co/PLdOltVu5M,en
2022-03-20 22:13:54+00:00,7bf7daa1491eb552a4569811af8114b3574fd5620b498524d1d7a0cb963556d9,@RobertKennedyJr I developed tinnitus with my Covid-19 infection and noticed no change better or worse after the vaccine,en
2022-03-20 22:12:20+00:00,c1e42ebe1a685948b92be0b4b37af7ae8297af1613975f306d106ba5d81b3f5b,Toronto to hold 24 pop-up COVID-19 vaccine clinics in new spring campaign - Global NewsKudos to the City of Toronto  https://t.co/JTqa7PHwYa,en
2022-03-20 22:11:38+00:00,2f881bec8e760b44de95bfcef55f2d9334a12c707ea6ba65c35e4fb0159ea462,"@KgMirth Jessica Berg Wilson, 37, of Seattle, Wash., passed away from COVID-19 Vaccine-Induced Thrombotic Thrombocytopenia after being bullied to take the shot! It’s sick to pretend these shots are safe just so you can stay living in your drug reliant delusion. https://t.co/pgCPJdyPul",en
2022-03-20 22:10:46+00:00,89ab2f9ea2555903c74d58dc414b070f,Once again no mention of what the venerable who are allergic to those vaccines are supposed to do as the AZ seems to have all but disappeared.COVID-19: Spring booster jabs to be offered to millions of vulnerable people in England https://t.co/ptJe7hh0Xz,en
2022-03-20 22:08:27+00:00,d0e3577df36100bbc8dd3d7c520d0508407f1f07b9b58767815a609c81c1c1f2,China is working on an inhaled version of the vaccine.Aerosol? Easily administered through the air? Ventilation systems?Hmm 🤔Inhalable vaccine for COVID-19 a step closer- https://t.co/oNkMAwteO6 https://t.co/fW9aP87bTe,en
2022-03-20 22:08:22+00:00,02b417c0bcd016c19e70f964bf9668cf,'Reassuring' data suggests Johnson &amp; Johnson vaccine may still have a role to play against Covid-19 https://t.co/UwphziCvar,en
2022-03-20 22:06:59+00:00,d9023b06d70eb96bbdefed138cfea65b,"@jeffreyatucker Widespread Public Misunderstanding of Pivotal Trials for COVID-19 Vaccines May Damage Public Confidence in All Vaccines? Is this propaganda? Now people, who were forced to be injected with mRNA and BRAINWASHED with ""safe and effective"" by @WHO etc. are to blame?",en
2022-03-20 22:06:29+00:00,fb83e6a02a7b2ac2130a99cbb11ca1a7,Investigation of metallic contaminations found in vector- and mRNA-based COVID-19-”vaccines”: Preliminary Results – Doctors for COVID Ethics https://t.co/YMVD45ALLs,en
2022-03-20 22:05:39+00:00,d4d71fbe6a79e21afed0e6ca4a13ecfa,Moderna asks FDA to approve fourth COVID-19 vaccine shot https://t.co/RPJOdiudPr via @upi,en
2022-03-20 22:05:00+00:00,275b3bbdda17e78d29e05296321895e7,"Vaccine effectiveness with one dose of the Johnson &amp; Johnson COVID-19 vaccine remained remarkably stable for preventing symptomatic disease and hospitalizations, researchers found.By @mms_walker#IDtwitterhttps://t.co/Ot6oJdQ6ps",en
2022-03-20 22:01:48+00:00,dd5314a2fc9e236697b956d3c28f80ce8c6bb6c8d29b50930264931f3d0e82f2,It Takes A Village Of Bureaucrats To Implement Despotismby Barry BrownsteinThe Centers for Disease Control and Prevention (CDC) is committed to a vaccine solution for COVID-19.https://t.co/USuXUbdtbK,en
