date,userid,tweet,lang
2022-02-16 23:59:08+00:00,2811559122,"Pfizer/BioNTech's COVID-19 mRNA vaccine provides an added layer of protection against reinfection for people who have been previously infected with COVID-19, as well as increased immune durability over time, according to two studies. https://t.co/XSLTK7mKVt",en
2022-02-16 23:58:51+00:00,26855173,"South Dakota Senate gave hearty support to Gov. Kristi Noem’s proposal to allow employees to gain exemptions from their employer’s COVID-19 vaccine mandates, passing it with the two-thirds majority required if it is to be enacted immediately. https://t.co/zHC9e3rr1L",en
2022-02-16 23:58:35+00:00,2588348960,Philadelphia firefighters union Local 22 IAFF sues city over COVID-19 vaccine mandate - 6abc Philadelphia https://t.co/6vpQjjJepK,en
2022-02-16 23:58:23+00:00,16126384,Project Veritas https://t.co/OegqqV9yFJ USA DNC GOP NYC NYS Vaccine COVID 19,en
2022-02-16 23:58:16+00:00,1615403874,Reporter Randall covers our last vaccination event in this Spartan Spotlight. The Randalls' Pharmacy team will administer COVID-19 vaccines on Fri 2/18 @ 2-5p at the @SMSDLibrary for all individuals ages 5+. To register: https://t.co/zw4TXgJ9tWhttps://t.co/TfafathzXm,en
2022-02-16 23:58:03+00:00,909187169385934848,2/16/2022: FRONT PAGE: He was anti-vaccine. Then his pregnant wife got covid-19. https://t.co/MwTXbBKjP6,en
2022-02-16 23:58:00+00:00,1437200421358129153,"#LucMontagnier passed away recently under suspicious circumstances.Before to die,the #Nobel Price of medicine denounced that people jabbed with the fake #vaccines already get the #VIH within the #injection to prevent new outbreak of #Covid_19 in the future.#NWO https://t.co/anMMmlOiIg",en
2022-02-16 23:57:36+00:00,976098246882885634,"There are currently 51candidatesOut of which, 10 candidates are in phase 3.#coronavirus #COVID #Covid-19 #vaccine #vaccines #vaccinationUse #telegram and add bot 'CoronaTrackerNepal_bot' to get details and notifications.Source: https://t.co/HmUwd0efIQ",en
2022-02-16 23:57:27+00:00,1357277029306146817,"@Angelasfreenews @BlackTomThePir8 But we should show it to everyone, like the media did with everyone sceptical of vaccines and dying of Covid-19.",en
2022-02-16 23:56:55+00:00,841830440487010308,"@jenclark1995 Do not be afraid. I am 65 young and DT1 of 45 years.With 2-1/2 doses of Pfizer vaccine 10 days ago I got covid 19.I had of all the symptoms and even got a sinusitis as a bonus that I am curing with antibiotics. I would had rather not catch covid, but I did but thankfully I am ok.",en
2022-02-16 23:56:44+00:00,2557592940,"The CDC recommends the COVID-19 vaccine for women who are pregnant, planning to get pregnant or breastfeeding. Data has shown that pregnant and recently pregnant women have a higher risk of severe COVID-19. https://t.co/fVCjhUHKJi",en
2022-02-16 23:56:32+00:00,4058194633,$MRNA NIAID vaccine R&amp;D director who collaborated with Moderna on COVID-19 vaccine to retire https://t.co/VVhcq6mp7a,en
2022-02-16 23:56:20+00:00,262758061,"Get vaccinated or boosted at our FREE COVID-19 Vaccine + Booster Clinic on Feb 22, 12-4PM at Chace Park. Anyone 5+ is eligible – regardless of insurance or immigration status. ✨ Visit https://t.co/RqYRcGVCup to make an appointment. Walk-ups are also available. https://t.co/uFOXHBbR3U",en
2022-02-16 23:56:00+00:00,810424,"After @Gothamist published an article in early February about staff at a city-run vaccine hub in the Bronx discouraging people who were pregnant or breastfeeding from getting COVID-19 shots, several other New Yorkers reached out to share similar stories.https://t.co/Sf7LUc6k77",en
2022-02-16 23:55:40+00:00,1335779309055668224,"Coachella and Stagecoach Remove All COVID-19 Precautions, Won't Require Proof of Vaccine or Masks https://t.co/kzZvtIWsAo via @Yahoo",en
2022-02-16 23:54:55+00:00,1035407830428180480,"@tsseabiscuit And btw, the COVID-19 spike protein is on the virus, not the vaccine recipients ""protein"" what ever you think is?!? No marks for you on today's COVID-19 quiz.",en
2022-02-16 23:54:02+00:00,37928746,COVID-19: All children aged 5-11 in UK will be offered coronavirus vaccine as England and Northern Ireland become latest nations to confirm plan | UK News | Sky News https://t.co/6jufsOFyC4,en
2022-02-16 23:53:25+00:00,21281763,"variants, vaccination remains the safest strategy to prevent SARS-CoV-2 infections and associated complications; all eligible persons should be up to date with COVID-19 vaccination. Additional recommendations for vaccine doses might be warranted in the future as the virus and",en
2022-02-16 23:53:04+00:00,21281763,"against COVID-19 and related hospitalization, and that surviving a previous infection protects against a reinfection and related hospitalization. Importantly, infection-derived protection was higher after the Delta variant became predominant, a time when vaccine-induced immunity",en
2022-02-16 23:52:54+00:00,2475151315,The #CovidInquiry must cover the UK government's failure to ensure global access to Covid-19 vaccines and treatments. I've added my name to @globaljusticeUK open letter to the Chair of the Inquiry https://t.co/sK6wBUihI4,en
2022-02-16 23:52:12+00:00,1422783939668811777,This is How Many COVID-19 Vaccines Vermont Has Received So Farhttps://t.co/xDBVuS1XL0,en
2022-02-16 23:51:52+00:00,1205206677437534210,"@james55750023 @dirtygreeneggs No but the fact that he is wrong, makes him wrong. Safety and Efficacy of the BNT162b2 mRNA Covid-19 Vaccine, is a clinical study of an mRNA covid vaccine. What he said is wrong and I found this paper in literally 1 google search as well as a few others.",en
2022-02-16 23:51:22+00:00,36480720,Still need to get your COVID-19 vaccine or ready for a booster dose? The @portvanusa and @WADeptHealth Care-A-Van are hosting a free COVID-19 vaccine clinic next week! 12:30-5:30 Tues Feb. 22. No appt needed! https://t.co/l6hSjxbPht,en
2022-02-16 23:50:30+00:00,21110041,COVID-19 vaccine campaign continues as Manitoba loosens restrictions: https://t.co/IwIqR2sxU3 https://t.co/6873bW1L4I,en
2022-02-16 23:49:32+00:00,1350562063463149572,Federal judge rules Air Force officer does not have to receive COVID-19 vaccine - CNNPolitics https://t.co/4Cv5PbL0ad,en
2022-02-16 23:48:38+00:00,3401810837,"It's not too late.Together, let's keep the health of family &amp; friends in the community safer with one extra ""layer of protection."" Learn more about obtaining a free COVID-19 vaccine first shot or booster shot nearby: https://t.co/36XRQaKl79#WeCanDoThis https://t.co/th4B5u0OSo",en
2022-02-16 23:48:14+00:00,164329648,"@LornaMa36402231 @PullanTrustees @tessyursine Researchers Warning that Covid-19 Vaccines Could Increase the Risk Of HIV Infectionhttps://t.co/M9aPCv6lFn…This answers the question, why the UK Shadow Health Secretary is so keen to test Patients for HIV, at the moment when there's a link to Vaccineshttps://t.co/IMZrDo0sF6",en
2022-02-16 23:48:04+00:00,91478624,NBA Commissioner Adam Silver spoke about a NYC Covid-19 vaccine requirement Wednesday that bars Brooklyn Nets star Kyrie Irving from playing in home games. Here's what he said: https://t.co/6Et02g6bxN https://t.co/WpqZjiL1KH,en
2022-02-16 23:47:44+00:00,380898112,"US FDA approved child Pfizer jabs in Oct 21:""Effectiveness: Immune responses of children 5-11 years of age were comparable to those of individuals 16 through 25 years of age. In addition, the vaccine was found to be 90.7% effective in preventing COVID-19 in children  -11."" 1/2",en
2022-02-16 23:47:07+00:00,1343378512485478400,233 more doses of the COVID-19 vaccine have been administered to #ptbo residents:💉First doses: 21💉Second doses: 166💉Third doses: 46 https://t.co/cWBCVkbwv3,en
2022-02-16 23:46:41+00:00,1297689143506608128,"Prosecutors in King County, Wash. say a man tried to attack a Bellevue restaurant worker with a meat cleaver after being asked to show proof of a COVID-19 vaccine. https://t.co/PFFArnIer7",en
2022-02-16 23:46:39+00:00,1240292411181588480,"@Sunnyhasthelook @Chongo1891 @darlingdeity @latimes P. S. I'm fully vaxxed and still had a breakthrough case of Covid-19.   The vaccines do not keep anyone from getting sick.  Covid caused long lasting heart, chronic fatigue, neurological, and systemic problems for me.  So know your ass from a hole in the ground b4 ya spout off.",en
2022-02-16 23:46:28+00:00,1057261044421128195,A Step Toward Africa’s First Covid-19 Vaccine of Its Own https://t.co/LipntSr43V,en
2022-02-16 23:46:03+00:00,1443618714449027073,State Board of Health group continues to consider COVID-19 vaccine mandate for children #WaLeg https://t.co/m8PLnQlPRo https://t.co/i20eDPiJOX,en
2022-02-16 23:45:43+00:00,62786088,"Coachella has announced there will now be no COVID-19 requirements — including vaccines, tests and masks — for its return in April | 📸: Julian Bajsel https://t.co/n3GEktckSy https://t.co/8HNfoXNruL",en
2022-02-16 23:45:33+00:00,1205206677437534210,@james55750023 Pollack et al Safety and Efficacy of the BNT162b2 mRNA Covid-19 Vaccine,en
2022-02-16 23:45:13+00:00,1251981278,"As of 4pm today, Cambridge is reporting:32 newly reported COVID-19 cases.0 newly reported COVID-19 deaths.22.6 cases per 100,000 residents, 7-day moving average.92% of residents with at least one vaccine dose and 75% fully vaccinated.More at https://t.co/YgmNLKcIMc #CambMA https://t.co/zVAV5Cp6de",en
2022-02-16 23:45:02+00:00,1060169055754182656,"As COVID-19 infections, hospitalizations, + deaths increase, the unvaccinated continue to be most at risk. The vaccines are safe and effective, and both Moderna + Pfizer’s COVID vaccines are FDA approved. Get yours today to protect yourself and your loved ones. https://t.co/4sP1Vd4ZYL",en
2022-02-16 23:44:01+00:00,321561198,"@volcanoscout @yoli_cochrane @DineenRon Having been infected with  covid 19 is there not a possibility that the diseases is causing these after affects? I mean it doesn’t fit your vaccine narrative but it certainly is a possibility, no ?",en
2022-02-16 23:43:21+00:00,1215421834218426369,Children have over a 99.9% survival rate if they get COVID-19. Children are already SAFE without ineffective masks or harmful mRNA vaccines! Read Dr. Robert Malone’s warning to parents! https://t.co/EspEtQ9MnN,en
2022-02-16 23:42:52+00:00,2445249750,bbchealth: Covid-19 vaccine offered to children aged five to 11 in Northern Ireland https://t.co/jkMUxjCXMh,en
2022-02-16 23:42:47+00:00,55762356,The US still has about 140K new cases of Covid-19 daily plus about 2400 deaths per day. Why in the hell are we loosening restrictions on masks and vaccines? We have a way to go before this is under control.,en
2022-02-16 23:42:30+00:00,1451692442403618817,"NEW - Klaus Schwab's WEF says ""the COVID 19 pandemic has led to a heightened focus on medical data, specifically so-called vaccine passports. These passports by nature serve as a form of digital identity.""https://t.co/ThhgUK8EeK "" U can shove ur digital ID up ur a**, Casie!"" https://t.co/XRiYbop5t3",en
2022-02-16 23:42:29+00:00,211561451,Milwaukee police disputed whether any officers were disciplined after a news station reported three made fake COVID-19 vaccine cards. https://t.co/gJe3hsVArc,en
2022-02-16 23:42:26+00:00,43064490,"Getting your third dose of the COVID-19 vaccine won’t just protect you - it will help protect your entire family.  From the oldest to the youngest, getting your third dose now means you’ve done everything you can to protect everyone you love from serious illness. https://t.co/46HzxAryBy",en
2022-02-16 23:42:19+00:00,14367890,"@TheWHN / @AlleBurgers: We can do better than vaccine-only strategies (Israel, Denmark, The Netherlands): 'Japan, Taiwan, India, Indonesia, and other countries - are using “Vaccine-Plus” strategies to reduce or halt transmission of COVID-19.' https://t.co/3rLomJUojs",en
2022-02-16 23:42:18+00:00,1240079361480499202,"Effectiveness of the BNT162b2 Vaccine after Recovery from Covid-19 | NEJM. Among patients who had recovered from Covid-19, the receipt of at least one dose of the BNT162b2 vaccine was associated with a significantly lower risk of recurrent infection. https://t.co/uqFvl0gj50",en
2022-02-16 23:42:16+00:00,304642251,"@DavidLammy @LBC Could the previous gentleman have been referring to this study? I believe it's been fact checked as false. PolitiFact - No, the COVID-19 vaccine is not increasing child mortality in England https://t.co/N6mXf8F1si",en
2022-02-16 23:42:11+00:00,1402787058058362884,"Klaus Schwab's World Economic Forum says ""the COVID 19 pandemic has led to a heightened focus on the power of medical data, specifically so-called vaccine passports. These passports by nature serve as a form of digital identity.""https://t.co/n4T4lgFAnw https://t.co/zrznvLbDPv",en
2022-02-16 23:41:57+00:00,160924150,Milwaukee police disputed whether any officers were disciplined after a news station reported three made fake COVID-19 vaccine cards. https://t.co/LORvZDhuvD,en
2022-02-16 23:41:41+00:00,41650007,"While progress has been made, it's important to not let our guard down. Vaccines, boosters, tests, effective treatments and prevention methods are still the best protection we have against COVID-19. (2/2) https://t.co/Uym29PHCve",en
2022-02-16 23:41:18+00:00,1253318702029824001,#COVID19AB No vaccine is perfect. The FLU vaccine that uses a technology that has been long-term tested is not perfect. The MRNA/Vector gene-code technologies for COVID 19 have not been long-term tested so may not be perfect. Your choice whether or not to use either one.,en
2022-02-16 23:41:17+00:00,164842006,Milwaukee police disputed whether any officers were disciplined after a news station reported three made fake COVID-19 vaccine cards. https://t.co/mW7ffGfNlE,en
2022-02-16 23:40:39+00:00,1492194087998533636,"#: COVID-19: Manitoba to drop vaccine requirements, l... https://t.co/a7urqMCZck",en
2022-02-16 23:40:27+00:00,3963318734,"📣 NRCH Podcast Episode 6: COVID-19 vaccines for 5 to 11 year oldsIn episode 6, we discuss caregivers’ concerns about the COVID-19 vaccine for children aged 5-11 year olds. Listen on:🎧 Spotify: https://t.co/RhfwANusZf🎧 Apple Podcasts: https://t.co/kNf60E60HW https://t.co/zK82Mk5qJF",en
2022-02-16 23:39:59+00:00,330566571,What happens when divorced parents disagree about their children getting the Covid-19 vaccine?  https://t.co/jvGNlzoOpQ by @WeinbergerLaw #Vaccine #LegalCustody #FamilyLaw #ChildCustody #NJfamily #Divorce #CustodyAgreements,en
2022-02-16 23:38:53+00:00,27732933,Petition: Don't offer covid-19 vaccine to 5-11 year olds until phase 3 trials complete https://t.co/QV7Pvgk8Wa,en
2022-02-16 23:38:30+00:00,1213624195373887488,@TTretsky @emab2 @GBNEWS How do you know the new flu vaccine doesn't melt your insides...It's much newer than the 2021 Covid-19 vaccine rollout...The TB jab your 14 year old kid just had is even newer than that... 😉,en
2022-02-16 23:37:55+00:00,1144172811881046016,Covid-19 vaccines don’t cause immunodeficiency syndrome - Full Fact https://t.co/y3HV4hnrZB,en
2022-02-16 23:37:33+00:00,1087920211,"For those who can't get the COVID-19 vaccine because of an underlying condition, Northwest Florida Community Hospital is one of three Panhandle locations offering another option. https://t.co/xnnpkPID1Y",en
2022-02-16 23:37:33+00:00,18006230,"For those who can't get the COVID-19 vaccine because of an underlying condition, Northwest Florida Community Hospital is one of three Panhandle locations offering another option. https://t.co/jeBq7MMs7o",en
2022-02-16 23:36:30+00:00,987410912037437441,"Production Of Covid-19 Vaccines To Be Initiated By German Biotech Company In Africa, In Cooperation With Ghana, Rwanda, And Senegal. https://t.co/HqpB0C7VM5",en
2022-02-16 23:35:13+00:00,78456241,Federal judge rules Air Force officer does not have to receive Covid-19 vaccine https://t.co/rd8KlUld5Y,en
2022-02-16 23:35:13+00:00,160926051,Milwaukee police disputed whether any officers were disciplined after a news station reported three made fake COVID-19 vaccine cards. https://t.co/GKmBPEitdc,en
2022-02-16 23:35:00+00:00,810670919857405952,@Arwenstar Dr. Fauci has been working with HIV Vaccines for the past 40 years. Then funded the Wuhan lab in China for Sars covid-19 experiments in 2016 because it was banned in the US. Put two and two together and you have this hybrid form of spike protein. And hes the same person promoting,en
2022-02-16 23:34:54+00:00,122443799,Therapeutic Goods Administration of Australia Authorizes Moderna's Covid-19 Vaccine in Children (6-11 Years) $MRNA https://t.co/DJ0ogeZDrO,en
2022-02-16 23:34:50+00:00,2227355222,BREAKING: The @TGAgovau has granted provisional registration for the use of our #COVID19 vaccine for active immunization to prevent COVID-19 caused by SARS-CoV-2 in children aged 6-11 years. https://t.co/xXPt8PwVio https://t.co/eXhEjgecre,en
2022-02-16 23:34:46+00:00,164843531,Milwaukee police disputed whether any officers were disciplined after a news station reported three made fake COVID-19 vaccine cards. https://t.co/ogfOAs4QC7,en
2022-02-16 23:33:01+00:00,239740332,Still have questions about the benefits of the #COVID-19 vaccine for your children? Providence pediatrician Dr. Rosser weighs in on the topic. Get the facts about COVID-19 vaccination for children and teens by visiting the CDC's website: https://t.co/wE6kA3HAnV https://t.co/r1mIyZfDmd,en
2022-02-16 23:32:24+00:00,3318510966,Therapeutic Goods Administration of Australia Authorizes Moderna's Covid-19 Vaccine in Children (6-11 Years) https://t.co/0dMVxXBpvV,en
2022-02-16 23:32:12+00:00,1018235650661801984,"Thrilled to chat with @LisaKearnsNYC + Jeff Waldron about the critical need for access to safe and promising therapies. Here's a teaser:Operation Warp Speed accelerated the development, manufacturing, and distribution of COVID-19 vaccines. Where's MY warp speed?!",en
2022-02-16 23:32:00+00:00,1355194932445786112,$MRNA Therapeutic Goods Administration of Australia Authorizes Moderna's Covid-19 Vaccine in Children (6-11 Years)https://t.co/a48tMZRMur,en
2022-02-16 23:31:41+00:00,1348027522949148672,"@SpeechTwit @melissaannlittl @MushuIsKing @az_chrissy @ACTBrigitte Before you move the goalposts, what do you think the failure rate for transmission and infection is for COVID-19 vaccines? Is there any rate you actually accept as credible?",en
2022-02-16 23:31:15+00:00,1254035253104181256,$MRNA Therapeutic Goods Administration of Australia Authorizes Moderna's Covid-19 Vaccine in Children (6-11 Years)https://t.co/WCSMokZ5IN#vaccine #covid19,en
2022-02-16 23:31:00+00:00,266143766,$MRNA Therapeutic Goods Administration of Australia Authorizes Moderna's Covid-19 Vaccine in Children (6-11 Years) https://t.co/pmfyhoB24e,en
2022-02-16 23:30:19+00:00,20097362,"A Portland, Oregon, man allegedly tried to open the emergency door of a Delta Air Lines flight because he wanted people to videotape him sharing his thoughts on the COVID-19 vaccine, federal authorities said. https://t.co/gaDotQlscA",en
2022-02-16 23:30:12+00:00,409387426,Senate committee dramatically scales back COVID-19 vaccine mandate bill | news - Indiana Public Media https://t.co/HitqDihE0w,en
2022-02-16 23:29:48+00:00,3128271122,"""If we aren't managing their concerns then we're not going to sell tickets, which we badly need."" -@KendraConnor, ED of the Varscona Hinshaw urges respect for COVID-19 comfort levels as some businesses continue vaccine checkshttps://t.co/dI70fbDqXW",en
2022-02-16 23:29:29+00:00,16664681,Hollywood unions and studios agreed to a new deal that requires booster shots for cast and crew who've already received their COVID-19 vaccines. https://t.co/5b1SgdsVeI,en
2022-02-16 23:28:19+00:00,160922264,Milwaukee police disputed whether any officers were disciplined after a news station reported three made fake COVID-19 vaccine cards. https://t.co/DW43OrHNFI,en
2022-02-16 23:27:27+00:00,918732168008028160,"'@coachella announced their health rules on their site and the page says there will be no mandates for vaccines or masks or anything. “By entering the festival, attendees voluntarily assume all risks related to exposure to COVID-19.”'#FREDUM wins!https://t.co/SX9nBL2plo",en
2022-02-16 23:27:00+00:00,2666598398,A judge on Tuesday blocked Boston Mayor Michelle Wu’s COVID-19 vaccine mandate for certain first responders.Massachusetts Appeals Court Judge Sabita Singh ruled that the vaccine requirement for members of three municipal labor unions...https://t.co/OziwFqUsM5,en
2022-02-16 23:26:49+00:00,1213624195373887488,@Emma62939722 @GBNEWS BTW you only get a year to make informed decisions about the Flu vaccine they need to change every year due to mutations...At least all Covid-19 vaccines have already been tested on billions of people worldwide - 3 times in many cases... 👍#ThinkAboutIt,en
2022-02-16 23:26:37+00:00,59162832,"@onlythetruth007 @Chrislu73300431 @GovGianforte @SydFizzard @JoeBiden @JustinTrudeau @jkenney VAERS data is not validated by medical professionals and doesn't validate causation. If you search VAERS data for all symptoms reported for COVID 19 vaccines, it shows 1 report of ""death of pet"" and 13 reports of ""death of relative."" Did the vaccine cause these?",en
2022-02-16 23:26:04+00:00,1465052105639698434,@helenjaneadkins @JiminyC24 The report’s purpose .... advised a non-urgent offer to all 5 to 11 year olds of 2 doses of the Pfizer-BioNTech paediatric vaccine. The main purpose .. is to increase their protection against severe illness in advance of a potential future wave of COVID-19.,en
2022-02-16 23:24:06+00:00,110482636,"Sheba Medical Center announces first trial outside US for Omicron vaccines: The study, developed in collaboration with Pfizer, will evaluate the safety, tolerability, and immunogenicity of a higher dose of the Pfizer-BioNTech COVID-19 vaccine. https://t.co/COoV2NLhoW JPost https://t.co/GKVNnD0NpL",en
2022-02-16 23:23:08+00:00,951251533257035778,@FoxNews I just watched about 30 seconds of Bret B.  They touched about Africa and a covid-19 production vaccine. How about covering the story on American Life insurance policies 2022 2023?,en
2022-02-16 23:23:00+00:00,2709451526,"In tribute to @RECWorcester during the Annual Meeting, we are proud to share YouthGROW's winning entry to the Worcester Youth COVID-19 Vaccine Video/Meme contest! https://t.co/sqrMcJVcZ4",en
2022-02-16 23:21:21+00:00,895118100,"@ControlGroup10 @ai_clayton Yes. There’s a comprehensive toxicology report, from a reputable UK lab, on several of the COVID-19 ‘vaccines’. The full results will be released in a couple of weeks. I have the preliminary findings. It’s not good hence my post ‘Don’t jab your children’ tweet earlier today.",en
2022-02-16 23:21:13+00:00,86824492,"“As we curbed our activities, governments did the absolute bare minimum to support us…could have invoked the Emergencies Act to create more hospitals, harmonize vaccine mandate protocols or to collect better COVID-19 data so we could actually understand what was happening.”",en
2022-02-16 23:20:56+00:00,80925364,Qantas CEO pie video unrelated to Covid-19 vaccine mandate - AFP Factcheck https://t.co/smgdxtBfah,en
2022-02-16 23:20:55+00:00,24762838,@bente_opstad @syklemil @ThAOSteen @MThallinger @btno Ikke så kort tid faktisk: «But the Covid-19 vaccines did not come from nowhere. Decades of research by tens of thousands of scientists worldwide put in place the essential knowledge and methods that underpinned their rapid development.» https://t.co/Ew0XmiM5oC,en
2022-02-16 23:19:33+00:00,82351804,"In vaccine-sceptic France, candidates walk tightrope on Covid measures: Vaccination debates and Covid-19 restrictions have sown divisions both on and off the presidential campaign trail in France, which ranks among the most vaccine-sceptic nations in the… https://t.co/HExUqiHKL0 https://t.co/Krd7xvZ1Aw",en
2022-02-16 23:18:57+00:00,17668645,"With preliminary data as of Feb. 15 at least 3,718,407 Wisconsin residents have received at least one dose of a COVID-19 vaccine, covering 63.8% of the state's population. At least 3,504,365 residents have completed the vaccine series, covering 60.1% of the population.",en
2022-02-16 23:18:56+00:00,1948018896,"Anyone 5 years &amp; older can get a COVID-19 vaccine, regardless of insurance or immigration status.The federal government provides a COVID-19 vaccine at no cost to anyone who wants one. Find a vaccine near you today: https://t.co/a1ph0XOwJL https://t.co/ylItVPpXtj",en
2022-02-16 23:18:35+00:00,1328148065820225536,"In light of the JCVI announcement re 5-11 yr olds, we are asking members of the public to distribute this letter to Public Officers with notice of liability, to educate and inform all those who are participating in the Covid-19 vaccine rollout to childrenhttps://t.co/5FXrdXuJNf",en
2022-02-16 23:18:33+00:00,1288273237143506944,"Anyone 5 years &amp; older can get a COVID-19 vaccine, regardless of insurance or immigration status.The federal government provides a COVID-19 vaccine at no cost to anyone who wants one. Find a vaccine near you today: https://t.co/DIgVzZT6O3 https://t.co/KBW0hy2XmV",en
2022-02-16 23:18:02+00:00,1310698636427190273,"@osadlerPT @frozen @bcndp For consideration, COVID-19 also impacts our cardiovascular systems. There are some rare side effects associated with vaccinations but there are many serious risks associated with even asymptomatic or mild C19 - vaccines reduce odds of severe illness. https://t.co/kbsqw546Tm",en
2022-02-16 23:17:55+00:00,2572211573,There are many people who have chosen to not be vaxxed against COVID 19 for whatever reason. I have no issue w/ them so those who say I do are wrongI think it’s a mistake and I think you put yourself and others at risk but 🤷‍♀️If you genuinely have ? About the vaccine ask,en
2022-02-16 23:17:54+00:00,16917300,@nypost So Sad. Some Americans would rather die than take the COVID-19 vaccine.,en
