date,userid,tweet,lang
2022-02-16 08:46:24+00:00,3306558887,"Effectiveness of Maternal Vaccination with mRNA COVID-19 Vaccine During Pregnancy Against COVID-19–Associated Hospitalization in Infants Aged 6 Months — 17 States, July 2021–January 2022 | MMWR https://t.co/QzFo3HXcXM",en
2022-02-16 08:46:13+00:00,2653909938,B.C. lifts most COVID-19 restrictions as long as masks and vaccine cards are used | CBC News https://t.co/xY5P4dIMXZ,en
2022-02-16 08:45:59+00:00,334739944,Do you work in Gauteng at a place where there are 50 or more employees who need a COVID-19 vaccine jab? Send your request on Email: popupsite@gauteng.gov.za or call 0800 222 8827 and the @GautengProvince will come to your workplace and vaccinate all employees #VaccinesSaveLives https://t.co/pE2iL1pZvI,en
2022-02-16 08:45:11+00:00,31746745,How long to Covid-19 vaccine boosters last? CDC study finds booster effectiveness drops with time https://t.co/9y5DYOyBOl https://t.co/Y0TH3lKXPw,en
2022-02-16 08:45:05+00:00,14715573,Man changes his mind about vaccines after battling COVID-19 https://t.co/c35AHiCzix,en
2022-02-16 08:45:02+00:00,100453427,"The COVID-19 vaccine is safe and effective for pregnant women. 🤰If you haven’t already, don’t delay - book in for your COVID-19 jab. #boostthebump https://t.co/NF5EpAVmvk",en
2022-02-16 08:45:00+00:00,625760052,"The relatively short shelf life of AstraZeneca’s  Covid-19 vaccine is complicating the rollout to the world's poorest nations, according to officials and internal World Health Organization documents reviewed by Reuters.https://t.co/al2tWiYi4o",en
2022-02-16 08:44:41+00:00,1357878566101217281,"Driving from all over Canada, thousands of #CanadaTruckers have arrived at the national capital.They are mainly protesting due to the recently imposed vaccine mandates and COVID-19 measures.(2/n)",en
2022-02-16 08:42:49+00:00,18461298,"@KBar23190507 @lori_bauckman @catpw3r @JasonOnTheDrums @jkenney And what about the damage Covid causes? Long Covid, for example. Data so far suggests the risk of myocarditis is much higher after being infected with Covid 19 than having the vaccine.https://t.co/5sr9S2nomB",en
2022-02-16 08:42:43+00:00,1441390499235962895,"Effectiveness of Maternal Vaccination with mRNA COVID-19 Vaccine During Pregnancy Against COVID-19–Associated Hospitalization in Infants Aged 6 Months — 17 States, July 2021–January 2022 https://t.co/nUVVRPaJXW",en
2022-02-16 08:42:35+00:00,1596829382,"Covid-19: Vaccines used in Malaysia are safe, says Khairy https://t.co/fv34c2jJR1 https://t.co/Ey1drZtUzW",en
2022-02-16 08:41:10+00:00,22594051,"Covid-19: Vaccines used in Malaysia are safe, says Khairyhttps://t.co/XzrWfxRgfw  https://t.co/XzrWfxRgfw",en
2022-02-16 08:40:22+00:00,507865095,#RT @CNET: How Long Do COVID-19 Vaccines Last? https://t.co/ZozfHPYMyt,en
2022-02-16 08:40:00+00:00,1207212811132137477,Hundreds of babies were observed in the study that sought to see if the benefits of the COVID-19 vaccine extended to infants. Read HERE: https://t.co/yzzj0ejDbb,en
2022-02-16 08:40:00+00:00,1359103958,The COVID-19 vaccines offer the best protection for pregnant women and their babies.#GetVaccinated #GetBoosted https://t.co/3wyjsNSG36,en
2022-02-16 08:39:40+00:00,1317369235325243392,https://t.co/j8PVLgGfdyCOVID-19: Wales becomes first UK nation to offer coronavirus vaccines to all five to 11-year-olds https://t.co/iWyB0PLo7t,en
2022-02-16 08:39:27+00:00,194874758,"Booster shots of the Pfizer/BioNTech and Moderna COVID-19 vaccines lost some effectiveness after four months but still did a good job of keeping people out of the hospital during the Omicron surge, a study shows. https://t.co/AKt0bB6kkU https://t.co/hbLPHdXsbH",en
2022-02-16 08:39:27+00:00,305245773,"@MissK30161327 @SAHPRA1 America NEVER gives anything for free. There’s ALWAYS strings attached. This propaganda piece shouldn’t fool anyone ➡️ Covid-19: “No strings attached” to donation of millions of Pfizer vaccines, says US govthttps://t.co/07HgRlxZka",en
2022-02-16 08:39:22+00:00,2374526018,B.C. lifts most COVID-19 restrictions as long as masks and vaccine cards are used https://t.co/iaYsJmmBN8,en
2022-02-16 08:38:31+00:00,3226480198,"Trust Science😯Case look: Clots associated with COVID-19 adenoviral vector based vaccines. Commonest thrombotic presentations were deep vein thrombosis ,cerebral venous sinus thrombosis,cerebral venous sinus thrombosis and pulmonary embolism😬 https://t.co/R9aDQ7btqU",en
2022-02-16 08:38:12+00:00,187517194,"Africa: Africa, EU to Meet After Rifts Over Covid-19 Vaccines https://t.co/kvuriu8mQl #newspapers #feedly",en
2022-02-16 08:37:58+00:00,16646918,Australian Police Confirm Use of LRAD Sonic Weapon at Protest Against COVID-19 Vaccine Mandates https://t.co/Pnms5pUc9s https://t.co/fgRbtjD0Uy,en
2022-02-16 08:37:06+00:00,760390479779422208,US struggles to turn donated Covid-19 vaccines into vaccination amid nations’ logistics trouble https://t.co/gjzZzfH1s8,en
2022-02-16 08:37:00+00:00,1395616987447889922,"＃Accelerationism＃The number of doses of COVID-19 vaccine delivered by the Pan American Health Organization (PAHO) to Latin America and the Caribbean reached 100 million today, thanks to the efforts of the organization’s Revolving Fund.",en
2022-02-16 08:36:39+00:00,1304680134008545280,"RT @asiasquawkbox: Covid-19 is not going away and will ‘stay with humans forever like flu,’ says @stephane_bancel, CEO of @moderna_tx.The company has started a clinical study of an Omicron-specific vaccine ‘in case it is needed,’ he adds. https://t.co/y6nK3kVP8h",en
2022-02-16 08:36:36+00:00,474634255,"If plans do indeed go ahead, #Tanzania will be the first East African country to manufacture Covid-19 vaccines. President Samia Hassan said while on a visit to Brussels that they plan to set up their own vaccine manufacturing plant.  https://t.co/ngx47ImLA4 via @The_EastAfrican",en
2022-02-16 08:36:33+00:00,1690569936,"German Cooperation, EU join hands towards first ever Covid-19 vaccine production in Ghana https://t.co/2hDIRRR8OZ",en
2022-02-16 08:36:22+00:00,22129041,"We're at Huntingdon Commemoration Hall between 10am-3pm today, offering first, second, third primary and booster doses of the COVID-19 vaccination! Anyone aged 12+ can pop in, so if your child is off school this week for half-term and is due a vaccine, please bring them along. https://t.co/fALs5LQ6jV",en
2022-02-16 08:36:07+00:00,1467241283882213384,@glamsng @ESPNFC It was the covid-19 vaccine that ended his career not Barcelona mediclal team,en
2022-02-16 08:36:03+00:00,1460099573179891719,"@d_e_mol @yazza97118774 @BuzzFreeman Not my friend, look at the top-  covid-19 vaccine.",en
2022-02-16 08:35:21+00:00,1391493965547905024,California bills target COVID-19 vaccine misinformation https://t.co/oOcEIkP9ML,en
2022-02-16 08:34:46+00:00,152004319,"The relatively short shelf life of AstraZeneca Plc's COVID-19 vaccine is complicating the rollout to the world's poorest nations, according to officials and internal World Health Organization documents reviewed by Reuters.   https://t.co/8OLu3Xi2wN",en
2022-02-16 08:34:40+00:00,3200857527,Australian Police Confirm Use of LRAD Sonic Weapon at Protest Against COVID-19 Vaccine Mandates https://t.co/fW1XIwroi9 via @epochtimes,en
2022-02-16 08:34:25+00:00,1006165705543299074,@rookierw @weyonsdon @DineenRon WTF DID I JUST WATCH!PLEASE TELL ME THIS IS FAKE!IT'S NOT FAKE!PLEASE SHARE🇺🇸 MUST STAND AGAINST THIS!ANNUAL COVID SHOTS FOR ALLALL FOR 💸!!!#Covid #Covid_19 #COVID19 #VaccineMandate #VaccineMandates#vaccines #CovaxinForKids #TruckersConvoyhttps://t.co/kKyQwnVbqK,en
2022-02-16 08:33:32+00:00,1006165705543299074,WTF DID I JUST WATCH!PLEASE TELL ME THIS IS FAKE!IT'S NOT FAKE!PLEASE SHARE🇺🇸 MUST STAND AGAINST THIS!ANNUAL COVID SHOTS FOR ALLALL FOR 💸!!!#Covid #Covid_19 #COVID19 #VaccineMandate #VaccineMandates#vaccines #CovaxinForKids #TruckersConvoyhttps://t.co/kKyQwnVbqK,en
2022-02-16 08:33:25+00:00,2655664015,"@pfizer CEO says people who spead covid misinformation about covid 19 vaccine are 'criminals'. Funny,Who paid the largest criminal fine in US history?Hypocrisy doesn't age well. https://t.co/mqLIzZnyqs",en
2022-02-16 08:33:24+00:00,487787361,"RTStateDept: We are donating five million Johnson &amp; Johnson COVID-19 vaccine doses to the @_AfricanUnion’s African Vaccine Acquisition Trust. In partnership with #COVAX, we have donated more than 155 million doses to Africa. https://t.co/Ftgq1kw2ID",en
2022-02-16 08:32:47+00:00,203123011,Short AstraZeneca shelf life complicates COVID-19 vaccine rollout to world's poorest https://t.co/HqlSVygRWf,en
2022-02-16 08:31:26+00:00,80672569,"Following the science seems to bring lots of 🤑 .""Pfizer has had an exceptionally good pandemic. Today it announced that its Covid-19 vaccine brought in $37bn billion last year, making it easily the most lucrative medicine in any given year in history.""https://t.co/DuyaWAiRyA",en
2022-02-16 08:31:11+00:00,16374906,National Task Force Against COVID-19 medical adviser Dr. Ted Herbosa on Wednesday (Feb. 16) said that COVID-19 is safe for Muslims and that it is not haram and that most vaccines came from plants.https://t.co/78ZvrcGY8b,en
2022-02-16 08:31:01+00:00,301939462,COVID-19 vaccination clinics are open this half-term.The vaccine protects young people from getting seriously ill from the virus. To find a walk-in clinic near you visit: https://t.co/YMj3yRzpEK or book an appointment online: https://t.co/8jojcra4qr https://t.co/d8kc9JBc0E,en
2022-02-16 08:30:06+00:00,162088304,New in our #BMCPublicHealth LGBTQ+ Health collection - a study highlights the need for vaccine rollouts to prioritize 2SLGBTQ+ youth experiencing homelessness &amp; to address health disparities exacerbated by the COVID-19 pandemic.https://t.co/Ga3joZgs2b https://t.co/EOLQdoT5T1,en
2022-02-16 08:30:03+00:00,913487633237524480,BA.2 Omicron sub-varient of COVID-19.Overwhelmed hospital staff.Vaccine &amp; mask mandates. Closing borers.Mental &amp; physical health declines.This exhaustion you’re feeling is resilience fatigue. Please be sure to rest.#staysafe #bewell #wednesdaywellnesstip #snellcpa https://t.co/Hjmd86NePW,en
2022-02-16 08:30:00+00:00,9624742,"We are donating five million Johnson &amp; Johnson COVID-19 vaccine doses to the @_AfricanUnion’s African Vaccine Acquisition Trust. In partnership with #COVAX, we have donated more than 155 million doses to Africa. https://t.co/c8kdmlBRIR",en
2022-02-16 08:30:00+00:00,22152147,Grab your child their Covid-19 vaccine this half term! 🗓️Search #GrabAJabhttps://t.co/9jOsqsrW6a https://t.co/ooEekAvDzk,en
2022-02-16 08:30:00+00:00,9130702,"People who are not up to date with their vaccines should avoid cruise travel, the CDC says. And regardless of vaccination status, the agency says those who are at increased risk for severe illness from covid-19 should also avoid cruises.https://t.co/NUSC0lgG1k",en
2022-02-16 08:28:49+00:00,702487766,General : AstraZeneca fulfills commitment to deliver 6.4 mil COVID-19 vaccine doses to Malaysia https://t.co/MP8kIuFZWn,en
2022-02-16 08:28:04+00:00,1476267254207729672,Research News : COVID-19 vaccines induce immune response to Omicron https://t.co/rpl500CuvF,en
2022-02-16 08:25:23+00:00,3019913038,https://t.co/LqLodR0k6CCOVID-19: UK volunteers needed to trial new Omicron-specific vaccine https://t.co/xcbZz1vyvm,en
2022-02-16 08:22:23+00:00,1279717771710836736,Update on COVID-19 Vaccine Availability in States/UTs  https://t.co/wOR89sSqzuhttps://t.co/lCneeLfoKU,en
2022-02-16 08:22:21+00:00,1389563826744479748,"@EricTopol @OurWorldInData Is looking beautiful in Denmark. Most of the us got the 3. Vaccine in December and with came also a round of very mild covid-19 ""flue""... we all survived. And now we are living happily ever after👍😘",en
2022-02-16 08:22:20+00:00,734280516,Active cases of COVID in Australia in June/July will be 5 times what it is now when &gt; 50% of people have had 4 vaccines. The more COVID-19 vaccinations you have the more infectious you become to others as you are getting the virus yourself. @abcnews @SkyNewsAust @wagov @nthealth,en
2022-02-16 08:21:48+00:00,8447532,"TwitterMoments: Getting a COVID-19 vaccine is safe for most people and helps protect against serious illness, according to scientists, public health officials and agencies.https://t.co/WtGHcNmREU",en
2022-02-16 08:21:45+00:00,1376408300120469504,"[NEWS IN-DEPTH] Full interview with Dr. Alice Tan, M.D., Internist of Mizmedi Women's Hospital @mizmedi :Fourth Dose of Covid-19 Vaccine: How Safe Is It and Who Needs It?https://t.co/NoiKAIJ7ft#covid19 #Vaccines #Effectiveness #Research #Safety #Concerns",en
2022-02-16 08:21:31+00:00,936128711711014912,"swachhbharat: Worried that the COVID-19 vaccine will affect your cycle negatively? Fret not, it is absolutely safe! Stay away from fake news, to beat the Coronavirus blues.#Unite2FightCorona #IndiaFightsCorona @PMOIndia @gssjodhpur @mansukhmandviya @… https://t.co/JPzsloqX6W",en
2022-02-16 08:21:00+00:00,1237419336672907264,Tanzania plans to start manufacturing Covid-19 vaccines in a move aimed at cutting the cost of importing them.https://t.co/6iTicwono8,en
2022-02-16 08:20:59+00:00,1191085085140889607,"@SAfmnews ACDP you are wrong, because ever since we started vaccination,  we don't need statisticians to calculate the decrease in hospitalizations of covid 19 patients..We just coming from festive but hospitals were empty..that should tell you vaccines are helping people of this country.",en
2022-02-16 08:19:22+00:00,964993198559907840,"German Cooperation, EU join hands towards first ever Covid-19 vaccine production in Ghana https://t.co/mmCVr3fxkD",en
2022-02-16 08:18:55+00:00,19760322,A Facebook policy change around covid-19 vaccine misinformation successfully managed to reduce anti-vax content on the platform - but only for a few months. My latest for @newscientist https://t.co/eTlzEKuFW9,en
2022-02-16 08:18:55+00:00,1095484218,"The relatively short shelf life of AstraZeneca Plc's COVID-19 vaccine is complicating the rollout to the world's poorest nations, according to officials and internal World Health Organization documents reviewed by Reuters.It is the latest headache to p… https://t.co/rRa7capwZS https://t.co/1tXYNmCiJR",en
2022-02-16 08:18:51+00:00,742363711755550720,"@Lady_Beachbum @RACGPPresident Did you not read this from your link...""Most of the information so far has come from mRNA vaccines (Comirnaty and Spikevax). EMA will also review data for other authorised COVID-19 vaccines as they become available"".neither available in USA or Australia. What of the other vaxs?",en
2022-02-16 08:17:46+00:00,30523252,"I'm old enough to remember when anyone who believed Covid 19 was a plot that all the world's medical professionals, political bodies and media were in on was rightly seen as nuts. Because vaccines have been successful, perversely that craziness has spread.",en
2022-02-16 08:17:37+00:00,708285786567942146,The #CovidInquiry must cover the UK government's failure to ensure global access to Covid-19 vaccines and treatments. I've added my name to @globaljusticeUK open letter to the Chair of the Inquiry https://t.co/YFNuKKQcId,en
2022-02-16 08:16:33+00:00,1483525618599931910,"Robert Kennedy Jr., the nephew of the late U.S. President John F. Kennedy, a self-described anti-vaccine activist and conspiracy theorist, during the COVID-19 pandemic has proposed various -19 related conspiracy theorieshttps://t.co/IcaPv3bAsE",en
2022-02-16 08:16:14+00:00,1488362326667390976,A recent survey conducted on the #adultpopulation in the United States has identified the most common predictive reasons behind #coronavirus disease 2019 (COVID-19) vaccine hesitancy.For more info:https://t.co/LpQ7W70H1l,en
2022-02-16 08:14:43+00:00,1347078046239506432,"As of February 14, a total of 2.95 billion doses of COVID-19 vaccine had been administered to 8.5483 million people in Kunming, Yunnan province, of whom 8.3637 million had received two or three doses of vaccine. https://t.co/g3QvfnMnvX",en
2022-02-16 08:12:08+00:00,1457389981614452741,The immunologist spoke about the effectiveness of the nasal vaccine against COVID-19 | News | News https://t.co/e6VvSfR8aL,en
2022-02-16 08:11:40+00:00,890106942915563520,"RT @swachhbharat Worried that the COVID-19 vaccine will affect your cycle negatively? Fret not, it is absolutely safe! Stay away from fake news, to beat the Coronavirus blues.#Unite2FightCorona #IndiaFightsCorona @PMOIndia @gssjodhpur @mansukhmandviya @prahladspatel @Bis…",en
2022-02-16 08:11:32+00:00,856652799290916870,"Data have clearly shown that receiving an mRNA COVID-19 vaccine during pregnancy reduces the risk for infection, severe illness and death from COVID- ...Transcript for CDC Media Telebriefing: COVID-19 Vaccination and Pregnancy | CDC Online ... https://t.co/ydYlRVu7Mh",en
2022-02-16 08:11:18+00:00,22594051,Covid-19: Khairy defends nurse who gave son vaccine dosehttps://t.co/xqBfKa7y60  https://t.co/xqBfKa7y60,en
2022-02-16 08:10:15+00:00,1329825416681492481,"CNBC: RT @asiasquawkbox: Covid-19 is not going away and will ‘stay with humans forever like flu,’ says @stephane_bancel, CEO of @moderna_tx.The company has started a clinical study of an Omicron-specific vaccine ‘in case it is needed,’ he adds. https://t.co/4WSR9uwdDk",en
2022-02-16 08:09:35+00:00,2814323911,"A JPN govt delay in rolling out COVID-19 booster shots left it more vulnerable than other rich countries when the Omicron variant brought a surge of deaths, say experts, local governments and a former vaccine czar. Story by @swiftrocky &amp; @emlies16https://t.co/WC3Xwen1OI",en
2022-02-16 08:08:51+00:00,749543733012492288,"swachhbharat: Worried that the COVID-19 vaccine will affect your cycle negatively? Fret not, it is absolutely safe! Stay away from fake news, to beat the Coronavirus blues.#Unite2FightCorona #IndiaFightsCorona @PMOIndia @gssjodhpur @mansukhmandviya @… https://t.co/OlESnOqdt9",en
2022-02-16 08:08:06+00:00,47086949,US struggles to turn donated Covid-19 vaccines into vaccination amid nations’ logistics trouble  https://t.co/W6CyWfW5Yh,en
2022-02-16 08:07:36+00:00,1596829382,Covid-19: Khairy defends nurse who gave son vaccine dose https://t.co/yjMPNdlE7h https://t.co/fylZA4mR19,en
2022-02-16 08:07:28+00:00,321649323,Medscape: Booster shots of the Pfizer and Moderna COVID-19 vaccines lost some effectiveness after four months https://t.co/c0Qk0O6ZDG https://t.co/hHbdGSMLbx,en
2022-02-16 08:06:47+00:00,1171429462337937408,"KILLING KIDS FOR PROFITS, NOBODY IS SAFE. Two Teen Boys Found Dead in Bed 3 &amp; 4 Days After Receiving Second Dose of Pfizer COVID-19 Vaccine. 'Parents and kids should know more deaths will happen,' warns Dr. Peter McCullough. https://t.co/ASay5iuPFT #Querdenker",en
2022-02-16 08:05:34+00:00,56280042,Covid-19: Khairy defends nurse who gave son vaccine dose https://t.co/vUIuEvFi9R,en
2022-02-16 08:05:21+00:00,1447460849099034629,"Delhi records more than 3 crore vaccine doses, thus achieving a milestone against COVID-19.#Delhi #Vaccination #Covid19 #CoronaVaccination #VaccineDose #Delhigram https://t.co/K8hWqN1lGY",en
2022-02-16 08:04:51+00:00,1363722904513503233,B.C. lifts most COVID-19 restrictions as long as masks and vaccine cards are used https://t.co/2NOwiJnWYs,en
2022-02-16 08:04:08+00:00,760134513691242496,Covid-19 vaccine efficacy study in kidney transplant patients - Emergency Live https://t.co/Dv8aznxNiU #thermal #imaging,en
2022-02-16 08:03:44+00:00,3883416257,"Funds for malaria control and elimination programs remain limited, and scientists worry that, between Covid-19 and the malaria vaccine rollout, attention and resources for conducting surveillance and drug resistance work might dry up.https://t.co/jCObtNUzXQ",en
2022-02-16 08:03:33+00:00,1229752606714728454,"Preliminary report; Ethnic differences in COVID-19 mortality in the second and third waves of the pandemic in England during the vaccine roll-out: a retrospective, population-based cohort study: Objectives: To assess whether ethnic… Read more ↓ https://t.co/vhYlJW4g0R",en
2022-02-16 08:03:25+00:00,100504361,RT @JKJAVMY: COVID-19 vaccines are not safe and serious side effects are common. Myths or Facts? https://t.co/Ct0YWMeQbq,en
2022-02-16 08:02:00+00:00,35764366,"Vaccinated people are far less likely to get serious COVID-19, be admitted to hospital or die from it.We urge you to get vaccinated to keep yourself, your loved ones and Enfield safe.Book your vaccine today at: https://t.co/pdbf6iiu3v#KeepEnfieldSafe https://t.co/lb2ELKf41A",en
2022-02-16 08:01:09+00:00,20511666,Huge thanks to @CatSmithMP for raising the issue of long-term effectiveness of COVID-19 vaccines for blood cancer patients.  https://t.co/tLwNlkORGj,en
2022-02-16 08:00:29+00:00,289241101,"The United States has delivered 400,000,000 COVID-19 vaccine doses to over 110 countries and economies and provided nearly $20 billion in relief to vulnerable communities worldwide.Together we can beat COVID-19! https://t.co/n7Lj8txhtX",en
2022-02-16 07:59:20+00:00,1407210313615822848,"""Based on passive surveillance reporting in the US, the risk of myocarditis after receiving mRNA-based COVID-19 vaccines was increased across multiple age and sex strata and was highest after the second vaccination dose in adolescent males and young men."" Cosas tiene el JAMA...",en
2022-02-16 07:59:08+00:00,792263243330904068,"Former FDA Commissioner and Current Pfizer Board Member Scott Gottlieb Admits Not Enough Children Under 5 Have COVID to Test VaccineYou look at the government statistics regarding the COVID-19 ""vaccines"" which clearly show that these products are maiming and killing millions",en
2022-02-16 07:58:40+00:00,1596829382,US struggles to turn donated Covid-19 vaccines into vaccination amid nations’ logistics trouble https://t.co/n5YEzvQbQO https://t.co/X8EJALRVlt,en
2022-02-16 07:57:30+00:00,921400462838042624,"Ethnic differences in COVID-19 mortality in the second and third waves of the pandemic in England during the vaccine roll-out: a retrospective, population-based cohort study  https://t.co/LaeRKzOVzU #medRxiv",en
2022-02-16 07:55:48+00:00,1440910384681009158,"WHO cited Vaccine hesitancy as one of the top 10 global health threats in 2019. Dr. Lisa Doggett, Senior Medical Director at HGS AxisPoint Health, addresses the COVID-19 vaccine hesitancy and promotes its acceptance.Watch: https://t.co/bWRogDEpiU#HGSHealthcare #vaccine https://t.co/HRLapzh4sN",en
2022-02-16 07:54:45+00:00,822392302224052224,Fourth Dose Of COVID-19 Vaccines To Start In South Korea#COVID19 #vaccines #covidvaccines #SouthKorea Read: https://t.co/9s19ho92U8 https://t.co/jDH1xRgWvl,en
2022-02-16 07:54:33+00:00,1407210313615822848,"""The number needed to vaccinate (NNV) to prevent one more case of COVID-19 as 1/ARR. NNVs bring a different perspective: 81 for the Moderna–NIH, 78 for the AstraZeneca–Oxford, 108 for the Gamaleya, 84 for the J&amp;J, and 119 for the Pfizer–BioNTech vaccines. ""https://t.co/MuezhFBOQ3",en
2022-02-16 07:54:04+00:00,893685029120888832,Push for international seafarers to access COVID-19 vaccines and be allowed to come ashore https://t.co/GFtEpnP1xf via @ABCaustralia,en
2022-02-16 07:50:47+00:00,200155729,"Covid-19 in the UK   72.7% with two vaccine doses and 56.4% with booster top-upDaily cases 46,186In hospital 12,304Daily deaths 234*Deaths up again",en
2022-02-16 07:50:45+00:00,345227641,@paulkrugman Also. Some Danes have decided against the vaccine understanding their choice but they pay more than 50 percent in taxes so what is life quality then? For some the Covid-19 can be the easy choice to escape the life in Denmark. It should be respected.,en
2022-02-16 07:50:42+00:00,1099819564081147904,"NPRA: No Serious Side Effects Reported From Children’s Covid-19 Vaccination Of 79,393 Covid vaccine doses administered to under-12 kids, only 8 reports of non-serious adverse effects have been received, equal to 0.1 reports per 1,000 doses.https://t.co/bdgzWX13Qi",en
2022-02-16 07:50:14+00:00,1434669037,"Cool. His choice. I'm actually pleasantly surprised he's enough of a grown-up to know this is the choice he faces. ""Novak Djokovic is willing to give up Grand Slam titles to avoid getting the Covid-19 vaccine""  https://t.co/Za3cPbYfUz",en
2022-02-16 07:49:38+00:00,1940581,"3/6RFID chips were, and maybe still are, in the frontline of the nonsense the misinformation army has been spreading against COVID-19 vaccines. #rfid #themedicalfuturist #digitalhealth",en
2022-02-16 07:48:34+00:00,205636848,You can walk-in for a COVID-19 1st/2nd vaccines or booster jab today at:📍Andrews Pharmacy #Macclesfield 📍Cre8 #Macclesfield &amp; Macclesfield Library📍Alsager Pharmacy📍Hollowood Chemists #Crewe📍Masonic Hall #NantwichSee all times &amp; full details at👉: https://t.co/ruoH9bkqdB https://t.co/y9eWTrrktX,en
2022-02-16 07:48:21+00:00,351669463,MAYOR'S OFFICE: New York City fired more than a thousand workers who failed to comply with the city’s COVID-19 vaccine mandate. https://t.co/OTkxaUCJhg,en
2022-02-16 07:47:50+00:00,1311033428201086976,"@justask66054535 ""Covid 19 Vaccines have been rigorously tested"" according to the CDC.  How do they describe vaccines that's have gone through regular approval? ""Actually tested?""",en
2022-02-16 07:46:47+00:00,1236373317105393664,Russia has 3 different vaccines for COVID-19 but they are not as efficient as western solutions are. This effort would be substantially hurt with sanctions. Therefore his objective is not war but peace. US objective is not peace but war due to bad intelligence and missjudgement.,en
2022-02-16 07:45:33+00:00,330826792,The 38 trucks and vans will aid the country’s COVID-19 vaccine drive as well as future immunization programs of the Department of Health. https://t.co/wART1ses5z,en
