date,userid,tweet,lang
2022-01-01 14:20:49+00:00,827953167992180736,"The worthiness of the vaccine is in relationship to the amount hospitalized of vaccinated and unvaccinated. What needs to be looked at to be fair to all, is how many are hospitalized after a recovering from covid-19 that needed little or no prescription.",en
2022-01-01 14:20:36+00:00,40933920,#AndinaEnglish Peru: Over 50.2 million COVID-19 vaccine doses applied https://t.co/cqRe8NGzs1 https://t.co/3jcsacdgEz,en
2022-01-01 14:20:02+00:00,15593696,VACCINE REFUSAL: More than 200 Marines separated for refusing COVID-19 vaccine. #8NNhttps://t.co/1OQQbAZDsV,en
2022-01-01 14:19:05+00:00,1310281173642489856,COVID-19 vaccine shows promising results during clinical trial in Pakistan | Pakistan Defence https://t.co/8peGCgnYNF via @defencepk,en
2022-01-01 14:18:12+00:00,1668021270,#Covid_19A very interesting video of interviews. A cautionary message from vaccine advocates.https://t.co/KOP5t40x2V,en
2022-01-01 14:18:02+00:00,2191265886,Marines kick out 206 troops for refusing Covid-19 vaccine.,en
2022-01-01 14:18:00+00:00,1056850669,"Listen to our live phone-in programme on #Covid_19 on FM Gold📻at 9.30 PM.• Ask questions to experts on Toll Free No: 1800-115767 • Dr. VK Paul, Member (Health), @NITIAayog &amp; Chairman of National Expert Group on Vaccine Administration for COVID to participate in discussion. https://t.co/qmrFEabnKp",en
2022-01-01 14:16:49+00:00,3205582234,"Natalie Winters asks the right question: Why was Pfizer partnering with the Chinese Communist Party's platform for vaccine passports and social credit scores the year before the COVID-19 ""pandemic"" started? https://t.co/T15psnkTLJ",en
2022-01-01 14:16:06+00:00,2799258205,Tested Positive After Vaccine - Covid-19 Quarantine Vlog https://t.co/Umn0CDbHZQ via @YouTube,en
2022-01-01 14:15:03+00:00,195658009,"@blsanthosh Come on, sooner you will see million #Covid_19/day and it will show the effectiveness of vaccines.",en
2022-01-01 14:15:00+00:00,27741349,"It's a new year, but it's still important to take a look back. Here are some of the major religion-related stories of 2021, the Capitol insurrection, the COVID-19 vaccine rollout and the Israeli-Palestinian conflict.https://t.co/vvfSB6SBXP",en
2022-01-01 14:14:58+00:00,843919270924959748,New Zealand Links Death Of 26yro Man To Pfizer COVID-19 Vaccine https://t.co/ZRe2DRB3TC via @AntiguaNewsRoom,en
2022-01-01 14:14:29+00:00,811972460560019456,"India sends batch of 5,00,000 doses of COVID-19 vaccine to Afghanistan, MEA confirms https://t.co/x3IZlaAfRi",en
2022-01-01 14:13:33+00:00,1424986688,#Wishlist2022✨ Our Wish from South Africa We wish for pharma to share COVID-19 vaccine recipes with WHO’s tech transfer hub to increase the number of vaccine manufacturers in African countries.#ShareTheTech #MedicinesShouldntBeALuxury  https://t.co/aM3jWcCPaS https://t.co/fYUVbUkfwx,en
2022-01-01 14:12:49+00:00,1273746524351213573,India sends 5 lakh COVID-19 vaccines to Afghanistan https://t.co/qOPISQSkUf… via @Orange News9 : Latest News,en
2022-01-01 14:12:36+00:00,1445499214801244175,"The U.S. Supreme Court will hear arguments Jan. 7 in cases challenging two of the Biden administration’s COVID-19 vaccine mandates. Those mandates would apply to more than 100 million American With compliance deadlines quickly approaching, the Supreme Court decided to step in.... https://t.co/r1o1aYsMDS",en
2022-01-01 14:12:10+00:00,1243944298564988928,"So many misunderstandings on science behind #Covid_19 #vaccine and #Omicron represents failure in the ability of establishment to effectively communicate complex issues in a digestible, simple format to build trust and inform better decision-making and policy debate.",en
2022-01-01 14:12:09+00:00,855989671708565504,COVID-19: Data on Vaccines - NYC Health https://t.co/CL78XZe8ho? via @nycgov,en
2022-01-01 14:11:37+00:00,867813849944268800,"@Velocirapticorn @Mr5mPlay125x @AnthonyCatucci @JennaEllisEsq How is a vaccine mandate different from a drug test at work?  Also, aren’t hospitals primarily responsible for the health of their patients?  Wouldn’t they be open to liability if patients were catching COVID-19 from staff?  I think so….",en
2022-01-01 14:10:58+00:00,2527557380,More than 200 Marines separated for refusing COVID-19 vaccine https://t.co/5Mg3VXJYQx,en
2022-01-01 14:10:56+00:00,1368897862357164033,"#India gives 500,000 doses of COVID-19 vaccines to #Afghanistan https://t.co/uXnFLWbLly #covid #vaccine",en
2022-01-01 14:10:16+00:00,15856435,How to carry your COVID-19 vaccine card on your phone https://t.co/0GJjLSSJne,en
2022-01-01 14:10:04+00:00,873424644,India sends 5 lakh COVID-19 vaccines to Afghanistan https://t.co/ZzDDZntPuo via @Orange News9 : Latest News,en
2022-01-01 14:09:24+00:00,873109732126359552,"Every adult in the country now needs to get a Covid-19 booster vaccine, because two doses does not give you enough protection against catching Omicron. https://t.co/OFZVL74MT1",en
2022-01-01 14:09:22+00:00,1893719730,UC system fires physician who challenged COVID-19 vaccine mandate in lawsuit https://t.co/akxRFspI04,en
2022-01-01 14:08:00+00:00,3010217166,"Effective January 4, 2022 applicable patrons accessing all municipal recreation facilities will be required to use the enhanced provincial COVID-19 vaccine certificate with QR code and the Verify Ontario.For more information visit: https://t.co/NgoSffDtdF https://t.co/DVRmRWtiCM",en
2022-01-01 14:07:55+00:00,23351882,"@RepPressley Good for your mild symptoms, but we saw countless photos of Americans treating covid like it never existed over the past year: sports venues packed/concerts/ restaurants packed to the gills. Vaccines are a great thing, but they are not a magic pill that kills covid-19 on contact.",en
2022-01-01 14:07:16+00:00,234366413,Appointments available TODAY - Jan 3 at the Sherwood Business Centre for the Moderna booster COVID-19 Vaccine. Please book online and ensure that you meet the eligibility requirements to receive your 3rd dose and are 30 years of age or older @infopei https://t.co/ANT3icH9CB,en
2022-01-01 14:07:11+00:00,361649109,"@GovAbbott @TexasDSHS @TDEM How about no, there are much more cost effective ways to limit the risks of Covid 19. 1. Get vaccinated 2. Wear a mask. 3. Social distancing.Texas wants to stop all vaccine and masks mandates because it hurts their freedom, then wants federal aid to bail them out.",en
2022-01-01 14:06:09+00:00,929076201187975168,Israel has started fourth vaccine shots for individuals with compromised immune systems#coronavirus #Covid_19 #florona @Israel  https://t.co/0Ef0bREJVV,en
2022-01-01 14:05:57+00:00,339113353,How COVID-19 mutates and how it affects vaccines | OSF HealthCare https://t.co/5vcHJtMFql,en
2022-01-01 14:05:44+00:00,2388694785,"Missouri to end COVID-19 state of emergency, citing effectiveness of vaccinehttps://t.co/OgkGMwQmHy",en
2022-01-01 14:04:59+00:00,1365401704750006278,"@MickusDickus @provaxtexan @CoralBlob @Mchael21592783M @EileenNZ @AndrewLazarus4 @Monstercoyliar @wendy_Lynnette @AGoldsmithEsq @mcfunny @ZaynJaffer @DCGreenZone1 @Kathmarval @JawKneeFaiv @FrankDElia7 @crabb_vicki @stevenmosher @SkepticalMutant @EstesPga @MdRisette @melissa94307909 @BrockKrause @doritmi @dodi_rains @Top_Muppetries @carlsmythe @RenfieldThomas @TakethatCt @tenebra99 @TonyBaduy @ncdave4life @indyymac @quigley_jesse @Kolyin @diederikdk @_mamadeb @gobantwo2 @ghoppe @AndyMac84956921 @LiamKav @SpookyJay36 @BichonAtLaw @deNutrients @floraoddchild @Suesue2point0 @CharaStone6 @chickaboy @smyl2day @AcademicShards @ConsequentialBr Oh, dear. You are part of the problem.""vaccine hesitancy has existed for centuries, its harmful effects have become more pronounced than ever before during the COVID-19 pandemic and it is considered one of the greatest threats to global health. ""Source &gt; https://t.co/Lh9jEdXYFw",en
2022-01-01 14:04:27+00:00,396439334,"COVID-19 Genetic Vaccine Safety in Children, by @RWMaloneMD https://t.co/Ypuvnc2Vmh",en
2022-01-01 14:03:50+00:00,190305650,"Lancaster ISD will offer COVID-19 vaccinations for Lancaster ISD students and parents on Monday, January 3.The clinic will offer the 1st, 2nd, &amp; booster dose of the following vaccines:💉Pfizer💉Moderna💉Johnson &amp; Johnson Click the link to register! https://t.co/Nz2OTf4DZG https://t.co/OG7qTJorwt",en
2022-01-01 14:03:45+00:00,2509033598,A right-wing radio host said Trump needs an 'intervention from a friend' after the former president advocated for the COVID-19 vaccine #NewsBreak https://t.co/EAPEteguzj,en
2022-01-01 14:03:02+00:00,722627077497696256,"People getting shocked about the necessity of fourth Covid-19 vaccine shot but wait till they find out that westerners take flu shot yearly.Virus mutate. They do not sit still. So, of course we need to go for some extra protection each time the virus mutate and become even",en
2022-01-01 14:02:57+00:00,1389627843328479235,"Despite receiving funding from the International Monetary Fund (IMF) and the World Bank, the government failed to obtain Covid-19 vaccines on time, and civilians were forced to rely on donated vaccines. To add insult to injury,#TabdeeliNahinTabahi",en
2022-01-01 14:02:48+00:00,1170667863734046720,Many rush to get first shot of COVID-19 vaccination as government will impose vaccine passports before Lunar New Year https://t.co/hYqVd2mQ6J,en
2022-01-01 14:02:32+00:00,225464976,J&amp;J says study shows vaccine boosters 85% in preventing severe COVID-19 illness https://t.co/FZDWRrGTK1,en
2022-01-01 14:02:10+00:00,1089985236,"Pleased to join the @UN_PGA New Year's resolution for a commitment to a sustainable and swift recovery from the COVID-19 pandemic through vaccine equity, no one is safe until everyone is safe. #VaccineEquity https://t.co/1IiTWaatbp",en
2022-01-01 14:01:55+00:00,973206107899514880,If you are pregnant it is important that you have both doses of your #COVID-19 vaccine and a booster.Book online or find a walk-in centrehttps://t.co/oTQtfxijja https://t.co/6yINr5v9or,en
2022-01-01 14:01:44+00:00,872744452728770560,Do you still have concerns about taking the COVID-19 vaccine?Please contact us via our Helpline at 0771 002 2382 or you can read our Covid-19 Vaccines Event Report: https://t.co/qbrxnYsxPr https://t.co/Pytz1G2NiS,en
2022-01-01 14:01:37+00:00,539724759,"""the Quebec government could have begun using rapid tests earlier, improved access to N95 masks, and made third doses of COVID-19 vaccines available faster to more people, particularly health-care workers."" Also, prov govs could have helped our hospitals YEARS AGO #CAQ",en
2022-01-01 14:01:09+00:00,1284998126202425344,"@Alison02315173 @Hetty2 @SoloCynic @GBNEWS @Nigel_Farage When the ""flu"" a was new it killed indiscriminately. It's been around for centuries, so we've had enough time to build some immunity and an effective vaccine, and yet it still kills. Covid-19 is not the flu 🙄",en
2022-01-01 14:01:02+00:00,515463027,🙌  for our great team in #Lebanon🇱🇧 who supported a #COVID-19 vaccine marathon by: 📱 Getting people registered for the vaccine.📢 Providing awareness sessions about possible side effects.🚐 Transporting people to vaccination centers. #VaccinesSaveLives https://t.co/DBRabASiRL,en
2022-01-01 14:01:01+00:00,2996801,"The top science stories of the year, picked by @laurahelmuth: 💉 COVID-19 and malaria vaccines🧬 Success of CRISPR🪲 Cicadas emerge from underground🚀 Discoveries on Mars🔭 James Webb Space Telescope launch🎶 Lemurs with rhythm https://t.co/xHQdmBCqkT",en
2022-01-01 14:00:49+00:00,23189415,Let's stay safe-Test before meeting people-Open windows to let fresh air in when friends and family are over-Wear a face covering when required-Get your Covid-19 booster vaccine if you're over 18- Isolate if you get a positive test#KeepBexleySafe https://t.co/t2bKVcFX9H,en
2022-01-01 14:00:37+00:00,11866582,Covid-19 is basically a Biblical plague. The vaccines are essentially a Biblical miracle. But guess which one the guys who pretend to live by the Bible are fighting.,en
2022-01-01 14:00:30+00:00,329708571,"The Covid-19 booster vaccine is available to every adult in the country, because two doses do not give you enough protection against catching Omicron. More info is here: https://t.co/LqIv2Gg4BE https://t.co/SexliOfM09",en
2022-01-01 14:00:11+00:00,13117042,Novavax said the data package is the last requirement before the company formally submits its emergency-use application next month to become the fourth U.S. COVID-19 vaccine. https://t.co/YELDW7sRPt,en
2022-01-01 14:00:03+00:00,221787025,"Every adult in the country now needs to get a Covid-19 booster vaccine, because two doses does not give you enough protection against catching Omicron.https://t.co/bdYhlEefBW https://t.co/j06BA9ISlw",en
2022-01-01 14:00:00+00:00,237460655,"Happy New Year! Schedule your COVID-19 vaccine, booster shot, or flu shot now. You can find the soonest available appointment near you by visiting: https://t.co/jfkDeCJ4Bw https://t.co/zpEGhCXdk3",en
2022-01-01 13:59:21+00:00,149271152,"@phoTomics @PoliticsForAlI @GOVUK I'd like people to realise it's not all about vaccines.Single dose ineffective.Booster effectiveness fades in a couple of months.Basic hand, face, space and ventilation likely to be crucial in limiting resurgence going forward until COVID-19 is a non threat all together.",en
2022-01-01 13:59:17+00:00,2547606713,"@Dr_Franks_ @JackPosobiec So far, there is no scientific evidence available that suggests spike proteins created in our bodies from the COVID-19 vaccines are toxic or damaging our organs,” experts at the Meedan......see this key STATEMENT ""SO FAR"" at time of article and since there has been proof",en
2022-01-01 13:59:11+00:00,626288465,Shocking and horrifying: a man has set himself and his car on fire in front of horrified diners while screaming about Victoria's Covid-19 vaccine mandates.https://t.co/zKsdkZK8sM,en
2022-01-01 13:59:06+00:00,8940342,From February 2021: The Houston vaccine expert has spent his whole life preparing for a battle like the one he’s found himself in since COVID-19 first came on the scene. https://t.co/vUod7X9HZb,en
2022-01-01 13:59:05+00:00,34713362,Here's how African leaders are working together to ensure a repeat of the Covid-19 vaccine shortfalls https://t.co/PYClVXWq9V,en
2022-01-01 13:58:37+00:00,840203017,"@JanBenninkCom Toevallig was #Moderna ook bezig met een griep/corona combovaccin in één 14 april 2021👇""Moderna's CEO shares his strategy to develop a 'world-changing' single vaccine that protects against COVID-19, the flu, and other respiratory illnesses"" Bron : https://t.co/m5dyFVUPXP🤡",en
2022-01-01 13:58:19+00:00,193507129,"Missouri to end COVID-19 state of emergency, citing effectiveness of vaccinehttps://t.co/gISl6ziFeN",en
2022-01-01 13:57:30+00:00,960133322600001536,"Omicron variant and vaccines: “Protection against hospitalisation is much greater than that against symptomatic disease, in particular after a booster dose, where vaccine effectiveness against hospitalisation is close to 90%”. #Omicron #Covid_19 #vaccine  https://t.co/GbGZbmua7P",en
2022-01-01 13:57:08+00:00,948579104881889280,The Covid-19 Booster Vaccine is now available to all 16 years and older. Head over to https://t.co/IAqy3Lqq9R to arrange an appointment that suits you! 💙#StratusHealthcare #BoosterVaccine https://t.co/CMTGI9oTuI,en
2022-01-01 13:56:15+00:00,1446569519493881861,Young Men More Likely to Get Heart Inflammation After Pfizer’s Booster Than COVID-19: Study Vaccines have  been pulled for less deaths.  https://t.co/GLq6sKxVPq,en
2022-01-01 13:56:06+00:00,990043728344748036,"#Ontario Makes Fourth Dose of #COVID19 Vaccine Available for SeniorsThe fourth dose of the COVID-19 vaccine is now available for long-term care residents and other senior citizens, if three months have passed since they received their third dose.#SaturdayThoughts https://t.co/cMeR6yoFxq",en
2022-01-01 13:55:50+00:00,1441892446946824194,The Infowars host Alex Jones slammed Trump's social-media network and called him 'pathetic' for supporting the COVID-19 vaccine https://t.co/PfoAyddC3u via @YahooNews,en
2022-01-01 13:55:41+00:00,3021660689,Studies indicate J&amp;J Covid-19 vaccine booster protects people against severe illness from Omicron variant https://t.co/uGgm3QgFJX https://t.co/ZwlzVY7fCd,en
2022-01-01 13:55:40+00:00,1350965127311486976,"United States Marine Corps kicks out 206 soldiers who refused to take COVID-19 vaccine, which amounts to a tiny percentage of its overall manpower. https://t.co/aOB56J5fxa",en
2022-01-01 13:55:09+00:00,533420902,If you’re not watching this historic interview you should be. #RobertMalone #vaccines #Covid_19,en
2022-01-01 13:55:05+00:00,1352762523540455424,"@US_FDA @CDCgov @POTUS So now it's projected that a Covid-19 vaccine shot for kids won't be available until mid 2022??? Pfizer isn't end all be all you crooks. In the mean time, a FULLY peer reviewed traditional vaccine already has data on children 2-18. #Covaxin.Do what's right!",en
2022-01-01 13:55:04+00:00,1310605525743214592,Antigua and Barbuda’s government mandated that all frontline workers take their booster shots of the coronavirus (COVID-19) vaccine.Read more: https://t.co/aDBE0JDIYS https://t.co/h1p8nC0olg,en
2022-01-01 13:54:39+00:00,1277742358273101827,"I'm at COVID-19 Vaccine Center in Khobar, Ash Sharqiyah https://t.co/mHiHPi3Gtg",en
2022-01-01 13:53:22+00:00,1476742116,#CDCHere are the different typesof #Vaccines for Covid-19 that are available...🤔Please comment and tell us if you are:A) fully vaccinatedB) hessitant on getting itC) refusing to get vaccinatedhttps://t.co/o7IaveKIMBLIKE ▪️ SHARE ▪️ FOLLOW,en
2022-01-01 13:51:40+00:00,1309140984522067970,@ChrisMZiegler I have important security update to implement at one of your government facilities and I will absolutely refuse to travel there to implement it until you get COVID-19 under control and implement vaccine mandate. So good luck with that.,en
2022-01-01 13:50:57+00:00,802811168,"@frances_freedom @RealTenille Subtweeting now, because I had to block FrancesFreedom due to spreading mis/dis-information on COVID-19 vaccines and just being an all-around jerk to people like me &amp; Tenille. Targeting kids did not occur &amp; there is more to this than FF is saying for those of you in the back.",en
2022-01-01 13:49:57+00:00,1313707184497274880,"The vaccine has been known as the Pfizer-BioNTech COVID-19 Vaccine, and will now be marketed as Comirnaty, for the prevention of COVID-19 in individuals 16 years of age and older.https://t.co/e8qbZSLcVT",en
2022-01-01 13:49:56+00:00,1313707184497274880,"At the end of the commercial they snuck in “vaccine approved for people 16 &amp; older”…can you say comirnaty?!August 23, 2021, FDA announced the first approval of a COVID-19 vaccine.",en
2022-01-01 13:49:09+00:00,1276495633520754689,"India gives 500,000 doses of Covid-19 vaccines to Afghanistan https://t.co/jJjQfCl2Ms",en
2022-01-01 13:48:53+00:00,3310578835,"Aaron Siri, a lawyer working on the case asking the FDA to release documents tied to the approval of the Pfizer-BioNTech COVID-19 vaccine on behalf of the Public Health and Medical Professionals for Transparency (formed by a group of doctors and scientist…https://t.co/v1KgXIcaGQ",en
2022-01-01 13:48:45+00:00,192768513,Trump’s comments touting COVID-19 vaccines spark anger among his loyal supporters - National | https://t.co/cuxc5lXfah https://t.co/0hN6qR9AZP,en
2022-01-01 13:47:25+00:00,1456816671742644228,Fired News Anchor Wendy Bell Sues Station For Discrimination https://t.co/L9MgNF6hiJ via @YouTube @cenkuygur go watch her show now. Her and adore would be perfect together. #wbr #vaccine #Covid_19 #Fauci,en
2022-01-01 13:47:01+00:00,1085621883121397761,United States Food and Drug Administration: Fast-Track Emergency Use Approval of the NOVAVAX NVX-CoV2373 COVID-19 Vaccine - Sign the Petition! https://t.co/QIkAZXkO8x via @Change,en
2022-01-01 13:46:22+00:00,1264229969691058181,Israel approves fourth COVID-19 vaccine dose for some https://t.co/3fFrF85cGF,en
2022-01-01 13:45:50+00:00,157484511,COVID-19 vaccines don’t destroy T cells or weaken immune system | AP News https://t.co/VNRTbixrCb,en
2022-01-01 13:44:05+00:00,860581310,Book COVID-19 Vaccine Appointment | Flu Shots &amp; Immunizations - https://t.co/fum4n2jmJ2 https://t.co/UscGHYimNn,en
2022-01-01 13:44:02+00:00,2488774495,"Dive into our Data in the Time of #COVID19 page to explore COVID-19 sources on data transparency, use, and more, including a new special section on vaccine distribution. https://t.co/Sscp3ca3RF https://t.co/RmwWSadJC6",en
2022-01-01 13:42:55+00:00,1281758467036811264,Israel starts administering fourth COVID-19 vaccine doses - https://t.co/9zy37kUfCI,en
2022-01-01 13:42:54+00:00,360220091,Israel starts administering fourth COVID-19 vaccine doses - https://t.co/yq9ofUXtx6,en
2022-01-01 13:42:41+00:00,1231969173737111552,Marines kick out 206 troops for refusing Covid-19 vaccine https://t.co/YoYSNQWpSD via @politico,en
2022-01-01 13:42:04+00:00,4507521,"Translation: ""I want your money""""He's been right on everything except this issue... When everyone I know dies, you are getting the blame, President Trump!""-- radio host Wayne Allyn Root, on the former president's support for COVID-19 vaccines",en
2022-01-01 13:42:03+00:00,283604227,New US COVID-19 vaccine receives emergency approval in India https://t.co/yEGBgoADw3 https://t.co/wXWiPlQOwj,en
2022-01-01 13:41:38+00:00,850472577667616770,"CRO-MAGS’ HARLEY FLANAGAN Defends Decision To Get COVID-19 Vaccine, Blasts ‘Conspiracy Theorists’  CRO-MAGS frontman Harley Flanagan has defended his",en
2022-01-01 13:41:20+00:00,739055189517307904,"@joinve1 @CryptoBull2020 The country has one of the world's highest COVID-19 vaccination levels, with about 78 percent of those ages 12 and older fully vaccinated, mostly with the Pfizer vaccine. At the same time, Israel now has one of the highest infection rates in the world lol",en
2022-01-01 13:40:48+00:00,1157090115912552448,Alex Jones slammed Trump's social-media network and called him 'pathetic' for supporting the COVID-19 vaccine https://t.co/eMra9O4Wqe,en
2022-01-01 13:40:05+00:00,19489239,"Corbevax, a new COVID-19 vaccine developed by the Texas Children's Hospital and Baylor College of Medicine, has received emergency approval on Tuesday to be administered in India.#COVID19 | #Vaccine | #Indiahttps://t.co/gF4ekWbxCR",en
2022-01-01 13:38:24+00:00,1305178132341764098,"@Sci_Phile @elonmusk Musk is also saying that both are thinking ""why aren't they dead yet"" about the other because both have unrealistic views about the a) danger of taking the vaccine, b) the death rate from COVID-19.  2/n",en
2022-01-01 13:38:23+00:00,5510112,CDC Sued for Withholding Post-Licensure V-safe Data on COVID-19 Vaccines https://t.co/IJi9XAEnt1 #TheShare via @TheShare,en
2022-01-01 13:37:28+00:00,1339601184722571267,Find health centre close to you with COVID-19 vaccine available and get vaccinated!,en
2022-01-01 13:35:09+00:00,17593806,How to carry your COVID-19 vaccine card on your phone https://t.co/cCJk3foQsD via @flipboard,en
2022-01-01 13:35:02+00:00,87597196,"Louisiana COVID-19 hospitalizations double in one week, vaccines urged https://t.co/Z9y5aEig2q https://t.co/rKNdWJJmyP",en
2022-01-01 13:34:39+00:00,195658009,@ndtv Increase #Covid_19 cases reflect that ineffective vaccines being injected to citizens and ultimately blaming people not wearing f*kin mask.#Vaccine,en
2022-01-01 13:34:32+00:00,3314172961,"India gives 500,000 doses of Covid-19 vaccines to Afghanistan https://t.co/s4fdJOcbn8",en
2022-01-01 13:34:31+00:00,100001851,"India gives 500,000 doses of Covid-19 vaccines to Afghanistan https://t.co/jUfURMRpCF",en
2022-01-01 13:34:30+00:00,1230729569080004609,"India gives 500,000 doses of Covid-19 vaccines to Afghanistan https://t.co/9N34JvrdlA",en
2022-01-01 13:34:28+00:00,848293759850774531,Tokyo researchers work toward 'dream' COVID-19 vaccine that gives protection for life | The Japan Times https://t.co/BSDWleDFAe,en
2022-01-01 13:34:12+00:00,901020478747312129,Open a Public Inquiry into Covid-19 Vaccine Safety - Petitions https://t.co/oJ6XGMqa9g,en
2022-01-01 13:34:00+00:00,3313946418,"Where people dying of Covid-19 has changed since vaccines became widely available. Death rates fell in most counties across the country, and in about one in five counties, the death rate fell by more than half. But in about one in 10 counties, death rates have more than doubled.",en
2022-01-01 13:33:43+00:00,921132128993193984,Fourth COVID-19 vaccine approved in Israel for most vulnerablehttps://t.co/CDJFW2Cj5W,en
2022-01-01 13:33:29+00:00,1061745306151346176,So it's a new year and only thing I hope is a new way of distributing covid-19 vaccines so we wouldn't stuck in this vicious cycle of variants/boosters. It basically sucks.,en
2022-01-01 13:30:22+00:00,1451304226051837956,Vaccines minimize the risk... People with COVID-19 infections may age much faster https://t.co/nreTwso9Qr,en
2022-01-01 13:30:07+00:00,872744452728770560,"Are you unsure of whether you are eligible for the COVID-19 booster vaccines? We recommend that you find out more here: https://t.co/4tlZsfThjwLet us fight this pandemic together. If you need any further support, email: help@cahn.org.ukYouTube: https://t.co/syXnEupd8R https://t.co/aFMKyPiWzc",en
2022-01-01 13:30:02+00:00,1192791243396440067,"In the news today: World Health OrganizationSpecialized agency of the United NationsCovid-19: WHO chief optimistic disease will be beaten in 2022Discussions underway for WHO approval for Corbevax Covid-19 vaccine, says developer #WorldHealthOrganization",en
2022-01-01 13:30:00+00:00,1331838258,This organization run by a Harvard University grad from Ancaster is educating thousands of students about the COVID-19 vaccinehttps://t.co/Q3XGafqtQb https://t.co/X7qCuQVb2U,en
