date,userid,tweet,lang
2022-05-23 14:33:18+00:00,815285747645288449,"""Three cadets at the U.S. Air Force Academy who have refused the COVID-19 vaccine will not be commissioned as military officers but will graduate with bachelor’s degrees, the academy said Saturday."" via @PoliticsSun https://t.co/uEcOIAWYZa",en
2022-05-23 14:33:06+00:00,2765561,Pfizer and BioNTech: Covid-19 vaccine 80.3 percent effective in kids under 5 https://t.co/Zin8TiaM4c https://t.co/gVEgZkARH7,en
2022-05-23 14:33:02+00:00,434064748,"U.S. FDA sets June meeting dates for Moderna, Pfizer small children COVID-19 vaccines https://t.co/x6XqoH68sE via FXEmpire #forex #fx",en
2022-05-23 14:33:00+00:00,14267944,"Three doses of Pfizer’s COVID-19 vaccine offer strong protection for children younger than 5, the company announced Monday. Pfizer plans to give the data to U.S. regulators later this week in a step toward letting the littlest kids get the shots.  https://t.co/3tMibx3Cdm",en
2022-05-23 14:32:22+00:00,2587449458,"@PMOIndia @narendramodi Due to doses of covid vaccine ,people of India saved from covid 19 new cased ,thanks to Hon'ble Prime Minister",en
2022-05-23 14:31:51+00:00,16340908,"Pfizer-BioNTech COVID-19 Vaccine Demonstrates Strong Immune Response, High Efficacy and Favorable Safety in Children 6 Months to Under 5 Years of Age Following Third Dose via @pfizer https://t.co/3XZyinhgN5",en
2022-05-23 14:31:38+00:00,14592411,"Three doses of Pfizer's COVID-19 vaccine offer strong protection for children younger than 5, the company announced Monday https://t.co/BYS4xGxNKS",en
2022-05-23 14:31:36+00:00,629084145,Pfizer Says Its 3-Dose COVID-19 Vaccine Saw Strong Immune Response in Kids Under 5 - CNET https://t.co/8wRrjqNzfx,en
2022-05-23 14:31:30+00:00,1443124912038858752,"@taz81 @JeremyVineOn5 US neurosurgeon: 'The COVID-19 pandemic is one of the most manipulated infectious disease events in history, characterized by official lies in an unending stream.'#covid19 #vaccine #covidvaccine https://t.co/uSHG93PMmc",en
2022-05-23 14:31:24+00:00,2165456221,"Pfizer-BioNTech's COVID-19 vaccine appears to be safe and effective for children ages 6 months to 5 years, according to a company study released early Monday. https://t.co/eDTFjbRMIs",en
2022-05-23 14:30:41+00:00,883382034638540803,Arizona Gov. Doug Ducey signed multiple bills on Friday banning COVID-19 vaccine mandates in schools and mask mandates in state or local government buildings https://t.co/YR0DQey6oo,en
2022-05-23 14:30:39+00:00,130627782,Pfizer says three small doses of its COVID-19 vaccine protect kids under 5 and that it plans to give the data to U.S. regulators later this weekThe 18 million children under 5 are the only group in the U.S. not yet eligible for COVID-19 vaccination:https://t.co/4amGaeIJyE,en
2022-05-23 14:30:35+00:00,18956073,"The COVID-19 vaccine-maker Pfizer-BioNTech said Monday that its three-dose vaccine was about 80% effective in preventing symptomatic infection in children under 5, meaning shots for the youngest population could come within weeks.https://t.co/Xd9BoEObBR",en
2022-05-23 14:30:24+00:00,213057317,"Ukrainians “are exempt from Canada’s COVID-19 vaccination entry requirements.” Refugees may be subject to tests and quarantines, but they are not required to receive the COVID vaccine to travel about the country freely. https://t.co/IgvpOvYCWD",en
2022-05-23 14:30:19+00:00,629514737,"#coronavirus #COVID__19 #antibodytest #facemasks #variantecovid  #vaccines #nanotechnology  #therapy #FDA #antibody #NextGen #drugs #AstraZeneca  #variants #medical_student #kids #pandemia #cancerFollow &amp; RT, please.https://t.co/RjJMN2iahN",en
2022-05-23 14:30:15+00:00,51685991,Council delivers covid-19 vaccine clinic updateshttps://t.co/wDwomOMFKq https://t.co/cdeAac0OyF,en
2022-05-23 14:30:13+00:00,95153908,@AburrallB @medwoman1 @Bryan_E_Zeiner @dqschmidt15 @SapienWoman @Welches @Badams820 @kim_because @VinceGottalotta @PatricktheB @ahrehead @AnthonyT2_ @TheLivingKira @KitemanArgues @megafant1 @flightmedic711 @GreenGuerilla1 @vixmcintyre @MJB24681 @bitterclingerpa @Emissarius2 @Lakewoodhocker1 @IMudlet @JGainsbourgh @Arachne646 @43Cyoa @AdorablePodcast @ziggywilde @Viktor_Renquist @WorkersUtopia @BrianNazarenus @Friendof_Darwin @NOONEPOTUSMEMES @NopeNopeJustNo_ @Erg24G @JoaniePhotos @giddy_bunny @QuidRises @_CallmeShelly_ @thlong20 @SockPuppetTruth @rjocore989 @WhoaDanWhoa @Cerulea78083156 @ms_julialee @MurphyYuiko @triadaxiom @LolLolcats99 Yet US Government is invested in Moderna. COVID-19 vaccine even with a shared patient 🙄,en
2022-05-23 14:30:13+00:00,40943042,"Pfizer-BioNTech's COVID-19 vaccine appears to be safe and effective for children ages 6 months to 5 years, according to a company study released early Monday. https://t.co/YlK48mEmVx",en
2022-05-23 14:30:06+00:00,20528383,"Three doses of Pfizer’s COVID-19 vaccine offer strong protection for children younger than 5, the company announced Monday.  https://t.co/B938lGxAgw",en
2022-05-23 14:30:03+00:00,15974185,FDA lifts hold on Ocugen's COVID-19 vaccine trial. But is it too late for the shot? https://t.co/8lJEbns2Tv,en
2022-05-23 14:30:02+00:00,108617488,"U.S. FDA sets June meeting dates for Moderna, Pfizer small children COVID-19 vaccines - https://t.co/49kdJu1a3z",en
2022-05-23 14:30:00+00:00,239861560,NEW: Pfizer says its three-dose vaccine is 80% effective against symptomatic omicron COVID-19 infection among children 6 months to under 5 years old.https://t.co/X38MbNEjyW,en
2022-05-23 14:29:22+00:00,2256940704,Republican bill defends service members against 'coercive' Covid-19 vaccine policies https://t.co/wsKHFgMYtX,en
2022-05-23 14:29:18+00:00,2412555163,"Three-dose Covid-19 vaccine produces strong immune response in children ages 6 months to 5 years, Pfizer and BioNTech say https://t.co/P6l40LuVn9",en
2022-05-23 14:29:05+00:00,910050092744302592,"Pfizer-BioNTech COVID-19 Vaccine Demonstrates Strong Immune Response, High Efficacy and Favorable Safety in Children 6 Months to Under 5 Years of Age Following Third Dose https://t.co/1SpwtfwnYs #AI #AINews #AiThority #News #Artificialintelligence #COVID19",en
2022-05-23 14:28:14+00:00,1379060515872333828,WKTV: Pfizer says three small doses of its COVID-19 vaccine protect kids under 5 and that it plans to give the data to U.S. regulators later this week. https://t.co/x08GitvEWh,en
2022-05-23 14:28:05+00:00,629514737,"#coronavirus #COVID__19 #antibodytest #facemasks #variantecovid  #vaccines #nanotechnology  #therapy #FDA #antibody #NextGen #drugs #AstraZeneca  #variants #medical_student #kids #pandemia #cancerFollow &amp; RT, please.https://t.co/nGgMETMIpS",en
2022-05-23 14:27:48+00:00,1173924760528416777,MAG-INGAT SA FAKE COVID-19 VACCINE#TeamZNPPO#TeamPNP#PNPKakampiMo#PNPWeServeAndProtect https://t.co/ZhpfTt5s0r,en
2022-05-23 14:27:27+00:00,512384180,American Airlines Pilot Bob Snow Says the COVID-19 Vaccine Led to His Cardiac Arrest Minutes After Landing a Plane w/ 200+ Passengers. https://t.co/StUMb9UHlD,en
2022-05-23 14:27:10+00:00,2879135130,Ever wondered how #COVID19 impacted the Sudanese church?Watch how St. George Orthodox Church managed COVID-19 precautions and vaccine procedures.  https://t.co/0KWHULUVba #Sudan https://t.co/Pdavb2X3wK,en
2022-05-23 14:27:07+00:00,1173924760528416777,MAG-INGAT SA FAKE COVID-19 VACCINE#TeamZNPPO#TeamPNP#PNPKakampiMo#PNPWeServeAndProtect https://t.co/uwKk6svHmu,en
2022-05-23 14:26:44+00:00,1173924760528416777,MAG-INGAT SA FAKE COVID-19 VACCINE#TeamZNPPO#TeamPNP#PNPKakampiMo#PNPWeServeAndProtect https://t.co/GcezzQ5k8H,en
2022-05-23 14:26:37+00:00,821951011220844545,"Today, Pfizer-BioNTech announced its covid-19 vaccine for children under 5 was 80.3% effective at preventing symptomatic infection. Read more about why it's taken so long to develop a vaccine for children under 5 and how this compares to Moderna's vax: https://t.co/hY19fervVq",en
2022-05-23 14:26:35+00:00,43087079,"Top story: Pfizer vaccine: Three-dose Covid-19 vaccine produces strong immune response in young children, Pfizer and BioNTech say - CNN https://t.co/kX1eTbOi2n, see more https://t.co/jy7weSBZEw",en
2022-05-23 14:26:29+00:00,1443124912038858752,"US neurosurgeon: 'The COVID-19 pandemic is one of the most manipulated infectious disease events in history, characterized by official lies in an unending stream.'#covid19 #vaccine #covidvaccine https://t.co/uSHG93PMmc",en
2022-05-23 14:25:51+00:00,629514737,"#coronavirus #COVID__19 #antibodytest #facemasks #variantecovid  #vaccines #nanotechnology  #therapy #FDA #antibody #NextGen #drugs #AstraZeneca  #variants #medical_student #kids #pandemia #cancerFollow &amp; RT, please.https://t.co/u84j4NzyVJ",en
2022-05-23 14:25:45+00:00,1405969311341199364,"$PFE, $BNTX Three-dose Covid-19 vaccine produces strong immune response in children ages 6 months to 5 years, Pfizer and BioNTech say.",en
2022-05-23 14:24:14+00:00,1311004650858934272,Pfizer says children under 5 can get 3 low-dose versions of its COVID-19 vaccine https://t.co/qD5bbRRw5I,en
2022-05-23 14:24:06+00:00,82144335,"Three doses of Pfizer’s COVID-19 vaccine offer strong protection for children younger than 5, the company announced Monday. Pfizer plans to give the data to U.S. regulators later this week in a step toward letting the littlest kids get the shots. https://t.co/t7x7d2sksF",en
2022-05-23 14:23:51+00:00,805872552690249732,"Three doses of Pfizer's COVID-19 vaccine offer strong protection for children younger than 5, the company announced Monday. Pfizer plans to give the data to U.S. regulators later this week in a step toward letting the littlest kids get the shotshttps://t.co/cJ7EwE2a5A",en
2022-05-23 14:22:29+00:00,16702346,"UK Pharmacy Services now offering COVID-19 boosters for kids ages 5-11 at our vaccine clinic in Lexington - UK Pharmacist Care Clinic, at 245 Fountain Court, Room 220. Appointments are strongly recommended and can be made at https://t.co/RDECi5yn2x.https://t.co/vhMMFXW1I3",en
2022-05-23 14:21:34+00:00,535563233,"U.S. FDA sets June meeting dates for Moderna, Pfizer small children COVID-19 vaccines https://t.co/LM5jGi9n9G",en
2022-05-23 14:20:28+00:00,562068729,"Do you have questions about vaccinating your child against Covid-19? Join the Pediatric Vaccines Forum this Wednesday, 5/25, at 5:30pm. Register at: https://t.co/FwBaZEFIMl",en
2022-05-23 14:20:00+00:00,860551547079602176,"Three doses of Pfizer’s COVID-19 vaccine offer strong protection for children younger than 5, the company announced Monday. Pfizer plans to give the data to U.S. regulators later this week in a step toward letting the littlest kids get the shots. https://t.co/vksd03FhxA",en
2022-05-23 14:20:00+00:00,34923953,"Three doses of Pfizer’s COVID-19 vaccine offer strong protection for children younger than 5, the company announced Monday. Pfizer plans to give the data to U.S. regulators later this week in a step toward letting the littlest kids get the shots. https://t.co/HjwoC6rmib",en
2022-05-23 14:19:45+00:00,226341400,"As COVID-19 changes, should vaccines also evolve? https://t.co/dDZwI9NfEZ via @NJSpotlightNews",en
2022-05-23 14:19:06+00:00,103229204,"COVID-19 in the US - a tragedy ignored, Four COVID-death peaks: the failure of the US anti-epidemic policy; WHO okayed vaccines including CanSinoBIO jab https://t.co/KKJJrj5tuj",en
2022-05-23 14:19:05+00:00,1142845795,"Three child-size doses of the Pfizer/BioNTech Covid-19 vaccine appeared to be safe and showed a strong immune response in children ages 6 months to 5 years, the companies said.  https://t.co/l7feCEG7IX https://t.co/9vnVpsLr2P",en
2022-05-23 14:17:47+00:00,1481219576839163912,"@narendramod @PMOIndia Respected PM Modi ji,   Could you please have COVID-19 vaccine roll out for kids who are below 12 years? Next academic year is about to start and most of the schools have been insisting for face-to-face classes. But we are worried without vaccine.",en
2022-05-23 14:17:42+00:00,18956073,"The COVID-19 vaccine-maker Pfizer-BioNTech said Monday that its three-dose vaccine was about 80% effective in preventing symptomatic infection in children under 5, meaning shots for the youngest population could come within weeks.https://t.co/8v3q1uwwg9",en
2022-05-23 14:17:33+00:00,3764438176,@melmc31 @BoxxOfMeng @marcorubio @usairforce George Washington required his troops to receive smallpox inoculations to prevent disease spread and maintain readiness. COVID-19 is no exception to vaccination requirements. Vaccines are essential to military readiness.,en
2022-05-23 14:17:25+00:00,1258065426,"Top story: Pfizer vaccine: Three-dose Covid-19 vaccine produces strong immune response in young children, Pfizer and BioNTech say - CNN https://t.co/QP9MzlDkAV, see more https://t.co/NQjezLSXCi",en
2022-05-23 14:17:23+00:00,2155462266,"mt @SeqComplete : Three Doses of Pfizer’s Covid-19 Vaccine 80% Effective in Young Children, Company Says - WSJ https://t.co/YmrEYQ7Txx, see more https://t.co/7dwSMSR7Od",en
2022-05-23 14:17:22+00:00,97443804,"Top story: Pfizer vaccine: Three-dose Covid-19 vaccine produces strong immune response in young children, Pfizer and BioNTech say - CNN https://t.co/A7GOQUaePN, see more https://t.co/vT7i1mLUMk",en
2022-05-23 14:17:13+00:00,799712447741317120,"Pfizer, BioNTech report 80 percent efficacy of Covid-19 vaccine for youngest children https://t.co/fquGPA02cS",en
2022-05-23 14:16:59+00:00,612316971,"las noticias internacionales Pfizer vaccine: Three-dose Covid-19 vaccine produces strong immune response in young children, Pfizer and BioNTech say - CNN https://t.co/5nLqhS0as9, see more https://t.co/2OG6kr1mxZ",en
2022-05-23 14:16:11+00:00,107547335,Pfizer Says Its 3-Dose COVID-19 Vaccine Saw Strong Immune Response in Kids Under 5     - CNET https://t.co/fkNcAzaWGy,en
2022-05-23 14:15:14+00:00,1938169380,Free Pfizer COVID-19 Booster Vaccines for 5-11-Year-Olds at Select Hy-Vee Pharmacies https://t.co/N3ntHMvfdT https://t.co/5qjSzsBu3U,en
2022-05-23 14:15:14+00:00,114905327,MCHD's daily COVID-19 web page is updated on weekdays. More information is available on the West Virginia DHHR COVID-19 dashboard. Make an appointment for a COVID-19 vaccine online at https://t.co/ugxePMvllg or go to our website.More info: https://t.co/6rtjc06TV7 https://t.co/h9xmMK1EAG,en
2022-05-23 14:15:05+00:00,17147234,Free Pfizer COVID-19 Booster Vaccines for 5-11-Year-Olds at Select Hy-Vee Pharmacies https://t.co/NOBC4RoEd9,en
2022-05-23 14:15:02+00:00,876314690,Q: What should I expect after getting a COVID-19 vaccine? A: You may have short-term side effects after vaccination. These are normal and should go away in a few days. See the full answer here: https://t.co/bMuuzLJngJ,en
2022-05-23 14:15:02+00:00,31725397,Not sure why your child needs the COVID-19 vaccine if you’ve already been jabbed? Dr Kiran Morjaria explains why in this short video.Get you child protected – book an appointment at https://t.co/7yL1cnvBIA or by calling 119https://t.co/xj6H8hx3vh,en
2022-05-23 14:14:46+00:00,29213439,"Kankakee and Iroquois counties in Illinois are back at Medium  Community Levels for COVID-19. Stay up to date with COVID-19 vaccines. Get tested if you have symptoms. Wear a mask if you have symptoms, a positive test, or are indoors with groups of people. https://t.co/X55PCRY2hX",en
2022-05-23 14:14:09+00:00,48003020,Pediatric Pfizer COVID-19 vaccines have arrived in T&amp;Thttps://t.co/QfB97qITPb,en
2022-05-23 14:14:04+00:00,26014321,Pediatric Pfizer COVID-19 vaccines have arrived in T&amp;Thttps://t.co/54RiJiVfHW,en
2022-05-23 14:14:00+00:00,1022842723060117504,Children aged 5 to 11 are now eligible for the COVID-19 vaccine. Parents and guardians can book online. Visit https://t.co/5wiMgfRw4X for more information or to book online. https://t.co/x3RKHclixs,en
2022-05-23 14:13:58+00:00,36640929,"COVID-19: The LatestGlobal Numbers525,686,037 cases6,277,389 deaths11,444,311,044 vaccine doses administered—Source: Johns Hopkins University",en
2022-05-23 14:13:47+00:00,1480251158,"Three doses of Pfizer’s COVID-19 vaccine offer strong protection for children younger than 5, the company announced Monday. Pfizer plans to give the data to U.S. regulators later this week in a step toward letting the littlest kids get the shots. https://t.co/TgDuqL6RgJ",en
2022-05-23 14:13:31+00:00,33758144,"“Three U.S. Air Force Academy cadets who refused to take the COVID-19 vaccine will graduate the school this week, but will not be commissioned as U.S. military officers, according to the Air Force.” https://t.co/gMiMUBzS2S",en
2022-05-23 14:12:42+00:00,1386394427040706560,"About time we speed up the vaccinating of 5-11s?“Pfizer-BioNTech COVID-19 Vaccine Demonstrates Strong Immune Response, High Efficacy and Favorable Safety in Children 6 Months to Under 5 Years of Age Following THIRD Dose”https://t.co/4kA4gbwCKk",en
2022-05-23 14:12:14+00:00,937962626222497793,"U.S. FDA sets June meeting dates for Moderna, Pfizer small children COVID-19 vaccines https://t.co/3EtjWRUqSe",en
2022-05-23 14:10:09+00:00,4058194633,$OCGN FDA lifts hold on Ocugen's COVID-19 vaccine trial. But is it too late for the shot? https://t.co/5DgLcZdY7v,en
2022-05-23 14:10:03+00:00,1456029233566949387,Arizona governor OK’s ban on school COVID-19 vaccines https://t.co/n6qj0o9BsO,en
2022-05-23 14:09:04+00:00,209599290,💉COVID-19 vaccines and boosters are available across the state. The COVID-19 vaccine is free💉 Find vaccines at a DHEC clinic or health department near you at https://t.co/uooFYqgE0D.Find vaccine clinics from other providers at https://t.co/XyMaC6wUg2. https://t.co/RHwh9KjxMB,en
2022-05-23 14:08:40+00:00,3764438176,"@labellaluna11 Military members have to receive many vaccines in order to maintain military readiness. COVID-19 is no exception, except that wingnuts and antivaxxers have joined forces to lie about the pandemic, deaths, illnesses and the effectiveness of the vaccine.",en
2022-05-23 14:07:42+00:00,415783099,"Top story: Pfizer vaccine: Three-dose Covid-19 vaccine produces strong immune response in young children, Pfizer and BioNTech say - CNN https://t.co/MS6RtgHoKh, see more https://t.co/WjH9p1IlHm",en
2022-05-23 14:07:33+00:00,221518519,"Top story: Pfizer vaccine: Three-dose Covid-19 vaccine produces strong immune response in young children, Pfizer and BioNTech say - CNN https://t.co/Q2xkiIu5Nf, see more https://t.co/iST3sEHyId",en
2022-05-23 14:07:30+00:00,1313210887591743489,3 cadets at the U.S. Air Force Academy who have refused the Covid-19 vaccine will not be commissioned as military officers but will graduate... —NBC Newshttps://t.co/LkyrvzoxjM #covid #covid19,en
2022-05-23 14:07:04+00:00,16666806,Pfizer says 3 shots of COVID-19 vaccine for children under 5 about 80% effective https://t.co/21cEm3OhvA,en
2022-05-23 14:06:46+00:00,1596829382,Pfizer says 3 shots of COVID-19 vaccine for children under 5 about 80% effective https://t.co/dx19vI5F7L https://t.co/8wgyrxAoii,en
2022-05-23 14:06:32+00:00,55060090,Pfizer says 3 shots of COVID-19 vaccine for children under 5 about 80% effective https://t.co/S76yDV7KTn,en
2022-05-23 14:06:20+00:00,712926286591762433,Highly Cited Articles in #BiologyMDPISide Effects of mRNA-Based and Viral Vector-Based COVID-19 Vaccines among German Healthcare Workers https://t.co/k9kMZ2qRZj #mdpibiology via @Biology_MDPI adverse effects; BTN162 vaccine; ChAdOx1 COVID-19 vaccine; cross-sectional studies https://t.co/kJxpvJep0E,en
2022-05-23 14:06:08+00:00,1490057525001170948,COVID-19 and the Economics of Vaccine Development https://t.co/1Rj8pWOHJh,en
2022-05-23 14:05:25+00:00,557670851,"The ECDOH COVID-19 vaccine clinic will run today 5/23 at @SUNYECC South (4041 Southwestern Blvd (Bldg 7-Old DMV), Orchard Park, NY 14127) from 12-4pm. Full schedule at https://t.co/1LbO846mSe, or call 716-858-2929 for a Vax Visit.",en
2022-05-23 14:05:10+00:00,138418838,"Fighting Stigma — AstraZeneca's COVID-19 vaccine receives EMA approval for use as third-dose booster - PMLiVE: Vaxzevria is a 'viral vector' vaccine, a technology that is also used to create vaccines for other infectious diseases like flu, HIV and Ebola. https://t.co/8zj2Vi89Hl",en
2022-05-23 14:05:06+00:00,1408595849005916163,"People once respected Robert F, Kennedy Jr. because of his work championing the environment.It's sad to see what he's become.Fact Check: Event 201 isn’t evidence that authorities planned the COVID-19 pandemic https://t.co/HNk74muJkb via @HealthFeedback #vaccines #COVID19",en
2022-05-23 14:03:44+00:00,2237866994,"📞 Dial 211 to schedule your FREE ride to get your COVID-19 vaccination, provided by @lyft.@Louisiana211 &amp; @BCBSLAFound proudly partner to bring you the Ride United Vaccine Access Campaign. (All rides are subject to availability based on location.) https://t.co/vaypawt9ZH",en
2022-05-23 14:03:27+00:00,3937432521,🚨Vaccine Confidence Fund for Barnet VCFSEs🚨Grants up to £20k for VCFSEs working within the target areas of this fund for projects to support covid-19 vaccine take-upDeadline: Friday 17th June 5pmFor details visit:👉 https://t.co/MwzNhhLldm#BarnetTogether #Covid19 https://t.co/BjgbmMkYxb,en
2022-05-23 14:03:12+00:00,140831396,"📞 Dial 211 to schedule your FREE ride to get your COVID-19 vaccination, provided by @lyft. @Louisiana211 &amp; @BCBSLAFound proudly partner to bring you the Ride United Vaccine Access Campaign. (All rides are subject to availability based on location.) https://t.co/7B9qfJs69S",en
2022-05-23 14:03:10+00:00,89669403,Coronavirus: Pfizer says 3 COVID-19 vaccine doses protect children under 5   https://t.co/JW2dCj7ui6,en
2022-05-23 14:03:06+00:00,18472450,"Three doses of Pfizer’s COVID-19 vaccine offer strong protection for children younger than 5, the company announced Monday. Pfizer plans to give the data to U.S. regulators later this week in a step toward letting the littlest kids get the shots. https://t.co/3xo1Y7lsKf",en
2022-05-23 14:03:03+00:00,117793973,"Faith in Vaccine Walk-Up Vaccination Sites are available for 1st dose, 2nd dose, and boosters. Pfizer vaccines for residents 12 years and older will be available at the walk-up vaccination sites listed. Visit: https://t.co/iYybX7ra0s to learn more about the COVID-19 vaccine. https://t.co/M4rBFFS1Nc",en
2022-05-23 14:03:00+00:00,27706099,"NEW: Three doses of Pfizer's COVID-19 vaccine offer strong protection for children younger than 5, the company announced Monday.https://t.co/2gUzh2YUTv",en
2022-05-23 14:02:58+00:00,25560065,The FDA has lifted the clinical hold it had on a Chester County company's clinical trial for a Covid-19 vaccine.  https://t.co/KMU2j8fII9,en
2022-05-23 14:02:52+00:00,90705306,Ask the expert: I hear COVID-19 symptoms are milder for children. Why should they receive the vaccine?https://t.co/YorAaKdiL5,en
2022-05-23 14:02:46+00:00,227402983,All Nunavummiut five years old and older are eligible to receive a COVID-19 vaccination. For Nunavummiut 18 and older. Booster shots are available to adults 4.5 months following the second dose of the vaccine and for those aged 12 to 17 six months after the second dose. https://t.co/QDhXRZWYSj,en
2022-05-23 14:02:10+00:00,1375010074838642690,"A while back, we hosted a panel discussion with journalists and a vaccinologist, who share dtheir do’s and don’ts of COVID-19 vaccine misinformation reporting. #ListenHere | https://t.co/DSgPRGd18q#COVID19 #vaccines #reporting #journalism",en
2022-05-23 14:01:24+00:00,593906865,"Approval of COVID-19 vaccines for kids ages 6 months - 5 years is nearing: FDA is in process of receiving applications from Pfizer and Moderna, with authorization possible in June.  #ImmunizeUnder5s https://t.co/JMdRgNyw40",en
2022-05-23 14:01:23+00:00,993257262,"❗ The COVID-19 vaccinations unit in Yeadon Way, Blackpool, will be closed for maintenance tomorrow (Tuesday 24 May)❗Anyone who visits the site for a vaccine will be directed to alternative locations. The centre will reopen on Wednesday (25 May) as normal. https://t.co/soGT1z9hUF",en
2022-05-23 14:01:03+00:00,1242205099222536193,Pfizer and BioNTech said that they have submitted an application to the US Food and Drug Administration for emergency use authorization of a booster dose of Covid-19 vaccine for children 5 through 11.,en
2022-05-23 14:01:03+00:00,100453427,Get your COVID-19 vaccine on Thursday the 26th May in Dartmouth!Please see the graphic for the full details. https://t.co/wGYBFo5gaL,en
2022-05-23 14:00:51+00:00,1449083262408740866,Pfizer on Monday said research shows its COVID-19 vaccine is about 80 percent effective for children five years old to six months old after a third dose.Read more: https://t.co/vu1NsnWthZ https://t.co/TpiKPnbwZg,en
2022-05-23 14:00:50+00:00,324914276,Pfizer-BioNTech share three-dose data for COVID-19 vaccine in children under five https://t.co/S9GhJlF2Eg,en
2022-05-23 14:00:47+00:00,208120290,"Should you be worried about reports of side effects for the COVID-19 vaccines made to the Vaccine Adverse Event Reporting System, or VAERS? Here’s Dr. Peter Marks with the answer… https://t.co/Th2nm0WYcG",en
2022-05-23 14:00:25+00:00,16950863,Parkland Hospital offering free COVID-19 testing and vaccines as cases increase https://t.co/FuySexCtGP,en
2022-05-23 14:00:15+00:00,24751297,"Pfizer-BioNTech's COVID-19 vaccine appears to be safe and effective for children ages 6 months to 5 years, according to a company study released early Monday. https://t.co/zoD9Awde18",en
2022-05-23 14:00:11+00:00,91087589,"Pfizer-BioNTech's COVID-19 vaccine appears to be safe and effective for children ages 6 months to 5 years, according to a company study released early Monday. https://t.co/ldrZoBfwJr",en
2022-05-23 14:00:11+00:00,21021385,"Pfizer-BioNTech's COVID-19 vaccine appears to be safe and effective for children ages 6 months to 5 years, according to a company study released early Monday. https://t.co/kUxNZsTaEr",en
