date,userid,tweet,lang
2022-02-16 19:00:47+00:00,1315640139939487745,Better late then never! Lets hope this gets rolled out speedily…COVID-19: All children aged 5-11 in UK will be offered coronavirus vaccine as England and Northern Ireland become latest nations to confirm plan https://t.co/YmYid7biqa,en
2022-02-16 19:00:26+00:00,1124329619715444737,"#Mythbuster -- No. Neither the authorized and recommended vaccines nor the other COVID-19 vaccines currently in clinical trials can cause you to test positive on viral tests, which are used to see if you have a current infection.​ @CDCgov Learn more here: https://t.co/a0mOx4jWGW https://t.co/Ih3rYMH3Dd",en
2022-02-16 19:00:22+00:00,928589530176815105,"A study led by Kimberly Nguyen, assistant professor in the @TuftsMedSchool, that analyzed COVID-19 vaccination coverage among adults found that those with previous diagnosis were less likely to have received the vaccine and were more reluctant to do so.https://t.co/KhqP5ZZ31T",en
2022-02-16 19:00:12+00:00,2344133054,"Know the facts! Getting vaccinated is fast, easy, and free. Anyone 5 years &amp; older can get a COVID-19 vaccine, regardless of insurance or immigration status. @CDCFound @thatlifetvshow https://t.co/8y7uCZYvsC",en
2022-02-16 19:00:06+00:00,190362469,"Ask the Doctor session will take place virtually on Friday, Feb. 18th from 1-2pm. Dr. Afsaneh Oliver a physician at Bridge Care Clinic, will address any questions or concerns you may have about the Covid 19 vaccine for adults and/or children. There is no need to register. https://t.co/jW5IdO3Whc",en
2022-02-16 19:00:02+00:00,242696106,The relatively short shelf life of AstraZeneca Plc’s COVID-19 vaccine is complicating the rollout to the world’s poorest nations.https://t.co/HsrhU5vpvm,en
2022-02-16 19:00:02+00:00,1358969828,"Getting the #COVID-19 vaccine is the best possible protection for you and your baby.It's not too late to get your first, second or booster vaccine.#VaccinesWork https://t.co/zIXTw1DoZ4",en
2022-02-16 18:59:48+00:00,43326045,What's not on the list is the MOST COMMON type of misinformation which is being passed through physicians in power and health agencies like CDC and IDPH. Like the myth that vaccines work 100% of the time to prevent transmission of covid-19. You can STILL GET AND SPREAD COVID-19.,en
2022-02-16 18:59:16+00:00,377016490,Houston-area health experts hope COVID-19 vaccine expansion breaks through apathy https://t.co/BNOXHVIHu1 via @houstonchron #hounews,en
2022-02-16 18:59:09+00:00,1211530358467903488,Ghana-Rwanda-Senegal-partner-biontech-to-produce-covid-19-tb-and-malaria-vaccines-in-Africa&gt;&gt;https://t.co/4xBbN6uHvH https://t.co/XT9jOatj0C,en
2022-02-16 18:59:05+00:00,208544381,"Regardless of your opinion on masks/vaccines/covid-19, can we agree that environmental impacts from a bunch of trucks idling are real? https://t.co/EXddbPOL9L",en
2022-02-16 18:58:49+00:00,720209792,@EmsleyColin @nadhimzahawi @sajidjavid @EssexPR Another one!https://t.co/OyDWscAryhPaediatric populationThe safety and efficacy of COVID-19 Vaccine AstraZeneca in children and adolescents (aged&lt;18 years old) have not yet been established. No data are available.@EssexPR  #COVID19 So why is being offered @sajidjavid ?,en
2022-02-16 18:58:39+00:00,1318949502347366403,"@sajidjavid you are an utter disgrace. God forgive you.Sajid Javid, the Health Secretary, said: 'I have accepted the advice from the independent JCVI to make a non-urgent offer of COVID-19 vaccines to all children aged five to 11 in England.’ #LeaveOurKidsAlone",en
2022-02-16 18:58:37+00:00,267781885,"All children aged five to 11 in England will be offered a Covid-19 vaccine, the UK government said Wednesday  https://t.co/R1eSy8c1Yt",en
2022-02-16 18:57:51+00:00,1454893544,@LoriAnnLothian @CandiceBergenMP Please show me that data as there was a recent poll that said 75% of Canadians want vaccine passports to remain for indoor dining and gatherings and 70% support mandatory vaccination for all adults. per the Covid-19 Monitor.,en
2022-02-16 18:57:32+00:00,2375841180,JUST IN -- Utah's House Business and Labor Committee approved HB63 on Tuesday.--It requires that employers exempt an employee from a vaccine requirement if they submit a note from a primary care provider that they were previously infected by COVID-19.https://t.co/hj9r1uQSmX,en
2022-02-16 18:57:28+00:00,1346515607743770624,NIAID vaccine R&amp;D director who collaborated with Moderna on COVID-19 vaccine to retire#startup #startups #entrepreneurship #biotech #biotechnology #science #scientist #neuroscience #neuroscientist  https://t.co/tMTYCmIQ2j,en
2022-02-16 18:56:46+00:00,1344751420139040783,"It's time to end the draconian COVID-19 restrictions and mandates in America. A government forcing individuals to receive a COVID-19 vaccine they don't want, is not a government worthy of being funded. #DefundVaxMandates",en
2022-02-16 18:56:21+00:00,3467590216,Researchers Warn Some Covid-19 Vaccines Could Increase Risk Of HIV Infection https://t.co/c0uyC2fBwo,en
2022-02-16 18:56:09+00:00,79745758,Trudeau has an inventory of 40 million vaccine doses at a cost of about $ 1.6 billion Does anybody want to step up and help out?Canada to buy 40 million Moderna COVID-19 doses in next two years: Trudeau https://t.co/2Nyq3ch4HF,en
2022-02-16 18:55:51+00:00,1467059447813922816,England to offer COVID-19 vaccine to all children aged 5-11 https://t.co/eJo3JjorbI,en
2022-02-16 18:55:44+00:00,1456331970,@CristinaNcl @Metro_Sport @EmzJB Lol Tsitsipas literally said that young people should go around catching covid-19 in order to have immunity and they are still saying that Djokovic has talked against covid-19 vaccines. 🤦🏻‍♀️,en
2022-02-16 18:55:37+00:00,829707574517850112,@johnpavlovitz I'm thinking about essential workers who died of Covid-19 at much higher rates than the general population during the pandemic. Did their empathy in caring for all of us in a national crisis suddenly evaporate when vaccines became available?,en
2022-02-16 18:55:00+00:00,168505657,Interested in hosting a COVID-19 mobile clinic or community conversation at your library? Hear from @MassDPH about resources and services available for your library to support vaccine equity. https://t.co/VEvpeTnVFM @mblclibraries,en
2022-02-16 18:54:41+00:00,1234561706015150080,Should someone with ‘natural immunity’ from a COVID-19 infection be exempted from vaccine mandates? A Utah House committee advanced a bill that would treat recent infections the same as vaccination. #utpol #utleg https://t.co/uWpFvAugup https://t.co/S1Xqskohjy,en
2022-02-16 18:54:37+00:00,816350346750599168,"@justabirduser @SusannaMcCoy19 @SteveDeaceShow Once Comrinaty received full FDA approval, both the remaining stock of Pfizer-BioNTech COVID-19 Vaccine and Comrinaty were distributed. Whether you receive one or the other does not matter, the approval applies to both. One is Brand, the other is generic.",en
2022-02-16 18:54:31+00:00,283604227,"Andy Vermaut shares:Covid-19: Vaccine will be offered to 5-11 year olds in England, Wales, and Scotland: England has followed Scotland and Wales in announcing that all children aged 5-11 years will be offered the covid-19 vaccine, in line with… https://t.co/odby7DELob Thank you.",en
2022-02-16 18:53:16+00:00,40061315,"DHEC is encouraging all pregnant women across the state to get their COVID-19 vaccine, after a new study from the CDC found babies whose mothers got the two-dose shots have a reduced risk of being hospitalized with the disease for the first six months ... https://t.co/cEpXqVzZG6",en
2022-02-16 18:53:04+00:00,1196716872634445825,"It would be disastrous if Australia were to use China’s advanced facial recognition technology to control society. Such use would result in the demise of political openness, already severely tested by the COVID-19 pandemic emergency measures, restrictions, and vaccine mandates. -",en
2022-02-16 18:52:21+00:00,975371212485545985,Massachusetts judge blocks Boston's COVID-19 vaccine mandate https://t.co/mAiZwcA5PI,en
2022-02-16 18:52:11+00:00,1092550866819780608,COVID-19: Why have cautious government advisers now changed their minds on vaccines for 5 to 11-year-olds? | UK News https://t.co/p7MZd11ypm,en
2022-02-16 18:52:11+00:00,1197856357178904576,"FDA executive officer sounds alarm on future COVID-19 policy - https://t.co/5mnFqTLa2S COCKSUCKERS, FUCK YOU AND YOUR VACCINE.",en
2022-02-16 18:52:04+00:00,22055291,Middlesex County COVID-19 vaccine tracker: 79% of people fully vaccinated https://t.co/M8grNZu42A,en
2022-02-16 18:52:02+00:00,1242133094,"The Covid-19 vaccine provides important protection for children and young people against the virus, reduces the risk of them passing on the infection to others, and minimising disruption to their lives and their education. For more information: https://t.co/Fd4yjxIi1R https://t.co/I3ukDPCCXL",en
2022-02-16 18:51:38+00:00,902966850421571584,"@steph___987 @TheBlueGem3 Capacity limits far more damaging to economy than masks or vaccine passports while if everyone vaccinated in large crowd, some will catch COVID-19 but few end up in hospital.  If includes unvaccinated, could lead to spike in hospitalizations.",en
2022-02-16 18:51:18+00:00,928011850238889985,"COVID-19: Why have cautious government advisers now changed their minds on vaccines for 5 to 11-year-olds? | UK News | Sky News Money in makers hands changed minds not virus, the gov bought tons of the toxic liquid they can’t dump it in public waterways https://t.co/1B5uO1L9GY",en
2022-02-16 18:51:09+00:00,414180885,Association Between 3 Doses of mRNA COVID-19 Vaccine and Symptomatic Infection Caused by Omicron and Delta... https://t.co/BncGsV0Q2f via @JAMA_current part of @JAMANetwork,en
2022-02-16 18:50:38+00:00,87227187,Joe Rogan has been yammering about the COVID-19 vaccines for months. Yet in spite of rampant misinformation—from him and so many others—the proportion of Americans who refuse their shots hasn’t budged since 2020. @danengber looks at how we got so stuck: https://t.co/zSg5sfM03l,en
2022-02-16 18:50:38+00:00,806763044986490881,The Lancet Publishes Medical Prof's Warning That Natural Immunity Has Made Vaccine Mandates Irrelevant - Becker News https://t.co/yhEILyqOlw #COVID19 #COVID #Covid_19 #covid19nfld #coronadebat #CoronaInfoCH #Corona #coronavirus #coronatoegangsbewijs,en
2022-02-16 18:50:04+00:00,22059338,Worcester County COVID-19 vaccine tracker: 69% of people fully vaccinated https://t.co/K86vuSx3tC,en
2022-02-16 18:50:00+00:00,345702753,"GHANA, RWANDA, SENEGAL PARTNER BIONTECH TO PRODUCE COVID-19, TB AND MALARIA VACCINES IN AFRICA Ghana, Rwanda and Senegal are partnering with German biotechnology company, BioNTech SE, to fill, finish, and package BioNTech mRNA vaccines in Africa, https://t.co/eLWusrMD5y",en
2022-02-16 18:49:59+00:00,731474336,"""Getting vaccinated against #COVID19 helps protect you from getting sick."" No it does not.""All approved COVID-19 vaccines have been thoroughly tested."" No they were not. The testing is still ongoing and you are the fucking test subjects.",en
2022-02-16 18:49:46+00:00,90705306,"The COVID-19 vaccine is the best protection against moderate to severe infection from a COVID-19 virus. If you have questions about the COVID-19 vaccine and your child’s health, speak with your healthcare provider or consult a paediatric nurse https://t.co/g8BWvniirp https://t.co/c2bbbpmPLM",en
2022-02-16 18:48:11+00:00,79498539,"Covid-19: WHO efforts to bring vaccine manufacturing to Africa are undermined by the drug industry, documents show https://t.co/BYXK55BJBg",en
2022-02-16 18:47:24+00:00,2192854051,"Getting vaccinated is by far the most effective way to stay out of the hospital when it comes to COVID-19! If you haven't received yours yet, call 617-643-8000 (North End) or 857-238-1100 (Charlestown) to get your vaccines or boosters. https://t.co/imTlkyBHXB",en
2022-02-16 18:47:16+00:00,1449303232551997442,"GHANA, RWANDA, SENEGAL PARTNER BIONTECH TO PRODUCE COVID-19, TB AND MALARIA VACCINES IN AFRICA#BuildingGhanaTogether https://t.co/5bfow9MzQI",en
2022-02-16 18:47:12+00:00,2584139035,One of the classes I'm currently preparing is on the COVID-19 vaccine supply chain 💉 The other is on air cargo  ✈ I find it extremely difficult to squeeze all I want to say and do on either topic into 3 hours!,en
2022-02-16 18:46:46+00:00,28585986,COVID-19 Update: Kenney calls on Trudeau and Biden to drop trucker vaccine mandates | Health minister says Alberta on track to zero restrictions https://t.co/w5c3CtJase https://t.co/VqqYwSUfUg,en
2022-02-16 18:46:30+00:00,928719404,Duration of Protection by Covid-19 Vaccineshttps://t.co/zGaTvusXly #covid,en
2022-02-16 18:46:27+00:00,146745072,@Whisker12899908 @newrobbiepaton So you admit there is no amount of long term safety data that could ever convince you the COVID-19 vaccines are safe. In which case there’s clearly no reasoning with you so why should anyone take you seriously?,en
2022-02-16 18:46:16+00:00,1036616693362114561,Open Letter with Notice of Legal Obligations &amp; Potential Liabilities to anyone Advocating or Administering COVID-19 Vaccines to Children from the UK Medical Freedom Alliance!! 🔥 https://t.co/VjE2lOjokw,en
2022-02-16 18:46:12+00:00,781240977922985984,"There's a free COVID-19 Vaccination Clinic this Sunday, February 20, at 10am-1pm at Walmart! Moderna vaccines are available for adults. Pfizer vaccines are available for anyone 5-years-old and up. 💉Everyone will receive a $25 gift card and some may get a $100 gift card! 💳 https://t.co/E4HK1b4RE2",en
2022-02-16 18:45:41+00:00,1336381549374267393,"COVID-19 vaccines *do* help reduce transmission.Completely stopping transmission is not needed for vaccines to be effective.Layering protection, increasing vaccine uptake, and investigating new strategies are all tools to fight the pandemic.🧵 [10/11]#ScienceUpFirst",en
2022-02-16 18:45:36+00:00,1336381549374267393,Remember: COVID-19 vaccines do not need to completely stop transmission to be effective.COVID-19 vaccines remain excellent at  protecting against severe disease and hospitalization. 2 doses means you are 5X less likely to be hospitalized.   🧵 [6/11]#ScienceUpFirst,en
2022-02-16 18:45:36+00:00,1336381549374267393,"Vaccines also indirectly reduce transmission by interrupting infection itself. If you never develop COVID-19, you can’t pass it on.Boosters reduce the risk of an Omicron infection. 2 doses help protect against infection, but to a lesser extent.🧵 [5/11]#ScienceUpFirst https://t.co/I582dYCOvq",en
2022-02-16 18:45:33+00:00,1336381549374267393,COVID-19 vaccines can directly reduce transmission by stopping your body from passing on live copies of the virus.Vaccines were good at interrupting transmission of the Alpha/Delta variants. How well they stop Omicron transmission is being studied.🧵 [3/11]#ScienceUpFirst https://t.co/YbtLOZmLVq,en
2022-02-16 18:45:31+00:00,1336381549374267393,Transmission is the passing of a disease-causing pathogen (like a virus) from an infected person to someone else.COVID-19 vaccines directly and indirectly reduce the transmission of COVID-19.🧵 [2/11]#ScienceUpFirst,en
2022-02-16 18:45:31+00:00,1336381549374267393,No vaccine is perfect. That includes the COVID-19 vaccines. But they don’t need to be in order to save millions of lives. A thread about transmission 👇🧵 [1/11]#ScienceUpFirst https://t.co/Vy4ccpHgkH,en
2022-02-16 18:45:27+00:00,2722400366,COVID-19 Booster Dose Provides 90% Protection Against Hospitalization During Omicron Surge. Get your vaccine boosters now! #Vaccine #COVID19,en
2022-02-16 18:45:07+00:00,740717150,Join us for an Instragram live COVID-19 Vaccine and Wellness Q&amp;A session for youth.February 17th from 7 to 8pmThe Link: https://t.co/2afdmK975G @SWCHC @OttawaHealth @NROCRC @bgcottawa https://t.co/AA7j7WC3V0,en
2022-02-16 18:43:46+00:00,165939990,"Anyone who has uttered the phrase ""my body, my choice"" about the COVID-19 vaccines should read this story.",en
2022-02-16 18:43:24+00:00,739987116721983489,"COVID-19 vaccines for children could arrive soon, according to health officials | ABC News https://t.co/MWvaxXRtoq",en
2022-02-16 18:42:54+00:00,40954616,The number of doses of COVID-19 vaccine delivered by the Pan American Health Organization (PAHO) to Latin America and the Caribbean reached 100 million on Tuesday.Read more:https://t.co/lSW8ULh4E6 https://t.co/fwmRrv3cB9,en
2022-02-16 18:42:48+00:00,1187188127539978241,💉 TODAY (2/16/22) COVID-19 VACCINE CLINIC - Pfizer Pediatric Only (5-11 Years Old) Every WednesdayThe Pfizer pediatric (5-11 years old) vaccine is offered every Wednesday from 2 pm-4 pm. https://t.co/MG3zJ24iwn@bgrecreation @bellgardenspolice @picocare#BellGardens https://t.co/aYjd9nbl2o,en
2022-02-16 18:40:38+00:00,186210906,The vaccination event at #SanDiegoCentralLibrary is now up and running! 💉 No appointments are needed and we've got a variety of COVID-19 vaccines and can take of your flu shot too. https://t.co/BncWufTpz4 https://t.co/5Zh9GPSIic,en
2022-02-16 18:40:09+00:00,1221770344371048448,"16th February, 2022For Immediate Release GHANA, RWANDA, SENEGAL PARTNER BIONTECH TO PRODUCE COVID-19, TB AND MALARIA VACCINES IN AFRICA https://t.co/c4k5HzM7h0",en
2022-02-16 18:40:07+00:00,1319670522,Pfizer made nearly US$37bn in sales from its Covid-19 vaccine last year – making it one of the most lucrative products in history – and has forecast another bumper year. @PierrePoilievre How much has the Trudeau foundation profited?,en
2022-02-16 18:40:02+00:00,171622913,Flu and #COVID19 are both hitting NYC right now. Make sure to protect yourself: ✅Get #vaccinated! Get the flu and COVID-19 vaccines at the same time.✅Wash your hands with soap &amp; water.🧼✅Mask up!😷Learn more: https://t.co/l2HeXKD1Sz https://t.co/K3SrEcAjX5,en
2022-02-16 18:40:01+00:00,16949344,"England has followed Scotland and Wales in announcing that all children aged 5-11 years will be offered the covid-19 vaccine, in line with advice from the Joint Committee on Vaccination and Immunisation. Northern Ireland is expected to follow suit shortlyhttps://t.co/igviMTDZt0",en
2022-02-16 18:39:59+00:00,3955942947,"We talk to Brendan Buckley about clinical trial design, his confidence in the COVID-19 vaccine, and the new “mega-trial” he’s watching closely: https://t.co/u3HFeJlIlY #clinicaltrials #teckrotheanswer #clinicaltrial #trials #protocol #mhealth #medtech #meded #pharma #ai #biotech",en
2022-02-16 18:39:46+00:00,17394793,"Bank of American announced it would donate $60,000 to Three Square Food Bank of Las Vegas after pledging $100 for each bank employee who got a COVID-19 vaccine booster. https://t.co/YZ4c7xi2g5",en
2022-02-16 18:39:34+00:00,70689903,👏🏻👏🏻👏🏻⁦@BioNTech_Group⁩ unveiled mobile Covid-19 vaccine production units that it aims to deploy across Africa and other regions that have had limited access to supplies https://t.co/6G4ESXGbbM,en
2022-02-16 18:39:14+00:00,1593224094,Man attacks Applebee's employee with meat cleaver over COVID-19 vaccine proof https://t.co/A9Brbuw8Xe,en
2022-02-16 18:39:14+00:00,1361083361675137024,About time too. COVID-19: All children aged 5-11 in UK will be offered coronavirus vaccine as England and Northern Ireland become latest nations to confirm plan https://t.co/qqt3YW46Fn,en
2022-02-16 18:38:08+00:00,20178548,Denton County officials are moving forward with a plan to spend some of its COVID-19 relief funds on three temporary internal auditor positions to audit relief partner United Way and seek FEMA reimbursement for the county’s vaccine clinics. https://t.co/pGbXrrigRS,en
2022-02-16 18:38:01+00:00,1452488216116744193,@DjokerNole @amolrajan @BBC1 You are antivax or you would already have the vaccine you are Antie vaxs for covid-19 do to your own political reasons we know you've had polio vaccine we know you've had measles vaccine so stop lying,en
2022-02-16 18:37:47+00:00,209311997,"@NickJay17553433 @LaLB__ @Nawwwwmannn @ycpromotions22 @JustinTrudeau COVID-19: Fit and healthy man, 42, killed by coronavirus regretted refusing vaccine - as sister issues misinformation warning https://t.co/30zk12Fl1j",en
2022-02-16 18:37:47+00:00,14844380,Vaccines provide head start to outrun COVID-19 https://t.co/MezJMDu6mj @steeplechaser29 @lorascollege,en
2022-02-16 18:37:36+00:00,1479049377125744644,@Miggle_BTC @ShadowLugia16 @mattletiss7 @jonnorris12 You think the vaccine puts you more at risk from Myocarditis than from getting Covid 19 so I’ll ignore everything you say as you’re clearly a bit dim.,en
2022-02-16 18:37:25+00:00,209311997,"COVID-19: Fit and healthy man, 42, killed by coronavirus regretted refusing vaccine - as sister issues misinformation warning https://t.co/30zk12Fl1j",en
2022-02-16 18:37:02+00:00,857969841982119936,"Help yourself, help your IUFW community, get $20 in Crimson cash by getting your COVID-19 vaccine booster now. Find a vaccine site 👉 https://t.co/x6adF8fKg9Let us know you’ve been boosted 👉https://t.co/mSZuWLpxP8 https://t.co/XNt8wBvGts",en
2022-02-16 18:36:37+00:00,2188692920,Please read an important message from the IPRRC team regarding the COVID-19 Vaccine. See you all in about two weeks! https://t.co/Gfnpmwx1rO https://t.co/uLUsqzwfIv,en
2022-02-16 18:35:15+00:00,551227922,"At German Biotechnology Company, @BioNTech_Group BioNTech SE is a German biotechnology company that manufactures BioNTech mRNA vaccines for COVID-19, Malaria and Tuberculosis in Africa. The first modular vaccine production facility (BioNTainer) is expected to be shipped in https://t.co/dgE2PIHDIo",en
2022-02-16 18:35:05+00:00,1209377539245821953,"COVID-19: N.L. to end restrictions, mandatory masking and vaccine passport – February 16, 2022 #Canadahttps://t.co/4ZIrHQqxVH",en
2022-02-16 18:33:53+00:00,15970567,"@NicholeManna Feb. 16, 2022 JPS update:- 93 patients currently being treated for COVID-19 at the hospital- 46 patients under investigation- 428 deaths - 132,019 vaccines given to health care workers, patients and the general public by JPSReplying to @BudKennedy and @NicholeManna",en
2022-02-16 18:33:51+00:00,56752034,"@vampipe @_LizVilchis In Mexico, a licensing agreement between Mount Sinai and Laboratorio Avi-Mex S.A. de C.V. (Avimex), a veterinary pharmaceutical company, will enable that country to soon begin Phase 1 trials in humans of a COVID-19 vaccine using NDV vector technology. Avimex began collaborating",en
2022-02-16 18:33:49+00:00,18989002,Man attacks Applebee's employee with meat cleaver over COVID-19 vaccine proof https://t.co/COu3JpaZVq,en
2022-02-16 18:33:40+00:00,1215421834218426369,@MuttleyMusings Absolutely sickening! Stop giving children the experimental &amp; harmful COVID-19 vaccine! Kids have over a 99.9% survival rate! See Dr. Robert Malone’s warning to parents on his website. https://t.co/EspEtQ9MnN,en
2022-02-16 18:33:20+00:00,94155231,"At last. UK follows USA, Canada, EU and others. COVID-19 vaccines for 5-11 year olds. 👇",en
2022-02-16 18:32:52+00:00,857276730544988161,"#حقوق_العلميين_الطبيين #حقوق_العلميين_الطبيينCOVID 19 vaccine is prepared by a team and a Egyptian clinical scientist in that time was participate in that great event , what you want to be sure about clinical scientists roles 🤷🏻‍♂️",en
2022-02-16 18:32:45+00:00,1067464813805268992,#COVID19 #Africa  “Afrigen’s success spotlights a failure of global solidarity. Africa’s scientists shouldn’t have to go it alone” great piece by @AkshayaSays  Step Toward Africa’s First Covid-19 Vaccine of Its Own -  https://t.co/UHM24CX93n,en
2022-02-16 18:32:42+00:00,24784868,"#216Day celebration idea - help protect yourself, family, and the CLE by getting vaccinated. This week, visit one of our @CityofCleveland health centers or come to Tower City on 2/18 to get your booster or any dose of the COVID-19 vaccine that you need! https://t.co/I4Wr28q9JN",en
2022-02-16 18:32:39+00:00,1152797358368968705,"NO ONE IN THE UNITED STATES GOVERNMENT EVER SAID: ""YOU HAVE TO TAKE THE COVID-19 VACCINE.""",en
2022-02-16 18:32:36+00:00,823297580578852864,Philadelphia Drops COVID-19 Vaccine Passport for Restaurantshttps://t.co/4EdGDxHezF,en
2022-02-16 18:32:17+00:00,3672155534,COVID-19 Clinics - Thank you for your ongoing support and partnership in helping us to keep our schools open and safer for in-person learning. Vaccines are safe and continue to be the best way to prot... https://t.co/OhajhPWn0g https://t.co/Xp7eJvOUsk,en
2022-02-16 18:31:54+00:00,893362939574468608,NHS in Crisis: COVID 19 Vaccines A Duty of Care and why Doctors are leaving the NHS https://t.co/gJtGINrPbS via @ukcolumn,en
2022-02-16 18:31:48+00:00,857276730544988161,"#حقوق_العلميين_الطبيين#حقوق_العلميين_الطبيينCOVID 19 vaccine is prepared by a team and a Egyptian clinical scientist in that time was participate in that great event , what you want to be sure about clinical scientists roles 🤷🏻‍♂️",en
2022-02-16 18:31:14+00:00,1884171336,"In partnership with @ImmunizeNV, we will be at Sparks Middle School TODAY from 3-6 p.m. providing COVID-19 vaccines for children and family members 5+. Walk-ins are welcome, but appointments are encouraged. Please book appointments here: https://t.co/EOH5Hg782z https://t.co/wez1IjwJw9",en
2022-02-16 18:31:09+00:00,1241911004,"Parents, have you done your homework? It's okay, the medical experts have made it easy! Get up to speed on the children's COVID-19 vaccine at https://t.co/NUKMrJMTpA, brought to you by @CHCOntario. https://t.co/c7dOAVj874",en
2022-02-16 18:31:01+00:00,915658126451494912,"California's Coachella returns following 2-year COVID-19 hiatus, will have no mask or vaccine requirements to attend massive festival https://t.co/PxA8ry29LI",en
