date,userid,tweet,lang
2022-06-29 23:59:54+00:00,132666591,New Study Confirms That Experimental Covid-19 Vaccines Impact Male Fertility https://t.co/RGZYr8z2kr via @WCH_Org,en
2022-06-29 23:59:46+00:00,456087619,Sen. Ted Cruz Feuding with a Muppet Over the COVID-19 Vaccine ...Again  https://t.co/Ez4AyNpQIo,en
2022-06-29 23:59:34+00:00,549272150,"@SBergsma Doctors BEGGING parents not to give their children deadly COVID-19 vaccines""Horrendous Outcomes f Babies &amp; Children in Moderna’s Vax Study: Dosage is 25 mgrams,eight times Pfizer’s dosage of 3 micrograms.A 6-month-old baby of 17 pounds receives same dosage as a 50-pound 5-y-old"" https://t.co/9SEbIS1Xj2",en
2022-06-29 23:58:50+00:00,948285950509158400,FDA: Don’t rush into changing Covid-19 vaccine composition https://t.co/FqPRDrUp8e,en
2022-06-29 23:57:44+00:00,948285950509158400,FDA: Don’t rush into changing Covid-19 vaccine composition https://t.co/3gl1qXUvXL,en
2022-06-29 23:57:29+00:00,241983890,Biden administration reaches agreement to purchase 105 million doses of Pfizer Covid-19 vaccine https://t.co/FKLdXN4Qvm,en
2022-06-29 23:56:12+00:00,1050954896109920257,"1/2 DOD: Pfizer Inc., New York, New York, awarded a $3.2 billion firm-fixed-price contract to manufacture, store and deliver mRNA COVID-19 vaccines. Work will be performed in Kalamazoo, Michigan. stimated completion date of May 31, 2023.",en
2022-06-29 23:55:48+00:00,1519516807324782592,"@realCruzThomas @patriottakes I couldn’t imagine the agony of losing my child, especially to something as awful as COVID-19. The day he turned five, he got his first vaccine dose. You’d still vote for the guy that put your baby into the ground? Seriously you suck as a parent.",en
2022-06-29 23:55:11+00:00,2949667835,BC man one of 1st Canadians compensated for injury due to COVID-19 vaccine https://t.co/ecqg8T4cPR via @YouTube,en
2022-06-29 23:55:04+00:00,50368760,🤬Pfizer and BioNTech Announce New Agreement with U.S. Government to Provide Additional Doses of COVID-19 Vaccine in Q4 2022 &amp; 2023. https://t.co/2pxWGnnRwr,en
2022-06-29 23:54:08+00:00,114560884,Texas Sen. Ted Cruz Twitter-feuding with a muppet over the COVID-19 vaccine ... again #SmartNews  https://t.co/P82MD3u76z,en
2022-06-29 23:54:04+00:00,1533470411094097920,"Elmo, Now Vaccinated, Advertises COVID-19 Vaccine Shots for Children Under 5https://t.co/lpwaMOC9zC",en
2022-06-29 23:52:40+00:00,73698410,TedCruz: RT @dcexaminer: Sen. @TedCruz took aim at the Sesame Street character @Elmo after the furry red Muppet monster and his father told children that getting the COVID-19 vaccine is the best way to keep friends and family safe. https://t.co/eFMmfvkSxt #conservative,en
2022-06-29 23:52:40+00:00,73698410,TedCruz: RT @FoxNews: .@tedcruz is in a fight with Elmo about COVID-19 vaccines https://t.co/GRmWfEmwg5 #conservative,en
2022-06-29 23:52:28+00:00,15717931,"LITTLE KID VACCINES: Today some of Austin’s youngest residents got their COVID-19 vaccines at Dell Children’s. This is Jackson who turns three this weekend. His mom says she’s relieved after 2yrs of worrying he’d get COVID. Still, she adds a lot of thought went into the decision. https://t.co/fKdAoDnfQO",en
2022-06-29 23:51:40+00:00,16212400,ELMO GETS HIS COVID-19 VACCINE SHOT IN NEW PSA https://t.co/CkPOxTBnWO https://t.co/jGHN601VMU,en
2022-06-29 23:50:55+00:00,917543960071102465,@EllenMcCarthy I’ve never had Covid-19 I was masked at very beginning and throughout have had two vaccines and two boosters continue to mask 😷  the last two months I don’t wear a mask anymore 🤷‍♀️but may go back depending on case numbers,en
2022-06-29 23:50:31+00:00,216638460,"EU chief can't find texts with Pfizer chief on COVID-19 vaccine deal. Ursula von der Leyen is no longer in possession of bribe text messages that she exchanged with Pfizer chief Albert Bourla to seal a COVID-19 vaccine deal, the Commission said. https://t.co/59cPvljAHa",en
2022-06-29 23:50:31+00:00,318596061,S1674 Recurrent Acute Pancreatitis Following COVID-19 Vaccine – A Case Study,en
2022-06-29 23:50:22+00:00,73127403,FDA panel recommends COVID-19 vaccine update as virus evolves https://t.co/PYi5qp6tTJ https://t.co/hmY7lfsw20,en
2022-06-29 23:48:55+00:00,738080100,US places $3.2 billion order for updated COVID-19 vaccines for fall https://t.co/vortIpHLNS,en
2022-06-29 23:48:30+00:00,1080972087047512064,“52.28% of [Ghanaian] males and 68.57% of females were either indifferent or not willing to vaccinate. … 52.25% thinks that some people are promoting the COVID-19 vaccines for financial gain rather than health reasons.”https://t.co/GJhAUD1V0k,en
2022-06-29 23:48:09+00:00,705622220052168704,And in other news:'The US agreed to pay vaccine partners Pfizer Inc. and BioNTech SE US$3.2 billion in a deal for 105 million of their messenger RNA shots against COVID-19.'https://t.co/AnVhXVPf3K,en
2022-06-29 23:48:08+00:00,532638065,"@EllenMcCarthy I've never had Covid-19 but I've had two vaccines, one booster and I wear a mask when I'm in public unless I'm outdoors in an uncrowded location (like walking in a park.)",en
2022-06-29 23:47:43+00:00,404596070,Misinformation is harmful. That's why the 'Independent' is disabling comments on posts related to the dangers of COVID-19 and the effectiveness of vaccines and testing.,en
2022-06-29 23:47:34+00:00,1354855405613150210,"@GovCanHealth https://t.co/6cfUm1qn8c""Myocarditis Following Immunization With mRNA COVID-19 Vaccines in Members of the US Military""",en
2022-06-29 23:47:20+00:00,2311063720,https://t.co/4mmpDAUoTF - Find COVID‑19 vaccine locations near you https://t.co/j5MAxF6kTG,en
2022-06-29 23:47:00+00:00,142748554,"*COVID-19 update* Canada extends #COVID19 border measures until Sept. 30 | BioNTech, Pfizer to start testing universal vaccine for coronaviruses• Hospitalized: 273• New: 642 over 7 days• Confirmed cases: 373,974Update @VancouverSun: https://t.co/jBlh5zUPvM",en
2022-06-29 23:46:49+00:00,872466981441552384,@KyleDChurch @Thestace06 @JessNotOver @marcdaalder @TorturousTurtle @AshBloomfield @drayeshaverrall About 95% of eligible New Zealanders over the age of 12 have had at least two doses of a Covid-19 vaccine.,en
2022-06-29 23:45:23+00:00,1429550114540974083,"@TweetleDee2b The term ‘vaccine’ was also manipulated &amp; changed to fit needless, profitable agendas.Merriam-Webster revised its ""vaccine"" definition to replace ""immunity"" with ""immune response."" The change also addresses the new technology of mRNA vaccines in light of the COVID-19 pandemic.",en
2022-06-29 23:44:35+00:00,1389626809356980226,@sphericaltime @Co0chieslay3r69 @Kingadventure31 @c44rson @WeTheCanceled @realchrisrufo @russell_nm Conclusionsthe first in vitro study on the effect of COVID-19 mRNA vaccine BNT162b2 on human liver cell line. We present evidence on fast entry of BNT162b2 into the cells and subsequent intracellular reverse transcription of BNT162b2 mRNA into DNA.https://t.co/DdunGqfDHG,en
2022-06-29 23:43:58+00:00,1352351840889929736,Doctors and Nurses Giving the Covid-19 Vaccine Will Be Tried as War Criminals https://t.co/kGFTXLBBLh,en
2022-06-29 23:43:24+00:00,908776201551880192,@Carolyn_Bennett Ladies and gentlemen I present to you Exhibit A as to why vaccines are ineffective at preventing both contraction and spreading of COVID 19. End all mandates immediately. There remains zero logic as to why they should be in place.,en
2022-06-29 23:42:35+00:00,783774766171721728,Yes. Children 6 months and older should get vaccinated against #COVID19 even if they’ve already had COVID-19. Getting vaccinated after having COVID-19 provides added protection to their immune system.Learn more about COVID-19 vaccines for children: https://t.co/39JSyOEkQe.,en
2022-06-29 23:42:32+00:00,1412541011025408000,Swedish Scientists: Pfizer’s Covid-19 Vaccine goes into Human Liver Cells and Converts into DNA! https://t.co/J0AylRWEB1,en
2022-06-29 23:42:30+00:00,139807430,@tedcruz here it is - Sesame Street stays safe as Elmo gets the COVID-19 vaccine https://t.co/j0jXBB93Pt,en
2022-06-29 23:42:11+00:00,22217141,Seems like an expensive way for one guy to learn that Covid-19 vaccines are safe and effective.,en
2022-06-29 23:40:28+00:00,279848159,"29,031 Covid-19 Vaccine Deaths, 240,022 Serious Injuries Reported to VAERS, as CDC Admits Not Monitoring System for Safety Signals https://t.co/QCvEqAJsoY",en
2022-06-29 23:40:11+00:00,3114448031,"Stock: $PFE - Pfizer Inc*** NEWS ***Pfizer, BioNTech announce new COVID-19 vaccine supply agreement with U.S. govt - Seeking Alphahttps://t.co/iG1R8dRzztTry now the Best Pivot Point Calculator!! https://t.co/EpEyWxsxPH#tradingview#stocks#stockstowatch https://t.co/1HkGQGZNkB",en
2022-06-29 23:39:31+00:00,912735824793493504,"@JoyceCarolOates More members of the Trump Cult ended up dying from COVID-19 than the Libs they sought to ""own"" by refusing to wear masks &amp; eschewing vaccines.Doesn't really seem to have registered with them, however.Don't seem too be very good at thinking ahead, so I could see them doing it. https://t.co/v9oOzev48g",en
2022-06-29 23:38:08+00:00,503494582,"2022World Council for Health Calls for Global Removal of COVID-19 Vaccines. - With &gt;3.5 million injuries and &gt;40,000 deaths, a gross underestimate, the vaccines must be pulled. https://t.co/zq68vSXo3B",en
2022-06-29 23:37:56+00:00,831302293,US places $3.2 billion order for updated COVID-19 vaccines for fall https://t.co/Ue92hz3CmM,en
2022-06-29 23:36:46+00:00,1519510044617986048,"Elmo, Now Vaccinated, Advertises COVID-19 Vaccine Shots for Children Under 5What is shame, when billions of dollars are to be made in the arms of babies?!  https://t.co/6ZC33oBVcg",en
2022-06-29 23:36:31+00:00,735238428606922754,Selected vaccine locations in LA county are currently offering Pfizer and Moderna COVID-19 pediatric vaccines. You can find your nearest vaccine location at https://t.co/KmceXbF05j. It is encouraged to call your vaccine location before to check availability. https://t.co/q6n7Da0zBo,en
2022-06-29 23:36:24+00:00,62328676,"FDA Panel Votes to Waive Clinical Trials for New COVID BoostersThe U.S.FDA’s vaccine advisory panel voted 19 to 2 on Tuesday to add an Omicron component to COVID-19 boosters this fall, over objections by panel members and despite a lack of data.🤡💉https://t.co/lxIvX1Hfyj",en
2022-06-29 23:36:12+00:00,863918844464726016,#News: #ELMO GETS HIS COVID-19 VACCINE SHOT IN NEW PSA https://t.co/oNFbf7vSPH,en
2022-06-29 23:35:06+00:00,29905232,"20220629: Reuters: FDA leaning toward new COVID-19 shots that target original strain, emerging Omicron variants [""FDA to finalize decision soon; vaccine makers say they could be ready to mass produce by October""",en
2022-06-29 23:34:14+00:00,1354855405613150210,"@GovCanHealth https://t.co/97XXRSSO0e Part 2..""of two doses of COVID-19 vaccine was lower than that among the un-vaccinated individuals. According to European Medicines Agency recommendations, frequent COVID-19 booster shots could adversely affect the immune response &amp; may not be feasible.""",en
2022-06-29 23:34:13+00:00,15193667,Pfizer and BioNTech Announce New Agreement with U.S. Government to Provide Additional Doses of COVID-19 Vaccine | Pfizer https://t.co/P5C3WgLUlc,en
2022-06-29 23:34:01+00:00,1354855405613150210,"@GovCanHealth https://t.co/97XXRSSO0ePart 1. ABSTRACT ""Recently, The Lancet published a study on the effectiveness of COVID-19 vaccines and the waning of immunity with time. The study showed that immune function among vaccinated individuals 8 months after the administration""....",en
2022-06-29 23:32:14+00:00,153303188,How many lives have been saved by covid-19 vaccines?~20 Million !https://t.co/H3KzapvbOC https://t.co/mpTKIPhdYC,en
2022-06-29 23:31:51+00:00,40712470,"@autodicatic Read ""3.3.1. Efficacy of mRNA-Based COVID-19 Vaccines""Or look at figure 2. There you see the vaccin group drastically outperforming the placebo group... I'm going to quit here. It's like talking to a wall",en
2022-06-29 23:31:34+00:00,389994403,@VaxxersAnti Are they talking about the COVID-19 vaccines? Because how the fuck was there any research in 2020?!,en
2022-06-29 23:31:24+00:00,15769858,Alberta woman argues removal from AHS organ transplant list over COVID-19 vaccine refusal was unconstitutional https://t.co/urIKPYSxu0,en
2022-06-29 23:30:11+00:00,1310741627137339392,"@michaelLussenbu @sharp_sherpa @healthgovau Then your sample is hopelessly awry. COVID-19 has killed one of every 300 people in America. Vaccine injuries are less than one in 100,000, closer to one in a million.",en
2022-06-29 23:29:18+00:00,2671002914,"@NickJay17553433 @alchemy4338 @spilmanlarry8 @CDCgov ""the COVID-19 vaccines have successfully reduced the rates of infections, severity, hospitalization, and mortality among the different populations."" https://t.co/cTZV3BQHcx",en
2022-06-29 23:29:17+00:00,1965939079,🤮🤮🤮Pfizer and BioNTech Announce New Agreement with U.S. Government to Provide Additional Doses of COVID-19 Vaccine | Business Wire https://t.co/Uv9BAUvG6G,en
2022-06-29 23:28:32+00:00,503494582,World Council for Health - Report Confirms Evidence for Recall of Covid-19 Vaccine - Covid 19 Reporter https://t.co/CTj7bCqWHl,en
2022-06-29 23:28:25+00:00,1510944533567188992,"INTERCHANGEABILITYFDA-approved COMIRNATY® (COVID-19 Vaccine, mRNA) and the Pfizer-BioNTech COVID-19 Vaccine FDA authorized for Emergency Use Authorization (EUA) for individuals 12 years of age and older can be used interchangeably by a vaccination provider.",en
2022-06-29 23:28:24+00:00,1510944533567188992,"Emergency uses of the vaccine have not been approved or licensed by FDA, but have been authorized by FDA, under an Emergency Use Authorization (EUA) to prevent Coronavirus Disease 2019 (COVID 19) in individuals 6 months of age and older.",en
2022-06-29 23:28:24+00:00,1510944533567188992,any authorized or approved COVID-19 vaccinea second booster dose to individuals 12 years of age and older with certain kinds of immunocompromise and who have received a first booster dose of any authorized or approved COVID-19 vaccine,en
2022-06-29 23:28:23+00:00,1510944533567188992,with a different authorized or approved COVID-19 vaccine. The booster schedule is based on the labeling information of the vaccine used for the primary seriesa second booster dose to individuals 50 years of age and older who have received a first booster dose of,en
2022-06-29 23:28:23+00:00,1510944533567188992,"a first booster dose to individuals 12 years of age and older who have completed a primary series with Pfizer-BioNTech COVID-19 Vaccine or COMIRNATY® (COVID-19 Vaccine, mRNA)a first booster dose to individuals 18 years of age and older who have completed primary vaccination",en
2022-06-29 23:28:22+00:00,1510944533567188992,a third primary series dose to individuals 5 years of age and older with certain kinds of immunocompromiseBooster Seriesa single booster dose to individuals 5 through 11 years of age who have completed a primary series with Pfizer-BioNTech COVID-19 Vaccine,en
2022-06-29 23:28:21+00:00,1510944533567188992,in individuals 6 months of age and older.Pfizer-BioNTech COVID-19 Vaccine is FDA authorized to provide:Primary Seriesa 3-dose primary series to individuals 6 months through 4 years of agea 2-dose primary series to individuals 5 years of age and older,en
2022-06-29 23:28:21+00:00,1510944533567188992,U.S. Indication &amp; Authorized UsePfizer-BioNTech COVID-19 Vaccine is FDA authorized under Emergency Use Authorization (EUA) for active immunization to prevent coronavirus disease 2019 (COVID-19) caused by severe acute respiratory syndrome coronavirus 2 (SARS-CoV-2),en
2022-06-29 23:28:19+00:00,1510944533567188992,"so that they can begin deliveries rapidly upon authorization or approval and subsequent recommendation by the U.S. Centers for Disease Control and Prevention’s (CDC), if received, and as directed by the U.S. government.The Pfizer-BioNTech COVID-19 Vaccine,",en
2022-06-29 23:28:16+00:00,1510944533567188992,"Under the agreement, the U.S. government will receive 105 million doses (30 µg, 10 µg and 3 µg). This may include adult Omicron-adapted COVID-19 vaccines, subject to authorization from the U.S. Food and Drug Administration (FDA).",en
2022-06-29 23:28:16+00:00,1510944533567188992,"NEW YORK &amp; MAINZ, Germany--(BUSINESS WIRE)--Pfizer Inc. (NYSE: PFE) and BioNTech SE (Nasdaq: BNTX) today announced a new vaccine supply agreement with the U.S. government to support the continued fight against COVID-19.",en
2022-06-29 23:28:02+00:00,707366631316578304,Moderna is the killer vaccine. My son took two shots but on the basis of his friends all dropping around him has refused the third killer shot. After Biden &amp; Harris are impeached we need to change the laws governing Big Pharma &amp; COVID 19 &amp; sue Moderna. @seanhannity,en
2022-06-29 23:27:57+00:00,1364349894044114947,ELMO GETS HIS COVID-19 VACCINE SHOT IN NEW PSA https://t.co/LhBdBLySwG,en
2022-06-29 23:27:54+00:00,2671002914,"@NickJay17553433 @alchemy4338 @spilmanlarry8 @CDCgov In conclusion, data from a wide variety of study types and settings demonstrate that COVID-19 vaccines provide high levels of protection against severe disease, and they additionally protect against infection and mild disease, even those caused by most SARS-CoV-2 variants...",en
2022-06-29 23:27:32+00:00,988487993504731137,"- 607,445 Ohioans have received their second booster of the COVID-19 vaccine. As of June 21, the seven-day average of Ohioans who have received a second booster has decreased by 39% compared to two weeks ago.",en
2022-06-29 23:27:00+00:00,2671002914,"@NickJay17553433 @alchemy4338 @spilmanlarry8 @CDCgov ""These interim results of a living systematic review show that after completed course the EMA-approved COVID-19 vaccines have a VE of 80% to 90% in preventing SARS-CoV2 infections, including asymptomatic ones.""https://t.co/yBXeBW8qiL?",en
2022-06-29 23:26:41+00:00,22577223,It's Okay to have questions about #Covid-19 vaccines for children! Amazing example @SesameStreet for our children.,en
2022-06-29 23:26:06+00:00,503494582,"1/2”The COVID-19 vaccines, of which there are 16 in use or about to be deployed, under any conditions cannot improve human health. There is a strong body of evidence that they are leading to a marked decline in the well-being of humans…",en
2022-06-29 23:25:52+00:00,549272150,"@robhonig Doctors BEGGING parents not to give their children deadly COVID-19 vaccines""Horrendous Outcomes f Babies &amp; Children in Moderna’s Vax Study: Dosage is 25 mgrams,eight times Pfizer’s dosage of 3 micrograms.A 6-month-old baby of 17 pounds receives same dosage as a 50-pound 5-y-old"" https://t.co/0iPcarSozw",en
2022-06-29 23:25:32+00:00,388774547,book covid 19 vaccination? This app is as useful as my previous question. Maybe you care to tell us about these vaccines that stopped long ago as part of LIVING WITH COVID. Are you against LIVING WITH COVID?,en
2022-06-29 23:25:02+00:00,779396446906966016,"A recent JAMA study detailed the risk of thrombosis associated with various COVID-19 vaccines. In his most recent column, Dr. Weiss provides perspective on this data. https://t.co/NHwbCKNrXW#COVID19 #Thrombosis",en
2022-06-29 23:24:12+00:00,1323062838504656896,@Carolyn_Bennett Fantastic news!  I have never tested positive for COVID-19.  I am feeling fine. I regret that I took the ineffective vaccines and stopped after 2. I won’t be following public  health guidelines and will continue to not mask.  Teachable moment - trust no one. Exercise free will!,en
2022-06-29 23:24:06+00:00,40173650,"""#POTUS News: Biden administration reaches agreement to purchase 105 million doses of Pfizer Covid-19 vaccine #News"": https://t.co/VHzr3pEGmj",en
2022-06-29 23:23:43+00:00,19300609,"1,269 possible side effects from COVID-19 Vaccines!!JUST SAY NO!!",en
2022-06-29 23:23:22+00:00,52099553,FDA panel recommends COVID-19 vaccine update as virus evolves https://t.co/XmJ9B9NxyK,en
2022-06-29 23:23:05+00:00,14596185,"“‘It is only a matter of time before a pilot has a medically significant event from an adverse reaction to this [COVID-19] vaccine and crashes an airliner, killing a few hundred American citizens in the process.’”",en
2022-06-29 23:23:00+00:00,3091853545,Pfizer and BioNTech Announce New Agreement with U.S. Government to Provide Additional Doses of COVID-19 Vaccine https://t.co/QtzBue1PLXPor ✒ @BusinessWire,en
2022-06-29 23:22:15+00:00,20597234,US places $3.2 billion order for updated COVID-19 vaccines for fall https://t.co/kArqzf44FK,en
2022-06-29 23:22:07+00:00,1173694178,Pfizer and BioNTech Announce New Agreement with U.S. Government to Provide Additional Doses of COVID-19 Vaccine | Business Wire - Perfect Example US Govt. Subsidizing Biopharma when their vaccines show LITTLE STATISTICAL PROOF of preventing #COVID. https://t.co/ZqG2OnQgRZ,en
2022-06-29 23:21:29+00:00,21158038,New Study Confirms That Experimental Covid-19 Vaccines Impact Male Fertility https://t.co/hgHJBRSNwk via @WCH_Org,en
2022-06-29 23:21:22+00:00,714515096580567045,The COVID-19 vaccine is safe andeffective and has been approved by the WHO and the Uganda National Drug Authority.Uganda's vaccination deployment plan includes refugees. Vaccines are available FREE of charge to both refugees and nationals@OxfamEAfrica @relonug  @refugeeslead https://t.co/5OcRwXe9jF,en
2022-06-29 23:20:03+00:00,259698028,ELMO GETS HIS COVID-19 VACCINE SHOT IN NEW PSA https://t.co/tEpiIhMkC5,en
2022-06-29 23:19:48+00:00,449015447,"The U.S. government will pay the companies $3.2 billion. Pfizer and BioNTech Announce New Agreement to Provide 105 million Additional Doses of COVID-19 Vaccine into Q4 2022, with an option for the U.S. Government to purchase up to 195 million doses!https://t.co/L3xYJ3xzIM",en
2022-06-29 23:19:07+00:00,118773285,Biden-Harris Administration secures 105 million doses of Pfizer's latest COVID-19 vaccine for fall vaccination campaign - https://t.co/OZWPNyEAVM https://t.co/IyEoWEu5pl https://t.co/Ju7f4tbY3p,en
2022-06-29 23:18:45+00:00,1252265591215398913,"@IrishTimes @LMShe4 State unable to find any country stupid enough to take 4.5m unused Covid-19 vaccines. There, fixed that for ya",en
2022-06-29 23:17:01+00:00,76417139,"Coming this Saturday! 📢 Pediatric ID physicians @JasonGNewland of @WUSTLmed and Buddy Creech, MD of @VUMC_ID discuss COVID-19 vaccination for children, incl. factors parents should weigh in determining the type of vaccine their child receives.https://t.co/1ZV8pIWgQg https://t.co/AwolSBnwoC",en
2022-06-29 23:16:24+00:00,1520264804669304835,The Biden administration has agreed to pay $3.2 billion for 105 million doses of Pfizer Inc.’s Covid-19 vaccine. Guess they have some big Plans.,en
2022-06-29 23:16:00+00:00,711914061072625665,South Korea approves first homemade COVID-19 vaccine https://t.co/wYuvo4b3hy,en
2022-06-29 23:15:56+00:00,42660725,Biden administration to purchase 105 million doses of Pfizer Covid-19 vaccine https://t.co/7yRTEDKYFi #news #feedly,en
2022-06-29 23:15:54+00:00,183374909,Elmo of 'Sesame Street' gets COVID-19 vaccine shot in PSA https://t.co/DLc3ZA2yHU via @YahooNews @TODAYshow @elmo @sesamestreet @COVID19Tracking @ntfcovid19ph @Covid19Critical,en
2022-06-29 23:15:36+00:00,16059041,"Children to get free flu vaccines, second Covid-19 booster eligibility expanded https://t.co/lRyFg4OjX5",en
2022-06-29 23:14:43+00:00,746509515131133952,I tested positive for Covid 19 thankfully I did not get the vaccine that doesn’t work so I did not die from myocarditis.,en
2022-06-29 23:14:22+00:00,1266563068223504389,COVID-19 vaccines saved 20 million lives in 1 year: Medical News Today https://t.co/2mYQ4OkQqO MORE w/ EcoSearch: https://t.co/aksHAT4PJT,en
2022-06-29 23:13:37+00:00,1507779579649396736,@SpencerGuard Does that include Covid-19 vaccines?,en
2022-06-29 23:13:06+00:00,26018051,No Safety Data to Back CDC’s Recommendation on Co-administering COVID-19 Injections and Other Vaccines in Children https://t.co/GGTWIgiNG0,en
2022-06-29 23:12:00+00:00,2978397657,Q: What does the science *really* say about COVID-19 vaccines?A: They save lives.Source: https://t.co/kbMlgWc6f1 https://t.co/8eHwMLG38O,en
2022-06-29 23:11:50+00:00,1276365236,Check out this week’s @NYCHealthSystem #COVID19 testing sites throughout the five boroughs. Testing is no cost to you. COVID-19 vaccines are available at select locations. Hours and locations: https://t.co/7e5Lfq39Y0 https://t.co/LbtDVxQLvP,en
2022-06-29 23:10:47+00:00,722182160,"Just another $3.2B to Pfizer!Pfizer Inc., New York, New York, is awarded a $3,200,000,000 firm-fixed-price contract to manufacture, store and deliver mRNA COVID-19 vaccines. Work will be performed in Kalamazoo, Michigan, with an estimated completion date of May 31, 2023. #$PFE",en
2022-06-29 23:10:46+00:00,259576106,"Nurses and docs have had vaccine mandates at MB hospitals, as well as nursing school and med school, for years, long before the COVID-19 pandemic. Why no lawsuits then?",en
2022-06-29 23:10:41+00:00,24443405,"Let me get this straight, @elmo got his #Covid_19 vaccine shot but @TannerHouck, a grown man who's a closer for the @RedSox, doesn't and is now stuck in the USA while his team loses? Lame.",en
2022-06-29 23:10:03+00:00,720794557,"U.S. to pay $3.2 billion to Pfizer, BioNTech for more COVID-19 vaccines for fall https://t.co/LJfTGdS4bY",en
2022-06-29 23:10:01+00:00,727592059385827330,"#Canada #Vancouver #Canadians Through deaths #lockdownextensions, raised #suicides, #domesticviolence, #sexualabuse,  unemployment etc. #Covid_19 has caused havoc. #Hunger &amp; #riots R awaited. No drug no #vaccine STOP IT. Take advice https://t.co/9LRAScysZL https://t.co/zGvoMGHNX9",en
2022-06-29 23:08:14+00:00,1490057525001170948,FDA panel recommends COVID-19 vaccine update as virus evolves https://t.co/xnTe8rDpKY,en
