date,userid,tweet,lang
2022-12-31 13:26:19+00:00,1599582057306497024,People are dying. The voluntarily took the COVID-19 vaccine shot. So when are we going to start running a death toll on the TV screen.This is one that blocked the Public knowledge. Of the Hunter Biden laptop https://t.co/9sp26hHsSc,en
2022-12-31 13:26:14+00:00,3033618893,"@dbongino Agreed...Through his COVID-19 vaccine mandate, Biden intentionally violated the constitutional and civil rights of millions of Americans, imposing his will on their bodies by threatening their livelihoods...",en
2022-12-31 13:25:28+00:00,23659863,"@EdHanso46959743 @Expressen Borde sagt troligen. Sett till annan data. En majoritet har vaccinerat sig.""The association of increased risk of COVID-19 with higher numbers of prior vaccine doses in our study, was unexpected""https://t.co/yKRqJVajRGhttps://t.co/xGb1CGGO5Ehttps://t.co/XWgBoSFa8c",en
2022-12-31 13:24:56+00:00,1633401716,"Remember every day.  Doctors and Pharmacists lied to you about the need for a vaccine for Covid 19 (99.5% survival rate does not need medicine).   And then they lied to you telling you it would help.  And it was SAFE (Sudden Death, anyone?)",en
2022-12-31 13:19:28+00:00,1495056894150516736,"@DrPPhillipsMD While the text of Poilievre's bill, C-278, explicitly mentions only COVID-19-related vaccine mandates, his social media accounts promoted the legislation as a way to ""scrap all vaccine mandates and ban any and all future vaccine mandates"" to give people their ""medical freedom.""",en
2022-12-31 13:18:35+00:00,1495056894150516736,@DrPPhillipsMD Conservative leadership hopeful Pierre Poilievre tables bill to ban COVID-19 vaccine mandates,en
2022-12-31 13:18:28+00:00,1575378615956639744,"TrustHealthInf: Frequently asked questions on #Covid 19 #vaccineshttps://t.co/nRYuXVeK8A Troubles aside, Xi says China on 'right side of history'",en
2022-12-31 13:18:27+00:00,1575378615956639744,"TrustHealthInf: Frequently asked questions on #Covid 19 #vaccineshttps://t.co/nRYuXVeK8A Despite war, some Ukrainian families reunite for New Year",en
2022-12-31 13:17:13+00:00,1599582057306497024,@cass_dar @LorenCulp Why would I need that test. Just like the covid-19 test and vaccine I don't need. Look at the people falling dead. They need a death toll on the tv. People that died from the vaccine,en
2022-12-31 13:16:18+00:00,1480229133850488833,@LukeJohnsonRCP Might be the covid 19 vaccine .,en
2022-12-31 13:15:11+00:00,1608568400300703744,"@DameV17 @lolbrooksie @iainmartin1 If you're going to get it, you'll get it anyway. No Covid-19 vaccine is intended to prevent contracting or spreading it, only to reduce symptoms in the vulnerable (over 85 or already seriously ill). Stop being selfish. You have it if you want to but don't expect your children to.",en
2022-12-31 13:14:00+00:00,1519390275319304194,@Noseyoldbisum @naomirwolf There is not enough research out.  What we do know is 1% of population dies of Covid 19 pneumonia without a vaccine.  It is not as deadly as once thought although still terrible.  Keep an open mind. In approximately 2 years we will know a lot more.,en
2022-12-31 13:12:45+00:00,1207679668008214530,"""430. Will a Covid-19 Vaccine Change the Future of Medical Research?"" by Freakonomics Radio https://t.co/dupvvZb3pH #economics #podcastSee more posts at https://t.co/lo9TyPHhtw",en
2022-12-31 13:12:27+00:00,1267452418830135301,"""257 million doses of COVID-19 vaccines have been administered in Shandong, and 95.72% of the seniors have been vaccinated, ranking first in China. This has protected people's life and health to the greatest extent possible,"" said Zhou Naixiang, governor of Shandong province. https://t.co/SVt5GXFKf1",en
2022-12-31 13:10:51+00:00,1057463042747682816,"""257 million doses of COVID-19 vaccines have been administered in Shandong, and 95.72% of the seniors have been vaccinated, ranking first in China. This has protected people's life and health to the greatest extent possible,"" said Zhou Naixiang, governor of Shandong province. https://t.co/5CU5vWIC1x",en
2022-12-31 13:10:51+00:00,16691539,"@andyaschmidt @43blah @jonlevyBU ""But how can you look at China and think we can possibly do anything about transmission besides encouraging vaccines""Suggest you read the DELPHI 386-expert 112-country study on ""How to end the COVID-19 public health threat"" published in Nature.https://t.co/bsfDGSDXsK",en
2022-12-31 13:10:44+00:00,709947536,COVID-19 numbers fluctuate throughout 2022 | Year in Review – Chico Enterprise-Record - Chico Enterprise-Record-- News | The Perfect Enemy: https://t.co/AaUAp39Bww.#Children #Coverage #PublicHealth #StateLevel #Vaccines https://t.co/pTofq3vtj0,en
2022-12-31 13:10:43+00:00,37716311,COVID-19 numbers fluctuate throughout 2022 | Year in Review – Chico Enterprise-Record - Chico Enterprise-Record-- News | The Perfect Enemy: https://t.co/sSK4HejI1F.#Children #Coverage #PublicHealth #StateLevel #Vaccines https://t.co/AgjWpNRerv,en
2022-12-31 13:10:17+00:00,2808227485,Top Japanese Physician-Scientist Gives Dire Warning About COVID-19 mRNA Vaccines: ‘Scientifically Misconceived’ https://t.co/HzABWJnHMp,en
2022-12-31 13:04:13+00:00,565813956,@karbar711 Yo your problems and greed with these medical companies are legit. But at the same time it was nice to get a vaccine that saved my life when I got Covid-19.,en
2022-12-31 13:02:45+00:00,2478858925,@Burdick8Matt @TimRunsHisMouth But if cases have risen that means there are people not vaccinating against measles since the covid 19 vaccine the number of antivaxxers have gone up as well,en
2022-12-31 13:02:00+00:00,46354716,"Paid and unpaid carers are more likely to be exposed to winter viruses. Both the flu and COVID-19 vaccines are available to carers this winter. For more information on seasonal vaccinations, go to https://t.co/UcgjlMlLAI.",en
2022-12-31 13:01:25+00:00,65073830,Check out this week’s #COVID19 testing sites throughout the five boroughs. Testing is no cost to you. COVID-19 vaccines are available at select locations. Hours and locations: https://t.co/qjyyFp3hYa https://t.co/XYk2G4mL7l,en
2022-12-31 13:00:19+00:00,1098892220801998850,A COVID-19 booster vaccine increases your immunity against serious illness by around 90% within two weeks. Find out if you're eligible for your free COVID-19 booster and flu vaccines and boost your immunity 👇https://t.co/pNwGafxcWu https://t.co/cIlMiHUhb5,en
2022-12-31 12:58:51+00:00,1594061499986857984,Please Share This Video: COVID-19 Vaccines Roundtable Highlights with Senator Ron Johnson https://t.co/yEw5wBzx1n,en
2022-12-31 12:56:34+00:00,2602416260,"@Jateba1 @CalltoActivism As a leading member of the House, Nancy Pelosi has access to information that could influence the stock market. For example, she would have known details about the COVID-19 lockdown, proposed government assistance, and potential vaccines days or weeks before the public.",en
2022-12-31 12:56:25+00:00,1353824630818168835,@Asso_Emilys But the questions here are:Is there other research to show the opposite?Are we sure for all the safety considerations of covid-19 vaccine?Why we choose mRNA vaccination while we can have a counter treatment to suppress cytokien storm and regulate the inate immunity ?,en
2022-12-31 12:55:06+00:00,1026550427981176832,Dr John puts mRNA COVID-19 vaccines into context with regards to serious adverse reactions in people and puzzles as to why the vaccines are not withdrawn.https://t.co/3kLMZNIeo9,en
2022-12-31 12:52:18+00:00,1608227199957491712,"@elonmusk Elon, you still need to check the coding for Twitter. If you use your account and start speaking negatively of the Covid-19 vaccine or Democratic coverups you will start getting followers and requests from bots using trashy womens photos as followers that track every comment.",en
2022-12-31 12:52:10+00:00,1311421252133847041,"Frequently asked questions on #Covid 19 #vaccineshttps://t.co/sylLZtwhsS Troubles aside, Xi says China on 'right side of history'",en
2022-12-31 12:52:09+00:00,1311421252133847041,"Frequently asked questions on #Covid 19 #vaccineshttps://t.co/sylLZtwhsS Despite war, some Ukrainian families reunite for New Year",en
2022-12-31 12:51:34+00:00,1093697610144190464,"@healthbyjames Please start specifying ""COVID-19 mRNA Anti-vaxxers"". I've have still yet to meet one single person in real life that is against all vaccines in my entire life.",en
2022-12-31 12:51:03+00:00,1360174889769054209,"JUST IN - U.S. CDC coordinated with Twitter, Facebook, and Google to censor users who questioned the COVID-19 vaccine, according to internal communications.https://t.co/fdFcfok3WX@disclosetv",en
2022-12-31 12:49:33+00:00,914622937,As if it was a variant of the Influenza virus. The flu vaccine is offered before the flu season begins to avoid pressure selection &amp; variants caused by a vaccine. Covid-2 vaccine was rolled out during the Covid-19 period &amp; thus caused the variants. I guess we all would have.,en
2022-12-31 12:49:17+00:00,1353824630818168835,"@Asso_Emilys My call here is not just the vaccine it regarding  to potential effect of COVID-19 and especially spike protein part which is a part of the vaccine , I am not anti-vaccine hoaxer to make it clear. Vaccines save a lot of lives to be more and more clear.",en
2022-12-31 12:48:49+00:00,749525383,"@AbraarKaran BUTFrom the discussion:""It is important to emphasize that although infections may now be more likely, COVID-19 vaccines have been shown to remain effective at preventing hospitalization and severe disease even against Omicron""So maybe not panic yet?",en
2022-12-31 12:47:20+00:00,986693681989210113,I am worried. Covid 19 is back with vengeance. Is SA ready? Where is your mask? Where is your sanitizer? Ready to apply for a tender at govt deptmnt? Ready for isolation?  Ready for another vaccine booster? Looks like we are about to re-live the past life. https://t.co/V2O1eGxl6E,en
2022-12-31 12:46:37+00:00,1491791368611459078,"We are just lab rats:""The bivalent COVID-19 vaccine booster was 30% effective in preventing infection, during the time when the virus strains dominant in the community were represented in the vaccine.""https://t.co/tJ65mHTLdw",en
2022-12-31 12:46:18+00:00,115308684,"No, the FDA did not say that the Pfizer COVID-19 vaccine causes blood clots https://t.co/cotMVDM8aq",en
2022-12-31 12:45:34+00:00,707456768021028865,Why we probably won't get new covid-19 vaccines in 2023 https://t.co/jdU5xVNQJr,en
2022-12-31 12:45:04+00:00,1451616680900186117,"Look at the serious adverse events reported in the Phase 3 clinical trials for Pfizer and Moderna, there is cause for concern.  The paper says, “Full transparency of the COVID-19 vaccine clinical trial data is needed to properly evaluate these questions. https://t.co/cDzx42vMmB",en
2022-12-31 12:44:57+00:00,117536679,@benhabib6 Lawmakers need to consider that things have changed considerably since 2020: 1.) COVID-19 is no longer a novel disease 2.) Vaccines are available for the vulnerable 3.) Antiviral treatments are available for those struggling with active infections,en
2022-12-31 12:44:29+00:00,1496980559817592836,"@pastorlocke So serious question for any unvaccinated who dont mind sharing. What is your basis for not getting a COVID-19 vaccine at this point? Is there still not enough data to show risk of side effects? Or is there a ""mark of the beast"" thing with it? Is it a presonal freedom thing?",en
2022-12-31 12:41:29+00:00,1460459111586443266,@ascot_john @_jenniferlong The drug AZT was created to treat HIV but instead it killed many people. I never trusted the Covid-19 vaccine because I recall the dark history of medicine. Tuskegee Experiment. The government approved experimentation of its citizenry is horrifying. Never trust the government.,en
2022-12-31 12:37:14+00:00,843056155601510401,“The year began inauspiciously with Premier Scott Moe feuding with a renowned excess death researcher and spreading false information about COVID-19 vaccines” it’s certainly been quite a year in Saskatchewan 🫣 #skpoli  https://t.co/C2ZLPCAbHY,en
2022-12-31 12:37:04+00:00,1311902091246329856,COVID–19 Vaccine Protection ActRead twice and referred to the Committee on the Judiciary.https://t.co/vV5lvI7odv,en
2022-12-31 12:34:12+00:00,1729556064,"Update today Dicember/31/2022 of pandemic Covid-19 on the planet: Total confirmed 660,317,813. Total deaths 6,689,978. Total Vaccine Doses Administered 13,162,761,528 and daily graph. https://t.co/DJUoQWb4bx",en
2022-12-31 12:34:04+00:00,1525314824934068224,"The history of period from 2020 to 2022 in Japan2021: Events have been resumed little by little, but the number of audience was limited. Taking vaccines for COVID-19 has started",en
2022-12-31 12:32:41+00:00,17535349,"@GoodwinMJ ""such as Britain’s success in developing its own COVID-19-vaccine"" was done under EU legislation.""respond decisively to the Ukraine crisis"", nothing to do with EU membership or not.",en
2022-12-31 12:30:28+00:00,709947536,COVID-19 hospitalization levels for NC's oldest old exceed pre-vaccine period - WFAE-- News | The Perfect Enemy: https://t.co/jZUTQoPLAj.#Children #Coronavirus #Coverage #LongTermCare #RaceEthnicity #Vaccines https://t.co/ygBWPeVAzP,en
2022-12-31 12:30:15+00:00,37716311,COVID-19 hospitalization levels for NC's oldest old exceed pre-vaccine period - WFAE-- News | The Perfect Enemy: https://t.co/aZD7frg7Lp.#Children #Coronavirus #Coverage #LongTermCare #RaceEthnicity #Vaccines https://t.co/PYlAmxbnXn,en
2022-12-31 12:28:34+00:00,1597043731533815811,Please Share This Video: COVID-19 Vaccines Roundtable Highlights with Senator Ron Johnson https://t.co/AxVcRmxdK8,en
2022-12-31 12:26:57+00:00,962845652353978368,"@Richbink @herbersh @drdrew @DrAseemMalhotra @AskDrDrew 10/ - Finally, there is NO evidence that vaccine-induced spike proteins are toxic. During a radio interview (the media; not science!), Byram Bridle surmised that COVID-19 vaccines might be linked to cardiovascular issues and infertility, and referred to the spike protein ...",en
2022-12-31 12:25:17+00:00,962845652353978368,"@Richbink @herbersh @drdrew @DrAseemMalhotra @AskDrDrew 7/ - There is evidence that intramuscular vaccines such as the COVID-19 vaccines only travel as far as the original injection site (arm muscle) and adjacent lymph nodes. For instance, see this peer-reviewed study demonstrating this in macaque monkeys: https://t.co/HavGE71fcM. ...",en
2022-12-31 12:24:00+00:00,835650270,Effectiveness of the Coronavirus Disease 2019 (COVID-19) Bivalent Vaccine https://t.co/pRDATfspI4,en
2022-12-31 12:23:22+00:00,1028831506645610496,"Highly immune evasive omicron XBB.1.5 variant is quickly becoming dominant in U.S. as it doubles weekly https://t.co/5BJiogD6Ni @goldseek Virus evolves, so do facts. Covid-19 subvariants further comprimise the efficacy of older and current vaccines.",en
2022-12-31 12:21:49+00:00,1523131437574197248,Please Share This Video: COVID-19 Vaccines Roundtable Highlights with Senator Ron Johnson https://t.co/v4dVNUueU3,en
2022-12-31 12:21:30+00:00,962845652353978368,"@Richbink @herbersh @drdrew @DrAseemMalhotra @AskDrDrew 1/ You need to read up on how the COVID-19 vaccines work, as well as other related research. - The COVID-19 vaccines in use today do NOT contain any live virus, so they CANNOT cause any infection/disease, including the disease known as COVID-19 (see https://t.co/rdttOzE4JW). ...",en
2022-12-31 12:20:46+00:00,1575378615956639744,TrustHealthInf: Frequently asked questions on #Covid 19 #vaccineshttps://t.co/nRYuXVeK8A Benedict’s resignation sparked calls for retirement protocol,en
2022-12-31 12:20:45+00:00,1575378615956639744,TrustHealthInf: Frequently asked questions on #Covid 19 #vaccineshttps://t.co/nRYuXVeK8A Benedict's lasting mark on papacy will be his resignation,en
2022-12-31 12:20:45+00:00,1575378615956639744,TrustHealthInf: Frequently asked questions on #Covid 19 #vaccineshttps://t.co/nRYuXVfhY8 Vatican says Pope Francis will celebrate funeral for Pope Emeritus Benedict XVI on Thursday in St. Peter's Square,en
2022-12-31 12:20:44+00:00,1575378615956639744,"TrustHealthInf: Frequently asked questions on #Covid 19 #vaccineshttps://t.co/nRYuXVeK8A UK problems won't go away in 2023, Sunak warns",en
2022-12-31 12:19:12+00:00,937962626222497793,"Year-ender 2022: Despite vaccine strides, India not out of Covid-19 shadow yet https://t.co/YrfziafefZ",en
2022-12-31 12:17:35+00:00,1452764998669938688,@CromwellsD @_johnbye @jneill @Ofcom Did you know taking some prescription medication for HG in pregnancy doubles risk of harm to the baby? 🚨 From 1 to 2% (GP source)Risk is a personal balance between likelihood and consequence. Risk of myocarditis is higher for Covid-19 than for the vaccine.,en
2022-12-31 12:15:45+00:00,922798177,"#OnThisDay #DidYouKnow #December 31, 2020: The World Health Organization issues its first emergency use validation for a COVID-19 vaccine. https://t.co/xUzRGjrcQ6 #OTD #FactsApp",en
2022-12-31 12:14:43+00:00,30848675,"https://t.co/b2vy1EJKTi37 deaths for every 100 road accidents makes rash driving and not following road discipline, 100 times more severe epidemic than covid-19 and unfortunately there is no vaccine for it. Yet no one is talking about it. @RoadsOfMumbai",en
2022-12-31 12:14:07+00:00,255411008,"He’s hugging on to the precious pandemic narrative.Covid-19 was created in a lab to push vaccines as well as the implementation of a dystopian control infrastructure, so that lockdowns can be used while the globalists rollout the 4IR.@Nigel_Farage is now supporting globalism.",en
2022-12-31 12:09:47+00:00,4766245999,@Dharmen46587056Indian Home Made vaccine for Covid-19 and seasonal virus .Still today people are using this pickle --2 years old pickle.👍👍👍👍👍👍👍👍👍👍👍👍https://t.co/lwDNidgAwG,en
2022-12-31 12:09:20+00:00,1441838229028630528,"Swine Flu Vaccine (1976)-1 serious event per 1000000 vaccineesVaccine Withdrawn.Rotavirus Vaccine , Rotashield (1999)- 1 to 2 serious event per 10000 vaccineesVaccine Withdrawn.Covid-19 mRNA Vaccines-1 serious event per 800 vaccineesVaccine officially promoted. 🤡",en
2022-12-31 12:06:28+00:00,1381294269118447622,Dr John Campbell - a history of vaccines and when they've been taken off the market - concluding with Covid-19. Mind Blowing! I would like someone on the left to Justify what our Government IS DOING!!! Certainly NOT looking out for We The People https://t.co/RKgzcju0YC,en
2022-12-31 12:04:41+00:00,40933920,#AndinaEnglish Peru: Over 86.62 million COVID-19 vaccine doses applied https://t.co/xdRGAw58uk https://t.co/n8sihWrANh,en
2022-12-31 12:00:44+00:00,1437903130985914373,@SallyPa50765326 @RealGemmaOD @NewsNancy9 The evidence is very clear you're more likely to get myocarditis or blood clot from a serious infection like covid-19 then from any vaccine ever. And it's only around the time you take the vaccine not a year later.,en
2022-12-31 12:00:38+00:00,2284162862,"Vaccines can protect us from COVID-19 by preventing us from getting infected at all and by preventing us from getting sick, ending up in the hospital, or dying – even if we are infected.#covid #ngo #charity #nonprofit #education #donate #volunteer #help #usa https://t.co/38afh0PoNg",en
2022-12-31 12:00:29+00:00,30280302,"🥳 'Tis the season to be jolly, but don't forget flu, Covid-19 and other viruses spread very easily when mixing indoors. If you have symptoms of flu or Covid-19, stay at home and avoid contact with others. Vaccines are available, visit https://t.co/ouISh7tuUP https://t.co/EVHHAydoGA",en
2022-12-31 12:00:07+00:00,22774160,Kushner =- Trump Mafia CEO- Client of SA and Russia- Vaccines corruption and Covid-19 deaths- abetting Khashoggi murder- aiding 2016 election activity by Russia,en
2022-12-31 11:58:53+00:00,453893287,"Florida Supreme Court Gives DeSantis Go-Ahead on COVID-19 Vaccine Grand JuryDeSantis petitioned the court for a grand jury last week, blasting vaccine manufacturers for touting questionably high efficacy rates and other claims that led to government mandates.🍿🍿🍿🍿🍿🍿🍿🍿",en
2022-12-31 11:57:33+00:00,518659141,"Analysis of Antibody Neutralisation Activity against SARS-CoV-2 Variants and Seasonal Human Coronaviruses NL63, HKU1, and 229E Induced by Three Different COVID-19 Vaccine Platforms https://t.co/azY2zdbCE5 #mdpivaccines via @MDPIOpenAccess",en
2022-12-31 11:53:44+00:00,1268598013,"@ninaturner COVID-19 vaccine was not free.  Taxpayers paiFederal Purchases of Pfizer and Moderna COVID-19 Vaccines have Totaled $25.3 Billion at an Average Price of $20.69 per DoseJesus said to him, ""I am the way, and the truth, and the life; no one comes to the Father except through Me.",en
2022-12-31 11:52:00+00:00,1311421252133847041,Frequently asked questions on #Covid 19 #vaccineshttps://t.co/sylLZtwhsS Benedict’s resignation sparked calls for retirement protocol,en
2022-12-31 11:51:59+00:00,1311421252133847041,Frequently asked questions on #Covid 19 #vaccineshttps://t.co/sylLZtwhsS Benedict's lasting mark on papacy will be his resignation,en
2022-12-31 11:51:59+00:00,1311421252133847041,Frequently asked questions on #Covid 19 #vaccineshttps://t.co/sylLZtwhsS Vatican says Pope Francis will celebrate funeral for Pope Emeritus Benedict XVI on Thursday in St. Peter's Square,en
2022-12-31 11:51:58+00:00,1311421252133847041,"Frequently asked questions on #Covid 19 #vaccineshttps://t.co/sylLZtwhsS UK problems won't go away in 2023, Sunak warns",en
2022-12-31 11:50:16+00:00,709947536,'People still need to be diligent.' A new approach in coping with COVID-19 in Minnesota - KSTP-- News | The Perfect Enemy: https://t.co/hTCTLRkM0X.#Coverage #Vaccines https://t.co/P5P9qhc9hz,en
2022-12-31 11:50:04+00:00,37716311,'People still need to be diligent.' A new approach in coping with COVID-19 in Minnesota - KSTP-- News | The Perfect Enemy: https://t.co/r4u9tyhgWZ.#Coverage #Vaccines https://t.co/BvEYNn0sL6,en
2022-12-31 11:49:31+00:00,1602149992965496832,"@canukgord COVID-19 vaccines were ALWAYS designed to prevent severe illness and death from COVID-19, not transmission.Stop lying and/or posting misinformation. It's not wrong to be ignorant. It's wrong to keep making things up.",en
2022-12-31 11:49:25+00:00,991386113154658304,@Smilje Do you think you've identified something wrong with the Covid-19-mrna-vaccine animal trials?Or - are you among those believing such weren't conducted?https://t.co/WF3Pudj127,en
2022-12-31 11:49:16+00:00,476903245,"Flashback 3 Years today...#OnThisDay in 2019: First word about Covid (even if no one of knew/was paying attention at the time). A few days later (January 5); the #WHO released this alert ""Covid-19 China"" https://t.co/QZlzjtZ07l #WHO #Covid #CoronaVirus #Covid19 #Wuhan #Vaccines https://t.co/1lcXMwUvyl",en
2022-12-31 11:48:54+00:00,1608934282856218626,@FaisalJaffery4 COVID 19 vaccine done.,en
2022-12-31 11:48:49+00:00,1515484593734164481,I started year 2022 with a Covid 19 booster shot. It ended with me regretting having the vaccines at all. I developed CKD after my Pfizer vaccines.,en
2022-12-31 11:47:37+00:00,1509170660610027522,As we all know that a new variant of Covid 19 has been discoveredso it is now our responsibility to take the heterologous vaccine Choose Booster Heterologous,en
2022-12-31 11:42:28+00:00,720999931885056004,COVID-19 vaccine boosters for young adults: a risk benefit assessment and ethical analysis of mandate policies at universities  https://t.co/RdlH73Egp1,en
2022-12-31 11:42:05+00:00,1602149992965496832,"@Gem_WifeOfRhye Nothing is perfectly safe. Even too much water, or air in the wrong places, will kill us.But the risk of dying from COVID-19 is significant. Vaccines offer our own immune system the opportunity to TRAIN to fight against COVID-19.No different from training your army before war. https://t.co/3qTljDADh9",en
2022-12-31 11:41:24+00:00,1189614217982296064,"@ebmpsykiatri @signesignum @fialott1 ""In 2022, we argue that COVID-19 vaccine strategies must remain focused on severe disease, and that global equity in achieving high adult coverage (ie, for those aged 18 years and older) of at least one dose is key to minimising severe COVID-19"". Inte barnhttps://t.co/tFKmfhL9E9",en
2022-12-31 11:40:30+00:00,1575730844022452224,The Vaccine: Inside the Race to Conquer the COVID-19 Pandemic VIPKYIKhttps://t.co/JJawB2W3Lg https://t.co/P4ymTEPDyz,en
2022-12-31 11:40:00+00:00,3309282453,"COVID-19 and flu spread more quickly in winter and can cause serious illness. If you’re 50 years or over, you are eligible for a free flu vaccine and a COVID-19 booster. #GetBoostedhttps://t.co/givhRHEY6x https://t.co/VpiucMlrcZ",en
2022-12-31 11:38:00+00:00,172867574,New law ends COVID-19 vaccine mandate for US troops | AP News https://t.co/C9RAAH0vWM |||,en
2022-12-31 11:37:56+00:00,1432926898208792578,"@DHSWI I will “Stay healthy and enjoy the people and activities you love the most this season,” without the COVID-19 “vaccine” and “boosters,” due to the fact that they are causing strokes, heart attacks, blood clots, horrible skin conditions, etc. etc. NO THANKS, FUCK THAT.",en
2022-12-31 11:35:53+00:00,884280375861587968,New Study Found A 9-Times Increased Rate Of Myocarditis In Males After mRNA Booster | 3 Or More COVID-19 Vaccine Doses Associated With A 6-Fold Increased Risk Of Infection Said Cleveland Clinic | ETC https://t.co/KyDMwOZmgx,en
2022-12-31 11:31:42+00:00,4768326807,"1999 - Boris Yeltsin resigns as President of Russia, leaving Prime Minister Vladimir Putin as acting President2020 - WHO grants the Pfizer/BioNTech COVID-19 vaccine emergency authorization, paving the way for worldwide distribution",en
