date,userid,tweet,lang
2022-11-10 15:02:38+00:00,06aab4d7841ecfcda99aa3607cb62c40,"The NHS is inviting people aged 50 years or over, those with certain health conditions and pregnant women to have the flu vaccine and COVID-19 booster.Find out more and book an appointment ➡ https://t.co/X9TyqYrev9 https://t.co/kfxxQ0Gdyw",en
2022-11-10 15:02:11+00:00,473bda7a162bec19c8e06c347faed950,We're still here. We're still listening. We're still working for you!The SC Disability Vaccine Access Network is here to help you understand COVID-19 with easy-to-understand facts! Learn more:https://t.co/irMqU8bGFE#COVID19 #Disability #VaxFacts@SCDDCouncil @DisabilityRtsSC https://t.co/hPNPJAYLrB,en
2022-11-10 15:01:57+00:00,78ad461d5d6c4c4a2a42c2ab6dec3a71,"Happy Thursday everyone! We are hosting a COVID-19 vaccine clinic today at Indian Spring Middle School. Stop by to receive your COVID-19 vaccine or booster!Thursday, November 10Indian Spring Middle School500 N University Parks Dr4:30 pm - 8:00 pm https://t.co/7SDADAeCQy",en
2022-11-10 15:01:38+00:00,2ba69703d98f527b30aed44f772bc687,COVID-19 vaccine update: children age 5 and up are now eligible to get an updated #BoosterDose from Pfizer or Moderna! Learn more about COVID vaccines and boosters:https://t.co/vtFLKylCPT https://t.co/VxaeJdlr0E,en
2022-11-10 15:01:30+00:00,a614dd11782cf6a43f0ad8dc4accc9d219fabdf7cb2f5042a48b6c1e2cf2a424,Students from the Students Igniting Vaccine Confidence team have created a chalk mural in a campaign to promote confidence in vaccination against COVID-19. Check out the main floor of the Essex Centre of Research (CORe) building.Read about the contest!👉https://t.co/f9pcDXeir3 https://t.co/vWPJtjB8dX,en
2022-11-10 15:01:26+00:00,af8548929ae2ee960f75d35428d1bd5f2e533ae2e2800d5d4b5e30903636cf71,"“Although the effectiveness of the currently available vaccines against new variants may decrease, vaccination still provides protection against severe COVID-19 caused by different variants and may also decrease the emergence of new variants.” https://t.co/nIC12lnjne",en
2022-11-10 15:01:21+00:00,21a3a3fdac7ccae7684a44a6eaedb236,"Immunizations protect you and your community!  Remember to keep up with COVID-19, flu and other vaccines.#PAAAP #ImmunizePAAP #ImmunizePA @pa_aap @ImmunizePA https://t.co/RXJfKqa6s3",en
2022-11-10 15:01:07+00:00,297be6f3a8cb68c3bee01515c358c49d,"Don't miss out on holiday gatherings and dinner parties this fall and winter because you're feeling ill. Get your bivalent COVID-19 booster vaccine on Thursday, November 10, 2022 at 2100 Campus Drive in Rochester. https://t.co/gO5zvwdvf7",en
2022-11-10 15:01:06+00:00,62b2c7997490e84147292a5ec7bc2e606a3b1d0da108c24c65e6622553fd381a,Boston Celtics promoting Covid-19 Moderna vaccine… https://t.co/vMDPxWtGpl,en
2022-11-10 15:00:58+00:00,507915083cf9395574756fef25cbbcb878f2998e207d21b672d72f22f35c31f1,"The latest data on gynaecological reactions to covid-19 vaccines. Data from MHRA to 26/10/22.Despite an alarming number of problems, doctors are still routinely recommending the jab for pregnant women. Why? https://t.co/bx5mtOyHuG https://t.co/CsnHfSzS9x",en
2022-11-10 15:00:40+00:00,85f25f68ba7a8f74288a4c4e86c33a7643e62c7dcc04846aaa07447d40767fa8,"@NeilMcCrossin @MRobertsQLD So was the covid 19 💉💉💉💉safe and effective?  Not quite!  Did it stop transmission..,,No!  So what were vaccine passports for and mandating most workers to be jabbed?  Do you know how many billions of taxpayers $$$ gone into the Pfizer and moderna? And all for what?  It’s back",en
2022-11-10 15:00:39+00:00,2a65d3da52fdd9af41691dc0f87517ca,"Faith in Vaccine Pop-Up Clinics are available for 1st dose, 2nd dose, and boosters. Pfizer vaccines for residents 12 years and older will be available at the walk-up vaccination sites listed. Visit: https://t.co/iYybX7rHQ0 to learn more about the COVID-19 vaccine. https://t.co/2dwotloGER",en
2022-11-10 15:00:32+00:00,d0c5944945c71513af068397859433dd748736d7c31d767e217d2b1b596f2c32,"The Latest COVID-19 Variants Can Evade Vaccine Protection, According to New Data https://t.co/MHXLvXvN89 NOT sure WHY the scientific world is speaking about suggestions! They have a paid JOB responsibility is to give true, Honest and proper answers. based on Facts!!",en
2022-11-10 15:00:17+00:00,fa75b73b64cf3fe999578d425cbdda6d,Protect yourself and your loved ones. Stay up to date on your COVID-19 vaccines and boosters. Find your vaccine at https://t.co/2gYlxQCFnR or call 833-308-1988 Mon-Fri 7am-6pm for an in-home vaccination appointment. https://t.co/BKpjMKLTos,en
2022-11-10 15:00:05+00:00,072457e950baf1c325de2ff0cab77b5a,@DKMCHC helped increase COVID-19 vaccine uptake in rural Nova Scotia by integrating vaccine information into primary care visits. Learn more a case study about them at: https://t.co/lmdWuaefWO @NSACHC #CVPNational https://t.co/RGgJP5kJGA,en
2022-11-10 15:00:02+00:00,7e76ff78c5280a382145eb46ecf21de0,The COVID-19 boosters are an excellent example of mRNA technology being used to save lives!Check out how our mRNA Gene Delivery Solutions can be used to support your development of the next big RNA vaccine!https://t.co/3dFpJQ0xTq https://t.co/ixURxpzA7I,en
2022-11-10 15:00:01+00:00,f8f43d39bdb127fe60eded5b4c2d30fb,"Did you know…?👍🏽 Getting vaccinated is the best way to keep you, your family, and your friends safe from COVID-19👍🏽 The FDA and CDC have the highest standards for ensuring safety of vaccines📺 Hear from Fred about why he got his 2-dose COVID-19 vaccines AND a booster shot! https://t.co/PKWaLZzkN4",en
2022-11-10 14:58:27+00:00,c740a434e045f67984f61d8981afeefc,"@SpyVsSpy20 @ChrisMGra @Sharky_vs_Evil @DuckYouAntiVaxr @DrJamesOlsson We can agree to this ""And while plenty of people have linked Brignole’s death with his comments about the vaccine, the Los Angeles Medical Examiner’s office is adamant that his demise was actually caused by a Covid-19 infection.""",en
2022-11-10 14:57:02+00:00,a7052005bba7e0336b72a306f99487ceff92c98d7b0fa2c1e6d3d090314b65f2,New Yale study finds promising results with nasal COVID-19 vaccine - Yale Daily News https://t.co/svX4365OTH,en
2022-11-10 14:56:46+00:00,5c06b566c78196f3269b2a1eafed47ee,https://t.co/rFDlyD4cuc Delayed Hepatitis Following COVID 19 mRNA Vaccine and an Accidental Booster,en
2022-11-10 14:56:45+00:00,429ebef3bcf448e998d5cb0d18e5b3aa,The Loudoun County Health Department is hosting COVID-19 booster events next week at Cascades Library and Purcellville Library. People age 5 and older are eligible to receive an updated booster two months after their last vaccine dose. @LoudounCoHealth https://t.co/8vllnvk1GJ,en
2022-11-10 14:56:02+00:00,524ea1ce7dbbcd6dde84e2b9552ef270,A study published by @NLM_NIH aims to identify the factors associated with COVID-19 vaccine hesitancy among South Asians in London. Findings suggest some individuals may be existing in a state of 'inbetweeness' – neither pro nor anti vaccination: https://t.co/zpKTLv3SaS,en
2022-11-10 14:55:30+00:00,fb767777ab3a79f40c5909b3fc9bd2c8,"Adherence to ongoing or future #vaccination campaigns is crucial to prevent #COVID-19-related morbidity and mortality in fragile. Discover the #hesitancy toward the vaccines among Kidney, Liver and Lung #transplant recipients! https://t.co/SSiKH7Ypfc #mdpivaccines @MDPIOpenAccess",en
2022-11-10 14:55:12+00:00,cfcddd2c19f9d8be3f85fb2fb279662f,"COVID-19 and flu spread more quickly in winter and can cause serious illness. If you’re 50 years or over, you are eligible for a free flu vaccine and a COVID-19 booster. #GetBoostedLink:Find out how to book at https://t.co/XiSvGTwIUH https://t.co/WILzi5tR9X",en
2022-11-10 14:51:59+00:00,9d90a7818d1c11481fd22bc28330f20e,"@DrAseemMalhotra Where is the proof that he has taken the booster shot, and where is the proof that the shot is actually the booster (mRNA covid-19 vaccine) and not a placebo?",en
2022-11-10 14:50:37+00:00,51954d7de31560a349c7a38ccc89cc7d72e77f43c2ae789fa477206320e4e50d,"@realscottchegg @ProfessorFerg06 “Because the FDA initially authorized the vaccines for emergency use, health care providers are legally required to submit adverse events reported after the COVID-19 vaccines, even if they don’t suspect the vaccine caused them.”This is true for all vaccines, not just EUA.",en
2022-11-10 14:48:08+00:00,9ffd153f9ceee3a1c832746d689cf8d1,@JakeWilde @mrdanwalker @clairebarberpr You see what you have just written there has no basis in reality. The over 55s (like me) and other younger vulnerable ones get vaccinated for influenza. There was no Covid-19 vaccine then. 🤷‍♂️,en
2022-11-10 14:48:00+00:00,eae54ae32befd7e1160d489efd060471e01a25b9ff1a8debb4175dbb009c92b4,"$BNTX [15s. delayed]: Issued Press Release on November 10, 09:45:00: Pfizer and BioNTech Receive Positive CHMP Opinion for Omicron BA.4/BA.5-Adapted Bivalent COVID-19 Vaccine Booster for Children 5 Through 11 Years of Age in European Union https://t.co/EgAuMDGn0P",en
2022-11-10 14:47:01+00:00,a9bc16cfe9e4c07ca65b8401547f82060c99a574c76dd0e447c8dae5185cf932,$PFE 2022-11-10 09:45 ET Pfizer and BioNTech Receive Positive CHMP Opinion for Omicron BA.4/BA.5-Adapted Bivalent COVID-19 Vaccine Booster for Children 5 Through 11 Years of Age in European Un...https://t.co/5jcB7l4128,en
2022-11-10 14:46:44+00:00,63f6ff24666f9b97b8e6bdf5b8e12bd0f963cd995f82474e37fd53b0377f1243,Pfizer and BioNTech Receive Positive CHMP Opinion for Omicron BA.4/BA.5-Adapted Bivalent COVID-19 Vaccine Booster for Children 5 Through 11 Years of Age in European Union$PFE $BNTX,en
2022-11-10 14:46:37+00:00,dead956e088467dd868b29b096bc1d60c9c89875f6852d7be3e308bd09f2f02e,$BNTX  Pfizer and BioNTech Receive Positive CHMP Opinion for Omicron BA.4/BA.5-Adapted Bivalent COVID-19 Vaccine Booster for Children 5 Through 11 Years of Age in European Union 1/3,en
2022-11-10 14:46:00+00:00,aa8f444ea0b79f0d60ca3f4bc3bf71d0e302a6ca7d7a1e55fea7e8ad684195d5,$BNTX  Pfizer and BioNTech Receive Positive CHMP Opinion for Omicron BA.4/BA.5-Adapted Bivalent COVID-19 Vaccine Booster for Children 5 Through 11 Years of Age in European Unionhttps://t.co/J5euiv6Tr4,en
2022-11-10 14:45:43+00:00,6ccd28582b653429e4bbe3e594ecaa5294038daac28575f77e0cee2c81baa7e2,Pfizer and BioNTech Receive Positive CHMP Opinion for Omicron BA.4/BA.5-Adapted Bivalent COVID-19 Vaccine Booster for Children 5 Through 11 Years of Age in .. $BNTX $PFE https://t.co/XLxF0m1Y56,en
2022-11-10 14:45:22+00:00,980a40eeec6eb78b08e9170798631d15,$PFE $BNTX Pfizer and BioNTech Receive Positive CHMP Opinion for Omicron BA.4/BA.5-Adapted Bivalent COVID-19 Vaccine Booster for Children 5 Through 11 Years of Age in European Union,en
2022-11-10 14:45:15+00:00,2d51fb9d0db4251ed8ac4c92a76a7b59770dcfc807c3dfa878ad99f1544ed7a1,$BNTX  Pfizer and BioNTech Receive Positive CHMP Opinion for Omicron BA.4/BA.5-Adapted Bivalent COVID-19 Vaccine Booster for Children 5 Through 11 Years of Age in European Unionhttps://t.co/YLVpgnAleT#vaccine #covid19,en
2022-11-10 14:45:13+00:00,b652975c5d3fb598fde3143be08822b2a0a0b150e777820bcd7eb42602619ba9,"If she dies, they murdered her. “We can save your life like we took an oath to do, but you won’t comply with a procedure proven to do nothing” is murderTerminally ill woman denied organ transplant due to COVID-19 vaccine status loses Alberta court appeal https://t.co/un59HoWB1y",en
2022-11-10 14:42:03+00:00,f2953358015effc78b1cb36864039696,New Research: Endocrine system after 2 years of COVID-19 vaccines: A narrative review of the literature: PurposeThe purpose of this study was to describe the current knowledge on the potential endocrine adverse effects… https://t.co/EFYevO46aU #Endocrinology #Endo,en
2022-11-10 14:41:56+00:00,90d0df533fb16d1b51c079b4aa1fc617,"WORLD FIRST: ROBOTIC ARMS Assembling Via Nanotech Inside COVID-19 ""Vaccines"" - Filmed in Real Time - Dr. Nixon https://t.co/l1KZHM4uEF",en
2022-11-10 14:40:02+00:00,0bee867f6bd900fd702508a8403a24a3840575f21bd583899dd1be3620a865f4,I tried to get back into Bl*ire White as a so bad it’s good kinda thing but then she started spouting the anti-COVID-19 vaccine shit again and I couldn’t take it anymore,en
2022-11-10 14:39:28+00:00,da4f5d1b3a1b87c18d71919ff5b58362,"All 1,366 references for COVID-19 vaccine-associated complications are listed by subject matter:https://t.co/BEkz1Puaru",en
2022-11-10 14:39:22+00:00,44a6a0ad541f5ccd19b4ea9441724d26d66b609fd8016c399ea2d8e8bcdece5e,"#HappeningCoSAP organize a CoVID-19 Vaccine awareness creation and training for Young Female Leaders on SHG Concept, leadership and Management, and Digitalization @ Adama Ras Hotel, Nov 10-12, 2022#MasterCardFdn #CoSAPEthiopia1 https://t.co/0iydLPOw3u",en
2022-11-10 14:39:03+00:00,a3e505188a67ceebe07acb7bcc1b9b940ec7a0b2e079482bd4a9595a58d1467e,@AmitAryaMD “The findings corroborate previous reports of encephalitis and myocarditis caused by gene-based COVID-19 vaccines.”.https://t.co/jgwFE8EtpT,en
2022-11-10 14:38:12+00:00,7612d2ac333d3c8f846041004af10f40,National vaccine safety network launches survey to monitor the safety of COVID-19 vaccines https://t.co/PoIOAM59pL,en
2022-11-10 14:38:04+00:00,40f24d2e52d1f704518d6db1d0c5c784d2ae4a5878490145239e9825edc2c016,"Global Vaccine Disaster Report-274Peter A. McCullough, MD, MPH™posting on #GETTR：The surge in catecholamines and cortisol early in the morning 3-6 AM can be a trigger for sudden death in #COVID-19 vaccine myocarditis.  Since more than half of cases⋯https://t.co/L0jXYYeY2x https://t.co/8092wOtw4L",en
2022-11-10 14:36:52+00:00,c1a58a67535d98f4ed8b216e616fc386b82db147a386529955b908d951f36d0c,"@BethanyCherisse @michaelpbreton The CDC had to redefine “vaccine"" to suit Political and Pharmaceutical interest.ERGO, Nobody on the planet has been vaccinated against Covid 19. https://t.co/qic5nzRYgO",en
2022-11-10 14:35:47+00:00,40f24d2e52d1f704518d6db1d0c5c784d2ae4a5878490145239e9825edc2c016,Global Vaccine Disaster Report-273Zelenko Freedom Foundation Posting on #GETTR：If parents give Covid-19 vaccines or boosters to kids they are going to regret the consequences. Acute death Shorten lifespans Infertilityhttps://t.co/1q3oJNFWh8 https://t.co/PH00pkCAmw,en
2022-11-10 14:33:46+00:00,63d007d8abd866d5da666aaf522ff34d,"The first man to receive a COVID-19 vaccine was William Shakespeare.  ""All the world's a stage""They are laughing at us.",en
2022-11-10 14:33:17+00:00,27395c34fbe83f24dc3418962b55636a,"Even the US is offering everyone Covid-19 booster shots. Why is the UK adopting a ""vaccine only"" policy against SARS-CoV-2 but isn't allowing millions of people to access vaccines.",en
2022-11-10 14:31:14+00:00,d21850539265edb880e3bdd8ba0c3eba03ba54527d1fe9d3038e80eb21e50da4,"“paradoxically, despite the success of COVID-19 vaccination campaigns, vaccine confidence has significantly declined since the onset of the pandemic”https://t.co/oAlJS9bZq6 https://t.co/m08Lnmt6Hr",en
2022-11-10 14:30:57+00:00,d0198d24f653af24871f11fd619ab9f8bb75010aaaaf38b32354d9ba6df84ad7,"@PeterSweden7 Oh interesting, what was different from previous years other the Covid-19 vaccine. If you lost your child thank to @wef @georgesoros @BillGates @ProfKlausSchwab @JoeBiden",en
2022-11-10 14:30:56+00:00,9b5971aca2ae635c6d33eab7d657b933de1c8bbbba25addf4be94963dbfe3395,@LibertyMutual8 @hotmud When you consider the covid 19 vaccine was manufactured in 2017 you tend to question everything about the covid illusion.,en
2022-11-10 14:30:31+00:00,419081f200fbde87569241b55c7a634e903388681b2b43b235969cc012a44557,FACT: Pharmacists have administered over 50% of the COVID-19 vaccine doses in the US. We recognize the key role pharmacists play in our communities and the urgent need for #HR7213. https://t.co/HSqt7cFR0r,en
2022-11-10 14:30:28+00:00,711f0ffe35b592da1c21f32320a3a9c109b02e63154727994bd249670c3a6a82,@Acyn Wait a minute! Is that man still on air? This is the man working as a dem government puppet who lied to the world about the #covid-19 #vaccine on TV.,en
2022-11-10 14:30:13+00:00,2b185f09723de9cf1cd1cae8f950f414,"AstraZeneca is no longer pursuing U.S. approval of its COVID-19 vaccine, Chief Executive Pascal Soriot said in a media call on Thursday. https://t.co/oFGE6XtzB4",en
2022-11-10 14:30:13+00:00,08e01dc45ac03f6759125cbcdacaf057,The City of Toronto will drop its COVID-19 vaccine mandate and will reinstate unionized unvaccinated employees and those who failed to disclose their vaccination status: https://t.co/mz5AHRN2f7#employmentlawyer#employmentlaw#vaccinemandate,en
2022-11-10 14:30:02+00:00,1dc67d8f11b667cc9f560ba9d5241747,The positive effects of paid sick leave policies on COVID-19 vaccination rates could be replicable for the bivalent boosters or the flu vaccine. https://t.co/5Fx6g1IyAx #FluShot #Vaccine #CareAccess,en
2022-11-10 14:29:50+00:00,bbb890041fa8d8c1b113d2dcb013dc46,"@Jakey0709 @FraiseAdam @i_Michelle @SoniaPoulton “Kirsch ended up radicalizing himself into becoming a COVID-19 anti-vaxxer. He founded the anti-vaccine group Vaccine Safety Research Foundation, whose advisors include Byram Bridle, Peter McCullough, Robert Malone, and Stephanie Seneff” https://t.co/Xd6f9LytVE … https://t.co/BGf93MhADU",en
2022-11-10 14:29:09+00:00,43e1a16448f07b2eb643dbbac8cac96959089353dc5259318694bdc3f025c91f,Getting out to speak to people in our community is so important to make sure they have the right information and we understand people's concerns. Boost your immunity this winter with the COVID-19 booster and flu vaccines. Book yours now 👉https://t.co/c6M3QWJh9S,en
2022-11-10 14:29:09+00:00,36ff2c52e7898923c1efe0fe60465de2,Researchers compare the risk of myocarditis between Pfizer and Moderna COVID-19 vaccines https://t.co/MgeCkrSEAB,en
2022-11-10 14:27:19+00:00,d41190bb95e4375a91101c73446e7ed3557c318630b08acf1493599faa47e88e,FACT: Pharmacists have administered over 50% of the COVID-19 vaccine doses in the US. We recognize the key role pharmacists play in our communities and the urgent need for #HR7213. https://t.co/zYwLFsOBx3,en
2022-11-10 14:26:11+00:00,19ce671f905ab7abd9611bdc91de951ded32550d39fb225fd7de388e5348d635,Dr. McCullough Drops The Gloves &amp; Exposes Who’s Really Behind Covid-19 #COVID19 #vaccinehttps://t.co/sgsxR7hrYF,en
2022-11-10 14:26:02+00:00,ee88d2320cd1c280b64ce23a5e40aff5a7c12f5ddb58be84beb7a0315f40a65e,Long-Term Organ Damage after COVID-19 Vaccines Emerging in Medical Literature https://t.co/3y6UsfPB2t,en
2022-11-10 14:24:56+00:00,d7886c805edc8bda8ad3f6165cf3b4df8dcf805bdc6f89277e4ee7d9731809bd,"@US_FDA Peter Marks: Don't forget to update the warning labelsEuropean Medicines Agency (EMA) committee on Friday recommended adding heavy menstrual bleeding to the list of side effect of mRNA COVID-19 vaccines (inc boosters) made by Moderna, as well as Pfizer and its partner BioNTec",en
2022-11-10 14:24:07+00:00,51d6489d49633a0e68725a1a61f74657,"Trust in experts, media literacy connected to COVID-19 vaccine intention https://t.co/KKcjQxqovQ via @EurekAlert @WSUNews Key: ""trust in experts, the ability to identify reliable media sources, &amp; the ability to critically evaluate those media sources...""Pls, #ScienceUpFirst!",en
2022-11-10 14:22:06+00:00,798f2802c919944101c39b4b27cf147bc6822a78d00c705af398f1af373386d9,"WHO just launched an AI-powered voice chat that can provide guidance on stress management, healthy lifestyle, and COVID-19 vaccines. Go try it out and leave your comments below.#Voicechatbots #AIinHealthcare #digitalhealth #covid   #WHO https://t.co/fZPBFtui9X",en
2022-11-10 14:22:04+00:00,a262adc81e57d4545b5be748fb405658,Pre-pandemic conspiratorial mindset predicted hesitance to accept COVID-19 vaccine https://t.co/UmAICXtAzv via @physorg_com,en
2022-11-10 14:21:17+00:00,12b15091c92bb01eec4aa9037649f36b9aab651e3d514e19bc6663c798c22aef,"@InannaMika @RepPress @MaxBlumenthal The “rational” being — reduced potential risk of COVID impact to donor recipients.The COVID-19 vaccine requirement is not a prohibition on access to medical treatment at all; it is part of the medical treatment,” the judges wrote.",en
2022-11-10 14:21:13+00:00,d5abba8d77cde63191d51e2e7acdc8e919f2d9039f52f4581faaf6135d476aa9,@NightShiftMD @picardonhealth An Israeli study has concluded that the short-lived immunity and rapid waning of the Pfizer BioNTech COVID-19 vaccine necessitates the reevaluation of future COVID-19 vaccination campaigns.https://t.co/BwpgjZKvpM,en
2022-11-10 14:20:39+00:00,8f1bc4bb62e1605e4ace7eaeb1882e44ed57aecffffa2fb0315ac31bccac12d9,Dr Simone Gold: The Truth About the COVID-19 Vaccine https://t.co/qFK5Ctcsh8,en
2022-11-10 14:18:49+00:00,fbf33f48a72cd536279d6a40d7b7c72f,Study finds Moderna’s COVID-19 vaccine safe and effective for young children https://t.co/7LxdXN2Vu6 via @vumchealth. 🙌🙌🙌,en
2022-11-10 14:18:30+00:00,f3421b177527d4afc7190fccf1648a1b,Children as young as 6 and 5 years of age are now eligible to receive a single booster dose of either the #Moderna or #Pfizer-Biontech #bivalent #COVID-19 #vaccines. Check out the #MRxClinicalAlert for other #COVID-19 notable developments! https://t.co/cQOT8X4odS https://t.co/KDTCofE0ev,en
2022-11-10 14:18:23+00:00,8a2930332ceb40f9fc78894a246e83a813da86ced4a736c20ce7c5ef60c3b72e,"For those who have been injured by the COVID-19 vaccine, one might use sleep actigraphy to monitor  recovery.  @hervk102 SEE DETAILS https://t.co/wfg48p7Gup",en
2022-11-10 14:18:03+00:00,d32fb6490915c6f1014787192b1fc52c622ab3bb6ca816630340e2178b7ee8d0,"STOP the Infanticide! 5,000% Increase in Fetal Deaths Following COVID-19 Vaccines! #ArizonaHealth #USHealth #AmericanHealthCare #Wellness #Arizona [Video] https://t.co/XaF4AECiaK",en
2022-11-10 14:17:21+00:00,9389b5505a4179d6933a90c88c047107,"If you are pregnant, the best thing you can do to protect yourself and your baby is to have your COVID-19 vaccine.https://t.co/yTNEQXDd6k",en
2022-11-10 14:16:59+00:00,890faf10ced6a0ffa01a1e042796901a,"'False &amp; Misleading Efficacy Claims—Why? CDC Director, Rochelle Walensky, MD, MPH, for the record, continues to make false claims about the COVID-19 vaccine boosters with the apparent motivation of getting more Americans “fully vaccinated.”' https://t.co/skBOunFSx3",en
2022-11-10 14:16:22+00:00,d675b99d33c2e9858a7a50a0a5e98aa6,Today's COVID-19 vaccine clinic is happening at the Royal Canadian Legion in Longlac from 12-3pm.A flu clinic is also being held in Marathon at Lakeview Hall from 6-9pm. https://t.co/f1FXHaRKFu,en
2022-11-10 14:15:32+00:00,fa00d840a871d8cb5ac2dc833a8064e2763a42a03685c343e3719ffc12ce5ff8,"On November 27, 2020, Hetero signed an agreement with the Russian Direct Investment Fund (RDIF) to manufacture 100 million doses of the Sputnik V vaccine.Hetero launched the generic version of experimental COVID-19 drug Remdesivir under brand name Covifor after acquiring",en
2022-11-10 14:15:15+00:00,95f2c9c11a171f99b0de7d7ed7cad1d4c0dd5306b0cc9fdc858cec1f3e107c60,@jumaf3 Seek booster of COVID-19 vaccine if you got the 2 or otherwise 😂😂,en
2022-11-10 14:15:00+00:00,5118f1f30f91049e08dc61d497baf7be,@ProfHeidiLarson joins @KatherineEBliss to discuss the impacts of Covid-19 on global vaccine confidence and the importance of listening to people’s stories to better understand how individuals experience and navigate global health threats. Listen here: https://t.co/vWVFtmagKT https://t.co/WKQ1C9ck5c,en
2022-11-10 14:14:48+00:00,df7ad96a3c88353ad5a7fdcd9a02c5b2,LIVE: E-petition debate relating to the safety of covid-19 vaccines - Mo... https://t.co/wyxjdHIqpo via @YouTube @SchoofsLiliane @peter_persyn @TijlDeBie https://t.co/303iapU4O6,en
2022-11-10 14:12:30+00:00,6f6ff2baf65315c0bfb146ac2d75edbf,"“Public health experts say older Americans in conservative states have embraced the #covid_19 #vaccine as a matter of survival, prioritizing it above partisan politics, libertarian impulses and fears of government overreach.” https://t.co/s1cUi8EOKF",en
2022-11-10 14:12:03+00:00,581432ef14b9e44ca539dbc5c9b3a0380ee9e570aa147e7e6deb78f24aecf365,@aretieare @jeepgirl_usa @DailyCaller This is the premier journal on heart disease. Show me yours.A study published on Wednesday in the journal Frontiers in Cardiovascular Medicine found that risk of developing myocarditis is seven times higher with a COVID-19 infection than with the COVID-19 vaccine.,en
2022-11-10 14:09:38+00:00,7c8e01ec2f5a6832c495829eb83e2975,We are sharing our data so you can make an informed decision about the COVID-19 vaccine. A COVID-19 data dashboard is available seven days a week at https://t.co/QSHP3sZtPW https://t.co/EsbEz4nHgM,en
2022-11-10 14:09:36+00:00,909ad597710234a2242da04a1f6b5c89695d07ee29829f882c07bffc844e4818,@I_start_over @rhill22733 @TheOmegaVarian1 @emeriticus Explain what part of Covid-19 vaccine mandates is “bodily autonomy”?,en
2022-11-10 14:09:00+00:00,3f52bbe4f91ea9814bbe29e09037e26d,"New research shows ""efforts to encourage acceptance of Covid-19 vaccines will hinge not only on providing information about their efficacy and safety from sources audience members find credible but also [on] improving knowledge of vaccination in general."" https://t.co/Mbd4gpCfbh",en
2022-11-10 14:08:24+00:00,bbeb7ddbc3f21b90c225366e0b20fc2e2b43b9a126595d9fdd06fc9f118926f6,"@smminco @nettlesoup31 Seeing you're comparing (incorrectly) mrna covid with polio vaxs, shall we compare polio vaccine injuries and deaths with covid-19 gene therapy injuries and deaths? https://t.co/S6Lq5B0Aq1",en
2022-11-10 14:07:18+00:00,2282a6437778b1ac15ecd4173d3ba811,"At #UPR41, Tushar Mehta, Solicitor General, said #India had responded to the COVID-19 pandemic by giving:- direct and free food support to 800 million persons- financial support to more than 445 million citizens- over 270 million vaccine doses to around 100 countries",en
