date,userid,tweet,lang
2022-02-16 15:00:18+00:00,1166872588733341697,"A COVID-19 vaccine clinic is available today at @NIUConvoCenter! All COVID vaccines will be available during this clinic (Pfizer, Moderna, and J&amp;J) and they can be any dose.Walk-ins are accepted to help ensure everyone can get their vaccine from 11-3:45! https://t.co/VMs0C9LZON",en
2022-02-16 15:00:05+00:00,159229238,"@1234renodog Sure, when they show proof that the vaccine prevents contamination of COVID-19 or its variants?",en
2022-02-16 15:00:05+00:00,146558810,Nebraska lawmakers came close Tuesday to blowing up a bill that would allow workers to claim medical and religious exemptions from workplace COVID-19 vaccine mandates. https://t.co/5eWL5v1swy,en
2022-02-16 15:00:03+00:00,252114970,"Remember your second shot! If you received the Pfizer or Moderna COVID-19 vaccine, you won't be fully immunized until two weeks after your second vaccine dose. Visit https://t.co/57glooZN4W for more info. https://t.co/AAukcnAact",en
2022-02-16 15:00:02+00:00,1257785277403115520,The Ministry of Health in India raised concerns over the 11.88 crore unutilized COVID-19 vaccine doses available in States and Union Territories. #briflynews #covid19 #covidvaccine #unutilized #healthministryhttps://t.co/X7tWaMb1ey,en
2022-02-16 15:00:02+00:00,544419434,COVID- 19 RESOURCE POP UP Today @PavYMCA PPE Kits will include: 😷 Face masks (while supplies last)👏 Hand sanitizer 👏Hand soap💉For vaccine and booster information at the Berwyn Public Health District call: 708-788-6600#BerwynStrong #CityofHomes #FightCovid19 #maskup https://t.co/brjKU4pAtL,en
2022-02-16 15:00:01+00:00,14897840,"COVID-19 vaccines during pregnancy can protect babies after they're born and lead to fewer hospitalized infants, a U.S. government study released suggested.https://t.co/Dlgrh7QOw3",en
2022-02-16 15:00:01+00:00,151513624,Are you jabbed and cleared for take off with the COVID-19 vaccine this half term?👪✈️Visit the foreign travel advice website to check which destinations depend on vaccination status: https://t.co/ZLBf4nkTIq#VaccinateBCWB💙 https://t.co/bzij4toL76,en
2022-02-16 15:00:00+00:00,2214206912,"It is no secret that the world is still in the midst of the #COVID-19 pandemic.Research to prevent the risk of further viruses spreading, and continued development of vaccines are at an all-time high.Find out more in our latest #blog.https://t.co/Sdvj1hqlcM https://t.co/JNsqDITL3A",en
2022-02-16 15:00:00+00:00,2861163724,Learn about Covid-19 vaccines at our upcoming Covid-19 info session in English on Feb. 25; in Mandarin on Feb. 23; and in Tamil on March 2. To register call Clara at 416-493–3333 ext 325 or yoonshinl@splc.ca https://t.co/oAALMq6LoR,en
2022-02-16 14:59:49+00:00,159229238,"@GovGone Sure, when they show proof that the vaccine prevents contamination of COVID-19 or its variants?",en
2022-02-16 14:59:42+00:00,822969245449519104,You can get a $100 debit card if you get your booster or first shot at NYC vaccination sitesCOVID-19 Vaccine Incentives - Coronavirus https://t.co/zhq4zmLhNE? via @nycgov,en
2022-02-16 14:59:18+00:00,237423291,"Looking for a COVID-19 vaccine clinic today? We've got one! Bradley Centre, 1:30-7:30! Walk in and booked appointments welcome! https://t.co/YPmZqRLNeZ #ckont",en
2022-02-16 14:59:13+00:00,203495115,Switzerland lifts most Covid-19 restrictions https://t.co/ndgm3NSPTc Probably one among other factors is the advantage of access to vaccines and vaccinating a significant part of the population. What about other countries/regions?,en
2022-02-16 14:59:05+00:00,33619524,Nebraska lawmakers came close Tuesday to blowing up a bill that would allow workers to claim medical and religious exemptions from workplace COVID-19 vaccine mandates. https://t.co/5w5ZVMd3YM,en
2022-02-16 14:59:04+00:00,6264712,Nebraska lawmakers came close Tuesday to blowing up a bill that would allow workers to claim medical and religious exemptions from workplace COVID-19 vaccine mandates. https://t.co/ZdulZMaCfr,en
2022-02-16 14:59:01+00:00,1667792120,"TONIGHT: Join us for a live discussion where we will provide new information related to COVID-19 vaccines, boosters, guidance of children &amp; more. https://t.co/nytxNP9ilz",en
2022-02-16 14:58:51+00:00,1177965457438998528,Getting COVID-19 vaccine improved mental health and well-being: study  https://t.co/6wDjpGzfNl,en
2022-02-16 14:58:48+00:00,1263009724938833920,"Leave alone ""twitter for IPhone"" this my new follower is all what I want in my life it's also a covid 19 Vaccine btw, why would I even shower 🚿 today am humbled🙏😭 https://t.co/h1A1sKTNwv",en
2022-02-16 14:58:40+00:00,23133750,'I was so stupid:' Anderson woman refused the vaccine &amp; almost died of COVID-19 https://t.co/9UJTc2PIRo via @indystar,en
2022-02-16 14:58:38+00:00,1371272925416947717,"@sock_spunk @MoonfireArt @80s_MEME_CENTER @Cernovich I love the cherry picked information, of random places with nothing but a single screenshot, and no links to back you up. Did you know more than twice the amount of people died from the covid 19 jab then all other vaccines combined going back to 1990? https://t.co/NOdXl3lnnK",en
2022-02-16 14:58:21+00:00,445523686,NEW: Houston-area health experts hope COVID-19 vaccine expansion breaks through apathy https://t.co/bR14G7n1w9 via @houstonchron,en
2022-02-16 14:58:04+00:00,865267708979544064,Nebraska lawmakers came close Tuesday to blowing up a bill that would allow workers to claim medical and religious exemptions from workplace COVID-19 vaccine mandates. https://t.co/ObQZR6rGml,en
2022-02-16 14:58:03+00:00,13850422,"White House seeks additional $30 billion in Covid-19 funding to go toward vaccines, treatments, testing and other pandemic preparedness measures https://t.co/EA6KayY35V",en
2022-02-16 14:57:55+00:00,21110041,"Manitoba to give COVID-19, vaccine update: https://t.co/u6CN77hYtI https://t.co/AlCVAKVwiv",en
2022-02-16 14:57:33+00:00,1907861946,BioNTech Unveils Mobile Covid-19 Vaccine Factories for Developing World https://t.co/Q7vwBNDo5p,en
2022-02-16 14:57:10+00:00,1364680935149551622,"COVID 19 vaccine is prepared by a team and a Egyptian clinical scientist in that time was participate in that great event , what you want to be sure about clinical scientists roles 🤷🏻‍♂️#حقوق_العلميين_الطبيين",en
2022-02-16 14:57:04+00:00,305075576,Nebraska lawmakers came close Tuesday to blowing up a bill that would allow workers to claim medical and religious exemptions from workplace COVID-19 vaccine mandates. https://t.co/xRrxOnheIH,en
2022-02-16 14:57:04+00:00,136326597,Nebraska lawmakers came close Tuesday to blowing up a bill that would allow workers to claim medical and religious exemptions from workplace COVID-19 vaccine mandates. https://t.co/GMNUIEsoaE,en
2022-02-16 14:57:04+00:00,2904051994,Nebraska lawmakers came close Tuesday to blowing up a bill that would allow workers to claim medical and religious exemptions from workplace COVID-19 vaccine mandates. https://t.co/5HEz3JG23S,en
2022-02-16 14:56:58+00:00,1171125514016296960,"Judge blocks Michelle Wu's Boston employee Covid-19 vaccine mandate, orders injunction. https://t.co/nVPWk1ISaK",en
2022-02-16 14:56:14+00:00,332885957,Director Debrief:  COVID-19 Vaccine Protection for Pregnant People and t... https://t.co/Zho0iEDHAn via @YouTube,en
2022-02-16 14:56:04+00:00,54951024,Nebraska lawmakers came close Tuesday to blowing up a bill that would allow workers to claim medical and religious exemptions from workplace COVID-19 vaccine mandates. https://t.co/ZQVSa0Z3fQ,en
2022-02-16 14:56:04+00:00,48716479,Nebraska lawmakers came close Tuesday to blowing up a bill that would allow workers to claim medical and religious exemptions from workplace COVID-19 vaccine mandates. https://t.co/bUcRIEz0yd,en
2022-02-16 14:56:02+00:00,24183598,"Join us on Tuesday, February 22 at noon CT for our “COVID-19, Year 3: Variants, Vaccines, and Your Questions Answered,"" event featuring medical professionals and professors from @UT_Dallas, @utarlington, @dallascollegetx, @NDCC and more. Register today: https://t.co/Dmq6WE61Uk https://t.co/6Ly6e28VRW",en
2022-02-16 14:55:17+00:00,1548887382,"COVID-19: Children aged 5-11 in Scotland to be offered vaccine, Nicola Sturgeon confirms | Politics News | Sky News. Also in Wales! So when ⁦@BorisJohnson⁩ are 5-11 Children in England getting the same offer? #JabsforU12s  https://t.co/NTD0782oeh",en
2022-02-16 14:55:13+00:00,20630658,COVID-19 vaccine in pregnancy may protect babies after birthhttps://t.co/UUUPXPseu7,en
2022-02-16 14:55:10+00:00,16226848,HAPPENING NOW:City of McAllen and @HidalgoCounty are hosting a  Covid-19 vaccine clinic https://t.co/71jFsQSnbP,en
2022-02-16 14:55:08+00:00,74182289,Rep. Lehman continues to use health care employees are the primary example of people he's trying to help.The bill now explicitly does NOT apply to health care employees who are subject to a federal COVID-19 vaccine mandate.,en
2022-02-16 14:55:03+00:00,1478560125937799168,COVID-19 ‘Vaccine’ Deaths Soar in Europe. Mass Funeral Protestfor Children Held in Switzerland - https://t.co/c5VZr6AnP1,en
2022-02-16 14:55:02+00:00,1675883406,"The @CDCgov has recently endorsed the approval of the Moderna COVID-19 vaccine. According to the CDC, more than 212.9 million people in the U.S. are fully vaccinated, and more than 90 million people have received a booster dose.Learn more: ⤵️https://t.co/eHKHP6befw",en
2022-02-16 14:54:59+00:00,3468678856,Senegal to Establish Covid-19 Vaccine Production Facility 🇸🇳 The Institut Pasteur de Dakar has partnered with BioNTech to build a production facility in Senegal. Read more: https://t.co/GDmhsTH2HZ #ECPNews #AfricanEnergy,en
2022-02-16 14:54:45+00:00,105560821,"@TheFreemanNews Pfizer Inc. said on Feb. 5 it had withdrawn an application for emergency-use authorisation of its COVID-19 vaccine in India, after failing to meet the drug regulator's demand for a local safety and immunogenicity study.",en
2022-02-16 14:54:36+00:00,74768262,"@marcosfraiha @CoronavirusBra1 Estamos muito tristes mesmo:""B.C. has one of the highest rates of vaccination in the world; as of Monday, 93.5 per cent of eligible adults have received a first dose of COVID-19 vaccine.""https://t.co/IBd9DYnrr7",en
2022-02-16 14:54:10+00:00,494495818,"#Covid-19 Vaccination Logistics. ""...Grappling with other challenges, like how to get vaccines to where they’re needed, obtaining supplies to administer them, storing them at ultra-cold temperatures when necessary.""https://t.co/VGi6CejM02",en
2022-02-16 14:54:07+00:00,733270320,Been part of Oxford Study on Covid-19 across the past two years. Today been told I still have antibodies from having had CV-19 in October. Already lasted longer than the vaccine antibodies. Tested every month so will see when they finally fade.,en
2022-02-16 14:54:04+00:00,425364987,Nebraska lawmakers came close Tuesday to blowing up a bill that would allow workers to claim medical and religious exemptions from workplace COVID-19 vaccine mandates. https://t.co/LxBJ6tE4wV,en
2022-02-16 14:54:01+00:00,55592470,"The webinar recording for @ahahospitals ""Building Confidence in the COVID-19 Vaccine During Pregnancy"" is now available! Learn about how health care professionals can build trust in the safety of COVID-19 vaccines for pregnant people: https://t.co/Kuz9APsfDf",en
2022-02-16 14:53:31+00:00,1135719146342309893,My Adverse Reaction To The Pfizer Covid-19 Vaccine (My Experience) https://t.co/yXTjuL1GXg @LotusGirlL,en
2022-02-16 14:53:20+00:00,1203699663821582339,"@CityCynthia I am willing to bet that a high percentage of his so called ""little guys"" have already been fully vaccinated to help prevent from ending up on a ventilator when/if they are infected with Covid 19. Is Ford still dumb enough to think the Vaccine prevents you from getting the virus? https://t.co/vlBdPblXkU",en
2022-02-16 14:53:16+00:00,74182289,"A big change I noticed - no longer are employers forced to grant religious exemptions to getting the COVID-19 vaccine without any further inquiry.Now, they grant those exemptions based on compliance with existing federal law.",en
2022-02-16 14:53:14+00:00,168524035,Novak Djokovic says he will opt out of future Grand Slams with COVID-19 vaccine mandates https://t.co/pvDwEJbaPe,en
2022-02-16 14:53:07+00:00,209599290,CDC reported Tuesday in its MMWR that an initial COVID-19 two-dose vaccine series during pregnancy can help prevent COVID-19 hospitalizations among infants under six months of age in addition to the protection the vaccine offers for pregnant people. https://t.co/DAFP8AfktZ https://t.co/O3aOIXqvLp,en
2022-02-16 14:52:08+00:00,2476070574,ACT NOW: Tell your governor and local legislators that COVID-19 vaccines must be voluntary! https://t.co/o4Jhn4YzGT via @standforhealth1,en
2022-02-16 14:51:55+00:00,889890139283087361,Find our analysis of EMS providers' motivations for COVID-19 vaccine decisions today in Prehospital and Disaster Medicine.https://t.co/PZP71IuFuT,en
2022-02-16 14:51:31+00:00,1348718376076636161,@MichiganTrader2 @ddeamon3 @RedneckWallaby @DineenRon No! Look at each approval. There are between moderna and pfizer 4 vaccines. Spikevax (approved and not in production) and Moderna COVID-19 (authorized under an EUA and Comirnaty (approved and not in production) and Biontech (authorized under an EUA.  https://t.co/4F6ydemyd9 https://t.co/un8PniK47O,en
2022-02-16 14:51:16+00:00,791710298369462272,"(3/4): For children ages 5 &amp; up, the COVID-19 vaccine is still the most effective way to avoid and lessen the chances of attaining COVID-19.",en
2022-02-16 14:51:13+00:00,1035424186771152897,Notify NYC: Get your COVID-19 vaccine booster at a City-run vaccine site through 2/28 and earn $100: https://t.co/M12SaYr4EB,en
2022-02-16 14:50:56+00:00,1201475680812306433,Covid 19  is a vaccine sales pitch!,en
2022-02-16 14:50:26+00:00,70394965,Tanzania to start manufacturing its own COVID-19 vaccines https://t.co/DcqLwpunvS,en
2022-02-16 14:50:20+00:00,21261969,"@Sinister689 @imgrund Ask an automotive engineer about seat belts. Of course, people still die while wearing their seat belts. It's just not as many people! So, are seat belts useless? Can you try to apply the same logic to vaccines for COVID-19? Feel free to tell me that seat belts are useless!",en
2022-02-16 14:50:06+00:00,1481110850085990400,4.31 million more COVID-19 vaccine doses administered on Chinese mainland https://t.co/fAfPnIvb0s,en
2022-02-16 14:50:02+00:00,791710298369462272,"(1/4): COVID-19 Vaccine update: The FDA has delayed the approval of the Pfizer vaccine for children ages 6 months to 4 years. The FDA is hoping to make their approval closer to springtime, as they await further evidence of safety and protection of the vaccine for this age group.",en
2022-02-16 14:49:53+00:00,16342817,COVID-19 update for Feb. 16: New vaccines on way for B.C. | Hospital numbers continue to fall as two deaths reported | Province eases restrictions https://t.co/I9pRvqoYYU,en
2022-02-16 14:49:52+00:00,1476306071186726914,"""The COVID 19 pandemic has led to a heightened focus on the power of medical data, specifically so-called vaccine passports. These passports by nature serve as a form of digital identity.""#COVID19 @MichaelPSenger https://t.co/VPyC4ENeu7",en
2022-02-16 14:49:37+00:00,1492626868348018690,#Dgitalidentity  COVID-19 vaccinehttps://t.co/yeA6S3f6lU,en
2022-02-16 14:49:18+00:00,19627046,"@WinterPollan @JeromeAdamsMD Nothing is 100%.  However, with a recent booster, the VE of the mRNA vaccines to stop getting symptomic Omicron covid-19 is between 70 to 75%. (Delta is even higher.) In otherwords, a recent booster stops 3 in 4 symptomic cases. 89% VE of booster to stop Omicron hospitalization.",en
2022-02-16 14:49:18+00:00,826077854085632000,@myshadesofgray @CoolReviewGuy @FrancoTarb @Vacherieboy @IndepdentGeorge @maemdoluno @HeartlandSignal “-More than a third of COVID-19 infections result in zero protective antibodies-Natural immunity fades faster than vaccine immunity-Natural immunity alone is less than half as effective than natural immunity plus vaccination”,en
2022-02-16 14:48:53+00:00,957347671680806912,"Klaus Schwab: ""the COVID 19 pandemic has led to a heightened focus on the power of medical data, specifically so-called vaccine passports. These passports by nature serve as a form of digital identity.""https://t.co/vL9eF45Ivs https://t.co/hERmXLBBZS",en
2022-02-16 14:48:00+00:00,289411623,"Kinda my whole deal:""The past two years have been a vivid reminder that pharmaceutical research can produce incredible results, as with the COVID-19 vaccines. But no matter how great they are, drugs don’t work if people can’t afford them.""https://t.co/SLcDkhdocS",en
2022-02-16 14:47:38+00:00,1444049359604273155,@barlow2021 @PolitiFact [citation needed] on the number of deaths 'possibly' from the vaccine.  How many 'possibly' would have died from Covid 19 if there had been no vaccine?  How many would have died if it had not been for the efforts of medical professionals?,en
2022-02-16 14:47:32+00:00,2163884395,@cxptainjaneway I would have a lot more followers except I come on Twitter primarily to entertain myself and sometimes that gets misinterpreted. I don’t really think there are tiny robots in the COVID-19 vaccine that the government is using to enter my brain and change my political beliefs.,en
2022-02-16 14:47:11+00:00,234390288,"Against ebola, COVID-19, or any other dangerous viral disease, vaccines are vital defensive weapons.These innovative ""Biontainer"" factories will speed-up regional production &amp; distribution of #mRNA #engineered  #vaccines in developing nations.Congratulations, #BioNTech",en
2022-02-16 14:46:59+00:00,567609666,"A wave of misinformation and conspiracy theories spread through social media underlie the COVID-19 vaccine hesitancy in Africa, where just 11 percent of the people have gotten the jab: https://t.co/ScihMF9KCc by @scienceally",en
2022-02-16 14:46:40+00:00,4765364386,"REPORT: [Reuters] - Pfizer Inc has WITHDRAWN an application for emergency-use authorization of its COVID-19 vaccine in India, after FAILING TO MEET DRUG REGULATORS DEMAND for a local safety and immunogenicity study...",en
2022-02-16 14:45:47+00:00,4494022813,https://t.co/PgVgd106pc Can COVID-19 vaccines teach T cells to recognize Omicron? #sciencetwitter #medTwitter,en
2022-02-16 14:45:35+00:00,2692783364,Autopsy Histopathologic Cardiac Findings in Two Adolescents Following the Second COVID-19 Vaccine Dose | Archives of Pathology &amp; Laboratory Medicine https://t.co/zrfT1SX4Ey,en
2022-02-16 14:45:29+00:00,830005599056252928,Can COVID-19 vaccines teach T cells to recognize Omicron? https://t.co/lVzr5OjXRB #scienceTwitter,en
2022-02-16 14:45:20+00:00,15750898,Thousands of protesters are refusing to leave after setting up camp on the grounds of New Zealand's Parliament to rail against the country's COVID-19 vaccine mandate -- a move inspired by the Canadian trucker protests.  https://t.co/PT4yfImj7v,en
2022-02-16 14:45:02+00:00,243990980,You can get the booster if you had a 2nd dose of the COVID-19 vaccine at least 3 months ago and:☑️You are aged 18 or over☑️You are aged 16 or over with a health condition that puts you at high risk of getting seriously ill from COVID-19Book now ➡️ https://t.co/XVsypTmRvV https://t.co/09k7BJOSLN,en
2022-02-16 14:45:02+00:00,523248016,Massachusetts judge blocks Boston’s COVID-19 vaccine mandate | Just The News https://t.co/t7ysLC0eZS,en
2022-02-16 14:45:01+00:00,2695193845,"Please see the most recent information regarding COVID-19 vaccination eligibility. To book in for a vaccine or if you have any queries, please dial 119 or visit the NHS website https://t.co/V0PNqLviKx",en
2022-02-16 14:45:00+00:00,4328930475,"If you’re unvaccinated, you’re about 8 times more likely to be hospitalised with COVID-19 than if you’ve had both doses of the vaccine and the booster.➡️ Book now or find your nearest walk-in vaccination clinic in #Birmingham and #Solihull here: https://t.co/4AKoZRh98j https://t.co/q6T0JO8kza",en
2022-02-16 14:45:00+00:00,15872418,3rd batch of COVID-19 vaccine shots for kids ages 5-11 arrives in PH https://t.co/yYBsJ0NIU2,en
2022-02-16 14:44:44+00:00,50340794,Can COVID-19 vaccines teach T cells to recognize Omicron? https://t.co/0aiadJ19Dl #ScienceTwitter,en
2022-02-16 14:44:30+00:00,1112038022927863808,"""...Germany's biotechnology company BioNTech has developed a vaccine factory, made from shipping containers.The company plans to ship to Africa as assembly kits to ease what the WHO has described as huge disparities in global COVID-19 vaccine access ...""https://t.co/grf83F6guq",en
2022-02-16 14:44:25+00:00,2618797484,Bill Excluding COVID-19 Vaccines From Requirements For School Attendance Passes https://t.co/ed0aNLLe5H,en
2022-02-16 14:43:41+00:00,67771614,clarifies vaccine passport language only applies to COVID-19; exempting health care workers who have to comply with CMS vaccine mandate; added at request of entertainment venues to allow vax mandates for those working closely with team/entertainers.,en
2022-02-16 14:43:36+00:00,2845722575,"BioNTech Unveils Mobile Covid-19 Vaccine Factories for Developing WorldModular production units, deployable in Africa and across the globe, could make 50 million shots a year.https://t.co/rsEiPKySvz https://t.co/kUrySgOESC",en
2022-02-16 14:43:07+00:00,767522616,"7 Reasons to Oppose COVID-19 Vaccine Mandates | by ⁦@B43Franco⁩ | Jan, 2022 | Medium#NoVaccineMandates #NoVaccinePassports #MyBodyMyChoice  https://t.co/SNSDD8hkb9",en
2022-02-16 14:42:41+00:00,237271964,HAPPENING TOMORROW: The Chickahominy Health District is hosting a COVID-19 vaccine clinic tomorrow from 4-6 p.m. You can call the Health District's hotline at 804-365-3240 or scan the QR code on the below flyer to schedule an appointment. https://t.co/RVaJf2MXJF,en
2022-02-16 14:42:38+00:00,1588224883,NRCS Secretary General Abubakar Kende and the Head of Abuja Country Cluster Delegation of @ifrc Bhupinder Tomar were at @nphcda to discuss the penetration of the COVID-19 vaccine and other PHC activities in hard to reach communities. https://t.co/YQeakXZpuz,en
2022-02-16 14:42:38+00:00,141901567,Ottawa’s police chief resigned Tuesday after criticism that he did not do enough to stop Covid-19 protests that have paralysed Canada’s capital city &amp; forced Trudeau to invoke emergency powers. A trucker-led movement calling on the govt to lift vaccine mandates has occupied… https://t.co/oVfzZx6JQG,en
2022-02-16 14:42:22+00:00,988487993504731137,"- The number of people in Lucas County receiving an additional dose of the COVID-19 vaccine shares a similar pattern with Ohio, and also has been decreasing since the end of December. As of Feb, 15, a total of 119,893 people in Lucas County have received a booster. https://t.co/bF6IhtYm8V",en
2022-02-16 14:42:21+00:00,988487993504731137,"- 3,329,884 Ohioans have received an additional dose of the COVID-19 vaccine as of Feb. 15, 2022. The number of people receiving an additional dose has been decreasing since the end of December. https://t.co/4NBOqwJG8f",en
2022-02-16 14:40:20+00:00,227325120,Big shout out to y’all that rushed to take the vaccine. It’s no more mandatory and countries are already relaxing their rules and regulations regarding Covid-19,en
2022-02-16 14:40:17+00:00,722804725662416897,Johnson &amp; Johnson says a single shot protects for up to 6 months against breakthrough infections.We are seeing vaccine effectiveness against #COVID-19 related hospitalization of approximately 80% from a single shot of the J&amp;J #vaccine.read more https://t.co/9ndR6zBqMg https://t.co/MeYGW9eXHR,en
2022-02-16 14:40:16+00:00,3676899683,"Trudeau's COVID-19 vaccine mandate violates Canada's Charter of Rights and Freedom, says charter signatory https://t.co/NkJFFaex0u",en
2022-02-16 14:40:11+00:00,1271781483741622273,@seanhannity Despicable! It shows the sick culture of liberal policies. Thousands are affected because liberals want to make their point. The “no common sense” mandates should have been terminated already. Vaccines and boosters don’t fully protect against and prevent the spread of covid-19,en
2022-02-16 14:40:06+00:00,107209657,"As of Feb. 15, Fulton County residents are eligible to receive $100 gift cards after getting their COVID-19 vaccine at select Fulton County Board of Health regional health centers. https://t.co/dvokmZaraN",en
2022-02-16 14:40:00+00:00,32496789,"COVID-19 vaccines during pregnancy can protect babies after they're born and lead to fewer hospitalized infants, a U.S. government study released Tuesday suggested. https://t.co/9DYUGVdZox",en
2022-02-16 14:39:44+00:00,3302102045,"Biden’s success against COVID-19 was a stunning achievement, while those on the right opposing vaccine mandates did nothing more than cause hospitalizations and deaths of unvaccinated Americans who Biden strove to keep protected and alive.",en
2022-02-16 14:39:33+00:00,491043747,*COVID - 19 Vaccination Update - Day 397**India’s cumulative vaccination coverage crosses 174 Crore**More than 31 lakh Vaccine doses administered today till 7 pm@MoHFW_INDIA @DDNewsHindi #vaccination https://t.co/vX0pQ8OxB5,en
2022-02-16 14:39:08+00:00,971058885472804864,BioNTech Unveils Mobile Covid-19 Vaccine Factories for Developing World https://t.co/4KAgfjHzhS,en
2022-02-16 14:37:31+00:00,1265378985015496705,COVID-19 vaccines are very safe and do not affect your fertility. To learn more click the following link: https://t.co/U3J4RiFM0X,en
2022-02-16 14:37:23+00:00,1535051239,"It’s my vaccine-iversary! 1 year ago today, I received my 1st Covid-19 vaccine. It was the biggest relief! I remember sitting in my car w/ watery eyes feeling like it was all going to be over soon. Never anticipated so many would turn against the science &amp; prolong the pandemic. https://t.co/IOKpySpGNw",en
