date,userid,tweet,lang
2022-05-06 06:30:19+00:00,1431484467219156996,#FDA restricts J&amp;J’s Covid-19 #vaccine due to blood clot risk - #Pfizer &amp; #Moderna have provided vast majority of #COVID19 vaccines in US. More than 200 million #Americans have been fully vaccinated with companies' 2 dose shots while less than 17 million Americans got J&amp;J shot. https://t.co/sJx7yi10AX,en
2022-05-06 06:29:44+00:00,2966105867,FDA restricts J&amp;J’s COVID-19 vaccine due to blood clot riskhttps://t.co/yA36DkibJh,en
2022-05-06 06:28:37+00:00,1426950204587184133,"@VeilletteAndre A new study based on Moderna’s Phase 3 clinical trial data suggests recipients of Moderna’s COVID-19 vaccine may be more likely to suffer repeated infections, perhaps indefinitely.https://t.co/Bfkwm2uDaw",en
2022-05-06 06:27:18+00:00,1650165835,The #StopTheSpread campaign is a partnership between @CocaColaCo and UWM. It has now reached out to 1.2 cr individuals from 5000+ villages across the country in its fight against COVID-19 vaccine hesitancy and facilitation of vaccinations in rural India.  #TheCocaColaFoundation https://t.co/DRbKXigtO3,en
2022-05-06 06:26:10+00:00,567278796,📍Update on COVID-19 Vaccine Availability in States/UTs 🔹More than 193.53 Crore vaccine doses provided to States/UTs🔹More than 18.81 Crore balance and unutilized vaccine doses still available with States/UTsDetails: https://t.co/4J8tAM4r2h  #IndiaFightsCorona https://t.co/lh89Bsppgo,en
2022-05-06 06:25:36+00:00,713523037560111105,FDA restricts J&amp;J’s COVID-19 vaccine due to blood clot risk https://t.co/LTUWQsnm1R,en
2022-05-06 06:25:07+00:00,25998954,FDA limiting use of Johnson &amp; Johnson COVID-19 vaccine due to blood clot risk https://t.co/SvW45KpZJj,en
2022-05-06 06:22:44+00:00,538804810,"WHO has published the excess deaths report: 14.9 million excess deaths associated with the COVID-19 pandemic in 2020 and 2021.Without vaccine equity, this toll will keep climbing.＃WHO　＃COVAX　＃COVID19https://t.co/JVeV0NP4oQ",en
2022-05-06 06:22:22+00:00,567278796,"🔹India’s Cumulative COVID-19 Vaccination Coverage exceeds 189.81 Cr🔹Over 2.99 Cr 1st dose vaccines administered for age group 12-14 years🔹India's Active caseload currently stands at 19,688Details: https://t.co/JTzfLHpz8B  #IndiaFightsCorona https://t.co/heOjqGeL3X",en
2022-05-06 06:22:10+00:00,20512439,Study suggests severe #obesity blunts antibody response to COVID-19 vaccines https://t.co/B2CfJ1XAMt,en
2022-05-06 06:22:10+00:00,17781837,FDA limiting use of Johnson &amp; Johnson COVID-19 vaccine due to blood clot risk https://t.co/Ae2r1u7DIa,en
2022-05-06 06:21:15+00:00,1157090115912552448,FDA puts strict limits on Johnson &amp; Johnson Covid-19 vaccine https://t.co/oC4kUNP549 #VaccineSideEffects,en
2022-05-06 06:20:07+00:00,16083143,FDA Limits Use of Johnson &amp; Johnson COVID-19 Vaccine  https://t.co/o4ozSH2mzF,en
2022-05-06 06:18:10+00:00,1483260398409236481,This time with another Vaccine... This was 3 hours ago posted. Warning the Truth is coming out Patriots. FDA vaccine warning: why has Johnson &amp; Johnson’s covid-19 shot been restricted? https://t.co/oYZn9xWF6z,en
2022-05-06 06:17:55+00:00,54510480,"👇👇👇uhm…A new study suggests recipients of Moderna’s COVID-19 vaccine may be more likely to suffer repeated infections, perhaps indefinitely. https://t.co/WaamKohVGU https://t.co/xf5vyClrG1",en
2022-05-06 06:17:28+00:00,2178653839,Pfizer “we may not be able to demonstrate sufficient efficacy or set of our covid 19 vaccine...https://t.co/iRL0t4t3nk,en
2022-05-06 06:17:00+00:00,1230138939773792258,Can you use an expired at-home Covid-19 test?https://t.co/pqeNln6EFW,en
2022-05-06 06:16:50+00:00,54510480,FDA restricts J&amp;J’s COVID-19 vaccine due to blood clot riskFDA officials said in a statement that they decided to restrict J&amp;J’s vaccine after taking another look at data on the risk of life-threatening blood clots within two weeks of vaccination. https://t.co/oiPdPo3jq7 https://t.co/RvPjJcvE4u,en
2022-05-06 06:15:19+00:00,15750898,#BREAKING: The FDA says it's strictly limiting who can receive Johnson &amp; Johnson’s COVID-19 vaccine due to a rare but serious risk of blood clots. https://t.co/IHIcdp6kl2,en
2022-05-06 06:15:05+00:00,25562183,"The U.S. health regulator said on Thursday it was limiting the use of Johnson &amp; Johnson's COVID-19 vaccine for adults due to the risk of a rare blood clotting syndrome, the latest setback to the shot that has been eclipsed by rivals. https://t.co/SxnSw3zGd6",en
2022-05-06 06:15:03+00:00,713959266407723008,@FaheemYounus In China many are fulfilling above requirements as specified by you but still all are suffering economically due to lockdown &amp; till Covid 19 is not stopped being used as political weapon all will suffer no matter how many times one take vaccines!!,en
2022-05-06 06:15:00+00:00,29219793,We have a vaccine for COVID-19 but why cannot we find one for #eastcoastfever? Find out on this podcast talking about neglected disease and the burden the pose to the poorest. https://t.co/RUo2j2vUfy@CGIAR @gatesfoundation @BillGates @KropffMartin,en
2022-05-06 06:14:33+00:00,121557564,🎊🎉🎊🎉🎊🎉🎊🎉👏👏👏👏👏👏👏👏Landmark Decision Stops Covid-19 Vaccine Mandates in India https://t.co/ltUDVKowm3,en
2022-05-06 06:14:23+00:00,1318622437924220928,Teachable moment on COVID19 to vaccine...COVID-19: Vaccine: https://t.co/A7jLuGQi2k https://t.co/zlyg8t7EA4,en
2022-05-06 06:14:18+00:00,20605217,FDA restricts who should receive the J&amp;J COVID-19 vaccine https://t.co/YImr6daJhM,en
2022-05-06 06:13:34+00:00,275880607,"Verder weer niets te zien, doorlopen.....FDA limits use of J&amp;J's Covid-19 vaccine for adults https://t.co/RL68VXl9nW",en
2022-05-06 06:10:56+00:00,713523037560111105,FDA restricts J&amp;J’s COVID-19 vaccine due to blood clot risk https://t.co/enk1RVll5x,en
2022-05-06 06:10:07+00:00,2416885579,SetoPati: FDA restricts J&amp;J’s COVID-19 vaccine in US due to blood clot risk -  https://t.co/FSQ3xzlril,en
2022-05-06 06:07:46+00:00,1659961717,"@jc_Craze @theconvocouch Hmm, nothing in that update mentioned the vaccine.On the other hand, perhaps it was COVID-19: https://t.co/BVvBkah8RQ",en
2022-05-06 06:06:20+00:00,936080878744276992,"https://t.co/fP9ev3gzNM""They Want to Take Over World"" - James Delingpole Interviews Dr. Mike YeadonFormer CSO/VP, Allergy &amp; Respiratory Research Head with Pfizer Global R&amp;D, &amp; co-founder Ziarco Pharma, joins James to discuss his grave concerns about COVID-19 vaccines.",en
2022-05-06 06:05:06+00:00,35315442,@KatePri14608408 @mrigankshail @Saffiya_Khan1 @WHO @DrTedros “A key reason for identifying new Covid-19 variants is to ensure that vaccine manufacturers have the necessary information to produce updates to their inoculations.” But in #Sweden they don’t even test anyone anymore 😳,en
2022-05-06 06:05:06+00:00,228010353,Vaccines induce multiple immune system mechanisms to protect against severe COVID-19 illness - https://t.co/Kmkgrg4dbn{ https://t.co/31l08r5cMw,en
2022-05-06 06:01:08+00:00,109233090,#STUDY: Natural Immunity Lasts Longer Than Protection From COVID-19 Vaccines. https://t.co/jem9jkajwC,en
2022-05-06 06:01:00+00:00,25387183,"Africa's top public health body urged all those purchasing COVID-19 vaccines for the continent to place orders with South Africa's Aspen Pharmacare, saying the market was key to developing vaccine manufacturing on the continent. Olivia Chan reports. https://t.co/sorxw1DhfU",en
2022-05-06 06:00:59+00:00,1431886953998258177,FDA restricts use of J&amp;J COVID-19 vaccine due to risk of blood clots https://t.co/bLPgldbnqS,en
2022-05-06 06:00:13+00:00,21435658,The FDA has restricted J&amp;J’s COVID-19 vaccine due to certain risks. https://t.co/NRGNaHTnsS,en
2022-05-06 06:00:12+00:00,738639850182610944,Chinese recombinant protein vaccine effective against COVID-19 in phase-3 human trials: study https://t.co/7X5fGRUMmB https://t.co/9pYYA4ai2k,en
2022-05-06 06:00:05+00:00,46326721,The FDA said it decided to restrict Johnson &amp; Johnson's COVID-19 vaccine after taking another look at data on the risk of life-threatening blood clots. https://t.co/3JwB0McAPg,en
2022-05-06 06:00:01+00:00,17383073,Flu season has officially arrived 🤧😷 Here is what you need to know to reduce the risk of catching #influenza or the flu/COVID-19 combo this winter ⬇️https://t.co/ECPdMGihoS@MackayIM @UQMedicine #Flurona #Vaccine #Flu #COVID19,en
2022-05-06 06:00:01+00:00,17722044,The FDA announced it is limiting the authorized use of the Johnson &amp; Johnson COVID-19 vaccine after studies showed people developed rare blood clots. https://t.co/YUaIESyTHG,en
2022-05-06 05:59:27+00:00,2366731909,FDA Limits Use of J&amp;J's COVID-19 Vaccine Due to Blood Clot Risk | https://t.co/2fE9ptSbOx - https://t.co/J4nu1rhJPb,en
2022-05-06 05:59:05+00:00,8216772,U.S. regulators on Thursday strictly limited who can receive Johnson &amp; Johnson’s COVID-19 vaccine due to the ongoing risk of rare but serious blood clots. https://t.co/NvMNXXr52b,en
2022-05-06 05:58:45+00:00,1304156557,Researchers confirm evidence of viral shedding from covid-19 vaccines https://t.co/tZhVVnsPY6,en
2022-05-06 05:57:32+00:00,2326619562,📍Update on COVID-19 Vaccine Availability in States/UTs 💠More than 193.53 Crore vaccine doses provided to States/UTs💠More than 18.81 Crore balance and unutilized vaccine doses still available with States/UTsRead here: https://t.co/UQK9IyqXMt  #IndiaFightsCorona https://t.co/XNlE7uQ2EO,en
2022-05-06 05:57:07+00:00,1354532781464801280,15. Vaccine Express initiative that inoculated 500 Aetas in Barangay Sta. Juliana.16. Leni backed the passage into law of the Unemployment Insurance Bill that will create an unemployment insurance system to protect Filipinos who have lost their jobs due to the COVID-19 pandemic.,en
2022-05-06 05:56:54+00:00,333924105,U.S. regulators are strictly limiting who can receive #Johnson &amp; Johnson’s #COVID-19 #vaccine due to a rare but serious risk of #blood #clots.https://t.co/KgwJY64hEu https://t.co/RPRfDxXAto,en
2022-05-06 05:55:11+00:00,228174127,News | Parents Sue CVS: 2 Young Boys Given COVID-19 Vaccine Instead of S... https://t.co/jFuLRTt82R via @YouTube,en
2022-05-06 05:53:37+00:00,528016807,These doses could have been given to spouses living in same households; Bonnie could have sped up time instead of waiting 6 months in between doses. COVID-19: B.C. destroyed hundreds of thousands of vaccine doses | Vancouver Sun #bcpoli  https://t.co/yIX8K761Db,en
2022-05-06 05:52:58+00:00,1347792909312139266,Petition: Don't offer covid-19 vaccine to 5-11 year olds until phase 3 trials complete https://t.co/aeZTObOdaK,en
2022-05-06 05:52:39+00:00,977406604244000768,Steps will be taken to give a fourth dose of COVID-19 Vaccine for people over 60 years of age from next Monday (09)#latestnews #SriLanka #COVID19,en
2022-05-06 05:52:34+00:00,1347792909312139266,Petition: Open a Public Inquiry into Covid-19 Vaccine Safety https://t.co/YDdPW5uQGD,en
2022-05-06 05:52:26+00:00,1063105109725511680,"Half of all people aged 75 and over in England have had their “spring booster” of Covid-19 vaccine, new figures show.https://t.co/KPorRPbWHt",en
2022-05-06 05:52:10+00:00,724701677039792130,"Top story: FDA puts strict limits on Johnson &amp; Johnson Covid-19 vaccine - CNN https://t.co/XWghRRlAMF, see more https://t.co/qdthu3m4QW",en
2022-05-06 05:52:09+00:00,233858730,"Top story: FDA puts strict limits on Johnson &amp; Johnson Covid-19 vaccine - CNN https://t.co/ZuYjydh8UM, see more https://t.co/6245QyIPPF",en
2022-05-06 05:52:09+00:00,42949588,"Top story: FDA puts strict limits on Johnson &amp; Johnson Covid-19 vaccine - CNN https://t.co/rvJzmhMTI5, see more https://t.co/vlDbsmqgd6",en
2022-05-06 05:52:09+00:00,253779135,"Top story: FDA puts strict limits on Johnson &amp; Johnson Covid-19 vaccine - CNN https://t.co/In8G80D9Wu, see more https://t.co/pxhftai1Vj",en
2022-05-06 05:50:51+00:00,1923178369,@UsforThemUK @apsmunro @IndependentSage @DeenanDpillay @dgurdasani1 @chrischirp @SusanMichie @globalhlthtwit @ReicherStephen @SGriffin_Lab @HelenRSalisbury @trishgreenhalgh @Daltmann10 That was an early days policy recommendation against original covid-19 with no vaccine available. Their advice has changed considerably since then. Dig out theor advice on schools since omicron appeared. Good scientists change their recommendations when the evidence changes.,en
2022-05-06 05:50:33+00:00,603547258,Johnson &amp; Johnson’s Covid-19 vaccine has been found to cause a rare blood clotting syndrome.The FDA said its analysis had determined that there is a risk of thrombosis with thrombocytopenia syndrome after the administration of the Johnson&amp;Johnson shot.Rest In Peace https://t.co/hWpkiHfyxS,en
2022-05-06 05:49:56+00:00,535800174,Landmark Decision Stops Covid-19 Vaccine Mandates in India https://t.co/uVijPaeB2n,en
2022-05-06 05:49:37+00:00,78913112,“The U.S. health regulator said on Thursday it was limiting the use of Johnson &amp; Johnson's (JNJ.N) COVID-19 vaccine for adults due to the risk of a rare blood clotting syndrome…” 😐U.S. limits use of J&amp;J's COVID vaccine on blood clot risks https://t.co/w9LIjE8qmI,en
2022-05-06 05:48:30+00:00,1480068057447821313,"🇦🇺 ""lessen side effects"" (chinese media)SYDNEY,  A new global trial of COVID-19 vaccines is set to begin in the state of Victoria, which will administer lower dose boosters in an effort to top up immunity, lessen side effects, &amp; stretch supplies.https://t.co/JnRKPKbRuB",en
2022-05-06 05:46:39+00:00,713523037560111105,FDA restricts J&amp;J’s COVID-19 vaccine due to blood clot risk https://t.co/FA50qAaIVk,en
2022-05-06 05:46:22+00:00,1415149780922081280,@Sharky_vs_Evil @andrew7rd @drkalai61 @Khairykj @KKMPutrajaya @AdiratnaMR @ICR_NIH This is from the data dump from Pfizers documents regarding their Covid-19 vaccine. At this point I believe you are a bot.,en
2022-05-06 05:46:15+00:00,7309052,"The Food and Drug Administration put rigid limits on who can receive Johnson &amp; Johnson’s one-dose COVID-19 vaccine on Thursday, saying the vaccine should only be given to people who cannot receive a different vaccine or those who specifically request it. https://t.co/q8E6h68p9p",en
2022-05-06 05:45:51+00:00,1499605634630574082,FDA limits use of Johnson &amp; Johnson’s Covid-19 vaccine https://t.co/DXgZsvIwXb,en
2022-05-06 05:45:34+00:00,49404200,"Fewer than 1 in 5 US parents say they’ll get Covid-19 vaccines for kids under 5 as soon as they can, survey finds https://t.co/POGgqCDRoc",en
2022-05-06 05:45:23+00:00,1007725923720835072,FDA limits use of Janssen COVID-19 vaccine https://t.co/nbaOSeocmN,en
2022-05-06 05:44:59+00:00,382944437,"@matthewdmarsden Got the vaccine X2 &amp; the Booster - I got COVID-19. Had I not gotten the vaccine and booster, I would have been in Hospital or Dead. Shut the hell up &amp; sit down.",en
2022-05-06 05:43:00+00:00,1480915456118644744,Blocked by members of Parliament for asking questions about the VDPS system @NHSBSA Why won't they talk to us? We have confirmed death certificates stating VITT covid-19 vaccine https://t.co/8JS5OAgj3p,en
2022-05-06 05:42:31+00:00,1419883847081107462,FDA restricts J&amp;J’s Covid-19 vaccine due to blood clot risk https://t.co/9LiwOHAiLq,en
2022-05-06 05:40:33+00:00,1478952771281829893,FDA restricts J&amp;J’s COVID-19 vaccine due to blood clot risk #news #today #FDA #restricts #JJs #COVID19 #vaccine #due #blood #clot #risk https://t.co/EJfnJxGQ1m,en
2022-05-06 05:40:25+00:00,349161578,Watchout... latest on J&amp;J COVID-19 vaccine. 👀🤔https://t.co/yxvOLmMgZZ,en
2022-05-06 05:39:40+00:00,803686502014316544,"The U.S. health regulator said on Thursday it was limiting the use of Johnson &amp; Johnson's (JNJ.N) COVID-19 vaccine for adults due to the risk of a rare blood clotting syndrome, the latest setback to the shot that has been eclipsed by rivals.",en
2022-05-06 05:39:28+00:00,1678161991,INFOGRAPHICS ON COVID-19 FAKE VACCINE#PNPKakampiMo#WeServeAndProtect#TeamPNP https://t.co/n6EE1drfSQ,en
2022-05-06 05:39:06+00:00,886269224481509376,https://t.co/SHUQiNU79iU.S. regulators on Thursday strictly limited who can receive Johnson &amp; Johnson’s COVID-19 vaccine due to a rare but serious risk of blood clots.  The Food and ...,en
2022-05-06 05:39:03+00:00,1237364454406447104,FDA limits J&amp;J COVID-19 vaccine due to rare blood clot riskhttps://t.co/M9mw0ZpvvL,en
2022-05-06 05:38:51+00:00,956303147680530434,Injured with COVID-19 Vaccines? You Have Very Few Options &amp; May be Out of Luck https://t.co/TI7YMcnERj,en
2022-05-06 05:38:04+00:00,44426926,FDA restricts J&amp;J’s COVID-19 vaccine due to blood clot risk https://t.co/bjEKCeGkOS,en
2022-05-06 05:38:03+00:00,834013638323224576,"The #COVID19 working group of the National Technical Advisory Group on Immunisation (#NTAGI), on Thursday, recommended that those traveling overseas can take precautionary doses of the COVID-19 vaccine before the prescribed period of nine months. https://t.co/n3fqRQlazK",en
2022-05-06 05:37:06+00:00,872362506630705153,FDA restricts J&amp;J’s COVID-19 vaccine due to blood clot risk https://t.co/rFwSv9bIxJ,en
2022-05-06 05:37:05+00:00,390167719,FDA restricts J&amp;J’s COVID-19 vaccine due to blood clot risk https://t.co/nirETYOiJN,en
2022-05-06 05:37:05+00:00,2189073337,FDA restricts J&amp;J’s COVID-19 vaccine due to blood clot risk https://t.co/il5oU3x7my,en
2022-05-06 05:36:30+00:00,2754030049,"Pat Jeomar Luyan conducted Infodemic drive/ lecture with the group of youngster at Barangay Mudeng, La Paz, Abra regarding the PNP CARE program and shared information on preventive measures against COVID-19, adherence on the IATF guidelines and  Fake COVID-19 Vaccine. https://t.co/XCJXFC8lQP",en
2022-05-06 05:36:22+00:00,18356802,BREAKING: FDA limits use of Janssen COVID-19 vaccine  https://t.co/GdEDOECoa1 via @MailOnline,en
2022-05-06 05:36:00+00:00,1404081805959983108,"By the way, the children reported to have severe hepatitis NEVER received Covid-19 vaccines. Hopefully this would deter the antivaxxers from making crazy allegation and misformation.",en
2022-05-06 05:35:55+00:00,956303147680530434,Pfizer’s mRNA-based COVID-19 Vaccine Durability Problems Continue with Fourth Dose—Large Israeli Population-wide Study https://t.co/C7fiJtZ3iT,en
2022-05-06 05:34:01+00:00,433946568,Dirty Low down dogfaced pony Soldier's..... we new it and they still sped [misinformation] to us all. BREAKING: FDA limits use of Janssen COVID-19 vaccine  https://t.co/4gbf8bsW55 via @MailOnline,en
2022-05-06 05:33:40+00:00,4901499033,There are alot of myths about Covid-19 and barriers making people be against vaccination.Myths-No need to wear a mask after vaccine-Vaccines from pneumonia will protect you from Covid-19 https://t.co/jZZ4De76Y1,en
2022-05-06 05:33:36+00:00,761067136567521280,FDA restricts Johnson &amp; Johnson COVID-19 vaccine due to blood clot riskhttps://t.co/0wmnomFLU2,en
2022-05-06 05:33:28+00:00,1508433265371222017,I came across this news on several facebook posts and tiktok videos. This is an example of Fake News. COVID-19 vaccines does not turn people into zombies and there’s no proof that the first COVID-19 vaccine patient acting out wildly #MILOnlineVerification #BeckerA #XUMIL2021 https://t.co/N6ZjJfql6o,en
2022-05-06 05:33:09+00:00,476251209,FDA restricts J&amp;J’s COVID-19 vaccine due to blood clot riskhttps://t.co/Zs5SrkcSbs,en
2022-05-06 05:32:48+00:00,1017979744640536577,#SafeAndEffective Increased emergency cardiovascular events among the under 40yr old population in Israel during vaccine rollout n third COVID-19 wavehttps://t.co/ejatnqRcZE #ClotShot #Myocarditis #VaccineSideEffects #vaccineinjuries #CovidVaccine #DepopulationAgenda #mRNA,en
2022-05-06 05:32:36+00:00,2783956591,Looks like the Chinese and Indian COVID-19 vaccines were not effective enough and that explains why the two Asian nations are pinned down by the new variant. Meanwhile 15 million people died due to COVID-19 causes world wide and not the official 5 million figures.,en
2022-05-06 05:32:24+00:00,351431656,MULTILINGUAL NEWS SERVICE MACEDONIAN 06 May 22.Audio resources in your language to keep your community informed and safe during COVID-19.#news #covid19 #media  #multilingualnewsservice #билтен #vaccine #macedonian   https://t.co/wGc47sRS0n,en
2022-05-06 05:31:52+00:00,243243630,"@captainwonkish @CarolinaSistah @chicfortruth @Jami_USA New Peer-Reviewed Study: COVID-19 Vaccines Increase Risk of Cardiac Arrest in Young People by 25 PercentBY JENNIFER MARGULIS AND JOE WANG TIMEMAY 4, 2022 PRINT",en
2022-05-06 05:31:16+00:00,1347792909312139266,💉SafeBREAKING: FDA limits use of Janssen COVID-19 vaccine  https://t.co/MpuKu7qyAg via @MailOnlineAnd effectivehttps://t.co/EuHM9ZMbqH,en
2022-05-06 05:30:50+00:00,1636764146,The use of community pharmacies in the COVID-19 vaccine rollout has proven to be hugely successful and popular with patients since being brought into the vaccination program rollout in July last year.To book your booster or flu shot visit: https://t.co/agatJJxqMC https://t.co/0R9XybL0F2,en
2022-05-06 05:30:09+00:00,9294762,US regulators have strictly limited who can receive Johnson &amp; Johnson's Covid-19 vaccine due to the ongoing risk of rare but serious blood clots. https://t.co/TB6oeIiGYh,en
2022-05-06 05:30:08+00:00,38469386,FDA restricts J&amp;J’s COVID-19 vaccine due to blood clot riskhttps://t.co/SCImobFb2a,en
2022-05-06 05:30:06+00:00,15014353,FDA restricts J&amp;J’s COVID-19 vaccine due to blood clot risk https://t.co/w6aYN6VLiu,en
2022-05-06 05:30:06+00:00,14849086,FDA restricts J&amp;J’s COVID-19 vaccine due to blood clot risk https://t.co/KrjmHn1BcX,en
2022-05-06 05:30:00+00:00,1731683821,"Interesting? The Office for National Statistics (ONS) do not, and I quote from the website: ""We do not hold information on COVID-19 vaccine injury. The Medicines and Healthcare products Regulatory Agency (MHRA) may be better placed to assist."" Alternatively ask Vikki Spit VIB UK",en
2022-05-06 05:29:49+00:00,701798284247994368,False report said that getting Covid-19 Vaccine would cause a woman's body to fight this different spike protein and affect her fertility.Fact: Covid-19 Vax will not affect fertility. It encourages the body to create copies of the spike protein found on the coronavirus' surface,en
2022-05-06 05:28:09+00:00,429555728,@KwameA009 None of the COVID-19 “vaccines are really vaccines. They’re all therapeutics.,en
2022-05-06 05:27:04+00:00,88246674,FDA restricts J&amp;J’s COVID-19 vaccine due to blood clot risk https://t.co/ZOUzzvG7aW,en
2022-05-06 05:26:04+00:00,38647512,#COVID19 | FDA restricts J&amp;J's Covid-19 vaccine due to blood clot riskhttps://t.co/dvOe7If4Vd,en
2022-05-06 05:26:02+00:00,1176808039648653312,US FDA limits use of Johnson &amp; Johnson Covid-19 vaccine over blood clot risk https://t.co/56bNVidi41,en
2022-05-06 05:25:34+00:00,289510670,"FDA limits use of Johnson &amp; Johnson's Covid-19 vaccine, citing clotting risk.  https://t.co/Fc4M70ngWF",en
2022-05-06 05:25:09+00:00,1477890812599889920,"congratulations, but i suggest you change that heading to: the INTENDED consequences of covid 19 vaccine policy as everything that has happened was intended to happen...",en
2022-05-06 05:25:01+00:00,1280062754116657152,Update on COVID-19 Vaccine Availability in States/UTsMore than 193.53 Crore vaccine doses provided to States/UTsMore than 18.81 Crore balance and unutilized vaccine doses still available with States/UTs@MoHFW_INDIA https://t.co/z0iWOiupt0,en
2022-05-06 05:23:54+00:00,1299874254931058691,Truth will out.BREAKING: FDA limits use of Janssen COVID-19 vaccine  https://t.co/XG26krHFRc @MailOnline,en
2022-05-06 05:23:38+00:00,1392718877168185346,"@rblommestijn Moderna ook:A new study based on Moderna’s Phase 3 clinical trial data suggests recipients of Moderna’s COVID-19 vaccine may be more likely to suffer repeated infections, perhaps indefinitely.https://t.co/bd6aGRCfuw",en
2022-05-06 05:23:05+00:00,18951956,FDA restricts J&amp;J’s COVID-19 vaccine due to blood clot risk https://t.co/IHFi2ixlhs,en
2022-05-06 05:23:03+00:00,1425325336548372480,FDA restricts J&amp;J's COVID-19 vaccine due to blood clot risk https://t.co/L3DGZCG6wy,en
2022-05-06 05:22:36+00:00,44698675,FDA restricts J&amp;J’s Covid-19 vaccine due to blood clot risk https://t.co/mJ3GIaKaOZ,en
2022-05-06 05:22:17+00:00,447054242,@BB8TEE @andrew7rd @drkalai61 @Khairykj @KKMPutrajaya @AdiratnaMR @ICR_NIH Wrong only 33 people have died in the uk of the vaccines and there's been 1210 compensation claims made for.vaccine injury/death and ADE is impossible with covid 19 and the covid vaccines as @SwaledaleMutton has proved many many time do keep to tbe one thread,en
2022-05-06 05:20:26+00:00,87775422,Trials of Omicron #vaccine underway #COVID_19 https://t.co/GnhcQsmmmp,en
2022-05-06 05:18:42+00:00,2641853189,FDA restricts Johnson &amp; Johnson's COVID-19 vaccine due to blood clot riskhttps://t.co/c2eeDcv1mf,en
2022-05-06 05:16:41+00:00,1457389981614452741,CDC chief promotes how to boost COVID-19 vaccine on visit to L.A. https://t.co/6lxN2KjVPz,en
2022-05-06 05:16:23+00:00,1489958961365536770,U.S. sends COVID-19 vaccines worldwide [rolling updates] https://t.co/bFvybqfhR7 via @ShareAmerica,en
2022-05-06 05:16:20+00:00,1313992278952882176,"Post-authorization surveillance of adverse events following COVID-19 vaccines in pregnant persons in the vaccine adverse event reporting system (VAERS), December 2020 - October 2021 #NeoPapers #neoTwitter https://t.co/DLEwysM3VU",en
2022-05-06 05:16:13+00:00,86025444,FDA limits use of Johnson and Johnson's Janssen COVID-19 vaccine  | Daily Mail Online https://t.co/H1ieo6TZYf,en
