date,userid,tweet,lang
2022-06-29 19:41:38+00:00,21410824,@Mollie_Whuppie @Mrssammoore @seanjward From the NHS website direct Research has shown the vaccines help:•reduce your risk of getting seriously ill or dying from COVID-19•reduce your risk of catching or spreading COVID-19•protect against COVID-19 variants,en
2022-06-29 19:41:23+00:00,275714002,Study Shows Safety of Hong Kong’s BNT162b2 and CoronaVac COVID-19 Vaccines for Patients With Cardiovascular Disease | @ESC_Journals @escardiohttps://t.co/aEKuOHnlsm,en
2022-06-29 19:41:12+00:00,30532810,Elmo of 'Sesame Street' gets COVID-19 vaccine shot in PSAWay to go ⁦@elmo⁩ ❤️ 💉💪 https://t.co/GudIgdMsrO,en
2022-06-29 19:41:05+00:00,159822837,The COVID-19 vaccine is now here for everyone 6 months and older.Get your entire family up to date on the COVID vaccine. We have resources and events posted on https://t.co/Q16TCQ2Qd2. https://t.co/YM0EOEFUc1,en
2022-06-29 19:40:04+00:00,777556022705741824,"5 FDA decisions to watch in the third quarterThe regulator will soon decide on updated COVID-19 vaccines, two gene therapies and closely watched drugs for psoriasis, cancer and ALS.https://t.co/ZuGcpA7xdw",en
2022-06-29 19:39:48+00:00,557670851,RELEASE: @OCHBuffalo &amp; @ECDOH to hold joint COVID-19 vaccine clinic for children age 6 months - 4 years on July 9. Appointments strongly recommended. https://t.co/PxaiiCKrs3,en
2022-06-29 19:39:21+00:00,35017949,"On June 18th, the @cdcgov approved COVID-19 vaccines for children as young as 6 months old. Yesterday, Good Sam added these vaccines to our ongoing Tuesday vaccine clinic. To schedule a COVID vaccine/booster for you or someone you know, age 6 months &amp; up, call 404.523.6571 today! https://t.co/auS35qjmwK",en
2022-06-29 19:39:13+00:00,946228255,Supper pumped that my girls got their #COVID 19 vaccine today! Thanks @radychildrens for making it super fun and easy for my kiddos! #putkids1st 🎉🥳🎉 #VaccinesWork https://t.co/5uMTFgVDus,en
2022-06-29 19:38:25+00:00,515724025,The US Food and Drug Administration's independent Vaccines and Related Biological Products Advisory Committee voted Tuesday to support recommending inclusion of an Omicron-specific component for a Covid-19 booster vaccine.https://t.co/FWOq1kFsR8#NYSAFP,en
2022-06-29 19:37:50+00:00,2888751042,"""Warning! Why We Should Not Take The Covid - 19 Vaccines!"" https://t.co/6NIes3rfQW via @YouTube",en
2022-06-29 19:37:02+00:00,135522601,India has a new mRNA vaccine against COVID-19.https://t.co/AtxpRSHMdT https://t.co/qxIYxaFokr,en
2022-06-29 19:36:37+00:00,817652,FDA: Don't rush a move to change the Covid-19 vaccine composition (STAT)https://t.co/8nWfgxQOj6https://t.co/dJC9bp3bOi,en
2022-06-29 19:36:25+00:00,338264164,"@sesamestreet It's okay to have questions about your child suffering from myocarditis after having given them a COVID-19 vaccine! Elmo's dad, Louie, talked to a pharma pediatrician and learned nothing from the last two years worth of data about COVID-19 itself or the dangers of the 'vaccine'.",en
2022-06-29 19:34:32+00:00,144531738,@JasonFindlay5 @EcoFashionByBG @LouWall48323834 @abolishwokeness It's insanely safe to stick with the crowd when it comes to the covid-19 vaccine. Safer than not being vaccinated,en
2022-06-29 19:34:05+00:00,778630867950460929,Could Would Should Covid-19: Professor Luke O'Neill says it is 'likely' new Omicron vaccine could be given with flu jab https://t.co/IoQB08Yh9P #assumptions #could #should,en
2022-06-29 19:33:40+00:00,2998956606,"🎇🧨🎇🧨While Covid-19 Vaccines are new, they science behind them is decades old. Extensive clinical studies have also confirmed their safety. Visit https://t.co/WCwMsMILuC or call 833-422-4255 to find a vaccine near you. 🧋🧋🥤 https://t.co/BK5Llvzw87",en
2022-06-29 19:33:37+00:00,21669972,ChristianaCare is currently offering the Pfizer COVID-19 vaccine for children 6 months through 4 years old at several Delaware practices in New Castle and Kent counties. Learn more and see a full list of participating locations here: https://t.co/8GwQPRAFdn #netDE,en
2022-06-29 19:33:11+00:00,23063097,"Moderna’s mRNA vaccines against Covid-19 have been a game changer, but did you know about their innovative litter box scooping technology? 🐈 https://t.co/lCq5kQpgC4",en
2022-06-29 19:31:56+00:00,1872630422,"COVID-19 Vaccine for Babies, Preschoolers https://t.co/i5noG920DE",en
2022-06-29 19:31:47+00:00,1502684082228146184,@aufmkeller @Florian_Hanover @BR24 @prof_freedom Wie hoch kann der schon sein?Peter Doshi: Pfizer and Moderna’s “95% effective” vaccines—we need more details and the raw datahttps://t.co/wdkMPsuRL7COVID-19 vaccine efficacy and effectiveness—the elephant (not) in the roomhttps://t.co/i4SgKEQJee,en
2022-06-29 19:31:35+00:00,998285023567544321,@3bagsful @nettykingsly @Jake_A_Reed @mildanalyst No they weren’t. At least not in the U.K.  Covid-19 Vaccines were produced to prevent severe disease - they weren’t advertised as stopping transmission. It could take years for a vaccine that stops transmission all together from all variants. It may never be achievable.,en
2022-06-29 19:31:05+00:00,15845694,"Studies on the COVID-19 pandemic have shown that millions of lives were saved by vaccines, and masking likely saved millions more. https://t.co/vWEWOHEk1D",en
2022-06-29 19:30:52+00:00,3740204842,Get vaccinated and boosted. Make sure you're up to date with all recommended covid-19 vaccine doses. Everyone ages 50 and older can get a second booster shot with Pfizer or Moderna at least 4 months after their first booster shot.⁠#BoostNewBrunswick https://t.co/INWlet4Fw4,en
2022-06-29 19:30:45+00:00,1194067522753986560,"@keller_via @Espress0Liber @thehill Sure it is a known phenomenon, but not with Covid-19.""Social media posts claim that vaccines will 'facilitate' greater infection, rather than stop the illness, due to 'pathogenic priming.' This is false.""",en
2022-06-29 19:30:12+00:00,236770150,South Korea approves use of first homegrown COVID-19 vaccine https://t.co/kEczU37r0A #Health https://t.co/eQQT8822Zi #news 602,en
2022-06-29 19:30:03+00:00,2998956606,"While Covid-19 Vaccines are new, they science behind them is decades old. Extensive clinical studies have also confirmed their safety. Visit https://t.co/WCwMsMILuC or call 833-422-4255 to find a vaccine near you. 🩴🩴 🧋🧋🥤 https://t.co/nV2MN7pC6F",en
2022-06-29 19:30:00+00:00,61562609,COVID-19 vaccines are now available across Maine for everyone 6 months and older.Learn more and find a vaccination site near you at https://t.co/7RzNScJKr9 https://t.co/wn5Qcwow0P,en
2022-06-29 19:29:09+00:00,488950348,"In a briefing to congress Tuesday FL Surgeon General Joseph Ladapo confirmed the decision to block county health departments from obtaining the COVID-19 vaccines for young children may prevent an estimated 30,000 disadvantaged kids from accessing vaccines. https://t.co/BU2ljoMko0",en
2022-06-29 19:26:02+00:00,7383122,A student at the Mahendra Secondary School in #Nepal receives a COVID-19 #vaccine as part of a countrywide campaign targeting 5- to 11-year-olds. 2.2 million pediatric vaccines were donated to Nepal through the #COVAX initiative from UNICEF and partners. https://t.co/dGUrPGKcAi https://t.co/9TA4yYNW04,en
2022-06-29 19:25:51+00:00,90138643,Challenges of Deciding Whether and How to Update COVID-19 Vaccines to Protect Against Variants | Vaccination | JAMA | JAMA Network https://t.co/v0a3UqL6Sj,en
2022-06-29 19:25:02+00:00,92088511,The side effects experienced among kids are nearly identical to those of adults.The CDC continues to highly recommend #COVID19 vaccines because the risk of severe illness and complications associated with COVID-19 far outweigh any risk from vaccination.https://t.co/YUMtEAW54G https://t.co/NdXN6EAwUL,en
2022-06-29 19:24:42+00:00,840113200783736834,Yes. #Children 6 months and older should get vaccinated against #COVID19 even if they’ve already had COVID-19. Getting vaccinated after having COVID-19 provides added protection to their immune system.Learn more about COVID-19 #vaccines for children: https://t.co/H4u0gyddRJ.,en
2022-06-29 19:24:36+00:00,777240569667985408,@marcorubio Don’t you represent Florida? Are you trying to distract from Florida’s terrible policy on the Covid-19 vaccine for children? Or some other grotesque stupidity in your state?,en
2022-06-29 19:24:13+00:00,1040146057093627904,"The PM particularly thanked China for renewal of the RMB 15 billion (US $ 2.3 billion) syndicate facility. He also thanked China for its support and assistance to Pakistan's efforts towards preventing the spread of COVID-19 by providing vaccine, protective and med equipment.",en
2022-06-29 19:23:37+00:00,180962804,"@HealthyFla @Meta In a briefing to a congressional subcommittee, @FLSurgeonGen confirmed state decision to block county health depts from obtaining  FDA-approved COVID-19 vaccines for young children may prevent an estimated 30k disadvantaged kids from accessing vaccines. https://t.co/uLUt1ATvhP",en
2022-06-29 19:20:04+00:00,2826499106,Acute Pancreatitis: A Possible Side Effect of COVID-19 Vaccine https://t.co/wdnFcxzxUC,en
2022-06-29 19:18:16+00:00,435793512,Happening Now: The  Town Hall Panel Discussion  on COVID-19  Vaccination  to answer  all your questions  on vaccines  and the   response.   Featuring @MinofHealthUG  PS  @DianaAtwine @SabrinaKitaka Prof Wanyenze @MakerereCHS  of Prof Kaleebu of  @uvri and Dr Kisakye @WHOUganda https://t.co/FMme70h0Hj,en
2022-06-29 19:17:53+00:00,1110578711114510336,@AllentownCityPA The bureau of health is now offering COVID-19 vaccines for children in six months to five years. @69News https://t.co/MgQAhnIOfC,en
2022-06-29 19:17:10+00:00,528935588,"@JasonFindlay5 It would appear so.""The study showed that immune function among vaccinated individuals 8 months after the administration of two doses of COVID-19 vaccine was lower than that among the unvaccinated individuals.""https://t.co/Kn1TCJEALv",en
2022-06-29 19:16:55+00:00,202821978,"Why We Can’t Succumb to Pandemic Fatigue: Mask mandates have dropped and vaccines are widely available, but COVID-19 remains a dangerous virus. New from @AAMCtoday.https://t.co/aV3mmSY68B",en
2022-06-29 19:16:20+00:00,1515667509659287557,"The “Future Framework,” a FDA regulatory scheme that would allow Pfizer &amp; Moderna to “reformulate” COVID-19 mRNA vaccines in perpetuity, without conducting clinical trials on the new vaccines, June 28 https://t.co/T51AeOoAzz",en
2022-06-29 19:15:58+00:00,431658229,@aproko_doctor I tell my kid sis say I just collect covid 19 vaccine so my finger print no dey work well bank app no open till further notice.,en
2022-06-29 19:15:38+00:00,3131141925,"A real success story! Death, devastating side effects, infertility &amp; no protection against covid! New Study Confirms That Experimental Covid-19 Vaccines Impact Male Fertility https://t.co/YoC3rXA9J8 via @WCH_Org",en
2022-06-29 19:15:00+00:00,2472781538,"Under the patent model, profit-seeking companies had market exclusivity on COVID-19 vaccines, and they were headquartered mostly in the U.S. and Europe. Unsurprisingly, this model did not result in dramatic vaccination of the world. https://t.co/l8thnY027g",en
2022-06-29 19:11:41+00:00,90898038,COVID-19 is surging now in parts of Kenya. Our new mobile vaccine clinics are hitting the road to ramp up access to vaccines in underserved communities. #HealthForAll,en
2022-06-29 19:11:11+00:00,1193172678040883200,"@santweets simple answer: yes. in the article I question the validity of  this statement:  '“Thinking” machines powered by AI have contributed incalculable benefits to humankind, including help with developing the COVID-19 vaccine at record speed.""I believe HPC is to thanked.",en
2022-06-29 19:08:57+00:00,1450928873382760451,EU chief can't find texts with Pfizer chief on COVID-19 vaccine deal https://t.co/8d7BU4CExE,en
2022-06-29 19:08:51+00:00,797942807222697988,"@CastorT26371809 @FvckYourFear @AngryFleas @joshisu5 @dakroot @ShockTraumaRN @krebiozen @richykirsh @djchicus @kath2cats @WalterTAllen @chimera414 @FukCorbyn @SkepticalMutant @isabelltemple @JimeeLiberty @provaxtexan @TMzedg @raouldukeerik @KStateTurk @WendyOrent @doom37455413 @JonesBonus @mpc_xetts @lazlowoodbine42 @mcfunny @TonyBaduy @dann58638436 @malo_j @kevinault @volpiranyas @BhChillin76 @Tryingmypatient @JonathanHannah @Jaytee116James @Frosty69B @JamesLynchGTC @paramaniac9 @nuhope2022 @AlBowers1 @Willard1951 @PremierImproves @iiiiii_x_iiiiii @AspAlaAsnAsnTyr @andylumm @Alex_on_A14 @isthisnetaken @itisjustmebabe @Diar380 @realshocks By definition, Pfizer-BioNTech Covid-19 Vaccine is the unlicensed name and Comirnaty is the licensed name.",en
2022-06-29 19:08:34+00:00,1391255995356119042,"Electron microscope images appear to show carbon nanotech, aluminum, thulium in Pfizer and Moderna’s covid-19 vaccines - Rather Expose Them Christian News Blog https://t.co/eJk9ptLu79",en
2022-06-29 19:08:31+00:00,740991042955005953,Didn't think I would post this but I tested positive for Covid-19. It honestly stinks but without the vaccine and boosters this would feel worse than it does. Gonna stay positive during the recovery process.,en
2022-06-29 19:08:22+00:00,2312363112,COVID-19 vaccine efficacy summary https://t.co/jP3diKXOrU via @IHME_UW,en
2022-06-29 19:06:51+00:00,305665582,The @CDCgov has now approved the Moderna &amp; Pfizer COVID-19 vaccines for ages 6 months &amp; up. Check with your local healthcare provider to see if they’re offering the vaccine to this age group. Visit @SCDHEC’s website to find a vaccination location near you! https://t.co/tn2QhgfipJ https://t.co/SP57Z6rYnp,en
2022-06-29 19:06:30+00:00,1014887441210200065,Elmo gets his COVID-19 vaccine | https://t.co/htLJr4gN2X https://t.co/KzPEFLYxBJ,en
2022-06-29 19:05:57+00:00,1486280426532474883,"A new study is looking for thousands of Pacific Northwest participants to help uncover answers about how COVID-19 vaccines work in kids and adults over the next few years, two Seattle health care systems announced Thursday morning.New COVID vaccine study looking for Pacific N... https://t.co/8MX5rfB9WU",en
2022-06-29 19:05:31+00:00,3318510966,Statement from U.S. Secretary of Education Miguel Cardona on New COVID-19 Vaccine Eligibility for Children Ages 5 an https://t.co/BtqJyCCuS7,en
2022-06-29 19:04:51+00:00,125414190,"Join us tomorrow for free food, music and activities at the It Takes A Village Community Resource Fair, from noon - 5 p.m. at Penn Park. A mobile COVID-19 vaccine clinic for ages 12+ will also be available!#ItTakesAVillage #mplfoundation #MadisonPublicLibrary #madisonwi https://t.co/bCHDvJqV9K",en
2022-06-29 19:04:23+00:00,36069538,"We invite you to learn more about COVID-19 by watching the “Ask the Doctors” series on Thursday nights presented by our partners @LHAORG. Topics include vaccines, boosters, children and more. https://t.co/dkjOe7Emxt",en
2022-06-29 19:04:09+00:00,997183969035726849,Coming off methotrexate doubles antibody levels after covid-19 vaccine https://t.co/b9H4Bon2Sz,en
2022-06-29 19:03:18+00:00,1522817803228753920,Terry Wilcox from @hudgellsol will be talking to @MarkSteynOnline on @gbnews at 8pm about the terms of reference and how he will be representing all vaccine injured and bereaved at the UK Covid-19 public inquiry https://t.co/OGeZusSIVT,en
2022-06-29 19:03:03+00:00,2764882936,"@Pampie59 As we engage in vaccine talk, let’s also pay tribute to Jackson Mthembu and others who were taken away from us by Covid 19.",en
2022-06-29 19:02:07+00:00,48047418,"Novavax is part of the FDA's COVID-19 booster debate, but its vaccine still hasn't been authorized in the U.S. https://t.co/GjxYK3krnW",en
2022-06-29 19:02:02+00:00,2328827605,COVID-19 Vaccine Does Not Increase CV Event Risk in Those With Existing Disease https://t.co/5IsBeTCMOe https://t.co/QZcg0180ln,en
2022-06-29 19:01:47+00:00,259698028,Chinese-made vaccines prove ineffective as COVID-19 cases rise https://t.co/GiqUGzq3oA,en
2022-06-29 19:01:44+00:00,1401233712021393410,Gov. Lee Orders COVID-19 Vaccine Mandate for Tennessee State Guard Despite Force’s Non-Federal Funding and Rolehttps://t.co/JJXR3Icwtx,en
2022-06-29 19:01:23+00:00,1071502309,"❌I'll get COVID-19 from vaccine? COVID-19 vaccine alters DNA? had COVID19, so don't need the vaccine? The 6 common myths about COVID-19 vaccine. Have you heard any of them? #COVIDVaccine #COVID19Myths Please visit https://t.co/j94Lr8C0zA for more  explanations on the myths https://t.co/F9jIiUdIHp",en
2022-06-29 19:01:20+00:00,288395610,There will be two pop-up COVID-19 vaccine clinics in July. See the poster for details. #WasagaBeach https://t.co/Tqrs3F1iMy https://t.co/g4gzGp4EIq,en
2022-06-29 19:01:07+00:00,855609411494137857,So excited to see this paper available online today. Our team used #VR simulations to support clinicians’ HPV vaccine communication and demonstrated an 18% increase in initiation rates!!! We’re using this approach to target COVID-19 next! #MedEd https://t.co/SNASThxEIF,en
2022-06-29 19:01:00+00:00,705503549359300608,COVID-19 Vaccines are now available at the City Clinic for children ages 5-18 free of charge. We currently have Pfizer &amp; J&amp;J available for primary &amp; booster doses. Please call at (201) 547-5535 to schedule an appointment. Walk-ins will not be accepted #HealthierJC @JerseyCity https://t.co/g3fgrhZ71r,en
2022-06-29 19:00:50+00:00,764203848,@ArtValley818_ Death: The only way the Covid-19 vaccine stops transmission.,en
2022-06-29 19:00:37+00:00,1270557418896986115,DeSantis says Florida is ‘affirmatively against’ Covid-19 vaccines for young kids.https://t.co/ovejL3xdNr#HoodMedicine#ItsNotOver#CovidStillPoppin#PublicHealthGuerrillas 🦍,en
2022-06-29 19:00:19+00:00,2267735730,PITTSBURGH — Most research on immunity to the SARS-CoV-2 virus and COVID-19 vaccine development has focused on antibody responses to the spike protein and other viral surface pr https://t.co/yF7AOEGsv4,en
2022-06-29 19:00:11+00:00,1405568597460664325,The CDC has recently approved the COVID-19 vaccine for children as young as 6 months old. A new update also is that children 5 and older are now able to get booster shots. We must continue to get vaccines/boosters to keep ourselves and others safe. #vaccineswork https://t.co/XL4XQgIU4A,en
2022-06-29 19:00:09+00:00,2267735730,"How can we increase the efficacy of vaccines used to protect against viral respiratory diseases such as influenza and COVID-19?  Scientists from Inserm, CNRS and Aix-Marseille Uni https://t.co/v9urZ2H4aL",en
2022-06-29 19:00:02+00:00,236770150,South Korea approves use of first homegrown COVID-19 vaccine https://t.co/kEczU37r0A #Health https://t.co/eQQT8822Zi #news 999,en
2022-06-29 19:00:00+00:00,1137147160388968448,"From the initial COVID-19 vaccine rollout over a year ago to the latest expansion of vaccine eligibility for those under 5, Health plans continue to work around the clock to improve vaccine access and acceptance. Learn more here &gt;&gt; https://t.co/T2yqwQZCnD https://t.co/ihpDmdJ8yh",en
2022-06-29 18:59:05+00:00,4247374520,Probably not wearing the “CONQUER COVID-19” t-shirt today. A vaccine love story in 4 parts. https://t.co/iI1MTyNkkQ,en
2022-06-29 18:59:03+00:00,1428445406241951755,@AndrewLazarus4 @FvckYourFear @AngryFleas @joshisu5 @dakroot @ShockTraumaRN @krebiozen @richykirsh @djchicus @kath2cats @WalterTAllen @chimera414 @FukCorbyn @SkepticalMutant @isabelltemple @JimeeLiberty @provaxtexan @TMzedg @raouldukeerik @KStateTurk @WendyOrent @doom37455413 @JonesBonus @mpc_xetts @lazlowoodbine42 @mcfunny @TonyBaduy @dann58638436 @malo_j @kevinault @volpiranyas @BhChillin76 @Tryingmypatient @JonathanHannah @Jaytee116James @Frosty69B @JamesLynchGTC @paramaniac9 @nuhope2022 @AlBowers1 @Willard1951 @PremierImproves @iiiiii_x_iiiiii @AspAlaAsnAsnTyr @andylumm @Alex_on_A14 @isthisnetaken @itisjustmebabe @Diar380 @realshocks Nope. There doesn’t appear to being any lying in this dear HCP letter. They aren’t claiming “Pfizer-BioNTech Covid-19 Vaccine” is licensed.,en
2022-06-29 18:58:46+00:00,4905433269,"@GirardotMarc @stephanieseneff @Vaccine_Truth3 @JesslovesMJK ""In a 2021 statement on the COVID-19 vaccines, two organizations focused on male reproduction also noted that fevers in general — including from COVID-19 infection or vaccination — can temporarily affect sperm production."" https://t.co/h6o1fQXtt2it is not conjeture",en
2022-06-29 18:58:35+00:00,368996879,COVID-19 vaccines are now available for babies and young children through @UIHealth.,en
2022-06-29 18:58:14+00:00,131673812,@chicagosmayor Wow. Covid 19 vaccine? Is that even still a thing?,en
2022-06-29 18:57:08+00:00,2491664966,"@Dean_Winnipeg Exactly which freedoms are they demanding?The protestors are armed with misinformation About COVID-19 vaccines, pandemic conspiracy theories, and a deep conviction that the federal government has trampled fundamental individual liberties  https://t.co/XhTwa9sZCA",en
2022-06-29 18:54:26+00:00,15312292,The Wisconsin Department of Health Services reports that 64.6% of the state has now received at least one dose of the COVID-19 vaccine.https://t.co/ugP6YRnBwE,en
2022-06-29 18:54:03+00:00,312149882,Biden Officials Ask Teachers to Help Promote Kids' COVID-19 vaccines https://t.co/fm04DcaSvJ via @newsmax,en
2022-06-29 18:53:18+00:00,18758897,South Korea Approves First Domestically Developed COVID-19 Vaccine | Time https://t.co/BHvmyUAQOX,en
2022-06-29 18:53:07+00:00,3837387507,@DebTood Should get the shingles vaccine. This might come back if you get infected with covid-19 again.,en
2022-06-29 18:52:53+00:00,1516515617410789376,"Novavax is part of the FDA’s COVID-19 booster debate, but its vaccine still hasn’t been authorized https://t.co/Tpb2Ya0yGz",en
2022-06-29 18:52:44+00:00,963495628545327104,"$NVAX NEW ARTICLE : Novavax is part of the FDA's COVID-19 booster debate, but its vaccine still hasn't been authorized https://t.co/iYBQbyb0te Get all the latest $NVAX related news here : https://t.co/Scl2feFQyC https://t.co/ZyO2VAIufF",en
2022-06-29 18:52:18+00:00,69359090,"Hear from Dr. Colette Charles with Center of Praise Ministries on how COVID-19 vaccines and boosters keep our community healthy. For more info on the Sacramento Get Vaccinated campaign, visit https://t.co/9M0JfKFHXg. https://t.co/dnmOGZR000",en
2022-06-29 18:50:06+00:00,1489673350255415309,"#PueblosVivos 'COVID-19 Booster Doses FAQ'S' ¡It's Never Too Late to get your COVID-19 Booster! Currently, vaccine boosters are recommended for all New York residents ages 5 and older. https://t.co/uqFZXE8JFl",en
2022-06-29 18:49:46+00:00,65388644,State and local paid sick time laws can help workers take time off to get the COVID-19 vaccine for themselves or a loved one. #PaidLeave continues to play a critical role in protecting public health. #WeEarnedIt https://t.co/FiY08MGdKh,en
2022-06-29 18:49:25+00:00,1200616796295847936,"Pfizer, $PFE, and Moderna, $MRNA, said they will be ready with COVID-19 vaccines designed to combat the BA.1 Omicron variant that was dominant last winter earlier than those designed to target currently dominant subvariants.",en
2022-06-29 18:48:36+00:00,42769016,"COVID-19 vaccine for kids gets off to slow start in Arizona ... response among parents has been tepid. “Demand is down, we aren’t seeing long lines or phones off the hook for this vaccination round.” https://t.co/ilMRq0TIzo via @tucsonstar",en
2022-06-29 18:48:18+00:00,821101854444503040,"I just posted ""Israeli study shows COVID-19 vaccines cause sperm counts to drop – https://t.co/hEHrgoXO5g"" on Reddithttps://t.co/bfNd4HQzCd",en
2022-06-29 18:48:05+00:00,1409975477293494277,World Council for Health expert declares Covid-19 vaccines ’dangerous and ineffective’ https://t.co/PKJ1FgcChH,en
2022-06-29 18:47:36+00:00,18850438,"BioNTech, Pfizer to start testing universal COVID-19 vaccine https://t.co/aLu6mFA5GN",en
2022-06-29 18:47:32+00:00,341010792,"@VictoriaN98026 @Riptokus @JoeW50047705 @yasu_almasih @Ct_Walsh88 @RubinReport Sorry sticky.""FDA Approves First COVID-19 Vaccine | FDA"" https://t.co/BKybsNiBZQ",en
2022-06-29 18:46:35+00:00,1250536454264160256,@globeandmail @wencyleung 1000 Peer Reviewed Studies Questioning Covid-19 Vaccine Safetyhttps://t.co/F06Nm1OdwE,en
2022-06-29 18:46:10+00:00,153455854,"Associate Dean, College of Pharmacy, and Chief Pharmacy Officer, UI Hospitals and Clinics, Michael Brownlee, answers questions about COVID-19 vaccines for children.  https://t.co/ENvB5rZL3R",en
2022-06-29 18:45:48+00:00,1255429277912379392,"The unintended consequences of COVID-19 vaccine policy: why mandates, passports and restrictions may cause more harm than good | BMJ Global Health https://t.co/hGzEpw0D09",en
2022-06-29 18:45:36+00:00,1493372923201081352,"Well said:""In Canada, the singular reliance on vaccines to control COVID-19 'obviously hasn’t worked,' Dr. Ladha said. 'It’s important to realize we need layers of protection – and masks are an essential layer.'""https://t.co/JLqU4CIWGu",en
2022-06-29 18:45:34+00:00,1248244692996763652,Health Department offering COVID-19 vaccines for youngest Detroiters https://t.co/aEiPk6OHD8,en
2022-06-29 18:45:05+00:00,1446340766385598469,Former news anchor dead one day after receiving COVID-19 vaccine https://t.co/c3MFQEt29y,en
2022-06-29 18:43:28+00:00,706474578,"At webinar today, @US_FDA's Peter Marks said of vials with fewer COVID-19 vaccine doses ""can't promise you that you'll see single dose presentations at your pharmacy this winter season, but my guess is we will migrate in that direction over the coming year or two"" https://t.co/8QfszfUrSe",en
2022-06-29 18:43:02+00:00,3249292251,@AOC @Plancpills @EFF @AbortionFunds Bodily autonomy didn't matter with the covid-19 vaccine so why should it matter now to y'all?,en
